16651.8s 2770 [I 2025-12-07 13:31:27,234] Trial 113 finished with value: 0.24152902550403246 and parameters: {'similarity': 'tversky', 'topK': 7, 'shrink': 419, 'tversky_alpha': 0.45811063216793224, 'tversky_beta': 1.6029621911858103}. Best is trial 91 with value: 0.24993110179607925.
16651.9s 2771 [0.24075131381826348, 0.24235090534646184, 0.24278062938224326, 0.23936303448014334, 0.24239924449305017]
16652.2s 2772 Unable to load Cython Compute_Similarity, reverting to Python
16661.2s 2773 Similarity column 6969 (100.0%), 763.36 column/sec. Elapsed time 9.13 sec
16661.4s 2774 EvaluatorHoldout: Ignoring 33 ( 0.1%) Users that have less than 1 test interactions
16676.0s 2775 EvaluatorHoldout: Processed 27062 (100.0%) in 14.83 sec. Users per second: 1825
16676.5s 2776 Unable to load Cython Compute_Similarity, reverting to Python
16685.6s 2777 Similarity column 6969 (100.0%), 757.35 column/sec. Elapsed time 9.20 sec
16685.7s 2778 EvaluatorHoldout: Ignoring 28 ( 0.1%) Users that have less than 1 test interactions
16700.4s 2779 EvaluatorHoldout: Processed 27067 (100.0%) in 14.88 sec. Users per second: 1819
16700.9s 2780 Unable to load Cython Compute_Similarity, reverting to Python
16709.9s 2781 Similarity column 6969 (100.0%), 754.75 column/sec. Elapsed time 9.23 sec
16710.1s 2782 EvaluatorHoldout: Ignoring 40 ( 0.1%) Users that have less than 1 test interactions
16725.0s 2783 EvaluatorHoldout: Processed 27055 (100.0%) in 14.88 sec. Users per second: 1818
16725.3s 2784 Unable to load Cython Compute_Similarity, reverting to Python
16735.0s 2785 Similarity column 6969 (100.0%), 704.92 column/sec. Elapsed time 9.89 sec
16735.2s 2786 EvaluatorHoldout: Ignoring 21 ( 0.1%) Users that have less than 1 test interactions
16750.0s 2787 EvaluatorHoldout: Processed 27074 (100.0%) in 14.92 sec. Users per second: 1815
16750.5s 2788 Unable to load Cython Compute_Similarity, reverting to Python
16760.2s 2789 Similarity column 6969 (100.0%), 712.17 column/sec. Elapsed time 9.79 sec
16760.3s 2790 EvaluatorHoldout: Ignoring 29 ( 0.1%) Users that have less than 1 test interactions
16775.0s 2791 EvaluatorHoldout: Processed 27066 (100.0%) in 14.88 sec. Users per second: 1819
16775.0s 2792 [I 2025-12-07 13:33:30,498] Trial 114 finished with value: 0.228515976085176 and parameters: {'similarity': 'tversky', 'topK': 39, 'shrink': 235, 'tversky_alpha': 0.3174228739989401, 'tversky_beta': 1.9494999967424895}. Best is trial 91 with value: 0.24993110179607925.
16775.0s 2793 
16775.0s 2794 [I 2025-12-07 13:33:30,498] Trial 114 finished with value: 0.228515976085176 and parameters: {'similarity': 'tversky', 'topK': 39, 'shrink': 235, 'tversky_alpha': 0.3174228739989401, 'tversky_beta': 1.9494999967424895}. Best is trial 91 with value: 0.24993110179607925.
16775.2s 2795 [0.2274036941501276, 0.22897993652644683, 0.22942926240996503, 0.22719077287847658, 0.22957621446086388]
16775.5s 2796 Unable to load Cython Compute_Similarity, reverting to Python
16784.6s 2797 Similarity column 6969 (100.0%), 749.04 column/sec. Elapsed time 9.30 sec
16784.8s 2798 EvaluatorHoldout: Ignoring 33 ( 0.1%) Users that have less than 1 test interactions
16803.3s 2799 EvaluatorHoldout: Processed 27062 (100.0%) in 18.57 sec. Users per second: 1458
16803.7s 2800 Unable to load Cython Compute_Similarity, reverting to Python
16812.9s 2801 Similarity column 6969 (100.0%), 742.92 column/sec. Elapsed time 9.38 sec
16813.1s 2802 EvaluatorHoldout: Ignoring 28 ( 0.1%) Users that have less than 1 test interactions
16831.8s 2803 EvaluatorHoldout: Processed 27067 (100.0%) in 18.88 sec. Users per second: 1434
16832.3s 2804 Unable to load Cython Compute_Similarity, reverting to Python
16841.4s 2805 Similarity column 6969 (100.0%), 754.83 column/sec. Elapsed time 9.23 sec
16841.5s 2806 EvaluatorHoldout: Ignoring 40 ( 0.1%) Users that have less than 1 test interactions
16860.1s 2807 EvaluatorHoldout: Processed 27055 (100.0%) in 18.77 sec. Users per second: 1441
16860.6s 2808 Unable to load Cython Compute_Similarity, reverting to Python
16869.8s 2809 Similarity column 6969 (100.0%), 742.20 column/sec. Elapsed time 9.39 sec
16870.0s 2810 EvaluatorHoldout: Ignoring 21 ( 0.1%) Users that have less than 1 test interactions
16888.6s 2811 EvaluatorHoldout: Processed 27074 (100.0%) in 18.69 sec. Users per second: 1449
16889.0s 2812 Unable to load Cython Compute_Similarity, reverting to Python
16898.0s 2813 Similarity column 6969 (100.0%), 760.66 column/sec. Elapsed time 9.16 sec
16898.2s 2814 EvaluatorHoldout: Ignoring 29 ( 0.1%) Users that have less than 1 test interactions
16916.6s 2815 EvaluatorHoldout: Processed 27066 (100.0%) in 18.63 sec. Users per second: 1453
16916.6s 2816 [I 2025-12-07 13:35:52,161] Trial 115 finished with value: 0.21678755827617335 and parameters: {'similarity': 'cosine', 'topK': 86, 'shrink': 325}. Best is trial 91 with value: 0.24993110179607925.
16916.6s 2817 
16916.6s 2818 [I 2025-12-07 13:35:52,161] Trial 115 finished with value: 0.21678755827617335 and parameters: {'similarity': 'cosine', 'topK': 86, 'shrink': 325}. Best is trial 91 with value: 0.24993110179607925.
16916.8s 2819 [0.21652547100231456, 0.2164994889687168, 0.21724762047211296, 0.21613291219890557, 0.2175322987388169]
16917.1s 2820 Unable to load Cython Compute_Similarity, reverting to Python
16932.5s 2821 Similarity column 6969 (100.0%), 452.91 column/sec. Elapsed time 15.39 sec
16932.5s 2822 EvaluatorHoldout: Ignoring 33 ( 0.1%) Users that have less than 1 test interactions
16956.9s 2823 EvaluatorHoldout: Processed 27062 (100.0%) in 24.40 sec. Users per second: 1109
16957.4s 2824 Unable to load Cython Compute_Similarity, reverting to Python
16972.7s 2825 Similarity column 6969 (100.0%), 452.87 column/sec. Elapsed time 15.39 sec
16972.8s 2826 EvaluatorHoldout: Ignoring 28 ( 0.1%) Users that have less than 1 test interactions
16997.3s 2827 EvaluatorHoldout: Processed 27067 (100.0%) in 24.58 sec. Users per second: 1101
16997.8s 2828 Unable to load Cython Compute_Similarity, reverting to Python
17013.0s 2829 Similarity column 6969 (100.0%), 458.11 column/sec. Elapsed time 15.21 sec
17013.0s 2830 EvaluatorHoldout: Ignoring 40 ( 0.1%) Users that have less than 1 test interactions
17037.6s 2831 EvaluatorHoldout: Processed 27055 (100.0%) in 24.56 sec. Users per second: 1102
17038.0s 2832 Unable to load Cython Compute_Similarity, reverting to Python
17053.3s 2833 Similarity column 6969 (100.0%), 454.24 column/sec. Elapsed time 15.34 sec
17053.4s 2834 EvaluatorHoldout: Ignoring 21 ( 0.1%) Users that have less than 1 test interactions
17078.0s 2835 EvaluatorHoldout: Processed 27074 (100.0%) in 24.61 sec. Users per second: 1100
17078.4s 2836 Unable to load Cython Compute_Similarity, reverting to Python
17093.9s 2837 Similarity column 6969 (100.0%), 449.41 column/sec. Elapsed time 15.51 sec
17094.0s 2838 EvaluatorHoldout: Ignoring 29 ( 0.1%) Users that have less than 1 test interactions
17118.6s 2839 EvaluatorHoldout: Processed 27066 (100.0%) in 24.64 sec. Users per second: 1099
17118.6s 2840 [I 2025-12-07 13:39:14,087] Trial 116 finished with value: 0.1669715868203599 and parameters: {'similarity': 'tversky', 'topK': 799, 'shrink': 352, 'tversky_alpha': 0.2189225952018534, 'tversky_beta': 1.5004852456694193}. Best is trial 91 with value: 0.24993110179607925.
17118.6s 2841 
17118.6s 2842 [I 2025-12-07 13:39:14,087] Trial 116 finished with value: 0.1669715868203599 and parameters: {'similarity': 'tversky', 'topK': 799, 'shrink': 352, 'tversky_alpha': 0.2189225952018534, 'tversky_beta': 1.5004852456694193}. Best is trial 91 with value: 0.24993110179607925.
17118.8s 2843 [0.16678202657766297, 0.16734567623012378, 0.16671350364426174, 0.1664952113097614, 0.16752151633998955]
17119.1s 2844 Unable to load Cython Compute_Similarity, reverting to Python
17127.9s 2845 Similarity column 6969 (100.0%), 780.05 column/sec. Elapsed time 8.93 sec
17128.0s 2846 EvaluatorHoldout: Ignoring 33 ( 0.1%) Users that have less than 1 test interactions
17141.7s 2847 EvaluatorHoldout: Processed 27062 (100.0%) in 13.88 sec. Users per second: 1950
17142.2s 2848 Unable to load Cython Compute_Similarity, reverting to Python
17150.9s 2849 Similarity column 6969 (100.0%), 782.35 column/sec. Elapsed time 8.91 sec
17151.1s 2850 EvaluatorHoldout: Ignoring 28 ( 0.1%) Users that have less than 1 test interactions
17165.1s 2851 EvaluatorHoldout: Processed 27067 (100.0%) in 14.03 sec. Users per second: 1929
17165.5s 2852 Unable to load Cython Compute_Similarity, reverting to Python
17174.7s 2853 Similarity column 6969 (100.0%), 742.59 column/sec. Elapsed time 9.38 sec
17174.9s 2854 EvaluatorHoldout: Ignoring 40 ( 0.1%) Users that have less than 1 test interactions
17188.6s 2855 EvaluatorHoldout: Processed 27055 (100.0%) in 13.92 sec. Users per second: 1943
17189.1s 2856 Unable to load Cython Compute_Similarity, reverting to Python
17198.1s 2857 Similarity column 6969 (100.0%), 763.57 column/sec. Elapsed time 9.13 sec
17198.2s 2858 EvaluatorHoldout: Ignoring 21 ( 0.1%) Users that have less than 1 test interactions
17212.0s 2859 EvaluatorHoldout: Processed 27074 (100.0%) in 13.91 sec. Users per second: 1947
17212.4s 2860 Unable to load Cython Compute_Similarity, reverting to Python
17221.3s 2861 Similarity column 6969 (100.0%), 767.03 column/sec. Elapsed time 9.09 sec
17221.5s 2862 EvaluatorHoldout: Ignoring 29 ( 0.1%) Users that have less than 1 test interactions
17235.4s 2863 EvaluatorHoldout: Processed 27066 (100.0%) in 13.87 sec. Users per second: 1951
17235.4s 2864 [I 2025-12-07 13:41:10,748] Trial 117 finished with value: 0.20376700488935845 and parameters: {'similarity': 'tversky', 'topK': 5, 'shrink': 277, 'tversky_alpha': 1.995281230770493, 'tversky_beta': 1.182597346670822}. Best is trial 91 with value: 0.24993110179607925.
17235.4s 2865 
17235.4s 2866 [I 2025-12-07 13:41:10,748] Trial 117 finished with value: 0.20376700488935845 and parameters: {'similarity': 'tversky', 'topK': 5, 'shrink': 277, 'tversky_alpha': 1.995281230770493, 'tversky_beta': 1.182597346670822}. Best is trial 91 with value: 0.24993110179607925.
17235.4s 2867 [0.2037126596573291, 0.20374048409698312, 0.20632890916953922, 0.2020286247726091, 0.20302434675033185]
17235.7s 2868 Unable to load Cython Compute_Similarity, reverting to Python
17245.0s 2869 Similarity column 6969 (100.0%), 733.86 column/sec. Elapsed time 9.50 sec
17245.2s 2870 EvaluatorHoldout: Ignoring 33 ( 0.1%) Users that have less than 1 test interactions
17261.3s 2871 EvaluatorHoldout: Processed 27062 (100.0%) in 16.19 sec. Users per second: 1672
17261.7s 2872 Unable to load Cython Compute_Similarity, reverting to Python
17271.2s 2873 Similarity column 6969 (100.0%), 747.04 column/sec. Elapsed time 9.33 sec
17271.2s 2874 EvaluatorHoldout: Ignoring 28 ( 0.1%) Users that have less than 1 test interactions
17287.7s 2875 EvaluatorHoldout: Processed 27067 (100.0%) in 16.77 sec. Users per second: 1614
17288.2s 2876 Unable to load Cython Compute_Similarity, reverting to Python
17297.4s 2877 Similarity column 6969 (100.0%), 742.67 column/sec. Elapsed time 9.38 sec
17297.6s 2878 EvaluatorHoldout: Ignoring 40 ( 0.1%) Users that have less than 1 test interactions
17313.8s 2879 EvaluatorHoldout: Processed 27055 (100.0%) in 16.28 sec. Users per second: 1661
17314.2s 2880 Unable to load Cython Compute_Similarity, reverting to Python
17323.8s 2881 Similarity column 6969 (100.0%), 709.35 column/sec. Elapsed time 9.82 sec
17324.0s 2882 EvaluatorHoldout: Ignoring 21 ( 0.1%) Users that have less than 1 test interactions
17340.0s 2883 EvaluatorHoldout: Processed 27074 (100.0%) in 16.21 sec. Users per second: 1670
17340.5s 2884 Unable to load Cython Compute_Similarity, reverting to Python
17349.8s 2885 Similarity column 6969 (100.0%), 745.28 column/sec. Elapsed time 9.35 sec
17349.9s 2886 EvaluatorHoldout: Ignoring 29 ( 0.1%) Users that have less than 1 test interactions
17365.8s 2887 EvaluatorHoldout: Processed 27066 (100.0%) in 16.12 sec. Users per second: 1679
17365.8s 2888 [I 2025-12-07 13:43:21,353] Trial 118 finished with value: 0.205169978920532 and parameters: {'similarity': 'tversky', 'topK': 62, 'shrink': 386, 'tversky_alpha': 0.2738433364285508, 'tversky_beta': 0.953063061247329}. Best is trial 91 with value: 0.24993110179607925.
17365.8s 2889 
17365.8s 2890 [I 2025-12-07 13:43:21,353] Trial 118 finished with value: 0.205169978920532 and parameters: {'similarity': 'tversky', 'topK': 62, 'shrink': 386, 'tversky_alpha': 0.2738433364285508, 'tversky_beta': 0.953063061247329}. Best is trial 91 with value: 0.24993110179607925.
17366.0s 2891 [0.205375537515715, 0.2055512839100525, 0.2054915573269591, 0.20423069030009258, 0.20520082554984065]
17366.3s 2892 Unable to load Cython Compute_Similarity, reverting to Python
17375.1s 2893 Similarity column 6969 (100.0%), 776.90 column/sec. Elapsed time 8.97 sec
17375.3s 2894 EvaluatorHoldout: Ignoring 33 ( 0.1%) Users that have less than 1 test interactions
17390.2s 2895 EvaluatorHoldout: Processed 27062 (100.0%) in 14.90 sec. Users per second: 1816
17390.5s 2896 Unable to load Cython Compute_Similarity, reverting to Python
17399.3s 2897 Similarity column 6969 (100.0%), 779.24 column/sec. Elapsed time 8.94 sec
17399.5s 2898 EvaluatorHoldout: Ignoring 28 ( 0.1%) Users that have less than 1 test interactions
17414.4s 2899 EvaluatorHoldout: Processed 27067 (100.0%) in 15.05 sec. Users per second: 1798
17414.8s 2900 Unable to load Cython Compute_Similarity, reverting to Python
17424.0s 2901 Similarity column 6969 (100.0%), 754.31 column/sec. Elapsed time 9.24 sec
17424.1s 2902 EvaluatorHoldout: Ignoring 40 ( 0.1%) Users that have less than 1 test interactions
17438.8s 2903 EvaluatorHoldout: Processed 27055 (100.0%) in 14.85 sec. Users per second: 1821
17439.2s 2904 Unable to load Cython Compute_Similarity, reverting to Python
17448.0s 2905 Similarity column 6969 (100.0%), 781.21 column/sec. Elapsed time 8.92 sec
17448.2s 2906 EvaluatorHoldout: Ignoring 21 ( 0.1%) Users that have less than 1 test interactions
17463.1s 2907 EvaluatorHoldout: Processed 27074 (100.0%) in 15.01 sec. Users per second: 1804
17463.5s 2908 Unable to load Cython Compute_Similarity, reverting to Python
17472.3s 2909 Similarity column 6969 (100.0%), 777.57 column/sec. Elapsed time 8.96 sec
17472.5s 2910 EvaluatorHoldout: Ignoring 29 ( 0.1%) Users that have less than 1 test interactions
17487.2s 2911 EvaluatorHoldout: Processed 27066 (100.0%) in 14.91 sec. Users per second: 1815
17487.2s 2912 [I 2025-12-07 13:45:22,722] Trial 119 finished with value: 0.20853222257231016 and parameters: {'similarity': 'jaccard', 'topK': 27, 'shrink': 148}. Best is trial 91 with value: 0.24993110179607925.
17487.2s 2913 
17487.2s 2914 [I 2025-12-07 13:45:22,722] Trial 119 finished with value: 0.20853222257231016 and parameters: {'similarity': 'jaccard', 'topK': 27, 'shrink': 148}. Best is trial 91 with value: 0.24993110179607925.
17487.4s 2915 [0.20833890363834337, 0.20909342571595213, 0.20934535228841913, 0.20742196039914837, 0.20846147081968777]
17487.7s 2916 Unable to load Cython Compute_Similarity, reverting to Python
17503.9s 2917 Similarity column 6969 (100.0%), 428.36 column/sec. Elapsed time 16.27 sec
17504.0s 2918 EvaluatorHoldout: Ignoring 33 ( 0.1%) Users that have less than 1 test interactions
17532.3s 2919 EvaluatorHoldout: Processed 27062 (100.0%) in 28.35 sec. Users per second: 954
17532.8s 2920 Unable to load Cython Compute_Similarity, reverting to Python
17548.9s 2921 Similarity column 6969 (100.0%), 431.70 column/sec. Elapsed time 16.14 sec
17549.0s 2922 EvaluatorHoldout: Ignoring 28 ( 0.1%) Users that have less than 1 test interactions
17577.0s 2923 EvaluatorHoldout: Processed 27067 (100.0%) in 28.10 sec. Users per second: 963
17577.5s 2924 Unable to load Cython Compute_Similarity, reverting to Python
17593.5s 2925 Similarity column 6969 (100.0%), 435.68 column/sec. Elapsed time 16.00 sec
17593.5s 2926 EvaluatorHoldout: Ignoring 40 ( 0.1%) Users that have less than 1 test interactions
17621.2s 2927 EvaluatorHoldout: Processed 27055 (100.0%) in 27.67 sec. Users per second: 978
17621.7s 2928 Unable to load Cython Compute_Similarity, reverting to Python
17637.4s 2929 Similarity column 6969 (100.0%), 440.29 column/sec. Elapsed time 15.83 sec
17637.5s 2930 EvaluatorHoldout: Ignoring 21 ( 0.1%) Users that have less than 1 test interactions
17665.3s 2931 EvaluatorHoldout: Processed 27074 (100.0%) in 27.81 sec. Users per second: 974
17665.8s 2932 Unable to load Cython Compute_Similarity, reverting to Python
17681.5s 2933 Similarity column 6969 (100.0%), 441.27 column/sec. Elapsed time 15.79 sec
17681.6s 2934 EvaluatorHoldout: Ignoring 29 ( 0.1%) Users that have less than 1 test interactions
17709.5s 2935 EvaluatorHoldout: Processed 27066 (100.0%) in 27.97 sec. Users per second: 968
17709.6s 2936 [I 2025-12-07 13:49:05,075] Trial 120 finished with value: 0.1858307304442496 and parameters: {'similarity': 'dice', 'topK': 944, 'shrink': 294}. Best is trial 91 with value: 0.24993110179607925.
17709.6s 2937 
17709.6s 2938 [I 2025-12-07 13:49:05,075] Trial 120 finished with value: 0.1858307304442496 and parameters: {'similarity': 'dice', 'topK': 944, 'shrink': 294}. Best is trial 91 with value: 0.24993110179607925.
17709.7s 2939 [0.18514545443198335, 0.18663197790186534, 0.1858022664608028, 0.18520128688432916, 0.18637266654226736]
17710.1s 2940 Unable to load Cython Compute_Similarity, reverting to Python
17719.0s 2941 Similarity column 6969 (100.0%), 774.42 column/sec. Elapsed time 9.00 sec
17719.1s 2942 EvaluatorHoldout: Ignoring 33 ( 0.1%) Users that have less than 1 test interactions
17733.0s 2943 EvaluatorHoldout: Processed 27062 (100.0%) in 14.06 sec. Users per second: 1924
17733.4s 2944 Unable to load Cython Compute_Similarity, reverting to Python
17742.2s 2945 Similarity column 6969 (100.0%), 782.36 column/sec. Elapsed time 8.91 sec
17742.4s 2946 EvaluatorHoldout: Ignoring 28 ( 0.1%) Users that have less than 1 test interactions
17756.5s 2947 EvaluatorHoldout: Processed 27067 (100.0%) in 14.19 sec. Users per second: 1907
17756.9s 2948 Unable to load Cython Compute_Similarity, reverting to Python
17765.9s 2949 Similarity column 6969 (100.0%), 752.31 column/sec. Elapsed time 9.26 sec
17766.1s 2950 EvaluatorHoldout: Ignoring 40 ( 0.1%) Users that have less than 1 test interactions
17779.9s 2951 EvaluatorHoldout: Processed 27055 (100.0%) in 13.96 sec. Users per second: 1938
17780.4s 2952 Unable to load Cython Compute_Similarity, reverting to Python
17789.6s 2953 Similarity column 6969 (100.0%), 751.34 column/sec. Elapsed time 9.28 sec
17789.7s 2954 EvaluatorHoldout: Ignoring 21 ( 0.1%) Users that have less than 1 test interactions
17803.6s 2955 EvaluatorHoldout: Processed 27074 (100.0%) in 14.13 sec. Users per second: 1916
17804.1s 2956 Unable to load Cython Compute_Similarity, reverting to Python
17813.1s 2957 Similarity column 6969 (100.0%), 757.12 column/sec. Elapsed time 9.20 sec
17813.3s 2958 EvaluatorHoldout: Ignoring 29 ( 0.1%) Users that have less than 1 test interactions
17827.5s 2959 EvaluatorHoldout: Processed 27066 (100.0%) in 14.21 sec. Users per second: 1905
17827.5s 2960 [I 2025-12-07 13:51:02,887] Trial 121 finished with value: 0.24435447485721543 and parameters: {'similarity': 'tversky', 'topK': 24, 'shrink': 176, 'tversky_alpha': 0.11642544065714844, 'tversky_beta': 1.9135639930075654}. Best is trial 91 with value: 0.24993110179607925.
17827.5s 2961 
17827.5s 2962 [I 2025-12-07 13:51:02,887] Trial 121 finished with value: 0.24435447485721543 and parameters: {'similarity': 'tversky', 'topK': 24, 'shrink': 176, 'tversky_alpha': 0.11642544065714844, 'tversky_beta': 1.9135639930075654}. Best is trial 91 with value: 0.24993110179607925.
17827.6s 2963 [0.24410548523973988, 0.24434466641171498, 0.24564330483573246, 0.2433142981558046, 0.24436461964308517]
17827.9s 2964 Unable to load Cython Compute_Similarity, reverting to Python
17836.8s 2965 Similarity column 6969 (100.0%), 764.24 column/sec. Elapsed time 9.12 sec
17837.0s 2966 EvaluatorHoldout: Ignoring 33 ( 0.1%) Users that have less than 1 test interactions
17851.5s 2967 EvaluatorHoldout: Processed 27062 (100.0%) in 14.69 sec. Users per second: 1842
17852.0s 2968 Unable to load Cython Compute_Similarity, reverting to Python
17861.1s 2969 Similarity column 6969 (100.0%), 767.51 column/sec. Elapsed time 9.08 sec
17861.1s 2970 EvaluatorHoldout: Ignoring 28 ( 0.1%) Users that have less than 1 test interactions
17875.8s 2971 EvaluatorHoldout: Processed 27067 (100.0%) in 14.85 sec. Users per second: 1822
17876.3s 2972 Unable to load Cython Compute_Similarity, reverting to Python
17885.3s 2973 Similarity column 6969 (100.0%), 753.77 column/sec. Elapsed time 9.25 sec
17885.5s 2974 EvaluatorHoldout: Ignoring 40 ( 0.1%) Users that have less than 1 test interactions
17900.2s 2975 EvaluatorHoldout: Processed 27055 (100.0%) in 14.77 sec. Users per second: 1832
17900.6s 2976 Unable to load Cython Compute_Similarity, reverting to Python
17909.6s 2977 Similarity column 6969 (100.0%), 758.04 column/sec. Elapsed time 9.19 sec
17909.8s 2978 EvaluatorHoldout: Ignoring 21 ( 0.1%) Users that have less than 1 test interactions
17924.3s 2979 EvaluatorHoldout: Processed 27074 (100.0%) in 14.70 sec. Users per second: 1842
17924.8s 2980 Unable to load Cython Compute_Similarity, reverting to Python
17933.9s 2981 Similarity column 6969 (100.0%), 761.27 column/sec. Elapsed time 9.15 sec
17934.0s 2982 EvaluatorHoldout: Ignoring 29 ( 0.1%) Users that have less than 1 test interactions
17948.5s 2983 EvaluatorHoldout: Processed 27066 (100.0%) in 14.69 sec. Users per second: 1842
17948.5s 2984 [I 2025-12-07 13:53:04,021] Trial 122 finished with value: 0.23047953756571182 and parameters: {'similarity': 'tversky', 'topK': 42, 'shrink': 217, 'tversky_alpha': 0.20660763960774436, 'tversky_beta': 1.8005843907108583}. Best is trial 91 with value: 0.24993110179607925.
17948.5s 2985 
