24328.0s 4208 [I 2025-12-07 15:39:23,530] Trial 173 finished with value: 0.21251222673125575 and parameters: {'similarity': 'tversky', 'topK': 44, 'shrink': 200, 'tversky_alpha': 0.6335241977460053, 'tversky_beta': 1.4116960493237842}. Best is trial 91 with value: 0.24993110179607925.
24328.0s 4209 
24328.0s 4210 [I 2025-12-07 15:39:23,530] Trial 173 finished with value: 0.21251222673125575 and parameters: {'similarity': 'tversky', 'topK': 44, 'shrink': 200, 'tversky_alpha': 0.6335241977460053, 'tversky_beta': 1.4116960493237842}. Best is trial 91 with value: 0.24993110179607925.
24328.2s 4211 [0.21282445082550674, 0.21262388087494807, 0.2132157948383159, 0.2112567662600255, 0.21264024085748262]
24328.5s 4212 Unable to load Cython Compute_Similarity, reverting to Python
24337.6s 4213 Similarity column 6969 (100.0%), 766.41 column/sec. Elapsed time 9.09 sec
24337.6s 4214 EvaluatorHoldout: Ignoring 33 ( 0.1%) Users that have less than 1 test interactions
24351.2s 4215 EvaluatorHoldout: Processed 27062 (100.0%) in 13.74 sec. Users per second: 1970
24351.7s 4216 Unable to load Cython Compute_Similarity, reverting to Python
24360.5s 4217 Similarity column 6969 (100.0%), 773.63 column/sec. Elapsed time 9.01 sec
24360.7s 4218 EvaluatorHoldout: Ignoring 28 ( 0.1%) Users that have less than 1 test interactions
24374.5s 4219 EvaluatorHoldout: Processed 27067 (100.0%) in 13.77 sec. Users per second: 1965
24374.8s 4220 Unable to load Cython Compute_Similarity, reverting to Python
24384.0s 4221 Similarity column 6969 (100.0%), 742.12 column/sec. Elapsed time 9.39 sec
24384.2s 4222 EvaluatorHoldout: Ignoring 40 ( 0.1%) Users that have less than 1 test interactions
24397.7s 4223 EvaluatorHoldout: Processed 27055 (100.0%) in 13.67 sec. Users per second: 1979
24398.1s 4224 Unable to load Cython Compute_Similarity, reverting to Python
24407.3s 4225 Similarity column 6969 (100.0%), 762.84 column/sec. Elapsed time 9.14 sec
24407.3s 4226 EvaluatorHoldout: Ignoring 21 ( 0.1%) Users that have less than 1 test interactions
24420.9s 4227 EvaluatorHoldout: Processed 27074 (100.0%) in 13.76 sec. Users per second: 1968
24421.4s 4228 Unable to load Cython Compute_Similarity, reverting to Python
24430.1s 4229 Similarity column 6969 (100.0%), 776.91 column/sec. Elapsed time 8.97 sec
24430.3s 4230 EvaluatorHoldout: Ignoring 29 ( 0.1%) Users that have less than 1 test interactions
24444.1s 4231 EvaluatorHoldout: Processed 27066 (100.0%) in 13.73 sec. Users per second: 1971
24444.1s 4232 [I 2025-12-07 15:41:19,428] Trial 174 finished with value: 0.2458573042310051 and parameters: {'similarity': 'tversky', 'topK': 7, 'shrink': 176, 'tversky_alpha': 0.45240734608558547, 'tversky_beta': 1.6218908813606607}. Best is trial 91 with value: 0.24993110179607925.
24444.1s 4233 
24444.1s 4234 [I 2025-12-07 15:41:19,428] Trial 174 finished with value: 0.2458573042310051 and parameters: {'similarity': 'tversky', 'topK': 7, 'shrink': 176, 'tversky_alpha': 0.45240734608558547, 'tversky_beta': 1.6218908813606607}. Best is trial 91 with value: 0.24993110179607925.
24444.1s 4235 [0.2444207155695899, 0.24661539335979335, 0.24832844824226072, 0.24396874337081428, 0.24595322061256725]
24444.4s 4236 Unable to load Cython Compute_Similarity, reverting to Python
24453.2s 4237 Similarity column 6969 (100.0%), 771.98 column/sec. Elapsed time 9.03 sec
24453.4s 4238 EvaluatorHoldout: Ignoring 33 ( 0.1%) Users that have less than 1 test interactions
24466.7s 4239 EvaluatorHoldout: Processed 27062 (100.0%) in 13.46 sec. Users per second: 2011
24467.2s 4240 Unable to load Cython Compute_Similarity, reverting to Python
24476.2s 4241 Similarity column 6969 (100.0%), 774.74 column/sec. Elapsed time 9.00 sec
24476.2s 4242 EvaluatorHoldout: Ignoring 28 ( 0.1%) Users that have less than 1 test interactions
24489.6s 4243 EvaluatorHoldout: Processed 27067 (100.0%) in 13.59 sec. Users per second: 1992
24490.1s 4244 Unable to load Cython Compute_Similarity, reverting to Python
24499.0s 4245 Similarity column 6969 (100.0%), 768.65 column/sec. Elapsed time 9.07 sec
24499.2s 4246 EvaluatorHoldout: Ignoring 40 ( 0.1%) Users that have less than 1 test interactions
24512.7s 4247 EvaluatorHoldout: Processed 27055 (100.0%) in 13.52 sec. Users per second: 2002
24513.0s 4248 Unable to load Cython Compute_Similarity, reverting to Python
24521.6s 4249 Similarity column 6969 (100.0%), 795.61 column/sec. Elapsed time 8.76 sec
24521.8s 4250 EvaluatorHoldout: Ignoring 21 ( 0.1%) Users that have less than 1 test interactions
24535.2s 4251 EvaluatorHoldout: Processed 27074 (100.0%) in 13.54 sec. Users per second: 2000
24535.6s 4252 Unable to load Cython Compute_Similarity, reverting to Python
24544.5s 4253 Similarity column 6969 (100.0%), 787.48 column/sec. Elapsed time 8.85 sec
24544.5s 4254 EvaluatorHoldout: Ignoring 29 ( 0.1%) Users that have less than 1 test interactions
24557.9s 4255 EvaluatorHoldout: Processed 27066 (100.0%) in 13.60 sec. Users per second: 1990
24557.9s 4256 [I 2025-12-07 15:43:13,451] Trial 175 finished with value: 0.24705309624525668 and parameters: {'similarity': 'tversky', 'topK': 5, 'shrink': 259, 'tversky_alpha': 0.403266024295789, 'tversky_beta': 1.7035450875075555}. Best is trial 91 with value: 0.24993110179607925.
24557.9s 4257 
24557.9s 4258 [I 2025-12-07 15:43:13,451] Trial 175 finished with value: 0.24705309624525668 and parameters: {'similarity': 'tversky', 'topK': 5, 'shrink': 259, 'tversky_alpha': 0.403266024295789, 'tversky_beta': 1.7035450875075555}. Best is trial 91 with value: 0.24993110179607925.
24558.1s 4259 [0.2460135304245914, 0.24784923615946342, 0.2482492964345605, 0.2463029930105388, 0.24685042519712924]
24558.4s 4260 Unable to load Cython Compute_Similarity, reverting to Python
24567.3s 4261 Similarity column 6969 (100.0%), 772.49 column/sec. Elapsed time 9.02 sec
24567.5s 4262 EvaluatorHoldout: Ignoring 33 ( 0.1%) Users that have less than 1 test interactions
24582.2s 4263 EvaluatorHoldout: Processed 27062 (100.0%) in 14.58 sec. Users per second: 1856
24582.4s 4264 Unable to load Cython Compute_Similarity, reverting to Python
24591.2s 4265 Similarity column 6969 (100.0%), 767.72 column/sec. Elapsed time 9.08 sec
24591.5s 4266 EvaluatorHoldout: Ignoring 28 ( 0.1%) Users that have less than 1 test interactions
24606.0s 4267 EvaluatorHoldout: Processed 27067 (100.0%) in 14.70 sec. Users per second: 1842
24606.5s 4268 Unable to load Cython Compute_Similarity, reverting to Python
24615.9s 4269 Similarity column 6969 (100.0%), 735.32 column/sec. Elapsed time 9.48 sec
24615.9s 4270 EvaluatorHoldout: Ignoring 40 ( 0.1%) Users that have less than 1 test interactions
24630.6s 4271 EvaluatorHoldout: Processed 27055 (100.0%) in 14.81 sec. Users per second: 1826
24631.1s 4272 Unable to load Cython Compute_Similarity, reverting to Python
24640.2s 4273 Similarity column 6969 (100.0%), 751.73 column/sec. Elapsed time 9.27 sec
24640.4s 4274 EvaluatorHoldout: Ignoring 21 ( 0.1%) Users that have less than 1 test interactions
24655.3s 4275 EvaluatorHoldout: Processed 27074 (100.0%) in 14.92 sec. Users per second: 1815
24655.6s 4276 Unable to load Cython Compute_Similarity, reverting to Python
24665.2s 4277 Similarity column 6969 (100.0%), 713.24 column/sec. Elapsed time 9.77 sec
24665.4s 4278 EvaluatorHoldout: Ignoring 29 ( 0.1%) Users that have less than 1 test interactions
24680.0s 4279 EvaluatorHoldout: Processed 27066 (100.0%) in 14.78 sec. Users per second: 1832
24680.0s 4280 [I 2025-12-07 15:45:15,503] Trial 176 finished with value: 0.22517762408316142 and parameters: {'similarity': 'tversky', 'topK': 33, 'shrink': 257, 'tversky_alpha': 0.39972199298192995, 'tversky_beta': 1.688994742265173}. Best is trial 91 with value: 0.24993110179607925.
24680.0s 4281 
24680.0s 4282 [I 2025-12-07 15:45:15,503] Trial 176 finished with value: 0.22517762408316142 and parameters: {'similarity': 'tversky', 'topK': 33, 'shrink': 257, 'tversky_alpha': 0.39972199298192995, 'tversky_beta': 1.688994742265173}. Best is trial 91 with value: 0.24993110179607925.
24680.2s 4283 [0.2245466125363941, 0.22547217552911808, 0.22618042196387328, 0.2240263657413137, 0.2256625446451079]
24680.5s 4284 Unable to load Cython Compute_Similarity, reverting to Python
24689.9s 4285 Similarity column 6969 (100.0%), 737.68 column/sec. Elapsed time 9.45 sec
24689.9s 4286 EvaluatorHoldout: Ignoring 33 ( 0.1%) Users that have less than 1 test interactions
24705.3s 4287 EvaluatorHoldout: Processed 27062 (100.0%) in 15.57 sec. Users per second: 1738
24705.8s 4288 Unable to load Cython Compute_Similarity, reverting to Python
24715.1s 4289 Similarity column 6969 (100.0%), 739.63 column/sec. Elapsed time 9.42 sec
24715.3s 4290 EvaluatorHoldout: Ignoring 28 ( 0.1%) Users that have less than 1 test interactions
24731.1s 4291 EvaluatorHoldout: Processed 27067 (100.0%) in 15.72 sec. Users per second: 1722
24731.3s 4292 Unable to load Cython Compute_Similarity, reverting to Python
24741.6s 4293 Similarity column 6969 (100.0%), 667.23 column/sec. Elapsed time 10.44 sec
24741.8s 4294 EvaluatorHoldout: Ignoring 40 ( 0.1%) Users that have less than 1 test interactions
24757.2s 4295 EvaluatorHoldout: Processed 27055 (100.0%) in 15.56 sec. Users per second: 1739
24757.7s 4296 Unable to load Cython Compute_Similarity, reverting to Python
24767.3s 4297 Similarity column 6969 (100.0%), 720.30 column/sec. Elapsed time 9.68 sec
24767.3s 4298 EvaluatorHoldout: Ignoring 21 ( 0.1%) Users that have less than 1 test interactions
24783.2s 4299 EvaluatorHoldout: Processed 27074 (100.0%) in 16.02 sec. Users per second: 1690
24783.7s 4300 Unable to load Cython Compute_Similarity, reverting to Python
24792.8s 4301 Similarity column 6969 (100.0%), 752.16 column/sec. Elapsed time 9.27 sec
24793.0s 4302 EvaluatorHoldout: Ignoring 29 ( 0.1%) Users that have less than 1 test interactions
24808.6s 4303 EvaluatorHoldout: Processed 27066 (100.0%) in 15.64 sec. Users per second: 1731
24808.6s 4304 [I 2025-12-07 15:47:23,950] Trial 177 finished with value: 0.21160322234588191 and parameters: {'similarity': 'tversky', 'topK': 54, 'shrink': 305, 'tversky_alpha': 0.5086370571541542, 'tversky_beta': 1.5796693234550658}. Best is trial 91 with value: 0.24993110179607925.
24808.6s 4305 
24808.6s 4306 [I 2025-12-07 15:47:23,950] Trial 177 finished with value: 0.21160322234588191 and parameters: {'similarity': 'tversky', 'topK': 54, 'shrink': 305, 'tversky_alpha': 0.5086370571541542, 'tversky_beta': 1.5796693234550658}. Best is trial 91 with value: 0.24993110179607925.
24808.6s 4307 [0.21142714658677755, 0.21189135072580648, 0.21187335099508567, 0.2107118913464696, 0.21211237207527023]
24808.9s 4308 Unable to load Cython Compute_Similarity, reverting to Python
24817.9s 4309 Similarity column 6969 (100.0%), 762.74 column/sec. Elapsed time 9.14 sec
24818.1s 4310 EvaluatorHoldout: Ignoring 33 ( 0.1%) Users that have less than 1 test interactions
24832.8s 4311 EvaluatorHoldout: Processed 27062 (100.0%) in 14.90 sec. Users per second: 1817
24833.3s 4312 Unable to load Cython Compute_Similarity, reverting to Python
24842.4s 4313 Similarity column 6969 (100.0%), 762.21 column/sec. Elapsed time 9.14 sec
24842.4s 4314 EvaluatorHoldout: Ignoring 28 ( 0.1%) Users that have less than 1 test interactions
24857.3s 4315 EvaluatorHoldout: Processed 27067 (100.0%) in 15.03 sec. Users per second: 1800
24857.8s 4316 Unable to load Cython Compute_Similarity, reverting to Python
24867.0s 4317 Similarity column 6969 (100.0%), 741.17 column/sec. Elapsed time 9.40 sec
24867.2s 4318 EvaluatorHoldout: Ignoring 40 ( 0.1%) Users that have less than 1 test interactions
24882.1s 4319 EvaluatorHoldout: Processed 27055 (100.0%) in 14.84 sec. Users per second: 1823
24882.4s 4320 Unable to load Cython Compute_Similarity, reverting to Python
24891.5s 4321 Similarity column 6969 (100.0%), 746.85 column/sec. Elapsed time 9.33 sec
24891.7s 4322 EvaluatorHoldout: Ignoring 21 ( 0.1%) Users that have less than 1 test interactions
24906.4s 4323 EvaluatorHoldout: Processed 27074 (100.0%) in 14.89 sec. Users per second: 1818
24906.9s 4324 Unable to load Cython Compute_Similarity, reverting to Python
24915.8s 4325 Similarity column 6969 (100.0%), 783.09 column/sec. Elapsed time 8.90 sec
24915.8s 4326 EvaluatorHoldout: Ignoring 29 ( 0.1%) Users that have less than 1 test interactions
24930.5s 4327 EvaluatorHoldout: Processed 27066 (100.0%) in 14.82 sec. Users per second: 1826
24930.5s 4328 [I 2025-12-07 15:49:25,976] Trial 178 finished with value: 0.21536907378395695 and parameters: {'similarity': 'tversky', 'topK': 31, 'shrink': 240, 'tversky_alpha': 0.9326577107073621, 'tversky_beta': 1.7084047759843086}. Best is trial 91 with value: 0.24993110179607925.
24930.5s 4329 
24930.5s 4330 [I 2025-12-07 15:49:25,976] Trial 178 finished with value: 0.21536907378395695 and parameters: {'similarity': 'tversky', 'topK': 31, 'shrink': 240, 'tversky_alpha': 0.9326577107073621, 'tversky_beta': 1.7084047759843086}. Best is trial 91 with value: 0.24993110179607925.
24930.7s 4331 [0.2154058243885978, 0.215982464200674, 0.2157466595185282, 0.2140911472184185, 0.2156192735935662]
24931.0s 4332 Unable to load Cython Compute_Similarity, reverting to Python
24939.6s 4333 Similarity column 6969 (100.0%), 790.26 column/sec. Elapsed time 8.82 sec
24939.8s 4334 EvaluatorHoldout: Ignoring 33 ( 0.1%) Users that have less than 1 test interactions
24953.1s 4335 EvaluatorHoldout: Processed 27062 (100.0%) in 13.32 sec. Users per second: 2032
24953.4s 4336 Unable to load Cython Compute_Similarity, reverting to Python
24962.1s 4337 Similarity column 6969 (100.0%), 787.67 column/sec. Elapsed time 8.85 sec
24962.3s 4338 EvaluatorHoldout: Ignoring 28 ( 0.1%) Users that have less than 1 test interactions
24975.4s 4339 EvaluatorHoldout: Processed 27067 (100.0%) in 13.30 sec. Users per second: 2035
24975.9s 4340 Unable to load Cython Compute_Similarity, reverting to Python
24985.2s 4341 Similarity column 6969 (100.0%), 749.29 column/sec. Elapsed time 9.30 sec
24985.2s 4342 EvaluatorHoldout: Ignoring 40 ( 0.1%) Users that have less than 1 test interactions
24998.2s 4343 EvaluatorHoldout: Processed 27055 (100.0%) in 13.21 sec. Users per second: 2048
24998.7s 4344 Unable to load Cython Compute_Similarity, reverting to Python
25007.3s 4345 Similarity column 6969 (100.0%), 791.63 column/sec. Elapsed time 8.80 sec
25007.5s 4346 EvaluatorHoldout: Ignoring 21 ( 0.1%) Users that have less than 1 test interactions
25021.0s 4347 EvaluatorHoldout: Processed 27074 (100.0%) in 13.40 sec. Users per second: 2020
25021.2s 4348 Unable to load Cython Compute_Similarity, reverting to Python
25029.9s 4349 Similarity column 6969 (100.0%), 790.65 column/sec. Elapsed time 8.81 sec
25030.1s 4350 EvaluatorHoldout: Ignoring 29 ( 0.1%) Users that have less than 1 test interactions
25043.3s 4351 EvaluatorHoldout: Processed 27066 (100.0%) in 13.36 sec. Users per second: 2025
25043.3s 4352 [I 2025-12-07 15:51:18,774] Trial 179 finished with value: 0.24916841871454146 and parameters: {'similarity': 'tversky', 'topK': 5, 'shrink': 4, 'tversky_alpha': 0.1981852619435526, 'tversky_beta': 1.7676293767286357}. Best is trial 91 with value: 0.24993110179607925.
25043.3s 4353 
25043.3s 4354 [I 2025-12-07 15:51:18,774] Trial 179 finished with value: 0.24916841871454146 and parameters: {'similarity': 'tversky', 'topK': 5, 'shrink': 4, 'tversky_alpha': 0.1981852619435526, 'tversky_beta': 1.7676293767286357}. Best is trial 91 with value: 0.24993110179607925.
25043.5s 4355 [0.24810215915926798, 0.2497280779846818, 0.2500956036112199, 0.2481226597921392, 0.2497935930253984]
25043.8s 4356 Unable to load Cython Compute_Similarity, reverting to Python
25052.8s 4357 Similarity column 6969 (100.0%), 766.10 column/sec. Elapsed time 9.10 sec
25052.9s 4358 EvaluatorHoldout: Ignoring 33 ( 0.1%) Users that have less than 1 test interactions
25068.6s 4359 EvaluatorHoldout: Processed 27062 (100.0%) in 15.90 sec. Users per second: 1702
25069.1s 4360 Unable to load Cython Compute_Similarity, reverting to Python
25078.0s 4361 Similarity column 6969 (100.0%), 766.09 column/sec. Elapsed time 9.10 sec
25078.2s 4362 EvaluatorHoldout: Ignoring 28 ( 0.1%) Users that have less than 1 test interactions
25094.2s 4363 EvaluatorHoldout: Processed 27067 (100.0%) in 15.97 sec. Users per second: 1694
25094.5s 4364 Unable to load Cython Compute_Similarity, reverting to Python
25103.5s 4365 Similarity column 6969 (100.0%), 757.82 column/sec. Elapsed time 9.20 sec
25103.7s 4366 EvaluatorHoldout: Ignoring 40 ( 0.1%) Users that have less than 1 test interactions
25119.4s 4367 EvaluatorHoldout: Processed 27055 (100.0%) in 15.88 sec. Users per second: 1704
25119.9s 4368 Unable to load Cython Compute_Similarity, reverting to Python
25129.2s 4369 Similarity column 6969 (100.0%), 756.77 column/sec. Elapsed time 9.21 sec
25129.2s 4370 EvaluatorHoldout: Ignoring 21 ( 0.1%) Users that have less than 1 test interactions
25144.9s 4371 EvaluatorHoldout: Processed 27074 (100.0%) in 16.01 sec. Users per second: 1691
25145.4s 4372 Unable to load Cython Compute_Similarity, reverting to Python
25154.3s 4373 Similarity column 6969 (100.0%), 768.34 column/sec. Elapsed time 9.07 sec
25154.5s 4374 EvaluatorHoldout: Ignoring 29 ( 0.1%) Users that have less than 1 test interactions
25170.4s 4375 [I 2025-12-07 15:53:25,694] Trial 180 finished with value: 0.20245028174520407 and parameters: {'similarity': 'dice', 'topK': 75, 'shrink': 0}. Best is trial 91 with value: 0.24993110179607925.
25170.4s 4376 
25170.4s 4377 [I 2025-12-07 15:53:25,694] Trial 180 finished with value: 0.20245028174520407 and parameters: {'similarity': 'dice', 'topK': 75, 'shrink': 0}. Best is trial 91 with value: 0.24993110179607925.
25170.4s 4378 EvaluatorHoldout: Processed 27066 (100.0%) in 15.82 sec. Users per second: 1711
25170.4s 4379 [0.20177871617281418, 0.20248463703568081, 0.20330226600787105, 0.20205034210777334, 0.20263544740188094]
25170.7s 4380 Unable to load Cython Compute_Similarity, reverting to Python
25179.5s 4381 Similarity column 6969 (100.0%), 775.06 column/sec. Elapsed time 8.99 sec
25179.7s 4382 EvaluatorHoldout: Ignoring 33 ( 0.1%) Users that have less than 1 test interactions
25193.7s 4383 EvaluatorHoldout: Processed 27062 (100.0%) in 14.20 sec. Users per second: 1906
25194.2s 4384 Unable to load Cython Compute_Similarity, reverting to Python
25203.1s 4385 Similarity column 6969 (100.0%), 779.34 column/sec. Elapsed time 8.94 sec
25203.1s 4386 EvaluatorHoldout: Ignoring 28 ( 0.1%) Users that have less than 1 test interactions
25217.1s 4387 EvaluatorHoldout: Processed 27067 (100.0%) in 14.15 sec. Users per second: 1913
25217.6s 4388 Unable to load Cython Compute_Similarity, reverting to Python
25226.3s 4389 Similarity column 6969 (100.0%), 783.55 column/sec. Elapsed time 8.89 sec
25226.5s 4390 EvaluatorHoldout: Ignoring 40 ( 0.1%) Users that have less than 1 test interactions
25240.5s 4391 EvaluatorHoldout: Processed 27055 (100.0%) in 14.00 sec. Users per second: 1932
25240.8s 4392 Unable to load Cython Compute_Similarity, reverting to Python
25249.5s 4393 Similarity column 6969 (100.0%), 786.33 column/sec. Elapsed time 8.86 sec
25249.7s 4394 EvaluatorHoldout: Ignoring 21 ( 0.1%) Users that have less than 1 test interactions
25263.7s 4395 EvaluatorHoldout: Processed 27074 (100.0%) in 14.18 sec. Users per second: 1909
25264.2s 4396 Unable to load Cython Compute_Similarity, reverting to Python
25273.2s 4397 Similarity column 6969 (100.0%), 777.26 column/sec. Elapsed time 8.97 sec
25273.2s 4398 EvaluatorHoldout: Ignoring 29 ( 0.1%) Users that have less than 1 test interactions
25287.1s 4399 EvaluatorHoldout: Processed 27066 (100.0%) in 14.14 sec. Users per second: 1914
25287.1s 4400 [I 2025-12-07 15:55:22,663] Trial 181 finished with value: 0.23912694694159678 and parameters: {'similarity': 'tversky', 'topK': 21, 'shrink': 271, 'tversky_alpha': 0.23654917339641063, 'tversky_beta': 1.7691658643789607}. Best is trial 91 with value: 0.24993110179607925.
25287.1s 4401 
