9230.4s 1138 [I 2025-12-06 23:51:41,290] Trial 45 finished with value: 0.21646245627985888 and parameters: {'topK': 121, 'shrink': 5, 'feature_weighting': 'TF-IDF'}. Best is trial 10 with value: 0.21699762942341766.
9230.5s 1139 [0.21667725481718778, 0.21682244804047496, 0.21601396092059594, 0.21707466387045737, 0.21572395375057846]
9230.9s 1140 Unable to load Cython Compute_Similarity, reverting to Python
9243.6s 1141 Similarity column 6969 (100.0%), 538.28 column/sec. Elapsed time 12.95 sec
9243.8s 1142 EvaluatorHoldout: Ignoring 48 ( 0.2%) Users that have less than 1 test interactions
9271.9s 1143 EvaluatorHoldout: Processed 27047 (100.0%) in 28.12 sec. Users per second: 962
9272.3s 1144 Unable to load Cython Compute_Similarity, reverting to Python
9284.7s 1145 Similarity column 6969 (100.0%), 556.85 column/sec. Elapsed time 12.52 sec
9284.9s 1146 EvaluatorHoldout: Ignoring 29 ( 0.1%) Users that have less than 1 test interactions
9313.2s 1147 EvaluatorHoldout: Processed 27066 (100.0%) in 28.44 sec. Users per second: 952
9313.7s 1148 Unable to load Cython Compute_Similarity, reverting to Python
9325.9s 1149 Similarity column 6969 (100.0%), 560.84 column/sec. Elapsed time 12.43 sec
9326.1s 1150 EvaluatorHoldout: Ignoring 42 ( 0.2%) Users that have less than 1 test interactions
9354.0s 1151 EvaluatorHoldout: Processed 27053 (100.0%) in 27.92 sec. Users per second: 969
9354.5s 1152 Unable to load Cython Compute_Similarity, reverting to Python
9366.6s 1153 Similarity column 6969 (100.0%), 566.12 column/sec. Elapsed time 12.31 sec
9366.8s 1154 EvaluatorHoldout: Ignoring 38 ( 0.1%) Users that have less than 1 test interactions
9394.7s 1155 EvaluatorHoldout: Processed 27057 (100.0%) in 28.04 sec. Users per second: 965
9395.2s 1156 Unable to load Cython Compute_Similarity, reverting to Python
9407.7s 1157 Similarity column 6969 (100.0%), 549.72 column/sec. Elapsed time 12.68 sec
9407.9s 1158 EvaluatorHoldout: Ignoring 32 ( 0.1%) Users that have less than 1 test interactions
9436.2s 1159 EvaluatorHoldout: Processed 27063 (100.0%) in 28.34 sec. Users per second: 955
9436.2s 1160 [I 2025-12-06 23:55:07,076] Trial 46 finished with value: 0.2142832899913884 and parameters: {'topK': 198, 'shrink': 806, 'feature_weighting': 'TF-IDF'}. Best is trial 10 with value: 0.21699762942341766.
9436.2s 1161 
9436.2s 1162 [I 2025-12-06 23:55:07,076] Trial 46 finished with value: 0.2142832899913884 and parameters: {'topK': 198, 'shrink': 806, 'feature_weighting': 'TF-IDF'}. Best is trial 10 with value: 0.21699762942341766.
9436.3s 1163 [0.2149832391636446, 0.21446248487188227, 0.21335332609897525, 0.21481812236112915, 0.21379927746131067]
9436.7s 1164 Unable to load Cython Compute_Similarity, reverting to Python
9448.7s 1165 Similarity column 6969 (100.0%), 571.67 column/sec. Elapsed time 12.19 sec
9448.9s 1166 EvaluatorHoldout: Ignoring 48 ( 0.2%) Users that have less than 1 test interactions
9471.3s 1167 EvaluatorHoldout: Processed 27047 (100.0%) in 22.50 sec. Users per second: 1202
9471.8s 1168 Unable to load Cython Compute_Similarity, reverting to Python
9482.9s 1169 Similarity column 6969 (100.0%), 617.73 column/sec. Elapsed time 11.28 sec
9483.1s 1170 EvaluatorHoldout: Ignoring 29 ( 0.1%) Users that have less than 1 test interactions
9505.5s 1171 EvaluatorHoldout: Processed 27066 (100.0%) in 22.55 sec. Users per second: 1200
9506.0s 1172 Unable to load Cython Compute_Similarity, reverting to Python
9517.5s 1173 Similarity column 6969 (100.0%), 596.91 column/sec. Elapsed time 11.68 sec
9517.7s 1174 EvaluatorHoldout: Ignoring 42 ( 0.2%) Users that have less than 1 test interactions
9540.3s 1175 EvaluatorHoldout: Processed 27053 (100.0%) in 22.66 sec. Users per second: 1194
9540.8s 1176 Unable to load Cython Compute_Similarity, reverting to Python
9552.3s 1177 Similarity column 6969 (100.0%), 593.08 column/sec. Elapsed time 11.75 sec
9552.5s 1178 EvaluatorHoldout: Ignoring 38 ( 0.1%) Users that have less than 1 test interactions
9574.8s 1179 EvaluatorHoldout: Processed 27057 (100.0%) in 22.40 sec. Users per second: 1208
9575.3s 1180 Unable to load Cython Compute_Similarity, reverting to Python
9586.5s 1181 Similarity column 6969 (100.0%), 612.49 column/sec. Elapsed time 11.38 sec
9586.7s 1182 EvaluatorHoldout: Ignoring 32 ( 0.1%) Users that have less than 1 test interactions
9608.9s 1183 EvaluatorHoldout: Processed 27063 (100.0%) in 22.28 sec. Users per second: 1214
9608.9s 1184 [I 2025-12-06 23:57:59,815] Trial 47 finished with value: 0.19995339466546994 and parameters: {'topK': 126, 'shrink': 164, 'feature_weighting': 'BM25'}. Best is trial 10 with value: 0.21699762942341766.
9608.9s 1185 
9608.9s 1186 [I 2025-12-06 23:57:59,815] Trial 47 finished with value: 0.19995339466546994 and parameters: {'topK': 126, 'shrink': 164, 'feature_weighting': 'BM25'}. Best is trial 10 with value: 0.21699762942341766.
9609.0s 1187 [0.20005458336067253, 0.2011263429974469, 0.1987683218021104, 0.19990902321431023, 0.19990870195280963]
9609.0s 1188 Unable to load Cython Compute_Similarity, reverting to Python
9621.8s 1189 Similarity column 6969 (100.0%), 545.96 column/sec. Elapsed time 12.76 sec
9622.0s 1190 EvaluatorHoldout: Ignoring 48 ( 0.2%) Users that have less than 1 test interactions
9652.8s 1191 EvaluatorHoldout: Processed 27047 (100.0%) in 30.84 sec. Users per second: 877
9652.9s 1192 Unable to load Cython Compute_Similarity, reverting to Python
9665.9s 1193 Similarity column 6969 (100.0%), 533.34 column/sec. Elapsed time 13.07 sec
9666.1s 1194 EvaluatorHoldout: Ignoring 29 ( 0.1%) Users that have less than 1 test interactions
9696.9s 1195 EvaluatorHoldout: Processed 27066 (100.0%) in 30.78 sec. Users per second: 879
9697.0s 1196 Unable to load Cython Compute_Similarity, reverting to Python
9710.1s 1197 Similarity column 6969 (100.0%), 529.65 column/sec. Elapsed time 13.16 sec
9710.3s 1198 EvaluatorHoldout: Ignoring 42 ( 0.2%) Users that have less than 1 test interactions
9741.2s 1199 EvaluatorHoldout: Processed 27053 (100.0%) in 30.97 sec. Users per second: 873
9741.4s 1200 Unable to load Cython Compute_Similarity, reverting to Python
9755.0s 1201 Similarity column 6969 (100.0%), 508.90 column/sec. Elapsed time 13.69 sec
9755.2s 1202 EvaluatorHoldout: Ignoring 38 ( 0.1%) Users that have less than 1 test interactions
9786.9s 1203 EvaluatorHoldout: Processed 27057 (100.0%) in 31.70 sec. Users per second: 854
9787.0s 1204 Unable to load Cython Compute_Similarity, reverting to Python
9802.7s 1205 Similarity column 6969 (100.0%), 443.31 column/sec. Elapsed time 15.72 sec
9802.9s 1206 EvaluatorHoldout: Ignoring 32 ( 0.1%) Users that have less than 1 test interactions
9836.2s 1207 EvaluatorHoldout: Processed 27063 (100.0%) in 33.28 sec. Users per second: 813
9836.2s 1208 [I 2025-12-07 00:01:47,067] Trial 48 finished with value: 0.20588292774858186 and parameters: {'topK': 305, 'shrink': 106, 'feature_weighting': 'none'}. Best is trial 10 with value: 0.21699762942341766.
9836.2s 1209 
9836.2s 1210 [I 2025-12-07 00:01:47,067] Trial 48 finished with value: 0.20588292774858186 and parameters: {'topK': 305, 'shrink': 106, 'feature_weighting': 'none'}. Best is trial 10 with value: 0.21699762942341766.
9836.3s 1211 [0.20658290914965408, 0.20538619196648553, 0.20455487408567122, 0.20684846391335884, 0.20604219962773954]
9836.7s 1212 Unable to load Cython Compute_Similarity, reverting to Python
9849.4s 1213 Similarity column 6969 (100.0%), 539.79 column/sec. Elapsed time 12.91 sec
9849.6s 1214 EvaluatorHoldout: Ignoring 48 ( 0.2%) Users that have less than 1 test interactions
9870.6s 1215 EvaluatorHoldout: Processed 27047 (100.0%) in 21.08 sec. Users per second: 1283
9871.1s 1216 Unable to load Cython Compute_Similarity, reverting to Python
9883.2s 1217 Similarity column 6969 (100.0%), 568.53 column/sec. Elapsed time 12.26 sec
9883.4s 1218 EvaluatorHoldout: Ignoring 29 ( 0.1%) Users that have less than 1 test interactions
9904.1s 1219 EvaluatorHoldout: Processed 27066 (100.0%) in 20.81 sec. Users per second: 1301
9904.6s 1220 Unable to load Cython Compute_Similarity, reverting to Python
9916.9s 1221 Similarity column 6969 (100.0%), 559.01 column/sec. Elapsed time 12.47 sec
9917.1s 1222 EvaluatorHoldout: Ignoring 42 ( 0.2%) Users that have less than 1 test interactions
9938.0s 1223 EvaluatorHoldout: Processed 27053 (100.0%) in 21.00 sec. Users per second: 1288
9938.4s 1224 Unable to load Cython Compute_Similarity, reverting to Python
9950.2s 1225 Similarity column 6969 (100.0%), 581.02 column/sec. Elapsed time 11.99 sec
9950.4s 1226 EvaluatorHoldout: Ignoring 38 ( 0.1%) Users that have less than 1 test interactions
9970.8s 1227 EvaluatorHoldout: Processed 27057 (100.0%) in 20.48 sec. Users per second: 1321
9971.3s 1228 Unable to load Cython Compute_Similarity, reverting to Python
9983.4s 1229 Similarity column 6969 (100.0%), 568.08 column/sec. Elapsed time 12.27 sec
9983.6s 1230 EvaluatorHoldout: Ignoring 32 ( 0.1%) Users that have less than 1 test interactions
10004.2s 1231 EvaluatorHoldout: Processed 27063 (100.0%) in 20.68 sec. Users per second: 1308
10004.2s 1232 [I 2025-12-07 00:04:35,088] Trial 49 finished with value: 0.2167609254128049 and parameters: {'topK': 52, 'shrink': 36, 'feature_weighting': 'TF-IDF'}. Best is trial 10 with value: 0.21699762942341766.
10004.2s 1233 
10004.2s 1234 [I 2025-12-07 00:04:35,088] Trial 49 finished with value: 0.2167609254128049 and parameters: {'topK': 52, 'shrink': 36, 'feature_weighting': 'TF-IDF'}. Best is trial 10 with value: 0.21699762942341766.
10004.3s 1235 [0.21719688941818013, 0.2167116018295625, 0.21579373278994593, 0.217839225675953, 0.21626317735038283]
10004.7s 1236 Unable to load Cython Compute_Similarity, reverting to Python
10017.4s 1237 Similarity column 6969 (100.0%), 540.96 column/sec. Elapsed time 12.88 sec
10017.6s 1238 EvaluatorHoldout: Ignoring 48 ( 0.2%) Users that have less than 1 test interactions
10043.7s 1239 EvaluatorHoldout: Processed 27047 (100.0%) in 26.16 sec. Users per second: 1034
10044.1s 1240 Unable to load Cython Compute_Similarity, reverting to Python
10056.8s 1241 Similarity column 6969 (100.0%), 543.57 column/sec. Elapsed time 12.82 sec
10057.0s 1242 EvaluatorHoldout: Ignoring 29 ( 0.1%) Users that have less than 1 test interactions
10082.6s 1243 EvaluatorHoldout: Processed 27066 (100.0%) in 25.69 sec. Users per second: 1054
10083.0s 1244 Unable to load Cython Compute_Similarity, reverting to Python
10095.3s 1245 Similarity column 6969 (100.0%), 559.69 column/sec. Elapsed time 12.45 sec
10095.5s 1246 EvaluatorHoldout: Ignoring 42 ( 0.2%) Users that have less than 1 test interactions
10122.0s 1247 EvaluatorHoldout: Processed 27053 (100.0%) in 26.59 sec. Users per second: 1017
10122.5s 1248 Unable to load Cython Compute_Similarity, reverting to Python
10135.8s 1249 Similarity column 6969 (100.0%), 515.12 column/sec. Elapsed time 13.53 sec
10136.0s 1250 EvaluatorHoldout: Ignoring 38 ( 0.1%) Users that have less than 1 test interactions
10162.2s 1251 EvaluatorHoldout: Processed 27057 (100.0%) in 26.23 sec. Users per second: 1032
10162.6s 1252 Unable to load Cython Compute_Similarity, reverting to Python
10174.9s 1253 Similarity column 6969 (100.0%), 561.93 column/sec. Elapsed time 12.40 sec
10175.1s 1254 EvaluatorHoldout: Ignoring 32 ( 0.1%) Users that have less than 1 test interactions
10201.1s 1255 EvaluatorHoldout: Processed 27063 (100.0%) in 26.09 sec. Users per second: 1037
10201.1s 1256 [I 2025-12-07 00:07:51,981] Trial 50 finished with value: 0.21556184973049097 and parameters: {'topK': 159, 'shrink': 345, 'feature_weighting': 'TF-IDF'}. Best is trial 10 with value: 0.21699762942341766.
10201.1s 1257 
10201.1s 1258 [I 2025-12-07 00:07:51,981] Trial 50 finished with value: 0.21556184973049097 and parameters: {'topK': 159, 'shrink': 345, 'feature_weighting': 'TF-IDF'}. Best is trial 10 with value: 0.21699762942341766.
10201.2s 1259 [0.21638167559251106, 0.21512501568514503, 0.21470771403280714, 0.2166242232448957, 0.21497062009709592]
10201.6s 1260 Unable to load Cython Compute_Similarity, reverting to Python
10213.2s 1261 Similarity column 6969 (100.0%), 588.52 column/sec. Elapsed time 11.84 sec
10213.4s 1262 EvaluatorHoldout: Ignoring 48 ( 0.2%) Users that have less than 1 test interactions
10234.4s 1263 EvaluatorHoldout: Processed 27047 (100.0%) in 21.06 sec. Users per second: 1284
10234.9s 1264 Unable to load Cython Compute_Similarity, reverting to Python
10246.5s 1265 Similarity column 6969 (100.0%), 591.68 column/sec. Elapsed time 11.78 sec
10246.7s 1266 EvaluatorHoldout: Ignoring 29 ( 0.1%) Users that have less than 1 test interactions
10267.7s 1267 EvaluatorHoldout: Processed 27066 (100.0%) in 21.12 sec. Users per second: 1282
10268.2s 1268 Unable to load Cython Compute_Similarity, reverting to Python
10280.0s 1269 Similarity column 6969 (100.0%), 578.34 column/sec. Elapsed time 12.05 sec
10280.2s 1270 EvaluatorHoldout: Ignoring 42 ( 0.2%) Users that have less than 1 test interactions
10301.4s 1271 EvaluatorHoldout: Processed 27053 (100.0%) in 21.26 sec. Users per second: 1272
10301.9s 1272 Unable to load Cython Compute_Similarity, reverting to Python
10313.7s 1273 Similarity column 6969 (100.0%), 579.88 column/sec. Elapsed time 12.02 sec
10313.9s 1274 EvaluatorHoldout: Ignoring 38 ( 0.1%) Users that have less than 1 test interactions
10335.0s 1275 EvaluatorHoldout: Processed 27057 (100.0%) in 21.18 sec. Users per second: 1278
10335.5s 1276 Unable to load Cython Compute_Similarity, reverting to Python
10347.9s 1277 Similarity column 6969 (100.0%), 550.97 column/sec. Elapsed time 12.65 sec
10348.1s 1278 EvaluatorHoldout: Ignoring 32 ( 0.1%) Users that have less than 1 test interactions
10369.2s 1279 EvaluatorHoldout: Processed 27063 (100.0%) in 21.17 sec. Users per second: 1278
10369.2s 1280 [I 2025-12-07 00:10:40,122] Trial 51 finished with value: 0.21705867461954864 and parameters: {'topK': 74, 'shrink': 0, 'feature_weighting': 'TF-IDF'}. Best is trial 51 with value: 0.21705867461954864.
10369.2s 1281 
10369.2s 1282 [I 2025-12-07 00:10:40,122] Trial 51 finished with value: 0.21705867461954864 and parameters: {'topK': 74, 'shrink': 0, 'feature_weighting': 'TF-IDF'}. Best is trial 51 with value: 0.21705867461954864.
10369.3s 1283 [0.21712447564553852, 0.21661366033063237, 0.21687996713153904, 0.21800287514023534, 0.216672394849798]
10369.7s 1284 Unable to load Cython Compute_Similarity, reverting to Python
10381.8s 1285 Similarity column 6969 (100.0%), 566.72 column/sec. Elapsed time 12.30 sec
10382.0s 1286 EvaluatorHoldout: Ignoring 48 ( 0.2%) Users that have less than 1 test interactions
10403.2s 1287 EvaluatorHoldout: Processed 27047 (100.0%) in 21.24 sec. Users per second: 1274
10403.6s 1288 Unable to load Cython Compute_Similarity, reverting to Python
10415.3s 1289 Similarity column 6969 (100.0%), 586.41 column/sec. Elapsed time 11.88 sec
10415.5s 1290 EvaluatorHoldout: Ignoring 29 ( 0.1%) Users that have less than 1 test interactions
10436.9s 1291 EvaluatorHoldout: Processed 27066 (100.0%) in 21.51 sec. Users per second: 1258
10437.4s 1292 Unable to load Cython Compute_Similarity, reverting to Python
10449.7s 1293 Similarity column 6969 (100.0%), 560.69 column/sec. Elapsed time 12.43 sec
10449.9s 1294 EvaluatorHoldout: Ignoring 42 ( 0.2%) Users that have less than 1 test interactions
10471.0s 1295 EvaluatorHoldout: Processed 27053 (100.0%) in 21.21 sec. Users per second: 1275
10471.4s 1296 Unable to load Cython Compute_Similarity, reverting to Python
10483.0s 1297 Similarity column 6969 (100.0%), 592.09 column/sec. Elapsed time 11.77 sec
10483.2s 1298 EvaluatorHoldout: Ignoring 38 ( 0.1%) Users that have less than 1 test interactions
10504.2s 1299 EvaluatorHoldout: Processed 27057 (100.0%) in 21.09 sec. Users per second: 1283
10504.7s 1300 Unable to load Cython Compute_Similarity, reverting to Python
10516.3s 1301 Similarity column 6969 (100.0%), 590.62 column/sec. Elapsed time 11.80 sec
10516.5s 1302 EvaluatorHoldout: Ignoring 32 ( 0.1%) Users that have less than 1 test interactions
10537.8s 1303 EvaluatorHoldout: Processed 27063 (100.0%) in 21.36 sec. Users per second: 1267
10537.8s 1304 [I 2025-12-07 00:13:28,660] Trial 52 finished with value: 0.21697820922082717 and parameters: {'topK': 73, 'shrink': 56, 'feature_weighting': 'TF-IDF'}. Best is trial 51 with value: 0.21705867461954864.
10537.8s 1305 
10537.8s 1306 [I 2025-12-07 00:13:28,660] Trial 52 finished with value: 0.21697820922082717 and parameters: {'topK': 73, 'shrink': 56, 'feature_weighting': 'TF-IDF'}. Best is trial 51 with value: 0.21705867461954864.
10537.9s 1307 [0.21718525659783466, 0.21657997666611903, 0.21657753687156156, 0.21795150796333582, 0.2165967680052849]
10538.2s 1308 Unable to load Cython Compute_Similarity, reverting to Python
10549.6s 1309 Similarity column 6969 (100.0%), 603.26 column/sec. Elapsed time 11.55 sec
10549.8s 1310 EvaluatorHoldout: Ignoring 48 ( 0.2%) Users that have less than 1 test interactions
10570.5s 1311 EvaluatorHoldout: Processed 27047 (100.0%) in 20.81 sec. Users per second: 1300
10571.0s 1312 Unable to load Cython Compute_Similarity, reverting to Python
10582.8s 1313 Similarity column 6969 (100.0%), 580.48 column/sec. Elapsed time 12.01 sec
10583.0s 1314 EvaluatorHoldout: Ignoring 29 ( 0.1%) Users that have less than 1 test interactions
10603.7s 1315 EvaluatorHoldout: Processed 27066 (100.0%) in 20.78 sec. Users per second: 1303
10604.2s 1316 Unable to load Cython Compute_Similarity, reverting to Python
10615.7s 1317 Similarity column 6969 (100.0%), 593.61 column/sec. Elapsed time 11.74 sec
10615.9s 1318 EvaluatorHoldout: Ignoring 42 ( 0.2%) Users that have less than 1 test interactions
10636.6s 1319 EvaluatorHoldout: Processed 27053 (100.0%) in 20.76 sec. Users per second: 1303
10637.0s 1320 Unable to load Cython Compute_Similarity, reverting to Python
10648.9s 1321 Similarity column 6969 (100.0%), 578.43 column/sec. Elapsed time 12.05 sec
10649.1s 1322 EvaluatorHoldout: Ignoring 38 ( 0.1%) Users that have less than 1 test interactions
10669.8s 1323 EvaluatorHoldout: Processed 27057 (100.0%) in 20.81 sec. Users per second: 1300
10670.3s 1324 Unable to load Cython Compute_Similarity, reverting to Python
10682.1s 1325 Similarity column 6969 (100.0%), 583.28 column/sec. Elapsed time 11.95 sec
10682.3s 1326 EvaluatorHoldout: Ignoring 32 ( 0.1%) Users that have less than 1 test interactions
10703.1s 1327 EvaluatorHoldout: Processed 27063 (100.0%) in 20.92 sec. Users per second: 1293
10703.1s 1328 [I 2025-12-07 00:16:13,998] Trial 53 finished with value: 0.2169626077715358 and parameters: {'topK': 70, 'shrink': 39, 'feature_weighting': 'TF-IDF'}. Best is trial 51 with value: 0.21705867461954864.
10703.1s 1329 
10703.1s 1330 [I 2025-12-07 00:16:13,998] Trial 53 finished with value: 0.2169626077715358 and parameters: {'topK': 70, 'shrink': 39, 'feature_weighting': 'TF-IDF'}. Best is trial 51 with value: 0.21705867461954864.
10703.2s 1331 [0.21730698693064107, 0.2165825552404096, 0.21623017449079998, 0.21794592166797164, 0.21674740052785674]
10703.6s 1332 Unable to load Cython Compute_Similarity, reverting to Python
10715.1s 1333 Similarity column 6969 (100.0%), 593.44 column/sec. Elapsed time 11.74 sec
10715.3s 1334 EvaluatorHoldout: Ignoring 48 ( 0.2%) Users that have less than 1 test interactions
10735.9s 1335 EvaluatorHoldout: Processed 27047 (100.0%) in 20.65 sec. Users per second: 1310
10736.4s 1336 Unable to load Cython Compute_Similarity, reverting to Python
10748.2s 1337 Similarity column 6969 (100.0%), 578.42 column/sec. Elapsed time 12.05 sec
10748.4s 1338 EvaluatorHoldout: Ignoring 29 ( 0.1%) Users that have less than 1 test interactions
10769.3s 1339 EvaluatorHoldout: Processed 27066 (100.0%) in 21.00 sec. Users per second: 1289
10769.8s 1340 Unable to load Cython Compute_Similarity, reverting to Python
10781.3s 1341 Similarity column 6969 (100.0%), 593.30 column/sec. Elapsed time 11.75 sec
10781.5s 1342 EvaluatorHoldout: Ignoring 42 ( 0.2%) Users that have less than 1 test interactions
10802.0s 1343 EvaluatorHoldout: Processed 27053 (100.0%) in 20.50 sec. Users per second: 1320
10802.4s 1344 Unable to load Cython Compute_Similarity, reverting to Python
10813.8s 1345 Similarity column 6969 (100.0%), 599.02 column/sec. Elapsed time 11.63 sec
10814.1s 1346 EvaluatorHoldout: Ignoring 38 ( 0.1%) Users that have less than 1 test interactions
10834.8s 1347 EvaluatorHoldout: Processed 27057 (100.0%) in 20.88 sec. Users per second: 1296
10835.3s 1348 Unable to load Cython Compute_Similarity, reverting to Python
10846.8s 1349 Similarity column 6969 (100.0%), 595.63 column/sec. Elapsed time 11.70 sec
10847.0s 1350 EvaluatorHoldout: Ignoring 32 ( 0.1%) Users that have less than 1 test interactions
10868.0s 1351 EvaluatorHoldout: Processed 27063 (100.0%) in 21.06 sec. Users per second: 1285
10868.0s 1352 [I 2025-12-07 00:18:58,881] Trial 54 finished with value: 0.21706238132685302 and parameters: {'topK': 73, 'shrink': 1, 'feature_weighting': 'TF-IDF'}. Best is trial 54 with value: 0.21706238132685302.
10868.0s 1353 
