3536.0s 490 [I 2025-12-07 09:52:51,483] Trial 18 finished with value: 0.21580193435399644 and parameters: {'similarity': 'cosine', 'topK': 152, 'shrink': 192}. Best is trial 17 with value: 0.21644456884223776.
3536.2s 491 [0.21529731415959036, 0.21577350738428439, 0.21608054298503826, 0.2148952827322255, 0.21696302450884367]
3536.5s 492 Unable to load Cython Compute_Similarity, reverting to Python
3549.4s 493 Similarity column 6969 (100.0%), 531.66 column/sec. Elapsed time 13.11 sec
3549.6s 494 EvaluatorHoldout: Ignoring 33 ( 0.1%) Users that have less than 1 test interactions
3576.6s 495 EvaluatorHoldout: Processed 27062 (100.0%) in 27.09 sec. Users per second: 999
3577.1s 496 Unable to load Cython Compute_Similarity, reverting to Python
3589.9s 497 Similarity column 6969 (100.0%), 534.57 column/sec. Elapsed time 13.04 sec
3590.1s 498 EvaluatorHoldout: Ignoring 28 ( 0.1%) Users that have less than 1 test interactions
3617.2s 499 EvaluatorHoldout: Processed 27067 (100.0%) in 27.19 sec. Users per second: 995
3617.7s 500 Unable to load Cython Compute_Similarity, reverting to Python
3630.4s 501 Similarity column 6969 (100.0%), 541.94 column/sec. Elapsed time 12.86 sec
3630.6s 502 EvaluatorHoldout: Ignoring 40 ( 0.1%) Users that have less than 1 test interactions
3657.5s 503 EvaluatorHoldout: Processed 27055 (100.0%) in 27.05 sec. Users per second: 1000
3658.0s 504 Unable to load Cython Compute_Similarity, reverting to Python
3670.7s 505 Similarity column 6969 (100.0%), 541.28 column/sec. Elapsed time 12.88 sec
3670.9s 506 EvaluatorHoldout: Ignoring 21 ( 0.1%) Users that have less than 1 test interactions
3697.9s 507 EvaluatorHoldout: Processed 27074 (100.0%) in 27.09 sec. Users per second: 999
3698.4s 508 Unable to load Cython Compute_Similarity, reverting to Python
3710.9s 509 Similarity column 6969 (100.0%), 548.05 column/sec. Elapsed time 12.72 sec
3711.1s 510 EvaluatorHoldout: Ignoring 29 ( 0.1%) Users that have less than 1 test interactions
3738.0s 511 EvaluatorHoldout: Processed 27066 (100.0%) in 26.96 sec. Users per second: 1004
3738.0s 512 [I 2025-12-07 09:56:13,506] Trial 19 finished with value: 0.20808175395779066 and parameters: {'similarity': 'cosine', 'topK': 497, 'shrink': 224}. Best is trial 17 with value: 0.21644456884223776.
3738.0s 513 
3738.0s 514 [I 2025-12-07 09:56:13,506] Trial 19 finished with value: 0.20808175395779066 and parameters: {'similarity': 'cosine', 'topK': 497, 'shrink': 224}. Best is trial 17 with value: 0.21644456884223776.
3738.2s 515 [0.20739067200118882, 0.20851750853261625, 0.20799478027817006, 0.20745448708763414, 0.20905132188934397]
3738.5s 516 Unable to load Cython Compute_Similarity, reverting to Python
3750.1s 517 Similarity column 6969 (100.0%), 592.97 column/sec. Elapsed time 11.75 sec
3750.2s 518 EvaluatorHoldout: Ignoring 33 ( 0.1%) Users that have less than 1 test interactions
3773.8s 519 EvaluatorHoldout: Processed 27062 (100.0%) in 23.73 sec. Users per second: 1141
3774.3s 520 Unable to load Cython Compute_Similarity, reverting to Python
3786.2s 521 Similarity column 6969 (100.0%), 579.46 column/sec. Elapsed time 12.03 sec
3786.4s 522 EvaluatorHoldout: Ignoring 28 ( 0.1%) Users that have less than 1 test interactions
3810.0s 523 EvaluatorHoldout: Processed 27067 (100.0%) in 23.76 sec. Users per second: 1139
3810.5s 524 Unable to load Cython Compute_Similarity, reverting to Python
3822.0s 525 Similarity column 6969 (100.0%), 594.42 column/sec. Elapsed time 11.72 sec
3822.2s 526 EvaluatorHoldout: Ignoring 40 ( 0.1%) Users that have less than 1 test interactions
3845.7s 527 EvaluatorHoldout: Processed 27055 (100.0%) in 23.59 sec. Users per second: 1147
3846.2s 528 Unable to load Cython Compute_Similarity, reverting to Python
3857.8s 529 Similarity column 6969 (100.0%), 592.00 column/sec. Elapsed time 11.77 sec
3857.9s 530 EvaluatorHoldout: Ignoring 21 ( 0.1%) Users that have less than 1 test interactions
3881.8s 531 EvaluatorHoldout: Processed 27074 (100.0%) in 23.98 sec. Users per second: 1129
3882.3s 532 Unable to load Cython Compute_Similarity, reverting to Python
3893.7s 533 Similarity column 6969 (100.0%), 601.25 column/sec. Elapsed time 11.59 sec
3893.9s 534 EvaluatorHoldout: Ignoring 29 ( 0.1%) Users that have less than 1 test interactions
3917.7s 535 EvaluatorHoldout: Processed 27066 (100.0%) in 23.94 sec. Users per second: 1131
3917.7s 536 [I 2025-12-07 09:59:13,207] Trial 20 finished with value: 0.1317768748935751 and parameters: {'similarity': 'tversky', 'topK': 325, 'shrink': 28, 'tversky_alpha': 1.9175419051022993, 'tversky_beta': 0.16979022398153842}. Best is trial 17 with value: 0.21644456884223776.
3917.7s 537 
3917.7s 538 [I 2025-12-07 09:59:13,207] Trial 20 finished with value: 0.1317768748935751 and parameters: {'similarity': 'tversky', 'topK': 325, 'shrink': 28, 'tversky_alpha': 1.9175419051022993, 'tversky_beta': 0.16979022398153842}. Best is trial 17 with value: 0.21644456884223776.
3917.9s 539 [0.13210318325128992, 0.13166043958876836, 0.13248732992927031, 0.13115487572479856, 0.13147854597374817]
3918.2s 540 Unable to load Cython Compute_Similarity, reverting to Python
3927.9s 541 Similarity column 6969 (100.0%), 704.75 column/sec. Elapsed time 9.89 sec
3928.1s 542 EvaluatorHoldout: Ignoring 33 ( 0.1%) Users that have less than 1 test interactions
3948.6s 543 EvaluatorHoldout: Processed 27062 (100.0%) in 20.70 sec. Users per second: 1307
3949.1s 544 Unable to load Cython Compute_Similarity, reverting to Python
3959.2s 545 Similarity column 6969 (100.0%), 677.58 column/sec. Elapsed time 10.29 sec
3959.4s 546 EvaluatorHoldout: Ignoring 28 ( 0.1%) Users that have less than 1 test interactions
3980.2s 547 EvaluatorHoldout: Processed 27067 (100.0%) in 20.95 sec. Users per second: 1292
3980.7s 548 Unable to load Cython Compute_Similarity, reverting to Python
3990.5s 549 Similarity column 6969 (100.0%), 695.43 column/sec. Elapsed time 10.02 sec
3990.7s 550 EvaluatorHoldout: Ignoring 40 ( 0.1%) Users that have less than 1 test interactions
4011.4s 551 EvaluatorHoldout: Processed 27055 (100.0%) in 20.80 sec. Users per second: 1301
4011.9s 552 Unable to load Cython Compute_Similarity, reverting to Python
4021.6s 553 Similarity column 6969 (100.0%), 705.44 column/sec. Elapsed time 9.88 sec
4021.7s 554 EvaluatorHoldout: Ignoring 21 ( 0.1%) Users that have less than 1 test interactions
4042.3s 555 EvaluatorHoldout: Processed 27074 (100.0%) in 20.72 sec. Users per second: 1307
4042.8s 556 Unable to load Cython Compute_Similarity, reverting to Python
4052.5s 557 Similarity column 6969 (100.0%), 707.26 column/sec. Elapsed time 9.85 sec
4052.7s 558 EvaluatorHoldout: Ignoring 29 ( 0.1%) Users that have less than 1 test interactions
4073.4s 559 EvaluatorHoldout: Processed 27066 (100.0%) in 20.84 sec. Users per second: 1299
4073.4s 560 [I 2025-12-07 10:01:48,877] Trial 21 finished with value: 0.2153545377603392 and parameters: {'similarity': 'cosine', 'topK': 169, 'shrink': 181}. Best is trial 17 with value: 0.21644456884223776.
4073.4s 561 
4073.4s 562 [I 2025-12-07 10:01:48,877] Trial 21 finished with value: 0.2153545377603392 and parameters: {'similarity': 'cosine', 'topK': 169, 'shrink': 181}. Best is trial 17 with value: 0.21644456884223776.
4073.6s 563 [0.214804017610379, 0.2156048105671319, 0.21514558543037882, 0.21435326350404976, 0.21686501168975658]
4073.9s 564 Unable to load Cython Compute_Similarity, reverting to Python
4083.2s 565 Similarity column 6969 (100.0%), 736.01 column/sec. Elapsed time 9.47 sec
4083.3s 566 EvaluatorHoldout: Ignoring 33 ( 0.1%) Users that have less than 1 test interactions
4102.2s 567 EvaluatorHoldout: Processed 27062 (100.0%) in 19.08 sec. Users per second: 1418
4102.7s 568 Unable to load Cython Compute_Similarity, reverting to Python
4112.1s 569 Similarity column 6969 (100.0%), 728.67 column/sec. Elapsed time 9.56 sec
4112.3s 570 EvaluatorHoldout: Ignoring 28 ( 0.1%) Users that have less than 1 test interactions
4131.7s 571 EvaluatorHoldout: Processed 27067 (100.0%) in 19.47 sec. Users per second: 1390
4132.1s 572 Unable to load Cython Compute_Similarity, reverting to Python
4141.7s 573 Similarity column 6969 (100.0%), 712.03 column/sec. Elapsed time 9.79 sec
4141.9s 574 EvaluatorHoldout: Ignoring 40 ( 0.1%) Users that have less than 1 test interactions
4161.6s 575 EvaluatorHoldout: Processed 27055 (100.0%) in 19.81 sec. Users per second: 1366
4162.1s 576 Unable to load Cython Compute_Similarity, reverting to Python
4172.4s 577 Similarity column 6969 (100.0%), 663.55 column/sec. Elapsed time 10.50 sec
4172.6s 578 EvaluatorHoldout: Ignoring 21 ( 0.1%) Users that have less than 1 test interactions
4192.1s 579 EvaluatorHoldout: Processed 27074 (100.0%) in 19.65 sec. Users per second: 1378
4192.6s 580 Unable to load Cython Compute_Similarity, reverting to Python
4202.2s 581 Similarity column 6969 (100.0%), 709.79 column/sec. Elapsed time 9.82 sec
4202.4s 582 EvaluatorHoldout: Ignoring 29 ( 0.1%) Users that have less than 1 test interactions
4221.7s 583 EvaluatorHoldout: Processed 27066 (100.0%) in 19.52 sec. Users per second: 1387
4221.7s 584 [I 2025-12-07 10:04:17,254] Trial 22 finished with value: 0.21646273460135723 and parameters: {'similarity': 'cosine', 'topK': 108, 'shrink': 262}. Best is trial 22 with value: 0.21646273460135723.
4221.7s 585 
4221.7s 586 [I 2025-12-07 10:04:17,254] Trial 22 finished with value: 0.21646273460135723 and parameters: {'similarity': 'cosine', 'topK': 108, 'shrink': 262}. Best is trial 22 with value: 0.21646273460135723.
4221.9s 587 [0.2154878435673156, 0.2164849411175443, 0.21786900398433895, 0.21573220207029925, 0.21673968226728807]
4222.2s 588 Unable to load Cython Compute_Similarity, reverting to Python
4232.0s 589 Similarity column 6969 (100.0%), 698.33 column/sec. Elapsed time 9.98 sec
4232.2s 590 EvaluatorHoldout: Ignoring 33 ( 0.1%) Users that have less than 1 test interactions
4251.4s 591 EvaluatorHoldout: Processed 27062 (100.0%) in 19.36 sec. Users per second: 1398
4251.9s 592 Unable to load Cython Compute_Similarity, reverting to Python
4261.6s 593 Similarity column 6969 (100.0%), 706.33 column/sec. Elapsed time 9.87 sec
4261.8s 594 EvaluatorHoldout: Ignoring 28 ( 0.1%) Users that have less than 1 test interactions
4281.3s 595 EvaluatorHoldout: Processed 27067 (100.0%) in 19.62 sec. Users per second: 1380
4281.7s 596 Unable to load Cython Compute_Similarity, reverting to Python
4291.2s 597 Similarity column 6969 (100.0%), 722.27 column/sec. Elapsed time 9.65 sec
4291.4s 598 EvaluatorHoldout: Ignoring 40 ( 0.1%) Users that have less than 1 test interactions
4310.8s 599 EvaluatorHoldout: Processed 27055 (100.0%) in 19.57 sec. Users per second: 1383
4311.3s 600 Unable to load Cython Compute_Similarity, reverting to Python
4320.8s 601 Similarity column 6969 (100.0%), 717.70 column/sec. Elapsed time 9.71 sec
4321.0s 602 EvaluatorHoldout: Ignoring 21 ( 0.1%) Users that have less than 1 test interactions
4340.4s 603 EvaluatorHoldout: Processed 27074 (100.0%) in 19.51 sec. Users per second: 1388
4340.9s 604 Unable to load Cython Compute_Similarity, reverting to Python
4350.2s 605 Similarity column 6969 (100.0%), 731.55 column/sec. Elapsed time 9.53 sec
4350.4s 606 EvaluatorHoldout: Ignoring 29 ( 0.1%) Users that have less than 1 test interactions
4369.5s 607 EvaluatorHoldout: Processed 27066 (100.0%) in 19.30 sec. Users per second: 1402
4369.5s 608 [I 2025-12-07 10:06:45,048] Trial 23 finished with value: 0.21652035948784162 and parameters: {'similarity': 'cosine', 'topK': 106, 'shrink': 272}. Best is trial 23 with value: 0.21652035948784162.
4369.5s 609 
4369.5s 610 [I 2025-12-07 10:06:45,048] Trial 23 finished with value: 0.21652035948784162 and parameters: {'similarity': 'cosine', 'topK': 106, 'shrink': 272}. Best is trial 23 with value: 0.21652035948784162.
4369.7s 611 [0.2154812872415075, 0.21655675012570824, 0.2178694092689922, 0.21581433655770063, 0.21688001424529962]
4370.0s 612 Unable to load Cython Compute_Similarity, reverting to Python
4380.9s 613 Similarity column 6969 (100.0%), 628.18 column/sec. Elapsed time 11.09 sec
4381.1s 614 EvaluatorHoldout: Ignoring 33 ( 0.1%) Users that have less than 1 test interactions
4404.4s 615 EvaluatorHoldout: Processed 27062 (100.0%) in 23.45 sec. Users per second: 1154
4404.9s 616 Unable to load Cython Compute_Similarity, reverting to Python
4415.9s 617 Similarity column 6969 (100.0%), 626.10 column/sec. Elapsed time 11.13 sec
4416.1s 618 EvaluatorHoldout: Ignoring 28 ( 0.1%) Users that have less than 1 test interactions
4439.6s 619 EvaluatorHoldout: Processed 27067 (100.0%) in 23.70 sec. Users per second: 1142
4440.1s 620 Unable to load Cython Compute_Similarity, reverting to Python
4451.3s 621 Similarity column 6969 (100.0%), 617.20 column/sec. Elapsed time 11.29 sec
4451.4s 622 EvaluatorHoldout: Ignoring 40 ( 0.1%) Users that have less than 1 test interactions
4474.7s 623 EvaluatorHoldout: Processed 27055 (100.0%) in 23.44 sec. Users per second: 1154
4475.2s 624 Unable to load Cython Compute_Similarity, reverting to Python
4486.0s 625 Similarity column 6969 (100.0%), 638.79 column/sec. Elapsed time 10.91 sec
4486.1s 626 EvaluatorHoldout: Ignoring 21 ( 0.1%) Users that have less than 1 test interactions
4509.3s 627 EvaluatorHoldout: Processed 27074 (100.0%) in 23.28 sec. Users per second: 1163
4509.8s 628 Unable to load Cython Compute_Similarity, reverting to Python
4520.3s 629 Similarity column 6969 (100.0%), 649.60 column/sec. Elapsed time 10.73 sec
4520.5s 630 EvaluatorHoldout: Ignoring 29 ( 0.1%) Users that have less than 1 test interactions
4543.7s 631 EvaluatorHoldout: Processed 27066 (100.0%) in 23.29 sec. Users per second: 1162
4543.7s 632 [I 2025-12-07 10:09:39,180] Trial 24 finished with value: 0.21357835939236378 and parameters: {'similarity': 'cosine', 'topK': 257, 'shrink': 302}. Best is trial 23 with value: 0.21652035948784162.
4543.7s 633 
4543.7s 634 [I 2025-12-07 10:09:39,180] Trial 24 finished with value: 0.21357835939236378 and parameters: {'similarity': 'cosine', 'topK': 257, 'shrink': 302}. Best is trial 23 with value: 0.21652035948784162.
4543.9s 635 [0.21308113521434152, 0.21416845700361326, 0.21303860636066274, 0.212876490709812, 0.21472710767338934]
4544.2s 636 Unable to load Cython Compute_Similarity, reverting to Python
4553.2s 637 Similarity column 6969 (100.0%), 760.73 column/sec. Elapsed time 9.16 sec
4553.3s 638 EvaluatorHoldout: Ignoring 33 ( 0.1%) Users that have less than 1 test interactions
4568.3s 639 EvaluatorHoldout: Processed 27062 (100.0%) in 15.10 sec. Users per second: 1793
4568.7s 640 Unable to load Cython Compute_Similarity, reverting to Python
4577.7s 641 Similarity column 6969 (100.0%), 759.18 column/sec. Elapsed time 9.18 sec
4577.9s 642 EvaluatorHoldout: Ignoring 28 ( 0.1%) Users that have less than 1 test interactions
4593.1s 643 EvaluatorHoldout: Processed 27067 (100.0%) in 15.28 sec. Users per second: 1772
4593.5s 644 Unable to load Cython Compute_Similarity, reverting to Python
4602.8s 645 Similarity column 6969 (100.0%), 736.92 column/sec. Elapsed time 9.46 sec
4603.0s 646 EvaluatorHoldout: Ignoring 40 ( 0.1%) Users that have less than 1 test interactions
4618.0s 647 EvaluatorHoldout: Processed 27055 (100.0%) in 15.18 sec. Users per second: 1782
4618.5s 648 Unable to load Cython Compute_Similarity, reverting to Python
4627.7s 649 Similarity column 6969 (100.0%), 742.14 column/sec. Elapsed time 9.39 sec
4627.9s 650 EvaluatorHoldout: Ignoring 21 ( 0.1%) Users that have less than 1 test interactions
4642.9s 651 EvaluatorHoldout: Processed 27074 (100.0%) in 15.22 sec. Users per second: 1779
4643.4s 652 Unable to load Cython Compute_Similarity, reverting to Python
4652.9s 653 Similarity column 6969 (100.0%), 722.53 column/sec. Elapsed time 9.65 sec
4653.1s 654 EvaluatorHoldout: Ignoring 29 ( 0.1%) Users that have less than 1 test interactions
4668.2s 655 EvaluatorHoldout: Processed 27066 (100.0%) in 15.23 sec. Users per second: 1777
4668.2s 656 [I 2025-12-07 10:11:43,675] Trial 25 finished with value: 0.23558901566404508 and parameters: {'similarity': 'asymmetric', 'topK': 78, 'shrink': 493, 'asymmetric_alpha': 0.09323361616619485}. Best is trial 25 with value: 0.23558901566404508.
4668.2s 657 
4668.2s 658 [I 2025-12-07 10:11:43,675] Trial 25 finished with value: 0.23558901566404508 and parameters: {'similarity': 'asymmetric', 'topK': 78, 'shrink': 493, 'asymmetric_alpha': 0.09323361616619485}. Best is trial 25 with value: 0.23558901566404508.
4668.4s 659 [0.23508619685168725, 0.23543687796417373, 0.23637335662502865, 0.23486344597860884, 0.23618520090072695]
4668.7s 660 Unable to load Cython Compute_Similarity, reverting to Python
4677.7s 661 Similarity column 6969 (100.0%), 755.56 column/sec. Elapsed time 9.22 sec
4677.9s 662 EvaluatorHoldout: Ignoring 33 ( 0.1%) Users that have less than 1 test interactions
4692.8s 663 EvaluatorHoldout: Processed 27062 (100.0%) in 15.04 sec. Users per second: 1799
4693.3s 664 Unable to load Cython Compute_Similarity, reverting to Python
4702.4s 665 Similarity column 6969 (100.0%), 752.25 column/sec. Elapsed time 9.26 sec
4702.5s 666 EvaluatorHoldout: Ignoring 28 ( 0.1%) Users that have less than 1 test interactions
4717.5s 667 EvaluatorHoldout: Processed 27067 (100.0%) in 15.12 sec. Users per second: 1790
4718.0s 668 Unable to load Cython Compute_Similarity, reverting to Python
4727.1s 669 Similarity column 6969 (100.0%), 750.80 column/sec. Elapsed time 9.28 sec
4727.3s 670 EvaluatorHoldout: Ignoring 40 ( 0.1%) Users that have less than 1 test interactions
4742.2s 671 EvaluatorHoldout: Processed 27055 (100.0%) in 15.11 sec. Users per second: 1791
4742.7s 672 Unable to load Cython Compute_Similarity, reverting to Python
4752.2s 673 Similarity column 6969 (100.0%), 719.56 column/sec. Elapsed time 9.69 sec
4752.4s 674 EvaluatorHoldout: Ignoring 21 ( 0.1%) Users that have less than 1 test interactions
4767.3s 675 EvaluatorHoldout: Processed 27074 (100.0%) in 15.08 sec. Users per second: 1796
4767.8s 676 Unable to load Cython Compute_Similarity, reverting to Python
4776.9s 677 Similarity column 6969 (100.0%), 751.63 column/sec. Elapsed time 9.27 sec
4777.0s 678 EvaluatorHoldout: Ignoring 29 ( 0.1%) Users that have less than 1 test interactions
4791.9s 679 EvaluatorHoldout: Processed 27066 (100.0%) in 15.07 sec. Users per second: 1796
4792.0s 680 [I 2025-12-07 10:13:47,470] Trial 26 finished with value: 0.23664908540282648 and parameters: {'similarity': 'asymmetric', 'topK': 74, 'shrink': 499, 'asymmetric_alpha': 0.07736730624743306}. Best is trial 26 with value: 0.23664908540282648.
4792.0s 681 
4792.0s 682 [I 2025-12-07 10:13:47,470] Trial 26 finished with value: 0.23664908540282648 and parameters: {'similarity': 'asymmetric', 'topK': 74, 'shrink': 499, 'asymmetric_alpha': 0.07736730624743306}. Best is trial 26 with value: 0.23664908540282648.
4792.1s 683 [0.2368017352327897, 0.2362964656542247, 0.23766476841713283, 0.23507609875722757, 0.23740635895275766]
4792.4s 684 Unable to load Cython Compute_Similarity, reverting to Python
4804.4s 685 Similarity column 6969 (100.0%), 572.60 column/sec. Elapsed time 12.17 sec
4804.6s 686 EvaluatorHoldout: Ignoring 33 ( 0.1%) Users that have less than 1 test interactions
4823.0s 687 EvaluatorHoldout: Processed 27062 (100.0%) in 18.41 sec. Users per second: 1470
4823.4s 688 Unable to load Cython Compute_Similarity, reverting to Python
4835.6s 689 Similarity column 6969 (100.0%), 563.37 column/sec. Elapsed time 12.37 sec
4835.8s 690 EvaluatorHoldout: Ignoring 28 ( 0.1%) Users that have less than 1 test interactions
4854.4s 691 EvaluatorHoldout: Processed 27067 (100.0%) in 18.67 sec. Users per second: 1450
4854.8s 692 Unable to load Cython Compute_Similarity, reverting to Python
4866.7s 693 Similarity column 6969 (100.0%), 580.75 column/sec. Elapsed time 12.00 sec
4866.9s 694 EvaluatorHoldout: Ignoring 40 ( 0.1%) Users that have less than 1 test interactions
4884.8s 695 EvaluatorHoldout: Processed 27055 (100.0%) in 18.07 sec. Users per second: 1497
4885.3s 696 Unable to load Cython Compute_Similarity, reverting to Python
4897.4s 697 Similarity column 6969 (100.0%), 567.95 column/sec. Elapsed time 12.27 sec
4897.6s 698 EvaluatorHoldout: Ignoring 21 ( 0.1%) Users that have less than 1 test interactions
4916.3s 699 EvaluatorHoldout: Processed 27074 (100.0%) in 18.76 sec. Users per second: 1443
4916.7s 700 Unable to load Cython Compute_Similarity, reverting to Python
4928.6s 701 Similarity column 6969 (100.0%), 576.29 column/sec. Elapsed time 12.09 sec
4928.8s 702 EvaluatorHoldout: Ignoring 29 ( 0.1%) Users that have less than 1 test interactions
4947.4s 703 EvaluatorHoldout: Processed 27066 (100.0%) in 18.62 sec. Users per second: 1454
4947.4s 704 [I 2025-12-07 10:16:22,854] Trial 27 finished with value: 0.20883401425257064 and parameters: {'similarity': 'asymmetric', 'topK': 414, 'shrink': 517, 'asymmetric_alpha': 0.06389264736013123}. Best is trial 26 with value: 0.23664908540282648.
4947.4s 705 
