6194.1s 922 [I 2025-12-07 10:37:09,546] Trial 36 finished with value: 0.18057182487433993 and parameters: {'similarity': 'asymmetric', 'topK': 232, 'shrink': 590, 'asymmetric_alpha': 0.7754574747962106}. Best is trial 28 with value: 0.23872565913262506.
6194.2s 923 [0.18033582979834323, 0.18043288763010015, 0.18080803449491523, 0.1798736654446829, 0.18140870700365816]
6194.5s 924 Unable to load Cython Compute_Similarity, reverting to Python
6208.2s 925 Similarity column 6969 (100.0%), 503.57 column/sec. Elapsed time 13.84 sec
6208.4s 926 EvaluatorHoldout: Ignoring 33 ( 0.1%) Users that have less than 1 test interactions
6232.7s 927 EvaluatorHoldout: Processed 27062 (100.0%) in 24.40 sec. Users per second: 1109
6233.2s 928 Unable to load Cython Compute_Similarity, reverting to Python
6246.7s 929 Similarity column 6969 (100.0%), 507.18 column/sec. Elapsed time 13.74 sec
6246.9s 930 EvaluatorHoldout: Ignoring 28 ( 0.1%) Users that have less than 1 test interactions
6270.7s 931 EvaluatorHoldout: Processed 27067 (100.0%) in 23.82 sec. Users per second: 1136
6271.2s 932 Unable to load Cython Compute_Similarity, reverting to Python
6284.3s 933 Similarity column 6969 (100.0%), 523.33 column/sec. Elapsed time 13.32 sec
6284.5s 934 EvaluatorHoldout: Ignoring 40 ( 0.1%) Users that have less than 1 test interactions
6308.2s 935 EvaluatorHoldout: Processed 27055 (100.0%) in 23.71 sec. Users per second: 1141
6308.6s 936 Unable to load Cython Compute_Similarity, reverting to Python
6322.0s 937 Similarity column 6969 (100.0%), 513.66 column/sec. Elapsed time 13.57 sec
6322.2s 938 EvaluatorHoldout: Ignoring 21 ( 0.1%) Users that have less than 1 test interactions
6346.2s 939 EvaluatorHoldout: Processed 27074 (100.0%) in 24.00 sec. Users per second: 1128
6346.6s 940 Unable to load Cython Compute_Similarity, reverting to Python
6360.1s 941 Similarity column 6969 (100.0%), 510.02 column/sec. Elapsed time 13.66 sec
6360.3s 942 EvaluatorHoldout: Ignoring 29 ( 0.1%) Users that have less than 1 test interactions
6384.4s 943 EvaluatorHoldout: Processed 27066 (100.0%) in 24.14 sec. Users per second: 1121
6384.4s 944 [I 2025-12-07 10:40:19,870] Trial 37 finished with value: 0.1917195570128851 and parameters: {'similarity': 'asymmetric', 'topK': 589, 'shrink': 402, 'asymmetric_alpha': 0.30552631361883714}. Best is trial 28 with value: 0.23872565913262506.
6384.4s 945 
6384.4s 946 [I 2025-12-07 10:40:19,870] Trial 37 finished with value: 0.1917195570128851 and parameters: {'similarity': 'asymmetric', 'topK': 589, 'shrink': 402, 'asymmetric_alpha': 0.30552631361883714}. Best is trial 28 with value: 0.23872565913262506.
6384.5s 947 [0.1910688096311101, 0.1917322345510237, 0.19178579701744072, 0.1913702396477659, 0.19264070421708515]
6384.9s 948 Unable to load Cython Compute_Similarity, reverting to Python
6394.5s 949 Similarity column 6969 (100.0%), 706.02 column/sec. Elapsed time 9.87 sec
6394.7s 950 EvaluatorHoldout: Ignoring 33 ( 0.1%) Users that have less than 1 test interactions
6410.0s 951 EvaluatorHoldout: Processed 27062 (100.0%) in 15.44 sec. Users per second: 1753
6410.5s 952 Unable to load Cython Compute_Similarity, reverting to Python
6420.2s 953 Similarity column 6969 (100.0%), 711.61 column/sec. Elapsed time 9.79 sec
6420.3s 954 EvaluatorHoldout: Ignoring 28 ( 0.1%) Users that have less than 1 test interactions
6435.3s 955 EvaluatorHoldout: Processed 27067 (100.0%) in 15.13 sec. Users per second: 1789
6435.8s 956 Unable to load Cython Compute_Similarity, reverting to Python
6445.3s 957 Similarity column 6969 (100.0%), 718.94 column/sec. Elapsed time 9.69 sec
6445.5s 958 EvaluatorHoldout: Ignoring 40 ( 0.1%) Users that have less than 1 test interactions
6460.8s 959 EvaluatorHoldout: Processed 27055 (100.0%) in 15.39 sec. Users per second: 1758
6461.2s 960 Unable to load Cython Compute_Similarity, reverting to Python
6470.8s 961 Similarity column 6969 (100.0%), 716.03 column/sec. Elapsed time 9.73 sec
6471.0s 962 EvaluatorHoldout: Ignoring 21 ( 0.1%) Users that have less than 1 test interactions
6486.3s 963 EvaluatorHoldout: Processed 27074 (100.0%) in 15.49 sec. Users per second: 1748
6486.8s 964 Unable to load Cython Compute_Similarity, reverting to Python
6496.3s 965 Similarity column 6969 (100.0%), 720.78 column/sec. Elapsed time 9.67 sec
6496.5s 966 EvaluatorHoldout: Ignoring 29 ( 0.1%) Users that have less than 1 test interactions
6511.7s 967 EvaluatorHoldout: Processed 27066 (100.0%) in 15.42 sec. Users per second: 1756
6511.7s 968 [I 2025-12-07 10:42:27,239] Trial 38 finished with value: 0.22734910943767814 and parameters: {'similarity': 'asymmetric', 'topK': 145, 'shrink': 331, 'asymmetric_alpha': 0.004219968693503131}. Best is trial 28 with value: 0.23872565913262506.
6511.7s 969 
6511.7s 970 [I 2025-12-07 10:42:27,239] Trial 38 finished with value: 0.22734910943767814 and parameters: {'similarity': 'asymmetric', 'topK': 145, 'shrink': 331, 'asymmetric_alpha': 0.004219968693503131}. Best is trial 28 with value: 0.23872565913262506.
6511.9s 971 [0.2269219505299576, 0.22641110214212418, 0.2289998667941403, 0.22605483303346688, 0.22835779468870174]
6512.2s 972 Unable to load Cython Compute_Similarity, reverting to Python
6521.1s 973 Similarity column 6969 (100.0%), 767.72 column/sec. Elapsed time 9.08 sec
6521.3s 974 EvaluatorHoldout: Ignoring 33 ( 0.1%) Users that have less than 1 test interactions
6538.5s 975 EvaluatorHoldout: Processed 27062 (100.0%) in 17.33 sec. Users per second: 1561
6539.0s 976 Unable to load Cython Compute_Similarity, reverting to Python
6547.8s 977 Similarity column 6969 (100.0%), 770.60 column/sec. Elapsed time 9.04 sec
6548.0s 978 EvaluatorHoldout: Ignoring 28 ( 0.1%) Users that have less than 1 test interactions
6565.1s 979 EvaluatorHoldout: Processed 27067 (100.0%) in 17.31 sec. Users per second: 1564
6565.6s 980 Unable to load Cython Compute_Similarity, reverting to Python
6574.8s 981 Similarity column 6969 (100.0%), 749.19 column/sec. Elapsed time 9.30 sec
6574.9s 982 EvaluatorHoldout: Ignoring 40 ( 0.1%) Users that have less than 1 test interactions
6592.1s 983 EvaluatorHoldout: Processed 27055 (100.0%) in 17.36 sec. Users per second: 1559
6592.6s 984 Unable to load Cython Compute_Similarity, reverting to Python
6601.7s 985 Similarity column 6969 (100.0%), 749.37 column/sec. Elapsed time 9.30 sec
6601.9s 986 EvaluatorHoldout: Ignoring 21 ( 0.1%) Users that have less than 1 test interactions
6619.1s 987 EvaluatorHoldout: Processed 27074 (100.0%) in 17.35 sec. Users per second: 1560
6619.6s 988 Unable to load Cython Compute_Similarity, reverting to Python
6628.5s 989 Similarity column 6969 (100.0%), 766.65 column/sec. Elapsed time 9.09 sec
6628.7s 990 EvaluatorHoldout: Ignoring 29 ( 0.1%) Users that have less than 1 test interactions
6645.9s 991 EvaluatorHoldout: Processed 27066 (100.0%) in 17.41 sec. Users per second: 1555
6645.9s 992 [I 2025-12-07 10:44:41,442] Trial 39 finished with value: 0.19851468365307853 and parameters: {'similarity': 'dice', 'topK': 66, 'shrink': 769}. Best is trial 28 with value: 0.23872565913262506.
6645.9s 993 
6645.9s 994 [I 2025-12-07 10:44:41,442] Trial 39 finished with value: 0.19851468365307853 and parameters: {'similarity': 'dice', 'topK': 66, 'shrink': 769}. Best is trial 28 with value: 0.23872565913262506.
6646.1s 995 [0.19741559874142423, 0.19837028540390275, 0.19979089896969632, 0.19788048964289387, 0.19911614550747544]
6646.4s 996 Unable to load Cython Compute_Similarity, reverting to Python
6662.3s 997 Similarity column 6969 (100.0%), 434.39 column/sec. Elapsed time 16.04 sec
6662.5s 998 EvaluatorHoldout: Ignoring 33 ( 0.1%) Users that have less than 1 test interactions
6691.6s 999 EvaluatorHoldout: Processed 27062 (100.0%) in 29.12 sec. Users per second: 929
6692.1s 1000 Unable to load Cython Compute_Similarity, reverting to Python
6707.7s 1001 Similarity column 6969 (100.0%), 442.92 column/sec. Elapsed time 15.73 sec
6707.8s 1002 EvaluatorHoldout: Ignoring 28 ( 0.1%) Users that have less than 1 test interactions
6737.3s 1003 EvaluatorHoldout: Processed 27067 (100.0%) in 29.51 sec. Users per second: 917
6737.8s 1004 Unable to load Cython Compute_Similarity, reverting to Python
6753.5s 1005 Similarity column 6969 (100.0%), 436.83 column/sec. Elapsed time 15.95 sec
6753.7s 1006 EvaluatorHoldout: Ignoring 40 ( 0.1%) Users that have less than 1 test interactions
6783.0s 1007 EvaluatorHoldout: Processed 27055 (100.0%) in 29.22 sec. Users per second: 926
6783.4s 1008 Unable to load Cython Compute_Similarity, reverting to Python
6799.0s 1009 Similarity column 6969 (100.0%), 442.82 column/sec. Elapsed time 15.74 sec
6799.2s 1010 EvaluatorHoldout: Ignoring 21 ( 0.1%) Users that have less than 1 test interactions
6828.4s 1011 EvaluatorHoldout: Processed 27074 (100.0%) in 29.25 sec. Users per second: 925
6828.9s 1012 Unable to load Cython Compute_Similarity, reverting to Python
6844.8s 1013 Similarity column 6969 (100.0%), 433.43 column/sec. Elapsed time 16.08 sec
6845.0s 1014 EvaluatorHoldout: Ignoring 29 ( 0.1%) Users that have less than 1 test interactions
6874.2s 1015 EvaluatorHoldout: Processed 27066 (100.0%) in 29.20 sec. Users per second: 927
6874.2s 1016 [I 2025-12-07 10:48:29,691] Trial 40 finished with value: 0.18499194018069315 and parameters: {'similarity': 'jaccard', 'topK': 910, 'shrink': 501}. Best is trial 28 with value: 0.23872565913262506.
6874.2s 1017 
6874.2s 1018 [I 2025-12-07 10:48:29,691] Trial 40 finished with value: 0.18499194018069315 and parameters: {'similarity': 'jaccard', 'topK': 910, 'shrink': 501}. Best is trial 28 with value: 0.23872565913262506.
6874.4s 1019 [0.1843238792885861, 0.18566758372790151, 0.1851669892075836, 0.18478455904417598, 0.18501668963521856]
6874.7s 1020 Unable to load Cython Compute_Similarity, reverting to Python
6884.0s 1021 Similarity column 6969 (100.0%), 734.00 column/sec. Elapsed time 9.49 sec
6884.2s 1022 EvaluatorHoldout: Ignoring 33 ( 0.1%) Users that have less than 1 test interactions
6899.2s 1023 EvaluatorHoldout: Processed 27062 (100.0%) in 15.15 sec. Users per second: 1786
6899.7s 1024 Unable to load Cython Compute_Similarity, reverting to Python
6909.2s 1025 Similarity column 6969 (100.0%), 719.88 column/sec. Elapsed time 9.68 sec
6909.3s 1026 EvaluatorHoldout: Ignoring 28 ( 0.1%) Users that have less than 1 test interactions
6924.4s 1027 EvaluatorHoldout: Processed 27067 (100.0%) in 15.25 sec. Users per second: 1775
6924.9s 1028 Unable to load Cython Compute_Similarity, reverting to Python
6935.0s 1029 Similarity column 6969 (100.0%), 676.30 column/sec. Elapsed time 10.30 sec
6935.2s 1030 EvaluatorHoldout: Ignoring 40 ( 0.1%) Users that have less than 1 test interactions
6950.3s 1031 EvaluatorHoldout: Processed 27055 (100.0%) in 15.19 sec. Users per second: 1781
6950.7s 1032 Unable to load Cython Compute_Similarity, reverting to Python
6960.2s 1033 Similarity column 6969 (100.0%), 719.75 column/sec. Elapsed time 9.68 sec
6960.4s 1034 EvaluatorHoldout: Ignoring 21 ( 0.1%) Users that have less than 1 test interactions
6975.6s 1035 EvaluatorHoldout: Processed 27074 (100.0%) in 15.32 sec. Users per second: 1767
6976.1s 1036 Unable to load Cython Compute_Similarity, reverting to Python
6986.1s 1037 Similarity column 6969 (100.0%), 686.28 column/sec. Elapsed time 10.15 sec
6986.2s 1038 EvaluatorHoldout: Ignoring 29 ( 0.1%) Users that have less than 1 test interactions
7001.2s 1039 EvaluatorHoldout: Processed 27066 (100.0%) in 15.17 sec. Users per second: 1784
7001.3s 1040 [I 2025-12-07 10:50:36,770] Trial 41 finished with value: 0.23295356888689328 and parameters: {'similarity': 'asymmetric', 'topK': 92, 'shrink': 467, 'asymmetric_alpha': 0.021213168951644962}. Best is trial 28 with value: 0.23872565913262506.
7001.3s 1041 
7001.3s 1042 [I 2025-12-07 10:50:36,770] Trial 41 finished with value: 0.23295356888689328 and parameters: {'similarity': 'asymmetric', 'topK': 92, 'shrink': 467, 'asymmetric_alpha': 0.021213168951644962}. Best is trial 28 with value: 0.23872565913262506.
7001.4s 1043 [0.23300755374617277, 0.23258703873161332, 0.23399705826062106, 0.23190862887136682, 0.2332675648246924]
7001.7s 1044 Unable to load Cython Compute_Similarity, reverting to Python
7010.8s 1045 Similarity column 6969 (100.0%), 750.03 column/sec. Elapsed time 9.29 sec
7011.0s 1046 EvaluatorHoldout: Ignoring 33 ( 0.1%) Users that have less than 1 test interactions
7026.4s 1047 EvaluatorHoldout: Processed 27062 (100.0%) in 15.49 sec. Users per second: 1747
7026.9s 1048 Unable to load Cython Compute_Similarity, reverting to Python
7036.2s 1049 Similarity column 6969 (100.0%), 731.62 column/sec. Elapsed time 9.53 sec
7036.4s 1050 EvaluatorHoldout: Ignoring 28 ( 0.1%) Users that have less than 1 test interactions
7051.8s 1051 EvaluatorHoldout: Processed 27067 (100.0%) in 15.53 sec. Users per second: 1742
7052.2s 1052 Unable to load Cython Compute_Similarity, reverting to Python
7061.2s 1053 Similarity column 6969 (100.0%), 762.86 column/sec. Elapsed time 9.14 sec
7061.4s 1054 EvaluatorHoldout: Ignoring 40 ( 0.1%) Users that have less than 1 test interactions
7076.6s 1055 EvaluatorHoldout: Processed 27055 (100.0%) in 15.39 sec. Users per second: 1757
7077.1s 1056 Unable to load Cython Compute_Similarity, reverting to Python
7086.5s 1057 Similarity column 6969 (100.0%), 726.84 column/sec. Elapsed time 9.59 sec
7086.7s 1058 EvaluatorHoldout: Ignoring 21 ( 0.1%) Users that have less than 1 test interactions
7102.1s 1059 EvaluatorHoldout: Processed 27074 (100.0%) in 15.52 sec. Users per second: 1744
7102.5s 1060 Unable to load Cython Compute_Similarity, reverting to Python
7112.1s 1061 Similarity column 6969 (100.0%), 714.13 column/sec. Elapsed time 9.76 sec
7112.3s 1062 EvaluatorHoldout: Ignoring 29 ( 0.1%) Users that have less than 1 test interactions
7127.6s 1063 EvaluatorHoldout: Processed 27066 (100.0%) in 15.47 sec. Users per second: 1750
7127.6s 1064 [I 2025-12-07 10:52:43,115] Trial 42 finished with value: 0.2265168064158337 and parameters: {'similarity': 'asymmetric', 'topK': 57, 'shrink': 559, 'asymmetric_alpha': 0.2295582835479985}. Best is trial 28 with value: 0.23872565913262506.
7127.6s 1065 
7127.6s 1066 [I 2025-12-07 10:52:43,115] Trial 42 finished with value: 0.2265168064158337 and parameters: {'similarity': 'asymmetric', 'topK': 57, 'shrink': 559, 'asymmetric_alpha': 0.2295582835479985}. Best is trial 28 with value: 0.23872565913262506.
7127.8s 1067 [0.22629021779115044, 0.22674961982591105, 0.2271092461334344, 0.2255756841880384, 0.22685926414063415]
7128.1s 1068 Unable to load Cython Compute_Similarity, reverting to Python
7138.5s 1069 Similarity column 6969 (100.0%), 662.59 column/sec. Elapsed time 10.52 sec
7138.6s 1070 EvaluatorHoldout: Ignoring 33 ( 0.1%) Users that have less than 1 test interactions
7156.4s 1071 EvaluatorHoldout: Processed 27062 (100.0%) in 17.90 sec. Users per second: 1512
7156.9s 1072 Unable to load Cython Compute_Similarity, reverting to Python
7166.9s 1073 Similarity column 6969 (100.0%), 677.60 column/sec. Elapsed time 10.28 sec
7167.1s 1074 EvaluatorHoldout: Ignoring 28 ( 0.1%) Users that have less than 1 test interactions
7185.2s 1075 EvaluatorHoldout: Processed 27067 (100.0%) in 18.13 sec. Users per second: 1493
7185.6s 1076 Unable to load Cython Compute_Similarity, reverting to Python
7195.6s 1077 Similarity column 6969 (100.0%), 682.08 column/sec. Elapsed time 10.22 sec
7195.8s 1078 EvaluatorHoldout: Ignoring 40 ( 0.1%) Users that have less than 1 test interactions
7213.5s 1079 EvaluatorHoldout: Processed 27055 (100.0%) in 17.77 sec. Users per second: 1523
7214.0s 1080 Unable to load Cython Compute_Similarity, reverting to Python
7224.4s 1081 Similarity column 6969 (100.0%), 656.18 column/sec. Elapsed time 10.62 sec
7224.6s 1082 EvaluatorHoldout: Ignoring 21 ( 0.1%) Users that have less than 1 test interactions
7242.4s 1083 EvaluatorHoldout: Processed 27074 (100.0%) in 17.92 sec. Users per second: 1510
7242.8s 1084 Unable to load Cython Compute_Similarity, reverting to Python
7252.8s 1085 Similarity column 6969 (100.0%), 689.26 column/sec. Elapsed time 10.11 sec
7253.0s 1086 EvaluatorHoldout: Ignoring 29 ( 0.1%) Users that have less than 1 test interactions
7270.7s 1087 EvaluatorHoldout: Processed 27066 (100.0%) in 17.81 sec. Users per second: 1520
7270.7s 1088 [I 2025-12-07 10:55:06,144] Trial 43 finished with value: 0.20625167464990488 and parameters: {'similarity': 'asymmetric', 'topK': 184, 'shrink': 648, 'asymmetric_alpha': 0.23631533475559025}. Best is trial 28 with value: 0.23872565913262506.
7270.7s 1089 
7270.7s 1090 [I 2025-12-07 10:55:06,144] Trial 43 finished with value: 0.20625167464990488 and parameters: {'similarity': 'asymmetric', 'topK': 184, 'shrink': 648, 'asymmetric_alpha': 0.23631533475559025}. Best is trial 28 with value: 0.23872565913262506.
7270.8s 1091 [0.20566791412941673, 0.20600032475370342, 0.20677585499748816, 0.20564258372097224, 0.20717169564794402]
7271.1s 1092 Unable to load Cython Compute_Similarity, reverting to Python
7280.6s 1093 Similarity column 6969 (100.0%), 720.60 column/sec. Elapsed time 9.67 sec
7280.8s 1094 EvaluatorHoldout: Ignoring 33 ( 0.1%) Users that have less than 1 test interactions
7304.5s 1095 EvaluatorHoldout: Processed 27062 (100.0%) in 23.80 sec. Users per second: 1137
7304.9s 1096 Unable to load Cython Compute_Similarity, reverting to Python
7314.5s 1097 Similarity column 6969 (100.0%), 716.87 column/sec. Elapsed time 9.72 sec
7314.7s 1098 EvaluatorHoldout: Ignoring 28 ( 0.1%) Users that have less than 1 test interactions
7338.5s 1099 EvaluatorHoldout: Processed 27067 (100.0%) in 23.90 sec. Users per second: 1132
7338.9s 1100 Unable to load Cython Compute_Similarity, reverting to Python
7348.4s 1101 Similarity column 6969 (100.0%), 719.40 column/sec. Elapsed time 9.69 sec
7348.6s 1102 EvaluatorHoldout: Ignoring 40 ( 0.1%) Users that have less than 1 test interactions
7372.5s 1103 EvaluatorHoldout: Processed 27055 (100.0%) in 24.06 sec. Users per second: 1125
7373.0s 1104 Unable to load Cython Compute_Similarity, reverting to Python
7382.5s 1105 Similarity column 6969 (100.0%), 719.41 column/sec. Elapsed time 9.69 sec
7382.7s 1106 EvaluatorHoldout: Ignoring 21 ( 0.1%) Users that have less than 1 test interactions
7406.2s 1107 EvaluatorHoldout: Processed 27074 (100.0%) in 23.61 sec. Users per second: 1147
7406.6s 1108 Unable to load Cython Compute_Similarity, reverting to Python
7415.9s 1109 Similarity column 6969 (100.0%), 732.42 column/sec. Elapsed time 9.51 sec
7416.1s 1110 EvaluatorHoldout: Ignoring 29 ( 0.1%) Users that have less than 1 test interactions
7439.9s 1111 EvaluatorHoldout: Processed 27066 (100.0%) in 23.89 sec. Users per second: 1133
7439.9s 1112 [I 2025-12-07 10:57:55,403] Trial 44 finished with value: 0.19640090924091852 and parameters: {'similarity': 'asymmetric', 'topK': 139, 'shrink': 364, 'asymmetric_alpha': 0.7209668229514409}. Best is trial 28 with value: 0.23872565913262506.
7439.9s 1113 
7439.9s 1114 [I 2025-12-07 10:57:55,403] Trial 44 finished with value: 0.19640090924091852 and parameters: {'similarity': 'asymmetric', 'topK': 139, 'shrink': 364, 'asymmetric_alpha': 0.7209668229514409}. Best is trial 28 with value: 0.23872565913262506.
7440.1s 1115 [0.19594130070085763, 0.19684149789720626, 0.19634040009132694, 0.19639764291734954, 0.19648370459785233]
7440.4s 1116 Unable to load Cython Compute_Similarity, reverting to Python
7451.4s 1117 Similarity column 6969 (100.0%), 619.65 column/sec. Elapsed time 11.25 sec
7451.6s 1118 EvaluatorHoldout: Ignoring 33 ( 0.1%) Users that have less than 1 test interactions
7470.3s 1119 EvaluatorHoldout: Processed 27062 (100.0%) in 18.77 sec. Users per second: 1442
7470.8s 1120 Unable to load Cython Compute_Similarity, reverting to Python
7481.6s 1121 Similarity column 6969 (100.0%), 629.51 column/sec. Elapsed time 11.07 sec
7481.8s 1122 EvaluatorHoldout: Ignoring 28 ( 0.1%) Users that have less than 1 test interactions
7500.5s 1123 EvaluatorHoldout: Processed 27067 (100.0%) in 18.78 sec. Users per second: 1441
7501.0s 1124 Unable to load Cython Compute_Similarity, reverting to Python
7512.0s 1125 Similarity column 6969 (100.0%), 622.81 column/sec. Elapsed time 11.19 sec
7512.2s 1126 EvaluatorHoldout: Ignoring 40 ( 0.1%) Users that have less than 1 test interactions
7530.9s 1127 EvaluatorHoldout: Processed 27055 (100.0%) in 18.84 sec. Users per second: 1436
7531.4s 1128 Unable to load Cython Compute_Similarity, reverting to Python
7542.4s 1129 Similarity column 6969 (100.0%), 623.08 column/sec. Elapsed time 11.18 sec
7542.6s 1130 EvaluatorHoldout: Ignoring 21 ( 0.1%) Users that have less than 1 test interactions
7561.5s 1131 EvaluatorHoldout: Processed 27074 (100.0%) in 18.94 sec. Users per second: 1429
7561.9s 1132 Unable to load Cython Compute_Similarity, reverting to Python
7572.9s 1133 Similarity column 6969 (100.0%), 620.54 column/sec. Elapsed time 11.23 sec
7573.1s 1134 EvaluatorHoldout: Ignoring 29 ( 0.1%) Users that have less than 1 test interactions
7591.8s 1135 EvaluatorHoldout: Processed 27066 (100.0%) in 18.74 sec. Users per second: 1445
7591.8s 1136 [I 2025-12-07 11:00:27,262] Trial 45 finished with value: 0.19894230909350646 and parameters: {'similarity': 'asymmetric', 'topK': 307, 'shrink': 434, 'asymmetric_alpha': 0.20325740926329483}. Best is trial 28 with value: 0.23872565913262506.
7591.8s 1137 
