22201.0s 3800 [I 2025-12-07 15:03:56,557] Trial 156 finished with value: 0.21284402364494248 and parameters: {'similarity': 'tversky', 'topK': 61, 'shrink': 122, 'tversky_alpha': 0.4255004194946756, 'tversky_beta': 1.471965441538763}. Best is trial 91 with value: 0.24993110179607925.
22201.0s 3801 
22201.0s 3802 [I 2025-12-07 15:03:56,557] Trial 156 finished with value: 0.21284402364494248 and parameters: {'similarity': 'tversky', 'topK': 61, 'shrink': 122, 'tversky_alpha': 0.4255004194946756, 'tversky_beta': 1.471965441538763}. Best is trial 91 with value: 0.24993110179607925.
22201.2s 3803 [0.2122753187292685, 0.21312222460556524, 0.2132491292830428, 0.2121135735987953, 0.21345987200804045]
22201.5s 3804 Unable to load Cython Compute_Similarity, reverting to Python
22210.5s 3805 Similarity column 6969 (100.0%), 765.98 column/sec. Elapsed time 9.10 sec
22210.7s 3806 EvaluatorHoldout: Ignoring 33 ( 0.1%) Users that have less than 1 test interactions
22225.5s 3807 EvaluatorHoldout: Processed 27062 (100.0%) in 14.82 sec. Users per second: 1826
22225.8s 3808 Unable to load Cython Compute_Similarity, reverting to Python
22234.9s 3809 Similarity column 6969 (100.0%), 751.11 column/sec. Elapsed time 9.28 sec
22235.1s 3810 EvaluatorHoldout: Ignoring 28 ( 0.1%) Users that have less than 1 test interactions
22249.8s 3811 EvaluatorHoldout: Processed 27067 (100.0%) in 14.93 sec. Users per second: 1812
22250.3s 3812 Unable to load Cython Compute_Similarity, reverting to Python
22260.4s 3813 Similarity column 6969 (100.0%), 694.43 column/sec. Elapsed time 10.04 sec
22260.4s 3814 EvaluatorHoldout: Ignoring 40 ( 0.1%) Users that have less than 1 test interactions
22275.0s 3815 EvaluatorHoldout: Processed 27055 (100.0%) in 14.83 sec. Users per second: 1824
22275.5s 3816 Unable to load Cython Compute_Similarity, reverting to Python
22285.0s 3817 Similarity column 6969 (100.0%), 722.34 column/sec. Elapsed time 9.65 sec
22285.2s 3818 EvaluatorHoldout: Ignoring 21 ( 0.1%) Users that have less than 1 test interactions
22300.2s 3819 EvaluatorHoldout: Processed 27074 (100.0%) in 14.85 sec. Users per second: 1823
22300.4s 3820 Unable to load Cython Compute_Similarity, reverting to Python
22309.6s 3821 Similarity column 6969 (100.0%), 740.83 column/sec. Elapsed time 9.41 sec
22309.8s 3822 EvaluatorHoldout: Ignoring 29 ( 0.1%) Users that have less than 1 test interactions
22324.5s 3823 EvaluatorHoldout: Processed 27066 (100.0%) in 14.91 sec. Users per second: 1815
22324.5s 3824 [I 2025-12-07 15:06:00,035] Trial 157 finished with value: 0.22099226962899707 and parameters: {'similarity': 'tversky', 'topK': 31, 'shrink': 155, 'tversky_alpha': 0.5895267289618702, 'tversky_beta': 1.5478758322085144}. Best is trial 91 with value: 0.24993110179607925.
22324.5s 3825 
22324.5s 3826 [I 2025-12-07 15:06:00,035] Trial 157 finished with value: 0.22099226962899707 and parameters: {'similarity': 'tversky', 'topK': 31, 'shrink': 155, 'tversky_alpha': 0.5895267289618702, 'tversky_beta': 1.5478758322085144}. Best is trial 91 with value: 0.24993110179607925.
22324.7s 3827 [0.22078126287409353, 0.22108720074234808, 0.22203973956107745, 0.21997904911934874, 0.22107409584811752]
22325.0s 3828 Unable to load Cython Compute_Similarity, reverting to Python
22334.3s 3829 Similarity column 6969 (100.0%), 750.23 column/sec. Elapsed time 9.29 sec
22334.3s 3830 EvaluatorHoldout: Ignoring 33 ( 0.1%) Users that have less than 1 test interactions
22348.6s 3831 EvaluatorHoldout: Processed 27062 (100.0%) in 14.44 sec. Users per second: 1874
22349.1s 3832 Unable to load Cython Compute_Similarity, reverting to Python
22358.1s 3833 Similarity column 6969 (100.0%), 756.19 column/sec. Elapsed time 9.22 sec
22358.3s 3834 EvaluatorHoldout: Ignoring 28 ( 0.1%) Users that have less than 1 test interactions
22372.9s 3835 EvaluatorHoldout: Processed 27067 (100.0%) in 14.58 sec. Users per second: 1856
22373.2s 3836 Unable to load Cython Compute_Similarity, reverting to Python
22382.6s 3837 Similarity column 6969 (100.0%), 725.17 column/sec. Elapsed time 9.61 sec
22382.8s 3838 EvaluatorHoldout: Ignoring 40 ( 0.1%) Users that have less than 1 test interactions
22397.1s 3839 EvaluatorHoldout: Processed 27055 (100.0%) in 14.45 sec. Users per second: 1873
22397.6s 3840 Unable to load Cython Compute_Similarity, reverting to Python
22406.9s 3841 Similarity column 6969 (100.0%), 747.58 column/sec. Elapsed time 9.32 sec
22406.9s 3842 EvaluatorHoldout: Ignoring 21 ( 0.1%) Users that have less than 1 test interactions
22421.3s 3843 EvaluatorHoldout: Processed 27074 (100.0%) in 14.53 sec. Users per second: 1863
22421.7s 3844 Unable to load Cython Compute_Similarity, reverting to Python
22430.7s 3845 Similarity column 6969 (100.0%), 759.18 column/sec. Elapsed time 9.18 sec
22430.9s 3846 EvaluatorHoldout: Ignoring 29 ( 0.1%) Users that have less than 1 test interactions
22445.6s 3847 EvaluatorHoldout: Processed 27066 (100.0%) in 14.69 sec. Users per second: 1842
22445.6s 3848 [I 2025-12-07 15:08:00,972] Trial 158 finished with value: 0.23142231252032838 and parameters: {'similarity': 'tversky', 'topK': 27, 'shrink': 169, 'tversky_alpha': 0.3645086476476787, 'tversky_beta': 1.6951105264245707}. Best is trial 91 with value: 0.24993110179607925.
22445.6s 3849 
22445.6s 3850 [I 2025-12-07 15:08:00,972] Trial 158 finished with value: 0.23142231252032838 and parameters: {'similarity': 'tversky', 'topK': 27, 'shrink': 169, 'tversky_alpha': 0.3645086476476787, 'tversky_beta': 1.6951105264245707}. Best is trial 91 with value: 0.24993110179607925.
22445.6s 3851 [0.2306392205070141, 0.2317539717148244, 0.23287977653009045, 0.23011377924596246, 0.2317248146037505]
22446.0s 3852 Unable to load Cython Compute_Similarity, reverting to Python
22455.3s 3853 Similarity column 6969 (100.0%), 734.46 column/sec. Elapsed time 9.49 sec
22455.5s 3854 EvaluatorHoldout: Ignoring 33 ( 0.1%) Users that have less than 1 test interactions
22470.4s 3855 EvaluatorHoldout: Processed 27062 (100.0%) in 15.06 sec. Users per second: 1797
22470.9s 3856 Unable to load Cython Compute_Similarity, reverting to Python
22480.2s 3857 Similarity column 6969 (100.0%), 741.29 column/sec. Elapsed time 9.40 sec
22480.3s 3858 EvaluatorHoldout: Ignoring 28 ( 0.1%) Users that have less than 1 test interactions
22495.2s 3859 EvaluatorHoldout: Processed 27067 (100.0%) in 15.15 sec. Users per second: 1787
22495.7s 3860 Unable to load Cython Compute_Similarity, reverting to Python
22505.0s 3861 Similarity column 6969 (100.0%), 736.95 column/sec. Elapsed time 9.46 sec
22505.2s 3862 EvaluatorHoldout: Ignoring 40 ( 0.1%) Users that have less than 1 test interactions
22520.4s 3863 EvaluatorHoldout: Processed 27055 (100.0%) in 15.20 sec. Users per second: 1780
22520.7s 3864 Unable to load Cython Compute_Similarity, reverting to Python
22530.6s 3865 Similarity column 6969 (100.0%), 692.81 column/sec. Elapsed time 10.06 sec
22530.8s 3866 EvaluatorHoldout: Ignoring 21 ( 0.1%) Users that have less than 1 test interactions
22545.9s 3867 EvaluatorHoldout: Processed 27074 (100.0%) in 15.25 sec. Users per second: 1775
22546.4s 3868 Unable to load Cython Compute_Similarity, reverting to Python
22556.7s 3869 Similarity column 6969 (100.0%), 670.81 column/sec. Elapsed time 10.39 sec
22556.8s 3870 EvaluatorHoldout: Ignoring 29 ( 0.1%) Users that have less than 1 test interactions
22571.8s 3871 EvaluatorHoldout: Processed 27066 (100.0%) in 15.24 sec. Users per second: 1776
22571.8s 3872 [I 2025-12-07 15:10:07,354] Trial 159 finished with value: 0.22025062250675967 and parameters: {'similarity': 'tversky', 'topK': 56, 'shrink': 137, 'tversky_alpha': 0.31217149306651654, 'tversky_beta': 1.6325730191013197}. Best is trial 91 with value: 0.24993110179607925.
22571.8s 3873 
22571.8s 3874 [I 2025-12-07 15:10:07,354] Trial 159 finished with value: 0.22025062250675967 and parameters: {'similarity': 'tversky', 'topK': 56, 'shrink': 137, 'tversky_alpha': 0.31217149306651654, 'tversky_beta': 1.6325730191013197}. Best is trial 91 with value: 0.24993110179607925.
22572.0s 3875 [0.21950422341844544, 0.22077866278168862, 0.22024506010854747, 0.21973900198366278, 0.220986164241454]
22572.3s 3876 Unable to load Cython Compute_Similarity, reverting to Python
22581.4s 3877 Similarity column 6969 (100.0%), 750.59 column/sec. Elapsed time 9.28 sec
22581.6s 3878 EvaluatorHoldout: Ignoring 33 ( 0.1%) Users that have less than 1 test interactions
22595.3s 3879 EvaluatorHoldout: Processed 27062 (100.0%) in 13.70 sec. Users per second: 1975
22595.6s 3880 Unable to load Cython Compute_Similarity, reverting to Python
22604.6s 3881 Similarity column 6969 (100.0%), 762.77 column/sec. Elapsed time 9.14 sec
22604.8s 3882 EvaluatorHoldout: Ignoring 28 ( 0.1%) Users that have less than 1 test interactions
22618.4s 3883 EvaluatorHoldout: Processed 27067 (100.0%) in 13.80 sec. Users per second: 1961
22618.9s 3884 Unable to load Cython Compute_Similarity, reverting to Python
22628.6s 3885 Similarity column 6969 (100.0%), 716.93 column/sec. Elapsed time 9.72 sec
22628.6s 3886 EvaluatorHoldout: Ignoring 40 ( 0.1%) Users that have less than 1 test interactions
22642.2s 3887 EvaluatorHoldout: Processed 27055 (100.0%) in 13.77 sec. Users per second: 1965
22642.7s 3888 Unable to load Cython Compute_Similarity, reverting to Python
22651.7s 3889 Similarity column 6969 (100.0%), 762.55 column/sec. Elapsed time 9.14 sec
22651.9s 3890 EvaluatorHoldout: Ignoring 21 ( 0.1%) Users that have less than 1 test interactions
22665.6s 3891 EvaluatorHoldout: Processed 27074 (100.0%) in 13.78 sec. Users per second: 1964
22665.9s 3892 Unable to load Cython Compute_Similarity, reverting to Python
22674.8s 3893 Similarity column 6969 (100.0%), 766.53 column/sec. Elapsed time 9.09 sec
22675.0s 3894 EvaluatorHoldout: Ignoring 29 ( 0.1%) Users that have less than 1 test interactions
22688.7s 3895 EvaluatorHoldout: Processed 27066 (100.0%) in 13.79 sec. Users per second: 1962
22688.7s 3896 [I 2025-12-07 15:12:04,187] Trial 160 finished with value: 0.24692755809556283 and parameters: {'similarity': 'tversky', 'topK': 6, 'shrink': 221, 'tversky_alpha': 0.3853328084348544, 'tversky_beta': 1.5884896736026353}. Best is trial 91 with value: 0.24993110179607925.
22688.7s 3897 
22688.7s 3898 [I 2025-12-07 15:12:04,187] Trial 160 finished with value: 0.24692755809556283 and parameters: {'similarity': 'tversky', 'topK': 6, 'shrink': 221, 'tversky_alpha': 0.3853328084348544, 'tversky_beta': 1.5884896736026353}. Best is trial 91 with value: 0.24993110179607925.
22688.9s 3899 [0.24564947918596833, 0.2482095666296305, 0.24877585522284332, 0.24572547310502282, 0.2462774163343491]
22689.2s 3900 Unable to load Cython Compute_Similarity, reverting to Python
22698.4s 3901 Similarity column 6969 (100.0%), 755.62 column/sec. Elapsed time 9.22 sec
22698.4s 3902 EvaluatorHoldout: Ignoring 33 ( 0.1%) Users that have less than 1 test interactions
22712.8s 3903 EvaluatorHoldout: Processed 27062 (100.0%) in 14.55 sec. Users per second: 1859
22713.3s 3904 Unable to load Cython Compute_Similarity, reverting to Python
22722.3s 3905 Similarity column 6969 (100.0%), 752.97 column/sec. Elapsed time 9.26 sec
22722.5s 3906 EvaluatorHoldout: Ignoring 28 ( 0.1%) Users that have less than 1 test interactions
22737.1s 3907 EvaluatorHoldout: Processed 27067 (100.0%) in 14.54 sec. Users per second: 1861
22737.4s 3908 Unable to load Cython Compute_Similarity, reverting to Python
22746.8s 3909 Similarity column 6969 (100.0%), 726.62 column/sec. Elapsed time 9.59 sec
22747.0s 3910 EvaluatorHoldout: Ignoring 40 ( 0.1%) Users that have less than 1 test interactions
22761.4s 3911 EvaluatorHoldout: Processed 27055 (100.0%) in 14.60 sec. Users per second: 1853
22761.9s 3912 Unable to load Cython Compute_Similarity, reverting to Python
22771.4s 3913 Similarity column 6969 (100.0%), 732.77 column/sec. Elapsed time 9.51 sec
22771.4s 3914 EvaluatorHoldout: Ignoring 21 ( 0.1%) Users that have less than 1 test interactions
22785.8s 3915 EvaluatorHoldout: Processed 27074 (100.0%) in 14.57 sec. Users per second: 1858
22786.3s 3916 Unable to load Cython Compute_Similarity, reverting to Python
22795.7s 3917 Similarity column 6969 (100.0%), 726.12 column/sec. Elapsed time 9.60 sec
22795.9s 3918 EvaluatorHoldout: Ignoring 29 ( 0.1%) Users that have less than 1 test interactions
22810.5s 3919 EvaluatorHoldout: Processed 27066 (100.0%) in 14.58 sec. Users per second: 1856
22810.5s 3920 [I 2025-12-07 15:14:05,857] Trial 161 finished with value: 0.22890758663953492 and parameters: {'similarity': 'tversky', 'topK': 24, 'shrink': 219, 'tversky_alpha': 0.3856560800289023, 'tversky_beta': 1.5061913402494327}. Best is trial 91 with value: 0.24993110179607925.
22810.5s 3921 
22810.5s 3922 [I 2025-12-07 15:14:05,857] Trial 161 finished with value: 0.22890758663953492 and parameters: {'similarity': 'tversky', 'topK': 24, 'shrink': 219, 'tversky_alpha': 0.3856560800289023, 'tversky_beta': 1.5061913402494327}. Best is trial 91 with value: 0.24993110179607925.
22810.5s 3923 [0.2280123012058949, 0.2295235378513178, 0.2303493226743166, 0.22820423405126247, 0.22844853741488277]
22810.9s 3924 Unable to load Cython Compute_Similarity, reverting to Python
22824.2s 3925 Similarity column 6969 (100.0%), 515.45 column/sec. Elapsed time 13.52 sec
22824.4s 3926 EvaluatorHoldout: Ignoring 33 ( 0.1%) Users that have less than 1 test interactions
22845.8s 3927 EvaluatorHoldout: Processed 27062 (100.0%) in 21.29 sec. Users per second: 1271
22846.1s 3928 Unable to load Cython Compute_Similarity, reverting to Python
22859.6s 3929 Similarity column 6969 (100.0%), 509.23 column/sec. Elapsed time 13.69 sec
22859.8s 3930 EvaluatorHoldout: Ignoring 28 ( 0.1%) Users that have less than 1 test interactions
22881.3s 3931 EvaluatorHoldout: Processed 27067 (100.0%) in 21.24 sec. Users per second: 1275
22881.4s 3932 Unable to load Cython Compute_Similarity, reverting to Python
22894.9s 3933 Similarity column 6969 (100.0%), 509.00 column/sec. Elapsed time 13.69 sec
22895.1s 3934 EvaluatorHoldout: Ignoring 40 ( 0.1%) Users that have less than 1 test interactions
22916.3s 3935 EvaluatorHoldout: Processed 27055 (100.0%) in 21.09 sec. Users per second: 1283
22916.6s 3936 Unable to load Cython Compute_Similarity, reverting to Python
22929.9s 3937 Similarity column 6969 (100.0%), 519.67 column/sec. Elapsed time 13.41 sec
22930.1s 3938 EvaluatorHoldout: Ignoring 21 ( 0.1%) Users that have less than 1 test interactions
22950.9s 3939 EvaluatorHoldout: Processed 27074 (100.0%) in 20.78 sec. Users per second: 1303
22951.3s 3940 Unable to load Cython Compute_Similarity, reverting to Python
22964.1s 3941 Similarity column 6969 (100.0%), 534.71 column/sec. Elapsed time 13.03 sec
22964.3s 3942 EvaluatorHoldout: Ignoring 29 ( 0.1%) Users that have less than 1 test interactions
22986.1s 3943 EvaluatorHoldout: Processed 27066 (100.0%) in 21.75 sec. Users per second: 1245
22986.1s 3944 [I 2025-12-07 15:17:01,487] Trial 162 finished with value: 0.1763879486397135 and parameters: {'similarity': 'tversky', 'topK': 542, 'shrink': 252, 'tversky_alpha': 0.2988492813518214, 'tversky_beta': 1.594111352695651}. Best is trial 91 with value: 0.24993110179607925.
22986.1s 3945 
22986.1s 3946 [I 2025-12-07 15:17:01,487] Trial 162 finished with value: 0.1763879486397135 and parameters: {'similarity': 'tversky', 'topK': 542, 'shrink': 252, 'tversky_alpha': 0.2988492813518214, 'tversky_beta': 1.594111352695651}. Best is trial 91 with value: 0.24993110179607925.
22986.2s 3947 [0.1763259082012437, 0.1765049032013911, 0.17606647960676264, 0.17554577422401538, 0.17749667796515464]
22986.5s 3948 Unable to load Cython Compute_Similarity, reverting to Python
22995.6s 3949 Similarity column 6969 (100.0%), 747.47 column/sec. Elapsed time 9.32 sec
22995.8s 3950 EvaluatorHoldout: Ignoring 33 ( 0.1%) Users that have less than 1 test interactions
23009.3s 3951 EvaluatorHoldout: Processed 27062 (100.0%) in 13.68 sec. Users per second: 1978
23009.8s 3952 Unable to load Cython Compute_Similarity, reverting to Python
23019.0s 3953 Similarity column 6969 (100.0%), 754.63 column/sec. Elapsed time 9.24 sec
23019.1s 3954 EvaluatorHoldout: Ignoring 28 ( 0.1%) Users that have less than 1 test interactions
23032.7s 3955 EvaluatorHoldout: Processed 27067 (100.0%) in 13.77 sec. Users per second: 1966
23033.1s 3956 Unable to load Cython Compute_Similarity, reverting to Python
23041.9s 3957 Similarity column 6969 (100.0%), 776.76 column/sec. Elapsed time 8.97 sec
23042.1s 3958 EvaluatorHoldout: Ignoring 40 ( 0.1%) Users that have less than 1 test interactions
23055.7s 3959 EvaluatorHoldout: Processed 27055 (100.0%) in 13.59 sec. Users per second: 1991
23056.0s 3960 Unable to load Cython Compute_Similarity, reverting to Python
23064.7s 3961 Similarity column 6969 (100.0%), 781.28 column/sec. Elapsed time 8.92 sec
23064.9s 3962 EvaluatorHoldout: Ignoring 21 ( 0.1%) Users that have less than 1 test interactions
23078.4s 3963 EvaluatorHoldout: Processed 27074 (100.0%) in 13.67 sec. Users per second: 1981
23078.9s 3964 Unable to load Cython Compute_Similarity, reverting to Python
23088.0s 3965 Similarity column 6969 (100.0%), 763.41 column/sec. Elapsed time 9.13 sec
23088.1s 3966 EvaluatorHoldout: Ignoring 29 ( 0.1%) Users that have less than 1 test interactions
23101.6s 3967 EvaluatorHoldout: Processed 27066 (100.0%) in 13.75 sec. Users per second: 1969
23101.6s 3968 [I 2025-12-07 15:18:57,154] Trial 163 finished with value: 0.24343847747765573 and parameters: {'similarity': 'tversky', 'topK': 5, 'shrink': 181, 'tversky_alpha': 0.467745538466956, 'tversky_beta': 1.4452921652479747}. Best is trial 91 with value: 0.24993110179607925.
23101.6s 3969 
23101.6s 3970 [I 2025-12-07 15:18:57,154] Trial 163 finished with value: 0.24343847747765573 and parameters: {'similarity': 'tversky', 'topK': 5, 'shrink': 181, 'tversky_alpha': 0.467745538466956, 'tversky_beta': 1.4452921652479747}. Best is trial 91 with value: 0.24993110179607925.
23101.8s 3971 [0.24332159070376616, 0.24366218655652677, 0.24484554848488807, 0.24180170407488383, 0.24356135756821376]
23102.1s 3972 Unable to load Cython Compute_Similarity, reverting to Python
23111.0s 3973 Similarity column 6969 (100.0%), 770.60 column/sec. Elapsed time 9.04 sec
23111.2s 3974 EvaluatorHoldout: Ignoring 33 ( 0.1%) Users that have less than 1 test interactions
23124.7s 3975 EvaluatorHoldout: Processed 27062 (100.0%) in 13.53 sec. Users per second: 2001
23125.1s 3976 Unable to load Cython Compute_Similarity, reverting to Python
23133.8s 3977 Similarity column 6969 (100.0%), 776.32 column/sec. Elapsed time 8.98 sec
23134.0s 3978 EvaluatorHoldout: Ignoring 28 ( 0.1%) Users that have less than 1 test interactions
23147.6s 3979 EvaluatorHoldout: Processed 27067 (100.0%) in 13.72 sec. Users per second: 1973
23148.1s 3980 Unable to load Cython Compute_Similarity, reverting to Python
23157.6s 3981 Similarity column 6969 (100.0%), 730.53 column/sec. Elapsed time 9.54 sec
23157.6s 3982 EvaluatorHoldout: Ignoring 40 ( 0.1%) Users that have less than 1 test interactions
23171.2s 3983 EvaluatorHoldout: Processed 27055 (100.0%) in 13.74 sec. Users per second: 1970
23171.7s 3984 Unable to load Cython Compute_Similarity, reverting to Python
23181.0s 3985 Similarity column 6969 (100.0%), 732.29 column/sec. Elapsed time 9.52 sec
23181.2s 3986 EvaluatorHoldout: Ignoring 21 ( 0.1%) Users that have less than 1 test interactions
23194.9s 3987 EvaluatorHoldout: Processed 27074 (100.0%) in 13.70 sec. Users per second: 1976
23195.2s 3988 Unable to load Cython Compute_Similarity, reverting to Python
23204.6s 3989 Similarity column 6969 (100.0%), 727.77 column/sec. Elapsed time 9.58 sec
23204.8s 3990 EvaluatorHoldout: Ignoring 29 ( 0.1%) Users that have less than 1 test interactions
23218.4s 3991 EvaluatorHoldout: Processed 27066 (100.0%) in 13.73 sec. Users per second: 1971
23218.4s 3992 [I 2025-12-07 15:20:53,892] Trial 164 finished with value: 0.24925139526318998 and parameters: {'similarity': 'tversky', 'topK': 5, 'shrink': 112, 'tversky_alpha': 0.3416927196900621, 'tversky_beta': 1.5711878512620592}. Best is trial 91 with value: 0.24993110179607925.
23218.4s 3993 
