4947.4s 706 [I 2025-12-07 10:16:22,854] Trial 27 finished with value: 0.20883401425257064 and parameters: {'similarity': 'asymmetric', 'topK': 414, 'shrink': 517, 'asymmetric_alpha': 0.06389264736013123}. Best is trial 26 with value: 0.23664908540282648.
4947.5s 707 [0.20810100810326523, 0.2087902930567821, 0.209168459006456, 0.20863594821889783, 0.20947436287745202]
4947.8s 708 Unable to load Cython Compute_Similarity, reverting to Python
4956.7s 709 Similarity column 6969 (100.0%), 768.60 column/sec. Elapsed time 9.07 sec
4956.9s 710 EvaluatorHoldout: Ignoring 33 ( 0.1%) Users that have less than 1 test interactions
4971.4s 711 EvaluatorHoldout: Processed 27062 (100.0%) in 14.62 sec. Users per second: 1851
4971.8s 712 Unable to load Cython Compute_Similarity, reverting to Python
4981.2s 713 Similarity column 6969 (100.0%), 734.59 column/sec. Elapsed time 9.49 sec
4981.3s 714 EvaluatorHoldout: Ignoring 28 ( 0.1%) Users that have less than 1 test interactions
4995.9s 715 EvaluatorHoldout: Processed 27067 (100.0%) in 14.71 sec. Users per second: 1840
4996.4s 716 Unable to load Cython Compute_Similarity, reverting to Python
5005.9s 717 Similarity column 6969 (100.0%), 720.73 column/sec. Elapsed time 9.67 sec
5006.1s 718 EvaluatorHoldout: Ignoring 40 ( 0.1%) Users that have less than 1 test interactions
5020.6s 719 EvaluatorHoldout: Processed 27055 (100.0%) in 14.66 sec. Users per second: 1845
5021.1s 720 Unable to load Cython Compute_Similarity, reverting to Python
5030.6s 721 Similarity column 6969 (100.0%), 716.42 column/sec. Elapsed time 9.73 sec
5030.8s 722 EvaluatorHoldout: Ignoring 21 ( 0.1%) Users that have less than 1 test interactions
5045.4s 723 EvaluatorHoldout: Processed 27074 (100.0%) in 14.75 sec. Users per second: 1835
5045.9s 724 Unable to load Cython Compute_Similarity, reverting to Python
5055.7s 725 Similarity column 6969 (100.0%), 699.83 column/sec. Elapsed time 9.96 sec
5055.8s 726 EvaluatorHoldout: Ignoring 29 ( 0.1%) Users that have less than 1 test interactions
5070.3s 727 EvaluatorHoldout: Processed 27066 (100.0%) in 14.68 sec. Users per second: 1844
5070.3s 728 [I 2025-12-07 10:18:25,855] Trial 28 finished with value: 0.23872565913262506 and parameters: {'similarity': 'asymmetric', 'topK': 52, 'shrink': 464, 'asymmetric_alpha': 0.047616230568607434}. Best is trial 28 with value: 0.23872565913262506.
5070.3s 729 
5070.3s 730 [I 2025-12-07 10:18:25,855] Trial 28 finished with value: 0.23872565913262506 and parameters: {'similarity': 'asymmetric', 'topK': 52, 'shrink': 464, 'asymmetric_alpha': 0.047616230568607434}. Best is trial 28 with value: 0.23872565913262506.
5070.5s 731 [0.23850258946809347, 0.23835283853736539, 0.23970864831061756, 0.23788423908779044, 0.23917998025925832]
5070.8s 732 Unable to load Cython Compute_Similarity, reverting to Python
5080.6s 733 Similarity column 6969 (100.0%), 700.02 column/sec. Elapsed time 9.96 sec
5080.8s 734 EvaluatorHoldout: Ignoring 33 ( 0.1%) Users that have less than 1 test interactions
5095.1s 735 EvaluatorHoldout: Processed 27062 (100.0%) in 14.47 sec. Users per second: 1871
5095.6s 736 Unable to load Cython Compute_Similarity, reverting to Python
5105.7s 737 Similarity column 6969 (100.0%), 673.24 column/sec. Elapsed time 10.35 sec
5105.9s 738 EvaluatorHoldout: Ignoring 28 ( 0.1%) Users that have less than 1 test interactions
5120.4s 739 EvaluatorHoldout: Processed 27067 (100.0%) in 14.57 sec. Users per second: 1858
5120.8s 740 Unable to load Cython Compute_Similarity, reverting to Python
5130.6s 741 Similarity column 6969 (100.0%), 700.57 column/sec. Elapsed time 9.95 sec
5130.8s 742 EvaluatorHoldout: Ignoring 40 ( 0.1%) Users that have less than 1 test interactions
5145.1s 743 EvaluatorHoldout: Processed 27055 (100.0%) in 14.50 sec. Users per second: 1866
5145.6s 744 Unable to load Cython Compute_Similarity, reverting to Python
5155.6s 745 Similarity column 6969 (100.0%), 683.30 column/sec. Elapsed time 10.20 sec
5155.8s 746 EvaluatorHoldout: Ignoring 21 ( 0.1%) Users that have less than 1 test interactions
5170.2s 747 EvaluatorHoldout: Processed 27074 (100.0%) in 14.54 sec. Users per second: 1862
5170.7s 748 Unable to load Cython Compute_Similarity, reverting to Python
5180.7s 749 Similarity column 6969 (100.0%), 681.48 column/sec. Elapsed time 10.23 sec
5180.9s 750 EvaluatorHoldout: Ignoring 29 ( 0.1%) Users that have less than 1 test interactions
5195.6s 751 EvaluatorHoldout: Processed 27066 (100.0%) in 14.86 sec. Users per second: 1821
5195.6s 752 [I 2025-12-07 10:20:31,133] Trial 29 finished with value: 0.2366030393032541 and parameters: {'similarity': 'asymmetric', 'topK': 43, 'shrink': 462, 'asymmetric_alpha': 0.02452704979181146}. Best is trial 28 with value: 0.23872565913262506.
5195.6s 753 
5195.6s 754 [I 2025-12-07 10:20:31,133] Trial 29 finished with value: 0.2366030393032541 and parameters: {'similarity': 'asymmetric', 'topK': 43, 'shrink': 462, 'asymmetric_alpha': 0.02452704979181146}. Best is trial 28 with value: 0.23872565913262506.
5195.8s 755 [0.23682404305097518, 0.23589121844880098, 0.2375885416303188, 0.2356854143442014, 0.2370259790419741]
5196.1s 756 Unable to load Cython Compute_Similarity, reverting to Python
5207.5s 757 Similarity column 6969 (100.0%), 603.18 column/sec. Elapsed time 11.55 sec
5207.7s 758 EvaluatorHoldout: Ignoring 33 ( 0.1%) Users that have less than 1 test interactions
5224.3s 759 EvaluatorHoldout: Processed 27062 (100.0%) in 16.74 sec. Users per second: 1616
5224.8s 760 Unable to load Cython Compute_Similarity, reverting to Python
5235.5s 761 Similarity column 6969 (100.0%), 637.36 column/sec. Elapsed time 10.93 sec
5235.7s 762 EvaluatorHoldout: Ignoring 28 ( 0.1%) Users that have less than 1 test interactions
5252.6s 763 EvaluatorHoldout: Processed 27067 (100.0%) in 16.95 sec. Users per second: 1597
5253.0s 764 Unable to load Cython Compute_Similarity, reverting to Python
5263.9s 765 Similarity column 6969 (100.0%), 626.98 column/sec. Elapsed time 11.12 sec
5264.1s 766 EvaluatorHoldout: Ignoring 40 ( 0.1%) Users that have less than 1 test interactions
5280.8s 767 EvaluatorHoldout: Processed 27055 (100.0%) in 16.81 sec. Users per second: 1610
5281.3s 768 Unable to load Cython Compute_Similarity, reverting to Python
5292.1s 769 Similarity column 6969 (100.0%), 637.99 column/sec. Elapsed time 10.92 sec
5292.2s 770 EvaluatorHoldout: Ignoring 21 ( 0.1%) Users that have less than 1 test interactions
5309.0s 771 EvaluatorHoldout: Processed 27074 (100.0%) in 16.87 sec. Users per second: 1605
5309.5s 772 Unable to load Cython Compute_Similarity, reverting to Python
5320.7s 773 Similarity column 6969 (100.0%), 611.73 column/sec. Elapsed time 11.39 sec
5320.9s 774 EvaluatorHoldout: Ignoring 29 ( 0.1%) Users that have less than 1 test interactions
5337.6s 775 EvaluatorHoldout: Processed 27066 (100.0%) in 16.86 sec. Users per second: 1605
5337.6s 776 [I 2025-12-07 10:22:53,097] Trial 30 finished with value: 0.22231651972210806 and parameters: {'similarity': 'asymmetric', 'topK': 257, 'shrink': 442, 'asymmetric_alpha': 0.012436830653871155}. Best is trial 28 with value: 0.23872565913262506.
5337.6s 777 
5337.6s 778 [I 2025-12-07 10:22:53,097] Trial 30 finished with value: 0.22231651972210806 and parameters: {'similarity': 'asymmetric', 'topK': 257, 'shrink': 442, 'asymmetric_alpha': 0.012436830653871155}. Best is trial 28 with value: 0.23872565913262506.
5337.8s 779 [0.22169714753317973, 0.22255869286788996, 0.22325306876558582, 0.22110816929616312, 0.22296552014772172]
5338.1s 780 Unable to load Cython Compute_Similarity, reverting to Python
5347.2s 781 Similarity column 6969 (100.0%), 748.13 column/sec. Elapsed time 9.32 sec
5347.4s 782 EvaluatorHoldout: Ignoring 33 ( 0.1%) Users that have less than 1 test interactions
5362.4s 783 EvaluatorHoldout: Processed 27062 (100.0%) in 15.22 sec. Users per second: 1778
5362.9s 784 Unable to load Cython Compute_Similarity, reverting to Python
5372.5s 785 Similarity column 6969 (100.0%), 719.96 column/sec. Elapsed time 9.68 sec
5372.6s 786 EvaluatorHoldout: Ignoring 28 ( 0.1%) Users that have less than 1 test interactions
5387.8s 787 EvaluatorHoldout: Processed 27067 (100.0%) in 15.33 sec. Users per second: 1766
5388.3s 788 Unable to load Cython Compute_Similarity, reverting to Python
5398.6s 789 Similarity column 6969 (100.0%), 660.77 column/sec. Elapsed time 10.55 sec
5398.8s 790 EvaluatorHoldout: Ignoring 40 ( 0.1%) Users that have less than 1 test interactions
5414.0s 791 EvaluatorHoldout: Processed 27055 (100.0%) in 15.30 sec. Users per second: 1769
5414.4s 792 Unable to load Cython Compute_Similarity, reverting to Python
5424.1s 793 Similarity column 6969 (100.0%), 709.95 column/sec. Elapsed time 9.82 sec
5424.3s 794 EvaluatorHoldout: Ignoring 21 ( 0.1%) Users that have less than 1 test interactions
5439.5s 795 EvaluatorHoldout: Processed 27074 (100.0%) in 15.36 sec. Users per second: 1763
5439.9s 796 Unable to load Cython Compute_Similarity, reverting to Python
5449.5s 797 Similarity column 6969 (100.0%), 729.58 column/sec. Elapsed time 9.55 sec
5449.5s 798 EvaluatorHoldout: Ignoring 29 ( 0.1%) Users that have less than 1 test interactions
5464.7s 799 EvaluatorHoldout: Processed 27066 (100.0%) in 15.33 sec. Users per second: 1766
5464.7s 800 [I 2025-12-07 10:25:00,186] Trial 31 finished with value: 0.23053920711445394 and parameters: {'similarity': 'asymmetric', 'topK': 63, 'shrink': 458, 'asymmetric_alpha': 0.17628299548329052}. Best is trial 28 with value: 0.23872565913262506.
5464.7s 801 
5464.7s 802 [I 2025-12-07 10:25:00,186] Trial 31 finished with value: 0.23053920711445394 and parameters: {'similarity': 'asymmetric', 'topK': 63, 'shrink': 458, 'asymmetric_alpha': 0.17628299548329052}. Best is trial 28 with value: 0.23872565913262506.
5464.9s 803 [0.23042063969421936, 0.23083398185565554, 0.2309310919546995, 0.22939554320282662, 0.23111477886486864]
5465.2s 804 Unable to load Cython Compute_Similarity, reverting to Python
5474.3s 805 Similarity column 6969 (100.0%), 749.66 column/sec. Elapsed time 9.30 sec
5474.5s 806 EvaluatorHoldout: Ignoring 33 ( 0.1%) Users that have less than 1 test interactions
5488.9s 807 EvaluatorHoldout: Processed 27062 (100.0%) in 14.57 sec. Users per second: 1858
5489.4s 808 Unable to load Cython Compute_Similarity, reverting to Python
5498.2s 809 Similarity column 6969 (100.0%), 768.43 column/sec. Elapsed time 9.07 sec
5498.4s 810 EvaluatorHoldout: Ignoring 28 ( 0.1%) Users that have less than 1 test interactions
5512.9s 811 EvaluatorHoldout: Processed 27067 (100.0%) in 14.65 sec. Users per second: 1847
5513.4s 812 Unable to load Cython Compute_Similarity, reverting to Python
5522.2s 813 Similarity column 6969 (100.0%), 777.49 column/sec. Elapsed time 8.96 sec
5522.4s 814 EvaluatorHoldout: Ignoring 40 ( 0.1%) Users that have less than 1 test interactions
5536.8s 815 EvaluatorHoldout: Processed 27055 (100.0%) in 14.59 sec. Users per second: 1854
5537.3s 816 Unable to load Cython Compute_Similarity, reverting to Python
5545.9s 817 Similarity column 6969 (100.0%), 790.12 column/sec. Elapsed time 8.82 sec
5546.1s 818 EvaluatorHoldout: Ignoring 21 ( 0.1%) Users that have less than 1 test interactions
5560.6s 819 EvaluatorHoldout: Processed 27074 (100.0%) in 14.57 sec. Users per second: 1858
5561.0s 820 Unable to load Cython Compute_Similarity, reverting to Python
5569.6s 821 Similarity column 6969 (100.0%), 793.60 column/sec. Elapsed time 8.78 sec
5569.8s 822 EvaluatorHoldout: Ignoring 29 ( 0.1%) Users that have less than 1 test interactions
5584.1s 823 EvaluatorHoldout: Processed 27066 (100.0%) in 14.50 sec. Users per second: 1866
5584.1s 824 [I 2025-12-07 10:26:59,639] Trial 32 finished with value: 0.2145768354037057 and parameters: {'similarity': 'asymmetric', 'topK': 8, 'shrink': 528, 'asymmetric_alpha': 0.5105525404684085}. Best is trial 28 with value: 0.23872565913262506.
5584.1s 825 
5584.1s 826 [I 2025-12-07 10:26:59,639] Trial 32 finished with value: 0.2145768354037057 and parameters: {'similarity': 'asymmetric', 'topK': 8, 'shrink': 528, 'asymmetric_alpha': 0.5105525404684085}. Best is trial 28 with value: 0.23872565913262506.
5584.3s 827 [0.21437831576183097, 0.2146405968120252, 0.21631812671475958, 0.21276199976303317, 0.2147851379668796]
5584.6s 828 Unable to load Cython Compute_Similarity, reverting to Python
5594.7s 829 Similarity column 6969 (100.0%), 683.19 column/sec. Elapsed time 10.20 sec
5594.8s 830 EvaluatorHoldout: Ignoring 33 ( 0.1%) Users that have less than 1 test interactions
5617.0s 831 EvaluatorHoldout: Processed 27062 (100.0%) in 22.34 sec. Users per second: 1211
5617.5s 832 Unable to load Cython Compute_Similarity, reverting to Python
5627.8s 833 Similarity column 6969 (100.0%), 667.52 column/sec. Elapsed time 10.44 sec
5627.9s 834 EvaluatorHoldout: Ignoring 28 ( 0.1%) Users that have less than 1 test interactions
5650.2s 835 EvaluatorHoldout: Processed 27067 (100.0%) in 22.35 sec. Users per second: 1211
5650.6s 836 Unable to load Cython Compute_Similarity, reverting to Python
5661.1s 837 Similarity column 6969 (100.0%), 661.00 column/sec. Elapsed time 10.54 sec
5661.2s 838 EvaluatorHoldout: Ignoring 40 ( 0.1%) Users that have less than 1 test interactions
5683.7s 839 EvaluatorHoldout: Processed 27055 (100.0%) in 22.62 sec. Users per second: 1196
5684.2s 840 Unable to load Cython Compute_Similarity, reverting to Python
5694.8s 841 Similarity column 6969 (100.0%), 646.99 column/sec. Elapsed time 10.77 sec
5695.0s 842 EvaluatorHoldout: Ignoring 21 ( 0.1%) Users that have less than 1 test interactions
5717.4s 843 EvaluatorHoldout: Processed 27074 (100.0%) in 22.59 sec. Users per second: 1199
5717.9s 844 Unable to load Cython Compute_Similarity, reverting to Python
5728.2s 845 Similarity column 6969 (100.0%), 668.44 column/sec. Elapsed time 10.43 sec
5728.3s 846 EvaluatorHoldout: Ignoring 29 ( 0.1%) Users that have less than 1 test interactions
5750.5s 847 EvaluatorHoldout: Processed 27066 (100.0%) in 22.35 sec. Users per second: 1211
5750.5s 848 [I 2025-12-07 10:29:46,040] Trial 33 finished with value: 0.2130540607169286 and parameters: {'similarity': 'asymmetric', 'topK': 207, 'shrink': 585, 'asymmetric_alpha': 0.4693201444213881}. Best is trial 28 with value: 0.23872565913262506.
5750.5s 849 
5750.5s 850 [I 2025-12-07 10:29:46,040] Trial 33 finished with value: 0.2130540607169286 and parameters: {'similarity': 'asymmetric', 'topK': 207, 'shrink': 585, 'asymmetric_alpha': 0.4693201444213881}. Best is trial 28 with value: 0.23872565913262506.
5750.7s 851 [0.2123688702529713, 0.213858791081115, 0.212757839292511, 0.2122641841906868, 0.21402061876735878]
5751.0s 852 Unable to load Cython Compute_Similarity, reverting to Python
5760.3s 853 Similarity column 6969 (100.0%), 739.66 column/sec. Elapsed time 9.42 sec
5760.4s 854 EvaluatorHoldout: Ignoring 33 ( 0.1%) Users that have less than 1 test interactions
5775.8s 855 EvaluatorHoldout: Processed 27062 (100.0%) in 15.55 sec. Users per second: 1740
5776.3s 856 Unable to load Cython Compute_Similarity, reverting to Python
5785.7s 857 Similarity column 6969 (100.0%), 732.07 column/sec. Elapsed time 9.52 sec
5785.9s 858 EvaluatorHoldout: Ignoring 28 ( 0.1%) Users that have less than 1 test interactions
5801.3s 859 EvaluatorHoldout: Processed 27067 (100.0%) in 15.62 sec. Users per second: 1733
5801.8s 860 Unable to load Cython Compute_Similarity, reverting to Python
5810.7s 861 Similarity column 6969 (100.0%), 765.64 column/sec. Elapsed time 9.10 sec
5810.9s 862 EvaluatorHoldout: Ignoring 40 ( 0.1%) Users that have less than 1 test interactions
5826.2s 863 EvaluatorHoldout: Processed 27055 (100.0%) in 15.45 sec. Users per second: 1751
5826.7s 864 Unable to load Cython Compute_Similarity, reverting to Python
5835.8s 865 Similarity column 6969 (100.0%), 750.94 column/sec. Elapsed time 9.28 sec
5836.0s 866 EvaluatorHoldout: Ignoring 21 ( 0.1%) Users that have less than 1 test interactions
5851.3s 867 EvaluatorHoldout: Processed 27074 (100.0%) in 15.53 sec. Users per second: 1743
5851.8s 868 Unable to load Cython Compute_Similarity, reverting to Python
5860.6s 869 Similarity column 6969 (100.0%), 773.17 column/sec. Elapsed time 9.01 sec
5860.8s 870 EvaluatorHoldout: Ignoring 29 ( 0.1%) Users that have less than 1 test interactions
5876.2s 871 EvaluatorHoldout: Processed 27066 (100.0%) in 15.53 sec. Users per second: 1743
5876.2s 872 [I 2025-12-07 10:31:51,714] Trial 34 finished with value: 0.22237989218747134 and parameters: {'similarity': 'asymmetric', 'topK': 41, 'shrink': 384, 'asymmetric_alpha': 0.34861103900536855}. Best is trial 28 with value: 0.23872565913262506.
5876.2s 873 
5876.2s 874 [I 2025-12-07 10:31:51,714] Trial 34 finished with value: 0.22237989218747134 and parameters: {'similarity': 'asymmetric', 'topK': 41, 'shrink': 384, 'asymmetric_alpha': 0.34861103900536855}. Best is trial 28 with value: 0.23872565913262506.
5876.4s 875 [0.22252679676792744, 0.22300279397172038, 0.22227147421170856, 0.22156932201063131, 0.22252907397536897]
5876.7s 876 Unable to load Cython Compute_Similarity, reverting to Python
5885.6s 877 Similarity column 6969 (100.0%), 762.56 column/sec. Elapsed time 9.14 sec
5885.8s 878 EvaluatorHoldout: Ignoring 33 ( 0.1%) Users that have less than 1 test interactions
5900.5s 879 EvaluatorHoldout: Processed 27062 (100.0%) in 14.87 sec. Users per second: 1820
5901.0s 880 Unable to load Cython Compute_Similarity, reverting to Python
5910.2s 881 Similarity column 6969 (100.0%), 744.74 column/sec. Elapsed time 9.36 sec
5910.4s 882 EvaluatorHoldout: Ignoring 28 ( 0.1%) Users that have less than 1 test interactions
5925.3s 883 EvaluatorHoldout: Processed 27067 (100.0%) in 15.07 sec. Users per second: 1797
5925.8s 884 Unable to load Cython Compute_Similarity, reverting to Python
5935.1s 885 Similarity column 6969 (100.0%), 735.06 column/sec. Elapsed time 9.48 sec
5935.3s 886 EvaluatorHoldout: Ignoring 40 ( 0.1%) Users that have less than 1 test interactions
5950.3s 887 EvaluatorHoldout: Processed 27055 (100.0%) in 15.14 sec. Users per second: 1787
5950.7s 888 Unable to load Cython Compute_Similarity, reverting to Python
5960.5s 889 Similarity column 6969 (100.0%), 700.52 column/sec. Elapsed time 9.95 sec
5960.7s 890 EvaluatorHoldout: Ignoring 21 ( 0.1%) Users that have less than 1 test interactions
5975.7s 891 EvaluatorHoldout: Processed 27074 (100.0%) in 15.12 sec. Users per second: 1790
5976.1s 892 Unable to load Cython Compute_Similarity, reverting to Python
5985.8s 893 Similarity column 6969 (100.0%), 706.76 column/sec. Elapsed time 9.86 sec
5986.0s 894 EvaluatorHoldout: Ignoring 29 ( 0.1%) Users that have less than 1 test interactions
6001.0s 895 EvaluatorHoldout: Processed 27066 (100.0%) in 15.16 sec. Users per second: 1785
6001.0s 896 [I 2025-12-07 10:33:56,532] Trial 35 finished with value: 0.2351488112187526 and parameters: {'similarity': 'asymmetric', 'topK': 82, 'shrink': 472, 'asymmetric_alpha': 0.03658172145717008}. Best is trial 28 with value: 0.23872565913262506.
6001.0s 897 
6001.0s 898 [I 2025-12-07 10:33:56,532] Trial 35 finished with value: 0.2351488112187526 and parameters: {'similarity': 'asymmetric', 'topK': 82, 'shrink': 472, 'asymmetric_alpha': 0.03658172145717008}. Best is trial 28 with value: 0.23872565913262506.
6001.2s 899 [0.234674792837648, 0.23543255071218067, 0.23598648695287294, 0.23397704164981462, 0.23567318394124692]
6001.5s 900 Unable to load Cython Compute_Similarity, reverting to Python
6012.1s 901 Similarity column 6969 (100.0%), 644.67 column/sec. Elapsed time 10.81 sec
6012.3s 902 EvaluatorHoldout: Ignoring 33 ( 0.1%) Users that have less than 1 test interactions
6039.5s 903 EvaluatorHoldout: Processed 27062 (100.0%) in 27.29 sec. Users per second: 992
6040.0s 904 Unable to load Cython Compute_Similarity, reverting to Python
6050.5s 905 Similarity column 6969 (100.0%), 648.02 column/sec. Elapsed time 10.75 sec
6050.7s 906 EvaluatorHoldout: Ignoring 28 ( 0.1%) Users that have less than 1 test interactions
6078.0s 907 EvaluatorHoldout: Processed 27067 (100.0%) in 27.41 sec. Users per second: 987
6078.5s 908 Unable to load Cython Compute_Similarity, reverting to Python
6089.4s 909 Similarity column 6969 (100.0%), 625.47 column/sec. Elapsed time 11.14 sec
6089.6s 910 EvaluatorHoldout: Ignoring 40 ( 0.1%) Users that have less than 1 test interactions
6116.9s 911 EvaluatorHoldout: Processed 27055 (100.0%) in 27.34 sec. Users per second: 990
6117.3s 912 Unable to load Cython Compute_Similarity, reverting to Python
6128.0s 913 Similarity column 6969 (100.0%), 642.99 column/sec. Elapsed time 10.84 sec
6128.2s 914 EvaluatorHoldout: Ignoring 21 ( 0.1%) Users that have less than 1 test interactions
6155.4s 915 EvaluatorHoldout: Processed 27074 (100.0%) in 27.27 sec. Users per second: 993
6155.8s 916 Unable to load Cython Compute_Similarity, reverting to Python
6166.8s 917 Similarity column 6969 (100.0%), 624.25 column/sec. Elapsed time 11.16 sec
6167.0s 918 EvaluatorHoldout: Ignoring 29 ( 0.1%) Users that have less than 1 test interactions
6194.1s 919 EvaluatorHoldout: Processed 27066 (100.0%) in 27.20 sec. Users per second: 995
6194.1s 920 [I 2025-12-07 10:37:09,546] Trial 36 finished with value: 0.18057182487433993 and parameters: {'similarity': 'asymmetric', 'topK': 232, 'shrink': 590, 'asymmetric_alpha': 0.7754574747962106}. Best is trial 28 with value: 0.23872565913262506.
6194.1s 921 
