5680.3s 706 [I 2025-12-06 22:52:31,213] Trial 27 finished with value: 0.21652522562447088 and parameters: {'topK': 109, 'shrink': 246, 'feature_weighting': 'TF-IDF'}. Best is trial 10 with value: 0.21699762942341766.
5680.4s 707 [0.21677673467991185, 0.21652687718626976, 0.21608876498577761, 0.21741323735683954, 0.21582051391355564]
5680.8s 708 Unable to load Cython Compute_Similarity, reverting to Python
5694.4s 709 Similarity column 6969 (100.0%), 505.89 column/sec. Elapsed time 13.78 sec
5694.6s 710 EvaluatorHoldout: Ignoring 48 ( 0.2%) Users that have less than 1 test interactions
5722.3s 711 EvaluatorHoldout: Processed 27047 (100.0%) in 27.76 sec. Users per second: 974
5722.8s 712 Unable to load Cython Compute_Similarity, reverting to Python
5736.0s 713 Similarity column 6969 (100.0%), 521.96 column/sec. Elapsed time 13.35 sec
5736.2s 714 EvaluatorHoldout: Ignoring 29 ( 0.1%) Users that have less than 1 test interactions
5763.4s 715 EvaluatorHoldout: Processed 27066 (100.0%) in 27.33 sec. Users per second: 991
5763.9s 716 Unable to load Cython Compute_Similarity, reverting to Python
5776.8s 717 Similarity column 6969 (100.0%), 531.86 column/sec. Elapsed time 13.10 sec
5777.0s 718 EvaluatorHoldout: Ignoring 42 ( 0.2%) Users that have less than 1 test interactions
5803.9s 719 EvaluatorHoldout: Processed 27053 (100.0%) in 26.98 sec. Users per second: 1003
5804.4s 720 Unable to load Cython Compute_Similarity, reverting to Python
5817.1s 721 Similarity column 6969 (100.0%), 541.42 column/sec. Elapsed time 12.87 sec
5817.3s 722 EvaluatorHoldout: Ignoring 38 ( 0.1%) Users that have less than 1 test interactions
5844.5s 723 EvaluatorHoldout: Processed 27057 (100.0%) in 27.29 sec. Users per second: 991
5845.0s 724 Unable to load Cython Compute_Similarity, reverting to Python
5858.4s 725 Similarity column 6969 (100.0%), 515.00 column/sec. Elapsed time 13.53 sec
5858.6s 726 EvaluatorHoldout: Ignoring 32 ( 0.1%) Users that have less than 1 test interactions
5885.8s 727 EvaluatorHoldout: Processed 27063 (100.0%) in 27.33 sec. Users per second: 990
5885.8s 728 [I 2025-12-06 22:55:56,760] Trial 28 finished with value: 0.2058070105158812 and parameters: {'topK': 274, 'shrink': 409, 'feature_weighting': 'BM25'}. Best is trial 10 with value: 0.21699762942341766.
5885.8s 729 
5885.8s 730 [I 2025-12-06 22:55:56,760] Trial 28 finished with value: 0.2058070105158812 and parameters: {'topK': 274, 'shrink': 409, 'feature_weighting': 'BM25'}. Best is trial 10 with value: 0.21699762942341766.
5886.0s 731 [0.20525599239160916, 0.2064069483718664, 0.20469321797164014, 0.20662150649385128, 0.20605738735043913]
5886.0s 732 Unable to load Cython Compute_Similarity, reverting to Python
5900.7s 733 Similarity column 6969 (100.0%), 471.26 column/sec. Elapsed time 14.79 sec
5900.9s 734 EvaluatorHoldout: Ignoring 48 ( 0.2%) Users that have less than 1 test interactions
5937.7s 735 EvaluatorHoldout: Processed 27047 (100.0%) in 36.75 sec. Users per second: 736
5937.8s 736 Unable to load Cython Compute_Similarity, reverting to Python
5952.6s 737 Similarity column 6969 (100.0%), 470.46 column/sec. Elapsed time 14.81 sec
5952.8s 738 EvaluatorHoldout: Ignoring 29 ( 0.1%) Users that have less than 1 test interactions
5989.5s 739 EvaluatorHoldout: Processed 27066 (100.0%) in 36.79 sec. Users per second: 736
5989.7s 740 Unable to load Cython Compute_Similarity, reverting to Python
6004.7s 741 Similarity column 6969 (100.0%), 463.85 column/sec. Elapsed time 15.02 sec
6004.9s 742 EvaluatorHoldout: Ignoring 42 ( 0.2%) Users that have less than 1 test interactions
6041.7s 743 EvaluatorHoldout: Processed 27053 (100.0%) in 36.83 sec. Users per second: 734
6041.8s 744 Unable to load Cython Compute_Similarity, reverting to Python
6056.7s 745 Similarity column 6969 (100.0%), 468.59 column/sec. Elapsed time 14.87 sec
6056.9s 746 EvaluatorHoldout: Ignoring 38 ( 0.1%) Users that have less than 1 test interactions
6094.0s 747 EvaluatorHoldout: Processed 27057 (100.0%) in 37.14 sec. Users per second: 729
6094.1s 748 Unable to load Cython Compute_Similarity, reverting to Python
6108.7s 749 Similarity column 6969 (100.0%), 476.63 column/sec. Elapsed time 14.62 sec
6108.9s 750 EvaluatorHoldout: Ignoring 32 ( 0.1%) Users that have less than 1 test interactions
6145.4s 751 EvaluatorHoldout: Processed 27063 (100.0%) in 36.51 sec. Users per second: 741
6145.4s 752 [I 2025-12-06 23:00:16,321] Trial 29 finished with value: 0.19753351943879113 and parameters: {'topK': 479, 'shrink': 219, 'feature_weighting': 'none'}. Best is trial 10 with value: 0.21699762942341766.
6145.4s 753 
6145.4s 754 [I 2025-12-06 23:00:16,321] Trial 29 finished with value: 0.19753351943879113 and parameters: {'topK': 479, 'shrink': 219, 'feature_weighting': 'none'}. Best is trial 10 with value: 0.21699762942341766.
6145.5s 755 [0.1983016402305659, 0.1970556622195138, 0.19645722728947407, 0.19858117461303007, 0.19727189284137187]
6145.9s 756 Unable to load Cython Compute_Similarity, reverting to Python
6156.6s 757 Similarity column 6969 (100.0%), 640.88 column/sec. Elapsed time 10.87 sec
6156.8s 758 EvaluatorHoldout: Ignoring 48 ( 0.2%) Users that have less than 1 test interactions
6176.5s 759 EvaluatorHoldout: Processed 27047 (100.0%) in 19.86 sec. Users per second: 1362
6177.0s 760 Unable to load Cython Compute_Similarity, reverting to Python
6188.6s 761 Similarity column 6969 (100.0%), 591.85 column/sec. Elapsed time 11.77 sec
6188.8s 762 EvaluatorHoldout: Ignoring 29 ( 0.1%) Users that have less than 1 test interactions
6208.9s 763 EvaluatorHoldout: Processed 27066 (100.0%) in 20.28 sec. Users per second: 1335
6209.4s 764 Unable to load Cython Compute_Similarity, reverting to Python
6220.8s 765 Similarity column 6969 (100.0%), 604.47 column/sec. Elapsed time 11.53 sec
6221.0s 766 EvaluatorHoldout: Ignoring 42 ( 0.2%) Users that have less than 1 test interactions
6241.3s 767 EvaluatorHoldout: Processed 27053 (100.0%) in 20.42 sec. Users per second: 1325
6241.8s 768 Unable to load Cython Compute_Similarity, reverting to Python
6253.6s 769 Similarity column 6969 (100.0%), 580.52 column/sec. Elapsed time 12.00 sec
6253.8s 770 EvaluatorHoldout: Ignoring 38 ( 0.1%) Users that have less than 1 test interactions
6274.3s 771 EvaluatorHoldout: Processed 27057 (100.0%) in 20.66 sec. Users per second: 1310
6274.8s 772 Unable to load Cython Compute_Similarity, reverting to Python
6286.2s 773 Similarity column 6969 (100.0%), 600.95 column/sec. Elapsed time 11.60 sec
6286.4s 774 EvaluatorHoldout: Ignoring 32 ( 0.1%) Users that have less than 1 test interactions
6306.7s 775 EvaluatorHoldout: Processed 27063 (100.0%) in 20.39 sec. Users per second: 1327
6306.7s 776 [I 2025-12-06 23:02:57,639] Trial 30 finished with value: 0.2166667786681132 and parameters: {'topK': 52, 'shrink': 66, 'feature_weighting': 'TF-IDF'}. Best is trial 10 with value: 0.21699762942341766.
6306.7s 777 
6306.7s 778 [I 2025-12-06 23:02:57,639] Trial 30 finished with value: 0.2166667786681132 and parameters: {'topK': 52, 'shrink': 66, 'feature_weighting': 'TF-IDF'}. Best is trial 10 with value: 0.21699762942341766.
6306.9s 779 [0.2171572834340825, 0.21664573294287146, 0.21568588671710046, 0.2176295514413171, 0.21621543880519453]
6307.2s 780 Unable to load Cython Compute_Similarity, reverting to Python
6319.2s 781 Similarity column 6969 (100.0%), 571.05 column/sec. Elapsed time 12.20 sec
6319.4s 782 EvaluatorHoldout: Ignoring 48 ( 0.2%) Users that have less than 1 test interactions
6341.0s 783 EvaluatorHoldout: Processed 27047 (100.0%) in 21.73 sec. Users per second: 1245
6341.5s 784 Unable to load Cython Compute_Similarity, reverting to Python
6353.1s 785 Similarity column 6969 (100.0%), 590.83 column/sec. Elapsed time 11.80 sec
6353.3s 786 EvaluatorHoldout: Ignoring 29 ( 0.1%) Users that have less than 1 test interactions
6375.6s 787 EvaluatorHoldout: Processed 27066 (100.0%) in 22.40 sec. Users per second: 1208
6376.1s 788 Unable to load Cython Compute_Similarity, reverting to Python
6388.2s 789 Similarity column 6969 (100.0%), 565.58 column/sec. Elapsed time 12.32 sec
6388.4s 790 EvaluatorHoldout: Ignoring 42 ( 0.2%) Users that have less than 1 test interactions
6410.4s 791 EvaluatorHoldout: Processed 27053 (100.0%) in 22.07 sec. Users per second: 1226
6410.9s 792 Unable to load Cython Compute_Similarity, reverting to Python
6422.9s 793 Similarity column 6969 (100.0%), 571.88 column/sec. Elapsed time 12.19 sec
6423.1s 794 EvaluatorHoldout: Ignoring 38 ( 0.1%) Users that have less than 1 test interactions
6445.3s 795 EvaluatorHoldout: Processed 27057 (100.0%) in 22.27 sec. Users per second: 1215
6445.7s 796 Unable to load Cython Compute_Similarity, reverting to Python
6457.4s 797 Similarity column 6969 (100.0%), 589.91 column/sec. Elapsed time 11.81 sec
6457.6s 798 EvaluatorHoldout: Ignoring 32 ( 0.1%) Users that have less than 1 test interactions
6479.9s 799 EvaluatorHoldout: Processed 27063 (100.0%) in 22.44 sec. Users per second: 1206
6479.9s 800 [I 2025-12-06 23:05:50,816] Trial 31 finished with value: 0.21691784677916764 and parameters: {'topK': 89, 'shrink': 97, 'feature_weighting': 'TF-IDF'}. Best is trial 10 with value: 0.21699762942341766.
6479.9s 801 
6479.9s 802 [I 2025-12-06 23:05:50,816] Trial 31 finished with value: 0.21691784677916764 and parameters: {'topK': 89, 'shrink': 97, 'feature_weighting': 'TF-IDF'}. Best is trial 10 with value: 0.21699762942341766.
6480.0s 803 [0.21737139370060338, 0.21711952224776523, 0.21682756636784775, 0.21756538017813914, 0.21570537140148266]
6480.4s 804 Unable to load Cython Compute_Similarity, reverting to Python
6494.0s 805 Similarity column 6969 (100.0%), 505.07 column/sec. Elapsed time 13.80 sec
6494.2s 806 EvaluatorHoldout: Ignoring 48 ( 0.2%) Users that have less than 1 test interactions
6518.6s 807 EvaluatorHoldout: Processed 27047 (100.0%) in 24.46 sec. Users per second: 1106
6519.1s 808 Unable to load Cython Compute_Similarity, reverting to Python
6530.9s 809 Similarity column 6969 (100.0%), 582.83 column/sec. Elapsed time 11.96 sec
6531.1s 810 EvaluatorHoldout: Ignoring 29 ( 0.1%) Users that have less than 1 test interactions
6555.2s 811 EvaluatorHoldout: Processed 27066 (100.0%) in 24.21 sec. Users per second: 1118
6555.7s 812 Unable to load Cython Compute_Similarity, reverting to Python
6567.8s 813 Similarity column 6969 (100.0%), 565.65 column/sec. Elapsed time 12.32 sec
6568.0s 814 EvaluatorHoldout: Ignoring 42 ( 0.2%) Users that have less than 1 test interactions
6592.1s 815 EvaluatorHoldout: Processed 27053 (100.0%) in 24.19 sec. Users per second: 1118
6592.6s 816 Unable to load Cython Compute_Similarity, reverting to Python
6604.5s 817 Similarity column 6969 (100.0%), 575.87 column/sec. Elapsed time 12.10 sec
6604.7s 818 EvaluatorHoldout: Ignoring 38 ( 0.1%) Users that have less than 1 test interactions
6628.3s 819 EvaluatorHoldout: Processed 27057 (100.0%) in 23.71 sec. Users per second: 1141
6628.8s 820 Unable to load Cython Compute_Similarity, reverting to Python
6640.2s 821 Similarity column 6969 (100.0%), 601.00 column/sec. Elapsed time 11.60 sec
6640.4s 822 EvaluatorHoldout: Ignoring 32 ( 0.1%) Users that have less than 1 test interactions
6664.1s 823 EvaluatorHoldout: Processed 27063 (100.0%) in 23.86 sec. Users per second: 1134
6664.1s 824 [I 2025-12-06 23:08:55,036] Trial 32 finished with value: 0.21641352074829792 and parameters: {'topK': 118, 'shrink': 301, 'feature_weighting': 'TF-IDF'}. Best is trial 10 with value: 0.21699762942341766.
6664.1s 825 
6664.1s 826 [I 2025-12-06 23:08:55,036] Trial 32 finished with value: 0.21641352074829792 and parameters: {'topK': 118, 'shrink': 301, 'feature_weighting': 'TF-IDF'}. Best is trial 10 with value: 0.21699762942341766.
6664.3s 827 [0.21669768533518494, 0.21668161155517782, 0.21572376807774185, 0.21707089420013398, 0.21589364457325097]
6664.6s 828 Unable to load Cython Compute_Similarity, reverting to Python
6676.2s 829 Similarity column 6969 (100.0%), 591.71 column/sec. Elapsed time 11.78 sec
6676.4s 830 EvaluatorHoldout: Ignoring 48 ( 0.2%) Users that have less than 1 test interactions
6697.7s 831 EvaluatorHoldout: Processed 27047 (100.0%) in 21.44 sec. Users per second: 1261
6698.2s 832 Unable to load Cython Compute_Similarity, reverting to Python
6709.6s 833 Similarity column 6969 (100.0%), 601.00 column/sec. Elapsed time 11.60 sec
6709.8s 834 EvaluatorHoldout: Ignoring 29 ( 0.1%) Users that have less than 1 test interactions
6731.6s 835 EvaluatorHoldout: Processed 27066 (100.0%) in 21.92 sec. Users per second: 1235
6732.1s 836 Unable to load Cython Compute_Similarity, reverting to Python
6743.9s 837 Similarity column 6969 (100.0%), 582.40 column/sec. Elapsed time 11.97 sec
6744.1s 838 EvaluatorHoldout: Ignoring 42 ( 0.2%) Users that have less than 1 test interactions
6766.0s 839 EvaluatorHoldout: Processed 27053 (100.0%) in 21.99 sec. Users per second: 1230
6766.5s 840 Unable to load Cython Compute_Similarity, reverting to Python
6778.4s 841 Similarity column 6969 (100.0%), 573.14 column/sec. Elapsed time 12.16 sec
6778.6s 842 EvaluatorHoldout: Ignoring 38 ( 0.1%) Users that have less than 1 test interactions
6800.9s 843 EvaluatorHoldout: Processed 27057 (100.0%) in 22.39 sec. Users per second: 1208
6801.4s 844 Unable to load Cython Compute_Similarity, reverting to Python
6813.1s 845 Similarity column 6969 (100.0%), 586.92 column/sec. Elapsed time 11.87 sec
6813.3s 846 EvaluatorHoldout: Ignoring 32 ( 0.1%) Users that have less than 1 test interactions
6835.7s 847 EvaluatorHoldout: Processed 27063 (100.0%) in 22.45 sec. Users per second: 1206
6835.7s 848 [I 2025-12-06 23:11:46,588] Trial 33 finished with value: 0.21670123637835056 and parameters: {'topK': 85, 'shrink': 127, 'feature_weighting': 'TF-IDF'}. Best is trial 10 with value: 0.21699762942341766.
6835.7s 849 
6835.7s 850 [I 2025-12-06 23:11:46,588] Trial 33 finished with value: 0.21670123637835056 and parameters: {'topK': 85, 'shrink': 127, 'feature_weighting': 'TF-IDF'}. Best is trial 10 with value: 0.21699762942341766.
6835.8s 851 [0.21702183707795672, 0.21686064265851723, 0.21658364927831103, 0.2171527199751141, 0.2158873329018537]
6836.2s 852 Unable to load Cython Compute_Similarity, reverting to Python
6849.5s 853 Similarity column 6969 (100.0%), 516.26 column/sec. Elapsed time 13.50 sec
6849.7s 854 EvaluatorHoldout: Ignoring 48 ( 0.2%) Users that have less than 1 test interactions
6875.1s 855 EvaluatorHoldout: Processed 27047 (100.0%) in 25.47 sec. Users per second: 1062
6875.6s 856 Unable to load Cython Compute_Similarity, reverting to Python
6888.7s 857 Similarity column 6969 (100.0%), 524.56 column/sec. Elapsed time 13.29 sec
6888.9s 858 EvaluatorHoldout: Ignoring 29 ( 0.1%) Users that have less than 1 test interactions
6915.0s 859 EvaluatorHoldout: Processed 27066 (100.0%) in 26.19 sec. Users per second: 1034
6915.5s 860 Unable to load Cython Compute_Similarity, reverting to Python
6928.8s 861 Similarity column 6969 (100.0%), 512.94 column/sec. Elapsed time 13.59 sec
6929.0s 862 EvaluatorHoldout: Ignoring 42 ( 0.2%) Users that have less than 1 test interactions
6954.7s 863 EvaluatorHoldout: Processed 27053 (100.0%) in 25.79 sec. Users per second: 1049
6955.2s 864 Unable to load Cython Compute_Similarity, reverting to Python
6968.7s 865 Similarity column 6969 (100.0%), 508.61 column/sec. Elapsed time 13.70 sec
6968.9s 866 EvaluatorHoldout: Ignoring 38 ( 0.1%) Users that have less than 1 test interactions
6994.4s 867 EvaluatorHoldout: Processed 27057 (100.0%) in 25.55 sec. Users per second: 1059
6994.9s 868 Unable to load Cython Compute_Similarity, reverting to Python
7008.9s 869 Similarity column 6969 (100.0%), 491.57 column/sec. Elapsed time 14.18 sec
7009.1s 870 EvaluatorHoldout: Ignoring 32 ( 0.1%) Users that have less than 1 test interactions
7035.3s 871 EvaluatorHoldout: Processed 27063 (100.0%) in 26.30 sec. Users per second: 1029
7035.3s 872 [I 2025-12-06 23:15:06,244] Trial 34 finished with value: 0.21549095582691774 and parameters: {'topK': 178, 'shrink': 45, 'feature_weighting': 'TF-IDF'}. Best is trial 10 with value: 0.21699762942341766.
7035.3s 873 
7035.3s 874 [I 2025-12-06 23:15:06,244] Trial 34 finished with value: 0.21549095582691774 and parameters: {'topK': 178, 'shrink': 45, 'feature_weighting': 'TF-IDF'}. Best is trial 10 with value: 0.21699762942341766.
7035.5s 875 [0.21607562021899884, 0.21551688105633965, 0.2147596771527776, 0.2160371110987808, 0.21506548960769198]
7035.8s 876 Unable to load Cython Compute_Similarity, reverting to Python
7049.0s 877 Similarity column 6969 (100.0%), 520.47 column/sec. Elapsed time 13.39 sec
7049.2s 878 EvaluatorHoldout: Ignoring 48 ( 0.2%) Users that have less than 1 test interactions
7074.7s 879 EvaluatorHoldout: Processed 27047 (100.0%) in 25.52 sec. Users per second: 1060
7075.2s 880 Unable to load Cython Compute_Similarity, reverting to Python
7088.1s 881 Similarity column 6969 (100.0%), 529.30 column/sec. Elapsed time 13.17 sec
7088.3s 882 EvaluatorHoldout: Ignoring 29 ( 0.1%) Users that have less than 1 test interactions
7114.0s 883 EvaluatorHoldout: Processed 27066 (100.0%) in 25.72 sec. Users per second: 1052
7114.4s 884 Unable to load Cython Compute_Similarity, reverting to Python
7127.8s 885 Similarity column 6969 (100.0%), 512.27 column/sec. Elapsed time 13.60 sec
7128.0s 886 EvaluatorHoldout: Ignoring 42 ( 0.2%) Users that have less than 1 test interactions
7153.5s 887 EvaluatorHoldout: Processed 27053 (100.0%) in 25.55 sec. Users per second: 1059
7154.0s 888 Unable to load Cython Compute_Similarity, reverting to Python
7167.1s 889 Similarity column 6969 (100.0%), 522.66 column/sec. Elapsed time 13.33 sec
7167.3s 890 EvaluatorHoldout: Ignoring 38 ( 0.1%) Users that have less than 1 test interactions
7192.6s 891 EvaluatorHoldout: Processed 27057 (100.0%) in 25.38 sec. Users per second: 1066
7193.1s 892 Unable to load Cython Compute_Similarity, reverting to Python
7206.0s 893 Similarity column 6969 (100.0%), 534.99 column/sec. Elapsed time 13.03 sec
7206.2s 894 EvaluatorHoldout: Ignoring 32 ( 0.1%) Users that have less than 1 test interactions
7232.0s 895 EvaluatorHoldout: Processed 27063 (100.0%) in 25.90 sec. Users per second: 1045
7232.0s 896 [I 2025-12-06 23:18:22,911] Trial 35 finished with value: 0.21598745105970635 and parameters: {'topK': 151, 'shrink': 177, 'feature_weighting': 'TF-IDF'}. Best is trial 10 with value: 0.21699762942341766.
7232.0s 897 
7232.0s 898 [I 2025-12-06 23:18:22,911] Trial 35 finished with value: 0.21598745105970635 and parameters: {'topK': 151, 'shrink': 177, 'feature_weighting': 'TF-IDF'}. Best is trial 10 with value: 0.21699762942341766.
7232.1s 899 [0.21628180413296572, 0.21593052563348758, 0.21554091009250415, 0.21692596760245228, 0.2152580478371222]
7232.5s 900 Unable to load Cython Compute_Similarity, reverting to Python
7246.1s 901 Similarity column 6969 (100.0%), 503.55 column/sec. Elapsed time 13.84 sec
7246.3s 902 EvaluatorHoldout: Ignoring 48 ( 0.2%) Users that have less than 1 test interactions
7273.0s 903 EvaluatorHoldout: Processed 27047 (100.0%) in 26.78 sec. Users per second: 1010
7273.5s 904 Unable to load Cython Compute_Similarity, reverting to Python
7286.6s 905 Similarity column 6969 (100.0%), 524.09 column/sec. Elapsed time 13.30 sec
7286.8s 906 EvaluatorHoldout: Ignoring 29 ( 0.1%) Users that have less than 1 test interactions
7313.4s 907 EvaluatorHoldout: Processed 27066 (100.0%) in 26.61 sec. Users per second: 1017
7313.9s 908 Unable to load Cython Compute_Similarity, reverting to Python
7327.1s 909 Similarity column 6969 (100.0%), 516.97 column/sec. Elapsed time 13.48 sec
7327.3s 910 EvaluatorHoldout: Ignoring 42 ( 0.2%) Users that have less than 1 test interactions
7354.2s 911 EvaluatorHoldout: Processed 27053 (100.0%) in 26.94 sec. Users per second: 1004
7354.7s 912 Unable to load Cython Compute_Similarity, reverting to Python
7367.9s 913 Similarity column 6969 (100.0%), 518.48 column/sec. Elapsed time 13.44 sec
7368.1s 914 EvaluatorHoldout: Ignoring 38 ( 0.1%) Users that have less than 1 test interactions
7395.1s 915 EvaluatorHoldout: Processed 27057 (100.0%) in 27.07 sec. Users per second: 999
7395.6s 916 Unable to load Cython Compute_Similarity, reverting to Python
7409.0s 917 Similarity column 6969 (100.0%), 514.11 column/sec. Elapsed time 13.56 sec
7409.2s 918 EvaluatorHoldout: Ignoring 32 ( 0.1%) Users that have less than 1 test interactions
7435.8s 919 EvaluatorHoldout: Processed 27063 (100.0%) in 26.70 sec. Users per second: 1014
7435.8s 920 [I 2025-12-06 23:21:46,745] Trial 36 finished with value: 0.21482652909773897 and parameters: {'topK': 215, 'shrink': 97, 'feature_weighting': 'TF-IDF'}. Best is trial 10 with value: 0.21699762942341766.
7435.8s 921 
