7435.8s 922 [I 2025-12-06 23:21:46,745] Trial 36 finished with value: 0.21482652909773897 and parameters: {'topK': 215, 'shrink': 97, 'feature_weighting': 'TF-IDF'}. Best is trial 10 with value: 0.21699762942341766.
7436.0s 923 [0.21569811098415156, 0.2144687060267556, 0.2141366420067918, 0.21533943068587746, 0.2144897557851183]
7436.3s 924 Unable to load Cython Compute_Similarity, reverting to Python
7452.3s 925 Similarity column 6969 (100.0%), 431.14 column/sec. Elapsed time 16.16 sec
7452.5s 926 EvaluatorHoldout: Ignoring 48 ( 0.2%) Users that have less than 1 test interactions
7489.8s 927 EvaluatorHoldout: Processed 27047 (100.0%) in 37.31 sec. Users per second: 725
7490.3s 928 Unable to load Cython Compute_Similarity, reverting to Python
7506.7s 929 Similarity column 6969 (100.0%), 419.61 column/sec. Elapsed time 16.61 sec
7506.9s 930 EvaluatorHoldout: Ignoring 29 ( 0.1%) Users that have less than 1 test interactions
7543.3s 931 EvaluatorHoldout: Processed 27066 (100.0%) in 36.45 sec. Users per second: 743
7543.8s 932 Unable to load Cython Compute_Similarity, reverting to Python
7559.3s 933 Similarity column 6969 (100.0%), 445.13 column/sec. Elapsed time 15.66 sec
7559.5s 934 EvaluatorHoldout: Ignoring 42 ( 0.2%) Users that have less than 1 test interactions
7595.2s 935 EvaluatorHoldout: Processed 27053 (100.0%) in 35.71 sec. Users per second: 758
7595.6s 936 Unable to load Cython Compute_Similarity, reverting to Python
7611.0s 937 Similarity column 6969 (100.0%), 446.90 column/sec. Elapsed time 15.59 sec
7611.2s 938 EvaluatorHoldout: Ignoring 38 ( 0.1%) Users that have less than 1 test interactions
7647.1s 939 EvaluatorHoldout: Processed 27057 (100.0%) in 35.84 sec. Users per second: 755
7647.5s 940 Unable to load Cython Compute_Similarity, reverting to Python
7662.8s 941 Similarity column 6969 (100.0%), 452.23 column/sec. Elapsed time 15.41 sec
7663.0s 942 EvaluatorHoldout: Ignoring 32 ( 0.1%) Users that have less than 1 test interactions
7698.4s 943 EvaluatorHoldout: Processed 27063 (100.0%) in 35.50 sec. Users per second: 762
7698.4s 944 [I 2025-12-06 23:26:09,357] Trial 37 finished with value: 0.20602205765589798 and parameters: {'topK': 547, 'shrink': 570, 'feature_weighting': 'TF-IDF'}. Best is trial 10 with value: 0.21699762942341766.
7698.4s 945 
7698.4s 946 [I 2025-12-06 23:26:09,357] Trial 37 finished with value: 0.20602205765589798 and parameters: {'topK': 547, 'shrink': 570, 'feature_weighting': 'TF-IDF'}. Best is trial 10 with value: 0.21699762942341766.
7698.6s 947 [0.2070434063768234, 0.20556378310984652, 0.20498055110234656, 0.2069884800362966, 0.20553406765417676]
7699.0s 948 Unable to load Cython Compute_Similarity, reverting to Python
7710.4s 949 Similarity column 6969 (100.0%), 596.54 column/sec. Elapsed time 11.68 sec
7710.6s 950 EvaluatorHoldout: Ignoring 48 ( 0.2%) Users that have less than 1 test interactions
7732.0s 951 EvaluatorHoldout: Processed 27047 (100.0%) in 21.42 sec. Users per second: 1263
7732.5s 952 Unable to load Cython Compute_Similarity, reverting to Python
7745.4s 953 Similarity column 6969 (100.0%), 532.79 column/sec. Elapsed time 13.08 sec
7745.6s 954 EvaluatorHoldout: Ignoring 29 ( 0.1%) Users that have less than 1 test interactions
7767.3s 955 EvaluatorHoldout: Processed 27066 (100.0%) in 21.82 sec. Users per second: 1240
7767.8s 956 Unable to load Cython Compute_Similarity, reverting to Python
7779.8s 957 Similarity column 6969 (100.0%), 569.70 column/sec. Elapsed time 12.23 sec
7780.0s 958 EvaluatorHoldout: Ignoring 42 ( 0.2%) Users that have less than 1 test interactions
7801.8s 959 EvaluatorHoldout: Processed 27053 (100.0%) in 21.85 sec. Users per second: 1238
7802.3s 960 Unable to load Cython Compute_Similarity, reverting to Python
7814.9s 961 Similarity column 6969 (100.0%), 544.03 column/sec. Elapsed time 12.81 sec
7815.1s 962 EvaluatorHoldout: Ignoring 38 ( 0.1%) Users that have less than 1 test interactions
7837.1s 963 EvaluatorHoldout: Processed 27057 (100.0%) in 22.15 sec. Users per second: 1221
7837.6s 964 Unable to load Cython Compute_Similarity, reverting to Python
7849.6s 965 Similarity column 6969 (100.0%), 573.27 column/sec. Elapsed time 12.16 sec
7849.8s 966 EvaluatorHoldout: Ignoring 32 ( 0.1%) Users that have less than 1 test interactions
7872.3s 967 EvaluatorHoldout: Processed 27063 (100.0%) in 22.55 sec. Users per second: 1200
7872.3s 968 [I 2025-12-06 23:29:03,173] Trial 38 finished with value: 0.19390432631767937 and parameters: {'topK': 84, 'shrink': 294, 'feature_weighting': 'BM25'}. Best is trial 10 with value: 0.21699762942341766.
7872.3s 969 
7872.3s 970 [I 2025-12-06 23:29:03,173] Trial 38 finished with value: 0.19390432631767937 and parameters: {'topK': 84, 'shrink': 294, 'feature_weighting': 'BM25'}. Best is trial 10 with value: 0.21699762942341766.
7872.4s 971 [0.1947641411451277, 0.19403628179613402, 0.19311927949794577, 0.19389211028571945, 0.1937098188634699]
7872.4s 972 Unable to load Cython Compute_Similarity, reverting to Python
7888.4s 973 Similarity column 6969 (100.0%), 433.61 column/sec. Elapsed time 16.07 sec
7888.6s 974 EvaluatorHoldout: Ignoring 48 ( 0.2%) Users that have less than 1 test interactions
7926.9s 975 EvaluatorHoldout: Processed 27047 (100.0%) in 38.27 sec. Users per second: 707
7927.0s 976 Unable to load Cython Compute_Similarity, reverting to Python
7942.7s 977 Similarity column 6969 (100.0%), 443.75 column/sec. Elapsed time 15.70 sec
7942.9s 978 EvaluatorHoldout: Ignoring 29 ( 0.1%) Users that have less than 1 test interactions
7981.5s 979 EvaluatorHoldout: Processed 27066 (100.0%) in 38.66 sec. Users per second: 700
7981.7s 980 Unable to load Cython Compute_Similarity, reverting to Python
7997.5s 981 Similarity column 6969 (100.0%), 440.34 column/sec. Elapsed time 15.83 sec
7997.7s 982 EvaluatorHoldout: Ignoring 42 ( 0.2%) Users that have less than 1 test interactions
8035.7s 983 EvaluatorHoldout: Processed 27053 (100.0%) in 38.05 sec. Users per second: 711
8035.8s 984 Unable to load Cython Compute_Similarity, reverting to Python
8051.7s 985 Similarity column 6969 (100.0%), 437.90 column/sec. Elapsed time 15.91 sec
8051.9s 986 EvaluatorHoldout: Ignoring 38 ( 0.1%) Users that have less than 1 test interactions
8090.1s 987 EvaluatorHoldout: Processed 27057 (100.0%) in 38.24 sec. Users per second: 708
8090.3s 988 Unable to load Cython Compute_Similarity, reverting to Python
8105.7s 989 Similarity column 6969 (100.0%), 451.74 column/sec. Elapsed time 15.43 sec
8105.9s 990 EvaluatorHoldout: Ignoring 32 ( 0.1%) Users that have less than 1 test interactions
8144.5s 991 EvaluatorHoldout: Processed 27063 (100.0%) in 38.68 sec. Users per second: 700
8144.5s 992 [I 2025-12-06 23:33:35,405] Trial 39 finished with value: 0.19473480530702902 and parameters: {'topK': 437, 'shrink': 377, 'feature_weighting': 'none'}. Best is trial 10 with value: 0.21699762942341766.
8144.5s 993 
8144.5s 994 [I 2025-12-06 23:33:35,405] Trial 39 finished with value: 0.19473480530702902 and parameters: {'topK': 437, 'shrink': 377, 'feature_weighting': 'none'}. Best is trial 10 with value: 0.21699762942341766.
8144.6s 995 [0.19547693560508114, 0.19409660386726188, 0.19368038076409003, 0.19583335030497112, 0.19458675599374084]
8145.0s 996 Unable to load Cython Compute_Similarity, reverting to Python
8158.7s 997 Similarity column 6969 (100.0%), 502.76 column/sec. Elapsed time 13.86 sec
8158.9s 998 EvaluatorHoldout: Ignoring 48 ( 0.2%) Users that have less than 1 test interactions
8187.2s 999 EvaluatorHoldout: Processed 27047 (100.0%) in 28.45 sec. Users per second: 951
8187.7s 1000 Unable to load Cython Compute_Similarity, reverting to Python
8202.1s 1001 Similarity column 6969 (100.0%), 477.17 column/sec. Elapsed time 14.60 sec
8202.3s 1002 EvaluatorHoldout: Ignoring 29 ( 0.1%) Users that have less than 1 test interactions
8231.0s 1003 EvaluatorHoldout: Processed 27066 (100.0%) in 28.75 sec. Users per second: 941
8231.5s 1004 Unable to load Cython Compute_Similarity, reverting to Python
8244.7s 1005 Similarity column 6969 (100.0%), 519.21 column/sec. Elapsed time 13.42 sec
8244.9s 1006 EvaluatorHoldout: Ignoring 42 ( 0.2%) Users that have less than 1 test interactions
8272.8s 1007 EvaluatorHoldout: Processed 27053 (100.0%) in 27.95 sec. Users per second: 968
8273.3s 1008 Unable to load Cython Compute_Similarity, reverting to Python
8286.3s 1009 Similarity column 6969 (100.0%), 526.94 column/sec. Elapsed time 13.23 sec
8286.5s 1010 EvaluatorHoldout: Ignoring 38 ( 0.1%) Users that have less than 1 test interactions
8314.4s 1011 EvaluatorHoldout: Processed 27057 (100.0%) in 27.94 sec. Users per second: 968
8314.9s 1012 Unable to load Cython Compute_Similarity, reverting to Python
8328.2s 1013 Similarity column 6969 (100.0%), 515.44 column/sec. Elapsed time 13.52 sec
8328.4s 1014 EvaluatorHoldout: Ignoring 32 ( 0.1%) Users that have less than 1 test interactions
8356.7s 1015 EvaluatorHoldout: Processed 27063 (100.0%) in 28.43 sec. Users per second: 952
8356.8s 1016 [I 2025-12-06 23:37:07,665] Trial 40 finished with value: 0.2140867291673228 and parameters: {'topK': 242, 'shrink': 194, 'feature_weighting': 'TF-IDF'}. Best is trial 10 with value: 0.21699762942341766.
8356.8s 1017 
8356.8s 1018 [I 2025-12-06 23:37:07,665] Trial 40 finished with value: 0.2140867291673228 and parameters: {'topK': 242, 'shrink': 194, 'feature_weighting': 'TF-IDF'}. Best is trial 10 with value: 0.21699762942341766.
8356.9s 1019 [0.21471519450537255, 0.21378452241590143, 0.21307747928773882, 0.21493957572643252, 0.21391687390116854]
8357.2s 1020 Unable to load Cython Compute_Similarity, reverting to Python
8369.5s 1021 Similarity column 6969 (100.0%), 561.27 column/sec. Elapsed time 12.42 sec
8369.7s 1022 EvaluatorHoldout: Ignoring 48 ( 0.2%) Users that have less than 1 test interactions
8391.5s 1023 EvaluatorHoldout: Processed 27047 (100.0%) in 21.92 sec. Users per second: 1234
8392.0s 1024 Unable to load Cython Compute_Similarity, reverting to Python
8403.8s 1025 Similarity column 6969 (100.0%), 581.06 column/sec. Elapsed time 11.99 sec
8404.0s 1026 EvaluatorHoldout: Ignoring 29 ( 0.1%) Users that have less than 1 test interactions
8426.4s 1027 EvaluatorHoldout: Processed 27066 (100.0%) in 22.52 sec. Users per second: 1202
8426.9s 1028 Unable to load Cython Compute_Similarity, reverting to Python
8439.5s 1029 Similarity column 6969 (100.0%), 544.51 column/sec. Elapsed time 12.80 sec
8439.7s 1030 EvaluatorHoldout: Ignoring 42 ( 0.2%) Users that have less than 1 test interactions
8462.1s 1031 EvaluatorHoldout: Processed 27053 (100.0%) in 22.50 sec. Users per second: 1202
8462.6s 1032 Unable to load Cython Compute_Similarity, reverting to Python
8475.2s 1033 Similarity column 6969 (100.0%), 543.51 column/sec. Elapsed time 12.82 sec
8475.4s 1034 EvaluatorHoldout: Ignoring 38 ( 0.1%) Users that have less than 1 test interactions
8498.3s 1035 EvaluatorHoldout: Processed 27057 (100.0%) in 22.92 sec. Users per second: 1180
8498.8s 1036 Unable to load Cython Compute_Similarity, reverting to Python
8510.6s 1037 Similarity column 6969 (100.0%), 578.59 column/sec. Elapsed time 12.04 sec
8510.8s 1038 EvaluatorHoldout: Ignoring 32 ( 0.1%) Users that have less than 1 test interactions
8532.7s 1039 EvaluatorHoldout: Processed 27063 (100.0%) in 22.03 sec. Users per second: 1229
8532.8s 1040 [I 2025-12-06 23:40:03,656] Trial 41 finished with value: 0.21686892680840136 and parameters: {'topK': 102, 'shrink': 74, 'feature_weighting': 'TF-IDF'}. Best is trial 10 with value: 0.21699762942341766.
8532.8s 1041 
8532.8s 1042 [I 2025-12-06 23:40:03,656] Trial 41 finished with value: 0.21686892680840136 and parameters: {'topK': 102, 'shrink': 74, 'feature_weighting': 'TF-IDF'}. Best is trial 10 with value: 0.21699762942341766.
8532.9s 1043 [0.21741549085374018, 0.2168543832687423, 0.2164788487886864, 0.21744240243867524, 0.2161535086921628]
8533.2s 1044 Unable to load Cython Compute_Similarity, reverting to Python
8545.0s 1045 Similarity column 6969 (100.0%), 583.91 column/sec. Elapsed time 11.93 sec
8545.2s 1046 EvaluatorHoldout: Ignoring 48 ( 0.2%) Users that have less than 1 test interactions
8566.5s 1047 EvaluatorHoldout: Processed 27047 (100.0%) in 21.43 sec. Users per second: 1262
8567.0s 1048 Unable to load Cython Compute_Similarity, reverting to Python
8578.3s 1049 Similarity column 6969 (100.0%), 602.54 column/sec. Elapsed time 11.57 sec
8578.5s 1050 EvaluatorHoldout: Ignoring 29 ( 0.1%) Users that have less than 1 test interactions
8600.3s 1051 EvaluatorHoldout: Processed 27066 (100.0%) in 21.81 sec. Users per second: 1241
8600.7s 1052 Unable to load Cython Compute_Similarity, reverting to Python
8612.2s 1053 Similarity column 6969 (100.0%), 598.44 column/sec. Elapsed time 11.65 sec
8612.4s 1054 EvaluatorHoldout: Ignoring 42 ( 0.2%) Users that have less than 1 test interactions
8634.0s 1055 EvaluatorHoldout: Processed 27053 (100.0%) in 21.74 sec. Users per second: 1244
8634.5s 1056 Unable to load Cython Compute_Similarity, reverting to Python
8646.3s 1057 Similarity column 6969 (100.0%), 578.97 column/sec. Elapsed time 12.04 sec
8646.5s 1058 EvaluatorHoldout: Ignoring 38 ( 0.1%) Users that have less than 1 test interactions
8668.1s 1059 EvaluatorHoldout: Processed 27057 (100.0%) in 21.69 sec. Users per second: 1247
8668.6s 1060 Unable to load Cython Compute_Similarity, reverting to Python
8679.6s 1061 Similarity column 6969 (100.0%), 623.14 column/sec. Elapsed time 11.18 sec
8679.8s 1062 EvaluatorHoldout: Ignoring 32 ( 0.1%) Users that have less than 1 test interactions
8701.6s 1063 EvaluatorHoldout: Processed 27063 (100.0%) in 21.91 sec. Users per second: 1235
8701.6s 1064 [I 2025-12-06 23:42:52,522] Trial 42 finished with value: 0.21685816183403564 and parameters: {'topK': 94, 'shrink': 128, 'feature_weighting': 'TF-IDF'}. Best is trial 10 with value: 0.21699762942341766.
8701.6s 1065 
8701.6s 1066 [I 2025-12-06 23:42:52,522] Trial 42 finished with value: 0.21685816183403564 and parameters: {'topK': 94, 'shrink': 128, 'feature_weighting': 'TF-IDF'}. Best is trial 10 with value: 0.21699762942341766.
8701.7s 1067 [0.21721473206728747, 0.21697284822651602, 0.21653322184763252, 0.21742189885993451, 0.21614810816880767]
8702.1s 1068 Unable to load Cython Compute_Similarity, reverting to Python
8713.6s 1069 Similarity column 6969 (100.0%), 597.88 column/sec. Elapsed time 11.66 sec
8713.8s 1070 EvaluatorHoldout: Ignoring 48 ( 0.2%) Users that have less than 1 test interactions
8734.0s 1071 EvaluatorHoldout: Processed 27047 (100.0%) in 20.33 sec. Users per second: 1330
8734.5s 1072 Unable to load Cython Compute_Similarity, reverting to Python
8745.7s 1073 Similarity column 6969 (100.0%), 611.90 column/sec. Elapsed time 11.39 sec
8745.9s 1074 EvaluatorHoldout: Ignoring 29 ( 0.1%) Users that have less than 1 test interactions
8766.2s 1075 EvaluatorHoldout: Processed 27066 (100.0%) in 20.42 sec. Users per second: 1326
8766.7s 1076 Unable to load Cython Compute_Similarity, reverting to Python
8778.1s 1077 Similarity column 6969 (100.0%), 599.40 column/sec. Elapsed time 11.63 sec
8778.3s 1078 EvaluatorHoldout: Ignoring 42 ( 0.2%) Users that have less than 1 test interactions
8798.6s 1079 EvaluatorHoldout: Processed 27053 (100.0%) in 20.41 sec. Users per second: 1326
8799.1s 1080 Unable to load Cython Compute_Similarity, reverting to Python
8810.3s 1081 Similarity column 6969 (100.0%), 609.28 column/sec. Elapsed time 11.44 sec
8810.5s 1082 EvaluatorHoldout: Ignoring 38 ( 0.1%) Users that have less than 1 test interactions
8830.8s 1083 EvaluatorHoldout: Processed 27057 (100.0%) in 20.34 sec. Users per second: 1330
8831.3s 1084 Unable to load Cython Compute_Similarity, reverting to Python
8842.4s 1085 Similarity column 6969 (100.0%), 612.52 column/sec. Elapsed time 11.38 sec
8842.6s 1086 EvaluatorHoldout: Ignoring 32 ( 0.1%) Users that have less than 1 test interactions
8863.0s 1087 EvaluatorHoldout: Processed 27063 (100.0%) in 20.46 sec. Users per second: 1323
8863.0s 1088 [I 2025-12-06 23:45:33,906] Trial 43 finished with value: 0.2168711114477361 and parameters: {'topK': 65, 'shrink': 41, 'feature_weighting': 'TF-IDF'}. Best is trial 10 with value: 0.21699762942341766.
8863.0s 1089 
8863.0s 1090 [I 2025-12-06 23:45:33,906] Trial 43 finished with value: 0.2168711114477361 and parameters: {'topK': 65, 'shrink': 41, 'feature_weighting': 'TF-IDF'}. Best is trial 10 with value: 0.21699762942341766.
8863.1s 1091 [0.21754686569859916, 0.2166723049907989, 0.21598036747003108, 0.21774797500720852, 0.21640804407204278]
8863.5s 1092 Unable to load Cython Compute_Similarity, reverting to Python
8875.9s 1093 Similarity column 6969 (100.0%), 554.01 column/sec. Elapsed time 12.58 sec
8876.1s 1094 EvaluatorHoldout: Ignoring 48 ( 0.2%) Users that have less than 1 test interactions
8900.3s 1095 EvaluatorHoldout: Processed 27047 (100.0%) in 24.33 sec. Users per second: 1112
8900.8s 1096 Unable to load Cython Compute_Similarity, reverting to Python
8913.0s 1097 Similarity column 6969 (100.0%), 560.62 column/sec. Elapsed time 12.43 sec
8913.2s 1098 EvaluatorHoldout: Ignoring 29 ( 0.1%) Users that have less than 1 test interactions
8938.1s 1099 EvaluatorHoldout: Processed 27066 (100.0%) in 24.92 sec. Users per second: 1086
8938.5s 1100 Unable to load Cython Compute_Similarity, reverting to Python
8951.2s 1101 Similarity column 6969 (100.0%), 539.69 column/sec. Elapsed time 12.91 sec
8951.4s 1102 EvaluatorHoldout: Ignoring 42 ( 0.2%) Users that have less than 1 test interactions
8976.2s 1103 EvaluatorHoldout: Processed 27053 (100.0%) in 24.79 sec. Users per second: 1091
8976.7s 1104 Unable to load Cython Compute_Similarity, reverting to Python
8989.7s 1105 Similarity column 6969 (100.0%), 526.25 column/sec. Elapsed time 13.24 sec
8989.9s 1106 EvaluatorHoldout: Ignoring 38 ( 0.1%) Users that have less than 1 test interactions
9015.5s 1107 EvaluatorHoldout: Processed 27057 (100.0%) in 25.66 sec. Users per second: 1054
9016.0s 1108 Unable to load Cython Compute_Similarity, reverting to Python
9029.5s 1109 Similarity column 6969 (100.0%), 507.29 column/sec. Elapsed time 13.74 sec
9029.7s 1110 EvaluatorHoldout: Ignoring 32 ( 0.1%) Users that have less than 1 test interactions
9054.5s 1111 EvaluatorHoldout: Processed 27063 (100.0%) in 24.88 sec. Users per second: 1088
9054.5s 1112 [I 2025-12-06 23:48:45,454] Trial 44 finished with value: 0.21594538247337375 and parameters: {'topK': 160, 'shrink': 88, 'feature_weighting': 'TF-IDF'}. Best is trial 10 with value: 0.21699762942341766.
9054.5s 1113 
9054.5s 1114 [I 2025-12-06 23:48:45,454] Trial 44 finished with value: 0.21594538247337375 and parameters: {'topK': 160, 'shrink': 88, 'feature_weighting': 'TF-IDF'}. Best is trial 10 with value: 0.21699762942341766.
9054.7s 1115 [0.21654239141194617, 0.21542315589350577, 0.21514654302491604, 0.2172134741371009, 0.2154013478993997]
9055.0s 1116 Unable to load Cython Compute_Similarity, reverting to Python
9067.1s 1117 Similarity column 6969 (100.0%), 567.35 column/sec. Elapsed time 12.28 sec
9067.3s 1118 EvaluatorHoldout: Ignoring 48 ( 0.2%) Users that have less than 1 test interactions
9089.7s 1119 EvaluatorHoldout: Processed 27047 (100.0%) in 22.52 sec. Users per second: 1201
9090.2s 1120 Unable to load Cython Compute_Similarity, reverting to Python
9101.7s 1121 Similarity column 6969 (100.0%), 594.48 column/sec. Elapsed time 11.72 sec
9101.9s 1122 EvaluatorHoldout: Ignoring 29 ( 0.1%) Users that have less than 1 test interactions
9124.3s 1123 EvaluatorHoldout: Processed 27066 (100.0%) in 22.45 sec. Users per second: 1205
9124.8s 1124 Unable to load Cython Compute_Similarity, reverting to Python
9136.7s 1125 Similarity column 6969 (100.0%), 576.54 column/sec. Elapsed time 12.09 sec
9136.9s 1126 EvaluatorHoldout: Ignoring 42 ( 0.2%) Users that have less than 1 test interactions
9159.6s 1127 EvaluatorHoldout: Processed 27053 (100.0%) in 22.80 sec. Users per second: 1187
9160.0s 1128 Unable to load Cython Compute_Similarity, reverting to Python
9172.1s 1129 Similarity column 6969 (100.0%), 567.66 column/sec. Elapsed time 12.28 sec
9172.3s 1130 EvaluatorHoldout: Ignoring 38 ( 0.1%) Users that have less than 1 test interactions
9194.8s 1131 EvaluatorHoldout: Processed 27057 (100.0%) in 22.55 sec. Users per second: 1200
9195.3s 1132 Unable to load Cython Compute_Similarity, reverting to Python
9207.6s 1133 Similarity column 6969 (100.0%), 556.45 column/sec. Elapsed time 12.52 sec
9207.8s 1134 EvaluatorHoldout: Ignoring 32 ( 0.1%) Users that have less than 1 test interactions
9230.4s 1135 EvaluatorHoldout: Processed 27063 (100.0%) in 22.67 sec. Users per second: 1194
9230.4s 1136 [I 2025-12-06 23:51:41,290] Trial 45 finished with value: 0.21646245627985888 and parameters: {'topK': 121, 'shrink': 5, 'feature_weighting': 'TF-IDF'}. Best is trial 10 with value: 0.21699762942341766.
9230.4s 1137 
