14396.8s 2362 [I 2025-12-07 12:53:52,212] Trial 96 finished with value: 0.225477489883699 and parameters: {'similarity': 'tversky', 'topK': 26, 'shrink': 203, 'tversky_alpha': 0.38480351396800594, 'tversky_beta': 1.3172378472136295}. Best is trial 91 with value: 0.24993110179607925.
14396.9s 2363 [0.22502089578268764, 0.22629602178286987, 0.22662337410348302, 0.22440775998113596, 0.22503939776831866]
14397.2s 2364 Unable to load Cython Compute_Similarity, reverting to Python
14407.0s 2365 Similarity column 6969 (100.0%), 698.87 column/sec. Elapsed time 9.97 sec
14407.2s 2366 EvaluatorHoldout: Ignoring 33 ( 0.1%) Users that have less than 1 test interactions
14423.5s 2367 EvaluatorHoldout: Processed 27062 (100.0%) in 16.50 sec. Users per second: 1640
14424.0s 2368 Unable to load Cython Compute_Similarity, reverting to Python
14433.9s 2369 Similarity column 6969 (100.0%), 699.38 column/sec. Elapsed time 9.96 sec
14434.0s 2370 EvaluatorHoldout: Ignoring 28 ( 0.1%) Users that have less than 1 test interactions
14450.3s 2371 EvaluatorHoldout: Processed 27067 (100.0%) in 16.49 sec. Users per second: 1642
14450.8s 2372 Unable to load Cython Compute_Similarity, reverting to Python
14460.8s 2373 Similarity column 6969 (100.0%), 682.98 column/sec. Elapsed time 10.20 sec
14461.0s 2374 EvaluatorHoldout: Ignoring 40 ( 0.1%) Users that have less than 1 test interactions
14477.5s 2375 EvaluatorHoldout: Processed 27055 (100.0%) in 16.55 sec. Users per second: 1635
14477.9s 2376 Unable to load Cython Compute_Similarity, reverting to Python
14488.2s 2377 Similarity column 6969 (100.0%), 661.39 column/sec. Elapsed time 10.54 sec
14488.4s 2378 EvaluatorHoldout: Ignoring 21 ( 0.1%) Users that have less than 1 test interactions
14504.6s 2379 EvaluatorHoldout: Processed 27074 (100.0%) in 16.28 sec. Users per second: 1663
14505.1s 2380 Unable to load Cython Compute_Similarity, reverting to Python
14515.0s 2381 Similarity column 6969 (100.0%), 695.62 column/sec. Elapsed time 10.02 sec
14515.1s 2382 EvaluatorHoldout: Ignoring 29 ( 0.1%) Users that have less than 1 test interactions
14531.4s 2383 EvaluatorHoldout: Processed 27066 (100.0%) in 16.45 sec. Users per second: 1646
14531.4s 2384 [I 2025-12-07 12:56:06,886] Trial 97 finished with value: 0.21076853856471897 and parameters: {'similarity': 'tversky', 'topK': 118, 'shrink': 249, 'tversky_alpha': 0.11634769356803981, 'tversky_beta': 1.4877873169038238}. Best is trial 91 with value: 0.24993110179607925.
14531.4s 2385 
14531.4s 2386 [I 2025-12-07 12:56:06,886] Trial 97 finished with value: 0.21076853856471897 and parameters: {'similarity': 'tversky', 'topK': 118, 'shrink': 249, 'tversky_alpha': 0.11634769356803981, 'tversky_beta': 1.4877873169038238}. Best is trial 91 with value: 0.24993110179607925.
14531.6s 2387 [0.20986261297689682, 0.21080176301584275, 0.21151615623272346, 0.21027852457752366, 0.21138363602060825]
14531.9s 2388 Unable to load Cython Compute_Similarity, reverting to Python
14541.2s 2389 Similarity column 6969 (100.0%), 730.68 column/sec. Elapsed time 9.54 sec
14541.4s 2390 EvaluatorHoldout: Ignoring 33 ( 0.1%) Users that have less than 1 test interactions
14557.3s 2391 EvaluatorHoldout: Processed 27062 (100.0%) in 15.94 sec. Users per second: 1698
14557.7s 2392 Unable to load Cython Compute_Similarity, reverting to Python
14567.0s 2393 Similarity column 6969 (100.0%), 732.31 column/sec. Elapsed time 9.52 sec
14567.2s 2394 EvaluatorHoldout: Ignoring 28 ( 0.1%) Users that have less than 1 test interactions
14583.2s 2395 EvaluatorHoldout: Processed 27067 (100.0%) in 16.13 sec. Users per second: 1678
14583.7s 2396 Unable to load Cython Compute_Similarity, reverting to Python
14593.3s 2397 Similarity column 6969 (100.0%), 717.70 column/sec. Elapsed time 9.71 sec
14593.4s 2398 EvaluatorHoldout: Ignoring 40 ( 0.1%) Users that have less than 1 test interactions
14609.3s 2399 EvaluatorHoldout: Processed 27055 (100.0%) in 16.12 sec. Users per second: 1678
14609.8s 2400 Unable to load Cython Compute_Similarity, reverting to Python
14619.6s 2401 Similarity column 6969 (100.0%), 698.07 column/sec. Elapsed time 9.98 sec
14619.8s 2402 EvaluatorHoldout: Ignoring 21 ( 0.1%) Users that have less than 1 test interactions
14635.8s 2403 EvaluatorHoldout: Processed 27074 (100.0%) in 16.08 sec. Users per second: 1684
14636.2s 2404 Unable to load Cython Compute_Similarity, reverting to Python
14645.7s 2405 Similarity column 6969 (100.0%), 716.84 column/sec. Elapsed time 9.72 sec
14645.9s 2406 EvaluatorHoldout: Ignoring 29 ( 0.1%) Users that have less than 1 test interactions
14662.0s 2407 EvaluatorHoldout: Processed 27066 (100.0%) in 16.17 sec. Users per second: 1673
14662.0s 2408 [I 2025-12-07 12:58:17,479] Trial 98 finished with value: 0.2102050310383347 and parameters: {'similarity': 'tversky', 'topK': 85, 'shrink': 287, 'tversky_alpha': 0.29241277574627544, 'tversky_beta': 1.720603830462291}. Best is trial 91 with value: 0.24993110179607925.
14662.0s 2409 
14662.0s 2410 [I 2025-12-07 12:58:17,479] Trial 98 finished with value: 0.2102050310383347 and parameters: {'similarity': 'tversky', 'topK': 85, 'shrink': 287, 'tversky_alpha': 0.29241277574627544, 'tversky_beta': 1.720603830462291}. Best is trial 91 with value: 0.24993110179607925.
14662.2s 2411 [0.20974015407542806, 0.21031152530276948, 0.21027737271536912, 0.2097046910536762, 0.21099141204443067]
14662.5s 2412 Unable to load Cython Compute_Similarity, reverting to Python
14671.8s 2413 Similarity column 6969 (100.0%), 738.87 column/sec. Elapsed time 9.43 sec
14671.9s 2414 EvaluatorHoldout: Ignoring 33 ( 0.1%) Users that have less than 1 test interactions
14686.3s 2415 EvaluatorHoldout: Processed 27062 (100.0%) in 14.53 sec. Users per second: 1862
14686.8s 2416 Unable to load Cython Compute_Similarity, reverting to Python
14695.8s 2417 Similarity column 6969 (100.0%), 756.54 column/sec. Elapsed time 9.21 sec
14696.0s 2418 EvaluatorHoldout: Ignoring 28 ( 0.1%) Users that have less than 1 test interactions
14710.5s 2419 EvaluatorHoldout: Processed 27067 (100.0%) in 14.64 sec. Users per second: 1849
14710.9s 2420 Unable to load Cython Compute_Similarity, reverting to Python
14720.3s 2421 Similarity column 6969 (100.0%), 732.48 column/sec. Elapsed time 9.51 sec
14720.5s 2422 EvaluatorHoldout: Ignoring 40 ( 0.1%) Users that have less than 1 test interactions
14734.8s 2423 EvaluatorHoldout: Processed 27055 (100.0%) in 14.55 sec. Users per second: 1860
14735.3s 2424 Unable to load Cython Compute_Similarity, reverting to Python
14744.6s 2425 Similarity column 6969 (100.0%), 744.73 column/sec. Elapsed time 9.36 sec
14744.7s 2426 EvaluatorHoldout: Ignoring 21 ( 0.1%) Users that have less than 1 test interactions
14759.1s 2427 EvaluatorHoldout: Processed 27074 (100.0%) in 14.59 sec. Users per second: 1856
14759.6s 2428 Unable to load Cython Compute_Similarity, reverting to Python
14769.0s 2429 Similarity column 6969 (100.0%), 724.05 column/sec. Elapsed time 9.62 sec
14769.2s 2430 EvaluatorHoldout: Ignoring 29 ( 0.1%) Users that have less than 1 test interactions
14783.9s 2431 EvaluatorHoldout: Processed 27066 (100.0%) in 14.69 sec. Users per second: 1843
14783.9s 2432 [I 2025-12-07 13:00:19,281] Trial 99 finished with value: 0.232395928072246 and parameters: {'similarity': 'tversky', 'topK': 46, 'shrink': 42, 'tversky_alpha': 0.1185725881081009, 'tversky_beta': 1.26209229481068}. Best is trial 91 with value: 0.24993110179607925.
14783.9s 2433 
14783.9s 2434 [I 2025-12-07 13:00:19,281] Trial 99 finished with value: 0.232395928072246 and parameters: {'similarity': 'tversky', 'topK': 46, 'shrink': 42, 'tversky_alpha': 0.1185725881081009, 'tversky_beta': 1.26209229481068}. Best is trial 91 with value: 0.24993110179607925.
14784.0s 2435 [0.23225535837329817, 0.2321289581241155, 0.23310395646995558, 0.23110209443183705, 0.23338927296202364]
14784.3s 2436 Unable to load Cython Compute_Similarity, reverting to Python
14799.2s 2437 Similarity column 6969 (100.0%), 461.79 column/sec. Elapsed time 15.09 sec
14799.4s 2438 EvaluatorHoldout: Ignoring 33 ( 0.1%) Users that have less than 1 test interactions
14824.9s 2439 EvaluatorHoldout: Processed 27062 (100.0%) in 25.47 sec. Users per second: 1063
14825.3s 2440 Unable to load Cython Compute_Similarity, reverting to Python
14840.0s 2441 Similarity column 6969 (100.0%), 467.73 column/sec. Elapsed time 14.90 sec
14840.2s 2442 EvaluatorHoldout: Ignoring 28 ( 0.1%) Users that have less than 1 test interactions
14865.8s 2443 EvaluatorHoldout: Processed 27067 (100.0%) in 25.55 sec. Users per second: 1059
14866.2s 2444 Unable to load Cython Compute_Similarity, reverting to Python
14881.3s 2445 Similarity column 6969 (100.0%), 455.66 column/sec. Elapsed time 15.29 sec
14881.5s 2446 EvaluatorHoldout: Ignoring 40 ( 0.1%) Users that have less than 1 test interactions
14906.7s 2447 EvaluatorHoldout: Processed 27055 (100.0%) in 25.22 sec. Users per second: 1073
14907.1s 2448 Unable to load Cython Compute_Similarity, reverting to Python
14922.0s 2449 Similarity column 6969 (100.0%), 462.06 column/sec. Elapsed time 15.08 sec
14922.2s 2450 EvaluatorHoldout: Ignoring 21 ( 0.1%) Users that have less than 1 test interactions
14948.0s 2451 EvaluatorHoldout: Processed 27074 (100.0%) in 25.57 sec. Users per second: 1059
14948.2s 2452 Unable to load Cython Compute_Similarity, reverting to Python
14963.0s 2453 Similarity column 6969 (100.0%), 467.75 column/sec. Elapsed time 14.90 sec
14963.2s 2454 EvaluatorHoldout: Ignoring 29 ( 0.1%) Users that have less than 1 test interactions
14989.1s 2455 EvaluatorHoldout: Processed 27066 (100.0%) in 25.87 sec. Users per second: 1046
14989.1s 2456 [I 2025-12-07 13:03:44,488] Trial 100 finished with value: 0.17995633179269815 and parameters: {'similarity': 'tversky', 'topK': 726, 'shrink': 336, 'tversky_alpha': 0.5347279927360977, 'tversky_beta': 1.1318050076741892}. Best is trial 91 with value: 0.24993110179607925.
14989.1s 2457 
14989.1s 2458 [I 2025-12-07 13:03:44,488] Trial 100 finished with value: 0.17995633179269815 and parameters: {'similarity': 'tversky', 'topK': 726, 'shrink': 336, 'tversky_alpha': 0.5347279927360977, 'tversky_beta': 1.1318050076741892}. Best is trial 91 with value: 0.24993110179607925.
14989.2s 2459 [0.18000126788783286, 0.17999622868702456, 0.17994180920880035, 0.17943643926288047, 0.18040591391695265]
14989.5s 2460 Unable to load Cython Compute_Similarity, reverting to Python
14998.5s 2461 Similarity column 6969 (100.0%), 755.65 column/sec. Elapsed time 9.22 sec
14998.7s 2462 EvaluatorHoldout: Ignoring 33 ( 0.1%) Users that have less than 1 test interactions
15012.4s 2463 EvaluatorHoldout: Processed 27062 (100.0%) in 13.86 sec. Users per second: 1953
15012.9s 2464 Unable to load Cython Compute_Similarity, reverting to Python
15021.8s 2465 Similarity column 6969 (100.0%), 776.99 column/sec. Elapsed time 8.97 sec
15021.9s 2466 EvaluatorHoldout: Ignoring 28 ( 0.1%) Users that have less than 1 test interactions
15035.6s 2467 EvaluatorHoldout: Processed 27067 (100.0%) in 13.90 sec. Users per second: 1947
15036.1s 2468 Unable to load Cython Compute_Similarity, reverting to Python
15045.3s 2469 Similarity column 6969 (100.0%), 742.84 column/sec. Elapsed time 9.38 sec
15045.5s 2470 EvaluatorHoldout: Ignoring 40 ( 0.1%) Users that have less than 1 test interactions
15059.3s 2471 EvaluatorHoldout: Processed 27055 (100.0%) in 13.87 sec. Users per second: 1950
15059.6s 2472 Unable to load Cython Compute_Similarity, reverting to Python
15068.4s 2473 Similarity column 6969 (100.0%), 775.11 column/sec. Elapsed time 8.99 sec
15068.6s 2474 EvaluatorHoldout: Ignoring 21 ( 0.1%) Users that have less than 1 test interactions
15082.5s 2475 EvaluatorHoldout: Processed 27074 (100.0%) in 14.02 sec. Users per second: 1931
15083.0s 2476 Unable to load Cython Compute_Similarity, reverting to Python
15092.0s 2477 Similarity column 6969 (100.0%), 762.41 column/sec. Elapsed time 9.14 sec
15092.1s 2478 EvaluatorHoldout: Ignoring 29 ( 0.1%) Users that have less than 1 test interactions
15106.0s 2479 EvaluatorHoldout: Processed 27066 (100.0%) in 14.04 sec. Users per second: 1928
15106.0s 2480 [I 2025-12-07 13:05:41,513] Trial 101 finished with value: 0.24300941196244435 and parameters: {'similarity': 'tversky', 'topK': 8, 'shrink': 379, 'tversky_alpha': 0.29356720101015144, 'tversky_beta': 1.3696839419841296}. Best is trial 91 with value: 0.24993110179607925.
15106.0s 2481 
15106.0s 2482 [I 2025-12-07 13:05:41,513] Trial 101 finished with value: 0.24300941196244435 and parameters: {'similarity': 'tversky', 'topK': 8, 'shrink': 379, 'tversky_alpha': 0.29356720101015144, 'tversky_beta': 1.3696839419841296}. Best is trial 91 with value: 0.24993110179607925.
15106.2s 2483 [0.2424846138537828, 0.24336840400696153, 0.24427356918844562, 0.24135788648701167, 0.24356258627602026]
15106.5s 2484 Unable to load Cython Compute_Similarity, reverting to Python
15115.7s 2485 Similarity column 6969 (100.0%), 743.40 column/sec. Elapsed time 9.37 sec
15115.9s 2486 EvaluatorHoldout: Ignoring 33 ( 0.1%) Users that have less than 1 test interactions
15130.3s 2487 EvaluatorHoldout: Processed 27062 (100.0%) in 14.49 sec. Users per second: 1868
15130.7s 2488 Unable to load Cython Compute_Similarity, reverting to Python
15139.9s 2489 Similarity column 6969 (100.0%), 742.12 column/sec. Elapsed time 9.39 sec
15140.1s 2490 EvaluatorHoldout: Ignoring 28 ( 0.1%) Users that have less than 1 test interactions
15154.5s 2491 EvaluatorHoldout: Processed 27067 (100.0%) in 14.64 sec. Users per second: 1849
15155.0s 2492 Unable to load Cython Compute_Similarity, reverting to Python
15164.7s 2493 Similarity column 6969 (100.0%), 713.91 column/sec. Elapsed time 9.76 sec
15164.8s 2494 EvaluatorHoldout: Ignoring 40 ( 0.1%) Users that have less than 1 test interactions
15179.1s 2495 EvaluatorHoldout: Processed 27055 (100.0%) in 14.51 sec. Users per second: 1864
15179.6s 2496 Unable to load Cython Compute_Similarity, reverting to Python
15189.0s 2497 Similarity column 6969 (100.0%), 727.88 column/sec. Elapsed time 9.57 sec
15189.2s 2498 EvaluatorHoldout: Ignoring 21 ( 0.1%) Users that have less than 1 test interactions
15203.7s 2499 EvaluatorHoldout: Processed 27074 (100.0%) in 14.50 sec. Users per second: 1868
15204.0s 2500 Unable to load Cython Compute_Similarity, reverting to Python
15213.1s 2501 Similarity column 6969 (100.0%), 751.60 column/sec. Elapsed time 9.27 sec
15213.3s 2502 EvaluatorHoldout: Ignoring 29 ( 0.1%) Users that have less than 1 test interactions
15227.6s 2503 EvaluatorHoldout: Processed 27066 (100.0%) in 14.47 sec. Users per second: 1870
15227.6s 2504 [I 2025-12-07 13:07:43,129] Trial 102 finished with value: 0.23276793963199865 and parameters: {'similarity': 'tversky', 'topK': 22, 'shrink': 220, 'tversky_alpha': 0.26715460031387306, 'tversky_beta': 1.357799185919304}. Best is trial 91 with value: 0.24993110179607925.
15227.6s 2505 
15227.6s 2506 [I 2025-12-07 13:07:43,129] Trial 102 finished with value: 0.23276793963199865 and parameters: {'similarity': 'tversky', 'topK': 22, 'shrink': 220, 'tversky_alpha': 0.26715460031387306, 'tversky_beta': 1.357799185919304}. Best is trial 91 with value: 0.24993110179607925.
15227.8s 2507 [0.2327639994446239, 0.23307246442011528, 0.23375625350550455, 0.23149106309680975, 0.23275591769293974]
15228.1s 2508 Unable to load Cython Compute_Similarity, reverting to Python
15237.0s 2509 Similarity column 6969 (100.0%), 773.12 column/sec. Elapsed time 9.01 sec
15237.1s 2510 EvaluatorHoldout: Ignoring 33 ( 0.1%) Users that have less than 1 test interactions
15253.0s 2511 EvaluatorHoldout: Processed 27062 (100.0%) in 16.02 sec. Users per second: 1689
15253.5s 2512 Unable to load Cython Compute_Similarity, reverting to Python
15262.4s 2513 Similarity column 6969 (100.0%), 760.50 column/sec. Elapsed time 9.16 sec
15262.6s 2514 EvaluatorHoldout: Ignoring 28 ( 0.1%) Users that have less than 1 test interactions
15278.6s 2515 EvaluatorHoldout: Processed 27067 (100.0%) in 15.98 sec. Users per second: 1693
15278.9s 2516 Unable to load Cython Compute_Similarity, reverting to Python
15287.7s 2517 Similarity column 6969 (100.0%), 775.14 column/sec. Elapsed time 8.99 sec
15287.9s 2518 EvaluatorHoldout: Ignoring 40 ( 0.1%) Users that have less than 1 test interactions
15304.0s 2519 EvaluatorHoldout: Processed 27055 (100.0%) in 16.25 sec. Users per second: 1665
15304.5s 2520 Unable to load Cython Compute_Similarity, reverting to Python
15313.4s 2521 Similarity column 6969 (100.0%), 777.97 column/sec. Elapsed time 8.96 sec
15313.5s 2522 EvaluatorHoldout: Ignoring 21 ( 0.1%) Users that have less than 1 test interactions
15329.3s 2523 EvaluatorHoldout: Processed 27074 (100.0%) in 16.00 sec. Users per second: 1692
15329.8s 2524 Unable to load Cython Compute_Similarity, reverting to Python
15338.5s 2525 Similarity column 6969 (100.0%), 778.36 column/sec. Elapsed time 8.95 sec
15338.7s 2526 EvaluatorHoldout: Ignoring 29 ( 0.1%) Users that have less than 1 test interactions
15354.7s 2527 EvaluatorHoldout: Processed 27066 (100.0%) in 15.99 sec. Users per second: 1693
15354.7s 2528 [I 2025-12-07 13:09:50,086] Trial 103 finished with value: 0.20221363020384606 and parameters: {'similarity': 'dice', 'topK': 45, 'shrink': 317}. Best is trial 91 with value: 0.24993110179607925.
15354.7s 2529 
15354.7s 2530 [I 2025-12-07 13:09:50,086] Trial 103 finished with value: 0.20221363020384606 and parameters: {'similarity': 'dice', 'topK': 45, 'shrink': 317}. Best is trial 91 with value: 0.24993110179607925.
15354.8s 2531 [0.20134921111930054, 0.2023411629400825, 0.20308071701714733, 0.20169799724311668, 0.20259906269958322]
15355.1s 2532 Unable to load Cython Compute_Similarity, reverting to Python
15363.8s 2533 Similarity column 6969 (100.0%), 783.98 column/sec. Elapsed time 8.89 sec
15364.0s 2534 EvaluatorHoldout: Ignoring 33 ( 0.1%) Users that have less than 1 test interactions
15377.4s 2535 EvaluatorHoldout: Processed 27062 (100.0%) in 13.57 sec. Users per second: 1995
15377.8s 2536 Unable to load Cython Compute_Similarity, reverting to Python
15386.7s 2537 Similarity column 6969 (100.0%), 778.85 column/sec. Elapsed time 8.95 sec
15386.8s 2538 EvaluatorHoldout: Ignoring 28 ( 0.1%) Users that have less than 1 test interactions
15400.3s 2539 EvaluatorHoldout: Processed 27067 (100.0%) in 13.70 sec. Users per second: 1975
15400.8s 2540 Unable to load Cython Compute_Similarity, reverting to Python
15410.0s 2541 Similarity column 6969 (100.0%), 744.32 column/sec. Elapsed time 9.36 sec
15410.2s 2542 EvaluatorHoldout: Ignoring 40 ( 0.1%) Users that have less than 1 test interactions
15423.9s 2543 EvaluatorHoldout: Processed 27055 (100.0%) in 13.78 sec. Users per second: 1964
15424.3s 2544 Unable to load Cython Compute_Similarity, reverting to Python
15433.3s 2545 Similarity column 6969 (100.0%), 756.12 column/sec. Elapsed time 9.22 sec
15433.5s 2546 EvaluatorHoldout: Ignoring 21 ( 0.1%) Users that have less than 1 test interactions
15447.1s 2547 EvaluatorHoldout: Processed 27074 (100.0%) in 13.80 sec. Users per second: 1962
15447.6s 2548 Unable to load Cython Compute_Similarity, reverting to Python
15456.6s 2549 Similarity column 6969 (100.0%), 768.62 column/sec. Elapsed time 9.07 sec
15456.7s 2550 EvaluatorHoldout: Ignoring 29 ( 0.1%) Users that have less than 1 test interactions
15470.3s 2551 EvaluatorHoldout: Processed 27066 (100.0%) in 13.78 sec. Users per second: 1964
15470.3s 2552 [I 2025-12-07 13:11:45,809] Trial 104 finished with value: 0.24857823118786265 and parameters: {'similarity': 'tversky', 'topK': 6, 'shrink': 293, 'tversky_alpha': 0.34158951058073744, 'tversky_beta': 1.7810559042339085}. Best is trial 91 with value: 0.24993110179607925.
15470.3s 2553 
15470.3s 2554 [I 2025-12-07 13:11:45,809] Trial 104 finished with value: 0.24857823118786265 and parameters: {'similarity': 'tversky', 'topK': 6, 'shrink': 293, 'tversky_alpha': 0.34158951058073744, 'tversky_beta': 1.7810559042339085}. Best is trial 91 with value: 0.24993110179607925.
15470.5s 2555 [0.24809071179068387, 0.24919419476346694, 0.24991771099337462, 0.2478901871103281, 0.24779835128145955]
15470.8s 2556 Unable to load Cython Compute_Similarity, reverting to Python
15479.8s 2557 Similarity column 6969 (100.0%), 759.59 column/sec. Elapsed time 9.17 sec
15480.0s 2558 EvaluatorHoldout: Ignoring 33 ( 0.1%) Users that have less than 1 test interactions
15496.6s 2559 EvaluatorHoldout: Processed 27062 (100.0%) in 16.64 sec. Users per second: 1626
15496.9s 2560 Unable to load Cython Compute_Similarity, reverting to Python
15506.0s 2561 Similarity column 6969 (100.0%), 756.52 column/sec. Elapsed time 9.21 sec
15506.2s 2562 EvaluatorHoldout: Ignoring 28 ( 0.1%) Users that have less than 1 test interactions
15522.6s 2563 EvaluatorHoldout: Processed 27067 (100.0%) in 16.66 sec. Users per second: 1625
15523.1s 2564 Unable to load Cython Compute_Similarity, reverting to Python
15532.4s 2565 Similarity column 6969 (100.0%), 747.26 column/sec. Elapsed time 9.33 sec
15532.5s 2566 EvaluatorHoldout: Ignoring 40 ( 0.1%) Users that have less than 1 test interactions
15548.8s 2567 EvaluatorHoldout: Processed 27055 (100.0%) in 16.55 sec. Users per second: 1635
15549.3s 2568 Unable to load Cython Compute_Similarity, reverting to Python
15558.3s 2569 Similarity column 6969 (100.0%), 757.84 column/sec. Elapsed time 9.20 sec
15558.5s 2570 EvaluatorHoldout: Ignoring 21 ( 0.1%) Users that have less than 1 test interactions
15575.0s 2571 EvaluatorHoldout: Processed 27074 (100.0%) in 16.56 sec. Users per second: 1635
15575.4s 2572 Unable to load Cython Compute_Similarity, reverting to Python
15584.5s 2573 Similarity column 6969 (100.0%), 752.67 column/sec. Elapsed time 9.26 sec
15584.7s 2574 EvaluatorHoldout: Ignoring 29 ( 0.1%) Users that have less than 1 test interactions
15601.2s 2575 EvaluatorHoldout: Processed 27066 (100.0%) in 16.72 sec. Users per second: 1619
