26377.7s 4616 [I 2025-12-07 16:13:33,207] Trial 190 finished with value: 0.23939735464374295 and parameters: {'similarity': 'tversky', 'topK': 5, 'shrink': 91, 'tversky_alpha': 0.32145688604543443, 'tversky_beta': 0.8444618978231824}. Best is trial 182 with value: 0.2514384438125787.
26377.7s 4617 
26377.7s 4618 [I 2025-12-07 16:13:33,207] Trial 190 finished with value: 0.23939735464374295 and parameters: {'similarity': 'tversky', 'topK': 5, 'shrink': 91, 'tversky_alpha': 0.32145688604543443, 'tversky_beta': 0.8444618978231824}. Best is trial 182 with value: 0.2514384438125787.
26377.9s 4619 [0.23877689225636997, 0.2399666057069815, 0.2412241767540649, 0.237552729928657, 0.2394663685726412]
26378.2s 4620 Unable to load Cython Compute_Similarity, reverting to Python
26387.1s 4621 Similarity column 6969 (100.0%), 763.58 column/sec. Elapsed time 9.13 sec
26387.3s 4622 EvaluatorHoldout: Ignoring 33 ( 0.1%) Users that have less than 1 test interactions
26401.0s 4623 EvaluatorHoldout: Processed 27062 (100.0%) in 13.59 sec. Users per second: 1992
26401.2s 4624 Unable to load Cython Compute_Similarity, reverting to Python
26410.0s 4625 Similarity column 6969 (100.0%), 781.21 column/sec. Elapsed time 8.92 sec
26410.2s 4626 EvaluatorHoldout: Ignoring 28 ( 0.1%) Users that have less than 1 test interactions
26423.7s 4627 EvaluatorHoldout: Processed 27067 (100.0%) in 13.67 sec. Users per second: 1980
26424.1s 4628 Unable to load Cython Compute_Similarity, reverting to Python
26433.1s 4629 Similarity column 6969 (100.0%), 779.72 column/sec. Elapsed time 8.94 sec
26433.1s 4630 EvaluatorHoldout: Ignoring 40 ( 0.1%) Users that have less than 1 test interactions
26446.4s 4631 EvaluatorHoldout: Processed 27055 (100.0%) in 13.49 sec. Users per second: 2005
26446.9s 4632 Unable to load Cython Compute_Similarity, reverting to Python
26455.6s 4633 Similarity column 6969 (100.0%), 781.29 column/sec. Elapsed time 8.92 sec
26455.8s 4634 EvaluatorHoldout: Ignoring 21 ( 0.1%) Users that have less than 1 test interactions
26469.6s 4635 EvaluatorHoldout: Processed 27074 (100.0%) in 13.70 sec. Users per second: 1976
26469.8s 4636 Unable to load Cython Compute_Similarity, reverting to Python
26479.0s 4637 Similarity column 6969 (100.0%), 747.76 column/sec. Elapsed time 9.32 sec
26479.2s 4638 EvaluatorHoldout: Ignoring 29 ( 0.1%) Users that have less than 1 test interactions
26492.6s 4639 EvaluatorHoldout: Processed 27066 (100.0%) in 13.60 sec. Users per second: 1989
26492.6s 4640 [I 2025-12-07 16:15:28,124] Trial 191 finished with value: 0.24963837859352161 and parameters: {'similarity': 'tversky', 'topK': 6, 'shrink': 214, 'tversky_alpha': 0.25050503846207606, 'tversky_beta': 1.549132298577213}. Best is trial 182 with value: 0.2514384438125787.
26492.6s 4641 
26492.6s 4642 [I 2025-12-07 16:15:28,124] Trial 191 finished with value: 0.24963837859352161 and parameters: {'similarity': 'tversky', 'topK': 6, 'shrink': 214, 'tversky_alpha': 0.25050503846207606, 'tversky_beta': 1.549132298577213}. Best is trial 182 with value: 0.2514384438125787.
26492.8s 4643 [0.24904566692725852, 0.2504535050403848, 0.2505296320154232, 0.248882142642184, 0.24928094634235756]
26493.1s 4644 Unable to load Cython Compute_Similarity, reverting to Python
26502.1s 4645 Similarity column 6969 (100.0%), 780.10 column/sec. Elapsed time 8.93 sec
26502.1s 4646 EvaluatorHoldout: Ignoring 33 ( 0.1%) Users that have less than 1 test interactions
26516.0s 4647 EvaluatorHoldout: Processed 27062 (100.0%) in 14.14 sec. Users per second: 1914
26516.5s 4648 Unable to load Cython Compute_Similarity, reverting to Python
26525.3s 4649 Similarity column 6969 (100.0%), 774.21 column/sec. Elapsed time 9.00 sec
26525.5s 4650 EvaluatorHoldout: Ignoring 28 ( 0.1%) Users that have less than 1 test interactions
26540.2s 4651 EvaluatorHoldout: Processed 27067 (100.0%) in 14.65 sec. Users per second: 1847
26540.5s 4652 Unable to load Cython Compute_Similarity, reverting to Python
26549.6s 4653 Similarity column 6969 (100.0%), 749.77 column/sec. Elapsed time 9.29 sec
26549.8s 4654 EvaluatorHoldout: Ignoring 40 ( 0.1%) Users that have less than 1 test interactions
26563.8s 4655 EvaluatorHoldout: Processed 27055 (100.0%) in 14.23 sec. Users per second: 1901
26564.3s 4656 Unable to load Cython Compute_Similarity, reverting to Python
26573.5s 4657 Similarity column 6969 (100.0%), 758.16 column/sec. Elapsed time 9.19 sec
26573.5s 4658 EvaluatorHoldout: Ignoring 21 ( 0.1%) Users that have less than 1 test interactions
26587.6s 4659 EvaluatorHoldout: Processed 27074 (100.0%) in 14.28 sec. Users per second: 1895
26588.1s 4660 Unable to load Cython Compute_Similarity, reverting to Python
26596.9s 4661 Similarity column 6969 (100.0%), 780.01 column/sec. Elapsed time 8.93 sec
26597.1s 4662 EvaluatorHoldout: Ignoring 29 ( 0.1%) Users that have less than 1 test interactions
26611.6s 4663 EvaluatorHoldout: Processed 27066 (100.0%) in 14.47 sec. Users per second: 1871
26611.6s 4664 [I 2025-12-07 16:17:26,872] Trial 192 finished with value: 0.2382040090362262 and parameters: {'similarity': 'tversky', 'topK': 24, 'shrink': 174, 'tversky_alpha': 0.2548130259578721, 'tversky_beta': 1.7604016559451938}. Best is trial 182 with value: 0.2514384438125787.
26611.6s 4665 
26611.6s 4666 [I 2025-12-07 16:17:26,872] Trial 192 finished with value: 0.2382040090362262 and parameters: {'similarity': 'tversky', 'topK': 24, 'shrink': 174, 'tversky_alpha': 0.2548130259578721, 'tversky_beta': 1.7604016559451938}. Best is trial 182 with value: 0.2514384438125787.
26611.6s 4667 [0.23829673464274073, 0.23834211860531362, 0.2396954481979918, 0.236154106169702, 0.23853163756538295]
26611.9s 4668 Unable to load Cython Compute_Similarity, reverting to Python
26620.8s 4669 Similarity column 6969 (100.0%), 764.04 column/sec. Elapsed time 9.12 sec
26621.0s 4670 EvaluatorHoldout: Ignoring 33 ( 0.1%) Users that have less than 1 test interactions
26635.8s 4671 EvaluatorHoldout: Processed 27062 (100.0%) in 14.97 sec. Users per second: 1807
26636.3s 4672 Unable to load Cython Compute_Similarity, reverting to Python
26645.5s 4673 Similarity column 6969 (100.0%), 756.58 column/sec. Elapsed time 9.21 sec
26645.5s 4674 EvaluatorHoldout: Ignoring 28 ( 0.1%) Users that have less than 1 test interactions
26660.3s 4675 EvaluatorHoldout: Processed 27067 (100.0%) in 14.98 sec. Users per second: 1807
26660.8s 4676 Unable to load Cython Compute_Similarity, reverting to Python
26670.1s 4677 Similarity column 6969 (100.0%), 736.91 column/sec. Elapsed time 9.46 sec
26670.3s 4678 EvaluatorHoldout: Ignoring 40 ( 0.1%) Users that have less than 1 test interactions
26685.3s 4679 EvaluatorHoldout: Processed 27055 (100.0%) in 14.98 sec. Users per second: 1806
26685.6s 4680 Unable to load Cython Compute_Similarity, reverting to Python
26694.6s 4681 Similarity column 6969 (100.0%), 752.51 column/sec. Elapsed time 9.26 sec
26694.8s 4682 EvaluatorHoldout: Ignoring 21 ( 0.1%) Users that have less than 1 test interactions
26709.7s 4683 EvaluatorHoldout: Processed 27074 (100.0%) in 15.03 sec. Users per second: 1802
26710.2s 4684 Unable to load Cython Compute_Similarity, reverting to Python
26719.6s 4685 Similarity column 6969 (100.0%), 744.94 column/sec. Elapsed time 9.36 sec
26719.6s 4686 EvaluatorHoldout: Ignoring 29 ( 0.1%) Users that have less than 1 test interactions
26734.5s 4687 EvaluatorHoldout: Processed 27066 (100.0%) in 15.08 sec. Users per second: 1795
26734.5s 4688 [I 2025-12-07 16:19:29,984] Trial 193 finished with value: 0.22802580488791016 and parameters: {'similarity': 'tversky', 'topK': 49, 'shrink': 251, 'tversky_alpha': 0.161013329192407, 'tversky_beta': 1.6481904347057674}. Best is trial 182 with value: 0.2514384438125787.
26734.5s 4689 
26734.5s 4690 [I 2025-12-07 16:19:29,984] Trial 193 finished with value: 0.22802580488791016 and parameters: {'similarity': 'tversky', 'topK': 49, 'shrink': 251, 'tversky_alpha': 0.161013329192407, 'tversky_beta': 1.6481904347057674}. Best is trial 182 with value: 0.2514384438125787.
26734.7s 4691 [0.22764577774550776, 0.22816292269326546, 0.2287489226469551, 0.22645977398749798, 0.22911162736632457]
26735.0s 4692 Unable to load Cython Compute_Similarity, reverting to Python
26743.9s 4693 Similarity column 6969 (100.0%), 759.93 column/sec. Elapsed time 9.17 sec
26744.1s 4694 EvaluatorHoldout: Ignoring 33 ( 0.1%) Users that have less than 1 test interactions
26758.6s 4695 EvaluatorHoldout: Processed 27062 (100.0%) in 14.31 sec. Users per second: 1892
26758.8s 4696 Unable to load Cython Compute_Similarity, reverting to Python
26767.8s 4697 Similarity column 6969 (100.0%), 754.69 column/sec. Elapsed time 9.23 sec
26768.0s 4698 EvaluatorHoldout: Ignoring 28 ( 0.1%) Users that have less than 1 test interactions
26782.2s 4699 EvaluatorHoldout: Processed 27067 (100.0%) in 14.39 sec. Users per second: 1881
26782.7s 4700 Unable to load Cython Compute_Similarity, reverting to Python
26792.7s 4701 Similarity column 6969 (100.0%), 701.97 column/sec. Elapsed time 9.93 sec
26792.7s 4702 EvaluatorHoldout: Ignoring 40 ( 0.1%) Users that have less than 1 test interactions
26806.7s 4703 EvaluatorHoldout: Processed 27055 (100.0%) in 14.24 sec. Users per second: 1899
26807.2s 4704 Unable to load Cython Compute_Similarity, reverting to Python
26816.9s 4705 Similarity column 6969 (100.0%), 708.17 column/sec. Elapsed time 9.84 sec
26817.1s 4706 EvaluatorHoldout: Ignoring 21 ( 0.1%) Users that have less than 1 test interactions
26831.4s 4707 EvaluatorHoldout: Processed 27074 (100.0%) in 14.28 sec. Users per second: 1896
26831.7s 4708 Unable to load Cython Compute_Similarity, reverting to Python
26840.6s 4709 Similarity column 6969 (100.0%), 758.60 column/sec. Elapsed time 9.19 sec
26840.8s 4710 EvaluatorHoldout: Ignoring 29 ( 0.1%) Users that have less than 1 test interactions
26854.9s 4711 EvaluatorHoldout: Processed 27066 (100.0%) in 14.25 sec. Users per second: 1899
26854.9s 4712 [I 2025-12-07 16:21:30,451] Trial 194 finished with value: 0.23728918096323098 and parameters: {'similarity': 'tversky', 'topK': 24, 'shrink': 203, 'tversky_alpha': 0.2875156895383039, 'tversky_beta': 1.8448835489381137}. Best is trial 182 with value: 0.2514384438125787.
26854.9s 4713 
26854.9s 4714 [I 2025-12-07 16:21:30,451] Trial 194 finished with value: 0.23728918096323098 and parameters: {'similarity': 'tversky', 'topK': 24, 'shrink': 203, 'tversky_alpha': 0.2875156895383039, 'tversky_beta': 1.8448835489381137}. Best is trial 182 with value: 0.2514384438125787.
26855.1s 4715 [0.23726824465210694, 0.23764045208013956, 0.2387481262670516, 0.23482075645280606, 0.2379683253640506]
26855.4s 4716 Unable to load Cython Compute_Similarity, reverting to Python
26864.7s 4717 Similarity column 6969 (100.0%), 752.72 column/sec. Elapsed time 9.26 sec
26864.7s 4718 EvaluatorHoldout: Ignoring 33 ( 0.1%) Users that have less than 1 test interactions
26878.0s 4719 EvaluatorHoldout: Processed 27062 (100.0%) in 13.51 sec. Users per second: 2003
26878.5s 4720 Unable to load Cython Compute_Similarity, reverting to Python
26887.6s 4721 Similarity column 6969 (100.0%), 754.44 column/sec. Elapsed time 9.24 sec
26887.8s 4722 EvaluatorHoldout: Ignoring 28 ( 0.1%) Users that have less than 1 test interactions
26901.4s 4723 EvaluatorHoldout: Processed 27067 (100.0%) in 13.62 sec. Users per second: 1987
26901.7s 4724 Unable to load Cython Compute_Similarity, reverting to Python
26910.8s 4725 Similarity column 6969 (100.0%), 749.29 column/sec. Elapsed time 9.30 sec
26911.0s 4726 EvaluatorHoldout: Ignoring 40 ( 0.1%) Users that have less than 1 test interactions
26924.4s 4727 EvaluatorHoldout: Processed 27055 (100.0%) in 13.52 sec. Users per second: 2001
26924.8s 4728 Unable to load Cython Compute_Similarity, reverting to Python
26934.0s 4729 Similarity column 6969 (100.0%), 763.45 column/sec. Elapsed time 9.13 sec
26934.0s 4730 EvaluatorHoldout: Ignoring 21 ( 0.1%) Users that have less than 1 test interactions
26947.3s 4731 EvaluatorHoldout: Processed 27074 (100.0%) in 13.47 sec. Users per second: 2010
26947.8s 4732 Unable to load Cython Compute_Similarity, reverting to Python
26956.8s 4733 Similarity column 6969 (100.0%), 758.97 column/sec. Elapsed time 9.18 sec
26957.0s 4734 EvaluatorHoldout: Ignoring 29 ( 0.1%) Users that have less than 1 test interactions
26970.5s 4735 EvaluatorHoldout: Processed 27066 (100.0%) in 13.48 sec. Users per second: 2008
26970.5s 4736 [I 2025-12-07 16:23:25,791] Trial 195 finished with value: 0.24834869222614583 and parameters: {'similarity': 'tversky', 'topK': 5, 'shrink': 294, 'tversky_alpha': 0.20503546228365388, 'tversky_beta': 1.5436640233623171}. Best is trial 182 with value: 0.2514384438125787.
26970.5s 4737 
26970.5s 4738 [I 2025-12-07 16:23:25,791] Trial 195 finished with value: 0.24834869222614583 and parameters: {'similarity': 'tversky', 'topK': 5, 'shrink': 294, 'tversky_alpha': 0.20503546228365388, 'tversky_beta': 1.5436640233623171}. Best is trial 182 with value: 0.2514384438125787.
26970.5s 4739 [0.24764235871141202, 0.2485765959500598, 0.24981192530104898, 0.24767564113636154, 0.2480369400318469]
26970.8s 4740 Unable to load Cython Compute_Similarity, reverting to Python
26980.0s 4741 Similarity column 6969 (100.0%), 740.72 column/sec. Elapsed time 9.41 sec
26980.2s 4742 EvaluatorHoldout: Ignoring 33 ( 0.1%) Users that have less than 1 test interactions
26994.9s 4743 EvaluatorHoldout: Processed 27062 (100.0%) in 14.88 sec. Users per second: 1819
26995.4s 4744 Unable to load Cython Compute_Similarity, reverting to Python
27004.4s 4745 Similarity column 6969 (100.0%), 771.59 column/sec. Elapsed time 9.03 sec
27004.4s 4746 EvaluatorHoldout: Ignoring 28 ( 0.1%) Users that have less than 1 test interactions
27019.1s 4747 EvaluatorHoldout: Processed 27067 (100.0%) in 14.82 sec. Users per second: 1826
27019.6s 4748 Unable to load Cython Compute_Similarity, reverting to Python
27028.4s 4749 Similarity column 6969 (100.0%), 770.15 column/sec. Elapsed time 9.05 sec
27028.6s 4750 EvaluatorHoldout: Ignoring 40 ( 0.1%) Users that have less than 1 test interactions
27043.5s 4751 EvaluatorHoldout: Processed 27055 (100.0%) in 14.82 sec. Users per second: 1826
27043.8s 4752 Unable to load Cython Compute_Similarity, reverting to Python
27052.6s 4753 Similarity column 6969 (100.0%), 770.42 column/sec. Elapsed time 9.05 sec
27052.8s 4754 EvaluatorHoldout: Ignoring 21 ( 0.1%) Users that have less than 1 test interactions
27067.6s 4755 EvaluatorHoldout: Processed 27074 (100.0%) in 14.90 sec. Users per second: 1817
27068.0s 4756 Unable to load Cython Compute_Similarity, reverting to Python
27077.1s 4757 Similarity column 6969 (100.0%), 770.78 column/sec. Elapsed time 9.04 sec
27077.1s 4758 EvaluatorHoldout: Ignoring 29 ( 0.1%) Users that have less than 1 test interactions
27091.7s 4759 EvaluatorHoldout: Processed 27066 (100.0%) in 14.79 sec. Users per second: 1830
27091.7s 4760 [I 2025-12-07 16:25:27,230] Trial 196 finished with value: 0.2273067279338396 and parameters: {'similarity': 'tversky', 'topK': 40, 'shrink': 292, 'tversky_alpha': 0.20174455988777573, 'tversky_beta': 1.537491197435052}. Best is trial 182 with value: 0.2514384438125787.
27091.7s 4761 
27091.7s 4762 [I 2025-12-07 16:25:27,230] Trial 196 finished with value: 0.2273067279338396 and parameters: {'similarity': 'tversky', 'topK': 40, 'shrink': 292, 'tversky_alpha': 0.20174455988777573, 'tversky_beta': 1.537491197435052}. Best is trial 182 with value: 0.2514384438125787.
27091.9s 4763 [0.22615173094138596, 0.2275349155165304, 0.2282541096687294, 0.22603777802839548, 0.2285551055141567]
27092.2s 4764 Unable to load Cython Compute_Similarity, reverting to Python
27100.9s 4765 Similarity column 6969 (100.0%), 788.86 column/sec. Elapsed time 8.83 sec
27101.1s 4766 EvaluatorHoldout: Ignoring 33 ( 0.1%) Users that have less than 1 test interactions
27114.6s 4767 EvaluatorHoldout: Processed 27062 (100.0%) in 13.53 sec. Users per second: 2001
27114.9s 4768 Unable to load Cython Compute_Similarity, reverting to Python
27123.7s 4769 Similarity column 6969 (100.0%), 775.40 column/sec. Elapsed time 8.99 sec
27123.9s 4770 EvaluatorHoldout: Ignoring 28 ( 0.1%) Users that have less than 1 test interactions
27137.2s 4771 EvaluatorHoldout: Processed 27067 (100.0%) in 13.53 sec. Users per second: 2000
27137.7s 4772 Unable to load Cython Compute_Similarity, reverting to Python
27146.9s 4773 Similarity column 6969 (100.0%), 764.35 column/sec. Elapsed time 9.12 sec
27146.9s 4774 EvaluatorHoldout: Ignoring 40 ( 0.1%) Users that have less than 1 test interactions
27160.0s 4775 EvaluatorHoldout: Processed 27055 (100.0%) in 13.35 sec. Users per second: 2027
27160.5s 4776 Unable to load Cython Compute_Similarity, reverting to Python
27169.1s 4777 Similarity column 6969 (100.0%), 794.66 column/sec. Elapsed time 8.77 sec
27169.3s 4778 EvaluatorHoldout: Ignoring 21 ( 0.1%) Users that have less than 1 test interactions
27182.9s 4779 EvaluatorHoldout: Processed 27074 (100.0%) in 13.42 sec. Users per second: 2017
27183.0s 4780 Unable to load Cython Compute_Similarity, reverting to Python
27191.5s 4781 Similarity column 6969 (100.0%), 803.43 column/sec. Elapsed time 8.67 sec
27191.7s 4782 EvaluatorHoldout: Ignoring 29 ( 0.1%) Users that have less than 1 test interactions
27204.9s 4783 EvaluatorHoldout: Processed 27066 (100.0%) in 13.40 sec. Users per second: 2019
27204.9s 4784 [I 2025-12-07 16:27:20,458] Trial 197 finished with value: 0.24774471131293022 and parameters: {'similarity': 'tversky', 'topK': 5, 'shrink': 320, 'tversky_alpha': 0.15591988414827962, 'tversky_beta': 1.4105749415229656}. Best is trial 182 with value: 0.2514384438125787.
27204.9s 4785 
27204.9s 4786 [I 2025-12-07 16:27:20,458] Trial 197 finished with value: 0.24774471131293022 and parameters: {'similarity': 'tversky', 'topK': 5, 'shrink': 320, 'tversky_alpha': 0.15591988414827962, 'tversky_beta': 1.4105749415229656}. Best is trial 182 with value: 0.2514384438125787.
27205.1s 4787 [0.2474991559775571, 0.24816276832135578, 0.24825797298328858, 0.24712829279781748, 0.24767536648463218]
27205.4s 4788 Unable to load Cython Compute_Similarity, reverting to Python
27214.7s 4789 Similarity column 6969 (100.0%), 749.78 column/sec. Elapsed time 9.29 sec
27214.7s 4790 EvaluatorHoldout: Ignoring 33 ( 0.1%) Users that have less than 1 test interactions
27230.0s 4791 EvaluatorHoldout: Processed 27062 (100.0%) in 15.45 sec. Users per second: 1752
27230.5s 4792 Unable to load Cython Compute_Similarity, reverting to Python
27239.4s 4793 Similarity column 6969 (100.0%), 765.92 column/sec. Elapsed time 9.10 sec
27239.6s 4794 EvaluatorHoldout: Ignoring 28 ( 0.1%) Users that have less than 1 test interactions
27255.1s 4795 EvaluatorHoldout: Processed 27067 (100.0%) in 15.44 sec. Users per second: 1753
27255.4s 4796 Unable to load Cython Compute_Similarity, reverting to Python
27264.3s 4797 Similarity column 6969 (100.0%), 762.39 column/sec. Elapsed time 9.14 sec
27264.5s 4798 EvaluatorHoldout: Ignoring 40 ( 0.1%) Users that have less than 1 test interactions
27279.8s 4799 EvaluatorHoldout: Processed 27055 (100.0%) in 15.43 sec. Users per second: 1754
27280.3s 4800 Unable to load Cython Compute_Similarity, reverting to Python
27289.7s 4801 Similarity column 6969 (100.0%), 736.86 column/sec. Elapsed time 9.46 sec
27289.7s 4802 EvaluatorHoldout: Ignoring 21 ( 0.1%) Users that have less than 1 test interactions
27305.0s 4803 EvaluatorHoldout: Processed 27074 (100.0%) in 15.47 sec. Users per second: 1750
27305.5s 4804 Unable to load Cython Compute_Similarity, reverting to Python
27314.7s 4805 Similarity column 6969 (100.0%), 744.81 column/sec. Elapsed time 9.36 sec
27314.9s 4806 EvaluatorHoldout: Ignoring 29 ( 0.1%) Users that have less than 1 test interactions
27330.2s 4807 EvaluatorHoldout: Processed 27066 (100.0%) in 15.24 sec. Users per second: 1776
27330.2s 4808 [I 2025-12-07 16:29:25,476] Trial 198 finished with value: 0.21830226798714403 and parameters: {'similarity': 'tversky', 'topK': 64, 'shrink': 327, 'tversky_alpha': 0.15277412319939665, 'tversky_beta': 1.3872902213315772}. Best is trial 182 with value: 0.2514384438125787.
27330.2s 4809 
