2119.6s 274 [I 2025-12-07 09:29:15,142] Trial 9 finished with value: 0.020448843089908523 and parameters: {'similarity': 'asymmetric', 'topK': 175, 'shrink': 398, 'asymmetric_alpha': 1.3834092583593474}. Best is trial 1 with value: 0.21611002685585196.
2119.8s 275 [0.020733477368750586, 0.020773871030089413, 0.020387614513860345, 0.020248185253594123, 0.02010106728324815]
2120.1s 276 Unable to load Cython Compute_Similarity, reverting to Python
2132.3s 277 Similarity column 6969 (100.0%), 562.20 column/sec. Elapsed time 12.40 sec
2132.5s 278 EvaluatorHoldout: Ignoring 33 ( 0.1%) Users that have less than 1 test interactions
2159.0s 279 EvaluatorHoldout: Processed 27062 (100.0%) in 26.58 sec. Users per second: 1018
2159.5s 280 Unable to load Cython Compute_Similarity, reverting to Python
2171.3s 281 Similarity column 6969 (100.0%), 582.44 column/sec. Elapsed time 11.97 sec
2171.5s 282 EvaluatorHoldout: Ignoring 28 ( 0.1%) Users that have less than 1 test interactions
2198.0s 283 EvaluatorHoldout: Processed 27067 (100.0%) in 26.68 sec. Users per second: 1014
2198.5s 284 Unable to load Cython Compute_Similarity, reverting to Python
2210.1s 285 Similarity column 6969 (100.0%), 589.45 column/sec. Elapsed time 11.82 sec
2210.3s 286 EvaluatorHoldout: Ignoring 40 ( 0.1%) Users that have less than 1 test interactions
2236.5s 287 EvaluatorHoldout: Processed 27055 (100.0%) in 26.26 sec. Users per second: 1030
2237.0s 288 Unable to load Cython Compute_Similarity, reverting to Python
2248.6s 289 Similarity column 6969 (100.0%), 590.86 column/sec. Elapsed time 11.79 sec
2248.8s 290 EvaluatorHoldout: Ignoring 21 ( 0.1%) Users that have less than 1 test interactions
2274.9s 291 EvaluatorHoldout: Processed 27074 (100.0%) in 26.25 sec. Users per second: 1031
2275.4s 292 Unable to load Cython Compute_Similarity, reverting to Python
2287.0s 293 Similarity column 6969 (100.0%), 592.44 column/sec. Elapsed time 11.76 sec
2287.2s 294 EvaluatorHoldout: Ignoring 29 ( 0.1%) Users that have less than 1 test interactions
2313.2s 295 EvaluatorHoldout: Processed 27066 (100.0%) in 26.15 sec. Users per second: 1035
2313.2s 296 [I 2025-12-07 09:32:28,713] Trial 10 finished with value: 0.21010584449281006 and parameters: {'similarity': 'cosine', 'topK': 377, 'shrink': 637}. Best is trial 1 with value: 0.21611002685585196.
2313.2s 297 
2313.2s 298 [I 2025-12-07 09:32:28,713] Trial 10 finished with value: 0.21010584449281006 and parameters: {'similarity': 'cosine', 'topK': 377, 'shrink': 637}. Best is trial 1 with value: 0.21611002685585196.
2313.4s 299 [0.2093496116216988, 0.21026585551944582, 0.21006572507074214, 0.20940483000673793, 0.21144320024542554]
2313.7s 300 Unable to load Cython Compute_Similarity, reverting to Python
2325.0s 301 Similarity column 6969 (100.0%), 606.19 column/sec. Elapsed time 11.50 sec
2325.2s 302 EvaluatorHoldout: Ignoring 33 ( 0.1%) Users that have less than 1 test interactions
2350.9s 303 EvaluatorHoldout: Processed 27062 (100.0%) in 25.89 sec. Users per second: 1045
2351.4s 304 Unable to load Cython Compute_Similarity, reverting to Python
2362.8s 305 Similarity column 6969 (100.0%), 603.19 column/sec. Elapsed time 11.55 sec
2363.0s 306 EvaluatorHoldout: Ignoring 28 ( 0.1%) Users that have less than 1 test interactions
2388.7s 307 EvaluatorHoldout: Processed 27067 (100.0%) in 25.81 sec. Users per second: 1049
2389.2s 308 Unable to load Cython Compute_Similarity, reverting to Python
2400.9s 309 Similarity column 6969 (100.0%), 587.41 column/sec. Elapsed time 11.86 sec
2401.1s 310 EvaluatorHoldout: Ignoring 40 ( 0.1%) Users that have less than 1 test interactions
2426.7s 311 EvaluatorHoldout: Processed 27055 (100.0%) in 25.80 sec. Users per second: 1049
2427.2s 312 Unable to load Cython Compute_Similarity, reverting to Python
2438.6s 313 Similarity column 6969 (100.0%), 604.68 column/sec. Elapsed time 11.53 sec
2438.7s 314 EvaluatorHoldout: Ignoring 21 ( 0.1%) Users that have less than 1 test interactions
2464.4s 315 EvaluatorHoldout: Processed 27074 (100.0%) in 25.76 sec. Users per second: 1051
2464.9s 316 Unable to load Cython Compute_Similarity, reverting to Python
2476.5s 317 Similarity column 6969 (100.0%), 591.62 column/sec. Elapsed time 11.78 sec
2476.7s 318 EvaluatorHoldout: Ignoring 29 ( 0.1%) Users that have less than 1 test interactions
2502.6s 319 EvaluatorHoldout: Processed 27066 (100.0%) in 26.06 sec. Users per second: 1039
2502.6s 320 [I 2025-12-07 09:35:38,120] Trial 11 finished with value: 0.21062018393422693 and parameters: {'similarity': 'cosine', 'topK': 360, 'shrink': 671}. Best is trial 1 with value: 0.21611002685585196.
2502.6s 321 
2502.6s 322 [I 2025-12-07 09:35:38,120] Trial 11 finished with value: 0.21062018393422693 and parameters: {'similarity': 'cosine', 'topK': 360, 'shrink': 671}. Best is trial 1 with value: 0.21611002685585196.
2502.8s 323 [0.20988502173354132, 0.21080465367991083, 0.21038710424203436, 0.2102616521513822, 0.21176248786426613]
2503.1s 324 Unable to load Cython Compute_Similarity, reverting to Python
2511.6s 325 Similarity column 6969 (100.0%), 806.34 column/sec. Elapsed time 8.64 sec
2511.7s 326 EvaluatorHoldout: Ignoring 33 ( 0.1%) Users that have less than 1 test interactions
2525.8s 327 EvaluatorHoldout: Processed 27062 (100.0%) in 14.26 sec. Users per second: 1898
2526.3s 328 Unable to load Cython Compute_Similarity, reverting to Python
2534.7s 329 Similarity column 6969 (100.0%), 812.61 column/sec. Elapsed time 8.58 sec
2534.9s 330 EvaluatorHoldout: Ignoring 28 ( 0.1%) Users that have less than 1 test interactions
2549.0s 331 EvaluatorHoldout: Processed 27067 (100.0%) in 14.24 sec. Users per second: 1901
2549.4s 332 Unable to load Cython Compute_Similarity, reverting to Python
2558.1s 333 Similarity column 6969 (100.0%), 785.04 column/sec. Elapsed time 8.88 sec
2558.3s 334 EvaluatorHoldout: Ignoring 40 ( 0.1%) Users that have less than 1 test interactions
2572.5s 335 EvaluatorHoldout: Processed 27055 (100.0%) in 14.34 sec. Users per second: 1887
2573.0s 336 Unable to load Cython Compute_Similarity, reverting to Python
2581.8s 337 Similarity column 6969 (100.0%), 774.02 column/sec. Elapsed time 9.00 sec
2582.0s 338 EvaluatorHoldout: Ignoring 21 ( 0.1%) Users that have less than 1 test interactions
2596.1s 339 EvaluatorHoldout: Processed 27074 (100.0%) in 14.27 sec. Users per second: 1897
2596.6s 340 Unable to load Cython Compute_Similarity, reverting to Python
2605.1s 341 Similarity column 6969 (100.0%), 795.06 column/sec. Elapsed time 8.77 sec
2605.3s 342 EvaluatorHoldout: Ignoring 29 ( 0.1%) Users that have less than 1 test interactions
2619.4s 343 EvaluatorHoldout: Processed 27066 (100.0%) in 14.22 sec. Users per second: 1903
2619.4s 344 [I 2025-12-07 09:37:34,894] Trial 12 finished with value: 0.2155636396180128 and parameters: {'similarity': 'cosine', 'topK': 7, 'shrink': 703}. Best is trial 1 with value: 0.21611002685585196.
2619.4s 345 
2619.4s 346 [I 2025-12-07 09:37:34,894] Trial 12 finished with value: 0.2155636396180128 and parameters: {'similarity': 'cosine', 'topK': 7, 'shrink': 703}. Best is trial 1 with value: 0.21611002685585196.
2619.6s 347 [0.21525904789057754, 0.21594345181599273, 0.21728553017177243, 0.2138934588730014, 0.21543670933872003]
2619.9s 348 Unable to load Cython Compute_Similarity, reverting to Python
2629.0s 349 Similarity column 6969 (100.0%), 743.18 column/sec. Elapsed time 9.38 sec
2629.2s 350 EvaluatorHoldout: Ignoring 33 ( 0.1%) Users that have less than 1 test interactions
2645.8s 351 EvaluatorHoldout: Processed 27062 (100.0%) in 16.76 sec. Users per second: 1615
2646.3s 352 Unable to load Cython Compute_Similarity, reverting to Python
2655.6s 353 Similarity column 6969 (100.0%), 742.22 column/sec. Elapsed time 9.39 sec
2655.7s 354 EvaluatorHoldout: Ignoring 28 ( 0.1%) Users that have less than 1 test interactions
2672.4s 355 EvaluatorHoldout: Processed 27067 (100.0%) in 16.80 sec. Users per second: 1611
2672.9s 356 Unable to load Cython Compute_Similarity, reverting to Python
2682.0s 357 Similarity column 6969 (100.0%), 744.67 column/sec. Elapsed time 9.36 sec
2682.2s 358 EvaluatorHoldout: Ignoring 40 ( 0.1%) Users that have less than 1 test interactions
2698.7s 359 EvaluatorHoldout: Processed 27055 (100.0%) in 16.64 sec. Users per second: 1626
2699.2s 360 Unable to load Cython Compute_Similarity, reverting to Python
2708.3s 361 Similarity column 6969 (100.0%), 745.42 column/sec. Elapsed time 9.35 sec
2708.5s 362 EvaluatorHoldout: Ignoring 21 ( 0.1%) Users that have less than 1 test interactions
2725.1s 363 EvaluatorHoldout: Processed 27074 (100.0%) in 16.69 sec. Users per second: 1622
2725.6s 364 Unable to load Cython Compute_Similarity, reverting to Python
2735.0s 365 Similarity column 6969 (100.0%), 725.93 column/sec. Elapsed time 9.60 sec
2735.2s 366 EvaluatorHoldout: Ignoring 29 ( 0.1%) Users that have less than 1 test interactions
2751.6s 367 EvaluatorHoldout: Processed 27066 (100.0%) in 16.62 sec. Users per second: 1628
2751.6s 368 [I 2025-12-07 09:39:47,144] Trial 13 finished with value: 0.20323384514440215 and parameters: {'similarity': 'tversky', 'topK': 78, 'shrink': 195, 'tversky_alpha': 1.137270481615041, 'tversky_beta': 0.9379458142962932}. Best is trial 1 with value: 0.21611002685585196.
2751.6s 369 
2751.6s 370 [I 2025-12-07 09:39:47,144] Trial 13 finished with value: 0.20323384514440215 and parameters: {'similarity': 'tversky', 'topK': 78, 'shrink': 195, 'tversky_alpha': 1.137270481615041, 'tversky_beta': 0.9379458142962932}. Best is trial 1 with value: 0.21611002685585196.
2751.8s 371 [0.20230639814754206, 0.2033406609416177, 0.20428421011668765, 0.20291893353077348, 0.2033190229853898]
2752.1s 372 Unable to load Cython Compute_Similarity, reverting to Python
2760.6s 373 Similarity column 6969 (100.0%), 803.94 column/sec. Elapsed time 8.67 sec
2760.8s 374 EvaluatorHoldout: Ignoring 33 ( 0.1%) Users that have less than 1 test interactions
2776.4s 375 EvaluatorHoldout: Processed 27062 (100.0%) in 15.77 sec. Users per second: 1716
2776.9s 376 Unable to load Cython Compute_Similarity, reverting to Python
2785.5s 377 Similarity column 6969 (100.0%), 791.60 column/sec. Elapsed time 8.80 sec
2785.7s 378 EvaluatorHoldout: Ignoring 28 ( 0.1%) Users that have less than 1 test interactions
2801.3s 379 EvaluatorHoldout: Processed 27067 (100.0%) in 15.74 sec. Users per second: 1719
2801.7s 380 Unable to load Cython Compute_Similarity, reverting to Python
2810.3s 381 Similarity column 6969 (100.0%), 796.19 column/sec. Elapsed time 8.75 sec
2810.5s 382 EvaluatorHoldout: Ignoring 40 ( 0.1%) Users that have less than 1 test interactions
2826.1s 383 EvaluatorHoldout: Processed 27055 (100.0%) in 15.77 sec. Users per second: 1716
2826.6s 384 Unable to load Cython Compute_Similarity, reverting to Python
2835.1s 385 Similarity column 6969 (100.0%), 801.29 column/sec. Elapsed time 8.70 sec
2835.3s 386 EvaluatorHoldout: Ignoring 21 ( 0.1%) Users that have less than 1 test interactions
2850.9s 387 EvaluatorHoldout: Processed 27074 (100.0%) in 15.78 sec. Users per second: 1716
2851.4s 388 Unable to load Cython Compute_Similarity, reverting to Python
2859.9s 389 Similarity column 6969 (100.0%), 795.40 column/sec. Elapsed time 8.76 sec
2860.1s 390 EvaluatorHoldout: Ignoring 29 ( 0.1%) Users that have less than 1 test interactions
2875.7s 391 EvaluatorHoldout: Processed 27066 (100.0%) in 15.75 sec. Users per second: 1719
2875.7s 392 [I 2025-12-07 09:41:51,245] Trial 14 finished with value: 0.21492679949025678 and parameters: {'similarity': 'cosine', 'topK': 18, 'shrink': 822}. Best is trial 1 with value: 0.21611002685585196.
2875.7s 393 
2875.7s 394 [I 2025-12-07 09:41:51,245] Trial 14 finished with value: 0.21492679949025678 and parameters: {'similarity': 'cosine', 'topK': 18, 'shrink': 822}. Best is trial 1 with value: 0.21611002685585196.
2875.9s 395 [0.21411370123888626, 0.21537266896901194, 0.21643198582180975, 0.21376275084702212, 0.21495289057455386]
2876.2s 396 Unable to load Cython Compute_Similarity, reverting to Python
2887.2s 397 Similarity column 6969 (100.0%), 623.01 column/sec. Elapsed time 11.19 sec
2887.4s 398 EvaluatorHoldout: Ignoring 33 ( 0.1%) Users that have less than 1 test interactions
2912.3s 399 EvaluatorHoldout: Processed 27062 (100.0%) in 24.99 sec. Users per second: 1083
2912.8s 400 Unable to load Cython Compute_Similarity, reverting to Python
2923.6s 401 Similarity column 6969 (100.0%), 633.43 column/sec. Elapsed time 11.00 sec
2923.8s 402 EvaluatorHoldout: Ignoring 28 ( 0.1%) Users that have less than 1 test interactions
2948.3s 403 EvaluatorHoldout: Processed 27067 (100.0%) in 24.70 sec. Users per second: 1096
2948.8s 404 Unable to load Cython Compute_Similarity, reverting to Python
2959.7s 405 Similarity column 6969 (100.0%), 629.84 column/sec. Elapsed time 11.06 sec
2959.9s 406 EvaluatorHoldout: Ignoring 40 ( 0.1%) Users that have less than 1 test interactions
2984.6s 407 EvaluatorHoldout: Processed 27055 (100.0%) in 24.85 sec. Users per second: 1089
2985.1s 408 Unable to load Cython Compute_Similarity, reverting to Python
2996.0s 409 Similarity column 6969 (100.0%), 629.19 column/sec. Elapsed time 11.08 sec
2996.2s 410 EvaluatorHoldout: Ignoring 21 ( 0.1%) Users that have less than 1 test interactions
3020.7s 411 EvaluatorHoldout: Processed 27074 (100.0%) in 24.64 sec. Users per second: 1099
3021.2s 412 Unable to load Cython Compute_Similarity, reverting to Python
3032.0s 413 Similarity column 6969 (100.0%), 634.95 column/sec. Elapsed time 10.98 sec
3032.2s 414 EvaluatorHoldout: Ignoring 29 ( 0.1%) Users that have less than 1 test interactions
3056.7s 415 EvaluatorHoldout: Processed 27066 (100.0%) in 24.64 sec. Users per second: 1098
3056.7s 416 [I 2025-12-07 09:44:52,198] Trial 15 finished with value: 0.212401293971234 and parameters: {'similarity': 'cosine', 'topK': 285, 'shrink': 731}. Best is trial 1 with value: 0.21611002685585196.
3056.7s 417 
3056.7s 418 [I 2025-12-07 09:44:52,198] Trial 15 finished with value: 0.212401293971234 and parameters: {'similarity': 'cosine', 'topK': 285, 'shrink': 731}. Best is trial 1 with value: 0.21611002685585196.
3056.9s 419 [0.21164118824624592, 0.2130052707634741, 0.21203112186656986, 0.21205148180061054, 0.2132774071792696]
3057.2s 420 Unable to load Cython Compute_Similarity, reverting to Python
3069.8s 421 Similarity column 6969 (100.0%), 546.52 column/sec. Elapsed time 12.75 sec
3069.9s 422 EvaluatorHoldout: Ignoring 33 ( 0.1%) Users that have less than 1 test interactions
3091.3s 423 EvaluatorHoldout: Processed 27062 (100.0%) in 21.43 sec. Users per second: 1263
3091.7s 424 Unable to load Cython Compute_Similarity, reverting to Python
3104.6s 425 Similarity column 6969 (100.0%), 533.26 column/sec. Elapsed time 13.07 sec
3104.8s 426 EvaluatorHoldout: Ignoring 28 ( 0.1%) Users that have less than 1 test interactions
3126.2s 427 EvaluatorHoldout: Processed 27067 (100.0%) in 21.52 sec. Users per second: 1258
3126.7s 428 Unable to load Cython Compute_Similarity, reverting to Python
3139.5s 429 Similarity column 6969 (100.0%), 539.95 column/sec. Elapsed time 12.91 sec
3139.6s 430 EvaluatorHoldout: Ignoring 40 ( 0.1%) Users that have less than 1 test interactions
3161.3s 431 EvaluatorHoldout: Processed 27055 (100.0%) in 21.74 sec. Users per second: 1244
3161.8s 432 Unable to load Cython Compute_Similarity, reverting to Python
3174.7s 433 Similarity column 6969 (100.0%), 530.01 column/sec. Elapsed time 13.15 sec
3174.9s 434 EvaluatorHoldout: Ignoring 21 ( 0.1%) Users that have less than 1 test interactions
3196.6s 435 EvaluatorHoldout: Processed 27074 (100.0%) in 21.78 sec. Users per second: 1243
3197.1s 436 Unable to load Cython Compute_Similarity, reverting to Python
3211.9s 437 Similarity column 6969 (100.0%), 464.97 column/sec. Elapsed time 14.99 sec
3212.1s 438 EvaluatorHoldout: Ignoring 29 ( 0.1%) Users that have less than 1 test interactions
3234.0s 439 EvaluatorHoldout: Processed 27066 (100.0%) in 22.00 sec. Users per second: 1230
3234.0s 440 [I 2025-12-07 09:47:49,523] Trial 16 finished with value: 0.17927719497826483 and parameters: {'similarity': 'tversky', 'topK': 499, 'shrink': 528, 'tversky_alpha': 0.015145956289002949, 'tversky_beta': 1.7785249534118914}. Best is trial 1 with value: 0.21611002685585196.
3234.0s 441 
3234.0s 442 [I 2025-12-07 09:47:49,523] Trial 16 finished with value: 0.17927719497826483 and parameters: {'similarity': 'tversky', 'topK': 499, 'shrink': 528, 'tversky_alpha': 0.015145956289002949, 'tversky_beta': 1.7785249534118914}. Best is trial 1 with value: 0.21611002685585196.
3234.2s 443 [0.17904271228960206, 0.17914222448628234, 0.17912675721612234, 0.17890849636701187, 0.18016578453230553]
3234.5s 444 Unable to load Cython Compute_Similarity, reverting to Python
3243.9s 445 Similarity column 6969 (100.0%), 727.57 column/sec. Elapsed time 9.58 sec
3244.1s 446 EvaluatorHoldout: Ignoring 33 ( 0.1%) Users that have less than 1 test interactions
3263.4s 447 EvaluatorHoldout: Processed 27062 (100.0%) in 19.52 sec. Users per second: 1387
3263.9s 448 Unable to load Cython Compute_Similarity, reverting to Python
3273.3s 449 Similarity column 6969 (100.0%), 725.46 column/sec. Elapsed time 9.61 sec
3273.5s 450 EvaluatorHoldout: Ignoring 28 ( 0.1%) Users that have less than 1 test interactions
3293.2s 451 EvaluatorHoldout: Processed 27067 (100.0%) in 19.80 sec. Users per second: 1367
3293.7s 452 Unable to load Cython Compute_Similarity, reverting to Python
3303.1s 453 Similarity column 6969 (100.0%), 724.09 column/sec. Elapsed time 9.62 sec
3303.3s 454 EvaluatorHoldout: Ignoring 40 ( 0.1%) Users that have less than 1 test interactions
3322.8s 455 EvaluatorHoldout: Processed 27055 (100.0%) in 19.69 sec. Users per second: 1374
3323.3s 456 Unable to load Cython Compute_Similarity, reverting to Python
3333.0s 457 Similarity column 6969 (100.0%), 703.37 column/sec. Elapsed time 9.91 sec
3333.2s 458 EvaluatorHoldout: Ignoring 21 ( 0.1%) Users that have less than 1 test interactions
3352.8s 459 EvaluatorHoldout: Processed 27074 (100.0%) in 19.74 sec. Users per second: 1371
3353.3s 460 Unable to load Cython Compute_Similarity, reverting to Python
3362.7s 461 Similarity column 6969 (100.0%), 726.87 column/sec. Elapsed time 9.59 sec
3362.9s 462 EvaluatorHoldout: Ignoring 29 ( 0.1%) Users that have less than 1 test interactions
3382.5s 463 EvaluatorHoldout: Processed 27066 (100.0%) in 19.71 sec. Users per second: 1373
3382.5s 464 [I 2025-12-07 09:50:17,976] Trial 17 finished with value: 0.21644456884223776 and parameters: {'similarity': 'cosine', 'topK': 121, 'shrink': 240}. Best is trial 17 with value: 0.21644456884223776.
3382.5s 465 
3382.5s 466 [I 2025-12-07 09:50:17,976] Trial 17 finished with value: 0.21644456884223776 and parameters: {'similarity': 'cosine', 'topK': 121, 'shrink': 240}. Best is trial 17 with value: 0.21644456884223776.
3382.7s 467 [0.21544253080325634, 0.21652034279185065, 0.21766121299320915, 0.21579714677058637, 0.21680161085228616]
3382.9s 468 Unable to load Cython Compute_Similarity, reverting to Python
3392.8s 469 Similarity column 6969 (100.0%), 696.49 column/sec. Elapsed time 10.01 sec
3393.0s 470 EvaluatorHoldout: Ignoring 33 ( 0.1%) Users that have less than 1 test interactions
3413.0s 471 EvaluatorHoldout: Processed 27062 (100.0%) in 20.16 sec. Users per second: 1342
3413.5s 472 Unable to load Cython Compute_Similarity, reverting to Python
3423.4s 473 Similarity column 6969 (100.0%), 688.55 column/sec. Elapsed time 10.12 sec
3423.6s 474 EvaluatorHoldout: Ignoring 28 ( 0.1%) Users that have less than 1 test interactions
3443.7s 475 EvaluatorHoldout: Processed 27067 (100.0%) in 20.32 sec. Users per second: 1332
3444.2s 476 Unable to load Cython Compute_Similarity, reverting to Python
3454.0s 477 Similarity column 6969 (100.0%), 698.42 column/sec. Elapsed time 9.98 sec
3454.2s 478 EvaluatorHoldout: Ignoring 40 ( 0.1%) Users that have less than 1 test interactions
3474.4s 479 EvaluatorHoldout: Processed 27055 (100.0%) in 20.36 sec. Users per second: 1329
3474.9s 480 Unable to load Cython Compute_Similarity, reverting to Python
3484.6s 481 Similarity column 6969 (100.0%), 707.86 column/sec. Elapsed time 9.85 sec
3484.8s 482 EvaluatorHoldout: Ignoring 21 ( 0.1%) Users that have less than 1 test interactions
3505.1s 483 EvaluatorHoldout: Processed 27074 (100.0%) in 20.44 sec. Users per second: 1325
3505.5s 484 Unable to load Cython Compute_Similarity, reverting to Python
3515.4s 485 Similarity column 6969 (100.0%), 696.93 column/sec. Elapsed time 10.00 sec
3515.5s 486 EvaluatorHoldout: Ignoring 29 ( 0.1%) Users that have less than 1 test interactions
3536.0s 487 EvaluatorHoldout: Processed 27066 (100.0%) in 20.56 sec. Users per second: 1316
3536.0s 488 [I 2025-12-07 09:52:51,483] Trial 18 finished with value: 0.21580193435399644 and parameters: {'similarity': 'cosine', 'topK': 152, 'shrink': 192}. Best is trial 17 with value: 0.21644456884223776.
3536.0s 489 
