12384.5s 1978 [I 2025-12-07 12:20:19,987] Trial 80 finished with value: 0.24810978805811468 and parameters: {'similarity': 'tversky', 'topK': 5, 'shrink': 155, 'tversky_alpha': 0.2671139953840142, 'tversky_beta': 1.310804682954121}. Best is trial 80 with value: 0.24810978805811468.
12384.7s 1979 [0.24738296987904315, 0.24897312395661292, 0.2490302688507427, 0.24690686009518878, 0.24825571750898587]
12385.0s 1980 Unable to load Cython Compute_Similarity, reverting to Python
12394.2s 1981 Similarity column 6969 (100.0%), 748.98 column/sec. Elapsed time 9.30 sec
12394.3s 1982 EvaluatorHoldout: Ignoring 33 ( 0.1%) Users that have less than 1 test interactions
12408.0s 1983 EvaluatorHoldout: Processed 27062 (100.0%) in 13.92 sec. Users per second: 1943
12408.5s 1984 Unable to load Cython Compute_Similarity, reverting to Python
12417.5s 1985 Similarity column 6969 (100.0%), 763.17 column/sec. Elapsed time 9.13 sec
12417.7s 1986 EvaluatorHoldout: Ignoring 28 ( 0.1%) Users that have less than 1 test interactions
12431.6s 1987 EvaluatorHoldout: Processed 27067 (100.0%) in 13.99 sec. Users per second: 1935
12432.0s 1988 Unable to load Cython Compute_Similarity, reverting to Python
12441.6s 1989 Similarity column 6969 (100.0%), 710.17 column/sec. Elapsed time 9.81 sec
12441.8s 1990 EvaluatorHoldout: Ignoring 40 ( 0.1%) Users that have less than 1 test interactions
12455.6s 1991 EvaluatorHoldout: Processed 27055 (100.0%) in 14.00 sec. Users per second: 1932
12456.1s 1992 Unable to load Cython Compute_Similarity, reverting to Python
12465.5s 1993 Similarity column 6969 (100.0%), 730.62 column/sec. Elapsed time 9.54 sec
12465.6s 1994 EvaluatorHoldout: Ignoring 21 ( 0.1%) Users that have less than 1 test interactions
12479.9s 1995 EvaluatorHoldout: Processed 27074 (100.0%) in 14.42 sec. Users per second: 1878
12480.4s 1996 Unable to load Cython Compute_Similarity, reverting to Python
12489.6s 1997 Similarity column 6969 (100.0%), 741.82 column/sec. Elapsed time 9.39 sec
12489.8s 1998 EvaluatorHoldout: Ignoring 29 ( 0.1%) Users that have less than 1 test interactions
12503.7s 1999 EvaluatorHoldout: Processed 27066 (100.0%) in 14.05 sec. Users per second: 1927
12503.7s 2000 [I 2025-12-07 12:22:19,175] Trial 81 finished with value: 0.24565981825765312 and parameters: {'similarity': 'tversky', 'topK': 8, 'shrink': 215, 'tversky_alpha': 0.24826520098029445, 'tversky_beta': 1.2306843834285548}. Best is trial 80 with value: 0.24810978805811468.
12503.7s 2001 
12503.7s 2002 [I 2025-12-07 12:22:19,175] Trial 81 finished with value: 0.24565981825765312 and parameters: {'similarity': 'tversky', 'topK': 8, 'shrink': 215, 'tversky_alpha': 0.24826520098029445, 'tversky_beta': 1.2306843834285548}. Best is trial 80 with value: 0.24810978805811468.
12503.8s 2003 [0.2444446776191468, 0.24664109144732832, 0.24696412515811123, 0.24430700737130873, 0.24594218969237067]
12504.2s 2004 Unable to load Cython Compute_Similarity, reverting to Python
12513.7s 2005 Similarity column 6969 (100.0%), 719.30 column/sec. Elapsed time 9.69 sec
12513.9s 2006 EvaluatorHoldout: Ignoring 33 ( 0.1%) Users that have less than 1 test interactions
12529.0s 2007 EvaluatorHoldout: Processed 27062 (100.0%) in 15.33 sec. Users per second: 1765
12529.5s 2008 Unable to load Cython Compute_Similarity, reverting to Python
12538.7s 2009 Similarity column 6969 (100.0%), 747.22 column/sec. Elapsed time 9.33 sec
12538.9s 2010 EvaluatorHoldout: Ignoring 28 ( 0.1%) Users that have less than 1 test interactions
12554.2s 2011 EvaluatorHoldout: Processed 27067 (100.0%) in 15.47 sec. Users per second: 1750
12554.6s 2012 Unable to load Cython Compute_Similarity, reverting to Python
12563.9s 2013 Similarity column 6969 (100.0%), 739.47 column/sec. Elapsed time 9.42 sec
12564.1s 2014 EvaluatorHoldout: Ignoring 40 ( 0.1%) Users that have less than 1 test interactions
12579.4s 2015 EvaluatorHoldout: Processed 27055 (100.0%) in 15.38 sec. Users per second: 1759
12579.8s 2016 Unable to load Cython Compute_Similarity, reverting to Python
12589.5s 2017 Similarity column 6969 (100.0%), 703.22 column/sec. Elapsed time 9.91 sec
12589.7s 2018 EvaluatorHoldout: Ignoring 21 ( 0.1%) Users that have less than 1 test interactions
12605.1s 2019 EvaluatorHoldout: Processed 27074 (100.0%) in 15.54 sec. Users per second: 1743
12605.5s 2020 Unable to load Cython Compute_Similarity, reverting to Python
12615.6s 2021 Similarity column 6969 (100.0%), 689.04 column/sec. Elapsed time 10.11 sec
12615.7s 2022 EvaluatorHoldout: Ignoring 29 ( 0.1%) Users that have less than 1 test interactions
12631.0s 2023 EvaluatorHoldout: Processed 27066 (100.0%) in 15.48 sec. Users per second: 1749
12631.0s 2024 [I 2025-12-07 12:24:26,501] Trial 82 finished with value: 0.2169575588800336 and parameters: {'similarity': 'tversky', 'topK': 56, 'shrink': 152, 'tversky_alpha': 0.2667334050471644, 'tversky_beta': 1.2517407205864284}. Best is trial 80 with value: 0.24810978805811468.
12631.0s 2025 
12631.0s 2026 [I 2025-12-07 12:24:26,501] Trial 82 finished with value: 0.2169575588800336 and parameters: {'similarity': 'tversky', 'topK': 56, 'shrink': 152, 'tversky_alpha': 0.2667334050471644, 'tversky_beta': 1.2517407205864284}. Best is trial 80 with value: 0.24810978805811468.
12631.2s 2027 [0.21662949500030096, 0.21691138909557292, 0.2172396941261497, 0.2167887672959921, 0.21721844888215225]
12631.5s 2028 Unable to load Cython Compute_Similarity, reverting to Python
12641.2s 2029 Similarity column 6969 (100.0%), 701.11 column/sec. Elapsed time 9.94 sec
12641.4s 2030 EvaluatorHoldout: Ignoring 33 ( 0.1%) Users that have less than 1 test interactions
12658.0s 2031 EvaluatorHoldout: Processed 27062 (100.0%) in 16.66 sec. Users per second: 1625
12658.4s 2032 Unable to load Cython Compute_Similarity, reverting to Python
12668.3s 2033 Similarity column 6969 (100.0%), 689.57 column/sec. Elapsed time 10.11 sec
12668.5s 2034 EvaluatorHoldout: Ignoring 28 ( 0.1%) Users that have less than 1 test interactions
12685.2s 2035 EvaluatorHoldout: Processed 27067 (100.0%) in 16.85 sec. Users per second: 1606
12685.7s 2036 Unable to load Cython Compute_Similarity, reverting to Python
12696.0s 2037 Similarity column 6969 (100.0%), 669.73 column/sec. Elapsed time 10.41 sec
12696.1s 2038 EvaluatorHoldout: Ignoring 40 ( 0.1%) Users that have less than 1 test interactions
12712.8s 2039 EvaluatorHoldout: Processed 27055 (100.0%) in 16.85 sec. Users per second: 1606
12713.3s 2040 Unable to load Cython Compute_Similarity, reverting to Python
12723.5s 2041 Similarity column 6969 (100.0%), 668.99 column/sec. Elapsed time 10.42 sec
12723.7s 2042 EvaluatorHoldout: Ignoring 21 ( 0.1%) Users that have less than 1 test interactions
12740.4s 2043 EvaluatorHoldout: Processed 27074 (100.0%) in 16.77 sec. Users per second: 1614
12740.9s 2044 Unable to load Cython Compute_Similarity, reverting to Python
12751.6s 2045 Similarity column 6969 (100.0%), 639.70 column/sec. Elapsed time 10.89 sec
12751.8s 2046 EvaluatorHoldout: Ignoring 29 ( 0.1%) Users that have less than 1 test interactions
12768.4s 2047 EvaluatorHoldout: Processed 27066 (100.0%) in 16.77 sec. Users per second: 1614
12768.4s 2048 [I 2025-12-07 12:26:43,901] Trial 83 finished with value: 0.2039163324758566 and parameters: {'similarity': 'tversky', 'topK': 105, 'shrink': 287, 'tversky_alpha': 0.22599711661079835, 'tversky_beta': 1.3258315788359485}. Best is trial 80 with value: 0.24810978805811468.
12768.4s 2049 
12768.4s 2050 [I 2025-12-07 12:26:43,901] Trial 83 finished with value: 0.2039163324758566 and parameters: {'similarity': 'tversky', 'topK': 105, 'shrink': 287, 'tversky_alpha': 0.22599711661079835, 'tversky_beta': 1.3258315788359485}. Best is trial 80 with value: 0.24810978805811468.
12768.6s 2051 [0.20389490061662363, 0.20391098619600223, 0.20427042512245136, 0.20265364720907636, 0.20485170323512947]
12768.9s 2052 Unable to load Cython Compute_Similarity, reverting to Python
12778.2s 2053 Similarity column 6969 (100.0%), 740.77 column/sec. Elapsed time 9.41 sec
12778.3s 2054 EvaluatorHoldout: Ignoring 33 ( 0.1%) Users that have less than 1 test interactions
12791.9s 2055 EvaluatorHoldout: Processed 27062 (100.0%) in 13.82 sec. Users per second: 1958
12792.4s 2056 Unable to load Cython Compute_Similarity, reverting to Python
12801.5s 2057 Similarity column 6969 (100.0%), 753.94 column/sec. Elapsed time 9.24 sec
12801.7s 2058 EvaluatorHoldout: Ignoring 28 ( 0.1%) Users that have less than 1 test interactions
12815.5s 2059 EvaluatorHoldout: Processed 27067 (100.0%) in 13.87 sec. Users per second: 1951
12815.9s 2060 Unable to load Cython Compute_Similarity, reverting to Python
12825.4s 2061 Similarity column 6969 (100.0%), 716.11 column/sec. Elapsed time 9.73 sec
12825.6s 2062 EvaluatorHoldout: Ignoring 40 ( 0.1%) Users that have less than 1 test interactions
12839.2s 2063 EvaluatorHoldout: Processed 27055 (100.0%) in 13.76 sec. Users per second: 1966
12839.7s 2064 Unable to load Cython Compute_Similarity, reverting to Python
12849.2s 2065 Similarity column 6969 (100.0%), 724.29 column/sec. Elapsed time 9.62 sec
12849.3s 2066 EvaluatorHoldout: Ignoring 21 ( 0.1%) Users that have less than 1 test interactions
12863.0s 2067 EvaluatorHoldout: Processed 27074 (100.0%) in 13.90 sec. Users per second: 1948
12863.5s 2068 Unable to load Cython Compute_Similarity, reverting to Python
12872.7s 2069 Similarity column 6969 (100.0%), 746.29 column/sec. Elapsed time 9.34 sec
12872.9s 2070 EvaluatorHoldout: Ignoring 29 ( 0.1%) Users that have less than 1 test interactions
12886.6s 2071 EvaluatorHoldout: Processed 27066 (100.0%) in 13.84 sec. Users per second: 1956
12886.6s 2072 [I 2025-12-07 12:28:42,051] Trial 84 finished with value: 0.23805865184649805 and parameters: {'similarity': 'tversky', 'topK': 5, 'shrink': 232, 'tversky_alpha': 0.5488490780922061, 'tversky_beta': 1.330359217638455}. Best is trial 80 with value: 0.24810978805811468.
12886.6s 2073 
12886.6s 2074 [I 2025-12-07 12:28:42,051] Trial 84 finished with value: 0.23805865184649805 and parameters: {'similarity': 'tversky', 'topK': 5, 'shrink': 232, 'tversky_alpha': 0.5488490780922061, 'tversky_beta': 1.330359217638455}. Best is trial 80 with value: 0.24810978805811468.
12886.7s 2075 [0.2370011997231696, 0.23912701725660496, 0.23950911638460515, 0.2364970799627841, 0.23815884590532638]
12887.0s 2076 Unable to load Cython Compute_Similarity, reverting to Python
12896.3s 2077 Similarity column 6969 (100.0%), 737.56 column/sec. Elapsed time 9.45 sec
12896.5s 2078 EvaluatorHoldout: Ignoring 33 ( 0.1%) Users that have less than 1 test interactions
12911.4s 2079 EvaluatorHoldout: Processed 27062 (100.0%) in 15.03 sec. Users per second: 1801
12911.8s 2080 Unable to load Cython Compute_Similarity, reverting to Python
12921.2s 2081 Similarity column 6969 (100.0%), 732.83 column/sec. Elapsed time 9.51 sec
12921.4s 2082 EvaluatorHoldout: Ignoring 28 ( 0.1%) Users that have less than 1 test interactions
12936.4s 2083 EvaluatorHoldout: Processed 27067 (100.0%) in 15.21 sec. Users per second: 1780
12936.9s 2084 Unable to load Cython Compute_Similarity, reverting to Python
12946.5s 2085 Similarity column 6969 (100.0%), 709.45 column/sec. Elapsed time 9.82 sec
12946.7s 2086 EvaluatorHoldout: Ignoring 40 ( 0.1%) Users that have less than 1 test interactions
12961.8s 2087 EvaluatorHoldout: Processed 27055 (100.0%) in 15.14 sec. Users per second: 1787
12962.2s 2088 Unable to load Cython Compute_Similarity, reverting to Python
12972.2s 2089 Similarity column 6969 (100.0%), 681.05 column/sec. Elapsed time 10.23 sec
12972.4s 2090 EvaluatorHoldout: Ignoring 21 ( 0.1%) Users that have less than 1 test interactions
12987.4s 2091 EvaluatorHoldout: Processed 27074 (100.0%) in 15.17 sec. Users per second: 1785
12987.9s 2092 Unable to load Cython Compute_Similarity, reverting to Python
12997.5s 2093 Similarity column 6969 (100.0%), 716.56 column/sec. Elapsed time 9.73 sec
12997.6s 2094 EvaluatorHoldout: Ignoring 29 ( 0.1%) Users that have less than 1 test interactions
13012.5s 2095 EvaluatorHoldout: Processed 27066 (100.0%) in 15.03 sec. Users per second: 1800
13012.5s 2096 [I 2025-12-07 12:30:48,023] Trial 85 finished with value: 0.22426300836868668 and parameters: {'similarity': 'tversky', 'topK': 51, 'shrink': 105, 'tversky_alpha': 0.21103900831618413, 'tversky_beta': 1.3711883918592904}. Best is trial 80 with value: 0.24810978805811468.
13012.5s 2097 
13012.5s 2098 [I 2025-12-07 12:30:48,023] Trial 85 finished with value: 0.22426300836868668 and parameters: {'similarity': 'tversky', 'topK': 51, 'shrink': 105, 'tversky_alpha': 0.21103900831618413, 'tversky_beta': 1.3711883918592904}. Best is trial 80 with value: 0.24810978805811468.
13012.7s 2099 [0.22371198465183723, 0.22456211889561475, 0.2251677839552948, 0.2231335136151857, 0.22473964072550096]
13013.0s 2100 Unable to load Cython Compute_Similarity, reverting to Python
13022.7s 2101 Similarity column 6969 (100.0%), 706.79 column/sec. Elapsed time 9.86 sec
13022.9s 2102 EvaluatorHoldout: Ignoring 33 ( 0.1%) Users that have less than 1 test interactions
13038.6s 2103 EvaluatorHoldout: Processed 27062 (100.0%) in 15.85 sec. Users per second: 1708
13039.1s 2104 Unable to load Cython Compute_Similarity, reverting to Python
13048.6s 2105 Similarity column 6969 (100.0%), 713.34 column/sec. Elapsed time 9.77 sec
13048.8s 2106 EvaluatorHoldout: Ignoring 28 ( 0.1%) Users that have less than 1 test interactions
13064.7s 2107 EvaluatorHoldout: Processed 27067 (100.0%) in 16.04 sec. Users per second: 1687
13065.2s 2108 Unable to load Cython Compute_Similarity, reverting to Python
13074.7s 2109 Similarity column 6969 (100.0%), 722.14 column/sec. Elapsed time 9.65 sec
13074.8s 2110 EvaluatorHoldout: Ignoring 40 ( 0.1%) Users that have less than 1 test interactions
13090.7s 2111 EvaluatorHoldout: Processed 27055 (100.0%) in 15.98 sec. Users per second: 1693
13091.1s 2112 Unable to load Cython Compute_Similarity, reverting to Python
13100.9s 2113 Similarity column 6969 (100.0%), 699.37 column/sec. Elapsed time 9.96 sec
13101.1s 2114 EvaluatorHoldout: Ignoring 21 ( 0.1%) Users that have less than 1 test interactions
13117.1s 2115 EvaluatorHoldout: Processed 27074 (100.0%) in 16.03 sec. Users per second: 1689
13117.5s 2116 Unable to load Cython Compute_Similarity, reverting to Python
13126.8s 2117 Similarity column 6969 (100.0%), 734.31 column/sec. Elapsed time 9.49 sec
13127.0s 2118 EvaluatorHoldout: Ignoring 29 ( 0.1%) Users that have less than 1 test interactions
13142.8s 2119 EvaluatorHoldout: Processed 27066 (100.0%) in 16.03 sec. Users per second: 1688
13142.8s 2120 [I 2025-12-07 12:32:58,350] Trial 86 finished with value: 0.2136756505700156 and parameters: {'similarity': 'tversky', 'topK': 70, 'shrink': 259, 'tversky_alpha': 0.18987486071143342, 'tversky_beta': 1.2365762957121327}. Best is trial 80 with value: 0.24810978805811468.
13142.8s 2121 
13142.8s 2122 [I 2025-12-07 12:32:58,350] Trial 86 finished with value: 0.2136756505700156 and parameters: {'similarity': 'tversky', 'topK': 70, 'shrink': 259, 'tversky_alpha': 0.18987486071143342, 'tversky_beta': 1.2365762957121327}. Best is trial 80 with value: 0.24810978805811468.
13143.0s 2123 [0.21319249814220556, 0.21369066209153995, 0.21359063846470333, 0.21320208984469233, 0.21470236430693687]
13143.3s 2124 Unable to load Cython Compute_Similarity, reverting to Python
13153.2s 2125 Similarity column 6969 (100.0%), 703.86 column/sec. Elapsed time 9.90 sec
13153.2s 2126 EvaluatorHoldout: Ignoring 33 ( 0.1%) Users that have less than 1 test interactions
13168.1s 2127 EvaluatorHoldout: Processed 27062 (100.0%) in 14.98 sec. Users per second: 1806
13168.5s 2128 Unable to load Cython Compute_Similarity, reverting to Python
13177.7s 2129 Similarity column 6969 (100.0%), 748.15 column/sec. Elapsed time 9.31 sec
13177.9s 2130 EvaluatorHoldout: Ignoring 28 ( 0.1%) Users that have less than 1 test interactions
13192.8s 2131 EvaluatorHoldout: Processed 27067 (100.0%) in 15.02 sec. Users per second: 1802
13193.2s 2132 Unable to load Cython Compute_Similarity, reverting to Python
13202.7s 2133 Similarity column 6969 (100.0%), 721.67 column/sec. Elapsed time 9.66 sec
13202.9s 2134 EvaluatorHoldout: Ignoring 40 ( 0.1%) Users that have less than 1 test interactions
13217.6s 2135 EvaluatorHoldout: Processed 27055 (100.0%) in 14.94 sec. Users per second: 1810
13218.1s 2136 Unable to load Cython Compute_Similarity, reverting to Python
13227.3s 2137 Similarity column 6969 (100.0%), 748.55 column/sec. Elapsed time 9.31 sec
13227.4s 2138 EvaluatorHoldout: Ignoring 21 ( 0.1%) Users that have less than 1 test interactions
13242.3s 2139 EvaluatorHoldout: Processed 27074 (100.0%) in 15.02 sec. Users per second: 1803
13242.8s 2140 Unable to load Cython Compute_Similarity, reverting to Python
13251.9s 2141 Similarity column 6969 (100.0%), 749.48 column/sec. Elapsed time 9.30 sec
13252.1s 2142 EvaluatorHoldout: Ignoring 29 ( 0.1%) Users that have less than 1 test interactions
13267.0s 2143 EvaluatorHoldout: Processed 27066 (100.0%) in 14.96 sec. Users per second: 1809
13267.0s 2144 [I 2025-12-07 12:35:02,382] Trial 87 finished with value: 0.21747136885903706 and parameters: {'similarity': 'tversky', 'topK': 30, 'shrink': 170, 'tversky_alpha': 0.43436685938758895, 'tversky_beta': 1.0543946972738238}. Best is trial 80 with value: 0.24810978805811468.
13267.0s 2145 
13267.0s 2146 [I 2025-12-07 12:35:02,382] Trial 87 finished with value: 0.21747136885903706 and parameters: {'similarity': 'tversky', 'topK': 30, 'shrink': 170, 'tversky_alpha': 0.43436685938758895, 'tversky_beta': 1.0543946972738238}. Best is trial 80 with value: 0.24810978805811468.
13267.1s 2147 [0.21735508141529364, 0.21795193561858336, 0.2185591602539738, 0.216055670778023, 0.21743499622931148]
13267.4s 2148 Unable to load Cython Compute_Similarity, reverting to Python
13277.2s 2149 Similarity column 6969 (100.0%), 696.60 column/sec. Elapsed time 10.00 sec
13277.4s 2150 EvaluatorHoldout: Ignoring 33 ( 0.1%) Users that have less than 1 test interactions
13293.4s 2151 EvaluatorHoldout: Processed 27062 (100.0%) in 16.18 sec. Users per second: 1672
13293.9s 2152 Unable to load Cython Compute_Similarity, reverting to Python
13303.5s 2153 Similarity column 6969 (100.0%), 721.08 column/sec. Elapsed time 9.66 sec
13303.6s 2154 EvaluatorHoldout: Ignoring 28 ( 0.1%) Users that have less than 1 test interactions
13319.7s 2155 EvaluatorHoldout: Processed 27067 (100.0%) in 16.31 sec. Users per second: 1659
13320.2s 2156 Unable to load Cython Compute_Similarity, reverting to Python
13330.3s 2157 Similarity column 6969 (100.0%), 677.23 column/sec. Elapsed time 10.29 sec
13330.5s 2158 EvaluatorHoldout: Ignoring 40 ( 0.1%) Users that have less than 1 test interactions
13346.6s 2159 EvaluatorHoldout: Processed 27055 (100.0%) in 16.15 sec. Users per second: 1675
13347.0s 2160 Unable to load Cython Compute_Similarity, reverting to Python
13356.9s 2161 Similarity column 6969 (100.0%), 689.17 column/sec. Elapsed time 10.11 sec
13357.1s 2162 EvaluatorHoldout: Ignoring 21 ( 0.1%) Users that have less than 1 test interactions
13373.1s 2163 EvaluatorHoldout: Processed 27074 (100.0%) in 16.20 sec. Users per second: 1672
13373.6s 2164 Unable to load Cython Compute_Similarity, reverting to Python
13383.3s 2165 Similarity column 6969 (100.0%), 709.82 column/sec. Elapsed time 9.82 sec
13383.4s 2166 EvaluatorHoldout: Ignoring 29 ( 0.1%) Users that have less than 1 test interactions
13399.8s 2167 EvaluatorHoldout: Processed 27066 (100.0%) in 16.50 sec. Users per second: 1641
13399.8s 2168 [I 2025-12-07 12:37:15,290] Trial 88 finished with value: 0.20984795329252895 and parameters: {'similarity': 'tversky', 'topK': 99, 'shrink': 211, 'tversky_alpha': 0.18358356092683514, 'tversky_beta': 1.4025078775207962}. Best is trial 80 with value: 0.24810978805811468.
13399.8s 2169 
