10137.9s 1570 [I 2025-12-07 11:42:53,374] Trial 63 finished with value: 0.2401408230394086 and parameters: {'similarity': 'tversky', 'topK': 6, 'shrink': 665, 'tversky_alpha': 0.3125393511116597, 'tversky_beta': 1.4764742119303214}. Best is trial 63 with value: 0.2401408230394086.
10138.1s 1571 [0.23859311761820537, 0.2406239724142654, 0.24215359813339996, 0.2385674239562062, 0.2407660030749661]
10138.4s 1572 Unable to load Cython Compute_Similarity, reverting to Python
10147.8s 1573 Similarity column 6969 (100.0%), 729.15 column/sec. Elapsed time 9.56 sec
10147.9s 1574 EvaluatorHoldout: Ignoring 33 ( 0.1%) Users that have less than 1 test interactions
10165.4s 1575 EvaluatorHoldout: Processed 27062 (100.0%) in 17.68 sec. Users per second: 1530
10165.9s 1576 Unable to load Cython Compute_Similarity, reverting to Python
10175.3s 1577 Similarity column 6969 (100.0%), 730.12 column/sec. Elapsed time 9.55 sec
10175.5s 1578 EvaluatorHoldout: Ignoring 28 ( 0.1%) Users that have less than 1 test interactions
10193.1s 1579 EvaluatorHoldout: Processed 27067 (100.0%) in 17.75 sec. Users per second: 1525
10193.5s 1580 Unable to load Cython Compute_Similarity, reverting to Python
10203.2s 1581 Similarity column 6969 (100.0%), 703.77 column/sec. Elapsed time 9.90 sec
10203.5s 1582 EvaluatorHoldout: Ignoring 40 ( 0.1%) Users that have less than 1 test interactions
10220.8s 1583 EvaluatorHoldout: Processed 27055 (100.0%) in 17.55 sec. Users per second: 1541
10221.3s 1584 Unable to load Cython Compute_Similarity, reverting to Python
10230.9s 1585 Similarity column 6969 (100.0%), 716.72 column/sec. Elapsed time 9.72 sec
10231.1s 1586 EvaluatorHoldout: Ignoring 21 ( 0.1%) Users that have less than 1 test interactions
10248.4s 1587 EvaluatorHoldout: Processed 27074 (100.0%) in 17.45 sec. Users per second: 1552
10248.8s 1588 Unable to load Cython Compute_Similarity, reverting to Python
10258.2s 1589 Similarity column 6969 (100.0%), 730.18 column/sec. Elapsed time 9.54 sec
10258.4s 1590 EvaluatorHoldout: Ignoring 29 ( 0.1%) Users that have less than 1 test interactions
10275.8s 1591 EvaluatorHoldout: Processed 27066 (100.0%) in 17.54 sec. Users per second: 1543
10275.8s 1592 [I 2025-12-07 11:45:11,289] Trial 64 finished with value: 0.19659051508762118 and parameters: {'similarity': 'tversky', 'topK': 94, 'shrink': 883, 'tversky_alpha': 0.4070293346640697, 'tversky_beta': 1.446486792809367}. Best is trial 63 with value: 0.2401408230394086.
10275.8s 1593 
10275.8s 1594 [I 2025-12-07 11:45:11,289] Trial 64 finished with value: 0.19659051508762118 and parameters: {'similarity': 'tversky', 'topK': 94, 'shrink': 883, 'tversky_alpha': 0.4070293346640697, 'tversky_beta': 1.446486792809367}. Best is trial 63 with value: 0.2401408230394086.
10276.0s 1595 [0.19642379058113363, 0.19627969910980275, 0.1973257842685697, 0.19600435944309166, 0.19691894203550808]
10276.3s 1596 Unable to load Cython Compute_Similarity, reverting to Python
10285.1s 1597 Similarity column 6969 (100.0%), 770.29 column/sec. Elapsed time 9.05 sec
10285.3s 1598 EvaluatorHoldout: Ignoring 33 ( 0.1%) Users that have less than 1 test interactions
10299.6s 1599 EvaluatorHoldout: Processed 27062 (100.0%) in 14.41 sec. Users per second: 1878
10300.1s 1600 Unable to load Cython Compute_Similarity, reverting to Python
10308.8s 1601 Similarity column 6969 (100.0%), 789.10 column/sec. Elapsed time 8.83 sec
10308.9s 1602 EvaluatorHoldout: Ignoring 28 ( 0.1%) Users that have less than 1 test interactions
10323.2s 1603 EvaluatorHoldout: Processed 27067 (100.0%) in 14.51 sec. Users per second: 1866
10323.7s 1604 Unable to load Cython Compute_Similarity, reverting to Python
10332.7s 1605 Similarity column 6969 (100.0%), 759.26 column/sec. Elapsed time 9.18 sec
10332.9s 1606 EvaluatorHoldout: Ignoring 40 ( 0.1%) Users that have less than 1 test interactions
10347.2s 1607 EvaluatorHoldout: Processed 27055 (100.0%) in 14.39 sec. Users per second: 1880
10347.6s 1608 Unable to load Cython Compute_Similarity, reverting to Python
10356.4s 1609 Similarity column 6969 (100.0%), 772.19 column/sec. Elapsed time 9.02 sec
10356.6s 1610 EvaluatorHoldout: Ignoring 21 ( 0.1%) Users that have less than 1 test interactions
10370.9s 1611 EvaluatorHoldout: Processed 27074 (100.0%) in 14.43 sec. Users per second: 1876
10371.4s 1612 Unable to load Cython Compute_Similarity, reverting to Python
10380.2s 1613 Similarity column 6969 (100.0%), 783.79 column/sec. Elapsed time 8.89 sec
10380.3s 1614 EvaluatorHoldout: Ignoring 29 ( 0.1%) Users that have less than 1 test interactions
10394.5s 1615 EvaluatorHoldout: Processed 27066 (100.0%) in 14.41 sec. Users per second: 1878
10394.5s 1616 [I 2025-12-07 11:47:10,040] Trial 65 finished with value: 0.20896071701486124 and parameters: {'similarity': 'tversky', 'topK': 8, 'shrink': 782, 'tversky_alpha': 0.3674731972758264, 'tversky_beta': 0.6251513245538256}. Best is trial 63 with value: 0.2401408230394086.
10394.5s 1617 
10394.5s 1618 [I 2025-12-07 11:47:10,040] Trial 65 finished with value: 0.20896071701486124 and parameters: {'similarity': 'tversky', 'topK': 8, 'shrink': 782, 'tversky_alpha': 0.3674731972758264, 'tversky_beta': 0.6251513245538256}. Best is trial 63 with value: 0.2401408230394086.
10394.7s 1619 [0.20856252081762036, 0.21003301717188866, 0.21073223267431535, 0.2067040541746729, 0.20877176023580898]
10395.0s 1620 Unable to load Cython Compute_Similarity, reverting to Python
10404.6s 1621 Similarity column 6969 (100.0%), 715.67 column/sec. Elapsed time 9.74 sec
10404.8s 1622 EvaluatorHoldout: Ignoring 33 ( 0.1%) Users that have less than 1 test interactions
10422.7s 1623 EvaluatorHoldout: Processed 27062 (100.0%) in 18.04 sec. Users per second: 1500
10423.1s 1624 Unable to load Cython Compute_Similarity, reverting to Python
10432.8s 1625 Similarity column 6969 (100.0%), 708.55 column/sec. Elapsed time 9.84 sec
10433.0s 1626 EvaluatorHoldout: Ignoring 28 ( 0.1%) Users that have less than 1 test interactions
10451.4s 1627 EvaluatorHoldout: Processed 27067 (100.0%) in 18.60 sec. Users per second: 1455
10451.9s 1628 Unable to load Cython Compute_Similarity, reverting to Python
10462.2s 1629 Similarity column 6969 (100.0%), 669.03 column/sec. Elapsed time 10.42 sec
10462.3s 1630 EvaluatorHoldout: Ignoring 40 ( 0.1%) Users that have less than 1 test interactions
10480.5s 1631 EvaluatorHoldout: Processed 27055 (100.0%) in 18.33 sec. Users per second: 1476
10481.0s 1632 Unable to load Cython Compute_Similarity, reverting to Python
10490.9s 1633 Similarity column 6969 (100.0%), 693.77 column/sec. Elapsed time 10.05 sec
10491.1s 1634 EvaluatorHoldout: Ignoring 21 ( 0.1%) Users that have less than 1 test interactions
10509.6s 1635 EvaluatorHoldout: Processed 27074 (100.0%) in 18.65 sec. Users per second: 1451
10510.0s 1636 Unable to load Cython Compute_Similarity, reverting to Python
10519.7s 1637 Similarity column 6969 (100.0%), 704.22 column/sec. Elapsed time 9.90 sec
10519.9s 1638 EvaluatorHoldout: Ignoring 29 ( 0.1%) Users that have less than 1 test interactions
10538.1s 1639 EvaluatorHoldout: Processed 27066 (100.0%) in 18.29 sec. Users per second: 1480
10538.1s 1640 [I 2025-12-07 11:49:33,584] Trial 66 finished with value: 0.1996368784426349 and parameters: {'similarity': 'tversky', 'topK': 133, 'shrink': 661, 'tversky_alpha': 1.1776214147679003, 'tversky_beta': 1.5124069760220558}. Best is trial 63 with value: 0.2401408230394086.
10538.1s 1641 
10538.1s 1642 [I 2025-12-07 11:49:33,584] Trial 66 finished with value: 0.1996368784426349 and parameters: {'similarity': 'tversky', 'topK': 133, 'shrink': 661, 'tversky_alpha': 1.1776214147679003, 'tversky_beta': 1.5124069760220558}. Best is trial 63 with value: 0.2401408230394086.
10538.3s 1643 [0.19880849046586124, 0.1999522045978507, 0.20045208729801098, 0.1984711914662084, 0.20050041838524316]
10538.6s 1644 Unable to load Cython Compute_Similarity, reverting to Python
10550.6s 1645 Similarity column 6969 (100.0%), 572.53 column/sec. Elapsed time 12.17 sec
10550.7s 1646 EvaluatorHoldout: Ignoring 33 ( 0.1%) Users that have less than 1 test interactions
10576.1s 1647 EvaluatorHoldout: Processed 27062 (100.0%) in 25.44 sec. Users per second: 1064
10576.6s 1648 Unable to load Cython Compute_Similarity, reverting to Python
10589.1s 1649 Similarity column 6969 (100.0%), 552.59 column/sec. Elapsed time 12.61 sec
10589.2s 1650 EvaluatorHoldout: Ignoring 28 ( 0.1%) Users that have less than 1 test interactions
10614.4s 1651 EvaluatorHoldout: Processed 27067 (100.0%) in 25.35 sec. Users per second: 1068
10614.9s 1652 Unable to load Cython Compute_Similarity, reverting to Python
10626.9s 1653 Similarity column 6969 (100.0%), 576.38 column/sec. Elapsed time 12.09 sec
10627.0s 1654 EvaluatorHoldout: Ignoring 40 ( 0.1%) Users that have less than 1 test interactions
10652.5s 1655 EvaluatorHoldout: Processed 27055 (100.0%) in 25.54 sec. Users per second: 1059
10652.9s 1656 Unable to load Cython Compute_Similarity, reverting to Python
10665.1s 1657 Similarity column 6969 (100.0%), 569.19 column/sec. Elapsed time 12.24 sec
10665.2s 1658 EvaluatorHoldout: Ignoring 21 ( 0.1%) Users that have less than 1 test interactions
10690.3s 1659 EvaluatorHoldout: Processed 27074 (100.0%) in 25.21 sec. Users per second: 1074
10690.8s 1660 Unable to load Cython Compute_Similarity, reverting to Python
10702.9s 1661 Similarity column 6969 (100.0%), 568.08 column/sec. Elapsed time 12.27 sec
10703.1s 1662 EvaluatorHoldout: Ignoring 29 ( 0.1%) Users that have less than 1 test interactions
10728.2s 1663 EvaluatorHoldout: Processed 27066 (100.0%) in 25.25 sec. Users per second: 1072
10728.2s 1664 [I 2025-12-07 11:52:43,723] Trial 67 finished with value: 0.20335363195721995 and parameters: {'similarity': 'asymmetric', 'topK': 432, 'shrink': 602, 'asymmetric_alpha': 0.4194150091540584}. Best is trial 63 with value: 0.2401408230394086.
10728.2s 1665 
10728.2s 1666 [I 2025-12-07 11:52:43,723] Trial 67 finished with value: 0.20335363195721995 and parameters: {'similarity': 'asymmetric', 'topK': 432, 'shrink': 602, 'asymmetric_alpha': 0.4194150091540584}. Best is trial 63 with value: 0.2401408230394086.
10728.4s 1667 [0.2026483414047103, 0.20325874496587185, 0.2028897149223889, 0.2034169502030066, 0.20455440829012228]
10728.7s 1668 Unable to load Cython Compute_Similarity, reverting to Python
10737.7s 1669 Similarity column 6969 (100.0%), 764.58 column/sec. Elapsed time 9.11 sec
10737.8s 1670 EvaluatorHoldout: Ignoring 33 ( 0.1%) Users that have less than 1 test interactions
10758.1s 1671 EvaluatorHoldout: Processed 27062 (100.0%) in 20.49 sec. Users per second: 1321
10758.6s 1672 Unable to load Cython Compute_Similarity, reverting to Python
10767.5s 1673 Similarity column 6969 (100.0%), 768.93 column/sec. Elapsed time 9.06 sec
10767.8s 1674 EvaluatorHoldout: Ignoring 28 ( 0.1%) Users that have less than 1 test interactions
10788.0s 1675 EvaluatorHoldout: Processed 27067 (100.0%) in 20.43 sec. Users per second: 1325
10788.5s 1676 Unable to load Cython Compute_Similarity, reverting to Python
10797.2s 1677 Similarity column 6969 (100.0%), 777.47 column/sec. Elapsed time 8.96 sec
10797.4s 1678 EvaluatorHoldout: Ignoring 40 ( 0.1%) Users that have less than 1 test interactions
10818.0s 1679 EvaluatorHoldout: Processed 27055 (100.0%) in 20.62 sec. Users per second: 1312
10818.4s 1680 Unable to load Cython Compute_Similarity, reverting to Python
10827.5s 1681 Similarity column 6969 (100.0%), 747.35 column/sec. Elapsed time 9.32 sec
10827.7s 1682 EvaluatorHoldout: Ignoring 21 ( 0.1%) Users that have less than 1 test interactions
10848.1s 1683 EvaluatorHoldout: Processed 27074 (100.0%) in 20.50 sec. Users per second: 1321
10848.5s 1684 Unable to load Cython Compute_Similarity, reverting to Python
10857.4s 1685 Similarity column 6969 (100.0%), 771.11 column/sec. Elapsed time 9.04 sec
10857.6s 1686 EvaluatorHoldout: Ignoring 29 ( 0.1%) Users that have less than 1 test interactions
10877.8s 1687 EvaluatorHoldout: Processed 27066 (100.0%) in 20.37 sec. Users per second: 1329
10877.8s 1688 [I 2025-12-07 11:55:13,282] Trial 68 finished with value: 0.2085335043325859 and parameters: {'similarity': 'asymmetric', 'topK': 60, 'shrink': 711, 'asymmetric_alpha': 0.6284362539707196}. Best is trial 63 with value: 0.2401408230394086.
10877.8s 1689 
10877.8s 1690 [I 2025-12-07 11:55:13,282] Trial 68 finished with value: 0.2085335043325859 and parameters: {'similarity': 'asymmetric', 'topK': 60, 'shrink': 711, 'asymmetric_alpha': 0.6284362539707196}. Best is trial 63 with value: 0.2401408230394086.
10878.0s 1691 [0.2082107165190065, 0.20825339918236183, 0.209070733716699, 0.20815045045954936, 0.20898222178531298]
10878.3s 1692 Unable to load Cython Compute_Similarity, reverting to Python
10887.3s 1693 Similarity column 6969 (100.0%), 753.48 column/sec. Elapsed time 9.25 sec
10887.5s 1694 EvaluatorHoldout: Ignoring 33 ( 0.1%) Users that have less than 1 test interactions
10909.9s 1695 EvaluatorHoldout: Processed 27062 (100.0%) in 22.34 sec. Users per second: 1211
10910.2s 1696 Unable to load Cython Compute_Similarity, reverting to Python
10919.2s 1697 Similarity column 6969 (100.0%), 753.63 column/sec. Elapsed time 9.25 sec
10919.4s 1698 EvaluatorHoldout: Ignoring 28 ( 0.1%) Users that have less than 1 test interactions
10941.9s 1699 EvaluatorHoldout: Processed 27067 (100.0%) in 22.54 sec. Users per second: 1201
10942.3s 1700 Unable to load Cython Compute_Similarity, reverting to Python
10951.7s 1701 Similarity column 6969 (100.0%), 727.08 column/sec. Elapsed time 9.58 sec
10951.9s 1702 EvaluatorHoldout: Ignoring 40 ( 0.1%) Users that have less than 1 test interactions
10974.2s 1703 EvaluatorHoldout: Processed 27055 (100.0%) in 22.39 sec. Users per second: 1208
10974.6s 1704 Unable to load Cython Compute_Similarity, reverting to Python
10983.7s 1705 Similarity column 6969 (100.0%), 746.77 column/sec. Elapsed time 9.33 sec
10983.9s 1706 EvaluatorHoldout: Ignoring 21 ( 0.1%) Users that have less than 1 test interactions
11006.2s 1707 EvaluatorHoldout: Processed 27074 (100.0%) in 22.35 sec. Users per second: 1211
11006.6s 1708 Unable to load Cython Compute_Similarity, reverting to Python
11015.7s 1709 Similarity column 6969 (100.0%), 751.39 column/sec. Elapsed time 9.27 sec
11015.9s 1710 EvaluatorHoldout: Ignoring 29 ( 0.1%) Users that have less than 1 test interactions
11038.5s 1711 EvaluatorHoldout: Processed 27066 (100.0%) in 22.66 sec. Users per second: 1194
11038.5s 1712 [I 2025-12-07 11:57:53,927] Trial 69 finished with value: 0.0926465862081688 and parameters: {'similarity': 'asymmetric', 'topK': 80, 'shrink': 317, 'asymmetric_alpha': 0.9430633872288996}. Best is trial 63 with value: 0.2401408230394086.
11038.5s 1713 
11038.5s 1714 [I 2025-12-07 11:57:53,927] Trial 69 finished with value: 0.0926465862081688 and parameters: {'similarity': 'asymmetric', 'topK': 80, 'shrink': 317, 'asymmetric_alpha': 0.9430633872288996}. Best is trial 63 with value: 0.2401408230394086.
11038.6s 1715 [0.0935874433858381, 0.09334553411046974, 0.09260197691502567, 0.09198942519756168, 0.09170855143194885]
11038.9s 1716 Unable to load Cython Compute_Similarity, reverting to Python
11048.6s 1717 Similarity column 6969 (100.0%), 707.88 column/sec. Elapsed time 9.84 sec
11048.8s 1718 EvaluatorHoldout: Ignoring 33 ( 0.1%) Users that have less than 1 test interactions
11066.7s 1719 EvaluatorHoldout: Processed 27062 (100.0%) in 18.07 sec. Users per second: 1497
11067.2s 1720 Unable to load Cython Compute_Similarity, reverting to Python
11076.8s 1721 Similarity column 6969 (100.0%), 715.56 column/sec. Elapsed time 9.74 sec
11076.9s 1722 EvaluatorHoldout: Ignoring 28 ( 0.1%) Users that have less than 1 test interactions
11094.8s 1723 EvaluatorHoldout: Processed 27067 (100.0%) in 18.10 sec. Users per second: 1495
11095.3s 1724 Unable to load Cython Compute_Similarity, reverting to Python
11105.4s 1725 Similarity column 6969 (100.0%), 676.78 column/sec. Elapsed time 10.30 sec
11105.6s 1726 EvaluatorHoldout: Ignoring 40 ( 0.1%) Users that have less than 1 test interactions
11123.6s 1727 EvaluatorHoldout: Processed 27055 (100.0%) in 18.03 sec. Users per second: 1500
11124.0s 1728 Unable to load Cython Compute_Similarity, reverting to Python
11133.5s 1729 Similarity column 6969 (100.0%), 716.92 column/sec. Elapsed time 9.72 sec
11133.7s 1730 EvaluatorHoldout: Ignoring 21 ( 0.1%) Users that have less than 1 test interactions
11151.5s 1731 EvaluatorHoldout: Processed 27074 (100.0%) in 17.98 sec. Users per second: 1506
11152.0s 1732 Unable to load Cython Compute_Similarity, reverting to Python
11162.3s 1733 Similarity column 6969 (100.0%), 669.97 column/sec. Elapsed time 10.40 sec
11162.4s 1734 EvaluatorHoldout: Ignoring 29 ( 0.1%) Users that have less than 1 test interactions
11180.3s 1735 EvaluatorHoldout: Processed 27066 (100.0%) in 18.04 sec. Users per second: 1501
11180.3s 1736 [I 2025-12-07 12:00:15,842] Trial 70 finished with value: 0.19452856929992418 and parameters: {'similarity': 'tversky', 'topK': 117, 'shrink': 438, 'tversky_alpha': 0.27560012015010193, 'tversky_beta': 0.8339762649953636}. Best is trial 63 with value: 0.2401408230394086.
11180.3s 1737 
11180.3s 1738 [I 2025-12-07 12:00:15,842] Trial 70 finished with value: 0.19452856929992418 and parameters: {'similarity': 'tversky', 'topK': 117, 'shrink': 438, 'tversky_alpha': 0.27560012015010193, 'tversky_beta': 0.8339762649953636}. Best is trial 63 with value: 0.2401408230394086.
11180.5s 1739 [0.19387739306141988, 0.19465507753055802, 0.19489748218430303, 0.19392243245459576, 0.19529046126874414]
11180.8s 1740 Unable to load Cython Compute_Similarity, reverting to Python
11190.0s 1741 Similarity column 6969 (100.0%), 744.14 column/sec. Elapsed time 9.37 sec
11190.2s 1742 EvaluatorHoldout: Ignoring 33 ( 0.1%) Users that have less than 1 test interactions
11204.9s 1743 EvaluatorHoldout: Processed 27062 (100.0%) in 14.83 sec. Users per second: 1824
11205.3s 1744 Unable to load Cython Compute_Similarity, reverting to Python
11214.4s 1745 Similarity column 6969 (100.0%), 750.52 column/sec. Elapsed time 9.29 sec
11214.6s 1746 EvaluatorHoldout: Ignoring 28 ( 0.1%) Users that have less than 1 test interactions
11229.4s 1747 EvaluatorHoldout: Processed 27067 (100.0%) in 14.92 sec. Users per second: 1814
11229.9s 1748 Unable to load Cython Compute_Similarity, reverting to Python
11239.4s 1749 Similarity column 6969 (100.0%), 721.83 column/sec. Elapsed time 9.65 sec
11239.5s 1750 EvaluatorHoldout: Ignoring 40 ( 0.1%) Users that have less than 1 test interactions
11254.4s 1751 EvaluatorHoldout: Processed 27055 (100.0%) in 14.98 sec. Users per second: 1805
11254.8s 1752 Unable to load Cython Compute_Similarity, reverting to Python
11264.4s 1753 Similarity column 6969 (100.0%), 717.08 column/sec. Elapsed time 9.72 sec
11264.6s 1754 EvaluatorHoldout: Ignoring 21 ( 0.1%) Users that have less than 1 test interactions
11279.5s 1755 EvaluatorHoldout: Processed 27074 (100.0%) in 15.02 sec. Users per second: 1802
11279.9s 1756 Unable to load Cython Compute_Similarity, reverting to Python
11289.5s 1757 Similarity column 6969 (100.0%), 709.96 column/sec. Elapsed time 9.82 sec
11289.7s 1758 EvaluatorHoldout: Ignoring 29 ( 0.1%) Users that have less than 1 test interactions
11304.6s 1759 EvaluatorHoldout: Processed 27066 (100.0%) in 15.08 sec. Users per second: 1795
11304.6s 1760 [I 2025-12-07 12:02:20,151] Trial 71 finished with value: 0.23570594861171004 and parameters: {'similarity': 'tversky', 'topK': 31, 'shrink': 514, 'tversky_alpha': 0.04564484999419194, 'tversky_beta': 1.6626229666900412}. Best is trial 63 with value: 0.2401408230394086.
11304.6s 1761 
11304.6s 1762 [I 2025-12-07 12:02:20,151] Trial 71 finished with value: 0.23570594861171004 and parameters: {'similarity': 'tversky', 'topK': 31, 'shrink': 514, 'tversky_alpha': 0.04564484999419194, 'tversky_beta': 1.6626229666900412}. Best is trial 63 with value: 0.2401408230394086.
11304.8s 1763 [0.23512165998734205, 0.23574047122383296, 0.23651653759084648, 0.23467659894786058, 0.236474475308668]
11305.1s 1764 Unable to load Cython Compute_Similarity, reverting to Python
11314.2s 1765 Similarity column 6969 (100.0%), 756.23 column/sec. Elapsed time 9.22 sec
11314.4s 1766 EvaluatorHoldout: Ignoring 33 ( 0.1%) Users that have less than 1 test interactions
11328.0s 1767 EvaluatorHoldout: Processed 27062 (100.0%) in 13.79 sec. Users per second: 1962
11328.5s 1768 Unable to load Cython Compute_Similarity, reverting to Python
11338.1s 1769 Similarity column 6969 (100.0%), 709.06 column/sec. Elapsed time 9.83 sec
11338.3s 1770 EvaluatorHoldout: Ignoring 28 ( 0.1%) Users that have less than 1 test interactions
11352.1s 1771 EvaluatorHoldout: Processed 27067 (100.0%) in 13.88 sec. Users per second: 1951
11352.5s 1772 Unable to load Cython Compute_Similarity, reverting to Python
11361.9s 1773 Similarity column 6969 (100.0%), 729.18 column/sec. Elapsed time 9.56 sec
11362.1s 1774 EvaluatorHoldout: Ignoring 40 ( 0.1%) Users that have less than 1 test interactions
11375.7s 1775 EvaluatorHoldout: Processed 27055 (100.0%) in 13.81 sec. Users per second: 1958
11376.2s 1776 Unable to load Cython Compute_Similarity, reverting to Python
11385.2s 1777 Similarity column 6969 (100.0%), 764.89 column/sec. Elapsed time 9.11 sec
11385.3s 1778 EvaluatorHoldout: Ignoring 21 ( 0.1%) Users that have less than 1 test interactions
11398.8s 1779 EvaluatorHoldout: Processed 27074 (100.0%) in 13.71 sec. Users per second: 1975
11399.3s 1780 Unable to load Cython Compute_Similarity, reverting to Python
11408.4s 1781 Similarity column 6969 (100.0%), 753.73 column/sec. Elapsed time 9.25 sec
11408.6s 1782 EvaluatorHoldout: Ignoring 29 ( 0.1%) Users that have less than 1 test interactions
11422.4s 1783 EvaluatorHoldout: Processed 27066 (100.0%) in 13.91 sec. Users per second: 1945
