27330.2s 4810 [I 2025-12-07 16:29:25,476] Trial 198 finished with value: 0.21830226798714403 and parameters: {'similarity': 'tversky', 'topK': 64, 'shrink': 327, 'tversky_alpha': 0.15277412319939665, 'tversky_beta': 1.3872902213315772}. Best is trial 182 with value: 0.2514384438125787.
27330.2s 4811 [0.21802109273318676, 0.218569822848655, 0.21850751684970596, 0.2177516001874946, 0.21866130731667768]
27330.5s 4812 Unable to load Cython Compute_Similarity, reverting to Python
27339.2s 4813 Similarity column 6969 (100.0%), 782.74 column/sec. Elapsed time 8.90 sec
27339.4s 4814 EvaluatorHoldout: Ignoring 33 ( 0.1%) Users that have less than 1 test interactions
27353.6s 4815 EvaluatorHoldout: Processed 27062 (100.0%) in 14.42 sec. Users per second: 1877
27354.1s 4816 Unable to load Cython Compute_Similarity, reverting to Python
27363.0s 4817 Similarity column 6969 (100.0%), 781.27 column/sec. Elapsed time 8.92 sec
27363.0s 4818 EvaluatorHoldout: Ignoring 28 ( 0.1%) Users that have less than 1 test interactions
27377.5s 4819 EvaluatorHoldout: Processed 27067 (100.0%) in 14.64 sec. Users per second: 1849
27378.0s 4820 Unable to load Cython Compute_Similarity, reverting to Python
27386.9s 4821 Similarity column 6969 (100.0%), 769.15 column/sec. Elapsed time 9.06 sec
27387.1s 4822 EvaluatorHoldout: Ignoring 40 ( 0.1%) Users that have less than 1 test interactions
27401.7s 4823 EvaluatorHoldout: Processed 27055 (100.0%) in 14.54 sec. Users per second: 1860
27401.9s 4824 Unable to load Cython Compute_Similarity, reverting to Python
27410.7s 4825 Similarity column 6969 (100.0%), 773.06 column/sec. Elapsed time 9.01 sec
27410.9s 4826 EvaluatorHoldout: Ignoring 21 ( 0.1%) Users that have less than 1 test interactions
27425.7s 4827 EvaluatorHoldout: Processed 27074 (100.0%) in 14.93 sec. Users per second: 1813
27426.2s 4828 Unable to load Cython Compute_Similarity, reverting to Python
27435.0s 4829 Similarity column 6969 (100.0%), 786.25 column/sec. Elapsed time 8.86 sec
27435.0s 4830 EvaluatorHoldout: Ignoring 29 ( 0.1%) Users that have less than 1 test interactions
27449.5s 4831 EvaluatorHoldout: Processed 27066 (100.0%) in 14.58 sec. Users per second: 1856
27449.5s 4832 [I 2025-12-07 16:31:24,977] Trial 199 finished with value: 0.23434828683583678 and parameters: {'similarity': 'tversky', 'topK': 36, 'shrink': 290, 'tversky_alpha': 0.1102287135741833, 'tversky_beta': 1.5603660662004308}. Best is trial 182 with value: 0.2514384438125787.
27449.5s 4833 
27449.5s 4834 [I 2025-12-07 16:31:24,977] Trial 199 finished with value: 0.23434828683583678 and parameters: {'similarity': 'tversky', 'topK': 36, 'shrink': 290, 'tversky_alpha': 0.1102287135741833, 'tversky_beta': 1.5603660662004308}. Best is trial 182 with value: 0.2514384438125787.
27449.5s 4835 [0.23376622734524108, 0.234380280517643, 0.23549721411435368, 0.23339562648951764, 0.23470208571242845]
27460.2s 4836 Traceback (most recent call last):
27460.2s 4837 File "<string>", line 1, in <module>
27460.2s 4838 File "/usr/local/lib/python3.11/dist-packages/papermill/execute.py", line 131, in execute_notebook
27460.2s 4839 raise_for_execution_errors(nb, output_path)
27460.2s 4840 File "/usr/local/lib/python3.11/dist-packages/papermill/execute.py", line 251, in raise_for_execution_errors
27460.2s 4841 raise error
27460.2s 4842 papermill.exceptions.PapermillExecutionError:
27460.2s 4843 ---------------------------------------------------------------------------
27460.2s 4844 Exception encountered at "In [3]":
27460.2s 4845 ---------------------------------------------------------------------------
27460.2s 4846 AttributeError                            Traceback (most recent call last)
27460.2s 4847 AttributeError: 'MessageFactory' object has no attribute 'GetPrototype'
27460.2s 4848 
27464.0s 4849 /usr/local/lib/python3.11/dist-packages/traitlets/traitlets.py:2915: FutureWarning: --Exporter.preprocessors=["remove_papermill_header.RemovePapermillHeader"] for containers is deprecated in traitlets 5.0. You can pass `--Exporter.preprocessors item` ... multiple times to add items to a list.
27464.0s 4850 warn(
27464.0s 4851 [NbConvertApp] Converting notebook __notebook__.ipynb to notebook
27465.1s 4852 [NbConvertApp] Writing 516170 bytes to __notebook__.ipynb
27468.2s 4853 /usr/local/lib/python3.11/dist-packages/traitlets/traitlets.py:2915: FutureWarning: --Exporter.preprocessors=["nbconvert.preprocessors.ExtractOutputPreprocessor"] for containers is deprecated in traitlets 5.0. You can pass `--Exporter.preprocessors item` ... multiple times to add items to a list.
27468.2s 4854 warn(
27468.3s 4855 [NbConvertApp] Converting notebook __notebook__.ipynb to html
27469.3s 4856 [NbConvertApp] Writing 788214 bytes to __results__.html