292.6s 58 [I 2025-12-06 21:22:43,594] Trial 0 finished with value: 0.21000318589260436 and parameters: {'topK': 410, 'shrink': 317, 'feature_weighting': 'TF-IDF'}. Best is trial 0 with value: 0.21000318589260436.
292.8s 59 [0.210605407440953, 0.20964568091149383, 0.2091504073828224, 0.210671652297134, 0.20994278143061854]
293.2s 60 Unable to load Cython Compute_Similarity, reverting to Python
305.4s 61 Similarity column 6969 (100.0%), 558.70 column/sec. Elapsed time 12.47 sec
305.6s 62 EvaluatorHoldout: Ignoring 48 ( 0.2%) Users that have less than 1 test interactions
333.6s 63 EvaluatorHoldout: Processed 27047 (100.0%) in 28.13 sec. Users per second: 962
334.2s 64 Unable to load Cython Compute_Similarity, reverting to Python
346.6s 65 Similarity column 6969 (100.0%), 554.45 column/sec. Elapsed time 12.57 sec
346.8s 66 EvaluatorHoldout: Ignoring 29 ( 0.1%) Users that have less than 1 test interactions
374.9s 67 EvaluatorHoldout: Processed 27066 (100.0%) in 28.27 sec. Users per second: 957
375.4s 68 Unable to load Cython Compute_Similarity, reverting to Python
387.5s 69 Similarity column 6969 (100.0%), 566.39 column/sec. Elapsed time 12.30 sec
387.7s 70 EvaluatorHoldout: Ignoring 42 ( 0.2%) Users that have less than 1 test interactions
416.2s 71 EvaluatorHoldout: Processed 27053 (100.0%) in 28.62 sec. Users per second: 945
416.7s 72 Unable to load Cython Compute_Similarity, reverting to Python
428.8s 73 Similarity column 6969 (100.0%), 567.17 column/sec. Elapsed time 12.29 sec
429.0s 74 EvaluatorHoldout: Ignoring 38 ( 0.1%) Users that have less than 1 test interactions
457.3s 75 EvaluatorHoldout: Processed 27057 (100.0%) in 28.37 sec. Users per second: 954
457.8s 76 Unable to load Cython Compute_Similarity, reverting to Python
470.0s 77 Similarity column 6969 (100.0%), 560.29 column/sec. Elapsed time 12.44 sec
470.2s 78 EvaluatorHoldout: Ignoring 32 ( 0.1%) Users that have less than 1 test interactions
498.5s 79 EvaluatorHoldout: Processed 27063 (100.0%) in 28.43 sec. Users per second: 952
498.5s 80 [I 2025-12-06 21:26:09,486] Trial 1 finished with value: 0.2138053435151353 and parameters: {'topK': 225, 'shrink': 687, 'feature_weighting': 'TF-IDF'}. Best is trial 1 with value: 0.2138053435151353.
498.5s 81 
498.5s 82 [I 2025-12-06 21:26:09,486] Trial 1 finished with value: 0.2138053435151353 and parameters: {'topK': 225, 'shrink': 687, 'feature_weighting': 'TF-IDF'}. Best is trial 1 with value: 0.2138053435151353.
498.7s 83 [0.21460474751112746, 0.21342974117159977, 0.21318894177529843, 0.21406924510513772, 0.2137340420125132]
499.1s 84 Unable to load Cython Compute_Similarity, reverting to Python
513.4s 85 Similarity column 6969 (100.0%), 481.35 column/sec. Elapsed time 14.48 sec
513.6s 86 EvaluatorHoldout: Ignoring 48 ( 0.2%) Users that have less than 1 test interactions
544.6s 87 EvaluatorHoldout: Processed 27047 (100.0%) in 31.10 sec. Users per second: 870
545.1s 88 Unable to load Cython Compute_Similarity, reverting to Python
559.1s 89 Similarity column 6969 (100.0%), 490.04 column/sec. Elapsed time 14.22 sec
559.3s 90 EvaluatorHoldout: Ignoring 29 ( 0.1%) Users that have less than 1 test interactions
590.2s 91 EvaluatorHoldout: Processed 27066 (100.0%) in 30.94 sec. Users per second: 875
590.7s 92 Unable to load Cython Compute_Similarity, reverting to Python
605.4s 93 Similarity column 6969 (100.0%), 470.28 column/sec. Elapsed time 14.82 sec
605.6s 94 EvaluatorHoldout: Ignoring 42 ( 0.2%) Users that have less than 1 test interactions
637.6s 95 EvaluatorHoldout: Processed 27053 (100.0%) in 32.07 sec. Users per second: 844
638.1s 96 Unable to load Cython Compute_Similarity, reverting to Python
653.7s 97 Similarity column 6969 (100.0%), 441.00 column/sec. Elapsed time 15.80 sec
653.9s 98 EvaluatorHoldout: Ignoring 38 ( 0.1%) Users that have less than 1 test interactions
686.7s 99 EvaluatorHoldout: Processed 27057 (100.0%) in 32.79 sec. Users per second: 825
687.2s 100 Unable to load Cython Compute_Similarity, reverting to Python
703.2s 101 Similarity column 6969 (100.0%), 431.27 column/sec. Elapsed time 16.16 sec
703.4s 102 EvaluatorHoldout: Ignoring 32 ( 0.1%) Users that have less than 1 test interactions
735.8s 103 EvaluatorHoldout: Processed 27063 (100.0%) in 32.46 sec. Users per second: 834
735.8s 104 [I 2025-12-06 21:30:06,719] Trial 2 finished with value: 0.21047071073481755 and parameters: {'topK': 471, 'shrink': 363, 'feature_weighting': 'BM25'}. Best is trial 1 with value: 0.2138053435151353.
735.8s 105 
735.8s 106 [I 2025-12-06 21:30:06,719] Trial 2 finished with value: 0.21047071073481755 and parameters: {'topK': 471, 'shrink': 363, 'feature_weighting': 'BM25'}. Best is trial 1 with value: 0.2138053435151353.
735.9s 107 [0.21117652010472124, 0.21117640769752083, 0.20998032269969227, 0.2099747066306608, 0.21004559654149266]
736.3s 108 Unable to load Cython Compute_Similarity, reverting to Python
749.4s 109 Similarity column 6969 (100.0%), 524.12 column/sec. Elapsed time 13.30 sec
749.6s 110 EvaluatorHoldout: Ignoring 48 ( 0.2%) Users that have less than 1 test interactions
780.0s 111 EvaluatorHoldout: Processed 27047 (100.0%) in 30.49 sec. Users per second: 887
780.6s 112 Unable to load Cython Compute_Similarity, reverting to Python
795.4s 113 Similarity column 6969 (100.0%), 462.35 column/sec. Elapsed time 15.07 sec
795.6s 114 EvaluatorHoldout: Ignoring 29 ( 0.1%) Users that have less than 1 test interactions
826.1s 115 EvaluatorHoldout: Processed 27066 (100.0%) in 30.58 sec. Users per second: 885
826.6s 116 Unable to load Cython Compute_Similarity, reverting to Python
840.4s 117 Similarity column 6969 (100.0%), 499.05 column/sec. Elapsed time 13.96 sec
840.6s 118 EvaluatorHoldout: Ignoring 42 ( 0.2%) Users that have less than 1 test interactions
870.5s 119 EvaluatorHoldout: Processed 27053 (100.0%) in 30.03 sec. Users per second: 901
871.0s 120 Unable to load Cython Compute_Similarity, reverting to Python
884.1s 121 Similarity column 6969 (100.0%), 525.97 column/sec. Elapsed time 13.25 sec
884.3s 122 EvaluatorHoldout: Ignoring 38 ( 0.1%) Users that have less than 1 test interactions
914.0s 123 EvaluatorHoldout: Processed 27057 (100.0%) in 29.88 sec. Users per second: 906
914.6s 124 Unable to load Cython Compute_Similarity, reverting to Python
927.4s 125 Similarity column 6969 (100.0%), 532.94 column/sec. Elapsed time 13.08 sec
927.6s 126 EvaluatorHoldout: Ignoring 32 ( 0.1%) Users that have less than 1 test interactions
957.0s 127 EvaluatorHoldout: Processed 27063 (100.0%) in 29.49 sec. Users per second: 918
957.0s 128 [I 2025-12-06 21:33:47,976] Trial 3 finished with value: 0.21324107252827504 and parameters: {'topK': 229, 'shrink': 989, 'feature_weighting': 'TF-IDF'}. Best is trial 1 with value: 0.2138053435151353.
957.0s 129 
957.0s 130 [I 2025-12-06 21:33:47,976] Trial 3 finished with value: 0.21324107252827504 and parameters: {'topK': 229, 'shrink': 989, 'feature_weighting': 'TF-IDF'}. Best is trial 1 with value: 0.2138053435151353.
957.2s 131 [0.21378739193890284, 0.2129197245547127, 0.21276771002010628, 0.21384207610530676, 0.21288846002234663]
957.5s 132 Unable to load Cython Compute_Similarity, reverting to Python
972.8s 133 Similarity column 6969 (100.0%), 450.42 column/sec. Elapsed time 15.47 sec
973.0s 134 EvaluatorHoldout: Ignoring 48 ( 0.2%) Users that have less than 1 test interactions
1009.0s 135 EvaluatorHoldout: Processed 27047 (100.0%) in 36.08 sec. Users per second: 750
1009.6s 136 Unable to load Cython Compute_Similarity, reverting to Python
1025.4s 137 Similarity column 6969 (100.0%), 434.00 column/sec. Elapsed time 16.06 sec
1025.6s 138 EvaluatorHoldout: Ignoring 29 ( 0.1%) Users that have less than 1 test interactions
1062.6s 139 EvaluatorHoldout: Processed 27066 (100.0%) in 37.00 sec. Users per second: 731
1063.1s 140 Unable to load Cython Compute_Similarity, reverting to Python
1079.0s 141 Similarity column 6969 (100.0%), 434.08 column/sec. Elapsed time 16.05 sec
1079.2s 142 EvaluatorHoldout: Ignoring 42 ( 0.2%) Users that have less than 1 test interactions
1116.1s 143 EvaluatorHoldout: Processed 27053 (100.0%) in 37.01 sec. Users per second: 731
1116.6s 144 Unable to load Cython Compute_Similarity, reverting to Python
1132.4s 145 Similarity column 6969 (100.0%), 437.68 column/sec. Elapsed time 15.92 sec
1132.6s 146 EvaluatorHoldout: Ignoring 38 ( 0.1%) Users that have less than 1 test interactions
1169.5s 147 EvaluatorHoldout: Processed 27057 (100.0%) in 36.97 sec. Users per second: 732
1170.0s 148 Unable to load Cython Compute_Similarity, reverting to Python
1185.6s 149 Similarity column 6969 (100.0%), 441.08 column/sec. Elapsed time 15.80 sec
1185.8s 150 EvaluatorHoldout: Ignoring 32 ( 0.1%) Users that have less than 1 test interactions
1222.8s 151 EvaluatorHoldout: Processed 27063 (100.0%) in 37.06 sec. Users per second: 730
1222.8s 152 [I 2025-12-06 21:38:13,756] Trial 4 finished with value: 0.20499615185759062 and parameters: {'topK': 564, 'shrink': 819, 'feature_weighting': 'TF-IDF'}. Best is trial 1 with value: 0.2138053435151353.
1222.8s 153 
1222.8s 154 [I 2025-12-06 21:38:13,756] Trial 4 finished with value: 0.20499615185759062 and parameters: {'topK': 564, 'shrink': 819, 'feature_weighting': 'TF-IDF'}. Best is trial 1 with value: 0.2138053435151353.
1223.0s 155 [0.20611921271532097, 0.20444257432112467, 0.2038912712353072, 0.20589910313346688, 0.2046285978827333]
1223.0s 156 Unable to load Cython Compute_Similarity, reverting to Python
1236.3s 157 Similarity column 6969 (100.0%), 520.39 column/sec. Elapsed time 13.39 sec
1236.5s 158 EvaluatorHoldout: Ignoring 48 ( 0.2%) Users that have less than 1 test interactions
1268.6s 159 EvaluatorHoldout: Processed 27047 (100.0%) in 32.22 sec. Users per second: 839
1268.8s 160 Unable to load Cython Compute_Similarity, reverting to Python
1282.3s 161 Similarity column 6969 (100.0%), 515.74 column/sec. Elapsed time 13.51 sec
1282.5s 162 EvaluatorHoldout: Ignoring 29 ( 0.1%) Users that have less than 1 test interactions
1314.6s 163 EvaluatorHoldout: Processed 27066 (100.0%) in 32.23 sec. Users per second: 840
1314.8s 164 Unable to load Cython Compute_Similarity, reverting to Python
1327.7s 165 Similarity column 6969 (100.0%), 538.87 column/sec. Elapsed time 12.93 sec
1327.9s 166 EvaluatorHoldout: Ignoring 42 ( 0.2%) Users that have less than 1 test interactions
1360.1s 167 EvaluatorHoldout: Processed 27053 (100.0%) in 32.28 sec. Users per second: 838
1360.3s 168 Unable to load Cython Compute_Similarity, reverting to Python
1373.7s 169 Similarity column 6969 (100.0%), 520.29 column/sec. Elapsed time 13.39 sec
1373.9s 170 EvaluatorHoldout: Ignoring 38 ( 0.1%) Users that have less than 1 test interactions
1405.7s 171 EvaluatorHoldout: Processed 27057 (100.0%) in 31.97 sec. Users per second: 846
1405.9s 172 Unable to load Cython Compute_Similarity, reverting to Python
1419.0s 173 Similarity column 6969 (100.0%), 530.08 column/sec. Elapsed time 13.15 sec
1419.2s 174 EvaluatorHoldout: Ignoring 32 ( 0.1%) Users that have less than 1 test interactions
1451.6s 175 EvaluatorHoldout: Processed 27063 (100.0%) in 32.53 sec. Users per second: 832
1451.6s 176 [I 2025-12-06 21:42:02,598] Trial 5 finished with value: 0.20393885017394903 and parameters: {'topK': 248, 'shrink': 265, 'feature_weighting': 'none'}. Best is trial 1 with value: 0.2138053435151353.
1451.6s 177 
1451.6s 178 [I 2025-12-06 21:42:02,598] Trial 5 finished with value: 0.20393885017394903 and parameters: {'topK': 248, 'shrink': 265, 'feature_weighting': 'none'}. Best is trial 1 with value: 0.2138053435151353.
1451.8s 179 [0.2052636557342801, 0.2031098991157391, 0.20259208781194293, 0.20456065183201227, 0.20416795637577073]
1452.2s 180 Unable to load Cython Compute_Similarity, reverting to Python
1465.8s 181 Similarity column 6969 (100.0%), 504.75 column/sec. Elapsed time 13.81 sec
1466.0s 182 EvaluatorHoldout: Ignoring 48 ( 0.2%) Users that have less than 1 test interactions
1494.1s 183 EvaluatorHoldout: Processed 27047 (100.0%) in 28.23 sec. Users per second: 958
1494.7s 184 Unable to load Cython Compute_Similarity, reverting to Python
1508.7s 185 Similarity column 6969 (100.0%), 490.62 column/sec. Elapsed time 14.20 sec
1508.9s 186 EvaluatorHoldout: Ignoring 29 ( 0.1%) Users that have less than 1 test interactions
1536.8s 187 EvaluatorHoldout: Processed 27066 (100.0%) in 27.98 sec. Users per second: 967
1537.3s 188 Unable to load Cython Compute_Similarity, reverting to Python
1550.9s 189 Similarity column 6969 (100.0%), 504.35 column/sec. Elapsed time 13.82 sec
1551.1s 190 EvaluatorHoldout: Ignoring 42 ( 0.2%) Users that have less than 1 test interactions
1579.5s 191 EvaluatorHoldout: Processed 27053 (100.0%) in 28.43 sec. Users per second: 952
1580.0s 192 Unable to load Cython Compute_Similarity, reverting to Python
1593.4s 193 Similarity column 6969 (100.0%), 510.57 column/sec. Elapsed time 13.65 sec
1593.6s 194 EvaluatorHoldout: Ignoring 38 ( 0.1%) Users that have less than 1 test interactions
1622.3s 195 EvaluatorHoldout: Processed 27057 (100.0%) in 28.72 sec. Users per second: 942
1622.8s 196 Unable to load Cython Compute_Similarity, reverting to Python
1636.8s 197 Similarity column 6969 (100.0%), 490.61 column/sec. Elapsed time 14.20 sec
1637.0s 198 EvaluatorHoldout: Ignoring 32 ( 0.1%) Users that have less than 1 test interactions
1665.4s 199 EvaluatorHoldout: Processed 27063 (100.0%) in 28.45 sec. Users per second: 951
1665.4s 200 [I 2025-12-06 21:45:36,325] Trial 6 finished with value: 0.20744663950856768 and parameters: {'topK': 309, 'shrink': 353, 'feature_weighting': 'BM25'}. Best is trial 1 with value: 0.2138053435151353.
1665.4s 201 
1665.4s 202 [I 2025-12-06 21:45:36,325] Trial 6 finished with value: 0.20744663950856768 and parameters: {'topK': 309, 'shrink': 353, 'feature_weighting': 'BM25'}. Best is trial 1 with value: 0.2138053435151353.
1665.6s 203 [0.20777366587269824, 0.20757953594822495, 0.20671063417981683, 0.20786429840003523, 0.20730506314206323]
1665.6s 204 Unable to load Cython Compute_Similarity, reverting to Python
1678.9s 205 Similarity column 6969 (100.0%), 519.05 column/sec. Elapsed time 13.43 sec
1679.1s 206 EvaluatorHoldout: Ignoring 48 ( 0.2%) Users that have less than 1 test interactions
1712.5s 207 EvaluatorHoldout: Processed 27047 (100.0%) in 33.51 sec. Users per second: 807
1712.7s 208 Unable to load Cython Compute_Similarity, reverting to Python
1726.5s 209 Similarity column 6969 (100.0%), 503.27 column/sec. Elapsed time 13.85 sec
1726.7s 210 EvaluatorHoldout: Ignoring 29 ( 0.1%) Users that have less than 1 test interactions
1759.8s 211 EvaluatorHoldout: Processed 27066 (100.0%) in 33.18 sec. Users per second: 816
1760.0s 212 Unable to load Cython Compute_Similarity, reverting to Python
1772.8s 213 Similarity column 6969 (100.0%), 543.56 column/sec. Elapsed time 12.82 sec
1773.0s 214 EvaluatorHoldout: Ignoring 42 ( 0.2%) Users that have less than 1 test interactions
1805.7s 215 EvaluatorHoldout: Processed 27053 (100.0%) in 32.86 sec. Users per second: 823
1805.9s 216 Unable to load Cython Compute_Similarity, reverting to Python
1818.2s 217 Similarity column 6969 (100.0%), 565.34 column/sec. Elapsed time 12.33 sec
1818.4s 218 EvaluatorHoldout: Ignoring 38 ( 0.1%) Users that have less than 1 test interactions
1851.0s 219 EvaluatorHoldout: Processed 27057 (100.0%) in 32.68 sec. Users per second: 828
1851.1s 220 Unable to load Cython Compute_Similarity, reverting to Python
1863.9s 221 Similarity column 6969 (100.0%), 542.79 column/sec. Elapsed time 12.84 sec
1864.1s 222 EvaluatorHoldout: Ignoring 32 ( 0.1%) Users that have less than 1 test interactions
1898.0s 223 EvaluatorHoldout: Processed 27063 (100.0%) in 33.96 sec. Users per second: 797
1898.0s 224 [I 2025-12-06 21:49:28,947] Trial 7 finished with value: 0.19384995955266957 and parameters: {'topK': 211, 'shrink': 998, 'feature_weighting': 'none'}. Best is trial 1 with value: 0.2138053435151353.
1898.0s 225 
1898.0s 226 [I 2025-12-06 21:49:28,947] Trial 7 finished with value: 0.19384995955266957 and parameters: {'topK': 211, 'shrink': 998, 'feature_weighting': 'none'}. Best is trial 1 with value: 0.2138053435151353.
1898.2s 227 [0.194511192589517, 0.19331745625938, 0.1929623026745486, 0.19468963465192118, 0.19376921158798105]
1898.2s 228 Unable to load Cython Compute_Similarity, reverting to Python
1911.5s 229 Similarity column 6969 (100.0%), 521.56 column/sec. Elapsed time 13.36 sec
1911.7s 230 EvaluatorHoldout: Ignoring 48 ( 0.2%) Users that have less than 1 test interactions
1945.4s 231 EvaluatorHoldout: Processed 27047 (100.0%) in 33.83 sec. Users per second: 799
1945.6s 232 Unable to load Cython Compute_Similarity, reverting to Python
1958.9s 233 Similarity column 6969 (100.0%), 523.55 column/sec. Elapsed time 13.31 sec
1959.1s 234 EvaluatorHoldout: Ignoring 29 ( 0.1%) Users that have less than 1 test interactions
1992.7s 235 EvaluatorHoldout: Processed 27066 (100.0%) in 33.70 sec. Users per second: 803
1992.9s 236 Unable to load Cython Compute_Similarity, reverting to Python
2006.5s 237 Similarity column 6969 (100.0%), 510.89 column/sec. Elapsed time 13.64 sec
2006.7s 238 EvaluatorHoldout: Ignoring 42 ( 0.2%) Users that have less than 1 test interactions
2039.4s 239 EvaluatorHoldout: Processed 27053 (100.0%) in 32.85 sec. Users per second: 824
2039.6s 240 Unable to load Cython Compute_Similarity, reverting to Python
2052.4s 241 Similarity column 6969 (100.0%), 543.62 column/sec. Elapsed time 12.82 sec
2052.6s 242 EvaluatorHoldout: Ignoring 38 ( 0.1%) Users that have less than 1 test interactions
2085.7s 243 EvaluatorHoldout: Processed 27057 (100.0%) in 33.20 sec. Users per second: 815
2085.9s 244 Unable to load Cython Compute_Similarity, reverting to Python
2098.7s 245 Similarity column 6969 (100.0%), 542.81 column/sec. Elapsed time 12.84 sec
2098.9s 246 EvaluatorHoldout: Ignoring 32 ( 0.1%) Users that have less than 1 test interactions
2131.8s 247 EvaluatorHoldout: Processed 27063 (100.0%) in 33.02 sec. Users per second: 819
2131.8s 248 [I 2025-12-06 21:53:22,732] Trial 8 finished with value: 0.1992650881311508 and parameters: {'topK': 267, 'shrink': 475, 'feature_weighting': 'none'}. Best is trial 1 with value: 0.2138053435151353.
2131.8s 249 
2131.8s 250 [I 2025-12-06 21:53:22,732] Trial 8 finished with value: 0.1992650881311508 and parameters: {'topK': 267, 'shrink': 475, 'feature_weighting': 'none'}. Best is trial 1 with value: 0.2138053435151353.
2132.0s 251 [0.2002632717266825, 0.19834764957931314, 0.19781444525864328, 0.20026114010540813, 0.19963893398570692]
2132.3s 252 Unable to load Cython Compute_Similarity, reverting to Python
2145.6s 253 Similarity column 6969 (100.0%), 518.58 column/sec. Elapsed time 13.44 sec
2145.8s 254 EvaluatorHoldout: Ignoring 48 ( 0.2%) Users that have less than 1 test interactions
2174.2s 255 EvaluatorHoldout: Processed 27047 (100.0%) in 28.53 sec. Users per second: 948
2174.7s 256 Unable to load Cython Compute_Similarity, reverting to Python
2188.2s 257 Similarity column 6969 (100.0%), 507.76 column/sec. Elapsed time 13.72 sec
2188.4s 258 EvaluatorHoldout: Ignoring 29 ( 0.1%) Users that have less than 1 test interactions
2217.4s 259 EvaluatorHoldout: Processed 27066 (100.0%) in 29.10 sec. Users per second: 930
2218.0s 260 Unable to load Cython Compute_Similarity, reverting to Python
2232.0s 261 Similarity column 6969 (100.0%), 491.78 column/sec. Elapsed time 14.17 sec
2232.2s 262 EvaluatorHoldout: Ignoring 42 ( 0.2%) Users that have less than 1 test interactions
2261.5s 263 EvaluatorHoldout: Processed 27053 (100.0%) in 29.43 sec. Users per second: 919
2262.0s 264 Unable to load Cython Compute_Similarity, reverting to Python
2276.1s 265 Similarity column 6969 (100.0%), 489.17 column/sec. Elapsed time 14.25 sec
2276.3s 266 EvaluatorHoldout: Ignoring 38 ( 0.1%) Users that have less than 1 test interactions
2305.5s 267 EvaluatorHoldout: Processed 27057 (100.0%) in 29.33 sec. Users per second: 923
2306.1s 268 Unable to load Cython Compute_Similarity, reverting to Python
2319.8s 269 Similarity column 6969 (100.0%), 499.50 column/sec. Elapsed time 13.95 sec
2320.0s 270 EvaluatorHoldout: Ignoring 32 ( 0.1%) Users that have less than 1 test interactions
2349.2s 271 EvaluatorHoldout: Processed 27063 (100.0%) in 29.24 sec. Users per second: 926
2349.2s 272 [I 2025-12-06 21:57:00,119] Trial 9 finished with value: 0.20327974087530404 and parameters: {'topK': 339, 'shrink': 925, 'feature_weighting': 'BM25'}. Best is trial 1 with value: 0.2138053435151353.
2349.2s 273 
