17948.5s 2986 [I 2025-12-07 13:53:04,021] Trial 122 finished with value: 0.23047953756571182 and parameters: {'similarity': 'tversky', 'topK': 42, 'shrink': 217, 'tversky_alpha': 0.20660763960774436, 'tversky_beta': 1.8005843907108583}. Best is trial 91 with value: 0.24993110179607925.
17948.7s 2987 [0.22972846901607702, 0.23096769370257206, 0.23156317142106234, 0.2289439181460175, 0.23119443554283015]
17949.0s 2988 Unable to load Cython Compute_Similarity, reverting to Python
17957.9s 2989 Similarity column 6969 (100.0%), 770.01 column/sec. Elapsed time 9.05 sec
17958.1s 2990 EvaluatorHoldout: Ignoring 33 ( 0.1%) Users that have less than 1 test interactions
17972.1s 2991 EvaluatorHoldout: Processed 27062 (100.0%) in 14.05 sec. Users per second: 1927
17972.4s 2992 Unable to load Cython Compute_Similarity, reverting to Python
17981.2s 2993 Similarity column 6969 (100.0%), 779.16 column/sec. Elapsed time 8.94 sec
17981.4s 2994 EvaluatorHoldout: Ignoring 28 ( 0.1%) Users that have less than 1 test interactions
17995.5s 2995 EvaluatorHoldout: Processed 27067 (100.0%) in 14.26 sec. Users per second: 1898
17995.9s 2996 Unable to load Cython Compute_Similarity, reverting to Python
18005.2s 2997 Similarity column 6969 (100.0%), 749.94 column/sec. Elapsed time 9.29 sec
18005.2s 2998 EvaluatorHoldout: Ignoring 40 ( 0.1%) Users that have less than 1 test interactions
18019.2s 2999 EvaluatorHoldout: Processed 27055 (100.0%) in 14.17 sec. Users per second: 1909
18019.7s 3000 Unable to load Cython Compute_Similarity, reverting to Python
18028.7s 3001 Similarity column 6969 (100.0%), 761.02 column/sec. Elapsed time 9.16 sec
18028.9s 3002 EvaluatorHoldout: Ignoring 21 ( 0.1%) Users that have less than 1 test interactions
18043.0s 3003 EvaluatorHoldout: Processed 27074 (100.0%) in 14.12 sec. Users per second: 1918
18043.3s 3004 Unable to load Cython Compute_Similarity, reverting to Python
18052.0s 3005 Similarity column 6969 (100.0%), 783.52 column/sec. Elapsed time 8.89 sec
18052.2s 3006 EvaluatorHoldout: Ignoring 29 ( 0.1%) Users that have less than 1 test interactions
18066.2s 3007 EvaluatorHoldout: Processed 27066 (100.0%) in 14.11 sec. Users per second: 1918
18066.2s 3008 [I 2025-12-07 13:55:01,679] Trial 123 finished with value: 0.2445180261140088 and parameters: {'similarity': 'tversky', 'topK': 23, 'shrink': 264, 'tversky_alpha': 0.07773410570920936, 'tversky_beta': 1.936180852986773}. Best is trial 91 with value: 0.24993110179607925.
18066.2s 3009 
18066.2s 3010 [I 2025-12-07 13:55:01,679] Trial 123 finished with value: 0.2445180261140088 and parameters: {'similarity': 'tversky', 'topK': 23, 'shrink': 264, 'tversky_alpha': 0.07773410570920936, 'tversky_beta': 1.936180852986773}. Best is trial 91 with value: 0.24993110179607925.
18066.4s 3011 [0.24411231047443419, 0.24421320357069784, 0.24553776851379921, 0.2435599449663628, 0.2451669030447499]
18066.7s 3012 Unable to load Cython Compute_Similarity, reverting to Python
18075.6s 3013 Similarity column 6969 (100.0%), 770.05 column/sec. Elapsed time 9.05 sec
18075.7s 3014 EvaluatorHoldout: Ignoring 33 ( 0.1%) Users that have less than 1 test interactions
18089.5s 3015 EvaluatorHoldout: Processed 27062 (100.0%) in 14.00 sec. Users per second: 1933
18090.0s 3016 Unable to load Cython Compute_Similarity, reverting to Python
18098.9s 3017 Similarity column 6969 (100.0%), 768.03 column/sec. Elapsed time 9.07 sec
18099.1s 3018 EvaluatorHoldout: Ignoring 28 ( 0.1%) Users that have less than 1 test interactions
18113.3s 3019 EvaluatorHoldout: Processed 27067 (100.0%) in 14.22 sec. Users per second: 1904
18113.6s 3020 Unable to load Cython Compute_Similarity, reverting to Python
18122.8s 3021 Similarity column 6969 (100.0%), 741.43 column/sec. Elapsed time 9.40 sec
18123.0s 3022 EvaluatorHoldout: Ignoring 40 ( 0.1%) Users that have less than 1 test interactions
18136.9s 3023 EvaluatorHoldout: Processed 27055 (100.0%) in 14.03 sec. Users per second: 1929
18137.4s 3024 Unable to load Cython Compute_Similarity, reverting to Python
18146.6s 3025 Similarity column 6969 (100.0%), 747.09 column/sec. Elapsed time 9.33 sec
18146.7s 3026 EvaluatorHoldout: Ignoring 21 ( 0.1%) Users that have less than 1 test interactions
18160.6s 3027 EvaluatorHoldout: Processed 27074 (100.0%) in 14.09 sec. Users per second: 1922
18161.1s 3028 Unable to load Cython Compute_Similarity, reverting to Python
18169.9s 3029 Similarity column 6969 (100.0%), 773.38 column/sec. Elapsed time 9.01 sec
18170.1s 3030 EvaluatorHoldout: Ignoring 29 ( 0.1%) Users that have less than 1 test interactions
18184.2s 3031 EvaluatorHoldout: Processed 27066 (100.0%) in 14.09 sec. Users per second: 1921
18184.2s 3032 [I 2025-12-07 13:56:59,575] Trial 124 finished with value: 0.24518187763657537 and parameters: {'similarity': 'tversky', 'topK': 24, 'shrink': 190, 'tversky_alpha': 0.06740975546186578, 'tversky_beta': 1.9022062254308671}. Best is trial 91 with value: 0.24993110179607925.
18184.2s 3033 
18184.2s 3034 [I 2025-12-07 13:56:59,575] Trial 124 finished with value: 0.24518187763657537 and parameters: {'similarity': 'tversky', 'topK': 24, 'shrink': 190, 'tversky_alpha': 0.06740975546186578, 'tversky_beta': 1.9022062254308671}. Best is trial 91 with value: 0.24993110179607925.
18184.3s 3035 [0.24533240180192423, 0.2451186188201989, 0.24621497644237372, 0.24373295660227431, 0.24551043451610569]
18184.6s 3036 Unable to load Cython Compute_Similarity, reverting to Python
18193.6s 3037 Similarity column 6969 (100.0%), 755.75 column/sec. Elapsed time 9.22 sec
18193.8s 3038 EvaluatorHoldout: Ignoring 33 ( 0.1%) Users that have less than 1 test interactions
18208.3s 3039 EvaluatorHoldout: Processed 27062 (100.0%) in 14.71 sec. Users per second: 1840
18208.8s 3040 Unable to load Cython Compute_Similarity, reverting to Python
18218.1s 3041 Similarity column 6969 (100.0%), 745.66 column/sec. Elapsed time 9.35 sec
18218.2s 3042 EvaluatorHoldout: Ignoring 28 ( 0.1%) Users that have less than 1 test interactions
18232.8s 3043 EvaluatorHoldout: Processed 27067 (100.0%) in 14.79 sec. Users per second: 1831
18233.3s 3044 Unable to load Cython Compute_Similarity, reverting to Python
18242.3s 3045 Similarity column 6969 (100.0%), 754.38 column/sec. Elapsed time 9.24 sec
18242.5s 3046 EvaluatorHoldout: Ignoring 40 ( 0.1%) Users that have less than 1 test interactions
18257.2s 3047 EvaluatorHoldout: Processed 27055 (100.0%) in 14.69 sec. Users per second: 1842
18257.5s 3048 Unable to load Cython Compute_Similarity, reverting to Python
18267.0s 3049 Similarity column 6969 (100.0%), 721.41 column/sec. Elapsed time 9.66 sec
18267.2s 3050 EvaluatorHoldout: Ignoring 21 ( 0.1%) Users that have less than 1 test interactions
18282.2s 3051 EvaluatorHoldout: Processed 27074 (100.0%) in 15.16 sec. Users per second: 1785
18282.7s 3052 Unable to load Cython Compute_Similarity, reverting to Python
18292.2s 3053 Similarity column 6969 (100.0%), 728.28 column/sec. Elapsed time 9.57 sec
18292.2s 3054 EvaluatorHoldout: Ignoring 29 ( 0.1%) Users that have less than 1 test interactions
18306.8s 3055 EvaluatorHoldout: Processed 27066 (100.0%) in 14.75 sec. Users per second: 1835
18306.8s 3056 [I 2025-12-07 13:59:02,341] Trial 125 finished with value: 0.23403074343222446 and parameters: {'similarity': 'tversky', 'topK': 64, 'shrink': 128, 'tversky_alpha': 0.0743911873137453, 'tversky_beta': 1.8870912091843517}. Best is trial 91 with value: 0.24993110179607925.
18306.8s 3057 
18306.8s 3058 [I 2025-12-07 13:59:02,341] Trial 125 finished with value: 0.23403074343222446 and parameters: {'similarity': 'tversky', 'topK': 64, 'shrink': 128, 'tversky_alpha': 0.0743911873137453, 'tversky_beta': 1.8870912091843517}. Best is trial 91 with value: 0.24993110179607925.
18307.0s 3059 [0.23377646721433792, 0.23403201225374257, 0.23492518212901797, 0.23276485607279696, 0.23465519949122676]
18307.3s 3060 Unable to load Cython Compute_Similarity, reverting to Python
18316.2s 3061 Similarity column 6969 (100.0%), 771.43 column/sec. Elapsed time 9.03 sec
18316.4s 3062 EvaluatorHoldout: Ignoring 33 ( 0.1%) Users that have less than 1 test interactions
18330.5s 3063 EvaluatorHoldout: Processed 27062 (100.0%) in 14.01 sec. Users per second: 1932
18330.7s 3064 Unable to load Cython Compute_Similarity, reverting to Python
18339.4s 3065 Similarity column 6969 (100.0%), 779.59 column/sec. Elapsed time 8.94 sec
18339.6s 3066 EvaluatorHoldout: Ignoring 28 ( 0.1%) Users that have less than 1 test interactions
18353.7s 3067 EvaluatorHoldout: Processed 27067 (100.0%) in 14.26 sec. Users per second: 1898
18354.2s 3068 Unable to load Cython Compute_Similarity, reverting to Python
18363.3s 3069 Similarity column 6969 (100.0%), 760.71 column/sec. Elapsed time 9.16 sec
18363.4s 3070 EvaluatorHoldout: Ignoring 40 ( 0.1%) Users that have less than 1 test interactions
18377.3s 3071 EvaluatorHoldout: Processed 27055 (100.0%) in 14.13 sec. Users per second: 1914
18377.8s 3072 Unable to load Cython Compute_Similarity, reverting to Python
18387.0s 3073 Similarity column 6969 (100.0%), 741.22 column/sec. Elapsed time 9.40 sec
18387.2s 3074 EvaluatorHoldout: Ignoring 21 ( 0.1%) Users that have less than 1 test interactions
18401.4s 3075 EvaluatorHoldout: Processed 27074 (100.0%) in 14.24 sec. Users per second: 1902
18401.8s 3076 Unable to load Cython Compute_Similarity, reverting to Python
18410.6s 3077 Similarity column 6969 (100.0%), 774.07 column/sec. Elapsed time 9.00 sec
18410.8s 3078 EvaluatorHoldout: Ignoring 29 ( 0.1%) Users that have less than 1 test interactions
18424.8s 3079 EvaluatorHoldout: Processed 27066 (100.0%) in 14.18 sec. Users per second: 1908
18424.8s 3080 [I 2025-12-07 14:01:00,329] Trial 126 finished with value: 0.24375957447359348 and parameters: {'similarity': 'tversky', 'topK': 28, 'shrink': 183, 'tversky_alpha': 0.06270142142662287, 'tversky_beta': 1.9178526385239771}. Best is trial 91 with value: 0.24993110179607925.
18424.8s 3081 
18424.8s 3082 [I 2025-12-07 14:01:00,329] Trial 126 finished with value: 0.24375957447359348 and parameters: {'similarity': 'tversky', 'topK': 28, 'shrink': 183, 'tversky_alpha': 0.06270142142662287, 'tversky_beta': 1.9178526385239771}. Best is trial 91 with value: 0.24993110179607925.
18425.0s 3083 [0.2438794530783535, 0.24402387795489197, 0.2446154894466242, 0.24254959167492002, 0.2437294602131777]
18425.3s 3084 Unable to load Cython Compute_Similarity, reverting to Python
18434.8s 3085 Similarity column 6969 (100.0%), 729.94 column/sec. Elapsed time 9.55 sec
18434.9s 3086 EvaluatorHoldout: Ignoring 33 ( 0.1%) Users that have less than 1 test interactions
18451.2s 3087 EvaluatorHoldout: Processed 27062 (100.0%) in 16.52 sec. Users per second: 1638
18451.7s 3088 Unable to load Cython Compute_Similarity, reverting to Python
18461.1s 3089 Similarity column 6969 (100.0%), 729.73 column/sec. Elapsed time 9.55 sec
18461.3s 3090 EvaluatorHoldout: Ignoring 28 ( 0.1%) Users that have less than 1 test interactions
18477.9s 3091 EvaluatorHoldout: Processed 27067 (100.0%) in 16.69 sec. Users per second: 1622
18478.3s 3092 Unable to load Cython Compute_Similarity, reverting to Python
18488.3s 3093 Similarity column 6969 (100.0%), 682.47 column/sec. Elapsed time 10.21 sec
18488.5s 3094 EvaluatorHoldout: Ignoring 40 ( 0.1%) Users that have less than 1 test interactions
18504.9s 3095 EvaluatorHoldout: Processed 27055 (100.0%) in 16.53 sec. Users per second: 1637
18505.4s 3096 Unable to load Cython Compute_Similarity, reverting to Python
18515.1s 3097 Similarity column 6969 (100.0%), 707.33 column/sec. Elapsed time 9.85 sec
18515.2s 3098 EvaluatorHoldout: Ignoring 21 ( 0.1%) Users that have less than 1 test interactions
18531.4s 3099 EvaluatorHoldout: Processed 27074 (100.0%) in 16.37 sec. Users per second: 1653
18531.9s 3100 Unable to load Cython Compute_Similarity, reverting to Python
18541.2s 3101 Similarity column 6969 (100.0%), 732.83 column/sec. Elapsed time 9.51 sec
18541.4s 3102 EvaluatorHoldout: Ignoring 29 ( 0.1%) Users that have less than 1 test interactions
18558.1s 3103 EvaluatorHoldout: Processed 27066 (100.0%) in 16.69 sec. Users per second: 1622
18558.1s 3104 [I 2025-12-07 14:03:13,489] Trial 127 finished with value: 0.20605259762778774 and parameters: {'similarity': 'tversky', 'topK': 96, 'shrink': 161, 'tversky_alpha': 1.7497699171706664, 'tversky_beta': 1.9732970910173337}. Best is trial 91 with value: 0.24993110179607925.
18558.1s 3105 
18558.1s 3106 [I 2025-12-07 14:03:13,489] Trial 127 finished with value: 0.20605259762778774 and parameters: {'similarity': 'tversky', 'topK': 96, 'shrink': 161, 'tversky_alpha': 1.7497699171706664, 'tversky_beta': 1.9732970910173337}. Best is trial 91 with value: 0.24993110179607925.
18558.2s 3107 [0.2049530957579471, 0.20613922133827098, 0.20673789161175116, 0.20559330654880342, 0.2068394728821662]
18558.5s 3108 Unable to load Cython Compute_Similarity, reverting to Python
18568.2s 3109 Similarity column 6969 (100.0%), 699.47 column/sec. Elapsed time 9.96 sec
18568.4s 3110 EvaluatorHoldout: Ignoring 33 ( 0.1%) Users that have less than 1 test interactions
18584.8s 3111 EvaluatorHoldout: Processed 27062 (100.0%) in 16.54 sec. Users per second: 1636
18585.3s 3112 Unable to load Cython Compute_Similarity, reverting to Python
18595.4s 3113 Similarity column 6969 (100.0%), 690.15 column/sec. Elapsed time 10.10 sec
18595.4s 3114 EvaluatorHoldout: Ignoring 28 ( 0.1%) Users that have less than 1 test interactions
18611.9s 3115 EvaluatorHoldout: Processed 27067 (100.0%) in 16.61 sec. Users per second: 1630
18612.4s 3116 Unable to load Cython Compute_Similarity, reverting to Python
18623.0s 3117 Similarity column 6969 (100.0%), 645.16 column/sec. Elapsed time 10.80 sec
18623.2s 3118 EvaluatorHoldout: Ignoring 40 ( 0.1%) Users that have less than 1 test interactions
18639.8s 3119 EvaluatorHoldout: Processed 27055 (100.0%) in 16.62 sec. Users per second: 1627
18640.1s 3120 Unable to load Cython Compute_Similarity, reverting to Python
18651.1s 3121 Similarity column 6969 (100.0%), 627.44 column/sec. Elapsed time 11.11 sec
18651.3s 3122 EvaluatorHoldout: Ignoring 21 ( 0.1%) Users that have less than 1 test interactions
18667.7s 3123 EvaluatorHoldout: Processed 27074 (100.0%) in 16.63 sec. Users per second: 1628
18668.2s 3124 Unable to load Cython Compute_Similarity, reverting to Python
18678.4s 3125 Similarity column 6969 (100.0%), 684.10 column/sec. Elapsed time 10.19 sec
18678.4s 3126 EvaluatorHoldout: Ignoring 29 ( 0.1%) Users that have less than 1 test interactions
18694.9s 3127 EvaluatorHoldout: Processed 27066 (100.0%) in 16.59 sec. Users per second: 1632
18694.9s 3128 [I 2025-12-07 14:05:30,379] Trial 128 finished with value: 0.20862685863065916 and parameters: {'similarity': 'tversky', 'topK': 132, 'shrink': 244, 'tversky_alpha': 0.14916658374360503, 'tversky_beta': 1.7445990229232065}. Best is trial 91 with value: 0.24993110179607925.
18694.9s 3129 
18694.9s 3130 [I 2025-12-07 14:05:30,379] Trial 128 finished with value: 0.20862685863065916 and parameters: {'similarity': 'tversky', 'topK': 132, 'shrink': 244, 'tversky_alpha': 0.14916658374360503, 'tversky_beta': 1.7445990229232065}. Best is trial 91 with value: 0.24993110179607925.
18695.1s 3131 [0.2082923047317387, 0.20873001285997683, 0.20874654868162026, 0.20826139734843852, 0.20910402953152146]
18695.4s 3132 Unable to load Cython Compute_Similarity, reverting to Python
18704.8s 3133 Similarity column 6969 (100.0%), 721.51 column/sec. Elapsed time 9.66 sec
18705.0s 3134 EvaluatorHoldout: Ignoring 33 ( 0.1%) Users that have less than 1 test interactions
18719.3s 3135 EvaluatorHoldout: Processed 27062 (100.0%) in 14.32 sec. Users per second: 1890
18719.7s 3136 Unable to load Cython Compute_Similarity, reverting to Python
18729.2s 3137 Similarity column 6969 (100.0%), 717.22 column/sec. Elapsed time 9.72 sec
18729.4s 3138 EvaluatorHoldout: Ignoring 28 ( 0.1%) Users that have less than 1 test interactions
18743.7s 3139 EvaluatorHoldout: Processed 27067 (100.0%) in 14.41 sec. Users per second: 1879
18744.1s 3140 Unable to load Cython Compute_Similarity, reverting to Python
18753.6s 3141 Similarity column 6969 (100.0%), 730.23 column/sec. Elapsed time 9.54 sec
18753.7s 3142 EvaluatorHoldout: Ignoring 40 ( 0.1%) Users that have less than 1 test interactions
18767.8s 3143 EvaluatorHoldout: Processed 27055 (100.0%) in 14.27 sec. Users per second: 1896
18768.3s 3144 Unable to load Cython Compute_Similarity, reverting to Python
18777.6s 3145 Similarity column 6969 (100.0%), 732.06 column/sec. Elapsed time 9.52 sec
18777.8s 3146 EvaluatorHoldout: Ignoring 21 ( 0.1%) Users that have less than 1 test interactions
18792.1s 3147 EvaluatorHoldout: Processed 27074 (100.0%) in 14.33 sec. Users per second: 1889
18792.5s 3148 Unable to load Cython Compute_Similarity, reverting to Python
18801.9s 3149 Similarity column 6969 (100.0%), 724.33 column/sec. Elapsed time 9.62 sec
18802.1s 3150 EvaluatorHoldout: Ignoring 29 ( 0.1%) Users that have less than 1 test interactions
18816.3s 3151 EvaluatorHoldout: Processed 27066 (100.0%) in 14.36 sec. Users per second: 1885
18816.3s 3152 [I 2025-12-07 14:07:31,811] Trial 129 finished with value: 0.23502770466190728 and parameters: {'similarity': 'tversky', 'topK': 44, 'shrink': 83, 'tversky_alpha': 0.001869286526428121, 'tversky_beta': 1.8463639468664224}. Best is trial 91 with value: 0.24993110179607925.
18816.3s 3153 
18816.3s 3154 [I 2025-12-07 14:07:31,811] Trial 129 finished with value: 0.23502770466190728 and parameters: {'similarity': 'tversky', 'topK': 44, 'shrink': 83, 'tversky_alpha': 0.001869286526428121, 'tversky_beta': 1.8463639468664224}. Best is trial 91 with value: 0.24993110179607925.
18816.5s 3155 [0.2348810085373874, 0.2343380853070418, 0.236167962479757, 0.2349730054968486, 0.23477846148850148]
18816.8s 3156 Unable to load Cython Compute_Similarity, reverting to Python
18826.6s 3157 Similarity column 6969 (100.0%), 708.50 column/sec. Elapsed time 9.84 sec
18826.6s 3158 EvaluatorHoldout: Ignoring 33 ( 0.1%) Users that have less than 1 test interactions
18842.0s 3159 EvaluatorHoldout: Processed 27062 (100.0%) in 15.48 sec. Users per second: 1748
18842.5s 3160 Unable to load Cython Compute_Similarity, reverting to Python
18852.0s 3161 Similarity column 6969 (100.0%), 716.01 column/sec. Elapsed time 9.73 sec
18852.2s 3162 EvaluatorHoldout: Ignoring 28 ( 0.1%) Users that have less than 1 test interactions
18867.6s 3163 EvaluatorHoldout: Processed 27067 (100.0%) in 15.47 sec. Users per second: 1749
18868.0s 3164 Unable to load Cython Compute_Similarity, reverting to Python
18877.6s 3165 Similarity column 6969 (100.0%), 714.47 column/sec. Elapsed time 9.75 sec
18877.8s 3166 EvaluatorHoldout: Ignoring 40 ( 0.1%) Users that have less than 1 test interactions
18893.1s 3167 EvaluatorHoldout: Processed 27055 (100.0%) in 15.53 sec. Users per second: 1742
18893.6s 3168 Unable to load Cython Compute_Similarity, reverting to Python
18903.4s 3169 Similarity column 6969 (100.0%), 707.21 column/sec. Elapsed time 9.85 sec
18903.5s 3170 EvaluatorHoldout: Ignoring 21 ( 0.1%) Users that have less than 1 test interactions
18918.8s 3171 EvaluatorHoldout: Processed 27074 (100.0%) in 15.46 sec. Users per second: 1752
18919.2s 3172 Unable to load Cython Compute_Similarity, reverting to Python
18928.6s 3173 Similarity column 6969 (100.0%), 730.34 column/sec. Elapsed time 9.54 sec
18928.8s 3174 EvaluatorHoldout: Ignoring 29 ( 0.1%) Users that have less than 1 test interactions
18944.2s 3175 EvaluatorHoldout: Processed 27066 (100.0%) in 15.41 sec. Users per second: 1757
18944.2s 3176 [I 2025-12-07 14:09:39,564] Trial 130 finished with value: 0.22387282270794814 and parameters: {'similarity': 'tversky', 'topK': 74, 'shrink': 198, 'tversky_alpha': 0.17192178221979437, 'tversky_beta': 1.9935743509527508}. Best is trial 91 with value: 0.24993110179607925.
18944.2s 3177 
