20109.3s 3392 [I 2025-12-07 14:29:04,776] Trial 139 finished with value: 0.24832563575077038 and parameters: {'similarity': 'tversky', 'topK': 5, 'shrink': 267, 'tversky_alpha': 0.25233715597748396, 'tversky_beta': 1.549460568101977}. Best is trial 91 with value: 0.24993110179607925.
20109.3s 3393 
20109.3s 3394 [I 2025-12-07 14:29:04,776] Trial 139 finished with value: 0.24832563575077038 and parameters: {'similarity': 'tversky', 'topK': 5, 'shrink': 267, 'tversky_alpha': 0.25233715597748396, 'tversky_beta': 1.549460568101977}. Best is trial 91 with value: 0.24993110179607925.
20109.5s 3395 [0.2473489400913049, 0.2487705667051702, 0.2493591319893294, 0.2482560812059521, 0.24789345876209531]
20109.8s 3396 Unable to load Cython Compute_Similarity, reverting to Python
20118.9s 3397 Similarity column 6969 (100.0%), 744.89 column/sec. Elapsed time 9.36 sec
20119.1s 3398 EvaluatorHoldout: Ignoring 33 ( 0.1%) Users that have less than 1 test interactions
20134.3s 3399 EvaluatorHoldout: Processed 27062 (100.0%) in 15.18 sec. Users per second: 1782
20134.6s 3400 Unable to load Cython Compute_Similarity, reverting to Python
20143.7s 3401 Similarity column 6969 (100.0%), 754.28 column/sec. Elapsed time 9.24 sec
20143.9s 3402 EvaluatorHoldout: Ignoring 28 ( 0.1%) Users that have less than 1 test interactions
20159.0s 3403 EvaluatorHoldout: Processed 27067 (100.0%) in 15.28 sec. Users per second: 1771
20159.5s 3404 Unable to load Cython Compute_Similarity, reverting to Python
20168.8s 3405 Similarity column 6969 (100.0%), 746.18 column/sec. Elapsed time 9.34 sec
20168.8s 3406 EvaluatorHoldout: Ignoring 40 ( 0.1%) Users that have less than 1 test interactions
20184.3s 3407 EvaluatorHoldout: Processed 27055 (100.0%) in 15.62 sec. Users per second: 1732
20184.8s 3408 Unable to load Cython Compute_Similarity, reverting to Python
20193.9s 3409 Similarity column 6969 (100.0%), 747.51 column/sec. Elapsed time 9.32 sec
20194.1s 3410 EvaluatorHoldout: Ignoring 21 ( 0.1%) Users that have less than 1 test interactions
20209.4s 3411 EvaluatorHoldout: Processed 27074 (100.0%) in 15.35 sec. Users per second: 1764
20209.8s 3412 Unable to load Cython Compute_Similarity, reverting to Python
20218.9s 3413 Similarity column 6969 (100.0%), 745.94 column/sec. Elapsed time 9.34 sec
20219.1s 3414 EvaluatorHoldout: Ignoring 29 ( 0.1%) Users that have less than 1 test interactions
20234.3s 3415 EvaluatorHoldout: Processed 27066 (100.0%) in 15.32 sec. Users per second: 1767
20234.3s 3416 [I 2025-12-07 14:31:09,789] Trial 140 finished with value: 0.2158224249405865 and parameters: {'similarity': 'tversky', 'topK': 43, 'shrink': 275, 'tversky_alpha': 0.5151560277743854, 'tversky_beta': 1.541145758996338}. Best is trial 91 with value: 0.24993110179607925.
20234.3s 3417 
20234.3s 3418 [I 2025-12-07 14:31:09,789] Trial 140 finished with value: 0.2158224249405865 and parameters: {'similarity': 'tversky', 'topK': 43, 'shrink': 275, 'tversky_alpha': 0.5151560277743854, 'tversky_beta': 1.541145758996338}. Best is trial 91 with value: 0.24993110179607925.
20234.5s 3419 [0.21596618577475543, 0.21609491531311165, 0.21667076497280113, 0.21434822193602493, 0.21603203670623944]
20234.8s 3420 Unable to load Cython Compute_Similarity, reverting to Python
20244.1s 3421 Similarity column 6969 (100.0%), 744.71 column/sec. Elapsed time 9.36 sec
20244.1s 3422 EvaluatorHoldout: Ignoring 33 ( 0.1%) Users that have less than 1 test interactions
20258.0s 3423 EvaluatorHoldout: Processed 27062 (100.0%) in 14.03 sec. Users per second: 1929
20258.5s 3424 Unable to load Cython Compute_Similarity, reverting to Python
20267.3s 3425 Similarity column 6969 (100.0%), 776.28 column/sec. Elapsed time 8.98 sec
20267.5s 3426 EvaluatorHoldout: Ignoring 28 ( 0.1%) Users that have less than 1 test interactions
20281.6s 3427 EvaluatorHoldout: Processed 27067 (100.0%) in 14.11 sec. Users per second: 1919
20281.9s 3428 Unable to load Cython Compute_Similarity, reverting to Python
20290.9s 3429 Similarity column 6969 (100.0%), 759.63 column/sec. Elapsed time 9.17 sec
20291.1s 3430 EvaluatorHoldout: Ignoring 40 ( 0.1%) Users that have less than 1 test interactions
20304.7s 3431 EvaluatorHoldout: Processed 27055 (100.0%) in 13.81 sec. Users per second: 1959
20305.2s 3432 Unable to load Cython Compute_Similarity, reverting to Python
20314.1s 3433 Similarity column 6969 (100.0%), 776.39 column/sec. Elapsed time 8.98 sec
20314.2s 3434 EvaluatorHoldout: Ignoring 21 ( 0.1%) Users that have less than 1 test interactions
20328.0s 3435 EvaluatorHoldout: Processed 27074 (100.0%) in 14.02 sec. Users per second: 1931
20328.5s 3436 Unable to load Cython Compute_Similarity, reverting to Python
20337.4s 3437 Similarity column 6969 (100.0%), 770.76 column/sec. Elapsed time 9.04 sec
20337.6s 3438 EvaluatorHoldout: Ignoring 29 ( 0.1%) Users that have less than 1 test interactions
20351.7s 3439 EvaluatorHoldout: Processed 27066 (100.0%) in 14.20 sec. Users per second: 1906
20351.7s 3440 [I 2025-12-07 14:33:07,110] Trial 141 finished with value: 0.22069049128289286 and parameters: {'similarity': 'tversky', 'topK': 6, 'shrink': 265, 'tversky_alpha': 0.25227843084532386, 'tversky_beta': 0.46881556277400327}. Best is trial 91 with value: 0.24993110179607925.
20351.7s 3441 
20351.7s 3442 [I 2025-12-07 14:33:07,110] Trial 141 finished with value: 0.22069049128289286 and parameters: {'similarity': 'tversky', 'topK': 6, 'shrink': 265, 'tversky_alpha': 0.25227843084532386, 'tversky_beta': 0.46881556277400327}. Best is trial 91 with value: 0.24993110179607925.
20351.8s 3443 [0.22043924461654463, 0.2215056022323893, 0.22225257777489912, 0.21867810178669533, 0.2205769300039359]
20352.1s 3444 Unable to load Cython Compute_Similarity, reverting to Python
20361.4s 3445 Similarity column 6969 (100.0%), 737.61 column/sec. Elapsed time 9.45 sec
20361.6s 3446 EvaluatorHoldout: Ignoring 33 ( 0.1%) Users that have less than 1 test interactions
20375.1s 3447 EvaluatorHoldout: Processed 27062 (100.0%) in 13.71 sec. Users per second: 1974
20375.6s 3448 Unable to load Cython Compute_Similarity, reverting to Python
20384.6s 3449 Similarity column 6969 (100.0%), 772.88 column/sec. Elapsed time 9.02 sec
20384.6s 3450 EvaluatorHoldout: Ignoring 28 ( 0.1%) Users that have less than 1 test interactions
20398.3s 3451 EvaluatorHoldout: Processed 27067 (100.0%) in 13.89 sec. Users per second: 1949
20398.8s 3452 Unable to load Cython Compute_Similarity, reverting to Python
20408.3s 3453 Similarity column 6969 (100.0%), 718.23 column/sec. Elapsed time 9.70 sec
20408.5s 3454 EvaluatorHoldout: Ignoring 40 ( 0.1%) Users that have less than 1 test interactions
20422.3s 3455 EvaluatorHoldout: Processed 27055 (100.0%) in 13.83 sec. Users per second: 1956
20422.7s 3456 Unable to load Cython Compute_Similarity, reverting to Python
20431.7s 3457 Similarity column 6969 (100.0%), 758.61 column/sec. Elapsed time 9.19 sec
20431.9s 3458 EvaluatorHoldout: Ignoring 21 ( 0.1%) Users that have less than 1 test interactions
20445.5s 3459 EvaluatorHoldout: Processed 27074 (100.0%) in 13.85 sec. Users per second: 1955
20446.0s 3460 Unable to load Cython Compute_Similarity, reverting to Python
20455.5s 3461 Similarity column 6969 (100.0%), 735.05 column/sec. Elapsed time 9.48 sec
20455.5s 3462 EvaluatorHoldout: Ignoring 29 ( 0.1%) Users that have less than 1 test interactions
20469.1s 3463 EvaluatorHoldout: Processed 27066 (100.0%) in 13.74 sec. Users per second: 1970
20469.1s 3464 [I 2025-12-07 14:35:04,599] Trial 142 finished with value: 0.24723839728999697 and parameters: {'similarity': 'tversky', 'topK': 5, 'shrink': 208, 'tversky_alpha': 0.3239010767125529, 'tversky_beta': 1.4575605655089967}. Best is trial 91 with value: 0.24993110179607925.
20469.1s 3465 
20469.1s 3466 [I 2025-12-07 14:35:04,599] Trial 142 finished with value: 0.24723839728999697 and parameters: {'similarity': 'tversky', 'topK': 5, 'shrink': 208, 'tversky_alpha': 0.3239010767125529, 'tversky_beta': 1.4575605655089967}. Best is trial 91 with value: 0.24993110179607925.
20469.3s 3467 [0.24655782666856726, 0.2479020955235908, 0.24852053557815942, 0.2463988264859919, 0.24681270219367538]
20469.6s 3468 Unable to load Cython Compute_Similarity, reverting to Python
20478.8s 3469 Similarity column 6969 (100.0%), 743.95 column/sec. Elapsed time 9.37 sec
20479.0s 3470 EvaluatorHoldout: Ignoring 33 ( 0.1%) Users that have less than 1 test interactions
20492.8s 3471 EvaluatorHoldout: Processed 27062 (100.0%) in 13.89 sec. Users per second: 1948
20493.2s 3472 Unable to load Cython Compute_Similarity, reverting to Python
20502.1s 3473 Similarity column 6969 (100.0%), 761.51 column/sec. Elapsed time 9.15 sec
20502.3s 3474 EvaluatorHoldout: Ignoring 28 ( 0.1%) Users that have less than 1 test interactions
20516.1s 3475 EvaluatorHoldout: Processed 27067 (100.0%) in 13.94 sec. Users per second: 1942
20516.6s 3476 Unable to load Cython Compute_Similarity, reverting to Python
20526.1s 3477 Similarity column 6969 (100.0%), 726.05 column/sec. Elapsed time 9.60 sec
20526.2s 3478 EvaluatorHoldout: Ignoring 40 ( 0.1%) Users that have less than 1 test interactions
20539.8s 3479 EvaluatorHoldout: Processed 27055 (100.0%) in 13.83 sec. Users per second: 1956
20540.3s 3480 Unable to load Cython Compute_Similarity, reverting to Python
20549.3s 3481 Similarity column 6969 (100.0%), 763.18 column/sec. Elapsed time 9.13 sec
20549.5s 3482 EvaluatorHoldout: Ignoring 21 ( 0.1%) Users that have less than 1 test interactions
20563.2s 3483 EvaluatorHoldout: Processed 27074 (100.0%) in 13.80 sec. Users per second: 1961
20563.6s 3484 Unable to load Cython Compute_Similarity, reverting to Python
20572.3s 3485 Similarity column 6969 (100.0%), 779.79 column/sec. Elapsed time 8.94 sec
20572.5s 3486 EvaluatorHoldout: Ignoring 29 ( 0.1%) Users that have less than 1 test interactions
20586.2s 3487 EvaluatorHoldout: Processed 27066 (100.0%) in 13.83 sec. Users per second: 1957
20586.2s 3488 [I 2025-12-07 14:37:01,685] Trial 143 finished with value: 0.24894872323735928 and parameters: {'similarity': 'tversky', 'topK': 7, 'shrink': 209, 'tversky_alpha': 0.32745251985028545, 'tversky_beta': 1.6314412269461183}. Best is trial 91 with value: 0.24993110179607925.
20586.2s 3489 
20586.2s 3490 [I 2025-12-07 14:37:01,685] Trial 143 finished with value: 0.24894872323735928 and parameters: {'similarity': 'tversky', 'topK': 7, 'shrink': 209, 'tversky_alpha': 0.32745251985028545, 'tversky_beta': 1.6314412269461183}. Best is trial 91 with value: 0.24993110179607925.
20586.4s 3491 [0.248082950305362, 0.24995154631471775, 0.250229089183059, 0.24767884226669545, 0.24880118811696217]
20586.7s 3492 Unable to load Cython Compute_Similarity, reverting to Python
20595.6s 3493 Similarity column 6969 (100.0%), 775.90 column/sec. Elapsed time 8.98 sec
20595.7s 3494 EvaluatorHoldout: Ignoring 33 ( 0.1%) Users that have less than 1 test interactions
20609.1s 3495 EvaluatorHoldout: Processed 27062 (100.0%) in 13.60 sec. Users per second: 1991
20609.6s 3496 Unable to load Cython Compute_Similarity, reverting to Python
20618.3s 3497 Similarity column 6969 (100.0%), 778.09 column/sec. Elapsed time 8.96 sec
20618.5s 3498 EvaluatorHoldout: Ignoring 28 ( 0.1%) Users that have less than 1 test interactions
20632.3s 3499 EvaluatorHoldout: Processed 27067 (100.0%) in 13.82 sec. Users per second: 1959
20632.7s 3500 Unable to load Cython Compute_Similarity, reverting to Python
20641.8s 3501 Similarity column 6969 (100.0%), 750.81 column/sec. Elapsed time 9.28 sec
20642.0s 3502 EvaluatorHoldout: Ignoring 40 ( 0.1%) Users that have less than 1 test interactions
20655.4s 3503 EvaluatorHoldout: Processed 27055 (100.0%) in 13.61 sec. Users per second: 1988
20655.9s 3504 Unable to load Cython Compute_Similarity, reverting to Python
20664.9s 3505 Similarity column 6969 (100.0%), 771.44 column/sec. Elapsed time 9.03 sec
20664.9s 3506 EvaluatorHoldout: Ignoring 21 ( 0.1%) Users that have less than 1 test interactions
20678.4s 3507 EvaluatorHoldout: Processed 27074 (100.0%) in 13.65 sec. Users per second: 1983
20678.9s 3508 Unable to load Cython Compute_Similarity, reverting to Python
20687.5s 3509 Similarity column 6969 (100.0%), 787.48 column/sec. Elapsed time 8.85 sec
20687.7s 3510 EvaluatorHoldout: Ignoring 29 ( 0.1%) Users that have less than 1 test interactions
20701.5s 3511 EvaluatorHoldout: Processed 27066 (100.0%) in 13.72 sec. Users per second: 1973
20701.5s 3512 [I 2025-12-07 14:38:56,798] Trial 144 finished with value: 0.24810710826692778 and parameters: {'similarity': 'tversky', 'topK': 5, 'shrink': 214, 'tversky_alpha': 0.33085890129416123, 'tversky_beta': 1.5873002649661732}. Best is trial 91 with value: 0.24993110179607925.
20701.5s 3513 
20701.5s 3514 [I 2025-12-07 14:38:56,798] Trial 144 finished with value: 0.24810710826692778 and parameters: {'similarity': 'tversky', 'topK': 5, 'shrink': 214, 'tversky_alpha': 0.33085890129416123, 'tversky_beta': 1.5873002649661732}. Best is trial 91 with value: 0.24993110179607925.
20701.5s 3515 [0.2473943251555228, 0.24889369204008605, 0.2492797336411497, 0.2470687600661409, 0.24789903043173955]
20701.8s 3516 Unable to load Cython Compute_Similarity, reverting to Python
20710.7s 3517 Similarity column 6969 (100.0%), 764.94 column/sec. Elapsed time 9.11 sec
20710.9s 3518 EvaluatorHoldout: Ignoring 33 ( 0.1%) Users that have less than 1 test interactions
20725.6s 3519 EvaluatorHoldout: Processed 27062 (100.0%) in 14.87 sec. Users per second: 1820
20726.1s 3520 Unable to load Cython Compute_Similarity, reverting to Python
20735.4s 3521 Similarity column 6969 (100.0%), 748.95 column/sec. Elapsed time 9.30 sec
20735.4s 3522 EvaluatorHoldout: Ignoring 28 ( 0.1%) Users that have less than 1 test interactions
20750.2s 3523 EvaluatorHoldout: Processed 27067 (100.0%) in 14.97 sec. Users per second: 1808
20750.7s 3524 Unable to load Cython Compute_Similarity, reverting to Python
20759.7s 3525 Similarity column 6969 (100.0%), 757.36 column/sec. Elapsed time 9.20 sec
20759.9s 3526 EvaluatorHoldout: Ignoring 40 ( 0.1%) Users that have less than 1 test interactions
20774.8s 3527 EvaluatorHoldout: Processed 27055 (100.0%) in 14.90 sec. Users per second: 1815
20775.1s 3528 Unable to load Cython Compute_Similarity, reverting to Python
20784.4s 3529 Similarity column 6969 (100.0%), 732.98 column/sec. Elapsed time 9.51 sec
20784.6s 3530 EvaluatorHoldout: Ignoring 21 ( 0.1%) Users that have less than 1 test interactions
20799.5s 3531 EvaluatorHoldout: Processed 27074 (100.0%) in 15.06 sec. Users per second: 1798
20800.0s 3532 Unable to load Cython Compute_Similarity, reverting to Python
20809.3s 3533 Similarity column 6969 (100.0%), 749.83 column/sec. Elapsed time 9.29 sec
20809.3s 3534 EvaluatorHoldout: Ignoring 29 ( 0.1%) Users that have less than 1 test interactions
20824.2s 3535 EvaluatorHoldout: Processed 27066 (100.0%) in 15.06 sec. Users per second: 1797
20824.2s 3536 [I 2025-12-07 14:40:59,735] Trial 145 finished with value: 0.22336576222501003 and parameters: {'similarity': 'tversky', 'topK': 44, 'shrink': 146, 'tversky_alpha': 0.3349927749961724, 'tversky_beta': 1.5896052525318007}. Best is trial 91 with value: 0.24993110179607925.
20824.2s 3537 
20824.2s 3538 [I 2025-12-07 14:40:59,735] Trial 145 finished with value: 0.22336576222501003 and parameters: {'similarity': 'tversky', 'topK': 44, 'shrink': 146, 'tversky_alpha': 0.3349927749961724, 'tversky_beta': 1.5896052525318007}. Best is trial 91 with value: 0.24993110179607925.
20824.4s 3539 [0.2226437831187054, 0.22378113245583112, 0.22403736742762947, 0.22223279957144962, 0.22413372855143457]
20824.7s 3540 Unable to load Cython Compute_Similarity, reverting to Python
20833.9s 3541 Similarity column 6969 (100.0%), 739.98 column/sec. Elapsed time 9.42 sec
20834.1s 3542 EvaluatorHoldout: Ignoring 33 ( 0.1%) Users that have less than 1 test interactions
20849.6s 3543 EvaluatorHoldout: Processed 27062 (100.0%) in 15.44 sec. Users per second: 1752
20849.9s 3544 Unable to load Cython Compute_Similarity, reverting to Python
20859.0s 3545 Similarity column 6969 (100.0%), 752.32 column/sec. Elapsed time 9.26 sec
20859.2s 3546 EvaluatorHoldout: Ignoring 28 ( 0.1%) Users that have less than 1 test interactions
20874.7s 3547 EvaluatorHoldout: Processed 27067 (100.0%) in 15.70 sec. Users per second: 1724
20875.2s 3548 Unable to load Cython Compute_Similarity, reverting to Python
20884.6s 3549 Similarity column 6969 (100.0%), 736.28 column/sec. Elapsed time 9.47 sec
20884.7s 3550 EvaluatorHoldout: Ignoring 40 ( 0.1%) Users that have less than 1 test interactions
20900.0s 3551 EvaluatorHoldout: Processed 27055 (100.0%) in 15.51 sec. Users per second: 1744
20900.5s 3552 Unable to load Cython Compute_Similarity, reverting to Python
20909.8s 3553 Similarity column 6969 (100.0%), 734.44 column/sec. Elapsed time 9.49 sec
20910.0s 3554 EvaluatorHoldout: Ignoring 21 ( 0.1%) Users that have less than 1 test interactions
20925.5s 3555 EvaluatorHoldout: Processed 27074 (100.0%) in 15.55 sec. Users per second: 1741
20925.9s 3556 Unable to load Cython Compute_Similarity, reverting to Python
20935.1s 3557 Similarity column 6969 (100.0%), 738.81 column/sec. Elapsed time 9.43 sec
20935.3s 3558 EvaluatorHoldout: Ignoring 29 ( 0.1%) Users that have less than 1 test interactions
20950.6s 3559 EvaluatorHoldout: Processed 27066 (100.0%) in 15.42 sec. Users per second: 1755
20950.6s 3560 [I 2025-12-07 14:43:06,086] Trial 146 finished with value: 0.21311237100439331 and parameters: {'similarity': 'tversky', 'topK': 65, 'shrink': 200, 'tversky_alpha': 0.39491686832226486, 'tversky_beta': 1.6410840953714216}. Best is trial 91 with value: 0.24993110179607925.
20950.6s 3561 
20950.6s 3562 [I 2025-12-07 14:43:06,086] Trial 146 finished with value: 0.21311237100439331 and parameters: {'similarity': 'tversky', 'topK': 65, 'shrink': 200, 'tversky_alpha': 0.39491686832226486, 'tversky_beta': 1.6410840953714216}. Best is trial 91 with value: 0.24993110179607925.
20950.8s 3563 [0.21253604738114698, 0.21352157549276082, 0.21335577026718572, 0.21223579928094624, 0.21391266259992678]
20951.1s 3564 Unable to load Cython Compute_Similarity, reverting to Python
20960.0s 3565 Similarity column 6969 (100.0%), 777.86 column/sec. Elapsed time 8.96 sec
20960.0s 3566 EvaluatorHoldout: Ignoring 33 ( 0.1%) Users that have less than 1 test interactions
20975.5s 3567 EvaluatorHoldout: Processed 27062 (100.0%) in 15.63 sec. Users per second: 1731
20976.0s 3568 Unable to load Cython Compute_Similarity, reverting to Python
20984.7s 3569 Similarity column 6969 (100.0%), 783.75 column/sec. Elapsed time 8.89 sec
20984.9s 3570 EvaluatorHoldout: Ignoring 28 ( 0.1%) Users that have less than 1 test interactions
21000.7s 3571 EvaluatorHoldout: Processed 27067 (100.0%) in 15.84 sec. Users per second: 1709
21001.0s 3572 Unable to load Cython Compute_Similarity, reverting to Python
21009.8s 3573 Similarity column 6969 (100.0%), 774.95 column/sec. Elapsed time 8.99 sec
21010.0s 3574 EvaluatorHoldout: Ignoring 40 ( 0.1%) Users that have less than 1 test interactions
21025.7s 3575 EvaluatorHoldout: Processed 27055 (100.0%) in 15.83 sec. Users per second: 1709
21026.2s 3576 Unable to load Cython Compute_Similarity, reverting to Python
21035.4s 3577 Similarity column 6969 (100.0%), 751.95 column/sec. Elapsed time 9.27 sec
21035.4s 3578 EvaluatorHoldout: Ignoring 21 ( 0.1%) Users that have less than 1 test interactions
21051.0s 3579 EvaluatorHoldout: Processed 27074 (100.0%) in 15.73 sec. Users per second: 1721
21051.5s 3580 Unable to load Cython Compute_Similarity, reverting to Python
21060.6s 3581 Similarity column 6969 (100.0%), 747.62 column/sec. Elapsed time 9.32 sec
21060.8s 3582 EvaluatorHoldout: Ignoring 29 ( 0.1%) Users that have less than 1 test interactions
21076.6s 3583 EvaluatorHoldout: Processed 27066 (100.0%) in 15.74 sec. Users per second: 1720
21076.6s 3584 [I 2025-12-07 14:45:11,916] Trial 147 finished with value: 0.2028286783114154 and parameters: {'similarity': 'dice', 'topK': 41, 'shrink': 221}. Best is trial 91 with value: 0.24993110179607925.
21076.6s 3585 
