2349.2s 274 [I 2025-12-06 21:57:00,119] Trial 9 finished with value: 0.20327974087530404 and parameters: {'topK': 339, 'shrink': 925, 'feature_weighting': 'BM25'}. Best is trial 1 with value: 0.2138053435151353.
2349.3s 275 [0.20347019411509157, 0.2033182174189459, 0.2023444692298133, 0.20366821508284383, 0.2035976085298256]
2349.7s 276 Unable to load Cython Compute_Similarity, reverting to Python
2361.3s 277 Similarity column 6969 (100.0%), 588.83 column/sec. Elapsed time 11.84 sec
2361.5s 278 EvaluatorHoldout: Ignoring 48 ( 0.2%) Users that have less than 1 test interactions
2382.8s 279 EvaluatorHoldout: Processed 27047 (100.0%) in 21.37 sec. Users per second: 1266
2383.3s 280 Unable to load Cython Compute_Similarity, reverting to Python
2395.2s 281 Similarity column 6969 (100.0%), 576.75 column/sec. Elapsed time 12.08 sec
2395.4s 282 EvaluatorHoldout: Ignoring 29 ( 0.1%) Users that have less than 1 test interactions
2417.0s 283 EvaluatorHoldout: Processed 27066 (100.0%) in 21.80 sec. Users per second: 1242
2417.5s 284 Unable to load Cython Compute_Similarity, reverting to Python
2428.8s 285 Similarity column 6969 (100.0%), 607.09 column/sec. Elapsed time 11.48 sec
2429.0s 286 EvaluatorHoldout: Ignoring 42 ( 0.2%) Users that have less than 1 test interactions
2450.6s 287 EvaluatorHoldout: Processed 27053 (100.0%) in 21.68 sec. Users per second: 1248
2451.1s 288 Unable to load Cython Compute_Similarity, reverting to Python
2462.8s 289 Similarity column 6969 (100.0%), 582.75 column/sec. Elapsed time 11.96 sec
2463.1s 290 EvaluatorHoldout: Ignoring 38 ( 0.1%) Users that have less than 1 test interactions
2484.7s 291 EvaluatorHoldout: Processed 27057 (100.0%) in 21.78 sec. Users per second: 1243
2485.2s 292 Unable to load Cython Compute_Similarity, reverting to Python
2497.5s 293 Similarity column 6969 (100.0%), 558.77 column/sec. Elapsed time 12.47 sec
2497.7s 294 EvaluatorHoldout: Ignoring 32 ( 0.1%) Users that have less than 1 test interactions
2519.1s 295 EvaluatorHoldout: Processed 27063 (100.0%) in 21.57 sec. Users per second: 1255
2519.1s 296 [I 2025-12-06 21:59:50,073] Trial 10 finished with value: 0.21699762942341766 and parameters: {'topK': 88, 'shrink': 26, 'feature_weighting': 'TF-IDF'}. Best is trial 10 with value: 0.21699762942341766.
2519.1s 297 
2519.1s 298 [I 2025-12-06 21:59:50,073] Trial 10 finished with value: 0.21699762942341766 and parameters: {'topK': 88, 'shrink': 26, 'feature_weighting': 'TF-IDF'}. Best is trial 10 with value: 0.21699762942341766.
2519.3s 299 [0.21753993678342365, 0.21737507139527648, 0.21671994611466772, 0.2175306692904304, 0.2158225235332902]
2519.6s 300 Unable to load Cython Compute_Similarity, reverting to Python
2531.4s 301 Similarity column 6969 (100.0%), 584.99 column/sec. Elapsed time 11.91 sec
2531.6s 302 EvaluatorHoldout: Ignoring 48 ( 0.2%) Users that have less than 1 test interactions
2553.4s 303 EvaluatorHoldout: Processed 27047 (100.0%) in 21.95 sec. Users per second: 1232
2553.9s 304 Unable to load Cython Compute_Similarity, reverting to Python
2566.1s 305 Similarity column 6969 (100.0%), 563.52 column/sec. Elapsed time 12.37 sec
2566.3s 306 EvaluatorHoldout: Ignoring 29 ( 0.1%) Users that have less than 1 test interactions
2588.6s 307 EvaluatorHoldout: Processed 27066 (100.0%) in 22.41 sec. Users per second: 1208
2589.1s 308 Unable to load Cython Compute_Similarity, reverting to Python
2601.3s 309 Similarity column 6969 (100.0%), 561.40 column/sec. Elapsed time 12.41 sec
2601.5s 310 EvaluatorHoldout: Ignoring 42 ( 0.2%) Users that have less than 1 test interactions
2623.4s 311 EvaluatorHoldout: Processed 27053 (100.0%) in 22.07 sec. Users per second: 1226
2623.9s 312 Unable to load Cython Compute_Similarity, reverting to Python
2635.8s 313 Similarity column 6969 (100.0%), 576.82 column/sec. Elapsed time 12.08 sec
2636.0s 314 EvaluatorHoldout: Ignoring 38 ( 0.1%) Users that have less than 1 test interactions
2657.9s 315 EvaluatorHoldout: Processed 27057 (100.0%) in 22.04 sec. Users per second: 1228
2658.4s 316 Unable to load Cython Compute_Similarity, reverting to Python
2670.8s 317 Similarity column 6969 (100.0%), 556.30 column/sec. Elapsed time 12.53 sec
2671.0s 318 EvaluatorHoldout: Ignoring 32 ( 0.1%) Users that have less than 1 test interactions
2692.9s 319 EvaluatorHoldout: Processed 27063 (100.0%) in 22.07 sec. Users per second: 1226
2692.9s 320 [I 2025-12-06 22:02:43,864] Trial 11 finished with value: 0.21691741085315322 and parameters: {'topK': 90, 'shrink': 83, 'feature_weighting': 'TF-IDF'}. Best is trial 10 with value: 0.21699762942341766.
2692.9s 321 
2692.9s 322 [I 2025-12-06 22:02:43,864] Trial 11 finished with value: 0.21691741085315322 and parameters: {'topK': 90, 'shrink': 83, 'feature_weighting': 'TF-IDF'}. Best is trial 10 with value: 0.21699762942341766.
2693.1s 323 [0.21738242102864802, 0.21718249472634726, 0.21678227697062077, 0.21742244411282666, 0.21581741742732335]
2693.4s 324 Unable to load Cython Compute_Similarity, reverting to Python
2704.9s 325 Similarity column 6969 (100.0%), 599.60 column/sec. Elapsed time 11.62 sec
2705.1s 326 EvaluatorHoldout: Ignoring 48 ( 0.2%) Users that have less than 1 test interactions
2725.2s 327 EvaluatorHoldout: Processed 27047 (100.0%) in 20.25 sec. Users per second: 1336
2725.7s 328 Unable to load Cython Compute_Similarity, reverting to Python
2737.2s 329 Similarity column 6969 (100.0%), 595.63 column/sec. Elapsed time 11.70 sec
2737.4s 330 EvaluatorHoldout: Ignoring 29 ( 0.1%) Users that have less than 1 test interactions
2757.6s 331 EvaluatorHoldout: Processed 27066 (100.0%) in 20.39 sec. Users per second: 1327
2758.2s 332 Unable to load Cython Compute_Similarity, reverting to Python
2769.7s 333 Similarity column 6969 (100.0%), 595.11 column/sec. Elapsed time 11.71 sec
2769.9s 334 EvaluatorHoldout: Ignoring 42 ( 0.2%) Users that have less than 1 test interactions
2790.3s 335 EvaluatorHoldout: Processed 27053 (100.0%) in 20.61 sec. Users per second: 1313
2790.9s 336 Unable to load Cython Compute_Similarity, reverting to Python
2802.8s 337 Similarity column 6969 (100.0%), 573.85 column/sec. Elapsed time 12.14 sec
2803.0s 338 EvaluatorHoldout: Ignoring 38 ( 0.1%) Users that have less than 1 test interactions
2823.6s 339 EvaluatorHoldout: Processed 27057 (100.0%) in 20.68 sec. Users per second: 1308
2824.1s 340 Unable to load Cython Compute_Similarity, reverting to Python
2835.9s 341 Similarity column 6969 (100.0%), 580.43 column/sec. Elapsed time 12.01 sec
2836.1s 342 EvaluatorHoldout: Ignoring 32 ( 0.1%) Users that have less than 1 test interactions
2856.9s 343 EvaluatorHoldout: Processed 27063 (100.0%) in 20.96 sec. Users per second: 1291
2856.9s 344 [I 2025-12-06 22:05:27,863] Trial 12 finished with value: 0.21689758776326534 and parameters: {'topK': 57, 'shrink': 16, 'feature_weighting': 'TF-IDF'}. Best is trial 10 with value: 0.21699762942341766.
2856.9s 345 
2856.9s 346 [I 2025-12-06 22:05:27,863] Trial 12 finished with value: 0.21689758776326534 and parameters: {'topK': 57, 'shrink': 16, 'feature_weighting': 'TF-IDF'}. Best is trial 10 with value: 0.21699762942341766.
2857.1s 347 [0.2177493035409796, 0.21672807282354564, 0.2162313009532513, 0.21761818160117455, 0.21616107989737568]
2857.4s 348 Unable to load Cython Compute_Similarity, reverting to Python
2868.9s 349 Similarity column 6969 (100.0%), 595.68 column/sec. Elapsed time 11.70 sec
2869.1s 350 EvaluatorHoldout: Ignoring 48 ( 0.2%) Users that have less than 1 test interactions
2889.8s 351 EvaluatorHoldout: Processed 27047 (100.0%) in 20.80 sec. Users per second: 1300
2890.3s 352 Unable to load Cython Compute_Similarity, reverting to Python
2902.5s 353 Similarity column 6969 (100.0%), 563.72 column/sec. Elapsed time 12.36 sec
2902.7s 354 EvaluatorHoldout: Ignoring 29 ( 0.1%) Users that have less than 1 test interactions
2922.8s 355 EvaluatorHoldout: Processed 27066 (100.0%) in 20.29 sec. Users per second: 1334
2923.4s 356 Unable to load Cython Compute_Similarity, reverting to Python
2934.8s 357 Similarity column 6969 (100.0%), 596.66 column/sec. Elapsed time 11.68 sec
2935.0s 358 EvaluatorHoldout: Ignoring 42 ( 0.2%) Users that have less than 1 test interactions
2955.6s 359 EvaluatorHoldout: Processed 27053 (100.0%) in 20.72 sec. Users per second: 1306
2956.1s 360 Unable to load Cython Compute_Similarity, reverting to Python
2967.7s 361 Similarity column 6969 (100.0%), 590.43 column/sec. Elapsed time 11.80 sec
2967.9s 362 EvaluatorHoldout: Ignoring 38 ( 0.1%) Users that have less than 1 test interactions
2988.0s 363 EvaluatorHoldout: Processed 27057 (100.0%) in 20.14 sec. Users per second: 1344
2988.5s 364 Unable to load Cython Compute_Similarity, reverting to Python
3000.0s 365 Similarity column 6969 (100.0%), 594.04 column/sec. Elapsed time 11.73 sec
3000.2s 366 EvaluatorHoldout: Ignoring 32 ( 0.1%) Users that have less than 1 test interactions
3020.8s 367 EvaluatorHoldout: Processed 27063 (100.0%) in 20.73 sec. Users per second: 1305
3020.8s 368 [I 2025-12-06 22:08:11,755] Trial 13 finished with value: 0.21696903082808455 and parameters: {'topK': 58, 'shrink': 1, 'feature_weighting': 'TF-IDF'}. Best is trial 10 with value: 0.21699762942341766.
3020.8s 369 
3020.8s 370 [I 2025-12-06 22:08:11,755] Trial 13 finished with value: 0.21696903082808455 and parameters: {'topK': 58, 'shrink': 1, 'feature_weighting': 'TF-IDF'}. Best is trial 10 with value: 0.21699762942341766.
3021.0s 371 [0.2175607969753073, 0.2166945680411578, 0.2163063447028896, 0.21790654093228415, 0.21637690348878388]
3021.3s 372 Unable to load Cython Compute_Similarity, reverting to Python
3033.7s 373 Similarity column 6969 (100.0%), 552.55 column/sec. Elapsed time 12.61 sec
3033.9s 374 EvaluatorHoldout: Ignoring 48 ( 0.2%) Users that have less than 1 test interactions
3058.5s 375 EvaluatorHoldout: Processed 27047 (100.0%) in 24.65 sec. Users per second: 1097
3059.0s 376 Unable to load Cython Compute_Similarity, reverting to Python
3071.0s 377 Similarity column 6969 (100.0%), 569.31 column/sec. Elapsed time 12.24 sec
3071.2s 378 EvaluatorHoldout: Ignoring 29 ( 0.1%) Users that have less than 1 test interactions
3095.6s 379 EvaluatorHoldout: Processed 27066 (100.0%) in 24.49 sec. Users per second: 1105
3096.1s 380 Unable to load Cython Compute_Similarity, reverting to Python
3108.3s 381 Similarity column 6969 (100.0%), 563.78 column/sec. Elapsed time 12.36 sec
3108.5s 382 EvaluatorHoldout: Ignoring 42 ( 0.2%) Users that have less than 1 test interactions
3132.8s 383 EvaluatorHoldout: Processed 27053 (100.0%) in 24.48 sec. Users per second: 1105
3133.4s 384 Unable to load Cython Compute_Similarity, reverting to Python
3146.2s 385 Similarity column 6969 (100.0%), 533.30 column/sec. Elapsed time 13.07 sec
3146.4s 386 EvaluatorHoldout: Ignoring 38 ( 0.1%) Users that have less than 1 test interactions
3171.3s 387 EvaluatorHoldout: Processed 27057 (100.0%) in 24.94 sec. Users per second: 1085
3171.8s 388 Unable to load Cython Compute_Similarity, reverting to Python
3185.8s 389 Similarity column 6969 (100.0%), 492.98 column/sec. Elapsed time 14.14 sec
3186.0s 390 EvaluatorHoldout: Ignoring 32 ( 0.1%) Users that have less than 1 test interactions
3210.9s 391 EvaluatorHoldout: Processed 27063 (100.0%) in 25.04 sec. Users per second: 1081
3210.9s 392 [I 2025-12-06 22:11:21,862] Trial 14 finished with value: 0.216278112459065 and parameters: {'topK': 139, 'shrink': 143, 'feature_weighting': 'TF-IDF'}. Best is trial 10 with value: 0.21699762942341766.
3210.9s 393 
3210.9s 394 [I 2025-12-06 22:11:21,862] Trial 14 finished with value: 0.216278112459065 and parameters: {'topK': 139, 'shrink': 143, 'feature_weighting': 'TF-IDF'}. Best is trial 10 with value: 0.21699762942341766.
3211.1s 395 [0.21611721543392617, 0.21630859251608003, 0.2160831333409654, 0.21718832491384618, 0.21569329609050733]
3211.5s 396 Unable to load Cython Compute_Similarity, reverting to Python
3225.3s 397 Similarity column 6969 (100.0%), 495.36 column/sec. Elapsed time 14.07 sec
3225.5s 398 EvaluatorHoldout: Ignoring 48 ( 0.2%) Users that have less than 1 test interactions
3251.7s 399 EvaluatorHoldout: Processed 27047 (100.0%) in 26.32 sec. Users per second: 1028
3252.3s 400 Unable to load Cython Compute_Similarity, reverting to Python
3266.2s 401 Similarity column 6969 (100.0%), 492.88 column/sec. Elapsed time 14.14 sec
3266.4s 402 EvaluatorHoldout: Ignoring 29 ( 0.1%) Users that have less than 1 test interactions
3291.9s 403 EvaluatorHoldout: Processed 27066 (100.0%) in 25.57 sec. Users per second: 1058
3292.4s 404 Unable to load Cython Compute_Similarity, reverting to Python
3305.6s 405 Similarity column 6969 (100.0%), 520.76 column/sec. Elapsed time 13.38 sec
3305.8s 406 EvaluatorHoldout: Ignoring 42 ( 0.2%) Users that have less than 1 test interactions
3331.0s 407 EvaluatorHoldout: Processed 27053 (100.0%) in 25.33 sec. Users per second: 1068
3331.5s 408 Unable to load Cython Compute_Similarity, reverting to Python
3344.2s 409 Similarity column 6969 (100.0%), 540.42 column/sec. Elapsed time 12.90 sec
3344.4s 410 EvaluatorHoldout: Ignoring 38 ( 0.1%) Users that have less than 1 test interactions
3369.6s 411 EvaluatorHoldout: Processed 27057 (100.0%) in 25.28 sec. Users per second: 1070
3370.1s 412 Unable to load Cython Compute_Similarity, reverting to Python
3383.2s 413 Similarity column 6969 (100.0%), 521.44 column/sec. Elapsed time 13.36 sec
3383.4s 414 EvaluatorHoldout: Ignoring 32 ( 0.1%) Users that have less than 1 test interactions
3408.1s 415 EvaluatorHoldout: Processed 27063 (100.0%) in 24.81 sec. Users per second: 1091
3408.1s 416 [I 2025-12-06 22:14:39,082] Trial 15 finished with value: 0.21605911359398786 and parameters: {'topK': 145, 'shrink': 181, 'feature_weighting': 'TF-IDF'}. Best is trial 10 with value: 0.21699762942341766.
3408.1s 417 
3408.1s 418 [I 2025-12-06 22:14:39,082] Trial 15 finished with value: 0.21605911359398786 and parameters: {'topK': 145, 'shrink': 181, 'feature_weighting': 'TF-IDF'}. Best is trial 10 with value: 0.21699762942341766.
3408.3s 419 [0.21641652332485722, 0.21580549773489133, 0.21565886002967086, 0.21686687387662476, 0.21554781300389514]
3408.7s 420 Unable to load Cython Compute_Similarity, reverting to Python
3421.5s 421 Similarity column 6969 (100.0%), 535.43 column/sec. Elapsed time 13.02 sec
3421.7s 422 EvaluatorHoldout: Ignoring 48 ( 0.2%) Users that have less than 1 test interactions
3446.1s 423 EvaluatorHoldout: Processed 27047 (100.0%) in 24.51 sec. Users per second: 1103
3446.6s 424 Unable to load Cython Compute_Similarity, reverting to Python
3460.2s 425 Similarity column 6969 (100.0%), 504.90 column/sec. Elapsed time 13.80 sec
3460.4s 426 EvaluatorHoldout: Ignoring 29 ( 0.1%) Users that have less than 1 test interactions
3484.6s 427 EvaluatorHoldout: Processed 27066 (100.0%) in 24.31 sec. Users per second: 1113
3485.2s 428 Unable to load Cython Compute_Similarity, reverting to Python
3498.3s 429 Similarity column 6969 (100.0%), 520.68 column/sec. Elapsed time 13.38 sec
3498.5s 430 EvaluatorHoldout: Ignoring 42 ( 0.2%) Users that have less than 1 test interactions
3523.0s 431 EvaluatorHoldout: Processed 27053 (100.0%) in 24.60 sec. Users per second: 1100
3523.6s 432 Unable to load Cython Compute_Similarity, reverting to Python
3537.8s 433 Similarity column 6969 (100.0%), 482.22 column/sec. Elapsed time 14.45 sec
3538.0s 434 EvaluatorHoldout: Ignoring 38 ( 0.1%) Users that have less than 1 test interactions
3563.3s 435 EvaluatorHoldout: Processed 27057 (100.0%) in 25.37 sec. Users per second: 1067
3563.8s 436 Unable to load Cython Compute_Similarity, reverting to Python
3577.3s 437 Similarity column 6969 (100.0%), 510.53 column/sec. Elapsed time 13.65 sec
3577.5s 438 EvaluatorHoldout: Ignoring 32 ( 0.1%) Users that have less than 1 test interactions
3602.2s 439 EvaluatorHoldout: Processed 27063 (100.0%) in 24.85 sec. Users per second: 1089
3602.2s 440 [I 2025-12-06 22:17:53,147] Trial 16 finished with value: 0.2163337112588118 and parameters: {'topK': 141, 'shrink': 2, 'feature_weighting': 'TF-IDF'}. Best is trial 10 with value: 0.21699762942341766.
3602.2s 441 
3602.2s 442 [I 2025-12-06 22:17:53,147] Trial 16 finished with value: 0.2163337112588118 and parameters: {'topK': 141, 'shrink': 2, 'feature_weighting': 'TF-IDF'}. Best is trial 10 with value: 0.21699762942341766.
3602.4s 443 [0.2164521307188868, 0.2161788948652909, 0.21601539599916725, 0.2171747867158862, 0.21584734799482783]
3602.8s 444 Unable to load Cython Compute_Similarity, reverting to Python
3616.3s 445 Similarity column 6969 (100.0%), 505.95 column/sec. Elapsed time 13.77 sec
3616.5s 446 EvaluatorHoldout: Ignoring 48 ( 0.2%) Users that have less than 1 test interactions
3640.9s 447 EvaluatorHoldout: Processed 27047 (100.0%) in 24.46 sec. Users per second: 1106
3641.5s 448 Unable to load Cython Compute_Similarity, reverting to Python
3656.0s 449 Similarity column 6969 (100.0%), 473.01 column/sec. Elapsed time 14.73 sec
3656.2s 450 EvaluatorHoldout: Ignoring 29 ( 0.1%) Users that have less than 1 test interactions
3683.7s 451 EvaluatorHoldout: Processed 27066 (100.0%) in 27.55 sec. Users per second: 982
3684.3s 452 Unable to load Cython Compute_Similarity, reverting to Python
3699.5s 453 Similarity column 6969 (100.0%), 451.33 column/sec. Elapsed time 15.44 sec
3699.7s 454 EvaluatorHoldout: Ignoring 42 ( 0.2%) Users that have less than 1 test interactions
3726.0s 455 EvaluatorHoldout: Processed 27053 (100.0%) in 26.40 sec. Users per second: 1025
3726.6s 456 Unable to load Cython Compute_Similarity, reverting to Python
3742.4s 457 Similarity column 6969 (100.0%), 436.73 column/sec. Elapsed time 15.96 sec
3742.6s 458 EvaluatorHoldout: Ignoring 38 ( 0.1%) Users that have less than 1 test interactions
3769.4s 459 EvaluatorHoldout: Processed 27057 (100.0%) in 26.89 sec. Users per second: 1006
3770.0s 460 Unable to load Cython Compute_Similarity, reverting to Python
3785.1s 461 Similarity column 6969 (100.0%), 453.68 column/sec. Elapsed time 15.36 sec
3785.3s 462 EvaluatorHoldout: Ignoring 32 ( 0.1%) Users that have less than 1 test interactions
3810.0s 463 EvaluatorHoldout: Processed 27063 (100.0%) in 24.82 sec. Users per second: 1091
3810.0s 464 [I 2025-12-06 22:21:20,970] Trial 17 finished with value: 0.2163289259391275 and parameters: {'topK': 78, 'shrink': 467, 'feature_weighting': 'TF-IDF'}. Best is trial 10 with value: 0.21699762942341766.
3810.0s 465 
3810.0s 466 [I 2025-12-06 22:21:20,970] Trial 17 finished with value: 0.2163289259391275 and parameters: {'topK': 78, 'shrink': 467, 'feature_weighting': 'TF-IDF'}. Best is trial 10 with value: 0.21699762942341766.
3810.2s 467 [0.21700788769536764, 0.2159738417999113, 0.216142582861049, 0.21682469243263347, 0.21569562490667613]
3810.6s 468 Unable to load Cython Compute_Similarity, reverting to Python
3823.7s 469 Similarity column 6969 (100.0%), 521.62 column/sec. Elapsed time 13.36 sec
3823.9s 470 EvaluatorHoldout: Ignoring 48 ( 0.2%) Users that have less than 1 test interactions
3848.7s 471 EvaluatorHoldout: Processed 27047 (100.0%) in 24.85 sec. Users per second: 1089
3849.2s 472 Unable to load Cython Compute_Similarity, reverting to Python
3864.2s 473 Similarity column 6969 (100.0%), 458.22 column/sec. Elapsed time 15.21 sec
3864.4s 474 EvaluatorHoldout: Ignoring 29 ( 0.1%) Users that have less than 1 test interactions
3889.1s 475 EvaluatorHoldout: Processed 27066 (100.0%) in 24.78 sec. Users per second: 1092
3889.6s 476 Unable to load Cython Compute_Similarity, reverting to Python
3902.6s 477 Similarity column 6969 (100.0%), 530.24 column/sec. Elapsed time 13.14 sec
3902.8s 478 EvaluatorHoldout: Ignoring 42 ( 0.2%) Users that have less than 1 test interactions
3927.0s 479 EvaluatorHoldout: Processed 27053 (100.0%) in 24.29 sec. Users per second: 1114
3927.5s 480 Unable to load Cython Compute_Similarity, reverting to Python
3940.2s 481 Similarity column 6969 (100.0%), 539.69 column/sec. Elapsed time 12.91 sec
3940.4s 482 EvaluatorHoldout: Ignoring 38 ( 0.1%) Users that have less than 1 test interactions
3964.0s 483 EvaluatorHoldout: Processed 27057 (100.0%) in 23.72 sec. Users per second: 1141
3964.5s 484 Unable to load Cython Compute_Similarity, reverting to Python
3976.6s 485 Similarity column 6969 (100.0%), 568.04 column/sec. Elapsed time 12.27 sec
3976.8s 486 EvaluatorHoldout: Ignoring 32 ( 0.1%) Users that have less than 1 test interactions
4000.3s 487 EvaluatorHoldout: Processed 27063 (100.0%) in 23.59 sec. Users per second: 1147
4000.3s 488 [I 2025-12-06 22:24:31,229] Trial 18 finished with value: 0.19628711062051218 and parameters: {'topK': 134, 'shrink': 686, 'feature_weighting': 'BM25'}. Best is trial 10 with value: 0.21699762942341766.
4000.3s 489 
