17197.3s 2218 [I 2025-12-07 02:04:28,116] Trial 90 finished with value: 0.21043395400403214 and parameters: {'topK': 98, 'shrink': 20, 'feature_weighting': 'none'}. Best is trial 54 with value: 0.21706238132685302.
17197.3s 2219 [0.21026840412877018, 0.2113129483943321, 0.2097402674246182, 0.21117570460649024, 0.20967244546594976]
17197.7s 2220 Unable to load Cython Compute_Similarity, reverting to Python
17209.4s 2221 Similarity column 6969 (100.0%), 587.14 column/sec. Elapsed time 11.87 sec
17209.6s 2222 EvaluatorHoldout: Ignoring 48 ( 0.2%) Users that have less than 1 test interactions
17230.9s 2223 EvaluatorHoldout: Processed 27047 (100.0%) in 21.40 sec. Users per second: 1264
17231.4s 2224 Unable to load Cython Compute_Similarity, reverting to Python
17243.5s 2225 Similarity column 6969 (100.0%), 565.38 column/sec. Elapsed time 12.33 sec
17243.7s 2226 EvaluatorHoldout: Ignoring 29 ( 0.1%) Users that have less than 1 test interactions
17265.0s 2227 EvaluatorHoldout: Processed 27066 (100.0%) in 21.36 sec. Users per second: 1267
17265.5s 2228 Unable to load Cython Compute_Similarity, reverting to Python
17277.4s 2229 Similarity column 6969 (100.0%), 574.99 column/sec. Elapsed time 12.12 sec
17277.6s 2230 EvaluatorHoldout: Ignoring 42 ( 0.2%) Users that have less than 1 test interactions
17298.6s 2231 EvaluatorHoldout: Processed 27053 (100.0%) in 21.06 sec. Users per second: 1284
17299.0s 2232 Unable to load Cython Compute_Similarity, reverting to Python
17311.0s 2233 Similarity column 6969 (100.0%), 575.00 column/sec. Elapsed time 12.12 sec
17311.2s 2234 EvaluatorHoldout: Ignoring 38 ( 0.1%) Users that have less than 1 test interactions
17332.6s 2235 EvaluatorHoldout: Processed 27057 (100.0%) in 21.43 sec. Users per second: 1262
17333.0s 2236 Unable to load Cython Compute_Similarity, reverting to Python
17345.6s 2237 Similarity column 6969 (100.0%), 542.58 column/sec. Elapsed time 12.84 sec
17345.8s 2238 EvaluatorHoldout: Ignoring 32 ( 0.1%) Users that have less than 1 test interactions
17367.0s 2239 EvaluatorHoldout: Processed 27063 (100.0%) in 21.27 sec. Users per second: 1273
17367.0s 2240 [I 2025-12-07 02:07:17,907] Trial 91 finished with value: 0.2168957183878631 and parameters: {'topK': 69, 'shrink': 42, 'feature_weighting': 'TF-IDF'}. Best is trial 54 with value: 0.21706238132685302.
17367.0s 2241 
17367.0s 2242 [I 2025-12-07 02:07:17,907] Trial 91 finished with value: 0.2168957183878631 and parameters: {'topK': 69, 'shrink': 42, 'feature_weighting': 'TF-IDF'}. Best is trial 54 with value: 0.21706238132685302.
17367.1s 2243 [0.21719259146275344, 0.2165797293266882, 0.21637824691153718, 0.21782875200248072, 0.21649927223585586]
17367.5s 2244 Unable to load Cython Compute_Similarity, reverting to Python
17379.6s 2245 Similarity column 6969 (100.0%), 567.41 column/sec. Elapsed time 12.28 sec
17379.8s 2246 EvaluatorHoldout: Ignoring 48 ( 0.2%) Users that have less than 1 test interactions
17400.2s 2247 EvaluatorHoldout: Processed 27047 (100.0%) in 20.45 sec. Users per second: 1322
17400.6s 2248 Unable to load Cython Compute_Similarity, reverting to Python
17412.3s 2249 Similarity column 6969 (100.0%), 588.35 column/sec. Elapsed time 11.84 sec
17412.5s 2250 EvaluatorHoldout: Ignoring 29 ( 0.1%) Users that have less than 1 test interactions
17433.3s 2251 EvaluatorHoldout: Processed 27066 (100.0%) in 20.89 sec. Users per second: 1296
17433.8s 2252 Unable to load Cython Compute_Similarity, reverting to Python
17445.7s 2253 Similarity column 6969 (100.0%), 574.32 column/sec. Elapsed time 12.13 sec
17445.9s 2254 EvaluatorHoldout: Ignoring 42 ( 0.2%) Users that have less than 1 test interactions
17467.4s 2255 EvaluatorHoldout: Processed 27053 (100.0%) in 21.48 sec. Users per second: 1259
17467.8s 2256 Unable to load Cython Compute_Similarity, reverting to Python
17480.1s 2257 Similarity column 6969 (100.0%), 556.17 column/sec. Elapsed time 12.53 sec
17480.3s 2258 EvaluatorHoldout: Ignoring 38 ( 0.1%) Users that have less than 1 test interactions
17501.4s 2259 EvaluatorHoldout: Processed 27057 (100.0%) in 21.07 sec. Users per second: 1284
17501.8s 2260 Unable to load Cython Compute_Similarity, reverting to Python
17513.5s 2261 Similarity column 6969 (100.0%), 585.32 column/sec. Elapsed time 11.91 sec
17513.7s 2262 EvaluatorHoldout: Ignoring 32 ( 0.1%) Users that have less than 1 test interactions
17534.7s 2263 EvaluatorHoldout: Processed 27063 (100.0%) in 21.06 sec. Users per second: 1285
17534.7s 2264 [I 2025-12-07 02:10:05,576] Trial 92 finished with value: 0.21678447854118024 and parameters: {'topK': 62, 'shrink': 18, 'feature_weighting': 'TF-IDF'}. Best is trial 54 with value: 0.21706238132685302.
17534.7s 2265 
17534.7s 2266 [I 2025-12-07 02:10:05,576] Trial 92 finished with value: 0.21678447854118024 and parameters: {'topK': 62, 'shrink': 18, 'feature_weighting': 'TF-IDF'}. Best is trial 54 with value: 0.21706238132685302.
17534.8s 2267 [0.21724380690972586, 0.21655324577923654, 0.21586640414518948, 0.21791496373354813, 0.2163439721382011]
17535.2s 2268 Unable to load Cython Compute_Similarity, reverting to Python
17547.2s 2269 Similarity column 6969 (100.0%), 570.72 column/sec. Elapsed time 12.21 sec
17547.4s 2270 EvaluatorHoldout: Ignoring 48 ( 0.2%) Users that have less than 1 test interactions
17568.7s 2271 EvaluatorHoldout: Processed 27047 (100.0%) in 21.36 sec. Users per second: 1266
17569.1s 2272 Unable to load Cython Compute_Similarity, reverting to Python
17581.6s 2273 Similarity column 6969 (100.0%), 551.17 column/sec. Elapsed time 12.64 sec
17581.8s 2274 EvaluatorHoldout: Ignoring 29 ( 0.1%) Users that have less than 1 test interactions
17603.9s 2275 EvaluatorHoldout: Processed 27066 (100.0%) in 22.00 sec. Users per second: 1230
17604.2s 2276 Unable to load Cython Compute_Similarity, reverting to Python
17616.6s 2277 Similarity column 6969 (100.0%), 551.41 column/sec. Elapsed time 12.64 sec
17616.8s 2278 EvaluatorHoldout: Ignoring 42 ( 0.2%) Users that have less than 1 test interactions
17639.0s 2279 EvaluatorHoldout: Processed 27053 (100.0%) in 22.26 sec. Users per second: 1216
17639.5s 2280 Unable to load Cython Compute_Similarity, reverting to Python
17651.9s 2281 Similarity column 6969 (100.0%), 553.48 column/sec. Elapsed time 12.59 sec
17652.1s 2282 EvaluatorHoldout: Ignoring 38 ( 0.1%) Users that have less than 1 test interactions
17674.3s 2283 EvaluatorHoldout: Processed 27057 (100.0%) in 22.21 sec. Users per second: 1218
17674.7s 2284 Unable to load Cython Compute_Similarity, reverting to Python
17686.9s 2285 Similarity column 6969 (100.0%), 562.25 column/sec. Elapsed time 12.39 sec
17687.1s 2286 EvaluatorHoldout: Ignoring 32 ( 0.1%) Users that have less than 1 test interactions
17709.2s 2287 EvaluatorHoldout: Processed 27063 (100.0%) in 22.19 sec. Users per second: 1219
17709.2s 2288 [I 2025-12-07 02:13:00,098] Trial 93 finished with value: 0.21666883291435765 and parameters: {'topK': 78, 'shrink': 110, 'feature_weighting': 'TF-IDF'}. Best is trial 54 with value: 0.21706238132685302.
17709.2s 2289 
17709.2s 2290 [I 2025-12-07 02:13:00,098] Trial 93 finished with value: 0.21666883291435765 and parameters: {'topK': 78, 'shrink': 110, 'feature_weighting': 'TF-IDF'}. Best is trial 54 with value: 0.21706238132685302.
17709.3s 2291 [0.21728049855958917, 0.21605712125097498, 0.21650677458215803, 0.21725925322531955, 0.21624051695374652]
17709.7s 2292 Unable to load Cython Compute_Similarity, reverting to Python
17722.6s 2293 Similarity column 6969 (100.0%), 530.00 column/sec. Elapsed time 13.15 sec
17722.8s 2294 EvaluatorHoldout: Ignoring 48 ( 0.2%) Users that have less than 1 test interactions
17746.6s 2295 EvaluatorHoldout: Processed 27047 (100.0%) in 23.75 sec. Users per second: 1139
17747.0s 2296 Unable to load Cython Compute_Similarity, reverting to Python
17760.0s 2297 Similarity column 6969 (100.0%), 529.34 column/sec. Elapsed time 13.17 sec
17760.2s 2298 EvaluatorHoldout: Ignoring 29 ( 0.1%) Users that have less than 1 test interactions
17783.9s 2299 EvaluatorHoldout: Processed 27066 (100.0%) in 23.75 sec. Users per second: 1139
17784.3s 2300 Unable to load Cython Compute_Similarity, reverting to Python
17797.6s 2301 Similarity column 6969 (100.0%), 519.15 column/sec. Elapsed time 13.42 sec
17797.8s 2302 EvaluatorHoldout: Ignoring 42 ( 0.2%) Users that have less than 1 test interactions
17820.8s 2303 EvaluatorHoldout: Processed 27053 (100.0%) in 23.03 sec. Users per second: 1174
17821.2s 2304 Unable to load Cython Compute_Similarity, reverting to Python
17834.2s 2305 Similarity column 6969 (100.0%), 528.32 column/sec. Elapsed time 13.19 sec
17834.4s 2306 EvaluatorHoldout: Ignoring 38 ( 0.1%) Users that have less than 1 test interactions
17858.1s 2307 EvaluatorHoldout: Processed 27057 (100.0%) in 23.77 sec. Users per second: 1138
17858.6s 2308 Unable to load Cython Compute_Similarity, reverting to Python
17872.6s 2309 Similarity column 6969 (100.0%), 490.69 column/sec. Elapsed time 14.20 sec
17872.8s 2310 EvaluatorHoldout: Ignoring 32 ( 0.1%) Users that have less than 1 test interactions
17897.2s 2311 EvaluatorHoldout: Processed 27063 (100.0%) in 24.41 sec. Users per second: 1108
17897.2s 2312 [I 2025-12-07 02:16:08,039] Trial 94 finished with value: 0.21682079873144816 and parameters: {'topK': 112, 'shrink': 67, 'feature_weighting': 'TF-IDF'}. Best is trial 54 with value: 0.21706238132685302.
17897.2s 2313 
17897.2s 2314 [I 2025-12-07 02:16:08,039] Trial 94 finished with value: 0.21682079873144816 and parameters: {'topK': 112, 'shrink': 67, 'feature_weighting': 'TF-IDF'}. Best is trial 54 with value: 0.21706238132685302.
17897.3s 2315 [0.2169684235063089, 0.21693105809199176, 0.21626321816506353, 0.21788583550748306, 0.21605545838639356]
17897.7s 2316 Unable to load Cython Compute_Similarity, reverting to Python
17911.6s 2317 Similarity column 6969 (100.0%), 494.06 column/sec. Elapsed time 14.11 sec
17911.8s 2318 EvaluatorHoldout: Ignoring 48 ( 0.2%) Users that have less than 1 test interactions
17934.3s 2319 EvaluatorHoldout: Processed 27047 (100.0%) in 22.51 sec. Users per second: 1201
17934.7s 2320 Unable to load Cython Compute_Similarity, reverting to Python
17947.4s 2321 Similarity column 6969 (100.0%), 541.12 column/sec. Elapsed time 12.88 sec
17947.6s 2322 EvaluatorHoldout: Ignoring 29 ( 0.1%) Users that have less than 1 test interactions
17970.7s 2323 EvaluatorHoldout: Processed 27066 (100.0%) in 23.16 sec. Users per second: 1169
17971.2s 2324 Unable to load Cython Compute_Similarity, reverting to Python
17984.2s 2325 Similarity column 6969 (100.0%), 528.17 column/sec. Elapsed time 13.19 sec
17984.4s 2326 EvaluatorHoldout: Ignoring 42 ( 0.2%) Users that have less than 1 test interactions
18006.9s 2327 EvaluatorHoldout: Processed 27053 (100.0%) in 22.60 sec. Users per second: 1197
18007.4s 2328 Unable to load Cython Compute_Similarity, reverting to Python
18020.2s 2329 Similarity column 6969 (100.0%), 535.37 column/sec. Elapsed time 13.02 sec
18020.4s 2330 EvaluatorHoldout: Ignoring 38 ( 0.1%) Users that have less than 1 test interactions
18042.8s 2331 EvaluatorHoldout: Processed 27057 (100.0%) in 22.45 sec. Users per second: 1205
18043.3s 2332 Unable to load Cython Compute_Similarity, reverting to Python
18055.7s 2333 Similarity column 6969 (100.0%), 551.40 column/sec. Elapsed time 12.64 sec
18055.9s 2334 EvaluatorHoldout: Ignoring 32 ( 0.1%) Users that have less than 1 test interactions
18078.1s 2335 EvaluatorHoldout: Processed 27063 (100.0%) in 22.21 sec. Users per second: 1219
18078.1s 2336 [I 2025-12-07 02:19:08,933] Trial 95 finished with value: 0.217029301096994 and parameters: {'topK': 92, 'shrink': 42, 'feature_weighting': 'TF-IDF'}. Best is trial 54 with value: 0.21706238132685302.
18078.1s 2337 
18078.1s 2338 [I 2025-12-07 02:19:08,933] Trial 95 finished with value: 0.217029301096994 and parameters: {'topK': 92, 'shrink': 42, 'feature_weighting': 'TF-IDF'}. Best is trial 54 with value: 0.21706238132685302.
18078.2s 2339 [0.21738570949257366, 0.21739099566628148, 0.21657321075373148, 0.21771936987683063, 0.21607721969555288]
18078.5s 2340 Unable to load Cython Compute_Similarity, reverting to Python
18093.4s 2341 Similarity column 6969 (100.0%), 463.52 column/sec. Elapsed time 15.04 sec
18093.6s 2342 EvaluatorHoldout: Ignoring 48 ( 0.2%) Users that have less than 1 test interactions
18124.1s 2343 EvaluatorHoldout: Processed 27047 (100.0%) in 30.51 sec. Users per second: 887
18124.5s 2344 Unable to load Cython Compute_Similarity, reverting to Python
18139.1s 2345 Similarity column 6969 (100.0%), 471.03 column/sec. Elapsed time 14.80 sec
18139.3s 2346 EvaluatorHoldout: Ignoring 29 ( 0.1%) Users that have less than 1 test interactions
18170.2s 2347 EvaluatorHoldout: Processed 27066 (100.0%) in 30.88 sec. Users per second: 877
18170.7s 2348 Unable to load Cython Compute_Similarity, reverting to Python
18185.7s 2349 Similarity column 6969 (100.0%), 457.50 column/sec. Elapsed time 15.23 sec
18185.9s 2350 EvaluatorHoldout: Ignoring 42 ( 0.2%) Users that have less than 1 test interactions
18216.8s 2351 EvaluatorHoldout: Processed 27053 (100.0%) in 30.82 sec. Users per second: 878
18217.2s 2352 Unable to load Cython Compute_Similarity, reverting to Python
18233.1s 2353 Similarity column 6969 (100.0%), 431.74 column/sec. Elapsed time 16.14 sec
18233.3s 2354 EvaluatorHoldout: Ignoring 38 ( 0.1%) Users that have less than 1 test interactions
18264.2s 2355 EvaluatorHoldout: Processed 27057 (100.0%) in 30.77 sec. Users per second: 879
18264.6s 2356 Unable to load Cython Compute_Similarity, reverting to Python
18279.7s 2357 Similarity column 6969 (100.0%), 455.83 column/sec. Elapsed time 15.29 sec
18279.9s 2358 EvaluatorHoldout: Ignoring 32 ( 0.1%) Users that have less than 1 test interactions
18310.4s 2359 EvaluatorHoldout: Processed 27063 (100.0%) in 30.45 sec. Users per second: 889
18310.4s 2360 [I 2025-12-07 02:23:01,204] Trial 96 finished with value: 0.21086179092525015 and parameters: {'topK': 400, 'shrink': 1, 'feature_weighting': 'TF-IDF'}. Best is trial 54 with value: 0.21706238132685302.
18310.4s 2361 
18310.4s 2362 [I 2025-12-07 02:23:01,204] Trial 96 finished with value: 0.21086179092525015 and parameters: {'topK': 400, 'shrink': 1, 'feature_weighting': 'TF-IDF'}. Best is trial 54 with value: 0.21706238132685302.
18310.4s 2363 [0.21160182424484256, 0.21051019449536904, 0.20994926176060832, 0.21154004874916815, 0.21070762537626275]
18310.8s 2364 Unable to load Cython Compute_Similarity, reverting to Python
18323.6s 2365 Similarity column 6969 (100.0%), 537.33 column/sec. Elapsed time 12.97 sec
18323.8s 2366 EvaluatorHoldout: Ignoring 48 ( 0.2%) Users that have less than 1 test interactions
18347.8s 2367 EvaluatorHoldout: Processed 27047 (100.0%) in 24.09 sec. Users per second: 1123
18348.3s 2368 Unable to load Cython Compute_Similarity, reverting to Python
18360.5s 2369 Similarity column 6969 (100.0%), 562.09 column/sec. Elapsed time 12.40 sec
18360.7s 2370 EvaluatorHoldout: Ignoring 29 ( 0.1%) Users that have less than 1 test interactions
18384.6s 2371 EvaluatorHoldout: Processed 27066 (100.0%) in 23.96 sec. Users per second: 1130
18385.0s 2372 Unable to load Cython Compute_Similarity, reverting to Python
18396.6s 2373 Similarity column 6969 (100.0%), 591.07 column/sec. Elapsed time 11.79 sec
18396.8s 2374 EvaluatorHoldout: Ignoring 42 ( 0.2%) Users that have less than 1 test interactions
18420.3s 2375 EvaluatorHoldout: Processed 27053 (100.0%) in 23.47 sec. Users per second: 1153
18420.7s 2376 Unable to load Cython Compute_Similarity, reverting to Python
18432.1s 2377 Similarity column 6969 (100.0%), 598.94 column/sec. Elapsed time 11.64 sec
18432.3s 2378 EvaluatorHoldout: Ignoring 38 ( 0.1%) Users that have less than 1 test interactions
18455.7s 2379 EvaluatorHoldout: Processed 27057 (100.0%) in 23.36 sec. Users per second: 1158
18456.1s 2380 Unable to load Cython Compute_Similarity, reverting to Python
18467.4s 2381 Similarity column 6969 (100.0%), 603.86 column/sec. Elapsed time 11.54 sec
18467.6s 2382 EvaluatorHoldout: Ignoring 32 ( 0.1%) Users that have less than 1 test interactions
18491.1s 2383 EvaluatorHoldout: Processed 27063 (100.0%) in 23.46 sec. Users per second: 1154
18491.1s 2384 [I 2025-12-07 02:26:01,908] Trial 97 finished with value: 0.2161105232965133 and parameters: {'topK': 129, 'shrink': 156, 'feature_weighting': 'TF-IDF'}. Best is trial 54 with value: 0.21706238132685302.
18491.1s 2385 
18491.1s 2386 [I 2025-12-07 02:26:01,908] Trial 97 finished with value: 0.2161105232965133 and parameters: {'topK': 129, 'shrink': 156, 'feature_weighting': 'TF-IDF'}. Best is trial 54 with value: 0.21706238132685302.
18491.1s 2387 [0.21580692771094304, 0.21620256802596313, 0.2157691664759231, 0.2168168071821133, 0.215957147087624]
18491.5s 2388 Unable to load Cython Compute_Similarity, reverting to Python
18502.8s 2389 Similarity column 6969 (100.0%), 607.81 column/sec. Elapsed time 11.47 sec
18503.0s 2390 EvaluatorHoldout: Ignoring 48 ( 0.2%) Users that have less than 1 test interactions
18524.1s 2391 EvaluatorHoldout: Processed 27047 (100.0%) in 21.12 sec. Users per second: 1280
18524.5s 2392 Unable to load Cython Compute_Similarity, reverting to Python
18535.7s 2393 Similarity column 6969 (100.0%), 608.11 column/sec. Elapsed time 11.46 sec
18535.9s 2394 EvaluatorHoldout: Ignoring 29 ( 0.1%) Users that have less than 1 test interactions
18557.5s 2395 EvaluatorHoldout: Processed 27066 (100.0%) in 21.63 sec. Users per second: 1251
18557.9s 2396 Unable to load Cython Compute_Similarity, reverting to Python
18569.2s 2397 Similarity column 6969 (100.0%), 608.28 column/sec. Elapsed time 11.46 sec
18569.4s 2398 EvaluatorHoldout: Ignoring 42 ( 0.2%) Users that have less than 1 test interactions
18590.9s 2399 EvaluatorHoldout: Processed 27053 (100.0%) in 21.52 sec. Users per second: 1257
18591.3s 2400 Unable to load Cython Compute_Similarity, reverting to Python
18602.5s 2401 Similarity column 6969 (100.0%), 608.95 column/sec. Elapsed time 11.44 sec
18602.7s 2402 EvaluatorHoldout: Ignoring 38 ( 0.1%) Users that have less than 1 test interactions
18624.3s 2403 EvaluatorHoldout: Processed 27057 (100.0%) in 21.58 sec. Users per second: 1254
18624.7s 2404 Unable to load Cython Compute_Similarity, reverting to Python
18636.0s 2405 Similarity column 6969 (100.0%), 604.92 column/sec. Elapsed time 11.52 sec
18636.2s 2406 EvaluatorHoldout: Ignoring 32 ( 0.1%) Users that have less than 1 test interactions
18658.1s 2407 EvaluatorHoldout: Processed 27063 (100.0%) in 21.90 sec. Users per second: 1236
18658.1s 2408 [I 2025-12-07 02:28:48,940] Trial 98 finished with value: 0.216957479023566 and parameters: {'topK': 92, 'shrink': 86, 'feature_weighting': 'TF-IDF'}. Best is trial 54 with value: 0.21706238132685302.
18658.1s 2409 
18658.1s 2410 [I 2025-12-07 02:28:48,940] Trial 98 finished with value: 0.216957479023566 and parameters: {'topK': 92, 'shrink': 86, 'feature_weighting': 'TF-IDF'}. Best is trial 54 with value: 0.21706238132685302.
18658.2s 2411 [0.21737524784850087, 0.21729141487259043, 0.21651602138883047, 0.21758876166165142, 0.21601594934625673]
18658.5s 2412 Unable to load Cython Compute_Similarity, reverting to Python
18670.1s 2413 Similarity column 6969 (100.0%), 589.48 column/sec. Elapsed time 11.82 sec
18670.3s 2414 EvaluatorHoldout: Ignoring 48 ( 0.2%) Users that have less than 1 test interactions
18692.1s 2415 EvaluatorHoldout: Processed 27047 (100.0%) in 21.77 sec. Users per second: 1243
18692.5s 2416 Unable to load Cython Compute_Similarity, reverting to Python
18703.5s 2417 Similarity column 6969 (100.0%), 621.88 column/sec. Elapsed time 11.21 sec
18703.7s 2418 EvaluatorHoldout: Ignoring 29 ( 0.1%) Users that have less than 1 test interactions
18726.0s 2419 EvaluatorHoldout: Processed 27066 (100.0%) in 22.34 sec. Users per second: 1212
18726.4s 2420 Unable to load Cython Compute_Similarity, reverting to Python
18738.2s 2421 Similarity column 6969 (100.0%), 581.64 column/sec. Elapsed time 11.98 sec
18738.4s 2422 EvaluatorHoldout: Ignoring 42 ( 0.2%) Users that have less than 1 test interactions
18761.4s 2423 EvaluatorHoldout: Processed 27053 (100.0%) in 22.99 sec. Users per second: 1177
18761.8s 2424 Unable to load Cython Compute_Similarity, reverting to Python
18774.8s 2425 Similarity column 6969 (100.0%), 527.39 column/sec. Elapsed time 13.21 sec
18775.0s 2426 EvaluatorHoldout: Ignoring 38 ( 0.1%) Users that have less than 1 test interactions
18798.2s 2427 EvaluatorHoldout: Processed 27057 (100.0%) in 23.21 sec. Users per second: 1166
18798.7s 2428 Unable to load Cython Compute_Similarity, reverting to Python
18811.7s 2429 Similarity column 6969 (100.0%), 528.16 column/sec. Elapsed time 13.19 sec
18811.9s 2430 EvaluatorHoldout: Ignoring 32 ( 0.1%) Users that have less than 1 test interactions
18834.8s 2431 EvaluatorHoldout: Processed 27063 (100.0%) in 22.90 sec. Users per second: 1182
18834.8s 2432 [I 2025-12-07 02:31:45,626] Trial 99 finished with value: 0.21686664162593114 and parameters: {'topK': 104, 'shrink': 51, 'feature_weighting': 'TF-IDF'}. Best is trial 54 with value: 0.21706238132685302.
18834.8s 2433 
