13992.8s 1786 [I 2025-12-07 01:11:03,678] Trial 72 finished with value: 0.21691169630498966 and parameters: {'topK': 69, 'shrink': 25, 'feature_weighting': 'TF-IDF'}. Best is trial 54 with value: 0.21706238132685302.
13992.9s 1787 [0.2172888956100197, 0.21658700009069837, 0.21636739215152206, 0.2178493539200161, 0.21646583975269207]
13993.3s 1788 Unable to load Cython Compute_Similarity, reverting to Python
14005.4s 1789 Similarity column 6969 (100.0%), 562.52 column/sec. Elapsed time 12.39 sec
14005.6s 1790 EvaluatorHoldout: Ignoring 48 ( 0.2%) Users that have less than 1 test interactions
14028.1s 1791 EvaluatorHoldout: Processed 27047 (100.0%) in 22.55 sec. Users per second: 1199
14028.6s 1792 Unable to load Cython Compute_Similarity, reverting to Python
14040.8s 1793 Similarity column 6969 (100.0%), 559.63 column/sec. Elapsed time 12.45 sec
14041.0s 1794 EvaluatorHoldout: Ignoring 29 ( 0.1%) Users that have less than 1 test interactions
14064.2s 1795 EvaluatorHoldout: Processed 27066 (100.0%) in 23.24 sec. Users per second: 1165
14064.7s 1796 Unable to load Cython Compute_Similarity, reverting to Python
14077.0s 1797 Similarity column 6969 (100.0%), 556.49 column/sec. Elapsed time 12.52 sec
14077.2s 1798 EvaluatorHoldout: Ignoring 42 ( 0.2%) Users that have less than 1 test interactions
14100.1s 1799 EvaluatorHoldout: Processed 27053 (100.0%) in 22.89 sec. Users per second: 1182
14100.5s 1800 Unable to load Cython Compute_Similarity, reverting to Python
14112.7s 1801 Similarity column 6969 (100.0%), 560.00 column/sec. Elapsed time 12.44 sec
14112.9s 1802 EvaluatorHoldout: Ignoring 38 ( 0.1%) Users that have less than 1 test interactions
14135.2s 1803 EvaluatorHoldout: Processed 27057 (100.0%) in 22.28 sec. Users per second: 1214
14135.6s 1804 Unable to load Cython Compute_Similarity, reverting to Python
14147.2s 1805 Similarity column 6969 (100.0%), 589.45 column/sec. Elapsed time 11.82 sec
14147.4s 1806 EvaluatorHoldout: Ignoring 32 ( 0.1%) Users that have less than 1 test interactions
14169.3s 1807 EvaluatorHoldout: Processed 27063 (100.0%) in 21.95 sec. Users per second: 1233
14169.3s 1808 [I 2025-12-07 01:14:00,208] Trial 73 finished with value: 0.21674627596294577 and parameters: {'topK': 109, 'shrink': 58, 'feature_weighting': 'TF-IDF'}. Best is trial 54 with value: 0.21706238132685302.
14169.3s 1809 
14169.3s 1810 [I 2025-12-07 01:14:00,208] Trial 73 finished with value: 0.21674627596294577 and parameters: {'topK': 109, 'shrink': 58, 'feature_weighting': 'TF-IDF'}. Best is trial 54 with value: 0.21706238132685302.
14169.4s 1811 [0.21692766038602407, 0.2168234512889911, 0.21636689756625654, 0.21762205915894225, 0.21599131141451486]
14169.8s 1812 Unable to load Cython Compute_Similarity, reverting to Python
14181.6s 1813 Similarity column 6969 (100.0%), 579.36 column/sec. Elapsed time 12.03 sec
14181.8s 1814 EvaluatorHoldout: Ignoring 48 ( 0.2%) Users that have less than 1 test interactions
14204.8s 1815 EvaluatorHoldout: Processed 27047 (100.0%) in 22.96 sec. Users per second: 1178
14205.1s 1816 Unable to load Cython Compute_Similarity, reverting to Python
14216.6s 1817 Similarity column 6969 (100.0%), 598.79 column/sec. Elapsed time 11.64 sec
14216.8s 1818 EvaluatorHoldout: Ignoring 29 ( 0.1%) Users that have less than 1 test interactions
14239.2s 1819 EvaluatorHoldout: Processed 27066 (100.0%) in 22.48 sec. Users per second: 1204
14239.6s 1820 Unable to load Cython Compute_Similarity, reverting to Python
14251.7s 1821 Similarity column 6969 (100.0%), 568.18 column/sec. Elapsed time 12.27 sec
14251.9s 1822 EvaluatorHoldout: Ignoring 42 ( 0.2%) Users that have less than 1 test interactions
14275.5s 1823 EvaluatorHoldout: Processed 27053 (100.0%) in 23.63 sec. Users per second: 1145
14275.9s 1824 Unable to load Cython Compute_Similarity, reverting to Python
14288.8s 1825 Similarity column 6969 (100.0%), 531.88 column/sec. Elapsed time 13.10 sec
14289.0s 1826 EvaluatorHoldout: Ignoring 38 ( 0.1%) Users that have less than 1 test interactions
14313.0s 1827 EvaluatorHoldout: Processed 27057 (100.0%) in 23.97 sec. Users per second: 1129
14313.4s 1828 Unable to load Cython Compute_Similarity, reverting to Python
14326.5s 1829 Similarity column 6969 (100.0%), 526.87 column/sec. Elapsed time 13.23 sec
14326.7s 1830 EvaluatorHoldout: Ignoring 32 ( 0.1%) Users that have less than 1 test interactions
14350.2s 1831 EvaluatorHoldout: Processed 27063 (100.0%) in 23.56 sec. Users per second: 1149
14350.2s 1832 [I 2025-12-07 01:17:01,049] Trial 74 finished with value: 0.21651133189880895 and parameters: {'topK': 133, 'shrink': 2, 'feature_weighting': 'TF-IDF'}. Best is trial 54 with value: 0.21706238132685302.
14350.2s 1833 
14350.2s 1834 [I 2025-12-07 01:17:01,049] Trial 74 finished with value: 0.21651133189880895 and parameters: {'topK': 133, 'shrink': 2, 'feature_weighting': 'TF-IDF'}. Best is trial 54 with value: 0.21706238132685302.
14350.3s 1835 [0.2162130979235998, 0.2165143020181089, 0.21648775566200296, 0.216995344188667, 0.21634615970166607]
14350.6s 1836 Unable to load Cython Compute_Similarity, reverting to Python
14363.4s 1837 Similarity column 6969 (100.0%), 537.56 column/sec. Elapsed time 12.96 sec
14363.6s 1838 EvaluatorHoldout: Ignoring 48 ( 0.2%) Users that have less than 1 test interactions
14385.9s 1839 EvaluatorHoldout: Processed 27047 (100.0%) in 22.30 sec. Users per second: 1213
14386.3s 1840 Unable to load Cython Compute_Similarity, reverting to Python
14398.5s 1841 Similarity column 6969 (100.0%), 561.19 column/sec. Elapsed time 12.42 sec
14398.7s 1842 EvaluatorHoldout: Ignoring 29 ( 0.1%) Users that have less than 1 test interactions
14420.5s 1843 EvaluatorHoldout: Processed 27066 (100.0%) in 21.83 sec. Users per second: 1240
14420.9s 1844 Unable to load Cython Compute_Similarity, reverting to Python
14433.5s 1845 Similarity column 6969 (100.0%), 546.22 column/sec. Elapsed time 12.76 sec
14433.7s 1846 EvaluatorHoldout: Ignoring 42 ( 0.2%) Users that have less than 1 test interactions
14456.1s 1847 EvaluatorHoldout: Processed 27053 (100.0%) in 22.44 sec. Users per second: 1206
14456.5s 1848 Unable to load Cython Compute_Similarity, reverting to Python
14468.3s 1849 Similarity column 6969 (100.0%), 583.29 column/sec. Elapsed time 11.95 sec
14468.5s 1850 EvaluatorHoldout: Ignoring 38 ( 0.1%) Users that have less than 1 test interactions
14490.1s 1851 EvaluatorHoldout: Processed 27057 (100.0%) in 21.64 sec. Users per second: 1250
14490.5s 1852 Unable to load Cython Compute_Similarity, reverting to Python
14502.3s 1853 Similarity column 6969 (100.0%), 581.87 column/sec. Elapsed time 11.98 sec
14502.5s 1854 EvaluatorHoldout: Ignoring 32 ( 0.1%) Users that have less than 1 test interactions
14523.7s 1855 EvaluatorHoldout: Processed 27063 (100.0%) in 21.20 sec. Users per second: 1276
14523.7s 1856 [I 2025-12-07 01:19:54,525] Trial 75 finished with value: 0.21677759048358514 and parameters: {'topK': 79, 'shrink': 103, 'feature_weighting': 'TF-IDF'}. Best is trial 54 with value: 0.21706238132685302.
14523.7s 1857 
14523.7s 1858 [I 2025-12-07 01:19:54,525] Trial 75 finished with value: 0.21677759048358514 and parameters: {'topK': 79, 'shrink': 103, 'feature_weighting': 'TF-IDF'}. Best is trial 54 with value: 0.21706238132685302.
14523.7s 1859 [0.21715990891330525, 0.2164040931780148, 0.21660253517436973, 0.21735476067709153, 0.2163666544751443]
14523.7s 1860 Unable to load Cython Compute_Similarity, reverting to Python
14535.8s 1861 Similarity column 6969 (100.0%), 578.99 column/sec. Elapsed time 12.04 sec
14536.0s 1862 EvaluatorHoldout: Ignoring 48 ( 0.2%) Users that have less than 1 test interactions
14559.7s 1863 EvaluatorHoldout: Processed 27047 (100.0%) in 23.78 sec. Users per second: 1137
14559.8s 1864 Unable to load Cython Compute_Similarity, reverting to Python
14571.7s 1865 Similarity column 6969 (100.0%), 582.48 column/sec. Elapsed time 11.96 sec
14571.9s 1866 EvaluatorHoldout: Ignoring 29 ( 0.1%) Users that have less than 1 test interactions
14595.5s 1867 EvaluatorHoldout: Processed 27066 (100.0%) in 23.65 sec. Users per second: 1145
14595.6s 1868 Unable to load Cython Compute_Similarity, reverting to Python
14607.9s 1869 Similarity column 6969 (100.0%), 565.08 column/sec. Elapsed time 12.33 sec
14608.1s 1870 EvaluatorHoldout: Ignoring 42 ( 0.2%) Users that have less than 1 test interactions
14632.0s 1871 EvaluatorHoldout: Processed 27053 (100.0%) in 23.89 sec. Users per second: 1133
14632.1s 1872 Unable to load Cython Compute_Similarity, reverting to Python
14644.0s 1873 Similarity column 6969 (100.0%), 581.86 column/sec. Elapsed time 11.98 sec
14644.2s 1874 EvaluatorHoldout: Ignoring 38 ( 0.1%) Users that have less than 1 test interactions
14668.5s 1875 EvaluatorHoldout: Processed 27057 (100.0%) in 24.30 sec. Users per second: 1113
14668.6s 1876 Unable to load Cython Compute_Similarity, reverting to Python
14681.2s 1877 Similarity column 6969 (100.0%), 551.51 column/sec. Elapsed time 12.64 sec
14681.4s 1878 EvaluatorHoldout: Ignoring 32 ( 0.1%) Users that have less than 1 test interactions
14705.9s 1879 EvaluatorHoldout: Processed 27063 (100.0%) in 24.50 sec. Users per second: 1105
14705.9s 1880 [I 2025-12-07 01:22:56,722] Trial 76 finished with value: 0.20976740032794208 and parameters: {'topK': 163, 'shrink': 29, 'feature_weighting': 'none'}. Best is trial 54 with value: 0.21706238132685302.
14705.9s 1881 
14705.9s 1882 [I 2025-12-07 01:22:56,722] Trial 76 finished with value: 0.20976740032794208 and parameters: {'topK': 163, 'shrink': 29, 'feature_weighting': 'none'}. Best is trial 54 with value: 0.21706238132685302.
14706.0s 1883 [0.20994843634054083, 0.20976025690808325, 0.20907582537699973, 0.21039183165624575, 0.20966065135784082]
14706.3s 1884 Unable to load Cython Compute_Similarity, reverting to Python
14718.3s 1885 Similarity column 6969 (100.0%), 570.89 column/sec. Elapsed time 12.21 sec
14718.5s 1886 EvaluatorHoldout: Ignoring 48 ( 0.2%) Users that have less than 1 test interactions
14740.1s 1887 EvaluatorHoldout: Processed 27047 (100.0%) in 21.65 sec. Users per second: 1249
14740.6s 1888 Unable to load Cython Compute_Similarity, reverting to Python
14752.1s 1889 Similarity column 6969 (100.0%), 598.28 column/sec. Elapsed time 11.65 sec
14752.3s 1890 EvaluatorHoldout: Ignoring 29 ( 0.1%) Users that have less than 1 test interactions
14773.4s 1891 EvaluatorHoldout: Processed 27066 (100.0%) in 21.22 sec. Users per second: 1276
14773.9s 1892 Unable to load Cython Compute_Similarity, reverting to Python
14784.9s 1893 Similarity column 6969 (100.0%), 620.78 column/sec. Elapsed time 11.23 sec
14785.1s 1894 EvaluatorHoldout: Ignoring 42 ( 0.2%) Users that have less than 1 test interactions
14805.7s 1895 EvaluatorHoldout: Processed 27053 (100.0%) in 20.70 sec. Users per second: 1307
14806.2s 1896 Unable to load Cython Compute_Similarity, reverting to Python
14817.1s 1897 Similarity column 6969 (100.0%), 626.47 column/sec. Elapsed time 11.12 sec
14817.3s 1898 EvaluatorHoldout: Ignoring 38 ( 0.1%) Users that have less than 1 test interactions
14838.5s 1899 EvaluatorHoldout: Processed 27057 (100.0%) in 21.25 sec. Users per second: 1273
14839.0s 1900 Unable to load Cython Compute_Similarity, reverting to Python
14849.6s 1901 Similarity column 6969 (100.0%), 640.19 column/sec. Elapsed time 10.89 sec
14849.8s 1902 EvaluatorHoldout: Ignoring 32 ( 0.1%) Users that have less than 1 test interactions
14870.9s 1903 EvaluatorHoldout: Processed 27063 (100.0%) in 21.14 sec. Users per second: 1280
14870.9s 1904 [I 2025-12-07 01:25:41,811] Trial 77 finished with value: 0.19739594326075247 and parameters: {'topK': 95, 'shrink': 75, 'feature_weighting': 'BM25'}. Best is trial 54 with value: 0.21706238132685302.
14870.9s 1905 
14870.9s 1906 [I 2025-12-07 01:25:41,811] Trial 77 finished with value: 0.19739594326075247 and parameters: {'topK': 95, 'shrink': 75, 'feature_weighting': 'BM25'}. Best is trial 54 with value: 0.21706238132685302.
14871.0s 1907 [0.19822957411036948, 0.1980126712665586, 0.19651299188093904, 0.19743834699143867, 0.19678613205445644]
14871.4s 1908 Unable to load Cython Compute_Similarity, reverting to Python
14882.7s 1909 Similarity column 6969 (100.0%), 603.08 column/sec. Elapsed time 11.56 sec
14882.9s 1910 EvaluatorHoldout: Ignoring 48 ( 0.2%) Users that have less than 1 test interactions
14906.6s 1911 EvaluatorHoldout: Processed 27047 (100.0%) in 23.74 sec. Users per second: 1139
14907.1s 1912 Unable to load Cython Compute_Similarity, reverting to Python
14918.4s 1913 Similarity column 6969 (100.0%), 603.68 column/sec. Elapsed time 11.54 sec
14918.6s 1914 EvaluatorHoldout: Ignoring 29 ( 0.1%) Users that have less than 1 test interactions
14942.3s 1915 EvaluatorHoldout: Processed 27066 (100.0%) in 23.77 sec. Users per second: 1139
14942.8s 1916 Unable to load Cython Compute_Similarity, reverting to Python
14955.0s 1917 Similarity column 6969 (100.0%), 560.80 column/sec. Elapsed time 12.43 sec
14955.2s 1918 EvaluatorHoldout: Ignoring 42 ( 0.2%) Users that have less than 1 test interactions
14978.8s 1919 EvaluatorHoldout: Processed 27053 (100.0%) in 23.69 sec. Users per second: 1142
14979.3s 1920 Unable to load Cython Compute_Similarity, reverting to Python
14990.7s 1921 Similarity column 6969 (100.0%), 598.16 column/sec. Elapsed time 11.65 sec
14990.9s 1922 EvaluatorHoldout: Ignoring 38 ( 0.1%) Users that have less than 1 test interactions
15015.0s 1923 EvaluatorHoldout: Processed 27057 (100.0%) in 24.12 sec. Users per second: 1122
15015.4s 1924 Unable to load Cython Compute_Similarity, reverting to Python
15026.9s 1925 Similarity column 6969 (100.0%), 595.92 column/sec. Elapsed time 11.69 sec
15027.1s 1926 EvaluatorHoldout: Ignoring 32 ( 0.1%) Users that have less than 1 test interactions
15051.4s 1927 EvaluatorHoldout: Processed 27063 (100.0%) in 24.31 sec. Users per second: 1113
15051.4s 1928 [I 2025-12-07 01:28:42,261] Trial 78 finished with value: 0.2160498594131 and parameters: {'topK': 147, 'shrink': 143, 'feature_weighting': 'TF-IDF'}. Best is trial 54 with value: 0.21706238132685302.
15051.4s 1929 
15051.4s 1930 [I 2025-12-07 01:28:42,261] Trial 78 finished with value: 0.2160498594131 and parameters: {'topK': 147, 'shrink': 143, 'feature_weighting': 'TF-IDF'}. Best is trial 54 with value: 0.21706238132685302.
15051.5s 1931 [0.21649790204496125, 0.2158724611262344, 0.21543252954775977, 0.21680049432868093, 0.2156459100178637]
15051.8s 1932 Unable to load Cython Compute_Similarity, reverting to Python
15063.5s 1933 Similarity column 6969 (100.0%), 590.56 column/sec. Elapsed time 11.80 sec
15063.7s 1934 EvaluatorHoldout: Ignoring 48 ( 0.2%) Users that have less than 1 test interactions
15088.7s 1935 EvaluatorHoldout: Processed 27047 (100.0%) in 25.14 sec. Users per second: 1076
15089.2s 1936 Unable to load Cython Compute_Similarity, reverting to Python
15100.9s 1937 Similarity column 6969 (100.0%), 585.56 column/sec. Elapsed time 11.90 sec
15101.1s 1938 EvaluatorHoldout: Ignoring 29 ( 0.1%) Users that have less than 1 test interactions
15126.2s 1939 EvaluatorHoldout: Processed 27066 (100.0%) in 25.16 sec. Users per second: 1076
15126.6s 1940 Unable to load Cython Compute_Similarity, reverting to Python
15138.6s 1941 Similarity column 6969 (100.0%), 572.89 column/sec. Elapsed time 12.16 sec
15138.8s 1942 EvaluatorHoldout: Ignoring 42 ( 0.2%) Users that have less than 1 test interactions
15164.9s 1943 EvaluatorHoldout: Processed 27053 (100.0%) in 26.19 sec. Users per second: 1033
15165.4s 1944 Unable to load Cython Compute_Similarity, reverting to Python
15177.9s 1945 Similarity column 6969 (100.0%), 546.17 column/sec. Elapsed time 12.76 sec
15178.1s 1946 EvaluatorHoldout: Ignoring 38 ( 0.1%) Users that have less than 1 test interactions
15203.7s 1947 EvaluatorHoldout: Processed 27057 (100.0%) in 25.60 sec. Users per second: 1057
15204.1s 1948 Unable to load Cython Compute_Similarity, reverting to Python
15216.5s 1949 Similarity column 6969 (100.0%), 553.42 column/sec. Elapsed time 12.59 sec
15216.7s 1950 EvaluatorHoldout: Ignoring 32 ( 0.1%) Users that have less than 1 test interactions
15242.3s 1951 EvaluatorHoldout: Processed 27063 (100.0%) in 25.64 sec. Users per second: 1055
15242.3s 1952 [I 2025-12-07 01:31:53,194] Trial 79 finished with value: 0.21584081701309837 and parameters: {'topK': 122, 'shrink': 536, 'feature_weighting': 'TF-IDF'}. Best is trial 54 with value: 0.21706238132685302.
15242.3s 1953 
15242.3s 1954 [I 2025-12-07 01:31:53,194] Trial 79 finished with value: 0.21584081701309837 and parameters: {'topK': 122, 'shrink': 536, 'feature_weighting': 'TF-IDF'}. Best is trial 54 with value: 0.21706238132685302.
15242.4s 1955 [0.2159759398911581, 0.21608858937663367, 0.21533784436526132, 0.21625468991422575, 0.21554702151821295]
15242.8s 1956 Unable to load Cython Compute_Similarity, reverting to Python
15259.1s 1957 Similarity column 6969 (100.0%), 422.32 column/sec. Elapsed time 16.50 sec
15259.3s 1958 EvaluatorHoldout: Ignoring 48 ( 0.2%) Users that have less than 1 test interactions
15295.6s 1959 EvaluatorHoldout: Processed 27047 (100.0%) in 36.24 sec. Users per second: 746
15296.0s 1960 Unable to load Cython Compute_Similarity, reverting to Python
15311.7s 1961 Similarity column 6969 (100.0%), 439.25 column/sec. Elapsed time 15.87 sec
15311.9s 1962 EvaluatorHoldout: Ignoring 29 ( 0.1%) Users that have less than 1 test interactions
15348.0s 1963 EvaluatorHoldout: Processed 27066 (100.0%) in 36.06 sec. Users per second: 751
15348.4s 1964 Unable to load Cython Compute_Similarity, reverting to Python
15365.0s 1965 Similarity column 6969 (100.0%), 414.19 column/sec. Elapsed time 16.83 sec
15365.2s 1966 EvaluatorHoldout: Ignoring 42 ( 0.2%) Users that have less than 1 test interactions
15402.5s 1967 EvaluatorHoldout: Processed 27053 (100.0%) in 37.23 sec. Users per second: 727
15402.9s 1968 Unable to load Cython Compute_Similarity, reverting to Python
15419.7s 1969 Similarity column 6969 (100.0%), 411.03 column/sec. Elapsed time 16.96 sec
15419.9s 1970 EvaluatorHoldout: Ignoring 38 ( 0.1%) Users that have less than 1 test interactions
15457.1s 1971 EvaluatorHoldout: Processed 27057 (100.0%) in 37.18 sec. Users per second: 728
15457.5s 1972 Unable to load Cython Compute_Similarity, reverting to Python
15473.6s 1973 Similarity column 6969 (100.0%), 429.79 column/sec. Elapsed time 16.21 sec
15473.8s 1974 EvaluatorHoldout: Ignoring 32 ( 0.1%) Users that have less than 1 test interactions
15510.0s 1975 EvaluatorHoldout: Processed 27063 (100.0%) in 36.17 sec. Users per second: 748
15510.0s 1976 [I 2025-12-07 01:36:20,830] Trial 80 finished with value: 0.20635707572832968 and parameters: {'topK': 531, 'shrink': 632, 'feature_weighting': 'TF-IDF'}. Best is trial 54 with value: 0.21706238132685302.
15510.0s 1977 
15510.0s 1978 [I 2025-12-07 01:36:20,830] Trial 80 finished with value: 0.20635707572832968 and parameters: {'topK': 531, 'shrink': 632, 'feature_weighting': 'TF-IDF'}. Best is trial 54 with value: 0.21706238132685302.
15510.1s 1979 [0.20738334610108433, 0.20567039957326488, 0.20532875316242463, 0.20729249591595408, 0.20611038388892045]
15510.4s 1980 Unable to load Cython Compute_Similarity, reverting to Python
15522.3s 1981 Similarity column 6969 (100.0%), 575.88 column/sec. Elapsed time 12.10 sec
15522.5s 1982 EvaluatorHoldout: Ignoring 48 ( 0.2%) Users that have less than 1 test interactions
15543.0s 1983 EvaluatorHoldout: Processed 27047 (100.0%) in 20.49 sec. Users per second: 1320
15543.4s 1984 Unable to load Cython Compute_Similarity, reverting to Python
15555.0s 1985 Similarity column 6969 (100.0%), 588.80 column/sec. Elapsed time 11.84 sec
15555.2s 1986 EvaluatorHoldout: Ignoring 29 ( 0.1%) Users that have less than 1 test interactions
15575.9s 1987 EvaluatorHoldout: Processed 27066 (100.0%) in 20.70 sec. Users per second: 1308
15576.3s 1988 Unable to load Cython Compute_Similarity, reverting to Python
15588.0s 1989 Similarity column 6969 (100.0%), 587.00 column/sec. Elapsed time 11.87 sec
15588.2s 1990 EvaluatorHoldout: Ignoring 42 ( 0.2%) Users that have less than 1 test interactions
15608.8s 1991 EvaluatorHoldout: Processed 27053 (100.0%) in 20.64 sec. Users per second: 1311
15609.2s 1992 Unable to load Cython Compute_Similarity, reverting to Python
15620.5s 1993 Similarity column 6969 (100.0%), 606.85 column/sec. Elapsed time 11.48 sec
15620.7s 1994 EvaluatorHoldout: Ignoring 38 ( 0.1%) Users that have less than 1 test interactions
15640.9s 1995 EvaluatorHoldout: Processed 27057 (100.0%) in 20.27 sec. Users per second: 1335
15641.4s 1996 Unable to load Cython Compute_Similarity, reverting to Python
15652.8s 1997 Similarity column 6969 (100.0%), 600.68 column/sec. Elapsed time 11.60 sec
15653.0s 1998 EvaluatorHoldout: Ignoring 32 ( 0.1%) Users that have less than 1 test interactions
15673.6s 1999 EvaluatorHoldout: Processed 27063 (100.0%) in 20.63 sec. Users per second: 1312
15673.6s 2000 [I 2025-12-07 01:39:04,423] Trial 81 finished with value: 0.2168955594911815 and parameters: {'topK': 59, 'shrink': 21, 'feature_weighting': 'TF-IDF'}. Best is trial 54 with value: 0.21706238132685302.
15673.6s 2001 
