11422.4s 1784 [I 2025-12-07 12:04:17,843] Trial 72 finished with value: 0.24604847521983428 and parameters: {'similarity': 'tversky', 'topK': 5, 'shrink': 499, 'tversky_alpha': 0.24862935210749953, 'tversky_beta': 1.6406819204005911}. Best is trial 72 with value: 0.24604847521983428.
11422.4s 1785 
11422.4s 1786 [I 2025-12-07 12:04:17,843] Trial 72 finished with value: 0.24604847521983428 and parameters: {'similarity': 'tversky', 'topK': 5, 'shrink': 499, 'tversky_alpha': 0.24862935210749953, 'tversky_beta': 1.6406819204005911}. Best is trial 72 with value: 0.24604847521983428.
11422.5s 1787 [0.24527037676180963, 0.24653369501046327, 0.2471202084893829, 0.24544478044937984, 0.2458733153881359]
11422.8s 1788 Unable to load Cython Compute_Similarity, reverting to Python
11432.5s 1789 Similarity column 6969 (100.0%), 709.37 column/sec. Elapsed time 9.82 sec
11432.7s 1790 EvaluatorHoldout: Ignoring 33 ( 0.1%) Users that have less than 1 test interactions
11446.8s 1791 EvaluatorHoldout: Processed 27062 (100.0%) in 14.31 sec. Users per second: 1891
11447.3s 1792 Unable to load Cython Compute_Similarity, reverting to Python
11456.8s 1793 Similarity column 6969 (100.0%), 725.14 column/sec. Elapsed time 9.61 sec
11456.9s 1794 EvaluatorHoldout: Ignoring 28 ( 0.1%) Users that have less than 1 test interactions
11471.1s 1795 EvaluatorHoldout: Processed 27067 (100.0%) in 14.38 sec. Users per second: 1883
11471.6s 1796 Unable to load Cython Compute_Similarity, reverting to Python
11481.7s 1797 Similarity column 6969 (100.0%), 679.98 column/sec. Elapsed time 10.25 sec
11481.9s 1798 EvaluatorHoldout: Ignoring 40 ( 0.1%) Users that have less than 1 test interactions
11496.3s 1799 EvaluatorHoldout: Processed 27055 (100.0%) in 14.50 sec. Users per second: 1866
11496.7s 1800 Unable to load Cython Compute_Similarity, reverting to Python
11506.4s 1801 Similarity column 6969 (100.0%), 704.80 column/sec. Elapsed time 9.89 sec
11506.6s 1802 EvaluatorHoldout: Ignoring 21 ( 0.1%) Users that have less than 1 test interactions
11520.9s 1803 EvaluatorHoldout: Processed 27074 (100.0%) in 14.46 sec. Users per second: 1872
11521.4s 1804 Unable to load Cython Compute_Similarity, reverting to Python
11530.6s 1805 Similarity column 6969 (100.0%), 748.70 column/sec. Elapsed time 9.31 sec
11530.7s 1806 EvaluatorHoldout: Ignoring 29 ( 0.1%) Users that have less than 1 test interactions
11544.9s 1807 EvaluatorHoldout: Processed 27066 (100.0%) in 14.40 sec. Users per second: 1879
11544.9s 1808 [I 2025-12-07 12:06:20,434] Trial 73 finished with value: 0.2401507982838147 and parameters: {'similarity': 'tversky', 'topK': 13, 'shrink': 508, 'tversky_alpha': 0.23475346303105615, 'tversky_beta': 1.6161766255861707}. Best is trial 72 with value: 0.24604847521983428.
11544.9s 1809 
11544.9s 1810 [I 2025-12-07 12:06:20,434] Trial 73 finished with value: 0.2401507982838147 and parameters: {'similarity': 'tversky', 'topK': 13, 'shrink': 508, 'tversky_alpha': 0.23475346303105615, 'tversky_beta': 1.6161766255861707}. Best is trial 72 with value: 0.24604847521983428.
11545.1s 1811 [0.23915140175824565, 0.24025967162776177, 0.24161998270238, 0.23970223218302392, 0.24002070314766208]
11545.4s 1812 Unable to load Cython Compute_Similarity, reverting to Python
11556.3s 1813 Similarity column 6969 (100.0%), 628.06 column/sec. Elapsed time 11.10 sec
11556.5s 1814 EvaluatorHoldout: Ignoring 33 ( 0.1%) Users that have less than 1 test interactions
11570.4s 1815 EvaluatorHoldout: Processed 27062 (100.0%) in 13.92 sec. Users per second: 1944
11570.8s 1816 Unable to load Cython Compute_Similarity, reverting to Python
11579.9s 1817 Similarity column 6969 (100.0%), 744.56 column/sec. Elapsed time 9.36 sec
11580.1s 1818 EvaluatorHoldout: Ignoring 28 ( 0.1%) Users that have less than 1 test interactions
11594.3s 1819 EvaluatorHoldout: Processed 27067 (100.0%) in 14.38 sec. Users per second: 1882
11594.8s 1820 Unable to load Cython Compute_Similarity, reverting to Python
11605.2s 1821 Similarity column 6969 (100.0%), 664.30 column/sec. Elapsed time 10.49 sec
11605.3s 1822 EvaluatorHoldout: Ignoring 40 ( 0.1%) Users that have less than 1 test interactions
11619.1s 1823 EvaluatorHoldout: Processed 27055 (100.0%) in 13.93 sec. Users per second: 1942
11619.6s 1824 Unable to load Cython Compute_Similarity, reverting to Python
11629.7s 1825 Similarity column 6969 (100.0%), 674.55 column/sec. Elapsed time 10.33 sec
11629.9s 1826 EvaluatorHoldout: Ignoring 21 ( 0.1%) Users that have less than 1 test interactions
11643.9s 1827 EvaluatorHoldout: Processed 27074 (100.0%) in 14.03 sec. Users per second: 1930
11644.3s 1828 Unable to load Cython Compute_Similarity, reverting to Python
11653.6s 1829 Similarity column 6969 (100.0%), 729.54 column/sec. Elapsed time 9.55 sec
11653.8s 1830 EvaluatorHoldout: Ignoring 29 ( 0.1%) Users that have less than 1 test interactions
11667.5s 1831 EvaluatorHoldout: Processed 27066 (100.0%) in 13.89 sec. Users per second: 1948
11667.5s 1832 [I 2025-12-07 12:08:23,064] Trial 74 finished with value: 0.2473016132765641 and parameters: {'similarity': 'tversky', 'topK': 6, 'shrink': 514, 'tversky_alpha': 0.2203323688953501, 'tversky_beta': 1.715169028384892}. Best is trial 74 with value: 0.2473016132765641.
11667.5s 1833 
11667.5s 1834 [I 2025-12-07 12:08:23,064] Trial 74 finished with value: 0.2473016132765641 and parameters: {'similarity': 'tversky', 'topK': 6, 'shrink': 514, 'tversky_alpha': 0.2203323688953501, 'tversky_beta': 1.715169028384892}. Best is trial 74 with value: 0.2473016132765641.
11667.7s 1835 [0.24651500695883918, 0.24804258765669476, 0.2485769640089327, 0.2465123518102721, 0.24686115594808183]
11668.0s 1836 Unable to load Cython Compute_Similarity, reverting to Python
11677.3s 1837 Similarity column 6969 (100.0%), 743.67 column/sec. Elapsed time 9.37 sec
11677.4s 1838 EvaluatorHoldout: Ignoring 33 ( 0.1%) Users that have less than 1 test interactions
11691.4s 1839 EvaluatorHoldout: Processed 27062 (100.0%) in 14.17 sec. Users per second: 1909
11691.9s 1840 Unable to load Cython Compute_Similarity, reverting to Python
11700.9s 1841 Similarity column 6969 (100.0%), 758.13 column/sec. Elapsed time 9.19 sec
11701.1s 1842 EvaluatorHoldout: Ignoring 28 ( 0.1%) Users that have less than 1 test interactions
11715.0s 1843 EvaluatorHoldout: Processed 27067 (100.0%) in 14.01 sec. Users per second: 1933
11715.4s 1844 Unable to load Cython Compute_Similarity, reverting to Python
11724.7s 1845 Similarity column 6969 (100.0%), 732.83 column/sec. Elapsed time 9.51 sec
11724.9s 1846 EvaluatorHoldout: Ignoring 40 ( 0.1%) Users that have less than 1 test interactions
11738.7s 1847 EvaluatorHoldout: Processed 27055 (100.0%) in 13.97 sec. Users per second: 1937
11739.2s 1848 Unable to load Cython Compute_Similarity, reverting to Python
11748.5s 1849 Similarity column 6969 (100.0%), 742.81 column/sec. Elapsed time 9.38 sec
11748.6s 1850 EvaluatorHoldout: Ignoring 21 ( 0.1%) Users that have less than 1 test interactions
11762.5s 1851 EvaluatorHoldout: Processed 27074 (100.0%) in 14.08 sec. Users per second: 1923
11763.0s 1852 Unable to load Cython Compute_Similarity, reverting to Python
11772.4s 1853 Similarity column 6969 (100.0%), 728.05 column/sec. Elapsed time 9.57 sec
11772.6s 1854 EvaluatorHoldout: Ignoring 29 ( 0.1%) Users that have less than 1 test interactions
11786.6s 1855 EvaluatorHoldout: Processed 27066 (100.0%) in 14.07 sec. Users per second: 1924
11786.6s 1856 [I 2025-12-07 12:10:21,997] Trial 75 finished with value: 0.24442911509417553 and parameters: {'similarity': 'tversky', 'topK': 8, 'shrink': 374, 'tversky_alpha': 0.24538922815129238, 'tversky_beta': 1.3564179518320907}. Best is trial 74 with value: 0.2473016132765641.
11786.6s 1857 
11786.6s 1858 [I 2025-12-07 12:10:21,997] Trial 75 finished with value: 0.24442911509417553 and parameters: {'similarity': 'tversky', 'topK': 8, 'shrink': 374, 'tversky_alpha': 0.24538922815129238, 'tversky_beta': 1.3564179518320907}. Best is trial 74 with value: 0.2473016132765641.
11786.7s 1859 [0.2431436404717223, 0.24550674839280712, 0.24546684855988152, 0.24310198161986502, 0.24492635642660177]
11787.0s 1860 Unable to load Cython Compute_Similarity, reverting to Python
11796.7s 1861 Similarity column 6969 (100.0%), 701.30 column/sec. Elapsed time 9.94 sec
11796.9s 1862 EvaluatorHoldout: Ignoring 33 ( 0.1%) Users that have less than 1 test interactions
11810.7s 1863 EvaluatorHoldout: Processed 27062 (100.0%) in 13.98 sec. Users per second: 1935
11811.2s 1864 Unable to load Cython Compute_Similarity, reverting to Python
11821.7s 1865 Similarity column 6969 (100.0%), 656.53 column/sec. Elapsed time 10.61 sec
11821.9s 1866 EvaluatorHoldout: Ignoring 28 ( 0.1%) Users that have less than 1 test interactions
11835.7s 1867 EvaluatorHoldout: Processed 27067 (100.0%) in 14.03 sec. Users per second: 1929
11836.2s 1868 Unable to load Cython Compute_Similarity, reverting to Python
11846.1s 1869 Similarity column 6969 (100.0%), 694.17 column/sec. Elapsed time 10.04 sec
11846.3s 1870 EvaluatorHoldout: Ignoring 40 ( 0.1%) Users that have less than 1 test interactions
11860.2s 1871 EvaluatorHoldout: Processed 27055 (100.0%) in 14.04 sec. Users per second: 1927
11860.6s 1872 Unable to load Cython Compute_Similarity, reverting to Python
11869.8s 1873 Similarity column 6969 (100.0%), 739.00 column/sec. Elapsed time 9.43 sec
11870.0s 1874 EvaluatorHoldout: Ignoring 21 ( 0.1%) Users that have less than 1 test interactions
11884.0s 1875 EvaluatorHoldout: Processed 27074 (100.0%) in 14.15 sec. Users per second: 1914
11884.5s 1876 Unable to load Cython Compute_Similarity, reverting to Python
11894.3s 1877 Similarity column 6969 (100.0%), 708.43 column/sec. Elapsed time 9.84 sec
11894.4s 1878 EvaluatorHoldout: Ignoring 29 ( 0.1%) Users that have less than 1 test interactions
11908.2s 1879 EvaluatorHoldout: Processed 27066 (100.0%) in 13.98 sec. Users per second: 1936
11908.2s 1880 [I 2025-12-07 12:12:23,699] Trial 76 finished with value: 0.24530758410726944 and parameters: {'similarity': 'tversky', 'topK': 7, 'shrink': 381, 'tversky_alpha': 0.26050179691846104, 'tversky_beta': 1.405654748207482}. Best is trial 74 with value: 0.2473016132765641.
11908.2s 1881 
11908.2s 1882 [I 2025-12-07 12:12:23,699] Trial 76 finished with value: 0.24530758410726944 and parameters: {'similarity': 'tversky', 'topK': 7, 'shrink': 381, 'tversky_alpha': 0.26050179691846104, 'tversky_beta': 1.405654748207482}. Best is trial 74 with value: 0.2473016132765641.
11908.4s 1883 [0.24399666225345454, 0.24620200029216055, 0.24692643439446654, 0.24425589092916536, 0.24515693266710026]
11908.7s 1884 Unable to load Cython Compute_Similarity, reverting to Python
11918.0s 1885 Similarity column 6969 (100.0%), 730.24 column/sec. Elapsed time 9.54 sec
11918.2s 1886 EvaluatorHoldout: Ignoring 33 ( 0.1%) Users that have less than 1 test interactions
11932.2s 1887 EvaluatorHoldout: Processed 27062 (100.0%) in 14.04 sec. Users per second: 1928
11932.6s 1888 Unable to load Cython Compute_Similarity, reverting to Python
11941.8s 1889 Similarity column 6969 (100.0%), 741.31 column/sec. Elapsed time 9.40 sec
11942.0s 1890 EvaluatorHoldout: Ignoring 28 ( 0.1%) Users that have less than 1 test interactions
11955.9s 1891 EvaluatorHoldout: Processed 27067 (100.0%) in 14.04 sec. Users per second: 1928
11956.4s 1892 Unable to load Cython Compute_Similarity, reverting to Python
11965.8s 1893 Similarity column 6969 (100.0%), 726.71 column/sec. Elapsed time 9.59 sec
11965.9s 1894 EvaluatorHoldout: Ignoring 40 ( 0.1%) Users that have less than 1 test interactions
11979.8s 1895 EvaluatorHoldout: Processed 27055 (100.0%) in 14.03 sec. Users per second: 1929
11980.3s 1896 Unable to load Cython Compute_Similarity, reverting to Python
11989.3s 1897 Similarity column 6969 (100.0%), 757.31 column/sec. Elapsed time 9.20 sec
11989.5s 1898 EvaluatorHoldout: Ignoring 21 ( 0.1%) Users that have less than 1 test interactions
12003.6s 1899 EvaluatorHoldout: Processed 27074 (100.0%) in 14.23 sec. Users per second: 1903
12004.1s 1900 Unable to load Cython Compute_Similarity, reverting to Python
12013.4s 1901 Similarity column 6969 (100.0%), 732.72 column/sec. Elapsed time 9.51 sec
12013.6s 1902 EvaluatorHoldout: Ignoring 29 ( 0.1%) Users that have less than 1 test interactions
12027.4s 1903 EvaluatorHoldout: Processed 27066 (100.0%) in 14.00 sec. Users per second: 1933
12027.4s 1904 [I 2025-12-07 12:14:22,918] Trial 77 finished with value: 0.24367167884051955 and parameters: {'similarity': 'tversky', 'topK': 8, 'shrink': 378, 'tversky_alpha': 0.2725236613016731, 'tversky_beta': 1.3734057042381034}. Best is trial 74 with value: 0.2473016132765641.
12027.4s 1905 
12027.4s 1906 [I 2025-12-07 12:14:22,918] Trial 77 finished with value: 0.24367167884051955 and parameters: {'similarity': 'tversky', 'topK': 8, 'shrink': 378, 'tversky_alpha': 0.2725236613016731, 'tversky_beta': 1.3734057042381034}. Best is trial 74 with value: 0.2473016132765641.
12027.6s 1907 [0.24295732460295696, 0.24427818789631922, 0.24449652003005262, 0.24208617128518697, 0.24454019038808203]
12027.9s 1908 Unable to load Cython Compute_Similarity, reverting to Python
12037.1s 1909 Similarity column 6969 (100.0%), 750.43 column/sec. Elapsed time 9.29 sec
12037.2s 1910 EvaluatorHoldout: Ignoring 33 ( 0.1%) Users that have less than 1 test interactions
12051.0s 1911 EvaluatorHoldout: Processed 27062 (100.0%) in 13.96 sec. Users per second: 1938
12051.5s 1912 Unable to load Cython Compute_Similarity, reverting to Python
12060.4s 1913 Similarity column 6969 (100.0%), 768.59 column/sec. Elapsed time 9.07 sec
12060.6s 1914 EvaluatorHoldout: Ignoring 28 ( 0.1%) Users that have less than 1 test interactions
12074.6s 1915 EvaluatorHoldout: Processed 27067 (100.0%) in 14.10 sec. Users per second: 1920
12075.0s 1916 Unable to load Cython Compute_Similarity, reverting to Python
12084.9s 1917 Similarity column 6969 (100.0%), 686.41 column/sec. Elapsed time 10.15 sec
12085.1s 1918 EvaluatorHoldout: Ignoring 40 ( 0.1%) Users that have less than 1 test interactions
12099.0s 1919 EvaluatorHoldout: Processed 27055 (100.0%) in 13.99 sec. Users per second: 1934
12099.4s 1920 Unable to load Cython Compute_Similarity, reverting to Python
12109.1s 1921 Similarity column 6969 (100.0%), 711.55 column/sec. Elapsed time 9.79 sec
12109.2s 1922 EvaluatorHoldout: Ignoring 21 ( 0.1%) Users that have less than 1 test interactions
12123.2s 1923 EvaluatorHoldout: Processed 27074 (100.0%) in 14.09 sec. Users per second: 1922
12123.7s 1924 Unable to load Cython Compute_Similarity, reverting to Python
12132.9s 1925 Similarity column 6969 (100.0%), 740.22 column/sec. Elapsed time 9.41 sec
12133.1s 1926 EvaluatorHoldout: Ignoring 29 ( 0.1%) Users that have less than 1 test interactions
12147.0s 1927 EvaluatorHoldout: Processed 27066 (100.0%) in 13.98 sec. Users per second: 1935
12147.0s 1928 [I 2025-12-07 12:16:22,405] Trial 78 finished with value: 0.24420011049394166 and parameters: {'similarity': 'tversky', 'topK': 8, 'shrink': 288, 'tversky_alpha': 0.2876936655456169, 'tversky_beta': 1.330676683177273}. Best is trial 74 with value: 0.2473016132765641.
12147.0s 1929 
12147.0s 1930 [I 2025-12-07 12:16:22,405] Trial 78 finished with value: 0.24420011049394166 and parameters: {'similarity': 'tversky', 'topK': 8, 'shrink': 288, 'tversky_alpha': 0.2876936655456169, 'tversky_beta': 1.330676683177273}. Best is trial 74 with value: 0.2473016132765641.
12147.1s 1931 [0.24322089821875736, 0.244628223767627, 0.24572721255152785, 0.24250381167253882, 0.24492040625925707]
12147.4s 1932 Unable to load Cython Compute_Similarity, reverting to Python
12156.6s 1933 Similarity column 6969 (100.0%), 740.95 column/sec. Elapsed time 9.41 sec
12156.8s 1934 EvaluatorHoldout: Ignoring 33 ( 0.1%) Users that have less than 1 test interactions
12170.5s 1935 EvaluatorHoldout: Processed 27062 (100.0%) in 13.85 sec. Users per second: 1953
12171.0s 1936 Unable to load Cython Compute_Similarity, reverting to Python
12180.3s 1937 Similarity column 6969 (100.0%), 742.21 column/sec. Elapsed time 9.39 sec
12180.4s 1938 EvaluatorHoldout: Ignoring 28 ( 0.1%) Users that have less than 1 test interactions
12194.3s 1939 EvaluatorHoldout: Processed 27067 (100.0%) in 14.06 sec. Users per second: 1926
12194.7s 1940 Unable to load Cython Compute_Similarity, reverting to Python
12203.9s 1941 Similarity column 6969 (100.0%), 745.28 column/sec. Elapsed time 9.35 sec
12204.1s 1942 EvaluatorHoldout: Ignoring 40 ( 0.1%) Users that have less than 1 test interactions
12218.1s 1943 EvaluatorHoldout: Processed 27055 (100.0%) in 14.07 sec. Users per second: 1923
12218.5s 1944 Unable to load Cython Compute_Similarity, reverting to Python
12227.8s 1945 Similarity column 6969 (100.0%), 729.23 column/sec. Elapsed time 9.56 sec
12228.1s 1946 EvaluatorHoldout: Ignoring 21 ( 0.1%) Users that have less than 1 test interactions
12242.0s 1947 EvaluatorHoldout: Processed 27074 (100.0%) in 14.08 sec. Users per second: 1924
12242.4s 1948 Unable to load Cython Compute_Similarity, reverting to Python
12252.1s 1949 Similarity column 6969 (100.0%), 713.50 column/sec. Elapsed time 9.77 sec
12252.2s 1950 EvaluatorHoldout: Ignoring 29 ( 0.1%) Users that have less than 1 test interactions
12265.9s 1951 EvaluatorHoldout: Processed 27066 (100.0%) in 13.86 sec. Users per second: 1953
12265.9s 1952 [I 2025-12-07 12:18:21,434] Trial 79 finished with value: 0.24596010772701465 and parameters: {'similarity': 'tversky', 'topK': 7, 'shrink': 283, 'tversky_alpha': 0.27955846730154815, 'tversky_beta': 1.3564267420133123}. Best is trial 74 with value: 0.2473016132765641.
12265.9s 1953 
12265.9s 1954 [I 2025-12-07 12:18:21,434] Trial 79 finished with value: 0.24596010772701465 and parameters: {'similarity': 'tversky', 'topK': 7, 'shrink': 283, 'tversky_alpha': 0.27955846730154815, 'tversky_beta': 1.3564267420133123}. Best is trial 74 with value: 0.2473016132765641.
12266.1s 1955 [0.24478780758239707, 0.24671043246278127, 0.247686809306778, 0.24476101410406023, 0.24585447517905676]
12266.4s 1956 Unable to load Cython Compute_Similarity, reverting to Python
12275.6s 1957 Similarity column 6969 (100.0%), 746.16 column/sec. Elapsed time 9.34 sec
12275.8s 1958 EvaluatorHoldout: Ignoring 33 ( 0.1%) Users that have less than 1 test interactions
12289.3s 1959 EvaluatorHoldout: Processed 27062 (100.0%) in 13.66 sec. Users per second: 1981
12289.7s 1960 Unable to load Cython Compute_Similarity, reverting to Python
12298.8s 1961 Similarity column 6969 (100.0%), 752.47 column/sec. Elapsed time 9.26 sec
12299.0s 1962 EvaluatorHoldout: Ignoring 28 ( 0.1%) Users that have less than 1 test interactions
12312.7s 1963 EvaluatorHoldout: Processed 27067 (100.0%) in 13.85 sec. Users per second: 1954
12313.2s 1964 Unable to load Cython Compute_Similarity, reverting to Python
12323.1s 1965 Similarity column 6969 (100.0%), 696.31 column/sec. Elapsed time 10.01 sec
12323.2s 1966 EvaluatorHoldout: Ignoring 40 ( 0.1%) Users that have less than 1 test interactions
12336.8s 1967 EvaluatorHoldout: Processed 27055 (100.0%) in 13.74 sec. Users per second: 1969
12337.3s 1968 Unable to load Cython Compute_Similarity, reverting to Python
12346.8s 1969 Similarity column 6969 (100.0%), 717.03 column/sec. Elapsed time 9.72 sec
12347.0s 1970 EvaluatorHoldout: Ignoring 21 ( 0.1%) Users that have less than 1 test interactions
12360.6s 1971 EvaluatorHoldout: Processed 27074 (100.0%) in 13.72 sec. Users per second: 1974
12361.0s 1972 Unable to load Cython Compute_Similarity, reverting to Python
12370.7s 1973 Similarity column 6969 (100.0%), 708.82 column/sec. Elapsed time 9.83 sec
12370.9s 1974 EvaluatorHoldout: Ignoring 29 ( 0.1%) Users that have less than 1 test interactions
12384.5s 1975 EvaluatorHoldout: Processed 27066 (100.0%) in 13.78 sec. Users per second: 1964
12384.5s 1976 [I 2025-12-07 12:20:19,987] Trial 80 finished with value: 0.24810978805811468 and parameters: {'similarity': 'tversky', 'topK': 5, 'shrink': 155, 'tversky_alpha': 0.2671139953840142, 'tversky_beta': 1.310804682954121}. Best is trial 80 with value: 0.24810978805811468.
12384.5s 1977 
