12444.7s 1570 [I 2025-12-07 00:45:15,624] Trial 63 finished with value: 0.21699325919421303 and parameters: {'topK': 97, 'shrink': 42, 'feature_weighting': 'TF-IDF'}. Best is trial 54 with value: 0.21706238132685302.
12444.9s 1571 [0.21730597730977289, 0.21694101779259092, 0.2168579844648968, 0.2176974716690353, 0.21616384473476932]
12445.2s 1572 Unable to load Cython Compute_Similarity, reverting to Python
12457.9s 1573 Similarity column 6969 (100.0%), 539.52 column/sec. Elapsed time 12.92 sec
12458.1s 1574 EvaluatorHoldout: Ignoring 48 ( 0.2%) Users that have less than 1 test interactions
12480.2s 1575 EvaluatorHoldout: Processed 27047 (100.0%) in 22.13 sec. Users per second: 1222
12480.6s 1576 Unable to load Cython Compute_Similarity, reverting to Python
12492.7s 1577 Similarity column 6969 (100.0%), 571.03 column/sec. Elapsed time 12.20 sec
12492.9s 1578 EvaluatorHoldout: Ignoring 29 ( 0.1%) Users that have less than 1 test interactions
12515.2s 1579 EvaluatorHoldout: Processed 27066 (100.0%) in 22.36 sec. Users per second: 1210
12515.6s 1580 Unable to load Cython Compute_Similarity, reverting to Python
12527.1s 1581 Similarity column 6969 (100.0%), 595.12 column/sec. Elapsed time 11.71 sec
12527.3s 1582 EvaluatorHoldout: Ignoring 42 ( 0.2%) Users that have less than 1 test interactions
12549.8s 1583 EvaluatorHoldout: Processed 27053 (100.0%) in 22.59 sec. Users per second: 1198
12550.3s 1584 Unable to load Cython Compute_Similarity, reverting to Python
12562.4s 1585 Similarity column 6969 (100.0%), 569.30 column/sec. Elapsed time 12.24 sec
12562.6s 1586 EvaluatorHoldout: Ignoring 38 ( 0.1%) Users that have less than 1 test interactions
12584.6s 1587 EvaluatorHoldout: Processed 27057 (100.0%) in 22.09 sec. Users per second: 1225
12585.0s 1588 Unable to load Cython Compute_Similarity, reverting to Python
12596.4s 1589 Similarity column 6969 (100.0%), 602.69 column/sec. Elapsed time 11.56 sec
12596.6s 1590 EvaluatorHoldout: Ignoring 32 ( 0.1%) Users that have less than 1 test interactions
12618.4s 1591 EvaluatorHoldout: Processed 27063 (100.0%) in 21.87 sec. Users per second: 1237
12618.4s 1592 [I 2025-12-07 00:48:09,281] Trial 64 finished with value: 0.21676485123701256 and parameters: {'topK': 90, 'shrink': 153, 'feature_weighting': 'TF-IDF'}. Best is trial 54 with value: 0.21706238132685302.
12618.4s 1593 
12618.4s 1594 [I 2025-12-07 00:48:09,281] Trial 64 finished with value: 0.21676485123701256 and parameters: {'topK': 90, 'shrink': 153, 'feature_weighting': 'TF-IDF'}. Best is trial 54 with value: 0.21706238132685302.
12618.5s 1595 [0.21725830360863047, 0.21701466721311055, 0.21665042366961018, 0.2172534233772097, 0.21564743831650182]
12618.9s 1596 Unable to load Cython Compute_Similarity, reverting to Python
12630.5s 1597 Similarity column 6969 (100.0%), 586.37 column/sec. Elapsed time 11.88 sec
12630.7s 1598 EvaluatorHoldout: Ignoring 48 ( 0.2%) Users that have less than 1 test interactions
12654.0s 1599 EvaluatorHoldout: Processed 27047 (100.0%) in 23.32 sec. Users per second: 1160
12654.4s 1600 Unable to load Cython Compute_Similarity, reverting to Python
12666.2s 1601 Similarity column 6969 (100.0%), 584.52 column/sec. Elapsed time 11.92 sec
12666.4s 1602 EvaluatorHoldout: Ignoring 29 ( 0.1%) Users that have less than 1 test interactions
12691.8s 1603 EvaluatorHoldout: Processed 27066 (100.0%) in 25.49 sec. Users per second: 1062
12692.3s 1604 Unable to load Cython Compute_Similarity, reverting to Python
12704.5s 1605 Similarity column 6969 (100.0%), 558.96 column/sec. Elapsed time 12.47 sec
12704.8s 1606 EvaluatorHoldout: Ignoring 42 ( 0.2%) Users that have less than 1 test interactions
12728.2s 1607 EvaluatorHoldout: Processed 27053 (100.0%) in 23.56 sec. Users per second: 1148
12728.7s 1608 Unable to load Cython Compute_Similarity, reverting to Python
12740.4s 1609 Similarity column 6969 (100.0%), 584.07 column/sec. Elapsed time 11.93 sec
12740.6s 1610 EvaluatorHoldout: Ignoring 38 ( 0.1%) Users that have less than 1 test interactions
12764.4s 1611 EvaluatorHoldout: Processed 27057 (100.0%) in 23.83 sec. Users per second: 1136
12764.8s 1612 Unable to load Cython Compute_Similarity, reverting to Python
12776.6s 1613 Similarity column 6969 (100.0%), 580.91 column/sec. Elapsed time 12.00 sec
12776.8s 1614 EvaluatorHoldout: Ignoring 32 ( 0.1%) Users that have less than 1 test interactions
12800.1s 1615 EvaluatorHoldout: Processed 27063 (100.0%) in 23.34 sec. Users per second: 1160
12800.1s 1616 [I 2025-12-07 00:51:11,006] Trial 65 finished with value: 0.21669208254485645 and parameters: {'topK': 115, 'shrink': 202, 'feature_weighting': 'TF-IDF'}. Best is trial 54 with value: 0.21706238132685302.
12800.1s 1617 
12800.1s 1618 [I 2025-12-07 00:51:11,006] Trial 65 finished with value: 0.21669208254485645 and parameters: {'topK': 115, 'shrink': 202, 'feature_weighting': 'TF-IDF'}. Best is trial 54 with value: 0.21706238132685302.
12800.2s 1619 [0.2167565444118529, 0.2170604601548969, 0.21617101292345475, 0.21761578571711648, 0.215856609516961]
12800.6s 1620 Unable to load Cython Compute_Similarity, reverting to Python
12812.5s 1621 Similarity column 6969 (100.0%), 573.09 column/sec. Elapsed time 12.16 sec
12812.7s 1622 EvaluatorHoldout: Ignoring 48 ( 0.2%) Users that have less than 1 test interactions
12837.0s 1623 EvaluatorHoldout: Processed 27047 (100.0%) in 24.33 sec. Users per second: 1112
12837.5s 1624 Unable to load Cython Compute_Similarity, reverting to Python
12849.4s 1625 Similarity column 6969 (100.0%), 575.83 column/sec. Elapsed time 12.10 sec
12849.6s 1626 EvaluatorHoldout: Ignoring 29 ( 0.1%) Users that have less than 1 test interactions
12873.6s 1627 EvaluatorHoldout: Processed 27066 (100.0%) in 24.09 sec. Users per second: 1123
12874.0s 1628 Unable to load Cython Compute_Similarity, reverting to Python
12886.0s 1629 Similarity column 6969 (100.0%), 575.76 column/sec. Elapsed time 12.10 sec
12886.2s 1630 EvaluatorHoldout: Ignoring 42 ( 0.2%) Users that have less than 1 test interactions
12909.5s 1631 EvaluatorHoldout: Processed 27053 (100.0%) in 23.46 sec. Users per second: 1153
12910.0s 1632 Unable to load Cython Compute_Similarity, reverting to Python
12921.5s 1633 Similarity column 6969 (100.0%), 594.22 column/sec. Elapsed time 11.73 sec
12921.7s 1634 EvaluatorHoldout: Ignoring 38 ( 0.1%) Users that have less than 1 test interactions
12945.6s 1635 EvaluatorHoldout: Processed 27057 (100.0%) in 23.90 sec. Users per second: 1132
12946.0s 1636 Unable to load Cython Compute_Similarity, reverting to Python
12957.7s 1637 Similarity column 6969 (100.0%), 588.13 column/sec. Elapsed time 11.85 sec
12957.9s 1638 EvaluatorHoldout: Ignoring 32 ( 0.1%) Users that have less than 1 test interactions
12981.8s 1639 EvaluatorHoldout: Processed 27063 (100.0%) in 23.96 sec. Users per second: 1130
12981.8s 1640 [I 2025-12-07 00:54:12,643] Trial 66 finished with value: 0.21626428128488842 and parameters: {'topK': 139, 'shrink': 117, 'feature_weighting': 'TF-IDF'}. Best is trial 54 with value: 0.21706238132685302.
12981.8s 1641 
12981.8s 1642 [I 2025-12-07 00:54:12,643] Trial 66 finished with value: 0.21626428128488842 and parameters: {'topK': 139, 'shrink': 117, 'feature_weighting': 'TF-IDF'}. Best is trial 54 with value: 0.21706238132685302.
12981.9s 1643 [0.21615642207458718, 0.21633317401255692, 0.2160111743015779, 0.21716928193724058, 0.21565135409847958]
12982.2s 1644 Unable to load Cython Compute_Similarity, reverting to Python
12993.6s 1645 Similarity column 6969 (100.0%), 600.02 column/sec. Elapsed time 11.61 sec
12993.8s 1646 EvaluatorHoldout: Ignoring 48 ( 0.2%) Users that have less than 1 test interactions
13014.1s 1647 EvaluatorHoldout: Processed 27047 (100.0%) in 20.38 sec. Users per second: 1327
13014.6s 1648 Unable to load Cython Compute_Similarity, reverting to Python
13025.7s 1649 Similarity column 6969 (100.0%), 614.66 column/sec. Elapsed time 11.34 sec
13025.9s 1650 EvaluatorHoldout: Ignoring 29 ( 0.1%) Users that have less than 1 test interactions
13046.7s 1651 EvaluatorHoldout: Processed 27066 (100.0%) in 20.87 sec. Users per second: 1297
13047.2s 1652 Unable to load Cython Compute_Similarity, reverting to Python
13058.7s 1653 Similarity column 6969 (100.0%), 592.61 column/sec. Elapsed time 11.76 sec
13058.9s 1654 EvaluatorHoldout: Ignoring 42 ( 0.2%) Users that have less than 1 test interactions
13079.6s 1655 EvaluatorHoldout: Processed 27053 (100.0%) in 20.72 sec. Users per second: 1306
13080.0s 1656 Unable to load Cython Compute_Similarity, reverting to Python
13091.9s 1657 Similarity column 6969 (100.0%), 576.89 column/sec. Elapsed time 12.08 sec
13092.1s 1658 EvaluatorHoldout: Ignoring 38 ( 0.1%) Users that have less than 1 test interactions
13112.7s 1659 EvaluatorHoldout: Processed 27057 (100.0%) in 20.69 sec. Users per second: 1308
13113.2s 1660 Unable to load Cython Compute_Similarity, reverting to Python
13124.9s 1661 Similarity column 6969 (100.0%), 582.15 column/sec. Elapsed time 11.97 sec
13125.1s 1662 EvaluatorHoldout: Ignoring 32 ( 0.1%) Users that have less than 1 test interactions
13145.7s 1663 EvaluatorHoldout: Processed 27063 (100.0%) in 20.67 sec. Users per second: 1310
13145.7s 1664 [I 2025-12-07 00:56:56,633] Trial 67 finished with value: 0.2169622788446489 and parameters: {'topK': 70, 'shrink': 29, 'feature_weighting': 'TF-IDF'}. Best is trial 54 with value: 0.21706238132685302.
13145.7s 1665 
13145.8s 1666 [I 2025-12-07 00:56:56,633] Trial 67 finished with value: 0.2169622788446489 and parameters: {'topK': 70, 'shrink': 29, 'feature_weighting': 'TF-IDF'}. Best is trial 54 with value: 0.21706238132685302.
13145.9s 1667 [0.21736343424677163, 0.21653110843909135, 0.21624895019941281, 0.2179812926869191, 0.21668660865104938]
13146.2s 1668 Unable to load Cython Compute_Similarity, reverting to Python
13157.8s 1669 Similarity column 6969 (100.0%), 591.14 column/sec. Elapsed time 11.79 sec
13158.0s 1670 EvaluatorHoldout: Ignoring 48 ( 0.2%) Users that have less than 1 test interactions
13179.8s 1671 EvaluatorHoldout: Processed 27047 (100.0%) in 21.82 sec. Users per second: 1240
13180.2s 1672 Unable to load Cython Compute_Similarity, reverting to Python
13191.3s 1673 Similarity column 6969 (100.0%), 616.89 column/sec. Elapsed time 11.30 sec
13191.5s 1674 EvaluatorHoldout: Ignoring 29 ( 0.1%) Users that have less than 1 test interactions
13213.5s 1675 EvaluatorHoldout: Processed 27066 (100.0%) in 22.03 sec. Users per second: 1228
13213.9s 1676 Unable to load Cython Compute_Similarity, reverting to Python
13225.3s 1677 Similarity column 6969 (100.0%), 599.50 column/sec. Elapsed time 11.62 sec
13225.5s 1678 EvaluatorHoldout: Ignoring 42 ( 0.2%) Users that have less than 1 test interactions
13247.4s 1679 EvaluatorHoldout: Processed 27053 (100.0%) in 21.90 sec. Users per second: 1235
13247.8s 1680 Unable to load Cython Compute_Similarity, reverting to Python
13259.7s 1681 Similarity column 6969 (100.0%), 577.86 column/sec. Elapsed time 12.06 sec
13259.9s 1682 EvaluatorHoldout: Ignoring 38 ( 0.1%) Users that have less than 1 test interactions
13282.0s 1683 EvaluatorHoldout: Processed 27057 (100.0%) in 22.24 sec. Users per second: 1216
13282.5s 1684 Unable to load Cython Compute_Similarity, reverting to Python
13294.0s 1685 Similarity column 6969 (100.0%), 595.04 column/sec. Elapsed time 11.71 sec
13294.2s 1686 EvaluatorHoldout: Ignoring 32 ( 0.1%) Users that have less than 1 test interactions
13316.0s 1687 EvaluatorHoldout: Processed 27063 (100.0%) in 21.84 sec. Users per second: 1239
13316.0s 1688 [I 2025-12-07 00:59:46,860] Trial 68 finished with value: 0.21687557110468608 and parameters: {'topK': 103, 'shrink': 62, 'feature_weighting': 'TF-IDF'}. Best is trial 54 with value: 0.21706238132685302.
13316.0s 1689 
13316.0s 1690 [I 2025-12-07 00:59:46,860] Trial 68 finished with value: 0.21687557110468608 and parameters: {'topK': 103, 'shrink': 62, 'feature_weighting': 'TF-IDF'}. Best is trial 54 with value: 0.21706238132685302.
13316.1s 1691 [0.2172150762272706, 0.21702491724641568, 0.2166071193821175, 0.21741341047325766, 0.21611733219436896]
13316.4s 1692 Unable to load Cython Compute_Similarity, reverting to Python
13327.8s 1693 Similarity column 6969 (100.0%), 604.67 column/sec. Elapsed time 11.53 sec
13328.0s 1694 EvaluatorHoldout: Ignoring 48 ( 0.2%) Users that have less than 1 test interactions
13349.8s 1695 EvaluatorHoldout: Processed 27047 (100.0%) in 21.89 sec. Users per second: 1236
13350.2s 1696 Unable to load Cython Compute_Similarity, reverting to Python
13361.9s 1697 Similarity column 6969 (100.0%), 589.31 column/sec. Elapsed time 11.83 sec
13362.1s 1698 EvaluatorHoldout: Ignoring 29 ( 0.1%) Users that have less than 1 test interactions
13384.5s 1699 EvaluatorHoldout: Processed 27066 (100.0%) in 22.52 sec. Users per second: 1202
13385.0s 1700 Unable to load Cython Compute_Similarity, reverting to Python
13396.6s 1701 Similarity column 6969 (100.0%), 588.71 column/sec. Elapsed time 11.84 sec
13396.8s 1702 EvaluatorHoldout: Ignoring 42 ( 0.2%) Users that have less than 1 test interactions
13418.8s 1703 EvaluatorHoldout: Processed 27053 (100.0%) in 22.06 sec. Users per second: 1227
13419.2s 1704 Unable to load Cython Compute_Similarity, reverting to Python
13430.4s 1705 Similarity column 6969 (100.0%), 614.30 column/sec. Elapsed time 11.34 sec
13430.6s 1706 EvaluatorHoldout: Ignoring 38 ( 0.1%) Users that have less than 1 test interactions
13453.0s 1707 EvaluatorHoldout: Processed 27057 (100.0%) in 22.53 sec. Users per second: 1201
13453.5s 1708 Unable to load Cython Compute_Similarity, reverting to Python
13465.4s 1709 Similarity column 6969 (100.0%), 574.01 column/sec. Elapsed time 12.14 sec
13465.6s 1710 EvaluatorHoldout: Ignoring 32 ( 0.1%) Users that have less than 1 test interactions
13487.8s 1711 EvaluatorHoldout: Processed 27063 (100.0%) in 22.30 sec. Users per second: 1214
13487.8s 1712 [I 2025-12-07 01:02:38,729] Trial 69 finished with value: 0.21593933275488286 and parameters: {'topK': 50, 'shrink': 896, 'feature_weighting': 'TF-IDF'}. Best is trial 54 with value: 0.21706238132685302.
13487.8s 1713 
13487.8s 1714 [I 2025-12-07 01:02:38,729] Trial 69 finished with value: 0.21593933275488286 and parameters: {'topK': 50, 'shrink': 896, 'feature_weighting': 'TF-IDF'}. Best is trial 54 with value: 0.21706238132685302.
13488.0s 1715 [0.21670501149342017, 0.21580416269827474, 0.21484575057252323, 0.2171933381215516, 0.2151484008886445]
13488.3s 1716 Unable to load Cython Compute_Similarity, reverting to Python
13499.9s 1717 Similarity column 6969 (100.0%), 591.40 column/sec. Elapsed time 11.78 sec
13500.1s 1718 EvaluatorHoldout: Ignoring 48 ( 0.2%) Users that have less than 1 test interactions
13521.3s 1719 EvaluatorHoldout: Processed 27047 (100.0%) in 21.26 sec. Users per second: 1272
13521.7s 1720 Unable to load Cython Compute_Similarity, reverting to Python
13532.9s 1721 Similarity column 6969 (100.0%), 615.66 column/sec. Elapsed time 11.32 sec
13533.1s 1722 EvaluatorHoldout: Ignoring 29 ( 0.1%) Users that have less than 1 test interactions
13554.4s 1723 EvaluatorHoldout: Processed 27066 (100.0%) in 21.38 sec. Users per second: 1266
13554.8s 1724 Unable to load Cython Compute_Similarity, reverting to Python
13566.0s 1725 Similarity column 6969 (100.0%), 612.10 column/sec. Elapsed time 11.39 sec
13566.2s 1726 EvaluatorHoldout: Ignoring 42 ( 0.2%) Users that have less than 1 test interactions
13587.7s 1727 EvaluatorHoldout: Processed 27053 (100.0%) in 21.51 sec. Users per second: 1257
13588.1s 1728 Unable to load Cython Compute_Similarity, reverting to Python
13599.3s 1729 Similarity column 6969 (100.0%), 610.28 column/sec. Elapsed time 11.42 sec
13599.5s 1730 EvaluatorHoldout: Ignoring 38 ( 0.1%) Users that have less than 1 test interactions
13621.0s 1731 EvaluatorHoldout: Processed 27057 (100.0%) in 21.52 sec. Users per second: 1257
13621.4s 1732 Unable to load Cython Compute_Similarity, reverting to Python
13633.0s 1733 Similarity column 6969 (100.0%), 591.88 column/sec. Elapsed time 11.77 sec
13633.2s 1734 EvaluatorHoldout: Ignoring 32 ( 0.1%) Users that have less than 1 test interactions
13654.9s 1735 EvaluatorHoldout: Processed 27063 (100.0%) in 21.72 sec. Users per second: 1246
13654.9s 1736 [I 2025-12-07 01:05:25,737] Trial 70 finished with value: 0.2168722845470489 and parameters: {'topK': 87, 'shrink': 81, 'feature_weighting': 'TF-IDF'}. Best is trial 54 with value: 0.21706238132685302.
13654.9s 1737 
13654.9s 1738 [I 2025-12-07 01:05:25,737] Trial 70 finished with value: 0.2168722845470489 and parameters: {'topK': 87, 'shrink': 81, 'feature_weighting': 'TF-IDF'}. Best is trial 54 with value: 0.21706238132685302.
13655.0s 1739 [0.2173384891443819, 0.21723988120230636, 0.21668869949839586, 0.21740292366153266, 0.21569142922862763]
13655.3s 1740 Unable to load Cython Compute_Similarity, reverting to Python
13666.6s 1741 Similarity column 6969 (100.0%), 608.34 column/sec. Elapsed time 11.46 sec
13666.8s 1742 EvaluatorHoldout: Ignoring 48 ( 0.2%) Users that have less than 1 test interactions
13687.3s 1743 EvaluatorHoldout: Processed 27047 (100.0%) in 20.59 sec. Users per second: 1314
13687.7s 1744 Unable to load Cython Compute_Similarity, reverting to Python
13699.2s 1745 Similarity column 6969 (100.0%), 595.78 column/sec. Elapsed time 11.70 sec
13699.4s 1746 EvaluatorHoldout: Ignoring 29 ( 0.1%) Users that have less than 1 test interactions
13720.9s 1747 EvaluatorHoldout: Processed 27066 (100.0%) in 21.53 sec. Users per second: 1257
13721.4s 1748 Unable to load Cython Compute_Similarity, reverting to Python
13734.3s 1749 Similarity column 6969 (100.0%), 530.38 column/sec. Elapsed time 13.14 sec
13734.5s 1750 EvaluatorHoldout: Ignoring 42 ( 0.2%) Users that have less than 1 test interactions
13756.5s 1751 EvaluatorHoldout: Processed 27053 (100.0%) in 22.06 sec. Users per second: 1226
13757.0s 1752 Unable to load Cython Compute_Similarity, reverting to Python
13769.1s 1753 Similarity column 6969 (100.0%), 564.31 column/sec. Elapsed time 12.35 sec
13769.3s 1754 EvaluatorHoldout: Ignoring 38 ( 0.1%) Users that have less than 1 test interactions
13790.6s 1755 EvaluatorHoldout: Processed 27057 (100.0%) in 21.27 sec. Users per second: 1272
13791.0s 1756 Unable to load Cython Compute_Similarity, reverting to Python
13803.1s 1757 Similarity column 6969 (100.0%), 565.62 column/sec. Elapsed time 12.32 sec
13803.3s 1758 EvaluatorHoldout: Ignoring 32 ( 0.1%) Users that have less than 1 test interactions
13824.4s 1759 EvaluatorHoldout: Processed 27063 (100.0%) in 21.13 sec. Users per second: 1281
13824.4s 1760 [I 2025-12-07 01:08:15,261] Trial 71 finished with value: 0.21706238132685302 and parameters: {'topK': 73, 'shrink': 1, 'feature_weighting': 'TF-IDF'}. Best is trial 54 with value: 0.21706238132685302.
13824.4s 1761 
13824.4s 1762 [I 2025-12-07 01:08:15,261] Trial 71 finished with value: 0.21706238132685302 and parameters: {'topK': 73, 'shrink': 1, 'feature_weighting': 'TF-IDF'}. Best is trial 54 with value: 0.21706238132685302.
13824.5s 1763 [0.2172821113337456, 0.21667529211284464, 0.2166249567028753, 0.21804643083431244, 0.21668311565048723]
13824.8s 1764 Unable to load Cython Compute_Similarity, reverting to Python
13836.7s 1765 Similarity column 6969 (100.0%), 576.95 column/sec. Elapsed time 12.08 sec
13836.9s 1766 EvaluatorHoldout: Ignoring 48 ( 0.2%) Users that have less than 1 test interactions
13857.7s 1767 EvaluatorHoldout: Processed 27047 (100.0%) in 20.86 sec. Users per second: 1297
13858.2s 1768 Unable to load Cython Compute_Similarity, reverting to Python
13869.8s 1769 Similarity column 6969 (100.0%), 591.62 column/sec. Elapsed time 11.78 sec
13870.0s 1770 EvaluatorHoldout: Ignoring 29 ( 0.1%) Users that have less than 1 test interactions
13890.9s 1771 EvaluatorHoldout: Processed 27066 (100.0%) in 21.00 sec. Users per second: 1289
13891.3s 1772 Unable to load Cython Compute_Similarity, reverting to Python
13903.4s 1773 Similarity column 6969 (100.0%), 566.06 column/sec. Elapsed time 12.31 sec
13903.6s 1774 EvaluatorHoldout: Ignoring 42 ( 0.2%) Users that have less than 1 test interactions
13924.7s 1775 EvaluatorHoldout: Processed 27053 (100.0%) in 21.12 sec. Users per second: 1281
13925.2s 1776 Unable to load Cython Compute_Similarity, reverting to Python
13937.3s 1777 Similarity column 6969 (100.0%), 567.14 column/sec. Elapsed time 12.29 sec
13937.5s 1778 EvaluatorHoldout: Ignoring 38 ( 0.1%) Users that have less than 1 test interactions
13958.5s 1779 EvaluatorHoldout: Processed 27057 (100.0%) in 21.10 sec. Users per second: 1282
13959.0s 1780 Unable to load Cython Compute_Similarity, reverting to Python
13971.4s 1781 Similarity column 6969 (100.0%), 549.95 column/sec. Elapsed time 12.67 sec
13971.6s 1782 EvaluatorHoldout: Ignoring 32 ( 0.1%) Users that have less than 1 test interactions
13992.8s 1783 EvaluatorHoldout: Processed 27063 (100.0%) in 21.22 sec. Users per second: 1275
13992.8s 1784 [I 2025-12-07 01:11:03,678] Trial 72 finished with value: 0.21691169630498966 and parameters: {'topK': 69, 'shrink': 25, 'feature_weighting': 'TF-IDF'}. Best is trial 54 with value: 0.21706238132685302.
13992.8s 1785 
