23218.4s 3994 [I 2025-12-07 15:20:53,892] Trial 164 finished with value: 0.24925139526318998 and parameters: {'similarity': 'tversky', 'topK': 5, 'shrink': 112, 'tversky_alpha': 0.3416927196900621, 'tversky_beta': 1.5711878512620592}. Best is trial 91 with value: 0.24993110179607925.
23218.6s 3995 [0.24833127960673984, 0.24988606801105764, 0.2501875506388499, 0.2485706531331468, 0.24928142492615574]
23218.9s 3996 Unable to load Cython Compute_Similarity, reverting to Python
23228.5s 3997 Similarity column 6969 (100.0%), 720.28 column/sec. Elapsed time 9.68 sec
23228.6s 3998 EvaluatorHoldout: Ignoring 33 ( 0.1%) Users that have less than 1 test interactions
23243.9s 3999 EvaluatorHoldout: Processed 27062 (100.0%) in 15.48 sec. Users per second: 1748
23244.4s 4000 Unable to load Cython Compute_Similarity, reverting to Python
23253.8s 4001 Similarity column 6969 (100.0%), 722.51 column/sec. Elapsed time 9.65 sec
23254.0s 4002 EvaluatorHoldout: Ignoring 28 ( 0.1%) Users that have less than 1 test interactions
23269.5s 4003 EvaluatorHoldout: Processed 27067 (100.0%) in 15.45 sec. Users per second: 1752
23269.8s 4004 Unable to load Cython Compute_Similarity, reverting to Python
23279.3s 4005 Similarity column 6969 (100.0%), 718.67 column/sec. Elapsed time 9.70 sec
23279.5s 4006 EvaluatorHoldout: Ignoring 40 ( 0.1%) Users that have less than 1 test interactions
23294.8s 4007 EvaluatorHoldout: Processed 27055 (100.0%) in 15.44 sec. Users per second: 1752
23295.2s 4008 Unable to load Cython Compute_Similarity, reverting to Python
23305.1s 4009 Similarity column 6969 (100.0%), 708.29 column/sec. Elapsed time 9.84 sec
23305.1s 4010 EvaluatorHoldout: Ignoring 21 ( 0.1%) Users that have less than 1 test interactions
23320.3s 4011 EvaluatorHoldout: Processed 27074 (100.0%) in 15.42 sec. Users per second: 1756
23320.8s 4012 Unable to load Cython Compute_Similarity, reverting to Python
23330.3s 4013 Similarity column 6969 (100.0%), 719.31 column/sec. Elapsed time 9.69 sec
23330.5s 4014 EvaluatorHoldout: Ignoring 29 ( 0.1%) Users that have less than 1 test interactions
23346.0s 4015 EvaluatorHoldout: Processed 27066 (100.0%) in 15.46 sec. Users per second: 1750
23346.0s 4016 [I 2025-12-07 15:23:01,341] Trial 165 finished with value: 0.21008003352871324 and parameters: {'similarity': 'tversky', 'topK': 41, 'shrink': 104, 'tversky_alpha': 1.2828945285094957, 'tversky_beta': 1.5608451089221875}. Best is trial 91 with value: 0.24993110179607925.
23346.0s 4017 
23346.0s 4018 [I 2025-12-07 15:23:01,341] Trial 165 finished with value: 0.21008003352871324 and parameters: {'similarity': 'tversky', 'topK': 41, 'shrink': 104, 'tversky_alpha': 1.2828945285094957, 'tversky_beta': 1.5608451089221875}. Best is trial 91 with value: 0.24993110179607925.
23346.0s 4019 [0.20984366158753676, 0.21011586632587345, 0.21053767678675914, 0.20929197512984915, 0.2106109878135476]
23346.4s 4020 Unable to load Cython Compute_Similarity, reverting to Python
23356.7s 4021 Similarity column 6969 (100.0%), 661.92 column/sec. Elapsed time 10.53 sec
23356.9s 4022 EvaluatorHoldout: Ignoring 33 ( 0.1%) Users that have less than 1 test interactions
23372.2s 4023 EvaluatorHoldout: Processed 27062 (100.0%) in 15.47 sec. Users per second: 1749
23372.7s 4024 Unable to load Cython Compute_Similarity, reverting to Python
23383.7s 4025 Similarity column 6969 (100.0%), 639.43 column/sec. Elapsed time 10.90 sec
23383.7s 4026 EvaluatorHoldout: Ignoring 28 ( 0.1%) Users that have less than 1 test interactions
23398.9s 4027 EvaluatorHoldout: Processed 27067 (100.0%) in 15.48 sec. Users per second: 1749
23399.4s 4028 Unable to load Cython Compute_Similarity, reverting to Python
23409.5s 4029 Similarity column 6969 (100.0%), 677.58 column/sec. Elapsed time 10.29 sec
23409.7s 4030 EvaluatorHoldout: Ignoring 40 ( 0.1%) Users that have less than 1 test interactions
23425.2s 4031 EvaluatorHoldout: Processed 27055 (100.0%) in 15.50 sec. Users per second: 1746
23425.5s 4032 Unable to load Cython Compute_Similarity, reverting to Python
23435.6s 4033 Similarity column 6969 (100.0%), 682.10 column/sec. Elapsed time 10.22 sec
23435.8s 4034 EvaluatorHoldout: Ignoring 21 ( 0.1%) Users that have less than 1 test interactions
23451.1s 4035 EvaluatorHoldout: Processed 27074 (100.0%) in 15.50 sec. Users per second: 1747
23451.6s 4036 Unable to load Cython Compute_Similarity, reverting to Python
23461.8s 4037 Similarity column 6969 (100.0%), 678.27 column/sec. Elapsed time 10.27 sec
23461.9s 4038 EvaluatorHoldout: Ignoring 29 ( 0.1%) Users that have less than 1 test interactions
23477.2s 4039 EvaluatorHoldout: Processed 27066 (100.0%) in 15.50 sec. Users per second: 1746
23477.2s 4040 [I 2025-12-07 15:25:12,722] Trial 166 finished with value: 0.212561867253654 and parameters: {'similarity': 'tversky', 'topK': 77, 'shrink': 50, 'tversky_alpha': 0.34778695981374197, 'tversky_beta': 1.5054122018584046}. Best is trial 91 with value: 0.24993110179607925.
23477.2s 4041 
23477.2s 4042 [I 2025-12-07 15:25:12,722] Trial 166 finished with value: 0.212561867253654 and parameters: {'similarity': 'tversky', 'topK': 77, 'shrink': 50, 'tversky_alpha': 0.34778695981374197, 'tversky_beta': 1.5054122018584046}. Best is trial 91 with value: 0.24993110179607925.
23477.4s 4043 [0.21203637206354822, 0.21341318308813134, 0.21242113200872997, 0.21184537662886996, 0.21309327247899054]
23477.7s 4044 Unable to load Cython Compute_Similarity, reverting to Python
23487.5s 4045 Similarity column 6969 (100.0%), 701.97 column/sec. Elapsed time 9.93 sec
23487.7s 4046 EvaluatorHoldout: Ignoring 33 ( 0.1%) Users that have less than 1 test interactions
23501.5s 4047 EvaluatorHoldout: Processed 27062 (100.0%) in 13.85 sec. Users per second: 1954
23501.8s 4048 Unable to load Cython Compute_Similarity, reverting to Python
23511.1s 4049 Similarity column 6969 (100.0%), 733.30 column/sec. Elapsed time 9.50 sec
23511.3s 4050 EvaluatorHoldout: Ignoring 28 ( 0.1%) Users that have less than 1 test interactions
23525.0s 4051 EvaluatorHoldout: Processed 27067 (100.0%) in 13.83 sec. Users per second: 1957
23525.5s 4052 Unable to load Cython Compute_Similarity, reverting to Python
23535.6s 4053 Similarity column 6969 (100.0%), 689.75 column/sec. Elapsed time 10.10 sec
23535.6s 4054 EvaluatorHoldout: Ignoring 40 ( 0.1%) Users that have less than 1 test interactions
23549.2s 4055 EvaluatorHoldout: Processed 27055 (100.0%) in 13.78 sec. Users per second: 1964
23549.7s 4056 Unable to load Cython Compute_Similarity, reverting to Python
23559.2s 4057 Similarity column 6969 (100.0%), 716.20 column/sec. Elapsed time 9.73 sec
23559.4s 4058 EvaluatorHoldout: Ignoring 21 ( 0.1%) Users that have less than 1 test interactions
23573.2s 4059 EvaluatorHoldout: Processed 27074 (100.0%) in 13.74 sec. Users per second: 1970
23573.5s 4060 Unable to load Cython Compute_Similarity, reverting to Python
23582.9s 4061 Similarity column 6969 (100.0%), 726.83 column/sec. Elapsed time 9.59 sec
23583.1s 4062 EvaluatorHoldout: Ignoring 29 ( 0.1%) Users that have less than 1 test interactions
23596.6s 4063 EvaluatorHoldout: Processed 27066 (100.0%) in 13.71 sec. Users per second: 1975
23596.6s 4064 [I 2025-12-07 15:27:12,144] Trial 167 finished with value: 0.24689694001221224 and parameters: {'similarity': 'tversky', 'topK': 5, 'shrink': 201, 'tversky_alpha': 0.41591496365031744, 'tversky_beta': 1.60886040093413}. Best is trial 91 with value: 0.24993110179607925.
23596.6s 4065 
23596.6s 4066 [I 2025-12-07 15:27:12,144] Trial 167 finished with value: 0.24689694001221224 and parameters: {'similarity': 'tversky', 'topK': 5, 'shrink': 201, 'tversky_alpha': 0.41591496365031744, 'tversky_beta': 1.60886040093413}. Best is trial 91 with value: 0.24993110179607925.
23596.8s 4067 [0.24630559784013867, 0.24741716781054832, 0.24800621057590658, 0.24590681816525453, 0.24684890566921322]
23597.1s 4068 Unable to load Cython Compute_Similarity, reverting to Python
23606.4s 4069 Similarity column 6969 (100.0%), 750.11 column/sec. Elapsed time 9.29 sec
23606.4s 4070 EvaluatorHoldout: Ignoring 33 ( 0.1%) Users that have less than 1 test interactions
23622.5s 4071 EvaluatorHoldout: Processed 27062 (100.0%) in 16.23 sec. Users per second: 1667
23623.0s 4072 Unable to load Cython Compute_Similarity, reverting to Python
23631.8s 4073 Similarity column 6969 (100.0%), 770.36 column/sec. Elapsed time 9.05 sec
23632.0s 4074 EvaluatorHoldout: Ignoring 28 ( 0.1%) Users that have less than 1 test interactions
23648.4s 4075 EvaluatorHoldout: Processed 27067 (100.0%) in 16.34 sec. Users per second: 1657
23648.7s 4076 Unable to load Cython Compute_Similarity, reverting to Python
23657.9s 4077 Similarity column 6969 (100.0%), 739.42 column/sec. Elapsed time 9.42 sec
23658.1s 4078 EvaluatorHoldout: Ignoring 40 ( 0.1%) Users that have less than 1 test interactions
23674.3s 4079 EvaluatorHoldout: Processed 27055 (100.0%) in 16.30 sec. Users per second: 1660
23674.7s 4080 Unable to load Cython Compute_Similarity, reverting to Python
23683.8s 4081 Similarity column 6969 (100.0%), 768.21 column/sec. Elapsed time 9.07 sec
23683.8s 4082 EvaluatorHoldout: Ignoring 21 ( 0.1%) Users that have less than 1 test interactions
23699.9s 4083 EvaluatorHoldout: Processed 27074 (100.0%) in 16.29 sec. Users per second: 1662
23700.4s 4084 Unable to load Cython Compute_Similarity, reverting to Python
23709.2s 4085 Similarity column 6969 (100.0%), 777.74 column/sec. Elapsed time 8.96 sec
23709.4s 4086 EvaluatorHoldout: Ignoring 29 ( 0.1%) Users that have less than 1 test interactions
23725.7s 4087 EvaluatorHoldout: Processed 27066 (100.0%) in 16.32 sec. Users per second: 1658
23725.7s 4088 [I 2025-12-07 15:29:21,070] Trial 168 finished with value: 0.21629122867545472 and parameters: {'similarity': 'cosine', 'topK': 36, 'shrink': 208}. Best is trial 91 with value: 0.24993110179607925.
23725.7s 4089 
23725.7s 4090 [I 2025-12-07 15:29:21,070] Trial 168 finished with value: 0.21629122867545472 and parameters: {'similarity': 'cosine', 'topK': 36, 'shrink': 208}. Best is trial 91 with value: 0.24993110179607925.
23725.7s 4091 [0.21527623243802702, 0.2165311076625857, 0.21722696286464, 0.21561800739822046, 0.21680383301380043]
23726.1s 4092 Unable to load Cython Compute_Similarity, reverting to Python
23735.3s 4093 Similarity column 6969 (100.0%), 735.75 column/sec. Elapsed time 9.47 sec
23735.5s 4094 EvaluatorHoldout: Ignoring 33 ( 0.1%) Users that have less than 1 test interactions
23750.7s 4095 EvaluatorHoldout: Processed 27062 (100.0%) in 15.34 sec. Users per second: 1764
23751.2s 4096 Unable to load Cython Compute_Similarity, reverting to Python
23760.7s 4097 Similarity column 6969 (100.0%), 737.70 column/sec. Elapsed time 9.45 sec
23760.7s 4098 EvaluatorHoldout: Ignoring 28 ( 0.1%) Users that have less than 1 test interactions
23776.0s 4099 EvaluatorHoldout: Processed 27067 (100.0%) in 15.44 sec. Users per second: 1753
23776.4s 4100 Unable to load Cython Compute_Similarity, reverting to Python
23785.6s 4101 Similarity column 6969 (100.0%), 749.14 column/sec. Elapsed time 9.30 sec
23785.8s 4102 EvaluatorHoldout: Ignoring 40 ( 0.1%) Users that have less than 1 test interactions
23801.2s 4103 EvaluatorHoldout: Processed 27055 (100.0%) in 15.37 sec. Users per second: 1761
23801.5s 4104 Unable to load Cython Compute_Similarity, reverting to Python
23810.9s 4105 Similarity column 6969 (100.0%), 723.27 column/sec. Elapsed time 9.64 sec
23811.1s 4106 EvaluatorHoldout: Ignoring 21 ( 0.1%) Users that have less than 1 test interactions
23826.2s 4107 EvaluatorHoldout: Processed 27074 (100.0%) in 15.30 sec. Users per second: 1769
23826.7s 4108 Unable to load Cython Compute_Similarity, reverting to Python
23836.3s 4109 Similarity column 6969 (100.0%), 727.83 column/sec. Elapsed time 9.58 sec
23836.3s 4110 EvaluatorHoldout: Ignoring 29 ( 0.1%) Users that have less than 1 test interactions
23851.4s 4111 EvaluatorHoldout: Processed 27066 (100.0%) in 15.30 sec. Users per second: 1769
23851.4s 4112 [I 2025-12-07 15:31:26,963] Trial 169 finished with value: 0.2173970633392989 and parameters: {'similarity': 'tversky', 'topK': 61, 'shrink': 234, 'tversky_alpha': 0.28979124495369607, 'tversky_beta': 1.6035891025331825}. Best is trial 91 with value: 0.24993110179607925.
23851.4s 4113 
23851.4s 4114 [I 2025-12-07 15:31:26,963] Trial 169 finished with value: 0.2173970633392989 and parameters: {'similarity': 'tversky', 'topK': 61, 'shrink': 234, 'tversky_alpha': 0.28979124495369607, 'tversky_beta': 1.6035891025331825}. Best is trial 91 with value: 0.24993110179607925.
23851.6s 4115 [0.21678487476087524, 0.21777531716839374, 0.21739721200596776, 0.21690199344173824, 0.2181259193195195]
23851.9s 4116 Unable to load Cython Compute_Similarity, reverting to Python
23860.8s 4117 Similarity column 6969 (100.0%), 766.39 column/sec. Elapsed time 9.09 sec
23861.0s 4118 EvaluatorHoldout: Ignoring 33 ( 0.1%) Users that have less than 1 test interactions
23875.4s 4119 EvaluatorHoldout: Processed 27062 (100.0%) in 14.34 sec. Users per second: 1887
23875.7s 4120 Unable to load Cython Compute_Similarity, reverting to Python
23884.7s 4121 Similarity column 6969 (100.0%), 763.17 column/sec. Elapsed time 9.13 sec
23884.9s 4122 EvaluatorHoldout: Ignoring 28 ( 0.1%) Users that have less than 1 test interactions
23898.8s 4123 EvaluatorHoldout: Processed 27067 (100.0%) in 14.12 sec. Users per second: 1916
23899.3s 4124 Unable to load Cython Compute_Similarity, reverting to Python
23908.7s 4125 Similarity column 6969 (100.0%), 742.56 column/sec. Elapsed time 9.39 sec
23908.7s 4126 EvaluatorHoldout: Ignoring 40 ( 0.1%) Users that have less than 1 test interactions
23922.8s 4127 EvaluatorHoldout: Processed 27055 (100.0%) in 14.24 sec. Users per second: 1899
23923.2s 4128 Unable to load Cython Compute_Similarity, reverting to Python
23932.3s 4129 Similarity column 6969 (100.0%), 752.82 column/sec. Elapsed time 9.26 sec
23932.5s 4130 EvaluatorHoldout: Ignoring 21 ( 0.1%) Users that have less than 1 test interactions
23946.7s 4131 EvaluatorHoldout: Processed 27074 (100.0%) in 14.17 sec. Users per second: 1910
23947.0s 4132 Unable to load Cython Compute_Similarity, reverting to Python
23956.0s 4133 Similarity column 6969 (100.0%), 761.21 column/sec. Elapsed time 9.16 sec
23956.2s 4134 EvaluatorHoldout: Ignoring 29 ( 0.1%) Users that have less than 1 test interactions
23970.1s 4135 EvaluatorHoldout: Processed 27066 (100.0%) in 14.12 sec. Users per second: 1916
23970.1s 4136 [I 2025-12-07 15:33:25,629] Trial 170 finished with value: 0.23992920876010887 and parameters: {'similarity': 'tversky', 'topK': 25, 'shrink': 74, 'tversky_alpha': 0.25269234006441554, 'tversky_beta': 1.7687106902966825}. Best is trial 91 with value: 0.24993110179607925.
23970.1s 4137 
23970.1s 4138 [I 2025-12-07 15:33:25,629] Trial 170 finished with value: 0.23992920876010887 and parameters: {'similarity': 'tversky', 'topK': 25, 'shrink': 74, 'tversky_alpha': 0.25269234006441554, 'tversky_beta': 1.7687106902966825}. Best is trial 91 with value: 0.24993110179607925.
23970.3s 4139 [0.23942585261168658, 0.2403306582989982, 0.2416792860082789, 0.23847742740837208, 0.2397328194732085]
23970.6s 4140 Unable to load Cython Compute_Similarity, reverting to Python
23979.6s 4141 Similarity column 6969 (100.0%), 774.53 column/sec. Elapsed time 9.00 sec
23979.6s 4142 EvaluatorHoldout: Ignoring 33 ( 0.1%) Users that have less than 1 test interactions
23993.1s 4143 EvaluatorHoldout: Processed 27062 (100.0%) in 13.66 sec. Users per second: 1982
23993.6s 4144 Unable to load Cython Compute_Similarity, reverting to Python
24002.5s 4145 Similarity column 6969 (100.0%), 766.99 column/sec. Elapsed time 9.09 sec
24002.7s 4146 EvaluatorHoldout: Ignoring 28 ( 0.1%) Users that have less than 1 test interactions
24016.5s 4147 EvaluatorHoldout: Processed 27067 (100.0%) in 13.67 sec. Users per second: 1981
24016.7s 4148 Unable to load Cython Compute_Similarity, reverting to Python
24026.0s 4149 Similarity column 6969 (100.0%), 731.81 column/sec. Elapsed time 9.52 sec
24026.2s 4150 EvaluatorHoldout: Ignoring 40 ( 0.1%) Users that have less than 1 test interactions
24039.6s 4151 EvaluatorHoldout: Processed 27055 (100.0%) in 13.58 sec. Users per second: 1992
24040.1s 4152 Unable to load Cython Compute_Similarity, reverting to Python
24049.3s 4153 Similarity column 6969 (100.0%), 754.21 column/sec. Elapsed time 9.24 sec
24049.3s 4154 EvaluatorHoldout: Ignoring 21 ( 0.1%) Users that have less than 1 test interactions
24062.8s 4155 EvaluatorHoldout: Processed 27074 (100.0%) in 13.63 sec. Users per second: 1986
24063.3s 4156 Unable to load Cython Compute_Similarity, reverting to Python
24071.9s 4157 Similarity column 6969 (100.0%), 788.18 column/sec. Elapsed time 8.84 sec
24072.1s 4158 EvaluatorHoldout: Ignoring 29 ( 0.1%) Users that have less than 1 test interactions
24085.8s 4159 EvaluatorHoldout: Processed 27066 (100.0%) in 13.64 sec. Users per second: 1984
24085.8s 4160 [I 2025-12-07 15:35:21,103] Trial 171 finished with value: 0.2479489564829403 and parameters: {'similarity': 'tversky', 'topK': 5, 'shrink': 156, 'tversky_alpha': 0.4178789565644275, 'tversky_beta': 1.6777284653106694}. Best is trial 91 with value: 0.24993110179607925.
24085.8s 4161 
24085.8s 4162 [I 2025-12-07 15:35:21,103] Trial 171 finished with value: 0.2479489564829403 and parameters: {'similarity': 'tversky', 'topK': 5, 'shrink': 156, 'tversky_alpha': 0.4178789565644275, 'tversky_beta': 1.6777284653106694}. Best is trial 91 with value: 0.24993110179607925.
24085.8s 4163 [0.24705061089249122, 0.2487948689094915, 0.24920511231806114, 0.2470585106029812, 0.24763567969167632]
24086.1s 4164 Unable to load Cython Compute_Similarity, reverting to Python
24095.0s 4165 Similarity column 6969 (100.0%), 768.82 column/sec. Elapsed time 9.06 sec
24095.2s 4166 EvaluatorHoldout: Ignoring 33 ( 0.1%) Users that have less than 1 test interactions
24109.2s 4167 EvaluatorHoldout: Processed 27062 (100.0%) in 14.19 sec. Users per second: 1908
24109.7s 4168 Unable to load Cython Compute_Similarity, reverting to Python
24119.2s 4169 Similarity column 6969 (100.0%), 732.60 column/sec. Elapsed time 9.51 sec
24119.2s 4170 EvaluatorHoldout: Ignoring 28 ( 0.1%) Users that have less than 1 test interactions
24133.3s 4171 EvaluatorHoldout: Processed 27067 (100.0%) in 14.29 sec. Users per second: 1894
24133.8s 4172 Unable to load Cython Compute_Similarity, reverting to Python
24143.1s 4173 Similarity column 6969 (100.0%), 736.03 column/sec. Elapsed time 9.47 sec
24143.3s 4174 EvaluatorHoldout: Ignoring 40 ( 0.1%) Users that have less than 1 test interactions
24157.4s 4175 EvaluatorHoldout: Processed 27055 (100.0%) in 14.15 sec. Users per second: 1912
24157.7s 4176 Unable to load Cython Compute_Similarity, reverting to Python
24166.6s 4177 Similarity column 6969 (100.0%), 769.29 column/sec. Elapsed time 9.06 sec
24166.8s 4178 EvaluatorHoldout: Ignoring 21 ( 0.1%) Users that have less than 1 test interactions
24180.7s 4179 EvaluatorHoldout: Processed 27074 (100.0%) in 14.12 sec. Users per second: 1917
24181.2s 4180 Unable to load Cython Compute_Similarity, reverting to Python
24190.5s 4181 Similarity column 6969 (100.0%), 752.56 column/sec. Elapsed time 9.26 sec
24190.5s 4182 EvaluatorHoldout: Ignoring 29 ( 0.1%) Users that have less than 1 test interactions
24204.3s 4183 EvaluatorHoldout: Processed 27066 (100.0%) in 14.01 sec. Users per second: 1932
24204.4s 4184 [I 2025-12-07 15:37:19,872] Trial 172 finished with value: 0.23757717107602913 and parameters: {'similarity': 'tversky', 'topK': 20, 'shrink': 117, 'tversky_alpha': 0.3529385132420293, 'tversky_beta': 1.6729520480348694}. Best is trial 91 with value: 0.24993110179607925.
24204.4s 4185 
24204.4s 4186 [I 2025-12-07 15:37:19,872] Trial 172 finished with value: 0.23757717107602913 and parameters: {'similarity': 'tversky', 'topK': 20, 'shrink': 117, 'tversky_alpha': 0.3529385132420293, 'tversky_beta': 1.6729520480348694}. Best is trial 91 with value: 0.24993110179607925.
24204.5s 4187 [0.2377783989886554, 0.23774374949447855, 0.23938569007437757, 0.23611552944037068, 0.23686248738226354]
24204.9s 4188 Unable to load Cython Compute_Similarity, reverting to Python
24213.7s 4189 Similarity column 6969 (100.0%), 767.13 column/sec. Elapsed time 9.08 sec
24213.9s 4190 EvaluatorHoldout: Ignoring 33 ( 0.1%) Users that have less than 1 test interactions
24229.0s 4191 EvaluatorHoldout: Processed 27062 (100.0%) in 15.03 sec. Users per second: 1800
24229.3s 4192 Unable to load Cython Compute_Similarity, reverting to Python
24238.2s 4193 Similarity column 6969 (100.0%), 766.61 column/sec. Elapsed time 9.09 sec
24238.4s 4194 EvaluatorHoldout: Ignoring 28 ( 0.1%) Users that have less than 1 test interactions
24253.5s 4195 EvaluatorHoldout: Processed 27067 (100.0%) in 15.24 sec. Users per second: 1776
24254.0s 4196 Unable to load Cython Compute_Similarity, reverting to Python
24263.2s 4197 Similarity column 6969 (100.0%), 756.80 column/sec. Elapsed time 9.21 sec
24263.2s 4198 EvaluatorHoldout: Ignoring 40 ( 0.1%) Users that have less than 1 test interactions
24278.1s 4199 EvaluatorHoldout: Processed 27055 (100.0%) in 15.09 sec. Users per second: 1793
24278.6s 4200 Unable to load Cython Compute_Similarity, reverting to Python
24287.7s 4201 Similarity column 6969 (100.0%), 747.06 column/sec. Elapsed time 9.33 sec
24287.9s 4202 EvaluatorHoldout: Ignoring 21 ( 0.1%) Users that have less than 1 test interactions
24303.2s 4203 EvaluatorHoldout: Processed 27074 (100.0%) in 15.26 sec. Users per second: 1775
24303.5s 4204 Unable to load Cython Compute_Similarity, reverting to Python
24312.8s 4205 Similarity column 6969 (100.0%), 735.15 column/sec. Elapsed time 9.48 sec
24313.0s 4206 EvaluatorHoldout: Ignoring 29 ( 0.1%) Users that have less than 1 test interactions
24328.0s 4207 EvaluatorHoldout: Processed 27066 (100.0%) in 15.20 sec. Users per second: 1781
