8875.5s 1354 [I 2025-12-07 11:21:50,969] Trial 54 finished with value: 0.23775050868545167 and parameters: {'similarity': 'tversky', 'topK': 28, 'shrink': 550, 'tversky_alpha': 0.03502197943883145, 'tversky_beta': 1.7916616574445885}. Best is trial 28 with value: 0.23872565913262506.
8875.6s 1355 [0.23719386946296467, 0.23808341519731338, 0.23876815760766212, 0.2366091634495398, 0.23809793770977838]
8876.0s 1356 Unable to load Cython Compute_Similarity, reverting to Python
8885.3s 1357 Similarity column 6969 (100.0%), 731.83 column/sec. Elapsed time 9.52 sec
8885.5s 1358 EvaluatorHoldout: Ignoring 33 ( 0.1%) Users that have less than 1 test interactions
8900.3s 1359 EvaluatorHoldout: Processed 27062 (100.0%) in 14.96 sec. Users per second: 1809
8900.8s 1360 Unable to load Cython Compute_Similarity, reverting to Python
8909.8s 1361 Similarity column 6969 (100.0%), 756.54 column/sec. Elapsed time 9.21 sec
8910.0s 1362 EvaluatorHoldout: Ignoring 28 ( 0.1%) Users that have less than 1 test interactions
8924.8s 1363 EvaluatorHoldout: Processed 27067 (100.0%) in 15.03 sec. Users per second: 1801
8925.3s 1364 Unable to load Cython Compute_Similarity, reverting to Python
8935.3s 1365 Similarity column 6969 (100.0%), 690.25 column/sec. Elapsed time 10.10 sec
8935.4s 1366 EvaluatorHoldout: Ignoring 40 ( 0.1%) Users that have less than 1 test interactions
8950.3s 1367 EvaluatorHoldout: Processed 27055 (100.0%) in 15.04 sec. Users per second: 1799
8950.8s 1368 Unable to load Cython Compute_Similarity, reverting to Python
8960.1s 1369 Similarity column 6969 (100.0%), 729.44 column/sec. Elapsed time 9.55 sec
8960.3s 1370 EvaluatorHoldout: Ignoring 21 ( 0.1%) Users that have less than 1 test interactions
8975.3s 1371 EvaluatorHoldout: Processed 27074 (100.0%) in 15.09 sec. Users per second: 1794
8975.8s 1372 Unable to load Cython Compute_Similarity, reverting to Python
8985.0s 1373 Similarity column 6969 (100.0%), 738.58 column/sec. Elapsed time 9.44 sec
8985.2s 1374 EvaluatorHoldout: Ignoring 29 ( 0.1%) Users that have less than 1 test interactions
9000.1s 1375 EvaluatorHoldout: Processed 27066 (100.0%) in 15.09 sec. Users per second: 1794
9000.1s 1376 [I 2025-12-07 11:23:55,638] Trial 55 finished with value: 0.2350640874112106 and parameters: {'similarity': 'tversky', 'topK': 35, 'shrink': 539, 'tversky_alpha': 0.04557565438886671, 'tversky_beta': 1.8209551777605402}. Best is trial 28 with value: 0.23872565913262506.
9000.1s 1377 
9000.1s 1378 [I 2025-12-07 11:23:55,638] Trial 55 finished with value: 0.2350640874112106 and parameters: {'similarity': 'tversky', 'topK': 35, 'shrink': 539, 'tversky_alpha': 0.04557565438886671, 'tversky_beta': 1.8209551777605402}. Best is trial 28 with value: 0.23872565913262506.
9000.3s 1379 [0.23449705163172188, 0.23480713710110832, 0.23597071725665938, 0.233925816655919, 0.23611971441064444]
9000.6s 1380 Unable to load Cython Compute_Similarity, reverting to Python
9010.6s 1381 Similarity column 6969 (100.0%), 688.14 column/sec. Elapsed time 10.13 sec
9010.7s 1382 EvaluatorHoldout: Ignoring 33 ( 0.1%) Users that have less than 1 test interactions
9029.3s 1383 EvaluatorHoldout: Processed 27062 (100.0%) in 18.71 sec. Users per second: 1446
9029.8s 1384 Unable to load Cython Compute_Similarity, reverting to Python
9039.7s 1385 Similarity column 6969 (100.0%), 691.39 column/sec. Elapsed time 10.08 sec
9039.9s 1386 EvaluatorHoldout: Ignoring 28 ( 0.1%) Users that have less than 1 test interactions
9058.7s 1387 EvaluatorHoldout: Processed 27067 (100.0%) in 18.87 sec. Users per second: 1434
9059.1s 1388 Unable to load Cython Compute_Similarity, reverting to Python
9069.1s 1389 Similarity column 6969 (100.0%), 684.54 column/sec. Elapsed time 10.18 sec
9069.3s 1390 EvaluatorHoldout: Ignoring 40 ( 0.1%) Users that have less than 1 test interactions
9087.9s 1391 EvaluatorHoldout: Processed 27055 (100.0%) in 18.77 sec. Users per second: 1442
9088.4s 1392 Unable to load Cython Compute_Similarity, reverting to Python
9098.0s 1393 Similarity column 6969 (100.0%), 710.49 column/sec. Elapsed time 9.81 sec
9098.2s 1394 EvaluatorHoldout: Ignoring 21 ( 0.1%) Users that have less than 1 test interactions
9116.6s 1395 EvaluatorHoldout: Processed 27074 (100.0%) in 18.58 sec. Users per second: 1457
9117.1s 1396 Unable to load Cython Compute_Similarity, reverting to Python
9126.8s 1397 Similarity column 6969 (100.0%), 704.90 column/sec. Elapsed time 9.89 sec
9127.0s 1398 EvaluatorHoldout: Ignoring 29 ( 0.1%) Users that have less than 1 test interactions
9145.6s 1399 EvaluatorHoldout: Processed 27066 (100.0%) in 18.73 sec. Users per second: 1445
9145.6s 1400 [I 2025-12-07 11:26:21,089] Trial 56 finished with value: 0.19666560487525617 and parameters: {'similarity': 'tversky', 'topK': 130, 'shrink': 693, 'tversky_alpha': 0.7327427990999031, 'tversky_beta': 1.1305030454415759}. Best is trial 28 with value: 0.23872565913262506.
9145.6s 1401 
9145.6s 1402 [I 2025-12-07 11:26:21,089] Trial 56 finished with value: 0.19666560487525617 and parameters: {'similarity': 'tversky', 'topK': 130, 'shrink': 693, 'tversky_alpha': 0.7327427990999031, 'tversky_beta': 1.1305030454415759}. Best is trial 28 with value: 0.23872565913262506.
9145.8s 1403 [0.19581331778455305, 0.19683010317493502, 0.1974111063355944, 0.19601941893144872, 0.19725407814974968]
9146.1s 1404 Unable to load Cython Compute_Similarity, reverting to Python
9155.2s 1405 Similarity column 6969 (100.0%), 746.96 column/sec. Elapsed time 9.33 sec
9155.4s 1406 EvaluatorHoldout: Ignoring 33 ( 0.1%) Users that have less than 1 test interactions
9170.8s 1407 EvaluatorHoldout: Processed 27062 (100.0%) in 15.57 sec. Users per second: 1738
9171.3s 1408 Unable to load Cython Compute_Similarity, reverting to Python
9180.4s 1409 Similarity column 6969 (100.0%), 759.59 column/sec. Elapsed time 9.17 sec
9180.5s 1410 EvaluatorHoldout: Ignoring 28 ( 0.1%) Users that have less than 1 test interactions
9195.9s 1411 EvaluatorHoldout: Processed 27067 (100.0%) in 15.54 sec. Users per second: 1742
9196.3s 1412 Unable to load Cython Compute_Similarity, reverting to Python
9205.5s 1413 Similarity column 6969 (100.0%), 746.20 column/sec. Elapsed time 9.34 sec
9205.7s 1414 EvaluatorHoldout: Ignoring 40 ( 0.1%) Users that have less than 1 test interactions
9221.0s 1415 EvaluatorHoldout: Processed 27055 (100.0%) in 15.41 sec. Users per second: 1756
9221.4s 1416 Unable to load Cython Compute_Similarity, reverting to Python
9230.2s 1417 Similarity column 6969 (100.0%), 772.85 column/sec. Elapsed time 9.02 sec
9230.4s 1418 EvaluatorHoldout: Ignoring 21 ( 0.1%) Users that have less than 1 test interactions
9245.9s 1419 EvaluatorHoldout: Processed 27074 (100.0%) in 15.62 sec. Users per second: 1733
9246.4s 1420 Unable to load Cython Compute_Similarity, reverting to Python
9255.3s 1421 Similarity column 6969 (100.0%), 770.89 column/sec. Elapsed time 9.04 sec
9255.4s 1422 EvaluatorHoldout: Ignoring 29 ( 0.1%) Users that have less than 1 test interactions
9270.6s 1423 EvaluatorHoldout: Processed 27066 (100.0%) in 15.38 sec. Users per second: 1759
9270.6s 1424 [I 2025-12-07 11:28:26,157] Trial 57 finished with value: 0.20774121066481327 and parameters: {'similarity': 'tversky', 'topK': 34, 'shrink': 571, 'tversky_alpha': 0.7126261684424134, 'tversky_beta': 1.216311086994033}. Best is trial 28 with value: 0.23872565913262506.
9270.6s 1425 
9270.6s 1426 [I 2025-12-07 11:28:26,157] Trial 57 finished with value: 0.20774121066481327 and parameters: {'similarity': 'tversky', 'topK': 34, 'shrink': 571, 'tversky_alpha': 0.7126261684424134, 'tversky_beta': 1.216311086994033}. Best is trial 28 with value: 0.23872565913262506.
9270.8s 1427 [0.2073561323228124, 0.2085447532093254, 0.20842523967192125, 0.20646693914549197, 0.20791298897451532]
9271.1s 1428 Unable to load Cython Compute_Similarity, reverting to Python
9281.2s 1429 Similarity column 6969 (100.0%), 677.48 column/sec. Elapsed time 10.29 sec
9281.4s 1430 EvaluatorHoldout: Ignoring 33 ( 0.1%) Users that have less than 1 test interactions
9299.6s 1431 EvaluatorHoldout: Processed 27062 (100.0%) in 18.29 sec. Users per second: 1480
9300.1s 1432 Unable to load Cython Compute_Similarity, reverting to Python
9310.3s 1433 Similarity column 6969 (100.0%), 668.08 column/sec. Elapsed time 10.43 sec
9310.5s 1434 EvaluatorHoldout: Ignoring 28 ( 0.1%) Users that have less than 1 test interactions
9328.7s 1435 EvaluatorHoldout: Processed 27067 (100.0%) in 18.36 sec. Users per second: 1474
9329.2s 1436 Unable to load Cython Compute_Similarity, reverting to Python
9339.2s 1437 Similarity column 6969 (100.0%), 685.62 column/sec. Elapsed time 10.16 sec
9339.4s 1438 EvaluatorHoldout: Ignoring 40 ( 0.1%) Users that have less than 1 test interactions
9357.6s 1439 EvaluatorHoldout: Processed 27055 (100.0%) in 18.37 sec. Users per second: 1473
9358.1s 1440 Unable to load Cython Compute_Similarity, reverting to Python
9368.1s 1441 Similarity column 6969 (100.0%), 680.06 column/sec. Elapsed time 10.25 sec
9368.3s 1442 EvaluatorHoldout: Ignoring 21 ( 0.1%) Users that have less than 1 test interactions
9386.8s 1443 EvaluatorHoldout: Processed 27074 (100.0%) in 18.55 sec. Users per second: 1460
9387.2s 1444 Unable to load Cython Compute_Similarity, reverting to Python
9397.2s 1445 Similarity column 6969 (100.0%), 680.73 column/sec. Elapsed time 10.24 sec
9397.4s 1446 EvaluatorHoldout: Ignoring 29 ( 0.1%) Users that have less than 1 test interactions
9416.0s 1447 EvaluatorHoldout: Processed 27066 (100.0%) in 18.69 sec. Users per second: 1448
9416.0s 1448 [I 2025-12-07 11:30:51,506] Trial 58 finished with value: 0.20091107476661238 and parameters: {'similarity': 'tversky', 'topK': 186, 'shrink': 408, 'tversky_alpha': 1.5029623555229037, 'tversky_beta': 1.8965393162096695}. Best is trial 28 with value: 0.23872565913262506.
9416.0s 1449 
9416.0s 1450 [I 2025-12-07 11:30:51,506] Trial 58 finished with value: 0.20091107476661238 and parameters: {'similarity': 'tversky', 'topK': 186, 'shrink': 408, 'tversky_alpha': 1.5029623555229037, 'tversky_beta': 1.8965393162096695}. Best is trial 28 with value: 0.23872565913262506.
9416.2s 1451 [0.20065019346914215, 0.20134982146695085, 0.20124252304325985, 0.20001241912933976, 0.20130041672436927]
9416.5s 1452 Unable to load Cython Compute_Similarity, reverting to Python
9427.1s 1453 Similarity column 6969 (100.0%), 650.27 column/sec. Elapsed time 10.72 sec
9427.2s 1454 EvaluatorHoldout: Ignoring 33 ( 0.1%) Users that have less than 1 test interactions
9448.3s 1455 EvaluatorHoldout: Processed 27062 (100.0%) in 21.19 sec. Users per second: 1277
9448.7s 1456 Unable to load Cython Compute_Similarity, reverting to Python
9459.1s 1457 Similarity column 6969 (100.0%), 662.67 column/sec. Elapsed time 10.52 sec
9459.3s 1458 EvaluatorHoldout: Ignoring 28 ( 0.1%) Users that have less than 1 test interactions
9481.0s 1459 EvaluatorHoldout: Processed 27067 (100.0%) in 21.84 sec. Users per second: 1239
9481.5s 1460 Unable to load Cython Compute_Similarity, reverting to Python
9492.0s 1461 Similarity column 6969 (100.0%), 655.15 column/sec. Elapsed time 10.64 sec
9492.1s 1462 EvaluatorHoldout: Ignoring 40 ( 0.1%) Users that have less than 1 test interactions
9513.5s 1463 EvaluatorHoldout: Processed 27055 (100.0%) in 21.58 sec. Users per second: 1254
9514.0s 1464 Unable to load Cython Compute_Similarity, reverting to Python
9524.7s 1465 Similarity column 6969 (100.0%), 647.84 column/sec. Elapsed time 10.76 sec
9524.8s 1466 EvaluatorHoldout: Ignoring 21 ( 0.1%) Users that have less than 1 test interactions
9546.2s 1467 EvaluatorHoldout: Processed 27074 (100.0%) in 21.55 sec. Users per second: 1256
9546.7s 1468 Unable to load Cython Compute_Similarity, reverting to Python
9557.2s 1469 Similarity column 6969 (100.0%), 658.86 column/sec. Elapsed time 10.58 sec
9557.3s 1470 EvaluatorHoldout: Ignoring 29 ( 0.1%) Users that have less than 1 test interactions
9578.7s 1471 EvaluatorHoldout: Processed 27066 (100.0%) in 21.52 sec. Users per second: 1258
9578.7s 1472 [I 2025-12-07 11:33:34,191] Trial 59 finished with value: 0.1959807427085365 and parameters: {'similarity': 'dice', 'topK': 251, 'shrink': 621}. Best is trial 28 with value: 0.23872565913262506.
9578.7s 1473 
9578.7s 1474 [I 2025-12-07 11:33:34,191] Trial 59 finished with value: 0.1959807427085365 and parameters: {'similarity': 'dice', 'topK': 251, 'shrink': 621}. Best is trial 28 with value: 0.23872565913262506.
9578.9s 1475 [0.19576331865921626, 0.19642247875784402, 0.19598976920346686, 0.1948808399045306, 0.19684730701762468]
9579.2s 1476 Unable to load Cython Compute_Similarity, reverting to Python
9592.5s 1477 Similarity column 6969 (100.0%), 518.67 column/sec. Elapsed time 13.44 sec
9592.6s 1478 EvaluatorHoldout: Ignoring 33 ( 0.1%) Users that have less than 1 test interactions
9618.2s 1479 EvaluatorHoldout: Processed 27062 (100.0%) in 25.63 sec. Users per second: 1056
9618.7s 1480 Unable to load Cython Compute_Similarity, reverting to Python
9631.8s 1481 Similarity column 6969 (100.0%), 526.86 column/sec. Elapsed time 13.23 sec
9631.9s 1482 EvaluatorHoldout: Ignoring 28 ( 0.1%) Users that have less than 1 test interactions
9657.5s 1483 EvaluatorHoldout: Processed 27067 (100.0%) in 25.72 sec. Users per second: 1052
9658.0s 1484 Unable to load Cython Compute_Similarity, reverting to Python
9671.1s 1485 Similarity column 6969 (100.0%), 528.71 column/sec. Elapsed time 13.18 sec
9671.2s 1486 EvaluatorHoldout: Ignoring 40 ( 0.1%) Users that have less than 1 test interactions
9696.9s 1487 EvaluatorHoldout: Processed 27055 (100.0%) in 25.76 sec. Users per second: 1050
9697.4s 1488 Unable to load Cython Compute_Similarity, reverting to Python
9710.5s 1489 Similarity column 6969 (100.0%), 527.36 column/sec. Elapsed time 13.21 sec
9710.6s 1490 EvaluatorHoldout: Ignoring 21 ( 0.1%) Users that have less than 1 test interactions
9736.2s 1491 EvaluatorHoldout: Processed 27074 (100.0%) in 25.70 sec. Users per second: 1054
9736.7s 1492 Unable to load Cython Compute_Similarity, reverting to Python
9749.8s 1493 Similarity column 6969 (100.0%), 526.18 column/sec. Elapsed time 13.24 sec
9750.0s 1494 EvaluatorHoldout: Ignoring 29 ( 0.1%) Users that have less than 1 test interactions
9775.7s 1495 EvaluatorHoldout: Processed 27066 (100.0%) in 25.82 sec. Users per second: 1048
9775.7s 1496 [I 2025-12-07 11:36:51,216] Trial 60 finished with value: 0.18951844696471004 and parameters: {'similarity': 'jaccard', 'topK': 584, 'shrink': 502}. Best is trial 28 with value: 0.23872565913262506.
9775.7s 1497 
9775.7s 1498 [I 2025-12-07 11:36:51,216] Trial 60 finished with value: 0.18951844696471004 and parameters: {'similarity': 'jaccard', 'topK': 584, 'shrink': 502}. Best is trial 28 with value: 0.23872565913262506.
9775.9s 1499 [0.18877097774987414, 0.19024689895685165, 0.1895993323796324, 0.18896060448267823, 0.19001442125451382]
9776.2s 1500 Unable to load Cython Compute_Similarity, reverting to Python
9785.2s 1501 Similarity column 6969 (100.0%), 764.59 column/sec. Elapsed time 9.11 sec
9785.3s 1502 EvaluatorHoldout: Ignoring 33 ( 0.1%) Users that have less than 1 test interactions
9799.9s 1503 EvaluatorHoldout: Processed 27062 (100.0%) in 14.79 sec. Users per second: 1829
9800.4s 1504 Unable to load Cython Compute_Similarity, reverting to Python
9809.4s 1505 Similarity column 6969 (100.0%), 760.85 column/sec. Elapsed time 9.16 sec
9809.6s 1506 EvaluatorHoldout: Ignoring 28 ( 0.1%) Users that have less than 1 test interactions
9824.4s 1507 EvaluatorHoldout: Processed 27067 (100.0%) in 14.91 sec. Users per second: 1815
9824.8s 1508 Unable to load Cython Compute_Similarity, reverting to Python
9834.0s 1509 Similarity column 6969 (100.0%), 740.22 column/sec. Elapsed time 9.41 sec
9834.2s 1510 EvaluatorHoldout: Ignoring 40 ( 0.1%) Users that have less than 1 test interactions
9849.0s 1511 EvaluatorHoldout: Processed 27055 (100.0%) in 14.92 sec. Users per second: 1814
9849.5s 1512 Unable to load Cython Compute_Similarity, reverting to Python
9858.4s 1513 Similarity column 6969 (100.0%), 768.21 column/sec. Elapsed time 9.07 sec
9858.5s 1514 EvaluatorHoldout: Ignoring 21 ( 0.1%) Users that have less than 1 test interactions
9873.2s 1515 EvaluatorHoldout: Processed 27074 (100.0%) in 14.89 sec. Users per second: 1819
9873.7s 1516 Unable to load Cython Compute_Similarity, reverting to Python
9882.5s 1517 Similarity column 6969 (100.0%), 773.76 column/sec. Elapsed time 9.01 sec
9882.7s 1518 EvaluatorHoldout: Ignoring 29 ( 0.1%) Users that have less than 1 test interactions
9897.5s 1519 EvaluatorHoldout: Processed 27066 (100.0%) in 14.86 sec. Users per second: 1822
9897.5s 1520 [I 2025-12-07 11:38:52,952] Trial 61 finished with value: 0.23422677797316277 and parameters: {'similarity': 'tversky', 'topK': 32, 'shrink': 539, 'tversky_alpha': 0.027781880307017896, 'tversky_beta': 1.5414155365926203}. Best is trial 28 with value: 0.23872565913262506.
9897.5s 1521 
9897.5s 1522 [I 2025-12-07 11:38:52,952] Trial 61 finished with value: 0.23422677797316277 and parameters: {'similarity': 'tversky', 'topK': 32, 'shrink': 539, 'tversky_alpha': 0.027781880307017896, 'tversky_beta': 1.5414155365926203}. Best is trial 28 with value: 0.23872565913262506.
9897.6s 1523 [0.23389256828378793, 0.2341806900511032, 0.23521794603419938, 0.2329836316597482, 0.2348590538369752]
9897.9s 1524 Unable to load Cython Compute_Similarity, reverting to Python
9906.8s 1525 Similarity column 6969 (100.0%), 764.71 column/sec. Elapsed time 9.11 sec
9907.0s 1526 EvaluatorHoldout: Ignoring 33 ( 0.1%) Users that have less than 1 test interactions
9921.9s 1527 EvaluatorHoldout: Processed 27062 (100.0%) in 15.06 sec. Users per second: 1797
9922.4s 1528 Unable to load Cython Compute_Similarity, reverting to Python
9931.6s 1529 Similarity column 6969 (100.0%), 750.00 column/sec. Elapsed time 9.29 sec
9931.7s 1530 EvaluatorHoldout: Ignoring 28 ( 0.1%) Users that have less than 1 test interactions
9946.8s 1531 EvaluatorHoldout: Processed 27067 (100.0%) in 15.21 sec. Users per second: 1779
9947.3s 1532 Unable to load Cython Compute_Similarity, reverting to Python
9956.7s 1533 Similarity column 6969 (100.0%), 720.48 column/sec. Elapsed time 9.67 sec
9956.9s 1534 EvaluatorHoldout: Ignoring 40 ( 0.1%) Users that have less than 1 test interactions
9972.0s 1535 EvaluatorHoldout: Processed 27055 (100.0%) in 15.21 sec. Users per second: 1779
9972.5s 1536 Unable to load Cython Compute_Similarity, reverting to Python
9981.5s 1537 Similarity column 6969 (100.0%), 757.33 column/sec. Elapsed time 9.20 sec
9981.7s 1538 EvaluatorHoldout: Ignoring 21 ( 0.1%) Users that have less than 1 test interactions
9996.6s 1539 EvaluatorHoldout: Processed 27074 (100.0%) in 15.15 sec. Users per second: 1787
9997.1s 1540 Unable to load Cython Compute_Similarity, reverting to Python
10006.1s 1541 Similarity column 6969 (100.0%), 767.19 column/sec. Elapsed time 9.08 sec
10006.2s 1542 EvaluatorHoldout: Ignoring 29 ( 0.1%) Users that have less than 1 test interactions
10021.3s 1543 EvaluatorHoldout: Processed 27066 (100.0%) in 15.21 sec. Users per second: 1779
10021.3s 1544 [I 2025-12-07 11:40:56,786] Trial 62 finished with value: 0.22091507908829597 and parameters: {'similarity': 'tversky', 'topK': 37, 'shrink': 544, 'tversky_alpha': 0.4602864497364696, 'tversky_beta': 1.9985845839391687}. Best is trial 28 with value: 0.23872565913262506.
10021.3s 1545 
10021.3s 1546 [I 2025-12-07 11:40:56,786] Trial 62 finished with value: 0.22091507908829597 and parameters: {'similarity': 'tversky', 'topK': 37, 'shrink': 544, 'tversky_alpha': 0.4602864497364696, 'tversky_beta': 1.9985845839391687}. Best is trial 28 with value: 0.23872565913262506.
10021.5s 1547 [0.2207200638749258, 0.22109439283170387, 0.22182496077825892, 0.2199114236307885, 0.2210245543258028]
10021.8s 1548 Unable to load Cython Compute_Similarity, reverting to Python
10030.7s 1549 Similarity column 6969 (100.0%), 765.04 column/sec. Elapsed time 9.11 sec
10030.9s 1550 EvaluatorHoldout: Ignoring 33 ( 0.1%) Users that have less than 1 test interactions
10044.6s 1551 EvaluatorHoldout: Processed 27062 (100.0%) in 13.82 sec. Users per second: 1958
10045.0s 1552 Unable to load Cython Compute_Similarity, reverting to Python
10054.0s 1553 Similarity column 6969 (100.0%), 761.77 column/sec. Elapsed time 9.15 sec
10054.2s 1554 EvaluatorHoldout: Ignoring 28 ( 0.1%) Users that have less than 1 test interactions
10067.9s 1555 EvaluatorHoldout: Processed 27067 (100.0%) in 13.87 sec. Users per second: 1951
10068.4s 1556 Unable to load Cython Compute_Similarity, reverting to Python
10077.5s 1557 Similarity column 6969 (100.0%), 755.07 column/sec. Elapsed time 9.23 sec
10077.6s 1558 EvaluatorHoldout: Ignoring 40 ( 0.1%) Users that have less than 1 test interactions
10091.2s 1559 EvaluatorHoldout: Processed 27055 (100.0%) in 13.81 sec. Users per second: 1960
10091.7s 1560 Unable to load Cython Compute_Similarity, reverting to Python
10100.7s 1561 Similarity column 6969 (100.0%), 760.07 column/sec. Elapsed time 9.17 sec
10100.9s 1562 EvaluatorHoldout: Ignoring 21 ( 0.1%) Users that have less than 1 test interactions
10114.7s 1563 EvaluatorHoldout: Processed 27074 (100.0%) in 13.89 sec. Users per second: 1950
10115.1s 1564 Unable to load Cython Compute_Similarity, reverting to Python
10123.9s 1565 Similarity column 6969 (100.0%), 770.71 column/sec. Elapsed time 9.04 sec
10124.1s 1566 EvaluatorHoldout: Ignoring 29 ( 0.1%) Users that have less than 1 test interactions
10137.8s 1567 EvaluatorHoldout: Processed 27066 (100.0%) in 13.90 sec. Users per second: 1947
10137.9s 1568 [I 2025-12-07 11:42:53,374] Trial 63 finished with value: 0.2401408230394086 and parameters: {'similarity': 'tversky', 'topK': 6, 'shrink': 665, 'tversky_alpha': 0.3125393511116597, 'tversky_beta': 1.4764742119303214}. Best is trial 63 with value: 0.2401408230394086.
10137.9s 1569 
