25287.1s 4402 [I 2025-12-07 15:55:22,663] Trial 181 finished with value: 0.23912694694159678 and parameters: {'similarity': 'tversky', 'topK': 21, 'shrink': 271, 'tversky_alpha': 0.23654917339641063, 'tversky_beta': 1.7691658643789607}. Best is trial 91 with value: 0.24993110179607925.
25287.3s 4403 [0.23872094415853023, 0.23938244968387276, 0.2407840515485843, 0.23747613882751156, 0.23927115048948522]
25287.6s 4404 Unable to load Cython Compute_Similarity, reverting to Python
25296.3s 4405 Similarity column 6969 (100.0%), 786.78 column/sec. Elapsed time 8.86 sec
25296.5s 4406 EvaluatorHoldout: Ignoring 33 ( 0.1%) Users that have less than 1 test interactions
25309.9s 4407 EvaluatorHoldout: Processed 27062 (100.0%) in 13.35 sec. Users per second: 2027
25310.2s 4408 Unable to load Cython Compute_Similarity, reverting to Python
25318.8s 4409 Similarity column 6969 (100.0%), 791.41 column/sec. Elapsed time 8.81 sec
25319.0s 4410 EvaluatorHoldout: Ignoring 28 ( 0.1%) Users that have less than 1 test interactions
25332.3s 4411 EvaluatorHoldout: Processed 27067 (100.0%) in 13.54 sec. Users per second: 1999
25332.8s 4412 Unable to load Cython Compute_Similarity, reverting to Python
25341.6s 4413 Similarity column 6969 (100.0%), 791.75 column/sec. Elapsed time 8.80 sec
25341.6s 4414 EvaluatorHoldout: Ignoring 40 ( 0.1%) Users that have less than 1 test interactions
25354.9s 4415 EvaluatorHoldout: Processed 27055 (100.0%) in 13.44 sec. Users per second: 2014
25355.4s 4416 Unable to load Cython Compute_Similarity, reverting to Python
25364.3s 4417 Similarity column 6969 (100.0%), 766.42 column/sec. Elapsed time 9.09 sec
25364.5s 4418 EvaluatorHoldout: Ignoring 21 ( 0.1%) Users that have less than 1 test interactions
25378.0s 4419 EvaluatorHoldout: Processed 27074 (100.0%) in 13.49 sec. Users per second: 2007
25378.3s 4420 Unable to load Cython Compute_Similarity, reverting to Python
25386.9s 4421 Similarity column 6969 (100.0%), 785.59 column/sec. Elapsed time 8.87 sec
25387.1s 4422 EvaluatorHoldout: Ignoring 29 ( 0.1%) Users that have less than 1 test interactions
25400.4s 4423 EvaluatorHoldout: Processed 27066 (100.0%) in 13.45 sec. Users per second: 2012
25400.4s 4424 [I 2025-12-07 15:57:15,953] Trial 182 finished with value: 0.2514384438125787 and parameters: {'similarity': 'tversky', 'topK': 6, 'shrink': 190, 'tversky_alpha': 0.19268184516318373, 'tversky_beta': 1.636737374198331}. Best is trial 182 with value: 0.2514384438125787.
25400.4s 4425 
25400.4s 4426 [I 2025-12-07 15:57:15,953] Trial 182 finished with value: 0.2514384438125787 and parameters: {'similarity': 'tversky', 'topK': 6, 'shrink': 190, 'tversky_alpha': 0.19268184516318373, 'tversky_beta': 1.636737374198331}. Best is trial 182 with value: 0.2514384438125787.
25400.6s 4427 [0.25141090754056483, 0.2520417290745687, 0.2522157477061386, 0.2504060962397783, 0.25111773850184305]
25400.9s 4428 Unable to load Cython Compute_Similarity, reverting to Python
25410.1s 4429 Similarity column 6969 (100.0%), 762.43 column/sec. Elapsed time 9.14 sec
25410.1s 4430 EvaluatorHoldout: Ignoring 33 ( 0.1%) Users that have less than 1 test interactions
25423.9s 4431 EvaluatorHoldout: Processed 27062 (100.0%) in 13.96 sec. Users per second: 1938
25424.4s 4432 Unable to load Cython Compute_Similarity, reverting to Python
25433.5s 4433 Similarity column 6969 (100.0%), 750.71 column/sec. Elapsed time 9.28 sec
25433.7s 4434 EvaluatorHoldout: Ignoring 28 ( 0.1%) Users that have less than 1 test interactions
25447.8s 4435 EvaluatorHoldout: Processed 27067 (100.0%) in 14.10 sec. Users per second: 1919
25448.1s 4436 Unable to load Cython Compute_Similarity, reverting to Python
25457.1s 4437 Similarity column 6969 (100.0%), 754.80 column/sec. Elapsed time 9.23 sec
25457.3s 4438 EvaluatorHoldout: Ignoring 40 ( 0.1%) Users that have less than 1 test interactions
25471.1s 4439 EvaluatorHoldout: Processed 27055 (100.0%) in 13.95 sec. Users per second: 1939
25471.6s 4440 Unable to load Cython Compute_Similarity, reverting to Python
25480.7s 4441 Similarity column 6969 (100.0%), 765.17 column/sec. Elapsed time 9.11 sec
25480.7s 4442 EvaluatorHoldout: Ignoring 21 ( 0.1%) Users that have less than 1 test interactions
25494.6s 4443 EvaluatorHoldout: Processed 27074 (100.0%) in 14.07 sec. Users per second: 1925
25495.1s 4444 Unable to load Cython Compute_Similarity, reverting to Python
25503.9s 4445 Similarity column 6969 (100.0%), 775.94 column/sec. Elapsed time 8.98 sec
25504.1s 4446 EvaluatorHoldout: Ignoring 29 ( 0.1%) Users that have less than 1 test interactions
25518.1s 4447 EvaluatorHoldout: Processed 27066 (100.0%) in 14.02 sec. Users per second: 1931
25518.1s 4448 [I 2025-12-07 15:59:13,426] Trial 183 finished with value: 0.24115731577809268 and parameters: {'similarity': 'tversky', 'topK': 25, 'shrink': 53, 'tversky_alpha': 0.1802062651137758, 'tversky_beta': 1.537556753587637}. Best is trial 182 with value: 0.2514384438125787.
25518.1s 4449 
25518.1s 4450 [I 2025-12-07 15:59:13,426] Trial 183 finished with value: 0.24115731577809268 and parameters: {'similarity': 'tversky', 'topK': 25, 'shrink': 53, 'tversky_alpha': 0.1802062651137758, 'tversky_beta': 1.537556753587637}. Best is trial 182 with value: 0.2514384438125787.
25518.1s 4451 [0.2406763471417035, 0.24056136594993272, 0.24287651294149637, 0.24044709900078187, 0.24122525385654897]
25518.4s 4452 Unable to load Cython Compute_Similarity, reverting to Python
25527.3s 4453 Similarity column 6969 (100.0%), 770.35 column/sec. Elapsed time 9.05 sec
25527.5s 4454 EvaluatorHoldout: Ignoring 33 ( 0.1%) Users that have less than 1 test interactions
25541.5s 4455 EvaluatorHoldout: Processed 27062 (100.0%) in 14.22 sec. Users per second: 1903
25542.0s 4456 Unable to load Cython Compute_Similarity, reverting to Python
25551.2s 4457 Similarity column 6969 (100.0%), 765.09 column/sec. Elapsed time 9.11 sec
25551.2s 4458 EvaluatorHoldout: Ignoring 28 ( 0.1%) Users that have less than 1 test interactions
25565.3s 4459 EvaluatorHoldout: Processed 27067 (100.0%) in 14.31 sec. Users per second: 1892
25565.7s 4460 Unable to load Cython Compute_Similarity, reverting to Python
25574.6s 4461 Similarity column 6969 (100.0%), 768.06 column/sec. Elapsed time 9.07 sec
25574.8s 4462 EvaluatorHoldout: Ignoring 40 ( 0.1%) Users that have less than 1 test interactions
25589.1s 4463 EvaluatorHoldout: Processed 27055 (100.0%) in 14.16 sec. Users per second: 1910
25589.3s 4464 Unable to load Cython Compute_Similarity, reverting to Python
25598.3s 4465 Similarity column 6969 (100.0%), 755.79 column/sec. Elapsed time 9.22 sec
25598.5s 4466 EvaluatorHoldout: Ignoring 21 ( 0.1%) Users that have less than 1 test interactions
25612.7s 4467 EvaluatorHoldout: Processed 27074 (100.0%) in 14.34 sec. Users per second: 1888
25613.2s 4468 Unable to load Cython Compute_Similarity, reverting to Python
25622.4s 4469 Similarity column 6969 (100.0%), 756.60 column/sec. Elapsed time 9.21 sec
25622.4s 4470 EvaluatorHoldout: Ignoring 29 ( 0.1%) Users that have less than 1 test interactions
25637.0s 4471 EvaluatorHoldout: Processed 27066 (100.0%) in 14.78 sec. Users per second: 1831
25637.0s 4472 [I 2025-12-07 16:01:12,532] Trial 184 finished with value: 0.23297005383177138 and parameters: {'similarity': 'tversky', 'topK': 44, 'shrink': 10, 'tversky_alpha': 0.20542073821957885, 'tversky_beta': 1.649122155426435}. Best is trial 182 with value: 0.2514384438125787.
25637.0s 4473 
25637.0s 4474 [I 2025-12-07 16:01:12,532] Trial 184 finished with value: 0.23297005383177138 and parameters: {'similarity': 'tversky', 'topK': 44, 'shrink': 10, 'tversky_alpha': 0.20542073821957885, 'tversky_beta': 1.649122155426435}. Best is trial 182 with value: 0.2514384438125787.
25637.2s 4475 [0.23284218171262422, 0.23323030071640347, 0.2339142355651705, 0.2316615663736448, 0.23320198479101417]
25637.5s 4476 Unable to load Cython Compute_Similarity, reverting to Python
25646.6s 4477 Similarity column 6969 (100.0%), 748.26 column/sec. Elapsed time 9.31 sec
25646.8s 4478 EvaluatorHoldout: Ignoring 33 ( 0.1%) Users that have less than 1 test interactions
25660.7s 4479 EvaluatorHoldout: Processed 27062 (100.0%) in 13.81 sec. Users per second: 1959
25661.0s 4480 Unable to load Cython Compute_Similarity, reverting to Python
25670.9s 4481 Similarity column 6969 (100.0%), 687.52 column/sec. Elapsed time 10.14 sec
25671.1s 4482 EvaluatorHoldout: Ignoring 28 ( 0.1%) Users that have less than 1 test interactions
25684.9s 4483 EvaluatorHoldout: Processed 27067 (100.0%) in 13.97 sec. Users per second: 1937
25685.4s 4484 Unable to load Cython Compute_Similarity, reverting to Python
25695.8s 4485 Similarity column 6969 (100.0%), 673.27 column/sec. Elapsed time 10.35 sec
25695.8s 4486 EvaluatorHoldout: Ignoring 40 ( 0.1%) Users that have less than 1 test interactions
25709.4s 4487 EvaluatorHoldout: Processed 27055 (100.0%) in 13.74 sec. Users per second: 1969
25709.9s 4488 Unable to load Cython Compute_Similarity, reverting to Python
25719.7s 4489 Similarity column 6969 (100.0%), 695.66 column/sec. Elapsed time 10.02 sec
25719.9s 4490 EvaluatorHoldout: Ignoring 21 ( 0.1%) Users that have less than 1 test interactions
25733.8s 4491 EvaluatorHoldout: Processed 27074 (100.0%) in 13.92 sec. Users per second: 1946
25734.1s 4492 Unable to load Cython Compute_Similarity, reverting to Python
25743.7s 4493 Similarity column 6969 (100.0%), 712.37 column/sec. Elapsed time 9.78 sec
25743.9s 4494 EvaluatorHoldout: Ignoring 29 ( 0.1%) Users that have less than 1 test interactions
25757.6s 4495 EvaluatorHoldout: Processed 27066 (100.0%) in 13.90 sec. Users per second: 1947
25757.6s 4496 [I 2025-12-07 16:03:13,163] Trial 185 finished with value: 0.2506701141019593 and parameters: {'similarity': 'tversky', 'topK': 6, 'shrink': 153, 'tversky_alpha': 0.3078718135098472, 'tversky_beta': 1.7358331054425231}. Best is trial 182 with value: 0.2514384438125787.
25757.6s 4497 
25757.6s 4498 [I 2025-12-07 16:03:13,163] Trial 185 finished with value: 0.2506701141019593 and parameters: {'similarity': 'tversky', 'topK': 6, 'shrink': 153, 'tversky_alpha': 0.3078718135098472, 'tversky_beta': 1.7358331054425231}. Best is trial 182 with value: 0.2514384438125787.
25757.8s 4499 [0.25011603003094124, 0.2514138029047533, 0.25169537515448553, 0.24994146937065082, 0.2501838930489658]
25758.2s 4500 Unable to load Cython Compute_Similarity, reverting to Python
25767.9s 4501 Similarity column 6969 (100.0%), 714.85 column/sec. Elapsed time 9.75 sec
25767.9s 4502 EvaluatorHoldout: Ignoring 33 ( 0.1%) Users that have less than 1 test interactions
25783.7s 4503 EvaluatorHoldout: Processed 27062 (100.0%) in 15.99 sec. Users per second: 1692
25784.2s 4504 Unable to load Cython Compute_Similarity, reverting to Python
25793.7s 4505 Similarity column 6969 (100.0%), 720.62 column/sec. Elapsed time 9.67 sec
25793.9s 4506 EvaluatorHoldout: Ignoring 28 ( 0.1%) Users that have less than 1 test interactions
25810.1s 4507 EvaluatorHoldout: Processed 27067 (100.0%) in 16.16 sec. Users per second: 1674
25810.4s 4508 Unable to load Cython Compute_Similarity, reverting to Python
25820.4s 4509 Similarity column 6969 (100.0%), 685.35 column/sec. Elapsed time 10.17 sec
25820.6s 4510 EvaluatorHoldout: Ignoring 40 ( 0.1%) Users that have less than 1 test interactions
25836.5s 4511 EvaluatorHoldout: Processed 27055 (100.0%) in 16.03 sec. Users per second: 1688
25836.9s 4512 Unable to load Cython Compute_Similarity, reverting to Python
25847.3s 4513 Similarity column 6969 (100.0%), 673.38 column/sec. Elapsed time 10.35 sec
25847.3s 4514 EvaluatorHoldout: Ignoring 21 ( 0.1%) Users that have less than 1 test interactions
25863.2s 4515 EvaluatorHoldout: Processed 27074 (100.0%) in 16.04 sec. Users per second: 1688
25863.7s 4516 Unable to load Cython Compute_Similarity, reverting to Python
25873.9s 4517 Similarity column 6969 (100.0%), 667.28 column/sec. Elapsed time 10.44 sec
25874.1s 4518 EvaluatorHoldout: Ignoring 29 ( 0.1%) Users that have less than 1 test interactions
25890.2s 4519 EvaluatorHoldout: Processed 27066 (100.0%) in 16.07 sec. Users per second: 1684
25890.2s 4520 [I 2025-12-07 16:05:25,560] Trial 186 finished with value: 0.2057524495324338 and parameters: {'similarity': 'jaccard', 'topK': 52, 'shrink': 141}. Best is trial 182 with value: 0.2514384438125787.
25890.2s 4521 
25890.2s 4522 [I 2025-12-07 16:05:25,560] Trial 186 finished with value: 0.2057524495324338 and parameters: {'similarity': 'jaccard', 'topK': 52, 'shrink': 141}. Best is trial 182 with value: 0.2514384438125787.
25890.2s 4523 [0.20547798844149334, 0.20566221610124352, 0.20653958488041235, 0.2053034293130975, 0.2057790289259223]
25890.6s 4524 Unable to load Cython Compute_Similarity, reverting to Python
25900.7s 4525 Similarity column 6969 (100.0%), 671.76 column/sec. Elapsed time 10.37 sec
25900.9s 4526 EvaluatorHoldout: Ignoring 33 ( 0.1%) Users that have less than 1 test interactions
25915.2s 4527 EvaluatorHoldout: Processed 27062 (100.0%) in 14.42 sec. Users per second: 1877
25915.7s 4528 Unable to load Cython Compute_Similarity, reverting to Python
25925.3s 4529 Similarity column 6969 (100.0%), 721.37 column/sec. Elapsed time 9.66 sec
25925.3s 4530 EvaluatorHoldout: Ignoring 28 ( 0.1%) Users that have less than 1 test interactions
25939.7s 4531 EvaluatorHoldout: Processed 27067 (100.0%) in 14.49 sec. Users per second: 1868
25940.2s 4532 Unable to load Cython Compute_Similarity, reverting to Python
25950.3s 4533 Similarity column 6969 (100.0%), 673.40 column/sec. Elapsed time 10.35 sec
25950.5s 4534 EvaluatorHoldout: Ignoring 40 ( 0.1%) Users that have less than 1 test interactions
25965.1s 4535 EvaluatorHoldout: Processed 27055 (100.0%) in 14.51 sec. Users per second: 1865
25965.3s 4536 Unable to load Cython Compute_Similarity, reverting to Python
25975.7s 4537 Similarity column 6969 (100.0%), 662.11 column/sec. Elapsed time 10.53 sec
25975.9s 4538 EvaluatorHoldout: Ignoring 21 ( 0.1%) Users that have less than 1 test interactions
25990.4s 4539 EvaluatorHoldout: Processed 27074 (100.0%) in 14.67 sec. Users per second: 1845
25990.9s 4540 Unable to load Cython Compute_Similarity, reverting to Python
26001.0s 4541 Similarity column 6969 (100.0%), 691.78 column/sec. Elapsed time 10.07 sec
26001.0s 4542 EvaluatorHoldout: Ignoring 29 ( 0.1%) Users that have less than 1 test interactions
26015.3s 4543 EvaluatorHoldout: Processed 27066 (100.0%) in 14.56 sec. Users per second: 1859
26015.4s 4544 [I 2025-12-07 16:07:30,867] Trial 187 finished with value: 0.2359333770717889 and parameters: {'similarity': 'tversky', 'topK': 25, 'shrink': 157, 'tversky_alpha': 0.3010143199824042, 'tversky_beta': 1.7342684997262148}. Best is trial 182 with value: 0.2514384438125787.
26015.4s 4545 
26015.4s 4546 [I 2025-12-07 16:07:30,867] Trial 187 finished with value: 0.2359333770717889 and parameters: {'similarity': 'tversky', 'topK': 25, 'shrink': 157, 'tversky_alpha': 0.3010143199824042, 'tversky_beta': 1.7342684997262148}. Best is trial 182 with value: 0.2514384438125787.
26015.5s 4547 [0.23574007519387527, 0.23649788414589182, 0.23694845523296287, 0.2342338561368993, 0.2362466146493153]
26015.9s 4548 Unable to load Cython Compute_Similarity, reverting to Python
26025.0s 4549 Similarity column 6969 (100.0%), 750.20 column/sec. Elapsed time 9.29 sec
26025.2s 4550 EvaluatorHoldout: Ignoring 33 ( 0.1%) Users that have less than 1 test interactions
26039.9s 4551 EvaluatorHoldout: Processed 27062 (100.0%) in 14.75 sec. Users per second: 1835
26040.2s 4552 Unable to load Cython Compute_Similarity, reverting to Python
26049.3s 4553 Similarity column 6969 (100.0%), 753.14 column/sec. Elapsed time 9.25 sec
26049.5s 4554 EvaluatorHoldout: Ignoring 28 ( 0.1%) Users that have less than 1 test interactions
26064.2s 4555 EvaluatorHoldout: Processed 27067 (100.0%) in 14.87 sec. Users per second: 1820
26064.7s 4556 Unable to load Cython Compute_Similarity, reverting to Python
26074.7s 4557 Similarity column 6969 (100.0%), 696.58 column/sec. Elapsed time 10.00 sec
26074.7s 4558 EvaluatorHoldout: Ignoring 40 ( 0.1%) Users that have less than 1 test interactions
26089.5s 4559 EvaluatorHoldout: Processed 27055 (100.0%) in 14.94 sec. Users per second: 1811
26090.0s 4560 Unable to load Cython Compute_Similarity, reverting to Python
26100.6s 4561 Similarity column 6969 (100.0%), 640.57 column/sec. Elapsed time 10.88 sec
26100.8s 4562 EvaluatorHoldout: Ignoring 21 ( 0.1%) Users that have less than 1 test interactions
26115.9s 4563 EvaluatorHoldout: Processed 27074 (100.0%) in 14.91 sec. Users per second: 1816
26116.1s 4564 Unable to load Cython Compute_Similarity, reverting to Python
26126.2s 4565 Similarity column 6969 (100.0%), 675.62 column/sec. Elapsed time 10.31 sec
26126.4s 4566 EvaluatorHoldout: Ignoring 29 ( 0.1%) Users that have less than 1 test interactions
26141.1s 4567 EvaluatorHoldout: Processed 27066 (100.0%) in 14.85 sec. Users per second: 1823
26141.1s 4568 [I 2025-12-07 16:09:36,610] Trial 188 finished with value: 0.2289673928470001 and parameters: {'similarity': 'tversky', 'topK': 38, 'shrink': 186, 'tversky_alpha': 0.27153024619987715, 'tversky_beta': 1.6949379649317478}. Best is trial 182 with value: 0.2514384438125787.
26141.1s 4569 
26141.1s 4570 [I 2025-12-07 16:09:36,610] Trial 188 finished with value: 0.2289673928470001 and parameters: {'similarity': 'tversky', 'topK': 38, 'shrink': 186, 'tversky_alpha': 0.27153024619987715, 'tversky_beta': 1.6949379649317478}. Best is trial 182 with value: 0.2514384438125787.
26141.3s 4571 [0.22773176841055945, 0.22937240597036992, 0.2302309360597652, 0.22774693195866014, 0.22975492183564572]
26141.6s 4572 Unable to load Cython Compute_Similarity, reverting to Python
26151.6s 4573 Similarity column 6969 (100.0%), 701.01 column/sec. Elapsed time 9.94 sec
26151.6s 4574 EvaluatorHoldout: Ignoring 33 ( 0.1%) Users that have less than 1 test interactions
26165.6s 4575 EvaluatorHoldout: Processed 27062 (100.0%) in 14.19 sec. Users per second: 1908
26166.1s 4576 Unable to load Cython Compute_Similarity, reverting to Python
26175.5s 4577 Similarity column 6969 (100.0%), 724.98 column/sec. Elapsed time 9.61 sec
26175.7s 4578 EvaluatorHoldout: Ignoring 28 ( 0.1%) Users that have less than 1 test interactions
26190.0s 4579 EvaluatorHoldout: Processed 27067 (100.0%) in 14.27 sec. Users per second: 1897
26190.3s 4580 Unable to load Cython Compute_Similarity, reverting to Python
26199.9s 4581 Similarity column 6969 (100.0%), 709.29 column/sec. Elapsed time 9.83 sec
26200.1s 4582 EvaluatorHoldout: Ignoring 40 ( 0.1%) Users that have less than 1 test interactions
26214.1s 4583 EvaluatorHoldout: Processed 27055 (100.0%) in 14.14 sec. Users per second: 1914
26214.6s 4584 Unable to load Cython Compute_Similarity, reverting to Python
26224.2s 4585 Similarity column 6969 (100.0%), 721.11 column/sec. Elapsed time 9.66 sec
26224.2s 4586 EvaluatorHoldout: Ignoring 21 ( 0.1%) Users that have less than 1 test interactions
26238.1s 4587 EvaluatorHoldout: Processed 27074 (100.0%) in 14.08 sec. Users per second: 1923
26238.6s 4588 Unable to load Cython Compute_Similarity, reverting to Python
26247.5s 4589 Similarity column 6969 (100.0%), 766.11 column/sec. Elapsed time 9.10 sec
26247.7s 4590 EvaluatorHoldout: Ignoring 29 ( 0.1%) Users that have less than 1 test interactions
26261.9s 4591 EvaluatorHoldout: Processed 27066 (100.0%) in 14.12 sec. Users per second: 1917
26261.9s 4592 [I 2025-12-07 16:11:37,194] Trial 189 finished with value: 0.24402766115061264 and parameters: {'similarity': 'tversky', 'topK': 20, 'shrink': 117, 'tversky_alpha': 0.21637797268221687, 'tversky_beta': 1.8114931789213868}. Best is trial 182 with value: 0.2514384438125787.
26261.9s 4593 
26261.9s 4594 [I 2025-12-07 16:11:37,194] Trial 189 finished with value: 0.24402766115061264 and parameters: {'similarity': 'tversky', 'topK': 20, 'shrink': 117, 'tversky_alpha': 0.21637797268221687, 'tversky_beta': 1.8114931789213868}. Best is trial 182 with value: 0.2514384438125787.
26261.9s 4595 [0.24383206339592675, 0.2432826651591011, 0.24557450984308013, 0.24315190772511225, 0.2442971596298431]
26262.2s 4596 Unable to load Cython Compute_Similarity, reverting to Python
26271.1s 4597 Similarity column 6969 (100.0%), 762.09 column/sec. Elapsed time 9.14 sec
26271.3s 4598 EvaluatorHoldout: Ignoring 33 ( 0.1%) Users that have less than 1 test interactions
26284.7s 4599 EvaluatorHoldout: Processed 27062 (100.0%) in 13.56 sec. Users per second: 1996
26285.2s 4600 Unable to load Cython Compute_Similarity, reverting to Python
26294.4s 4601 Similarity column 6969 (100.0%), 759.64 column/sec. Elapsed time 9.17 sec
26294.4s 4602 EvaluatorHoldout: Ignoring 28 ( 0.1%) Users that have less than 1 test interactions
26307.9s 4603 EvaluatorHoldout: Processed 27067 (100.0%) in 13.67 sec. Users per second: 1981
26308.4s 4604 Unable to load Cython Compute_Similarity, reverting to Python
26317.8s 4605 Similarity column 6969 (100.0%), 721.47 column/sec. Elapsed time 9.66 sec
26318.0s 4606 EvaluatorHoldout: Ignoring 40 ( 0.1%) Users that have less than 1 test interactions
26331.7s 4607 EvaluatorHoldout: Processed 27055 (100.0%) in 13.63 sec. Users per second: 1985
26332.0s 4608 Unable to load Cython Compute_Similarity, reverting to Python
26340.8s 4609 Similarity column 6969 (100.0%), 772.00 column/sec. Elapsed time 9.03 sec
26341.0s 4610 EvaluatorHoldout: Ignoring 21 ( 0.1%) Users that have less than 1 test interactions
26354.5s 4611 EvaluatorHoldout: Processed 27074 (100.0%) in 13.68 sec. Users per second: 1979
26355.0s 4612 Unable to load Cython Compute_Similarity, reverting to Python
26364.2s 4613 Similarity column 6969 (100.0%), 760.52 column/sec. Elapsed time 9.16 sec
26364.2s 4614 EvaluatorHoldout: Ignoring 29 ( 0.1%) Users that have less than 1 test interactions
26377.7s 4615 EvaluatorHoldout: Processed 27066 (100.0%) in 13.67 sec. Users per second: 1980
