18944.2s 3178 [I 2025-12-07 14:09:39,564] Trial 130 finished with value: 0.22387282270794814 and parameters: {'similarity': 'tversky', 'topK': 74, 'shrink': 198, 'tversky_alpha': 0.17192178221979437, 'tversky_beta': 1.9935743509527508}. Best is trial 91 with value: 0.24993110179607925.
18944.2s 3179 [0.22340026346455658, 0.22396753729925942, 0.22421353967185592, 0.22283478024396, 0.22494799286010897]
18944.6s 3180 Unable to load Cython Compute_Similarity, reverting to Python
18954.2s 3181 Similarity column 6969 (100.0%), 707.34 column/sec. Elapsed time 9.85 sec
18954.4s 3182 EvaluatorHoldout: Ignoring 33 ( 0.1%) Users that have less than 1 test interactions
18968.7s 3183 EvaluatorHoldout: Processed 27062 (100.0%) in 14.43 sec. Users per second: 1875
18969.2s 3184 Unable to load Cython Compute_Similarity, reverting to Python
18978.7s 3185 Similarity column 6969 (100.0%), 730.37 column/sec. Elapsed time 9.54 sec
18978.7s 3186 EvaluatorHoldout: Ignoring 28 ( 0.1%) Users that have less than 1 test interactions
18993.1s 3187 EvaluatorHoldout: Processed 27067 (100.0%) in 14.52 sec. Users per second: 1864
18993.6s 3188 Unable to load Cython Compute_Similarity, reverting to Python
19003.4s 3189 Similarity column 6969 (100.0%), 696.34 column/sec. Elapsed time 10.01 sec
19003.6s 3190 EvaluatorHoldout: Ignoring 40 ( 0.1%) Users that have less than 1 test interactions
19018.0s 3191 EvaluatorHoldout: Processed 27055 (100.0%) in 14.42 sec. Users per second: 1876
19018.3s 3192 Unable to load Cython Compute_Similarity, reverting to Python
19027.8s 3193 Similarity column 6969 (100.0%), 718.24 column/sec. Elapsed time 9.70 sec
19028.0s 3194 EvaluatorHoldout: Ignoring 21 ( 0.1%) Users that have less than 1 test interactions
19042.2s 3195 EvaluatorHoldout: Processed 27074 (100.0%) in 14.41 sec. Users per second: 1879
19042.7s 3196 Unable to load Cython Compute_Similarity, reverting to Python
19051.8s 3197 Similarity column 6969 (100.0%), 761.58 column/sec. Elapsed time 9.15 sec
19051.9s 3198 EvaluatorHoldout: Ignoring 29 ( 0.1%) Users that have less than 1 test interactions
19066.1s 3199 EvaluatorHoldout: Processed 27066 (100.0%) in 14.38 sec. Users per second: 1882
19066.1s 3200 [I 2025-12-07 14:11:41,609] Trial 131 finished with value: 0.24258296685628844 and parameters: {'similarity': 'tversky', 'topK': 23, 'shrink': 262, 'tversky_alpha': 0.07898173709955122, 'tversky_beta': 1.6572187394018663}. Best is trial 91 with value: 0.24993110179607925.
19066.1s 3201 
19066.1s 3202 [I 2025-12-07 14:11:41,609] Trial 131 finished with value: 0.24258296685628844 and parameters: {'similarity': 'tversky', 'topK': 23, 'shrink': 262, 'tversky_alpha': 0.07898173709955122, 'tversky_beta': 1.6572187394018663}. Best is trial 91 with value: 0.24993110179607925.
19066.3s 3203 [0.24258761319621835, 0.24258567172475667, 0.2435529624090556, 0.2415972750298971, 0.24259131192151437]
19066.6s 3204 Unable to load Cython Compute_Similarity, reverting to Python
19075.7s 3205 Similarity column 6969 (100.0%), 745.54 column/sec. Elapsed time 9.35 sec
19075.9s 3206 EvaluatorHoldout: Ignoring 33 ( 0.1%) Users that have less than 1 test interactions
19091.2s 3207 EvaluatorHoldout: Processed 27062 (100.0%) in 15.20 sec. Users per second: 1780
19091.5s 3208 Unable to load Cython Compute_Similarity, reverting to Python
19101.2s 3209 Similarity column 6969 (100.0%), 703.15 column/sec. Elapsed time 9.91 sec
19101.4s 3210 EvaluatorHoldout: Ignoring 28 ( 0.1%) Users that have less than 1 test interactions
19116.5s 3211 EvaluatorHoldout: Processed 27067 (100.0%) in 15.27 sec. Users per second: 1772
19117.0s 3212 Unable to load Cython Compute_Similarity, reverting to Python
19126.7s 3213 Similarity column 6969 (100.0%), 716.77 column/sec. Elapsed time 9.72 sec
19126.7s 3214 EvaluatorHoldout: Ignoring 40 ( 0.1%) Users that have less than 1 test interactions
19141.9s 3215 EvaluatorHoldout: Processed 27055 (100.0%) in 15.33 sec. Users per second: 1765
19142.4s 3216 Unable to load Cython Compute_Similarity, reverting to Python
19152.2s 3217 Similarity column 6969 (100.0%), 696.27 column/sec. Elapsed time 10.01 sec
19152.4s 3218 EvaluatorHoldout: Ignoring 21 ( 0.1%) Users that have less than 1 test interactions
19167.7s 3219 EvaluatorHoldout: Processed 27074 (100.0%) in 15.31 sec. Users per second: 1768
19168.1s 3220 Unable to load Cython Compute_Similarity, reverting to Python
19178.3s 3221 Similarity column 6969 (100.0%), 665.62 column/sec. Elapsed time 10.47 sec
19178.5s 3222 EvaluatorHoldout: Ignoring 29 ( 0.1%) Users that have less than 1 test interactions
19193.7s 3223 EvaluatorHoldout: Processed 27066 (100.0%) in 15.33 sec. Users per second: 1765
19193.7s 3224 [I 2025-12-07 14:13:49,238] Trial 132 finished with value: 0.22503251110607786 and parameters: {'similarity': 'tversky', 'topK': 49, 'shrink': 310, 'tversky_alpha': 0.23187780207975844, 'tversky_beta': 1.7974583541437836}. Best is trial 91 with value: 0.24993110179607925.
19193.7s 3225 
19193.7s 3226 [I 2025-12-07 14:13:49,238] Trial 132 finished with value: 0.22503251110607786 and parameters: {'similarity': 'tversky', 'topK': 49, 'shrink': 310, 'tversky_alpha': 0.23187780207975844, 'tversky_beta': 1.7974583541437836}. Best is trial 91 with value: 0.24993110179607925.
19193.9s 3227 [0.2243135728311414, 0.22520870068168222, 0.2255318532998735, 0.22419516497571124, 0.225913263741981]
19194.2s 3228 Unable to load Cython Compute_Similarity, reverting to Python
19203.8s 3229 Similarity column 6969 (100.0%), 723.04 column/sec. Elapsed time 9.64 sec
19203.9s 3230 EvaluatorHoldout: Ignoring 33 ( 0.1%) Users that have less than 1 test interactions
19218.5s 3231 EvaluatorHoldout: Processed 27062 (100.0%) in 14.77 sec. Users per second: 1832
19219.0s 3232 Unable to load Cython Compute_Similarity, reverting to Python
19228.2s 3233 Similarity column 6969 (100.0%), 738.16 column/sec. Elapsed time 9.44 sec
19228.4s 3234 EvaluatorHoldout: Ignoring 28 ( 0.1%) Users that have less than 1 test interactions
19243.0s 3235 EvaluatorHoldout: Processed 27067 (100.0%) in 14.56 sec. Users per second: 1859
19243.3s 3236 Unable to load Cython Compute_Similarity, reverting to Python
19253.1s 3237 Similarity column 6969 (100.0%), 697.84 column/sec. Elapsed time 9.99 sec
19253.3s 3238 EvaluatorHoldout: Ignoring 40 ( 0.1%) Users that have less than 1 test interactions
19267.7s 3239 EvaluatorHoldout: Processed 27055 (100.0%) in 14.53 sec. Users per second: 1862
19268.1s 3240 Unable to load Cython Compute_Similarity, reverting to Python
19277.5s 3241 Similarity column 6969 (100.0%), 750.80 column/sec. Elapsed time 9.28 sec
19277.5s 3242 EvaluatorHoldout: Ignoring 21 ( 0.1%) Users that have less than 1 test interactions
19291.9s 3243 EvaluatorHoldout: Processed 27074 (100.0%) in 14.63 sec. Users per second: 1850
19292.4s 3244 Unable to load Cython Compute_Similarity, reverting to Python
19301.4s 3245 Similarity column 6969 (100.0%), 754.30 column/sec. Elapsed time 9.24 sec
19301.6s 3246 EvaluatorHoldout: Ignoring 29 ( 0.1%) Users that have less than 1 test interactions
19316.1s 3247 EvaluatorHoldout: Processed 27066 (100.0%) in 14.52 sec. Users per second: 1864
19316.1s 3248 [I 2025-12-07 14:15:51,496] Trial 133 finished with value: 0.23623169718480375 and parameters: {'similarity': 'tversky', 'topK': 24, 'shrink': 225, 'tversky_alpha': 0.18363081807628023, 'tversky_beta': 1.4092306843669171}. Best is trial 91 with value: 0.24993110179607925.
19316.1s 3249 
19316.1s 3250 [I 2025-12-07 14:15:51,496] Trial 133 finished with value: 0.23623169718480375 and parameters: {'similarity': 'tversky', 'topK': 24, 'shrink': 225, 'tversky_alpha': 0.18363081807628023, 'tversky_beta': 1.4092306843669171}. Best is trial 91 with value: 0.24993110179607925.
19316.2s 3251 [0.23579947206761628, 0.23672565271921409, 0.23783162334360852, 0.2341326532982689, 0.2366690844953108]
19316.5s 3252 Unable to load Cython Compute_Similarity, reverting to Python
19325.7s 3253 Similarity column 6969 (100.0%), 739.53 column/sec. Elapsed time 9.42 sec
19325.9s 3254 EvaluatorHoldout: Ignoring 33 ( 0.1%) Users that have less than 1 test interactions
19339.6s 3255 EvaluatorHoldout: Processed 27062 (100.0%) in 13.88 sec. Users per second: 1950
19340.1s 3256 Unable to load Cython Compute_Similarity, reverting to Python
19349.4s 3257 Similarity column 6969 (100.0%), 745.79 column/sec. Elapsed time 9.34 sec
19349.5s 3258 EvaluatorHoldout: Ignoring 28 ( 0.1%) Users that have less than 1 test interactions
19363.4s 3259 EvaluatorHoldout: Processed 27067 (100.0%) in 14.08 sec. Users per second: 1922
19363.9s 3260 Unable to load Cython Compute_Similarity, reverting to Python
19373.5s 3261 Similarity column 6969 (100.0%), 710.38 column/sec. Elapsed time 9.81 sec
19373.7s 3262 EvaluatorHoldout: Ignoring 40 ( 0.1%) Users that have less than 1 test interactions
19387.6s 3263 EvaluatorHoldout: Processed 27055 (100.0%) in 13.91 sec. Users per second: 1944
19387.9s 3264 Unable to load Cython Compute_Similarity, reverting to Python
19396.9s 3265 Similarity column 6969 (100.0%), 758.58 column/sec. Elapsed time 9.19 sec
19397.1s 3266 EvaluatorHoldout: Ignoring 21 ( 0.1%) Users that have less than 1 test interactions
19410.9s 3267 EvaluatorHoldout: Processed 27074 (100.0%) in 13.99 sec. Users per second: 1936
19411.4s 3268 Unable to load Cython Compute_Similarity, reverting to Python
19421.1s 3269 Similarity column 6969 (100.0%), 718.32 column/sec. Elapsed time 9.70 sec
19421.2s 3270 EvaluatorHoldout: Ignoring 29 ( 0.1%) Users that have less than 1 test interactions
19435.0s 3271 EvaluatorHoldout: Processed 27066 (100.0%) in 14.00 sec. Users per second: 1934
19435.0s 3272 [I 2025-12-07 14:17:50,509] Trial 134 finished with value: 0.24858798993705414 and parameters: {'similarity': 'tversky', 'topK': 8, 'shrink': 269, 'tversky_alpha': 0.35934591798128074, 'tversky_beta': 1.89145672340618}. Best is trial 91 with value: 0.24993110179607925.
19435.0s 3273 
19435.0s 3274 [I 2025-12-07 14:17:50,509] Trial 134 finished with value: 0.24858798993705414 and parameters: {'similarity': 'tversky', 'topK': 8, 'shrink': 269, 'tversky_alpha': 0.35934591798128074, 'tversky_beta': 1.89145672340618}. Best is trial 91 with value: 0.24993110179607925.
19435.2s 3275 [0.24734150519410797, 0.24950998798571566, 0.24978337415006913, 0.24750204671440088, 0.24880303564097683]
19435.5s 3276 Unable to load Cython Compute_Similarity, reverting to Python
19444.7s 3277 Similarity column 6969 (100.0%), 742.47 column/sec. Elapsed time 9.39 sec
19444.9s 3278 EvaluatorHoldout: Ignoring 33 ( 0.1%) Users that have less than 1 test interactions
19460.3s 3279 EvaluatorHoldout: Processed 27062 (100.0%) in 15.44 sec. Users per second: 1753
19460.7s 3280 Unable to load Cython Compute_Similarity, reverting to Python
19470.2s 3281 Similarity column 6969 (100.0%), 717.29 column/sec. Elapsed time 9.72 sec
19470.4s 3282 EvaluatorHoldout: Ignoring 28 ( 0.1%) Users that have less than 1 test interactions
19485.7s 3283 EvaluatorHoldout: Processed 27067 (100.0%) in 15.49 sec. Users per second: 1748
19486.2s 3284 Unable to load Cython Compute_Similarity, reverting to Python
19495.7s 3285 Similarity column 6969 (100.0%), 731.09 column/sec. Elapsed time 9.53 sec
19495.7s 3286 EvaluatorHoldout: Ignoring 40 ( 0.1%) Users that have less than 1 test interactions
19511.0s 3287 EvaluatorHoldout: Processed 27055 (100.0%) in 15.44 sec. Users per second: 1753
19511.5s 3288 Unable to load Cython Compute_Similarity, reverting to Python
19520.9s 3289 Similarity column 6969 (100.0%), 725.15 column/sec. Elapsed time 9.61 sec
19521.1s 3290 EvaluatorHoldout: Ignoring 21 ( 0.1%) Users that have less than 1 test interactions
19536.6s 3291 EvaluatorHoldout: Processed 27074 (100.0%) in 15.48 sec. Users per second: 1748
19536.9s 3292 Unable to load Cython Compute_Similarity, reverting to Python
19546.3s 3293 Similarity column 6969 (100.0%), 728.76 column/sec. Elapsed time 9.56 sec
19546.5s 3294 EvaluatorHoldout: Ignoring 29 ( 0.1%) Users that have less than 1 test interactions
19561.7s 3295 EvaluatorHoldout: Processed 27066 (100.0%) in 15.40 sec. Users per second: 1757
19561.7s 3296 [I 2025-12-07 14:19:57,241] Trial 135 finished with value: 0.21879470568648607 and parameters: {'similarity': 'tversky', 'topK': 57, 'shrink': 241, 'tversky_alpha': 0.3588213403283142, 'tversky_beta': 1.8642139936294464}. Best is trial 91 with value: 0.24993110179607925.
19561.7s 3297 
19561.7s 3298 [I 2025-12-07 14:19:57,241] Trial 135 finished with value: 0.21879470568648607 and parameters: {'similarity': 'tversky', 'topK': 57, 'shrink': 241, 'tversky_alpha': 0.3588213403283142, 'tversky_beta': 1.8642139936294464}. Best is trial 91 with value: 0.24993110179607925.
19561.9s 3299 [0.21824483580607618, 0.219027889536923, 0.2189935185002494, 0.21845073633915005, 0.21925654825003169]
19562.2s 3300 Unable to load Cython Compute_Similarity, reverting to Python
19571.2s 3301 Similarity column 6969 (100.0%), 777.48 column/sec. Elapsed time 8.96 sec
19571.2s 3302 EvaluatorHoldout: Ignoring 33 ( 0.1%) Users that have less than 1 test interactions
19586.6s 3303 EvaluatorHoldout: Processed 27062 (100.0%) in 15.61 sec. Users per second: 1733
19587.1s 3304 Unable to load Cython Compute_Similarity, reverting to Python
19595.8s 3305 Similarity column 6969 (100.0%), 784.63 column/sec. Elapsed time 8.88 sec
19596.0s 3306 EvaluatorHoldout: Ignoring 28 ( 0.1%) Users that have less than 1 test interactions
19611.9s 3307 EvaluatorHoldout: Processed 27067 (100.0%) in 15.87 sec. Users per second: 1706
19612.2s 3308 Unable to load Cython Compute_Similarity, reverting to Python
19621.6s 3309 Similarity column 6969 (100.0%), 729.56 column/sec. Elapsed time 9.55 sec
19621.8s 3310 EvaluatorHoldout: Ignoring 40 ( 0.1%) Users that have less than 1 test interactions
19637.3s 3311 EvaluatorHoldout: Processed 27055 (100.0%) in 15.66 sec. Users per second: 1728
19637.7s 3312 Unable to load Cython Compute_Similarity, reverting to Python
19646.6s 3313 Similarity column 6969 (100.0%), 777.98 column/sec. Elapsed time 8.96 sec
19646.7s 3314 EvaluatorHoldout: Ignoring 21 ( 0.1%) Users that have less than 1 test interactions
19662.4s 3315 EvaluatorHoldout: Processed 27074 (100.0%) in 15.87 sec. Users per second: 1706
19662.9s 3316 Unable to load Cython Compute_Similarity, reverting to Python
19671.7s 3317 Similarity column 6969 (100.0%), 773.33 column/sec. Elapsed time 9.01 sec
19671.9s 3318 EvaluatorHoldout: Ignoring 29 ( 0.1%) Users that have less than 1 test interactions
19687.7s 3319 EvaluatorHoldout: Processed 27066 (100.0%) in 15.77 sec. Users per second: 1716
19687.7s 3320 [I 2025-12-07 14:22:03,029] Trial 136 finished with value: 0.21591525211171794 and parameters: {'similarity': 'cosine', 'topK': 25, 'shrink': 187}. Best is trial 91 with value: 0.24993110179607925.
19687.7s 3321 
19687.7s 3322 [I 2025-12-07 14:22:03,029] Trial 136 finished with value: 0.21591525211171794 and parameters: {'similarity': 'cosine', 'topK': 25, 'shrink': 187}. Best is trial 91 with value: 0.24993110179607925.
19687.7s 3323 [0.2146968998212538, 0.21671700159431828, 0.2163818999490163, 0.2156421835460136, 0.2161382756479878]
19688.0s 3324 Unable to load Cython Compute_Similarity, reverting to Python
19697.4s 3325 Similarity column 6969 (100.0%), 726.96 column/sec. Elapsed time 9.59 sec
19697.6s 3326 EvaluatorHoldout: Ignoring 33 ( 0.1%) Users that have less than 1 test interactions
19713.4s 3327 EvaluatorHoldout: Processed 27062 (100.0%) in 16.00 sec. Users per second: 1692
19713.9s 3328 Unable to load Cython Compute_Similarity, reverting to Python
19723.6s 3329 Similarity column 6969 (100.0%), 720.51 column/sec. Elapsed time 9.67 sec
19723.6s 3330 EvaluatorHoldout: Ignoring 28 ( 0.1%) Users that have less than 1 test interactions
19739.5s 3331 EvaluatorHoldout: Processed 27067 (100.0%) in 16.07 sec. Users per second: 1685
19740.0s 3332 Unable to load Cython Compute_Similarity, reverting to Python
19749.5s 3333 Similarity column 6969 (100.0%), 719.74 column/sec. Elapsed time 9.68 sec
19749.7s 3334 EvaluatorHoldout: Ignoring 40 ( 0.1%) Users that have less than 1 test interactions
19765.8s 3335 EvaluatorHoldout: Processed 27055 (100.0%) in 16.06 sec. Users per second: 1685
19766.1s 3336 Unable to load Cython Compute_Similarity, reverting to Python
19775.6s 3337 Similarity column 6969 (100.0%), 720.36 column/sec. Elapsed time 9.67 sec
19775.8s 3338 EvaluatorHoldout: Ignoring 21 ( 0.1%) Users that have less than 1 test interactions
19791.6s 3339 EvaluatorHoldout: Processed 27074 (100.0%) in 16.02 sec. Users per second: 1690
19792.1s 3340 Unable to load Cython Compute_Similarity, reverting to Python
19801.9s 3341 Similarity column 6969 (100.0%), 710.53 column/sec. Elapsed time 9.81 sec
19801.9s 3342 EvaluatorHoldout: Ignoring 29 ( 0.1%) Users that have less than 1 test interactions
19817.7s 3343 EvaluatorHoldout: Processed 27066 (100.0%) in 15.98 sec. Users per second: 1693
19817.7s 3344 [I 2025-12-07 14:24:13,259] Trial 137 finished with value: 0.21764312434784755 and parameters: {'similarity': 'tversky', 'topK': 83, 'shrink': 344, 'tversky_alpha': 0.13819320205267918, 'tversky_beta': 1.7274434895324553}. Best is trial 91 with value: 0.24993110179607925.
19817.7s 3345 
19817.7s 3346 [I 2025-12-07 14:24:13,259] Trial 137 finished with value: 0.21764312434784755 and parameters: {'similarity': 'tversky', 'topK': 83, 'shrink': 344, 'tversky_alpha': 0.13819320205267918, 'tversky_beta': 1.7274434895324553}. Best is trial 91 with value: 0.24993110179607925.
19817.9s 3347 [0.21690598630968053, 0.21769464109172307, 0.2179639721930896, 0.21723975678088384, 0.21841126536386082]
19818.2s 3348 Unable to load Cython Compute_Similarity, reverting to Python
19830.4s 3349 Similarity column 6969 (100.0%), 564.49 column/sec. Elapsed time 12.35 sec
19830.6s 3350 EvaluatorHoldout: Ignoring 33 ( 0.1%) Users that have less than 1 test interactions
19853.0s 3351 EvaluatorHoldout: Processed 27062 (100.0%) in 22.33 sec. Users per second: 1212
19853.3s 3352 Unable to load Cython Compute_Similarity, reverting to Python
19865.4s 3353 Similarity column 6969 (100.0%), 567.16 column/sec. Elapsed time 12.29 sec
19865.6s 3354 EvaluatorHoldout: Ignoring 28 ( 0.1%) Users that have less than 1 test interactions
19888.0s 3355 EvaluatorHoldout: Processed 27067 (100.0%) in 22.37 sec. Users per second: 1210
19888.3s 3356 Unable to load Cython Compute_Similarity, reverting to Python
19900.5s 3357 Similarity column 6969 (100.0%), 565.90 column/sec. Elapsed time 12.31 sec
19900.7s 3358 EvaluatorHoldout: Ignoring 40 ( 0.1%) Users that have less than 1 test interactions
19923.0s 3359 EvaluatorHoldout: Processed 27055 (100.0%) in 22.25 sec. Users per second: 1216
19923.3s 3360 Unable to load Cython Compute_Similarity, reverting to Python
19935.6s 3361 Similarity column 6969 (100.0%), 558.98 column/sec. Elapsed time 12.47 sec
19935.8s 3362 EvaluatorHoldout: Ignoring 21 ( 0.1%) Users that have less than 1 test interactions
19958.3s 3363 EvaluatorHoldout: Processed 27074 (100.0%) in 22.51 sec. Users per second: 1203
19958.6s 3364 Unable to load Cython Compute_Similarity, reverting to Python
19970.9s 3365 Similarity column 6969 (100.0%), 558.71 column/sec. Elapsed time 12.47 sec
19971.1s 3366 EvaluatorHoldout: Ignoring 29 ( 0.1%) Users that have less than 1 test interactions
19993.4s 3367 EvaluatorHoldout: Processed 27066 (100.0%) in 22.13 sec. Users per second: 1223
19993.4s 3368 [I 2025-12-07 14:27:08,670] Trial 138 finished with value: 0.1777133871774154 and parameters: {'similarity': 'tversky', 'topK': 382, 'shrink': 974, 'tversky_alpha': 0.4199684523395286, 'tversky_beta': 1.9182651154232269}. Best is trial 91 with value: 0.24993110179607925.
19993.4s 3369 
19993.4s 3370 [I 2025-12-07 14:27:08,670] Trial 138 finished with value: 0.1777133871774154 and parameters: {'similarity': 'tversky', 'topK': 382, 'shrink': 974, 'tversky_alpha': 0.4199684523395286, 'tversky_beta': 1.9182651154232269}. Best is trial 91 with value: 0.24993110179607925.
19993.4s 3371 [0.17778811011118398, 0.1776297171495472, 0.17760348254407704, 0.1769115846952235, 0.1786340413870452]
19993.7s 3372 Unable to load Cython Compute_Similarity, reverting to Python
20002.6s 3373 Similarity column 6969 (100.0%), 759.54 column/sec. Elapsed time 9.18 sec
20002.8s 3374 EvaluatorHoldout: Ignoring 33 ( 0.1%) Users that have less than 1 test interactions
20016.3s 3375 EvaluatorHoldout: Processed 27062 (100.0%) in 13.61 sec. Users per second: 1988
20016.8s 3376 Unable to load Cython Compute_Similarity, reverting to Python
20025.8s 3377 Similarity column 6969 (100.0%), 768.91 column/sec. Elapsed time 9.06 sec
20025.8s 3378 EvaluatorHoldout: Ignoring 28 ( 0.1%) Users that have less than 1 test interactions
20039.4s 3379 EvaluatorHoldout: Processed 27067 (100.0%) in 13.78 sec. Users per second: 1964
20039.9s 3380 Unable to load Cython Compute_Similarity, reverting to Python
20049.1s 3381 Similarity column 6969 (100.0%), 740.41 column/sec. Elapsed time 9.41 sec
20049.3s 3382 EvaluatorHoldout: Ignoring 40 ( 0.1%) Users that have less than 1 test interactions
20063.0s 3383 EvaluatorHoldout: Processed 27055 (100.0%) in 13.66 sec. Users per second: 1980
20063.3s 3384 Unable to load Cython Compute_Similarity, reverting to Python
20072.4s 3385 Similarity column 6969 (100.0%), 749.75 column/sec. Elapsed time 9.30 sec
20072.6s 3386 EvaluatorHoldout: Ignoring 21 ( 0.1%) Users that have less than 1 test interactions
20086.2s 3387 EvaluatorHoldout: Processed 27074 (100.0%) in 13.78 sec. Users per second: 1965
20086.7s 3388 Unable to load Cython Compute_Similarity, reverting to Python
20095.7s 3389 Similarity column 6969 (100.0%), 773.00 column/sec. Elapsed time 9.02 sec
20095.7s 3390 EvaluatorHoldout: Ignoring 29 ( 0.1%) Users that have less than 1 test interactions
20109.3s 3391 EvaluatorHoldout: Processed 27066 (100.0%) in 13.68 sec. Users per second: 1979
