8.5s 1 0.00s - Debugger warning: It seems that frozen modules are being used, which may
8.5s 2 0.00s - make the debugger miss breakpoints. Please pass -Xfrozen_modules=off
8.5s 3 0.00s - to python to disable frozen modules.
8.5s 4 0.00s - Note: Debugging will proceed. Set PYDEVD_DISABLE_FILE_VALIDATION=1 to disable this validation.
9.2s 5 0.00s - Debugger warning: It seems that frozen modules are being used, which may
9.2s 6 0.00s - make the debugger miss breakpoints. Please pass -Xfrozen_modules=off
9.2s 7 0.00s - to python to disable frozen modules.
9.2s 8 0.00s - Note: Debugging will proceed. Set PYDEVD_DISABLE_FILE_VALIDATION=1 to disable this validation.
13.8s 9 /kaggle/input/recommender-systems-2025-challenge-polimi/data_train.csv
13.8s 10 /kaggle/input/recommender-systems-2025-challenge-polimi/sample_submission.csv
13.8s 11 /kaggle/input/recommender-systems-2025-challenge-polimi/data_target_users_test.csv
13.8s 12 Cloning into 'RecSys_Course_AT_PoliMi'...
14.3s 13 remote: Enumerating objects: 1698, done.[K
14.4s 14 remote: Counting objects:   0% (1/270)[Kremote: Counting objects:   1% (3/270)[Kremote: Counting objects:   2% (6/270)[Kremote: Counting objects:   3% (9/270)[Kremote: Counting objects:   4% (11/270)[Kremote: Counting objects:   5% (14/270)[Kremote: Counting objects:   6% (17/270)[Kremote: Counting objects:   7% (19/270)[Kremote: Counting objects:   8% (22/270)[Kremote: Counting objects:   9% (25/270)[Kremote: Counting objects:  10% (27/270)[Kremote: Counting objects:  11% (30/270)[Kremote: Counting objects:  12% (33/270)[Kremote: Counting objects:  13% (36/270)[Kremote: Counting objects:  14% (38/270)[Kremote: Counting objects:  15% (41/270)[Kremote: Counting objects:  16% (44/270)[Kremote: Counting objects:  17% (46/270)[Kremote: Counting objects:  18% (49/270)[Kremote: Counting objects:  19% (52/270)[Kremote: Counting objects:  20% (54/270)[Kremote: Counting objects:  21% (57/270)[Kremote: Counting objects:  22% (60/270)[Kremote: Counting objects:  23% (63/270)[Kremote: Counting objects:  24% (65/270)[Kremote: Counting objects:  25% (68/270)[Kremote: Counting objects:  26% (71/270)[Kremote: Counting objects:  27% (73/270)[Kremote: Counting objects:  28% (76/270)[Kremote: Counting objects:  29% (79/270)[Kremote: Counting objects:  30% (81/270)[Kremote: Counting objects:  31% (84/270)[Kremote: Counting objects:  32% (87/270)[Kremote: Counting objects:  33% (90/270)[Kremote: Counting objects:  34% (92/270)[Kremote: Counting objects:  35% (95/270)[Kremote: Counting objects:  36% (98/270)[Kremote: Counting objects:  37% (100/270)[Kremote: Counting objects:  38% (103/270)[Kremote: Counting objects:  39% (106/270)[Kremote: Counting objects:  40% (108/270)[Kremote: Counting objects:  41% (111/270)[Kremote: Counting objects:  42% (114/270)[Kremote: Counting objects:  43% (117/270)[Kremote: Counting objects:  44% (119/270)[Kremote: Counting objects:  45% (122/270)[Kremote: Counting objects:  46% (125/270)[Kremote: Counting objects:  47% (127/270)[Kremote: Counting objects:  48% (130/270)[Kremote: Counting objects:  49% (133/270)[Kremote: Counting objects:  50% (135/270)[Kremote: Counting objects:  51% (138/270)[Kremote: Counting objects:  52% (141/270)[Kremote: Counting objects:  53% (144/270)[Kremote: Counting objects:  54% (146/270)[Kremote: Counting objects:  55% (149/270)[Kremote: Counting objects:  56% (152/270)[Kremote: Counting objects:  57% (154/270)[Kremote: Counting objects:  58% (157/270)[Kremote: Counting objects:  59% (160/270)[Kremote: Counting objects:  60% (162/270)[Kremote: Counting objects:  61% (165/270)[Kremote: Counting objects:  62% (168/270)[Kremote: Counting objects:  63% (171/270)[Kremote: Counting objects:  64% (173/270)[Kremote: Counting objects:  65% (176/270)[Kremote: Counting objects:  66% (179/270)[Kremote: Counting objects:  67% (181/270)[Kremote: Counting objects:  68% (184/270)[Kremote: Counting objects:  69% (187/270)[Kremote: Counting objects:  70% (189/270)[Kremote: Counting objects:  71% (192/270)[Kremote: Counting objects:  72% (195/270)[Kremote: Counting objects:  73% (198/270)[Kremote: Counting objects:  74% (200/270)[Kremote: Counting objects:  75% (203/270)[Kremote: Counting objects:  76% (206/270)[Kremote: Counting objects:  77% (208/270)[Kremote: Counting objects:  78% (211/270)[Kremote: Counting objects:  79% (214/270)[Kremote: Counting objects:  80% (216/270)[Kremote: Counting objects:  81% (219/270)[Kremote: Counting objects:  82% (222/270)[Kremote: Counting objects:  83% (225/270)[Kremote: Counting objects:  84% (227/270)[Kremote: Counting objects:  85% (230/270)[Kremote: Counting objects:  86% (233/270)[Kremote: Counting objects:  87% (235/270)[Kremote: Counting objects:  88% (238/270)[Kremote: Counting objects:  89% (241/270)[Kremote: Counting objects:  90% (243/270)[Kremote: Counting objects:  91% (246/270)[Kremote: Counting objects:  92% (249/270)[Kremote: Counting objects:  93% (252/270)[Kremote: Counting objects:  94% (254/270)[Kremote: Counting objects:  95% (257/270)[Kremote: Counting objects:  96% (260/270)[Kremote: Counting objects:  97% (262/270)[Kremote: Counting objects:  98% (265/270)[Kremote: Counting objects:  99% (268/270)[Kremote: Counting objects: 100% (270/270)[Kremote: Counting objects: 100% (270/270), done.[K
14.6s 15 remote: Compressing objects:   1% (1/57)[Kremote: Compressing objects:   3% (2/57)[Kremote: Compressing objects:   5% (3/57)[Kremote: Compressing objects:   7% (4/57)[Kremote: Compressing objects:   8% (5/57)[Kremote: Compressing objects:  10% (6/57)[Kremote: Compressing objects:  12% (7/57)[Kremote: Compressing objects:  14% (8/57)[Kremote: Compressing objects:  15% (9/57)[Kremote: Compressing objects:  17% (10/57)[Kremote: Compressing objects:  19% (11/57)[Kremote: Compressing objects:  21% (12/57)[Kremote: Compressing objects:  22% (13/57)[Kremote: Compressing objects:  24% (14/57)[Kremote: Compressing objects:  26% (15/57)[Kremote: Compressing objects:  28% (16/57)[Kremote: Compressing objects:  29% (17/57)[Kremote: Compressing objects:  31% (18/57)[Kremote: Compressing objects:  33% (19/57)[Kremote: Compressing objects:  35% (20/57)[Kremote: Compressing objects:  36% (21/57)[Kremote: Compressing objects:  38% (22/57)[Kremote: Compressing objects:  40% (23/57)[Kremote: Compressing objects:  42% (24/57)[Kremote: Compressing objects:  43% (25/57)[Kremote: Compressing objects:  45% (26/57)[Kremote: Compressing objects:  47% (27/57)[Kremote: Compressing objects:  49% (28/57)[Kremote: Compressing objects:  50% (29/57)[Kremote: Compressing objects:  52% (30/57)[Kremote: Compressing objects:  54% (31/57)[Kremote: Compressing objects:  56% (32/57)[Kremote: Compressing objects:  57% (33/57)[Kremote: Compressing objects:  59% (34/57)[Kremote: Compressing objects:  61% (35/57)[Kremote: Compressing objects:  63% (36/57)[Kremote: Compressing objects:  64% (37/57)[Kremote: Compressing objects:  66% (38/57)[Kremote: Compressing objects:  68% (39/57)[Kremote: Compressing objects:  70% (40/57)[Kremote: Compressing objects:  71% (41/57)[Kremote: Compressing objects:  73% (42/57)[Kremote: Compressing objects:  75% (43/57)[Kremote: Compressing objects:  77% (44/57)[Kremote: Compressing objects:  78% (45/57)[Kremote: Compressing objects:  80% (46/57)[Kremote: Compressing objects:  82% (47/57)[Kremote: Compressing objects:  84% (48/57)[Kremote: Compressing objects:  85% (49/57)[Kremote: Compressing objects:  87% (50/57)[Kremote: Compressing objects:  89% (51/57)[Kremote: Compressing objects:  91% (52/57)[Kremote: Compressing objects:  92% (53/57)[Kremote: Compressing objects:  94% (54/57)[Kremote: Compressing objects:  96% (55/57)[Kremote: Compressing objects:  98% (56/57)[Kremote: Compressing objects: 100% (57/57)[Kremote: Compressing objects: 100% (57/57), done.[K
16.6s 16 Receiving objects:   0% (1/1698)Receiving objects:   1% (17/1698)Receiving objects:   2% (34/1698)Receiving objects:   3% (51/1698)Receiving objects:   4% (68/1698)Receiving objects:   5% (85/1698)Receiving objects:   6% (102/1698)Receiving objects:   7% (119/1698)Receiving objects:   8% (136/1698)Receiving objects:   9% (153/1698)Receiving objects:  10% (170/1698)Receiving objects:  11% (187/1698)Receiving objects:  12% (204/1698)Receiving objects:  13% (221/1698)Receiving objects:  14% (238/1698)Receiving objects:  15% (255/1698)Receiving objects:  16% (272/1698)Receiving objects:  17% (289/1698)Receiving objects:  18% (306/1698)Receiving objects:  19% (323/1698)Receiving objects:  20% (340/1698)Receiving objects:  21% (357/1698)Receiving objects:  22% (374/1698)Receiving objects:  23% (391/1698)Receiving objects:  24% (408/1698)Receiving objects:  25% (425/1698)Receiving objects:  26% (442/1698)Receiving objects:  27% (459/1698)Receiving objects:  28% (476/1698), 9.67 MiB | 19.32 MiB/sReceiving objects:  29% (493/1698), 9.67 MiB | 19.32 MiB/sReceiving objects:  30% (510/1698), 9.67 MiB | 19.32 MiB/sReceiving objects:  31% (527/1698), 9.67 MiB | 19.32 MiB/sReceiving objects:  32% (544/1698), 9.67 MiB | 19.32 MiB/sReceiving objects:  33% (561/1698), 9.67 MiB | 19.32 MiB/sReceiving objects:  34% (578/1698), 9.67 MiB | 19.32 MiB/sReceiving objects:  35% (595/1698), 9.67 MiB | 19.32 MiB/sReceiving objects:  36% (612/1698), 9.67 MiB | 19.32 MiB/sReceiving objects:  37% (629/1698), 9.67 MiB | 19.32 MiB/sReceiving objects:  38% (646/1698), 9.67 MiB | 19.32 MiB/sReceiving objects:  39% (663/1698), 9.67 MiB | 19.32 MiB/sReceiving objects:  40% (680/1698), 9.67 MiB | 19.32 MiB/sReceiving objects:  41% (697/1698), 9.67 MiB | 19.32 MiB/sReceiving objects:  42% (714/1698), 9.67 MiB | 19.32 MiB/sReceiving objects:  43% (731/1698), 9.67 MiB | 19.32 MiB/sReceiving objects:  44% (748/1698), 9.67 MiB | 19.32 MiB/sReceiving objects:  45% (765/1698), 9.67 MiB | 19.32 MiB/sReceiving objects:  46% (782/1698), 9.67 MiB | 19.32 MiB/sReceiving objects:  47% (799/1698), 9.67 MiB | 19.32 MiB/sReceiving objects:  48% (816/1698), 9.67 MiB | 19.32 MiB/sReceiving objects:  49% (833/1698), 9.67 MiB | 19.32 MiB/sReceiving objects:  50% (849/1698), 9.67 MiB | 19.32 MiB/sReceiving objects:  51% (866/1698), 9.67 MiB | 19.32 MiB/sReceiving objects:  52% (883/1698), 9.67 MiB | 19.32 MiB/sReceiving objects:  53% (900/1698), 9.67 MiB | 19.32 MiB/sReceiving objects:  54% (917/1698), 9.67 MiB | 19.32 MiB/sReceiving objects:  55% (934/1698), 9.67 MiB | 19.32 MiB/sReceiving objects:  56% (951/1698), 9.67 MiB | 19.32 MiB/sReceiving objects:  57% (968/1698), 9.67 MiB | 19.32 MiB/sReceiving objects:  58% (985/1698), 9.67 MiB | 19.32 MiB/sReceiving objects:  59% (1002/1698), 9.67 MiB | 19.32 MiB/sReceiving objects:  60% (1019/1698), 9.67 MiB | 19.32 MiB/sReceiving objects:  61% (1036/1698), 9.67 MiB | 19.32 MiB/sReceiving objects:  61% (1039/1698), 26.39 MiB | 26.38 MiB/sReceiving objects:  62% (1053/1698), 26.39 MiB | 26.38 MiB/sReceiving objects:  63% (1070/1698), 26.39 MiB | 26.38 MiB/sReceiving objects:  64% (1087/1698), 26.39 MiB | 26.38 MiB/sReceiving objects:  65% (1104/1698), 26.39 MiB | 26.38 MiB/sReceiving objects:  66% (1121/1698), 26.39 MiB | 26.38 MiB/sReceiving objects:  67% (1138/1698), 26.39 MiB | 26.38 MiB/sReceiving objects:  68% (1155/1698), 26.39 MiB | 26.38 MiB/sReceiving objects:  69% (1172/1698), 44.01 MiB | 29.34 MiB/sReceiving objects:  70% (1189/1698), 44.01 MiB | 29.34 MiB/sReceiving objects:  71% (1206/1698), 44.01 MiB | 29.34 MiB/sReceiving objects:  72% (1223/1698), 44.01 MiB | 29.34 MiB/sReceiving objects:  73% (1240/1698), 44.01 MiB | 29.34 MiB/sReceiving objects:  74% (1257/1698), 44.01 MiB | 29.34 MiB/sReceiving objects:  75% (1274/1698), 44.01 MiB | 29.34 MiB/sReceiving objects:  76% (1291/1698), 44.01 MiB | 29.34 MiB/sReceiving objects:  77% (1308/1698), 44.01 MiB | 29.34 MiB/sReceiving objects:  78% (1325/1698), 44.01 MiB | 29.34 MiB/sReceiving objects:  79% (1342/1698), 44.01 MiB | 29.34 MiB/sReceiving objects:  80% (1359/1698), 44.01 MiB | 29.34 MiB/sReceiving objects:  81% (1376/1698), 44.01 MiB | 29.34 MiB/sReceiving objects:  82% (1393/1698), 44.01 MiB | 29.34 MiB/sReceiving objects:  83% (1410/1698), 44.01 MiB | 29.34 MiB/sReceiving objects:  84% (1427/1698), 44.01 MiB | 29.34 MiB/sReceiving objects:  85% (1444/1698), 44.01 MiB | 29.34 MiB/sReceiving objects:  86% (1461/1698), 44.01 MiB | 29.34 MiB/sReceiving objects:  87% (1478/1698), 44.01 MiB | 29.34 MiB/sReceiving objects:  88% (1495/1698), 44.01 MiB | 29.34 MiB/sReceiving objects:  89% (1512/1698), 44.01 MiB | 29.34 MiB/sReceiving objects:  90% (1529/1698), 44.01 MiB | 29.34 MiB/sReceiving objects:  91% (1546/1698), 44.01 MiB | 29.34 MiB/sReceiving objects:  92% (1563/1698), 44.01 MiB | 29.34 MiB/sReceiving objects:  93% (1580/1698), 44.01 MiB | 29.34 MiB/sReceiving objects:  94% (1597/1698), 44.01 MiB | 29.34 MiB/sReceiving objects:  95% (1614/1698), 44.01 MiB | 29.34 MiB/sReceiving objects:  96% (1631/1698), 44.01 MiB | 29.34 MiB/sReceiving objects:  97% (1648/1698), 44.01 MiB | 29.34 MiB/sReceiving objects:  98% (1665/1698), 44.01 MiB | 29.34 MiB/sReceiving objects:  99% (1682/1698), 44.01 MiB | 29.34 MiB/sremote: Total 1698 (delta 229), reused 218 (delta 213), pack-reused 1428 (from 3)[K
16.6s 17 Receiving objects: 100% (1698/1698), 44.01 MiB | 29.34 MiB/sReceiving objects: 100% (1698/1698), 56.49 MiB | 28.91 MiB/s, done.
16.8s 18 Resolving deltas:   0% (0/980)Resolving deltas:   1% (10/980)Resolving deltas:   2% (20/980)Resolving deltas:   3% (30/980)Resolving deltas:   4% (40/980)Resolving deltas:   5% (49/980)Resolving deltas:   6% (59/980)Resolving deltas:   7% (69/980)Resolving deltas:   8% (79/980)Resolving deltas:   9% (89/980)Resolving deltas:  10% (98/980)Resolving deltas:  11% (108/980)Resolving deltas:  12% (118/980)Resolving deltas:  13% (128/980)Resolving deltas:  14% (138/980)Resolving deltas:  15% (147/980)Resolving deltas:  16% (157/980)Resolving deltas:  17% (167/980)Resolving deltas:  18% (177/980)Resolving deltas:  19% (187/980)Resolving deltas:  20% (196/980)Resolving deltas:  21% (206/980)Resolving deltas:  22% (216/980)Resolving deltas:  23% (226/980)Resolving deltas:  24% (236/980)Resolving deltas:  25% (245/980)Resolving deltas:  26% (255/980)Resolving deltas:  27% (265/980)Resolving deltas:  28% (275/980)Resolving deltas:  29% (285/980)Resolving deltas:  30% (294/980)Resolving deltas:  31% (304/980)Resolving deltas:  32% (314/980)Resolving deltas:  33% (324/980)Resolving deltas:  34% (334/980)Resolving deltas:  35% (343/980)Resolving deltas:  36% (353/980)Resolving deltas:  37% (363/980)Resolving deltas:  38% (373/980)Resolving deltas:  39% (383/980)Resolving deltas:  40% (392/980)Resolving deltas:  41% (402/980)Resolving deltas:  42% (412/980)Resolving deltas:  43% (422/980)Resolving deltas:  44% (432/980)Resolving deltas:  45% (441/980)Resolving deltas:  46% (451/980)Resolving deltas:  47% (461/980)Resolving deltas:  48% (471/980)Resolving deltas:  49% (481/980)Resolving deltas:  50% (490/980)Resolving deltas:  51% (500/980)Resolving deltas:  52% (510/980)Resolving deltas:  53% (520/980)Resolving deltas:  54% (530/980)Resolving deltas:  55% (539/980)Resolving deltas:  56% (549/980)Resolving deltas:  57% (559/980)Resolving deltas:  58% (569/980)Resolving deltas:  59% (579/980)Resolving deltas:  60% (588/980)Resolving deltas:  61% (598/980)Resolving deltas:  62% (608/980)Resolving deltas:  63% (618/980)Resolving deltas:  64% (628/980)Resolving deltas:  65% (637/980)Resolving deltas:  66% (647/980)Resolving deltas:  67% (657/980)Resolving deltas:  68% (667/980)Resolving deltas:  69% (677/980)Resolving deltas:  70% (686/980)Resolving deltas:  71% (696/980)Resolving deltas:  72% (706/980)Resolving deltas:  73% (716/980)Resolving deltas:  74% (726/980)Resolving deltas:  75% (735/980)Resolving deltas:  76% (745/980)Resolving deltas:  77% (755/980)Resolving deltas:  78% (765/980)Resolving deltas:  79% (775/980)Resolving deltas:  80% (784/980)Resolving deltas:  81% (794/980)Resolving deltas:  82% (804/980)Resolving deltas:  83% (814/980)Resolving deltas:  84% (824/980)Resolving deltas:  85% (833/980)Resolving deltas:  86% (843/980)Resolving deltas:  87% (853/980)Resolving deltas:  88% (863/980)Resolving deltas:  89% (873/980)Resolving deltas:  90% (882/980)Resolving deltas:  91% (892/980)Resolving deltas:  92% (902/980)Resolving deltas:  93% (912/980)Resolving deltas:  94% (922/980)Resolving deltas:  95% (931/980)Resolving deltas:  96% (941/980)Resolving deltas:  97% (951/980)Resolving deltas:  98% (961/980)Resolving deltas:  99% (971/980)Resolving deltas: 100% (980/980)Resolving deltas: 100% (980/980), done.
17.5s 19 /kaggle/working/RecSys_Course_AT_PoliMi
22.4s 20 2025-12-07 08:54:16.923480: E external/local_xla/xla/stream_executor/cuda/cuda_fft.cc:477] Unable to register cuFFT factory: Attempting to register factory for plugin cuFFT when one has already been registered
22.4s 21 WARNING: All log messages before absl::InitializeLog() is called are written to STDERR
22.4s 22 E0000 00:00:1765097657.166675      13 cuda_dnn.cc:8310] Unable to register cuDNN factory: Attempting to register factory for plugin cuDNN when one has already been registered
22.4s 23 E0000 00:00:1765097657.248775      13 cuda_blas.cc:1418] Unable to register cuBLAS factory: Attempting to register factory for plugin cuBLAS when one has already been registered
22.6s 24 2025-12-07 08:54:16.923480: E external/local_xla/xla/stream_executor/cuda/cuda_fft.cc:477] Unable to register cuFFT factory: Attempting to register factory for plugin cuFFT when one has already been registered
22.6s 25 WARNING: All log messages before absl::InitializeLog() is called are written to STDERR
22.6s 26 E0000 00:00:1765097657.166675      13 cuda_dnn.cc:8310] Unable to register cuDNN factory: Attempting to register factory for plugin cuDNN when one has already been registered
22.6s 27 E0000 00:00:1765097657.248775      13 cuda_blas.cc:1418] Unable to register cuBLAS factory: Attempting to register factory for plugin cuBLAS when one has already been registered
22.6s 28 
22.6s 29 2025-12-07 08:54:16.923480: E external/local_xla/xla/stream_executor/cuda/cuda_fft.cc:477] Unable to register cuFFT factory: Attempting to register factory for plugin cuFFT when one has already been registered
22.6s 30 WARNING: All log messages before absl::InitializeLog() is called are written to STDERR
22.6s 31 E0000 00:00:1765097657.166675      13 cuda_dnn.cc:8310] Unable to register cuDNN factory: Attempting to register factory for plugin cuDNN when one has already been registered
22.6s 32 E0000 00:00:1765097657.248775      13 cuda_blas.cc:1418] Unable to register cuBLAS factory: Attempting to register factory for plugin cuBLAS when one has already been registered
47.6s 33 [I 2025-12-07 08:54:43,121] A new study created in memory with name: no-name-11ebdd27-5ec3-4092-8fc6-9059c4649a96
47.6s 34 
47.6s 35 [I 2025-12-07 08:54:43,121] A new study created in memory with name: no-name-11ebdd27-5ec3-4092-8fc6-9059c4649a96
48.1s 36 Unable to load Cython Compute_Similarity, reverting to Python
62.1s 37 Similarity column 6969 (100.0%), 493.07 column/sec. Elapsed time 14.13 sec
62.3s 38 EvaluatorHoldout: Ignoring 33 ( 0.1%) Users that have less than 1 test interactions
92.2s 39 EvaluatorHoldout: Processed 27062 (100.0%) in 29.98 sec. Users per second: 903
92.7s 40 Unable to load Cython Compute_Similarity, reverting to Python
106.5s 41 Similarity column 6969 (100.0%), 497.32 column/sec. Elapsed time 14.01 sec
106.7s 42 EvaluatorHoldout: Ignoring 28 ( 0.1%) Users that have less than 1 test interactions
136.4s 43 EvaluatorHoldout: Processed 27067 (100.0%) in 29.75 sec. Users per second: 910
136.9s 44 Unable to load Cython Compute_Similarity, reverting to Python
150.5s 45 Similarity column 6969 (100.0%), 504.29 column/sec. Elapsed time 13.82 sec
150.7s 46 EvaluatorHoldout: Ignoring 40 ( 0.1%) Users that have less than 1 test interactions
180.5s 47 EvaluatorHoldout: Processed 27055 (100.0%) in 29.89 sec. Users per second: 905
181.0s 48 Unable to load Cython Compute_Similarity, reverting to Python
194.8s 49 Similarity column 6969 (100.0%), 497.58 column/sec. Elapsed time 14.01 sec
195.0s 50 EvaluatorHoldout: Ignoring 21 ( 0.1%) Users that have less than 1 test interactions
224.4s 51 EvaluatorHoldout: Processed 27074 (100.0%) in 29.49 sec. Users per second: 918
224.9s 52 Unable to load Cython Compute_Similarity, reverting to Python
238.6s 53 Similarity column 6969 (100.0%), 502.43 column/sec. Elapsed time 13.87 sec
238.8s 54 EvaluatorHoldout: Ignoring 29 ( 0.1%) Users that have less than 1 test interactions
268.3s 55 EvaluatorHoldout: Processed 27066 (100.0%) in 29.60 sec. Users per second: 914
268.3s 56 [I 2025-12-07 08:58:23,858] Trial 0 finished with value: 0.20406766412044472 and parameters: {'similarity': 'cosine', 'topK': 654, 'shrink': 435}. Best is trial 0 with value: 0.20406766412044472.
268.3s 57 
