15601.2s 2576 [I 2025-12-07 13:13:56,741] Trial 105 finished with value: 0.20325448905611268 and parameters: {'similarity': 'jaccard', 'topK': 69, 'shrink': 282}. Best is trial 91 with value: 0.24993110179607925.
15601.2s 2577 
15601.2s 2578 [I 2025-12-07 13:13:56,741] Trial 105 finished with value: 0.20325448905611268 and parameters: {'similarity': 'jaccard', 'topK': 69, 'shrink': 282}. Best is trial 91 with value: 0.24993110179607925.
15601.4s 2579 [0.20222798223565608, 0.20340160022432593, 0.20404849115152798, 0.20276332575677514, 0.20383104591227813]
15601.7s 2580 Unable to load Cython Compute_Similarity, reverting to Python
15610.8s 2581 Similarity column 6969 (100.0%), 761.81 column/sec. Elapsed time 9.15 sec
15610.9s 2582 EvaluatorHoldout: Ignoring 33 ( 0.1%) Users that have less than 1 test interactions
15624.9s 2583 EvaluatorHoldout: Processed 27062 (100.0%) in 14.21 sec. Users per second: 1904
15625.4s 2584 Unable to load Cython Compute_Similarity, reverting to Python
15634.2s 2585 Similarity column 6969 (100.0%), 770.33 column/sec. Elapsed time 9.05 sec
15634.4s 2586 EvaluatorHoldout: Ignoring 28 ( 0.1%) Users that have less than 1 test interactions
15648.7s 2587 EvaluatorHoldout: Processed 27067 (100.0%) in 14.34 sec. Users per second: 1887
15649.1s 2588 Unable to load Cython Compute_Similarity, reverting to Python
15658.2s 2589 Similarity column 6969 (100.0%), 746.52 column/sec. Elapsed time 9.34 sec
15658.4s 2590 EvaluatorHoldout: Ignoring 40 ( 0.1%) Users that have less than 1 test interactions
15672.5s 2591 EvaluatorHoldout: Processed 27055 (100.0%) in 14.21 sec. Users per second: 1904
15673.0s 2592 Unable to load Cython Compute_Similarity, reverting to Python
15682.0s 2593 Similarity column 6969 (100.0%), 764.56 column/sec. Elapsed time 9.11 sec
15682.1s 2594 EvaluatorHoldout: Ignoring 21 ( 0.1%) Users that have less than 1 test interactions
15696.1s 2595 EvaluatorHoldout: Processed 27074 (100.0%) in 14.20 sec. Users per second: 1906
15696.6s 2596 Unable to load Cython Compute_Similarity, reverting to Python
15705.3s 2597 Similarity column 6969 (100.0%), 781.41 column/sec. Elapsed time 8.92 sec
15705.5s 2598 EvaluatorHoldout: Ignoring 29 ( 0.1%) Users that have less than 1 test interactions
15719.8s 2599 EvaluatorHoldout: Processed 27066 (100.0%) in 14.32 sec. Users per second: 1890
15719.8s 2600 [I 2025-12-07 13:15:55,183] Trial 106 finished with value: 0.24332595279934868 and parameters: {'similarity': 'tversky', 'topK': 27, 'shrink': 171, 'tversky_alpha': 0.09354912358592249, 'tversky_beta': 1.8679195396440837}. Best is trial 91 with value: 0.24993110179607925.
15719.8s 2601 
15719.8s 2602 [I 2025-12-07 13:15:55,183] Trial 106 finished with value: 0.24332595279934868 and parameters: {'similarity': 'tversky', 'topK': 27, 'shrink': 171, 'tversky_alpha': 0.09354912358592249, 'tversky_beta': 1.8679195396440837}. Best is trial 91 with value: 0.24993110179607925.
15719.9s 2603 [0.24285127654674035, 0.24345048577848705, 0.2443375447306755, 0.24274204938637997, 0.24324840755446048]
15720.2s 2604 Unable to load Cython Compute_Similarity, reverting to Python
15729.5s 2605 Similarity column 6969 (100.0%), 729.65 column/sec. Elapsed time 9.55 sec
15729.7s 2606 EvaluatorHoldout: Ignoring 33 ( 0.1%) Users that have less than 1 test interactions
15745.1s 2607 EvaluatorHoldout: Processed 27062 (100.0%) in 15.56 sec. Users per second: 1739
15745.6s 2608 Unable to load Cython Compute_Similarity, reverting to Python
15755.3s 2609 Similarity column 6969 (100.0%), 715.39 column/sec. Elapsed time 9.74 sec
15755.4s 2610 EvaluatorHoldout: Ignoring 28 ( 0.1%) Users that have less than 1 test interactions
15771.1s 2611 EvaluatorHoldout: Processed 27067 (100.0%) in 15.88 sec. Users per second: 1705
15771.6s 2612 Unable to load Cython Compute_Similarity, reverting to Python
15781.2s 2613 Similarity column 6969 (100.0%), 710.67 column/sec. Elapsed time 9.81 sec
15781.4s 2614 EvaluatorHoldout: Ignoring 40 ( 0.1%) Users that have less than 1 test interactions
15797.1s 2615 EvaluatorHoldout: Processed 27055 (100.0%) in 15.72 sec. Users per second: 1721
15797.4s 2616 Unable to load Cython Compute_Similarity, reverting to Python
15807.0s 2617 Similarity column 6969 (100.0%), 716.26 column/sec. Elapsed time 9.73 sec
15807.2s 2618 EvaluatorHoldout: Ignoring 21 ( 0.1%) Users that have less than 1 test interactions
15822.8s 2619 EvaluatorHoldout: Processed 27074 (100.0%) in 15.80 sec. Users per second: 1714
15823.3s 2620 Unable to load Cython Compute_Similarity, reverting to Python
15833.3s 2621 Similarity column 6969 (100.0%), 689.72 column/sec. Elapsed time 10.10 sec
15833.4s 2622 EvaluatorHoldout: Ignoring 29 ( 0.1%) Users that have less than 1 test interactions
15849.0s 2623 EvaluatorHoldout: Processed 27066 (100.0%) in 15.79 sec. Users per second: 1714
15849.0s 2624 [I 2025-12-07 13:18:04,548] Trial 107 finished with value: 0.227895240907394 and parameters: {'similarity': 'tversky', 'topK': 104, 'shrink': 249, 'tversky_alpha': 0.0030918975371083124, 'tversky_beta': 1.8100256962715393}. Best is trial 91 with value: 0.24993110179607925.
15849.0s 2625 
15849.0s 2626 [I 2025-12-07 13:18:04,548] Trial 107 finished with value: 0.227895240907394 and parameters: {'similarity': 'tversky', 'topK': 104, 'shrink': 249, 'tversky_alpha': 0.0030918975371083124, 'tversky_beta': 1.8100256962715393}. Best is trial 91 with value: 0.24993110179607925.
15849.2s 2627 [0.22704850024886605, 0.22786526980859753, 0.2288918419625054, 0.2272920440650871, 0.228378548451914]
15849.5s 2628 Unable to load Cython Compute_Similarity, reverting to Python
15858.8s 2629 Similarity column 6969 (100.0%), 739.65 column/sec. Elapsed time 9.42 sec
15859.0s 2630 EvaluatorHoldout: Ignoring 33 ( 0.1%) Users that have less than 1 test interactions
15874.1s 2631 EvaluatorHoldout: Processed 27062 (100.0%) in 15.17 sec. Users per second: 1784
15874.5s 2632 Unable to load Cython Compute_Similarity, reverting to Python
15883.7s 2633 Similarity column 6969 (100.0%), 736.92 column/sec. Elapsed time 9.46 sec
15883.9s 2634 EvaluatorHoldout: Ignoring 28 ( 0.1%) Users that have less than 1 test interactions
15899.0s 2635 EvaluatorHoldout: Processed 27067 (100.0%) in 15.30 sec. Users per second: 1769
15899.5s 2636 Unable to load Cython Compute_Similarity, reverting to Python
15909.1s 2637 Similarity column 6969 (100.0%), 720.41 column/sec. Elapsed time 9.67 sec
15909.2s 2638 EvaluatorHoldout: Ignoring 40 ( 0.1%) Users that have less than 1 test interactions
15924.3s 2639 EvaluatorHoldout: Processed 27055 (100.0%) in 15.25 sec. Users per second: 1774
15924.8s 2640 Unable to load Cython Compute_Similarity, reverting to Python
15934.1s 2641 Similarity column 6969 (100.0%), 732.93 column/sec. Elapsed time 9.51 sec
15934.3s 2642 EvaluatorHoldout: Ignoring 21 ( 0.1%) Users that have less than 1 test interactions
15949.5s 2643 EvaluatorHoldout: Processed 27074 (100.0%) in 15.22 sec. Users per second: 1779
15949.8s 2644 Unable to load Cython Compute_Similarity, reverting to Python
15959.0s 2645 Similarity column 6969 (100.0%), 744.86 column/sec. Elapsed time 9.36 sec
15959.2s 2646 EvaluatorHoldout: Ignoring 29 ( 0.1%) Users that have less than 1 test interactions
15974.3s 2647 EvaluatorHoldout: Processed 27066 (100.0%) in 15.23 sec. Users per second: 1777
15974.3s 2648 [I 2025-12-07 13:20:09,787] Trial 108 finished with value: 0.21923445830208793 and parameters: {'similarity': 'tversky', 'topK': 48, 'shrink': 193, 'tversky_alpha': 0.3792524775104696, 'tversky_beta': 1.5663177620472717}. Best is trial 91 with value: 0.24993110179607925.
15974.3s 2649 
15974.3s 2650 [I 2025-12-07 13:20:09,787] Trial 108 finished with value: 0.21923445830208793 and parameters: {'similarity': 'tversky', 'topK': 48, 'shrink': 193, 'tversky_alpha': 0.3792524775104696, 'tversky_beta': 1.5663177620472717}. Best is trial 91 with value: 0.24993110179607925.
15974.5s 2651 [0.2191978941554856, 0.21966751119192102, 0.2195537784367834, 0.21857316483357958, 0.21917994289267015]
15974.8s 2652 Unable to load Cython Compute_Similarity, reverting to Python
15989.0s 2653 Similarity column 6969 (100.0%), 487.68 column/sec. Elapsed time 14.29 sec
15989.1s 2654 EvaluatorHoldout: Ignoring 33 ( 0.1%) Users that have less than 1 test interactions
16011.5s 2655 EvaluatorHoldout: Processed 27062 (100.0%) in 22.50 sec. Users per second: 1203
16012.0s 2656 Unable to load Cython Compute_Similarity, reverting to Python
16026.1s 2657 Similarity column 6969 (100.0%), 491.19 column/sec. Elapsed time 14.19 sec
16026.2s 2658 EvaluatorHoldout: Ignoring 28 ( 0.1%) Users that have less than 1 test interactions
16048.7s 2659 EvaluatorHoldout: Processed 27067 (100.0%) in 22.59 sec. Users per second: 1198
16049.2s 2660 Unable to load Cython Compute_Similarity, reverting to Python
16063.5s 2661 Similarity column 6969 (100.0%), 486.19 column/sec. Elapsed time 14.33 sec
16063.5s 2662 EvaluatorHoldout: Ignoring 40 ( 0.1%) Users that have less than 1 test interactions
16085.8s 2663 EvaluatorHoldout: Processed 27055 (100.0%) in 22.32 sec. Users per second: 1212
16086.3s 2664 Unable to load Cython Compute_Similarity, reverting to Python
16100.3s 2665 Similarity column 6969 (100.0%), 493.96 column/sec. Elapsed time 14.11 sec
16100.4s 2666 EvaluatorHoldout: Ignoring 21 ( 0.1%) Users that have less than 1 test interactions
16123.1s 2667 EvaluatorHoldout: Processed 27074 (100.0%) in 22.77 sec. Users per second: 1189
16123.6s 2668 Unable to load Cython Compute_Similarity, reverting to Python
16137.9s 2669 Similarity column 6969 (100.0%), 486.54 column/sec. Elapsed time 14.32 sec
16137.9s 2670 EvaluatorHoldout: Ignoring 29 ( 0.1%) Users that have less than 1 test interactions
16160.6s 2671 EvaluatorHoldout: Processed 27066 (100.0%) in 22.73 sec. Users per second: 1191
16160.6s 2672 [I 2025-12-07 13:23:16,092] Trial 109 finished with value: 0.17030124333212904 and parameters: {'similarity': 'tversky', 'topK': 642, 'shrink': 354, 'tversky_alpha': 0.21146282782487616, 'tversky_beta': 1.7372979053406234}. Best is trial 91 with value: 0.24993110179607925.
16160.6s 2673 
16160.6s 2674 [I 2025-12-07 13:23:16,092] Trial 109 finished with value: 0.17030124333212904 and parameters: {'similarity': 'tversky', 'topK': 642, 'shrink': 354, 'tversky_alpha': 0.21146282782487616, 'tversky_beta': 1.7372979053406234}. Best is trial 91 with value: 0.24993110179607925.
16160.8s 2675 [0.17052436936157195, 0.17019418938604622, 0.16977019586986686, 0.1698456737020664, 0.17117178834109378]
16161.1s 2676 Unable to load Cython Compute_Similarity, reverting to Python
16170.1s 2677 Similarity column 6969 (100.0%), 768.38 column/sec. Elapsed time 9.07 sec
16170.2s 2678 EvaluatorHoldout: Ignoring 33 ( 0.1%) Users that have less than 1 test interactions
16184.5s 2679 EvaluatorHoldout: Processed 27062 (100.0%) in 14.48 sec. Users per second: 1869
16185.0s 2680 Unable to load Cython Compute_Similarity, reverting to Python
16193.7s 2681 Similarity column 6969 (100.0%), 778.20 column/sec. Elapsed time 8.96 sec
16193.9s 2682 EvaluatorHoldout: Ignoring 28 ( 0.1%) Users that have less than 1 test interactions
16208.4s 2683 EvaluatorHoldout: Processed 27067 (100.0%) in 14.56 sec. Users per second: 1859
16208.8s 2684 Unable to load Cython Compute_Similarity, reverting to Python
16218.0s 2685 Similarity column 6969 (100.0%), 739.74 column/sec. Elapsed time 9.42 sec
16218.2s 2686 EvaluatorHoldout: Ignoring 40 ( 0.1%) Users that have less than 1 test interactions
16232.7s 2687 EvaluatorHoldout: Processed 27055 (100.0%) in 14.61 sec. Users per second: 1852
16233.1s 2688 Unable to load Cython Compute_Similarity, reverting to Python
16242.2s 2689 Similarity column 6969 (100.0%), 763.56 column/sec. Elapsed time 9.13 sec
16242.3s 2690 EvaluatorHoldout: Ignoring 21 ( 0.1%) Users that have less than 1 test interactions
16256.7s 2691 EvaluatorHoldout: Processed 27074 (100.0%) in 14.61 sec. Users per second: 1853
16257.2s 2692 Unable to load Cython Compute_Similarity, reverting to Python
16265.9s 2693 Similarity column 6969 (100.0%), 778.41 column/sec. Elapsed time 8.95 sec
16266.1s 2694 EvaluatorHoldout: Ignoring 29 ( 0.1%) Users that have less than 1 test interactions
16281.0s 2695 EvaluatorHoldout: Processed 27066 (100.0%) in 14.87 sec. Users per second: 1820
16281.0s 2696 [I 2025-12-07 13:25:16,363] Trial 110 finished with value: 0.13628237314436398 and parameters: {'similarity': 'tversky', 'topK': 5, 'shrink': 100, 'tversky_alpha': 1.1635261828046484, 'tversky_beta': 0.09040947676805555}. Best is trial 91 with value: 0.24993110179607925.
16281.0s 2697 
16281.0s 2698 [I 2025-12-07 13:25:16,363] Trial 110 finished with value: 0.13628237314436398 and parameters: {'similarity': 'tversky', 'topK': 5, 'shrink': 100, 'tversky_alpha': 1.1635261828046484, 'tversky_beta': 0.09040947676805555}. Best is trial 91 with value: 0.24993110179607925.
16281.0s 2699 [0.1358342167594539, 0.13720910364891084, 0.1375305439710872, 0.13463718718664758, 0.13620081415572036]
16281.4s 2700 Unable to load Cython Compute_Similarity, reverting to Python
16291.0s 2701 Similarity column 6969 (100.0%), 709.78 column/sec. Elapsed time 9.82 sec
16291.2s 2702 EvaluatorHoldout: Ignoring 33 ( 0.1%) Users that have less than 1 test interactions
16305.8s 2703 EvaluatorHoldout: Processed 27062 (100.0%) in 14.77 sec. Users per second: 1832
16306.3s 2704 Unable to load Cython Compute_Similarity, reverting to Python
16315.4s 2705 Similarity column 6969 (100.0%), 761.66 column/sec. Elapsed time 9.15 sec
16315.4s 2706 EvaluatorHoldout: Ignoring 28 ( 0.1%) Users that have less than 1 test interactions
16330.0s 2707 EvaluatorHoldout: Processed 27067 (100.0%) in 14.76 sec. Users per second: 1833
16330.5s 2708 Unable to load Cython Compute_Similarity, reverting to Python
16340.2s 2709 Similarity column 6969 (100.0%), 708.23 column/sec. Elapsed time 9.84 sec
16340.4s 2710 EvaluatorHoldout: Ignoring 40 ( 0.1%) Users that have less than 1 test interactions
16355.1s 2711 EvaluatorHoldout: Processed 27055 (100.0%) in 14.80 sec. Users per second: 1828
16355.5s 2712 Unable to load Cython Compute_Similarity, reverting to Python
16364.5s 2713 Similarity column 6969 (100.0%), 753.35 column/sec. Elapsed time 9.25 sec
16364.7s 2714 EvaluatorHoldout: Ignoring 21 ( 0.1%) Users that have less than 1 test interactions
16379.4s 2715 EvaluatorHoldout: Processed 27074 (100.0%) in 14.83 sec. Users per second: 1826
16379.9s 2716 Unable to load Cython Compute_Similarity, reverting to Python
16389.0s 2717 Similarity column 6969 (100.0%), 754.17 column/sec. Elapsed time 9.24 sec
16389.1s 2718 EvaluatorHoldout: Ignoring 29 ( 0.1%) Users that have less than 1 test interactions
16403.8s 2719 EvaluatorHoldout: Processed 27066 (100.0%) in 14.82 sec. Users per second: 1826
16403.8s 2720 [I 2025-12-07 13:27:19,308] Trial 111 finished with value: 0.22662120698886304 and parameters: {'similarity': 'tversky', 'topK': 24, 'shrink': 397, 'tversky_alpha': 0.33053937991944826, 'tversky_beta': 1.4324541748498656}. Best is trial 91 with value: 0.24993110179607925.
16403.8s 2721 
16403.8s 2722 [I 2025-12-07 13:27:19,308] Trial 111 finished with value: 0.22662120698886304 and parameters: {'similarity': 'tversky', 'topK': 24, 'shrink': 397, 'tversky_alpha': 0.33053937991944826, 'tversky_beta': 1.4324541748498656}. Best is trial 91 with value: 0.24993110179607925.
16404.0s 2723 [0.22607000693477539, 0.22738861090214008, 0.22819373539590765, 0.22564970372193033, 0.22580397798956173]
16404.3s 2724 Unable to load Cython Compute_Similarity, reverting to Python
16413.6s 2725 Similarity column 6969 (100.0%), 735.60 column/sec. Elapsed time 9.47 sec
16413.8s 2726 EvaluatorHoldout: Ignoring 33 ( 0.1%) Users that have less than 1 test interactions
16430.1s 2727 EvaluatorHoldout: Processed 27062 (100.0%) in 16.40 sec. Users per second: 1650
16430.5s 2728 Unable to load Cython Compute_Similarity, reverting to Python
16439.8s 2729 Similarity column 6969 (100.0%), 734.14 column/sec. Elapsed time 9.49 sec
16440.0s 2730 EvaluatorHoldout: Ignoring 28 ( 0.1%) Users that have less than 1 test interactions
16456.3s 2731 EvaluatorHoldout: Processed 27067 (100.0%) in 16.49 sec. Users per second: 1642
16456.8s 2732 Unable to load Cython Compute_Similarity, reverting to Python
16466.1s 2733 Similarity column 6969 (100.0%), 740.54 column/sec. Elapsed time 9.41 sec
16466.2s 2734 EvaluatorHoldout: Ignoring 40 ( 0.1%) Users that have less than 1 test interactions
16482.4s 2735 EvaluatorHoldout: Processed 27055 (100.0%) in 16.36 sec. Users per second: 1654
16482.9s 2736 Unable to load Cython Compute_Similarity, reverting to Python
16492.5s 2737 Similarity column 6969 (100.0%), 713.90 column/sec. Elapsed time 9.76 sec
16492.7s 2738 EvaluatorHoldout: Ignoring 21 ( 0.1%) Users that have less than 1 test interactions
16508.9s 2739 EvaluatorHoldout: Processed 27074 (100.0%) in 16.32 sec. Users per second: 1659
16509.3s 2740 Unable to load Cython Compute_Similarity, reverting to Python
16518.5s 2741 Similarity column 6969 (100.0%), 739.51 column/sec. Elapsed time 9.42 sec
16518.7s 2742 EvaluatorHoldout: Ignoring 29 ( 0.1%) Users that have less than 1 test interactions
16534.9s 2743 EvaluatorHoldout: Processed 27066 (100.0%) in 16.34 sec. Users per second: 1656
16534.9s 2744 [I 2025-12-07 13:29:30,445] Trial 112 finished with value: 0.20441744480668828 and parameters: {'similarity': 'tversky', 'topK': 70, 'shrink': 304, 'tversky_alpha': 0.9404858370194009, 'tversky_beta': 1.2843238155711565}. Best is trial 91 with value: 0.24993110179607925.
16534.9s 2745 
16534.9s 2746 [I 2025-12-07 13:29:30,445] Trial 112 finished with value: 0.20441744480668828 and parameters: {'similarity': 'tversky', 'topK': 70, 'shrink': 304, 'tversky_alpha': 0.9404858370194009, 'tversky_beta': 1.2843238155711565}. Best is trial 91 with value: 0.24993110179607925.
16535.1s 2747 [0.20395907235180832, 0.20443250478056718, 0.20502779341121657, 0.20382819771285657, 0.20483965577699273]
16535.4s 2748 Unable to load Cython Compute_Similarity, reverting to Python
16544.4s 2749 Similarity column 6969 (100.0%), 772.19 column/sec. Elapsed time 9.03 sec
16544.5s 2750 EvaluatorHoldout: Ignoring 33 ( 0.1%) Users that have less than 1 test interactions
16558.1s 2751 EvaluatorHoldout: Processed 27062 (100.0%) in 13.81 sec. Users per second: 1959
16558.6s 2752 Unable to load Cython Compute_Similarity, reverting to Python
16567.5s 2753 Similarity column 6969 (100.0%), 768.20 column/sec. Elapsed time 9.07 sec
16567.7s 2754 EvaluatorHoldout: Ignoring 28 ( 0.1%) Users that have less than 1 test interactions
16581.5s 2755 EvaluatorHoldout: Processed 27067 (100.0%) in 13.93 sec. Users per second: 1944
16581.9s 2756 Unable to load Cython Compute_Similarity, reverting to Python
16591.1s 2757 Similarity column 6969 (100.0%), 738.60 column/sec. Elapsed time 9.44 sec
16591.3s 2758 EvaluatorHoldout: Ignoring 40 ( 0.1%) Users that have less than 1 test interactions
16605.0s 2759 EvaluatorHoldout: Processed 27055 (100.0%) in 13.87 sec. Users per second: 1950
16605.5s 2760 Unable to load Cython Compute_Similarity, reverting to Python
16614.9s 2761 Similarity column 6969 (100.0%), 739.04 column/sec. Elapsed time 9.43 sec
16615.0s 2762 EvaluatorHoldout: Ignoring 21 ( 0.1%) Users that have less than 1 test interactions
16628.6s 2763 EvaluatorHoldout: Processed 27074 (100.0%) in 13.81 sec. Users per second: 1960
16629.1s 2764 Unable to load Cython Compute_Similarity, reverting to Python
16637.8s 2765 Similarity column 6969 (100.0%), 782.92 column/sec. Elapsed time 8.90 sec
16638.0s 2766 EvaluatorHoldout: Ignoring 29 ( 0.1%) Users that have less than 1 test interactions
16651.8s 2767 EvaluatorHoldout: Processed 27066 (100.0%) in 13.90 sec. Users per second: 1948
16651.8s 2768 [I 2025-12-07 13:31:27,234] Trial 113 finished with value: 0.24152902550403246 and parameters: {'similarity': 'tversky', 'topK': 7, 'shrink': 419, 'tversky_alpha': 0.45811063216793224, 'tversky_beta': 1.6029621911858103}. Best is trial 91 with value: 0.24993110179607925.
16651.8s 2769 
