268.3s 58 [I 2025-12-07 08:58:23,858] Trial 0 finished with value: 0.20406766412044472 and parameters: {'similarity': 'cosine', 'topK': 654, 'shrink': 435}. Best is trial 0 with value: 0.20406766412044472.
268.5s 59 [0.20336681218632485, 0.2041335353803632, 0.20450363730016274, 0.20319344601261322, 0.20514088972275968]
268.8s 60 Unable to load Cython Compute_Similarity, reverting to Python
278.2s 61 Similarity column 6969 (100.0%), 729.77 column/sec. Elapsed time 9.55 sec
278.4s 62 EvaluatorHoldout: Ignoring 33 ( 0.1%) Users that have less than 1 test interactions
297.9s 63 EvaluatorHoldout: Processed 27062 (100.0%) in 19.70 sec. Users per second: 1374
298.4s 64 Unable to load Cython Compute_Similarity, reverting to Python
307.8s 65 Similarity column 6969 (100.0%), 729.30 column/sec. Elapsed time 9.56 sec
308.0s 66 EvaluatorHoldout: Ignoring 28 ( 0.1%) Users that have less than 1 test interactions
327.7s 67 EvaluatorHoldout: Processed 27067 (100.0%) in 19.88 sec. Users per second: 1361
328.2s 68 Unable to load Cython Compute_Similarity, reverting to Python
337.6s 69 Similarity column 6969 (100.0%), 726.22 column/sec. Elapsed time 9.60 sec
337.8s 70 EvaluatorHoldout: Ignoring 40 ( 0.1%) Users that have less than 1 test interactions
357.3s 71 EvaluatorHoldout: Processed 27055 (100.0%) in 19.66 sec. Users per second: 1376
357.8s 72 Unable to load Cython Compute_Similarity, reverting to Python
367.4s 73 Similarity column 6969 (100.0%), 707.91 column/sec. Elapsed time 9.84 sec
367.6s 74 EvaluatorHoldout: Ignoring 21 ( 0.1%) Users that have less than 1 test interactions
387.3s 75 EvaluatorHoldout: Processed 27074 (100.0%) in 19.78 sec. Users per second: 1369
387.7s 76 Unable to load Cython Compute_Similarity, reverting to Python
397.0s 77 Similarity column 6969 (100.0%), 734.05 column/sec. Elapsed time 9.49 sec
397.2s 78 EvaluatorHoldout: Ignoring 29 ( 0.1%) Users that have less than 1 test interactions
416.8s 79 EvaluatorHoldout: Processed 27066 (100.0%) in 19.67 sec. Users per second: 1376
416.8s 80 [I 2025-12-07 09:00:52,269] Trial 1 finished with value: 0.21611002685585196 and parameters: {'similarity': 'cosine', 'topK': 140, 'shrink': 124}. Best is trial 1 with value: 0.21611002685585196.
416.8s 81 
416.8s 82 [I 2025-12-07 09:00:52,269] Trial 1 finished with value: 0.21611002685585196 and parameters: {'similarity': 'cosine', 'topK': 140, 'shrink': 124}. Best is trial 1 with value: 0.21611002685585196.
416.9s 83 [0.21536461513025637, 0.21638061247388002, 0.21648183287248263, 0.21516036562547255, 0.2171627081771683]
417.2s 84 Unable to load Cython Compute_Similarity, reverting to Python
433.2s 85 Similarity column 6969 (100.0%), 430.52 column/sec. Elapsed time 16.19 sec
433.4s 86 EvaluatorHoldout: Ignoring 33 ( 0.1%) Users that have less than 1 test interactions
466.1s 87 EvaluatorHoldout: Processed 27062 (100.0%) in 32.65 sec. Users per second: 829
466.6s 88 Unable to load Cython Compute_Similarity, reverting to Python
483.4s 89 Similarity column 6969 (100.0%), 409.70 column/sec. Elapsed time 17.01 sec
483.6s 90 EvaluatorHoldout: Ignoring 28 ( 0.1%) Users that have less than 1 test interactions
516.3s 91 EvaluatorHoldout: Processed 27067 (100.0%) in 32.70 sec. Users per second: 828
516.7s 92 Unable to load Cython Compute_Similarity, reverting to Python
533.0s 93 Similarity column 6969 (100.0%), 423.47 column/sec. Elapsed time 16.46 sec
533.2s 94 EvaluatorHoldout: Ignoring 40 ( 0.1%) Users that have less than 1 test interactions
566.0s 95 EvaluatorHoldout: Processed 27055 (100.0%) in 32.76 sec. Users per second: 826
566.4s 96 Unable to load Cython Compute_Similarity, reverting to Python
582.9s 97 Similarity column 6969 (100.0%), 419.50 column/sec. Elapsed time 16.61 sec
583.1s 98 EvaluatorHoldout: Ignoring 21 ( 0.1%) Users that have less than 1 test interactions
615.9s 99 EvaluatorHoldout: Processed 27074 (100.0%) in 32.80 sec. Users per second: 825
616.3s 100 Unable to load Cython Compute_Similarity, reverting to Python
632.5s 101 Similarity column 6969 (100.0%), 427.14 column/sec. Elapsed time 16.32 sec
632.7s 102 EvaluatorHoldout: Ignoring 29 ( 0.1%) Users that have less than 1 test interactions
665.2s 103 EvaluatorHoldout: Processed 27066 (100.0%) in 32.53 sec. Users per second: 832
665.2s 104 [I 2025-12-07 09:05:00,713] Trial 2 finished with value: 0.17988646088658578 and parameters: {'similarity': 'dice', 'topK': 989, 'shrink': 920}. Best is trial 1 with value: 0.21611002685585196.
665.2s 105 
665.2s 106 [I 2025-12-07 09:05:00,713] Trial 2 finished with value: 0.17988646088658578 and parameters: {'similarity': 'dice', 'topK': 989, 'shrink': 920}. Best is trial 1 with value: 0.21611002685585196.
665.4s 107 [0.17956836761518125, 0.18044111510343638, 0.179693332071772, 0.1797379397838358, 0.17999154985870341]
665.7s 108 Unable to load Cython Compute_Similarity, reverting to Python
679.6s 109 Similarity column 6969 (100.0%), 493.71 column/sec. Elapsed time 14.12 sec
679.8s 110 EvaluatorHoldout: Ignoring 33 ( 0.1%) Users that have less than 1 test interactions
707.0s 111 EvaluatorHoldout: Processed 27062 (100.0%) in 27.30 sec. Users per second: 991
707.5s 112 Unable to load Cython Compute_Similarity, reverting to Python
721.5s 113 Similarity column 6969 (100.0%), 492.32 column/sec. Elapsed time 14.16 sec
721.7s 114 EvaluatorHoldout: Ignoring 28 ( 0.1%) Users that have less than 1 test interactions
748.8s 115 EvaluatorHoldout: Processed 27067 (100.0%) in 27.16 sec. Users per second: 997
749.3s 116 Unable to load Cython Compute_Similarity, reverting to Python
763.3s 117 Similarity column 6969 (100.0%), 490.12 column/sec. Elapsed time 14.22 sec
763.5s 118 EvaluatorHoldout: Ignoring 40 ( 0.1%) Users that have less than 1 test interactions
790.7s 119 EvaluatorHoldout: Processed 27055 (100.0%) in 27.21 sec. Users per second: 994
791.1s 120 Unable to load Cython Compute_Similarity, reverting to Python
805.0s 121 Similarity column 6969 (100.0%), 494.99 column/sec. Elapsed time 14.08 sec
805.2s 122 EvaluatorHoldout: Ignoring 21 ( 0.1%) Users that have less than 1 test interactions
832.8s 123 EvaluatorHoldout: Processed 27074 (100.0%) in 27.69 sec. Users per second: 978
833.3s 124 Unable to load Cython Compute_Similarity, reverting to Python
847.2s 125 Similarity column 6969 (100.0%), 494.35 column/sec. Elapsed time 14.10 sec
847.4s 126 EvaluatorHoldout: Ignoring 29 ( 0.1%) Users that have less than 1 test interactions
874.7s 127 EvaluatorHoldout: Processed 27066 (100.0%) in 27.28 sec. Users per second: 992
874.7s 128 [I 2025-12-07 09:08:30,166] Trial 3 finished with value: 0.18656969375847116 and parameters: {'similarity': 'dice', 'topK': 665, 'shrink': 606}. Best is trial 1 with value: 0.21611002685585196.
874.7s 129 
874.7s 130 [I 2025-12-07 09:08:30,166] Trial 3 finished with value: 0.18656969375847116 and parameters: {'similarity': 'dice', 'topK': 665, 'shrink': 606}. Best is trial 1 with value: 0.21611002685585196.
874.8s 131 [0.18583515921432744, 0.18696024565288666, 0.18656890844965537, 0.18634448323325517, 0.18713967224223121]
875.1s 132 Unable to load Cython Compute_Similarity, reverting to Python
889.3s 133 Similarity column 6969 (100.0%), 485.43 column/sec. Elapsed time 14.36 sec
889.5s 134 EvaluatorHoldout: Ignoring 33 ( 0.1%) Users that have less than 1 test interactions
918.4s 135 EvaluatorHoldout: Processed 27062 (100.0%) in 28.90 sec. Users per second: 936
918.8s 136 Unable to load Cython Compute_Similarity, reverting to Python
933.5s 137 Similarity column 6969 (100.0%), 469.46 column/sec. Elapsed time 14.84 sec
933.7s 138 EvaluatorHoldout: Ignoring 28 ( 0.1%) Users that have less than 1 test interactions
962.8s 139 EvaluatorHoldout: Processed 27067 (100.0%) in 29.15 sec. Users per second: 929
963.3s 140 Unable to load Cython Compute_Similarity, reverting to Python
977.9s 141 Similarity column 6969 (100.0%), 470.24 column/sec. Elapsed time 14.82 sec
978.1s 142 EvaluatorHoldout: Ignoring 40 ( 0.1%) Users that have less than 1 test interactions
1006.9s 143 EvaluatorHoldout: Processed 27055 (100.0%) in 28.85 sec. Users per second: 938
1007.4s 144 Unable to load Cython Compute_Similarity, reverting to Python
1021.9s 145 Similarity column 6969 (100.0%), 472.46 column/sec. Elapsed time 14.75 sec
1022.1s 146 EvaluatorHoldout: Ignoring 21 ( 0.1%) Users that have less than 1 test interactions
1051.4s 147 EvaluatorHoldout: Processed 27074 (100.0%) in 29.30 sec. Users per second: 924
1051.9s 148 Unable to load Cython Compute_Similarity, reverting to Python
1066.3s 149 Similarity column 6969 (100.0%), 477.84 column/sec. Elapsed time 14.58 sec
1066.5s 150 EvaluatorHoldout: Ignoring 29 ( 0.1%) Users that have less than 1 test interactions
1095.1s 151 EvaluatorHoldout: Processed 27066 (100.0%) in 28.71 sec. Users per second: 943
1095.1s 152 [I 2025-12-07 09:12:10,645] Trial 4 finished with value: 0.1838113988223523 and parameters: {'similarity': 'jaccard', 'topK': 704, 'shrink': 866}. Best is trial 1 with value: 0.21611002685585196.
1095.1s 153 
1095.1s 154 [I 2025-12-07 09:12:10,645] Trial 4 finished with value: 0.1838113988223523 and parameters: {'similarity': 'jaccard', 'topK': 704, 'shrink': 866}. Best is trial 1 with value: 0.21611002685585196.
1095.3s 155 [0.1833179218822063, 0.18426745507221012, 0.18358664419885648, 0.18343032259099334, 0.18445465036749528]
1095.6s 156 Unable to load Cython Compute_Similarity, reverting to Python
1110.7s 157 Similarity column 6969 (100.0%), 455.53 column/sec. Elapsed time 15.30 sec
1110.9s 158 EvaluatorHoldout: Ignoring 33 ( 0.1%) Users that have less than 1 test interactions
1137.9s 159 EvaluatorHoldout: Processed 27062 (100.0%) in 26.97 sec. Users per second: 1003
1138.4s 160 Unable to load Cython Compute_Similarity, reverting to Python
1153.4s 161 Similarity column 6969 (100.0%), 457.11 column/sec. Elapsed time 15.25 sec
1153.6s 162 EvaluatorHoldout: Ignoring 28 ( 0.1%) Users that have less than 1 test interactions
1180.9s 163 EvaluatorHoldout: Processed 27067 (100.0%) in 27.29 sec. Users per second: 992
1181.4s 164 Unable to load Cython Compute_Similarity, reverting to Python
1196.3s 165 Similarity column 6969 (100.0%), 460.91 column/sec. Elapsed time 15.12 sec
1196.5s 166 EvaluatorHoldout: Ignoring 40 ( 0.1%) Users that have less than 1 test interactions
1223.4s 167 EvaluatorHoldout: Processed 27055 (100.0%) in 26.89 sec. Users per second: 1006
1223.8s 168 Unable to load Cython Compute_Similarity, reverting to Python
1238.7s 169 Similarity column 6969 (100.0%), 462.49 column/sec. Elapsed time 15.07 sec
1238.9s 170 EvaluatorHoldout: Ignoring 21 ( 0.1%) Users that have less than 1 test interactions
1265.4s 171 EvaluatorHoldout: Processed 27074 (100.0%) in 26.55 sec. Users per second: 1020
1265.9s 172 Unable to load Cython Compute_Similarity, reverting to Python
1280.8s 173 Similarity column 6969 (100.0%), 462.71 column/sec. Elapsed time 15.06 sec
1281.0s 174 EvaluatorHoldout: Ignoring 29 ( 0.1%) Users that have less than 1 test interactions
1308.0s 175 EvaluatorHoldout: Processed 27066 (100.0%) in 27.06 sec. Users per second: 1000
1308.0s 176 [I 2025-12-07 09:15:43,517] Trial 5 finished with value: 0.18852679521815757 and parameters: {'similarity': 'jaccard', 'topK': 812, 'shrink': 310}. Best is trial 1 with value: 0.21611002685585196.
1308.0s 177 
1308.0s 178 [I 2025-12-07 09:15:43,517] Trial 5 finished with value: 0.18852679521815757 and parameters: {'similarity': 'jaccard', 'topK': 812, 'shrink': 310}. Best is trial 1 with value: 0.21611002685585196.
1308.2s 179 [0.1881853829328968, 0.18877400898435961, 0.18890279843531005, 0.18805933802997887, 0.1887124477082425]
1308.5s 180 Unable to load Cython Compute_Similarity, reverting to Python
1324.6s 181 Similarity column 6969 (100.0%), 428.11 column/sec. Elapsed time 16.28 sec
1324.8s 182 EvaluatorHoldout: Ignoring 33 ( 0.1%) Users that have less than 1 test interactions
1364.1s 183 EvaluatorHoldout: Processed 27062 (100.0%) in 39.31 sec. Users per second: 688
1364.5s 184 Unable to load Cython Compute_Similarity, reverting to Python
1380.4s 185 Similarity column 6969 (100.0%), 433.65 column/sec. Elapsed time 16.07 sec
1380.6s 186 EvaluatorHoldout: Ignoring 28 ( 0.1%) Users that have less than 1 test interactions
1420.5s 187 EvaluatorHoldout: Processed 27067 (100.0%) in 39.90 sec. Users per second: 678
1421.0s 188 Unable to load Cython Compute_Similarity, reverting to Python
1437.2s 189 Similarity column 6969 (100.0%), 423.95 column/sec. Elapsed time 16.44 sec
1437.4s 190 EvaluatorHoldout: Ignoring 40 ( 0.1%) Users that have less than 1 test interactions
1477.1s 191 EvaluatorHoldout: Processed 27055 (100.0%) in 39.69 sec. Users per second: 682
1477.6s 192 Unable to load Cython Compute_Similarity, reverting to Python
1493.8s 193 Similarity column 6969 (100.0%), 424.45 column/sec. Elapsed time 16.42 sec
1494.0s 194 EvaluatorHoldout: Ignoring 21 ( 0.1%) Users that have less than 1 test interactions
1533.5s 195 EvaluatorHoldout: Processed 27074 (100.0%) in 39.52 sec. Users per second: 685
1534.0s 196 Unable to load Cython Compute_Similarity, reverting to Python
1550.3s 197 Similarity column 6969 (100.0%), 424.00 column/sec. Elapsed time 16.44 sec
1550.5s 198 EvaluatorHoldout: Ignoring 29 ( 0.1%) Users that have less than 1 test interactions
1589.7s 199 EvaluatorHoldout: Processed 27066 (100.0%) in 39.21 sec. Users per second: 690
1589.7s 200 [I 2025-12-07 09:20:25,185] Trial 6 finished with value: 0.013747636343172113 and parameters: {'similarity': 'asymmetric', 'topK': 981, 'shrink': 354, 'asymmetric_alpha': 1.6988486364824271}. Best is trial 1 with value: 0.21611002685585196.
1589.7s 201 
1589.7s 202 [I 2025-12-07 09:20:25,185] Trial 6 finished with value: 0.013747636343172113 and parameters: {'similarity': 'asymmetric', 'topK': 981, 'shrink': 354, 'asymmetric_alpha': 1.6988486364824271}. Best is trial 1 with value: 0.21611002685585196.
1589.9s 203 [0.014045056935373057, 0.014068473592163176, 0.013435256086911214, 0.01355286182634738, 0.013636533275065735]
1590.2s 204 Unable to load Cython Compute_Similarity, reverting to Python
1600.1s 205 Similarity column 6969 (100.0%), 683.92 column/sec. Elapsed time 10.19 sec
1600.3s 206 EvaluatorHoldout: Ignoring 33 ( 0.1%) Users that have less than 1 test interactions
1618.3s 207 EvaluatorHoldout: Processed 27062 (100.0%) in 18.14 sec. Users per second: 1492
1618.8s 208 Unable to load Cython Compute_Similarity, reverting to Python
1628.9s 209 Similarity column 6969 (100.0%), 678.36 column/sec. Elapsed time 10.27 sec
1629.1s 210 EvaluatorHoldout: Ignoring 28 ( 0.1%) Users that have less than 1 test interactions
1647.4s 211 EvaluatorHoldout: Processed 27067 (100.0%) in 18.47 sec. Users per second: 1465
1647.9s 212 Unable to load Cython Compute_Similarity, reverting to Python
1658.6s 213 Similarity column 6969 (100.0%), 640.62 column/sec. Elapsed time 10.88 sec
1658.8s 214 EvaluatorHoldout: Ignoring 40 ( 0.1%) Users that have less than 1 test interactions
1676.5s 215 EvaluatorHoldout: Processed 27055 (100.0%) in 17.83 sec. Users per second: 1517
1677.0s 216 Unable to load Cython Compute_Similarity, reverting to Python
1687.2s 217 Similarity column 6969 (100.0%), 671.06 column/sec. Elapsed time 10.39 sec
1687.4s 218 EvaluatorHoldout: Ignoring 21 ( 0.1%) Users that have less than 1 test interactions
1705.9s 219 EvaluatorHoldout: Processed 27074 (100.0%) in 18.69 sec. Users per second: 1449
1706.4s 220 Unable to load Cython Compute_Similarity, reverting to Python
1716.6s 221 Similarity column 6969 (100.0%), 669.97 column/sec. Elapsed time 10.40 sec
1716.8s 222 EvaluatorHoldout: Ignoring 29 ( 0.1%) Users that have less than 1 test interactions
1734.9s 223 EvaluatorHoldout: Processed 27066 (100.0%) in 18.28 sec. Users per second: 1480
1734.9s 224 [I 2025-12-07 09:22:50,454] Trial 7 finished with value: 0.20255680964827957 and parameters: {'similarity': 'jaccard', 'topK': 195, 'shrink': 71}. Best is trial 1 with value: 0.21611002685585196.
1734.9s 225 
1734.9s 226 [I 2025-12-07 09:22:50,454] Trial 7 finished with value: 0.20255680964827957 and parameters: {'similarity': 'jaccard', 'topK': 195, 'shrink': 71}. Best is trial 1 with value: 0.21611002685585196.
1735.1s 227 [0.20196002221978382, 0.20282294806981596, 0.20279011636953462, 0.20166163346912278, 0.20354932811314075]
1735.4s 228 Unable to load Cython Compute_Similarity, reverting to Python
1750.2s 229 Similarity column 6969 (100.0%), 465.40 column/sec. Elapsed time 14.97 sec
1750.4s 230 EvaluatorHoldout: Ignoring 33 ( 0.1%) Users that have less than 1 test interactions
1774.4s 231 EvaluatorHoldout: Processed 27062 (100.0%) in 24.02 sec. Users per second: 1127
1774.9s 232 Unable to load Cython Compute_Similarity, reverting to Python
1789.9s 233 Similarity column 6969 (100.0%), 458.02 column/sec. Elapsed time 15.22 sec
1790.1s 234 EvaluatorHoldout: Ignoring 28 ( 0.1%) Users that have less than 1 test interactions
1814.7s 235 EvaluatorHoldout: Processed 27067 (100.0%) in 24.65 sec. Users per second: 1098
1815.2s 236 Unable to load Cython Compute_Similarity, reverting to Python
1830.0s 237 Similarity column 6969 (100.0%), 465.24 column/sec. Elapsed time 14.98 sec
1830.2s 238 EvaluatorHoldout: Ignoring 40 ( 0.1%) Users that have less than 1 test interactions
1854.4s 239 EvaluatorHoldout: Processed 27055 (100.0%) in 24.30 sec. Users per second: 1113
1854.9s 240 Unable to load Cython Compute_Similarity, reverting to Python
1869.9s 241 Similarity column 6969 (100.0%), 460.82 column/sec. Elapsed time 15.12 sec
1870.0s 242 EvaluatorHoldout: Ignoring 21 ( 0.1%) Users that have less than 1 test interactions
1894.2s 243 EvaluatorHoldout: Processed 27074 (100.0%) in 24.25 sec. Users per second: 1117
1894.7s 244 Unable to load Cython Compute_Similarity, reverting to Python
1909.3s 245 Similarity column 6969 (100.0%), 471.84 column/sec. Elapsed time 14.77 sec
1909.5s 246 EvaluatorHoldout: Ignoring 29 ( 0.1%) Users that have less than 1 test interactions
1933.8s 247 EvaluatorHoldout: Processed 27066 (100.0%) in 24.33 sec. Users per second: 1112
1933.8s 248 [I 2025-12-07 09:26:09,310] Trial 8 finished with value: 0.1906104091624039 and parameters: {'similarity': 'dice', 'topK': 745, 'shrink': 75}. Best is trial 1 with value: 0.21611002685585196.
1933.8s 249 
1933.8s 250 [I 2025-12-07 09:26:09,310] Trial 8 finished with value: 0.1906104091624039 and parameters: {'similarity': 'dice', 'topK': 745, 'shrink': 75}. Best is trial 1 with value: 0.21611002685585196.
1934.0s 251 [0.1899129275396925, 0.19146921720457186, 0.19077198956164435, 0.19001708372534484, 0.190880827780766]
1934.3s 252 Unable to load Cython Compute_Similarity, reverting to Python
1944.4s 253 Similarity column 6969 (100.0%), 674.79 column/sec. Elapsed time 10.33 sec
1944.6s 254 EvaluatorHoldout: Ignoring 33 ( 0.1%) Users that have less than 1 test interactions
1970.5s 255 EvaluatorHoldout: Processed 27062 (100.0%) in 26.04 sec. Users per second: 1039
1971.0s 256 Unable to load Cython Compute_Similarity, reverting to Python
1981.3s 257 Similarity column 6969 (100.0%), 667.19 column/sec. Elapsed time 10.45 sec
1981.4s 258 EvaluatorHoldout: Ignoring 28 ( 0.1%) Users that have less than 1 test interactions
2007.5s 259 EvaluatorHoldout: Processed 27067 (100.0%) in 26.20 sec. Users per second: 1033
2008.0s 260 Unable to load Cython Compute_Similarity, reverting to Python
2018.2s 261 Similarity column 6969 (100.0%), 673.64 column/sec. Elapsed time 10.35 sec
2018.3s 262 EvaluatorHoldout: Ignoring 40 ( 0.1%) Users that have less than 1 test interactions
2044.4s 263 EvaluatorHoldout: Processed 27055 (100.0%) in 26.19 sec. Users per second: 1033
2044.9s 264 Unable to load Cython Compute_Similarity, reverting to Python
2055.6s 265 Similarity column 6969 (100.0%), 638.14 column/sec. Elapsed time 10.92 sec
2055.8s 266 EvaluatorHoldout: Ignoring 21 ( 0.1%) Users that have less than 1 test interactions
2082.0s 267 EvaluatorHoldout: Processed 27074 (100.0%) in 26.34 sec. Users per second: 1028
2082.5s 268 Unable to load Cython Compute_Similarity, reverting to Python
2093.2s 269 Similarity column 6969 (100.0%), 639.58 column/sec. Elapsed time 10.90 sec
2093.4s 270 EvaluatorHoldout: Ignoring 29 ( 0.1%) Users that have less than 1 test interactions
2119.6s 271 EvaluatorHoldout: Processed 27066 (100.0%) in 26.38 sec. Users per second: 1026
2119.6s 272 [I 2025-12-07 09:29:15,142] Trial 9 finished with value: 0.020448843089908523 and parameters: {'similarity': 'asymmetric', 'topK': 175, 'shrink': 398, 'asymmetric_alpha': 1.3834092583593474}. Best is trial 1 with value: 0.21611002685585196.
2119.6s 273 
