13399.8s 2170 [I 2025-12-07 12:37:15,290] Trial 88 finished with value: 0.20984795329252895 and parameters: {'similarity': 'tversky', 'topK': 99, 'shrink': 211, 'tversky_alpha': 0.18358356092683514, 'tversky_beta': 1.4025078775207962}. Best is trial 80 with value: 0.24810978805811468.
13400.0s 2171 [0.20975195362272597, 0.2095379653194944, 0.20996590539102866, 0.20957185964901018, 0.21041208248038548]
13400.3s 2172 Unable to load Cython Compute_Similarity, reverting to Python
13410.3s 2173 Similarity column 6969 (100.0%), 678.60 column/sec. Elapsed time 10.27 sec
13410.5s 2174 EvaluatorHoldout: Ignoring 33 ( 0.1%) Users that have less than 1 test interactions
13428.2s 2175 EvaluatorHoldout: Processed 27062 (100.0%) in 17.73 sec. Users per second: 1526
13428.6s 2176 Unable to load Cython Compute_Similarity, reverting to Python
13438.7s 2177 Similarity column 6969 (100.0%), 681.16 column/sec. Elapsed time 10.23 sec
13438.9s 2178 EvaluatorHoldout: Ignoring 28 ( 0.1%) Users that have less than 1 test interactions
13456.6s 2179 EvaluatorHoldout: Processed 27067 (100.0%) in 17.85 sec. Users per second: 1516
13457.1s 2180 Unable to load Cython Compute_Similarity, reverting to Python
13467.6s 2181 Similarity column 6969 (100.0%), 656.59 column/sec. Elapsed time 10.61 sec
13467.7s 2182 EvaluatorHoldout: Ignoring 40 ( 0.1%) Users that have less than 1 test interactions
13485.2s 2183 EvaluatorHoldout: Processed 27055 (100.0%) in 17.69 sec. Users per second: 1529
13485.7s 2184 Unable to load Cython Compute_Similarity, reverting to Python
13495.9s 2185 Similarity column 6969 (100.0%), 668.51 column/sec. Elapsed time 10.42 sec
13496.1s 2186 EvaluatorHoldout: Ignoring 21 ( 0.1%) Users that have less than 1 test interactions
13513.8s 2187 EvaluatorHoldout: Processed 27074 (100.0%) in 17.74 sec. Users per second: 1526
13514.2s 2188 Unable to load Cython Compute_Similarity, reverting to Python
13524.1s 2189 Similarity column 6969 (100.0%), 692.00 column/sec. Elapsed time 10.07 sec
13524.3s 2190 EvaluatorHoldout: Ignoring 29 ( 0.1%) Users that have less than 1 test interactions
13541.9s 2191 EvaluatorHoldout: Processed 27066 (100.0%) in 17.79 sec. Users per second: 1522
13541.9s 2192 [I 2025-12-07 12:39:37,427] Trial 89 finished with value: 0.19546222229973087 and parameters: {'similarity': 'tversky', 'topK': 157, 'shrink': 340, 'tversky_alpha': 0.5676971588864954, 'tversky_beta': 1.6646993500647955}. Best is trial 80 with value: 0.24810978805811468.
13541.9s 2193 
13541.9s 2194 [I 2025-12-07 12:39:37,427] Trial 89 finished with value: 0.19546222229973087 and parameters: {'similarity': 'tversky', 'topK': 157, 'shrink': 340, 'tversky_alpha': 0.5676971588864954, 'tversky_beta': 1.6646993500647955}. Best is trial 80 with value: 0.24810978805811468.
13542.1s 2195 [0.19532908748518737, 0.19547948139175564, 0.19571439939107788, 0.19460311301137087, 0.1961850302192626]
13542.4s 2196 Unable to load Cython Compute_Similarity, reverting to Python
13551.7s 2197 Similarity column 6969 (100.0%), 744.08 column/sec. Elapsed time 9.37 sec
13551.8s 2198 EvaluatorHoldout: Ignoring 33 ( 0.1%) Users that have less than 1 test interactions
13567.4s 2199 EvaluatorHoldout: Processed 27062 (100.0%) in 15.82 sec. Users per second: 1711
13567.9s 2200 Unable to load Cython Compute_Similarity, reverting to Python
13577.5s 2201 Similarity column 6969 (100.0%), 715.99 column/sec. Elapsed time 9.73 sec
13577.7s 2202 EvaluatorHoldout: Ignoring 28 ( 0.1%) Users that have less than 1 test interactions
13593.5s 2203 EvaluatorHoldout: Processed 27067 (100.0%) in 15.89 sec. Users per second: 1703
13593.9s 2204 Unable to load Cython Compute_Similarity, reverting to Python
13603.4s 2205 Similarity column 6969 (100.0%), 713.81 column/sec. Elapsed time 9.76 sec
13603.6s 2206 EvaluatorHoldout: Ignoring 40 ( 0.1%) Users that have less than 1 test interactions
13619.3s 2207 EvaluatorHoldout: Processed 27055 (100.0%) in 15.88 sec. Users per second: 1704
13619.8s 2208 Unable to load Cython Compute_Similarity, reverting to Python
13629.2s 2209 Similarity column 6969 (100.0%), 736.29 column/sec. Elapsed time 9.46 sec
13629.3s 2210 EvaluatorHoldout: Ignoring 21 ( 0.1%) Users that have less than 1 test interactions
13644.9s 2211 EvaluatorHoldout: Processed 27074 (100.0%) in 15.81 sec. Users per second: 1713
13645.4s 2212 Unable to load Cython Compute_Similarity, reverting to Python
13654.5s 2213 Similarity column 6969 (100.0%), 752.42 column/sec. Elapsed time 9.26 sec
13654.7s 2214 EvaluatorHoldout: Ignoring 29 ( 0.1%) Users that have less than 1 test interactions
13670.4s 2215 EvaluatorHoldout: Processed 27066 (100.0%) in 15.79 sec. Users per second: 1714
13670.4s 2216 [I 2025-12-07 12:41:45,836] Trial 90 finished with value: 0.21065628601266123 and parameters: {'similarity': 'tversky', 'topK': 49, 'shrink': 375, 'tversky_alpha': 0.3505662461976385, 'tversky_beta': 1.1739618196622614}. Best is trial 80 with value: 0.24810978805811468.
13670.4s 2217 
13670.4s 2218 [I 2025-12-07 12:41:45,836] Trial 90 finished with value: 0.21065628601266123 and parameters: {'similarity': 'tversky', 'topK': 49, 'shrink': 375, 'tversky_alpha': 0.3505662461976385, 'tversky_beta': 1.1739618196622614}. Best is trial 80 with value: 0.24810978805811468.
13670.5s 2219 [0.21079675079732257, 0.21103281331091817, 0.2113672458969631, 0.20949627590860653, 0.21058834414949582]
13670.8s 2220 Unable to load Cython Compute_Similarity, reverting to Python
13679.7s 2221 Similarity column 6969 (100.0%), 770.81 column/sec. Elapsed time 9.04 sec
13679.9s 2222 EvaluatorHoldout: Ignoring 33 ( 0.1%) Users that have less than 1 test interactions
13693.5s 2223 EvaluatorHoldout: Processed 27062 (100.0%) in 13.79 sec. Users per second: 1962
13694.0s 2224 Unable to load Cython Compute_Similarity, reverting to Python
13702.9s 2225 Similarity column 6969 (100.0%), 772.66 column/sec. Elapsed time 9.02 sec
13703.0s 2226 EvaluatorHoldout: Ignoring 28 ( 0.1%) Users that have less than 1 test interactions
13716.6s 2227 EvaluatorHoldout: Processed 27067 (100.0%) in 13.75 sec. Users per second: 1968
13717.1s 2228 Unable to load Cython Compute_Similarity, reverting to Python
13726.2s 2229 Similarity column 6969 (100.0%), 745.46 column/sec. Elapsed time 9.35 sec
13726.4s 2230 EvaluatorHoldout: Ignoring 40 ( 0.1%) Users that have less than 1 test interactions
13740.1s 2231 EvaluatorHoldout: Processed 27055 (100.0%) in 13.73 sec. Users per second: 1971
13740.4s 2232 Unable to load Cython Compute_Similarity, reverting to Python
13749.4s 2233 Similarity column 6969 (100.0%), 757.28 column/sec. Elapsed time 9.20 sec
13749.6s 2234 EvaluatorHoldout: Ignoring 21 ( 0.1%) Users that have less than 1 test interactions
13763.3s 2235 EvaluatorHoldout: Processed 27074 (100.0%) in 13.81 sec. Users per second: 1961
13763.8s 2236 Unable to load Cython Compute_Similarity, reverting to Python
13772.7s 2237 Similarity column 6969 (100.0%), 775.64 column/sec. Elapsed time 8.98 sec
13772.8s 2238 EvaluatorHoldout: Ignoring 29 ( 0.1%) Users that have less than 1 test interactions
13786.4s 2239 EvaluatorHoldout: Processed 27066 (100.0%) in 13.86 sec. Users per second: 1953
13786.5s 2240 [I 2025-12-07 12:43:41,972] Trial 91 finished with value: 0.24993110179607925 and parameters: {'similarity': 'tversky', 'topK': 6, 'shrink': 293, 'tversky_alpha': 0.17798826409709376, 'tversky_beta': 1.5918794762562551}. Best is trial 91 with value: 0.24993110179607925.
13786.5s 2241 
13786.5s 2242 [I 2025-12-07 12:43:41,972] Trial 91 finished with value: 0.24993110179607925 and parameters: {'similarity': 'tversky', 'topK': 6, 'shrink': 293, 'tversky_alpha': 0.17798826409709376, 'tversky_beta': 1.5918794762562551}. Best is trial 91 with value: 0.24993110179607925.
13786.7s 2243 [0.24952618259294151, 0.25016220051639315, 0.2506325172129118, 0.24945037085481425, 0.24988423780333552]
13787.0s 2244 Unable to load Cython Compute_Similarity, reverting to Python
13795.8s 2245 Similarity column 6969 (100.0%), 766.99 column/sec. Elapsed time 9.09 sec
13796.0s 2246 EvaluatorHoldout: Ignoring 33 ( 0.1%) Users that have less than 1 test interactions
13809.7s 2247 EvaluatorHoldout: Processed 27062 (100.0%) in 13.71 sec. Users per second: 1974
13810.1s 2248 Unable to load Cython Compute_Similarity, reverting to Python
13819.1s 2249 Similarity column 6969 (100.0%), 758.05 column/sec. Elapsed time 9.19 sec
13819.3s 2250 EvaluatorHoldout: Ignoring 28 ( 0.1%) Users that have less than 1 test interactions
13832.8s 2251 EvaluatorHoldout: Processed 27067 (100.0%) in 13.74 sec. Users per second: 1970
13833.3s 2252 Unable to load Cython Compute_Similarity, reverting to Python
13842.4s 2253 Similarity column 6969 (100.0%), 758.71 column/sec. Elapsed time 9.19 sec
13842.5s 2254 EvaluatorHoldout: Ignoring 40 ( 0.1%) Users that have less than 1 test interactions
13856.1s 2255 EvaluatorHoldout: Processed 27055 (100.0%) in 13.80 sec. Users per second: 1961
13856.6s 2256 Unable to load Cython Compute_Similarity, reverting to Python
13865.6s 2257 Similarity column 6969 (100.0%), 758.02 column/sec. Elapsed time 9.19 sec
13865.8s 2258 EvaluatorHoldout: Ignoring 21 ( 0.1%) Users that have less than 1 test interactions
13879.6s 2259 EvaluatorHoldout: Processed 27074 (100.0%) in 13.86 sec. Users per second: 1954
13880.0s 2260 Unable to load Cython Compute_Similarity, reverting to Python
13888.9s 2261 Similarity column 6969 (100.0%), 763.68 column/sec. Elapsed time 9.13 sec
13889.1s 2262 EvaluatorHoldout: Ignoring 29 ( 0.1%) Users that have less than 1 test interactions
13902.8s 2263 EvaluatorHoldout: Processed 27066 (100.0%) in 13.87 sec. Users per second: 1951
13902.8s 2264 [I 2025-12-07 12:45:38,344] Trial 92 finished with value: 0.24897922964998456 and parameters: {'similarity': 'tversky', 'topK': 6, 'shrink': 286, 'tversky_alpha': 0.15488523578857538, 'tversky_beta': 1.3856256905342619}. Best is trial 91 with value: 0.24993110179607925.
13902.8s 2265 
13902.8s 2266 [I 2025-12-07 12:45:38,344] Trial 92 finished with value: 0.24897922964998456 and parameters: {'similarity': 'tversky', 'topK': 6, 'shrink': 286, 'tversky_alpha': 0.15488523578857538, 'tversky_beta': 1.3856256905342619}. Best is trial 91 with value: 0.24993110179607925.
13903.0s 2267 [0.24869036075103362, 0.2491386671501603, 0.24966806368501301, 0.24844993287120773, 0.2489491237925082]
13903.3s 2268 Unable to load Cython Compute_Similarity, reverting to Python
13912.6s 2269 Similarity column 6969 (100.0%), 746.48 column/sec. Elapsed time 9.34 sec
13912.7s 2270 EvaluatorHoldout: Ignoring 33 ( 0.1%) Users that have less than 1 test interactions
13927.1s 2271 EvaluatorHoldout: Processed 27062 (100.0%) in 14.64 sec. Users per second: 1849
13927.6s 2272 Unable to load Cython Compute_Similarity, reverting to Python
13936.6s 2273 Similarity column 6969 (100.0%), 758.26 column/sec. Elapsed time 9.19 sec
13936.8s 2274 EvaluatorHoldout: Ignoring 28 ( 0.1%) Users that have less than 1 test interactions
13951.5s 2275 EvaluatorHoldout: Processed 27067 (100.0%) in 14.72 sec. Users per second: 1839
13951.9s 2276 Unable to load Cython Compute_Similarity, reverting to Python
13960.9s 2277 Similarity column 6969 (100.0%), 752.61 column/sec. Elapsed time 9.26 sec
13961.1s 2278 EvaluatorHoldout: Ignoring 40 ( 0.1%) Users that have less than 1 test interactions
13975.5s 2279 EvaluatorHoldout: Processed 27055 (100.0%) in 14.54 sec. Users per second: 1861
13976.0s 2280 Unable to load Cython Compute_Similarity, reverting to Python
13984.9s 2281 Similarity column 6969 (100.0%), 769.43 column/sec. Elapsed time 9.06 sec
13985.0s 2282 EvaluatorHoldout: Ignoring 21 ( 0.1%) Users that have less than 1 test interactions
13999.5s 2283 EvaluatorHoldout: Processed 27074 (100.0%) in 14.60 sec. Users per second: 1854
13999.9s 2284 Unable to load Cython Compute_Similarity, reverting to Python
14008.9s 2285 Similarity column 6969 (100.0%), 763.29 column/sec. Elapsed time 9.13 sec
14009.1s 2286 EvaluatorHoldout: Ignoring 29 ( 0.1%) Users that have less than 1 test interactions
14023.7s 2287 EvaluatorHoldout: Processed 27066 (100.0%) in 14.68 sec. Users per second: 1843
14023.7s 2288 [I 2025-12-07 12:47:39,110] Trial 93 finished with value: 0.23596713203694436 and parameters: {'similarity': 'tversky', 'topK': 27, 'shrink': 304, 'tversky_alpha': 0.15630091682590314, 'tversky_beta': 1.5620589439348505}. Best is trial 91 with value: 0.24993110179607925.
14023.7s 2289 
14023.7s 2290 [I 2025-12-07 12:47:39,110] Trial 93 finished with value: 0.23596713203694436 and parameters: {'similarity': 'tversky', 'topK': 27, 'shrink': 304, 'tversky_alpha': 0.15630091682590314, 'tversky_beta': 1.5620589439348505}. Best is trial 91 with value: 0.24993110179607925.
14023.8s 2291 [0.23548556815399874, 0.23625139333592912, 0.2375727548111002, 0.2344825365299346, 0.23604340735375923]
14024.1s 2292 Unable to load Cython Compute_Similarity, reverting to Python
14033.1s 2293 Similarity column 6969 (100.0%), 754.24 column/sec. Elapsed time 9.24 sec
14033.3s 2294 EvaluatorHoldout: Ignoring 33 ( 0.1%) Users that have less than 1 test interactions
14048.4s 2295 EvaluatorHoldout: Processed 27062 (100.0%) in 15.27 sec. Users per second: 1772
14048.9s 2296 Unable to load Cython Compute_Similarity, reverting to Python
14058.2s 2297 Similarity column 6969 (100.0%), 747.58 column/sec. Elapsed time 9.32 sec
14058.3s 2298 EvaluatorHoldout: Ignoring 28 ( 0.1%) Users that have less than 1 test interactions
14073.5s 2299 EvaluatorHoldout: Processed 27067 (100.0%) in 15.37 sec. Users per second: 1761
14073.9s 2300 Unable to load Cython Compute_Similarity, reverting to Python
14082.9s 2301 Similarity column 6969 (100.0%), 758.80 column/sec. Elapsed time 9.18 sec
14083.1s 2302 EvaluatorHoldout: Ignoring 40 ( 0.1%) Users that have less than 1 test interactions
14098.4s 2303 EvaluatorHoldout: Processed 27055 (100.0%) in 15.33 sec. Users per second: 1765
14098.8s 2304 Unable to load Cython Compute_Similarity, reverting to Python
14108.3s 2305 Similarity column 6969 (100.0%), 715.01 column/sec. Elapsed time 9.75 sec
14108.5s 2306 EvaluatorHoldout: Ignoring 21 ( 0.1%) Users that have less than 1 test interactions
14123.7s 2307 EvaluatorHoldout: Processed 27074 (100.0%) in 15.36 sec. Users per second: 1763
14124.2s 2308 Unable to load Cython Compute_Similarity, reverting to Python
14133.7s 2309 Similarity column 6969 (100.0%), 724.92 column/sec. Elapsed time 9.61 sec
14133.8s 2310 EvaluatorHoldout: Ignoring 29 ( 0.1%) Users that have less than 1 test interactions
14149.0s 2311 EvaluatorHoldout: Processed 27066 (100.0%) in 15.35 sec. Users per second: 1764
14149.0s 2312 [I 2025-12-07 12:49:44,527] Trial 94 finished with value: 0.22428212600204178 and parameters: {'similarity': 'tversky', 'topK': 57, 'shrink': 266, 'tversky_alpha': 0.1306899314361023, 'tversky_beta': 1.444852478525828}. Best is trial 91 with value: 0.24993110179607925.
14149.0s 2313 
14149.0s 2314 [I 2025-12-07 12:49:44,527] Trial 94 finished with value: 0.22428212600204178 and parameters: {'similarity': 'tversky', 'topK': 57, 'shrink': 266, 'tversky_alpha': 0.1306899314361023, 'tversky_beta': 1.444852478525828}. Best is trial 91 with value: 0.24993110179607925.
14149.2s 2315 [0.22369498925136067, 0.22450747229027398, 0.2247883751942354, 0.22355828243432802, 0.22486151084001083]
14149.5s 2316 Unable to load Cython Compute_Similarity, reverting to Python
14158.7s 2317 Similarity column 6969 (100.0%), 744.55 column/sec. Elapsed time 9.36 sec
14158.9s 2318 EvaluatorHoldout: Ignoring 33 ( 0.1%) Users that have less than 1 test interactions
14174.1s 2319 EvaluatorHoldout: Processed 27062 (100.0%) in 15.31 sec. Users per second: 1768
14174.5s 2320 Unable to load Cython Compute_Similarity, reverting to Python
14184.0s 2321 Similarity column 6969 (100.0%), 723.21 column/sec. Elapsed time 9.64 sec
14184.2s 2322 EvaluatorHoldout: Ignoring 28 ( 0.1%) Users that have less than 1 test interactions
14199.2s 2323 EvaluatorHoldout: Processed 27067 (100.0%) in 15.23 sec. Users per second: 1777
14199.7s 2324 Unable to load Cython Compute_Similarity, reverting to Python
14209.1s 2325 Similarity column 6969 (100.0%), 737.87 column/sec. Elapsed time 9.44 sec
14209.2s 2326 EvaluatorHoldout: Ignoring 40 ( 0.1%) Users that have less than 1 test interactions
14224.2s 2327 EvaluatorHoldout: Processed 27055 (100.0%) in 15.25 sec. Users per second: 1775
14224.7s 2328 Unable to load Cython Compute_Similarity, reverting to Python
14234.6s 2329 Similarity column 6969 (100.0%), 695.04 column/sec. Elapsed time 10.03 sec
14234.8s 2330 EvaluatorHoldout: Ignoring 21 ( 0.1%) Users that have less than 1 test interactions
14250.0s 2331 EvaluatorHoldout: Processed 27074 (100.0%) in 15.26 sec. Users per second: 1774
14250.3s 2332 Unable to load Cython Compute_Similarity, reverting to Python
14259.7s 2333 Similarity column 6969 (100.0%), 725.22 column/sec. Elapsed time 9.61 sec
14260.0s 2334 EvaluatorHoldout: Ignoring 29 ( 0.1%) Users that have less than 1 test interactions
14275.1s 2335 EvaluatorHoldout: Processed 27066 (100.0%) in 15.30 sec. Users per second: 1769
14275.1s 2336 [I 2025-12-07 12:51:50,611] Trial 95 finished with value: 0.224489193424024 and parameters: {'similarity': 'tversky', 'topK': 75, 'shrink': 132, 'tversky_alpha': 0.13504822118217696, 'tversky_beta': 1.6688504206837462}. Best is trial 91 with value: 0.24993110179607925.
14275.1s 2337 
14275.1s 2338 [I 2025-12-07 12:51:50,611] Trial 95 finished with value: 0.224489193424024 and parameters: {'similarity': 'tversky', 'topK': 75, 'shrink': 132, 'tversky_alpha': 0.13504822118217696, 'tversky_beta': 1.6688504206837462}. Best is trial 91 with value: 0.24993110179607925.
14275.3s 2339 [0.22464482291741578, 0.22441724962801174, 0.22484816121288959, 0.22310413709166416, 0.22543159627013856]
14275.6s 2340 Unable to load Cython Compute_Similarity, reverting to Python
14284.7s 2341 Similarity column 6969 (100.0%), 755.42 column/sec. Elapsed time 9.23 sec
14284.8s 2342 EvaluatorHoldout: Ignoring 33 ( 0.1%) Users that have less than 1 test interactions
14299.3s 2343 EvaluatorHoldout: Processed 27062 (100.0%) in 14.61 sec. Users per second: 1852
14299.7s 2344 Unable to load Cython Compute_Similarity, reverting to Python
14308.6s 2345 Similarity column 6969 (100.0%), 770.94 column/sec. Elapsed time 9.04 sec
14308.8s 2346 EvaluatorHoldout: Ignoring 28 ( 0.1%) Users that have less than 1 test interactions
14323.9s 2347 EvaluatorHoldout: Processed 27067 (100.0%) in 15.17 sec. Users per second: 1784
14324.3s 2348 Unable to load Cython Compute_Similarity, reverting to Python
14333.5s 2349 Similarity column 6969 (100.0%), 737.65 column/sec. Elapsed time 9.45 sec
14333.7s 2350 EvaluatorHoldout: Ignoring 40 ( 0.1%) Users that have less than 1 test interactions
14348.3s 2351 EvaluatorHoldout: Processed 27055 (100.0%) in 14.69 sec. Users per second: 1842
14348.7s 2352 Unable to load Cython Compute_Similarity, reverting to Python
14358.0s 2353 Similarity column 6969 (100.0%), 744.53 column/sec. Elapsed time 9.36 sec
14358.1s 2354 EvaluatorHoldout: Ignoring 21 ( 0.1%) Users that have less than 1 test interactions
14372.7s 2355 EvaluatorHoldout: Processed 27074 (100.0%) in 14.75 sec. Users per second: 1836
14373.2s 2356 Unable to load Cython Compute_Similarity, reverting to Python
14382.0s 2357 Similarity column 6969 (100.0%), 774.04 column/sec. Elapsed time 9.00 sec
14382.2s 2358 EvaluatorHoldout: Ignoring 29 ( 0.1%) Users that have less than 1 test interactions
14396.8s 2359 EvaluatorHoldout: Processed 27066 (100.0%) in 14.70 sec. Users per second: 1842
14396.8s 2360 [I 2025-12-07 12:53:52,212] Trial 96 finished with value: 0.225477489883699 and parameters: {'similarity': 'tversky', 'topK': 26, 'shrink': 203, 'tversky_alpha': 0.38480351396800594, 'tversky_beta': 1.3172378472136295}. Best is trial 91 with value: 0.24993110179607925.
14396.8s 2361 
