15673.6s 2002 [I 2025-12-07 01:39:04,423] Trial 81 finished with value: 0.2168955594911815 and parameters: {'topK': 59, 'shrink': 21, 'feature_weighting': 'TF-IDF'}. Best is trial 54 with value: 0.21706238132685302.
15673.7s 2003 [0.2171611913678149, 0.2166008917695384, 0.21615018137930678, 0.21785729868001727, 0.21670823425923005]
15674.0s 2004 Unable to load Cython Compute_Similarity, reverting to Python
15686.2s 2005 Similarity column 6969 (100.0%), 564.28 column/sec. Elapsed time 12.35 sec
15686.4s 2006 EvaluatorHoldout: Ignoring 48 ( 0.2%) Users that have less than 1 test interactions
15707.7s 2007 EvaluatorHoldout: Processed 27047 (100.0%) in 21.36 sec. Users per second: 1266
15708.1s 2008 Unable to load Cython Compute_Similarity, reverting to Python
15719.3s 2009 Similarity column 6969 (100.0%), 609.74 column/sec. Elapsed time 11.43 sec
15719.5s 2010 EvaluatorHoldout: Ignoring 29 ( 0.1%) Users that have less than 1 test interactions
15740.9s 2011 EvaluatorHoldout: Processed 27066 (100.0%) in 21.41 sec. Users per second: 1264
15741.3s 2012 Unable to load Cython Compute_Similarity, reverting to Python
15752.7s 2013 Similarity column 6969 (100.0%), 602.66 column/sec. Elapsed time 11.56 sec
15752.9s 2014 EvaluatorHoldout: Ignoring 42 ( 0.2%) Users that have less than 1 test interactions
15774.5s 2015 EvaluatorHoldout: Processed 27053 (100.0%) in 21.64 sec. Users per second: 1250
15774.9s 2016 Unable to load Cython Compute_Similarity, reverting to Python
15786.3s 2017 Similarity column 6969 (100.0%), 602.75 column/sec. Elapsed time 11.56 sec
15786.5s 2018 EvaluatorHoldout: Ignoring 38 ( 0.1%) Users that have less than 1 test interactions
15807.8s 2019 EvaluatorHoldout: Processed 27057 (100.0%) in 21.31 sec. Users per second: 1270
15808.2s 2020 Unable to load Cython Compute_Similarity, reverting to Python
15819.2s 2021 Similarity column 6969 (100.0%), 622.67 column/sec. Elapsed time 11.19 sec
15819.4s 2022 EvaluatorHoldout: Ignoring 32 ( 0.1%) Users that have less than 1 test interactions
15840.4s 2023 EvaluatorHoldout: Processed 27063 (100.0%) in 21.08 sec. Users per second: 1284
15840.4s 2024 [I 2025-12-07 01:41:51,274] Trial 82 finished with value: 0.21689474405831338 and parameters: {'topK': 87, 'shrink': 52, 'feature_weighting': 'TF-IDF'}. Best is trial 54 with value: 0.21706238132685302.
15840.4s 2025 
15840.4s 2026 [I 2025-12-07 01:41:51,274] Trial 82 finished with value: 0.21689474405831338 and parameters: {'topK': 87, 'shrink': 52, 'feature_weighting': 'TF-IDF'}. Best is trial 54 with value: 0.21706238132685302.
15840.5s 2027 [0.2173840470132167, 0.21723528292057084, 0.21665372965273846, 0.2174133938008834, 0.2157872669041574]
15840.8s 2028 Unable to load Cython Compute_Similarity, reverting to Python
15851.7s 2029 Similarity column 6969 (100.0%), 632.37 column/sec. Elapsed time 11.02 sec
15851.9s 2030 EvaluatorHoldout: Ignoring 48 ( 0.2%) Users that have less than 1 test interactions
15871.9s 2031 EvaluatorHoldout: Processed 27047 (100.0%) in 19.95 sec. Users per second: 1355
15872.2s 2032 Unable to load Cython Compute_Similarity, reverting to Python
15882.9s 2033 Similarity column 6969 (100.0%), 638.33 column/sec. Elapsed time 10.92 sec
15883.1s 2034 EvaluatorHoldout: Ignoring 29 ( 0.1%) Users that have less than 1 test interactions
15903.8s 2035 EvaluatorHoldout: Processed 27066 (100.0%) in 20.72 sec. Users per second: 1306
15904.2s 2036 Unable to load Cython Compute_Similarity, reverting to Python
15916.0s 2037 Similarity column 6969 (100.0%), 581.57 column/sec. Elapsed time 11.98 sec
15916.2s 2038 EvaluatorHoldout: Ignoring 42 ( 0.2%) Users that have less than 1 test interactions
15936.6s 2039 EvaluatorHoldout: Processed 27053 (100.0%) in 20.46 sec. Users per second: 1322
15937.1s 2040 Unable to load Cython Compute_Similarity, reverting to Python
15948.6s 2041 Similarity column 6969 (100.0%), 591.37 column/sec. Elapsed time 11.78 sec
15948.8s 2042 EvaluatorHoldout: Ignoring 38 ( 0.1%) Users that have less than 1 test interactions
15969.3s 2043 EvaluatorHoldout: Processed 27057 (100.0%) in 20.53 sec. Users per second: 1318
15969.8s 2044 Unable to load Cython Compute_Similarity, reverting to Python
15981.0s 2045 Similarity column 6969 (100.0%), 608.86 column/sec. Elapsed time 11.45 sec
15981.2s 2046 EvaluatorHoldout: Ignoring 32 ( 0.1%) Users that have less than 1 test interactions
16001.9s 2047 EvaluatorHoldout: Processed 27063 (100.0%) in 20.70 sec. Users per second: 1307
16001.9s 2048 [I 2025-12-07 01:44:32,720] Trial 83 finished with value: 0.21683220988617907 and parameters: {'topK': 64, 'shrink': 4, 'feature_weighting': 'TF-IDF'}. Best is trial 54 with value: 0.21706238132685302.
16001.9s 2049 
16001.9s 2050 [I 2025-12-07 01:44:32,720] Trial 83 finished with value: 0.21683220988617907 and parameters: {'topK': 64, 'shrink': 4, 'feature_weighting': 'TF-IDF'}. Best is trial 54 with value: 0.21706238132685302.
16002.0s 2051 [0.21753546321674555, 0.21671954313865535, 0.21582086459471653, 0.2175491476708399, 0.21653603080993808]
16002.3s 2052 Unable to load Cython Compute_Similarity, reverting to Python
16014.2s 2053 Similarity column 6969 (100.0%), 575.48 column/sec. Elapsed time 12.11 sec
16014.4s 2054 EvaluatorHoldout: Ignoring 48 ( 0.2%) Users that have less than 1 test interactions
16036.4s 2055 EvaluatorHoldout: Processed 27047 (100.0%) in 22.00 sec. Users per second: 1229
16036.8s 2056 Unable to load Cython Compute_Similarity, reverting to Python
16048.6s 2057 Similarity column 6969 (100.0%), 579.95 column/sec. Elapsed time 12.02 sec
16048.8s 2058 EvaluatorHoldout: Ignoring 29 ( 0.1%) Users that have less than 1 test interactions
16071.2s 2059 EvaluatorHoldout: Processed 27066 (100.0%) in 22.39 sec. Users per second: 1209
16071.6s 2060 Unable to load Cython Compute_Similarity, reverting to Python
16083.7s 2061 Similarity column 6969 (100.0%), 567.67 column/sec. Elapsed time 12.28 sec
16083.9s 2062 EvaluatorHoldout: Ignoring 42 ( 0.2%) Users that have less than 1 test interactions
16106.4s 2063 EvaluatorHoldout: Processed 27053 (100.0%) in 22.50 sec. Users per second: 1202
16106.8s 2064 Unable to load Cython Compute_Similarity, reverting to Python
16118.9s 2065 Similarity column 6969 (100.0%), 565.70 column/sec. Elapsed time 12.32 sec
16119.1s 2066 EvaluatorHoldout: Ignoring 38 ( 0.1%) Users that have less than 1 test interactions
16141.7s 2067 EvaluatorHoldout: Processed 27057 (100.0%) in 22.62 sec. Users per second: 1196
16142.1s 2068 Unable to load Cython Compute_Similarity, reverting to Python
16154.2s 2069 Similarity column 6969 (100.0%), 566.59 column/sec. Elapsed time 12.30 sec
16154.4s 2070 EvaluatorHoldout: Ignoring 32 ( 0.1%) Users that have less than 1 test interactions
16177.0s 2071 EvaluatorHoldout: Processed 27063 (100.0%) in 22.63 sec. Users per second: 1196
16177.0s 2072 [I 2025-12-07 01:47:27,882] Trial 84 finished with value: 0.21693072128563987 and parameters: {'topK': 98, 'shrink': 115, 'feature_weighting': 'TF-IDF'}. Best is trial 54 with value: 0.21706238132685302.
16177.0s 2073 
16177.0s 2074 [I 2025-12-07 01:47:27,882] Trial 84 finished with value: 0.21693072128563987 and parameters: {'topK': 98, 'shrink': 115, 'feature_weighting': 'TF-IDF'}. Best is trial 54 with value: 0.21706238132685302.
16177.1s 2075 [0.21739402874839037, 0.21692971569631478, 0.21665969001004792, 0.21773851295864344, 0.21593165901480288]
16177.5s 2076 Unable to load Cython Compute_Similarity, reverting to Python
16189.3s 2077 Similarity column 6969 (100.0%), 581.65 column/sec. Elapsed time 11.98 sec
16189.5s 2078 EvaluatorHoldout: Ignoring 48 ( 0.2%) Users that have less than 1 test interactions
16211.0s 2079 EvaluatorHoldout: Processed 27047 (100.0%) in 21.63 sec. Users per second: 1251
16211.5s 2080 Unable to load Cython Compute_Similarity, reverting to Python
16223.6s 2081 Similarity column 6969 (100.0%), 567.75 column/sec. Elapsed time 12.27 sec
16223.8s 2082 EvaluatorHoldout: Ignoring 29 ( 0.1%) Users that have less than 1 test interactions
16245.7s 2083 EvaluatorHoldout: Processed 27066 (100.0%) in 21.96 sec. Users per second: 1233
16246.1s 2084 Unable to load Cython Compute_Similarity, reverting to Python
16258.2s 2085 Similarity column 6969 (100.0%), 566.79 column/sec. Elapsed time 12.30 sec
16258.4s 2086 EvaluatorHoldout: Ignoring 42 ( 0.2%) Users that have less than 1 test interactions
16280.0s 2087 EvaluatorHoldout: Processed 27053 (100.0%) in 21.63 sec. Users per second: 1251
16280.4s 2088 Unable to load Cython Compute_Similarity, reverting to Python
16291.8s 2089 Similarity column 6969 (100.0%), 599.55 column/sec. Elapsed time 11.62 sec
16292.0s 2090 EvaluatorHoldout: Ignoring 38 ( 0.1%) Users that have less than 1 test interactions
16313.4s 2091 EvaluatorHoldout: Processed 27057 (100.0%) in 21.36 sec. Users per second: 1267
16313.8s 2092 Unable to load Cython Compute_Similarity, reverting to Python
16325.3s 2093 Similarity column 6969 (100.0%), 592.25 column/sec. Elapsed time 11.77 sec
16325.5s 2094 EvaluatorHoldout: Ignoring 32 ( 0.1%) Users that have less than 1 test interactions
16346.8s 2095 EvaluatorHoldout: Processed 27063 (100.0%) in 21.29 sec. Users per second: 1271
16346.8s 2096 [I 2025-12-07 01:50:17,660] Trial 85 finished with value: 0.21679427997991216 and parameters: {'topK': 79, 'shrink': 77, 'feature_weighting': 'TF-IDF'}. Best is trial 54 with value: 0.21706238132685302.
16346.8s 2097 
16346.8s 2098 [I 2025-12-07 01:50:17,660] Trial 85 finished with value: 0.21679427997991216 and parameters: {'topK': 79, 'shrink': 77, 'feature_weighting': 'TF-IDF'}. Best is trial 54 with value: 0.21706238132685302.
16346.9s 2099 [0.21723599551700096, 0.21648403186556767, 0.21663982503353388, 0.21733697928169435, 0.21627456820176388]
16347.2s 2100 Unable to load Cython Compute_Similarity, reverting to Python
16358.5s 2101 Similarity column 6969 (100.0%), 609.96 column/sec. Elapsed time 11.43 sec
16358.7s 2102 EvaluatorHoldout: Ignoring 48 ( 0.2%) Users that have less than 1 test interactions
16378.8s 2103 EvaluatorHoldout: Processed 27047 (100.0%) in 20.22 sec. Users per second: 1338
16379.3s 2104 Unable to load Cython Compute_Similarity, reverting to Python
16390.6s 2105 Similarity column 6969 (100.0%), 602.64 column/sec. Elapsed time 11.56 sec
16390.8s 2106 EvaluatorHoldout: Ignoring 29 ( 0.1%) Users that have less than 1 test interactions
16411.2s 2107 EvaluatorHoldout: Processed 27066 (100.0%) in 20.45 sec. Users per second: 1324
16411.7s 2108 Unable to load Cython Compute_Similarity, reverting to Python
16423.1s 2109 Similarity column 6969 (100.0%), 596.91 column/sec. Elapsed time 11.68 sec
16423.3s 2110 EvaluatorHoldout: Ignoring 42 ( 0.2%) Users that have less than 1 test interactions
16443.7s 2111 EvaluatorHoldout: Processed 27053 (100.0%) in 20.37 sec. Users per second: 1328
16444.1s 2112 Unable to load Cython Compute_Similarity, reverting to Python
16455.9s 2113 Similarity column 6969 (100.0%), 581.62 column/sec. Elapsed time 11.98 sec
16456.1s 2114 EvaluatorHoldout: Ignoring 38 ( 0.1%) Users that have less than 1 test interactions
16476.8s 2115 EvaluatorHoldout: Processed 27057 (100.0%) in 20.74 sec. Users per second: 1305
16477.2s 2116 Unable to load Cython Compute_Similarity, reverting to Python
16488.5s 2117 Similarity column 6969 (100.0%), 605.11 column/sec. Elapsed time 11.52 sec
16488.7s 2118 EvaluatorHoldout: Ignoring 32 ( 0.1%) Users that have less than 1 test interactions
16509.6s 2119 EvaluatorHoldout: Processed 27063 (100.0%) in 20.92 sec. Users per second: 1293
16509.6s 2120 [I 2025-12-07 01:53:00,430] Trial 86 finished with value: 0.21676410358393286 and parameters: {'topK': 62, 'shrink': 32, 'feature_weighting': 'TF-IDF'}. Best is trial 54 with value: 0.21706238132685302.
16509.6s 2121 
16509.6s 2122 [I 2025-12-07 01:53:00,430] Trial 86 finished with value: 0.21676410358393286 and parameters: {'topK': 62, 'shrink': 32, 'feature_weighting': 'TF-IDF'}. Best is trial 54 with value: 0.21706238132685302.
16509.7s 2123 [0.2172694775499684, 0.21652566008176083, 0.21580876480030914, 0.21786945099938412, 0.21634716448824187]
16510.0s 2124 Unable to load Cython Compute_Similarity, reverting to Python
16521.9s 2125 Similarity column 6969 (100.0%), 575.54 column/sec. Elapsed time 12.11 sec
16522.1s 2126 EvaluatorHoldout: Ignoring 48 ( 0.2%) Users that have less than 1 test interactions
16545.2s 2127 EvaluatorHoldout: Processed 27047 (100.0%) in 23.07 sec. Users per second: 1172
16545.6s 2128 Unable to load Cython Compute_Similarity, reverting to Python
16557.6s 2129 Similarity column 6969 (100.0%), 570.72 column/sec. Elapsed time 12.21 sec
16557.8s 2130 EvaluatorHoldout: Ignoring 29 ( 0.1%) Users that have less than 1 test interactions
16581.2s 2131 EvaluatorHoldout: Processed 27066 (100.0%) in 23.42 sec. Users per second: 1156
16581.7s 2132 Unable to load Cython Compute_Similarity, reverting to Python
16593.8s 2133 Similarity column 6969 (100.0%), 564.73 column/sec. Elapsed time 12.34 sec
16594.0s 2134 EvaluatorHoldout: Ignoring 42 ( 0.2%) Users that have less than 1 test interactions
16617.2s 2135 EvaluatorHoldout: Processed 27053 (100.0%) in 23.17 sec. Users per second: 1167
16617.6s 2136 Unable to load Cython Compute_Similarity, reverting to Python
16629.6s 2137 Similarity column 6969 (100.0%), 571.26 column/sec. Elapsed time 12.20 sec
16629.8s 2138 EvaluatorHoldout: Ignoring 38 ( 0.1%) Users that have less than 1 test interactions
16653.0s 2139 EvaluatorHoldout: Processed 27057 (100.0%) in 23.27 sec. Users per second: 1163
16653.5s 2140 Unable to load Cython Compute_Similarity, reverting to Python
16665.2s 2141 Similarity column 6969 (100.0%), 585.01 column/sec. Elapsed time 11.91 sec
16665.4s 2142 EvaluatorHoldout: Ignoring 32 ( 0.1%) Users that have less than 1 test interactions
16688.0s 2143 EvaluatorHoldout: Processed 27063 (100.0%) in 22.65 sec. Users per second: 1195
16688.0s 2144 [I 2025-12-07 01:55:58,849] Trial 87 finished with value: 0.21668037076862962 and parameters: {'topK': 115, 'shrink': 88, 'feature_weighting': 'TF-IDF'}. Best is trial 54 with value: 0.21706238132685302.
16688.0s 2145 
16688.0s 2146 [I 2025-12-07 01:55:58,849] Trial 87 finished with value: 0.21668037076862962 and parameters: {'topK': 115, 'shrink': 88, 'feature_weighting': 'TF-IDF'}. Best is trial 54 with value: 0.21706238132685302.
16688.1s 2147 [0.21676357001057847, 0.2169922653827541, 0.216141550817311, 0.2175119532388578, 0.21599251439364656]
16688.4s 2148 Unable to load Cython Compute_Similarity, reverting to Python
16700.1s 2149 Similarity column 6969 (100.0%), 586.93 column/sec. Elapsed time 11.87 sec
16700.3s 2150 EvaluatorHoldout: Ignoring 48 ( 0.2%) Users that have less than 1 test interactions
16721.1s 2151 EvaluatorHoldout: Processed 27047 (100.0%) in 20.80 sec. Users per second: 1300
16721.5s 2152 Unable to load Cython Compute_Similarity, reverting to Python
16733.5s 2153 Similarity column 6969 (100.0%), 571.56 column/sec. Elapsed time 12.19 sec
16733.7s 2154 EvaluatorHoldout: Ignoring 29 ( 0.1%) Users that have less than 1 test interactions
16755.1s 2155 EvaluatorHoldout: Processed 27066 (100.0%) in 21.37 sec. Users per second: 1267
16755.5s 2156 Unable to load Cython Compute_Similarity, reverting to Python
16767.1s 2157 Similarity column 6969 (100.0%), 589.67 column/sec. Elapsed time 11.82 sec
16767.3s 2158 EvaluatorHoldout: Ignoring 42 ( 0.2%) Users that have less than 1 test interactions
16787.7s 2159 EvaluatorHoldout: Processed 27053 (100.0%) in 20.42 sec. Users per second: 1325
16788.1s 2160 Unable to load Cython Compute_Similarity, reverting to Python
16800.7s 2161 Similarity column 6969 (100.0%), 544.58 column/sec. Elapsed time 12.80 sec
16800.9s 2162 EvaluatorHoldout: Ignoring 38 ( 0.1%) Users that have less than 1 test interactions
16822.1s 2163 EvaluatorHoldout: Processed 27057 (100.0%) in 21.17 sec. Users per second: 1278
16822.5s 2164 Unable to load Cython Compute_Similarity, reverting to Python
16834.5s 2165 Similarity column 6969 (100.0%), 572.83 column/sec. Elapsed time 12.17 sec
16834.7s 2166 EvaluatorHoldout: Ignoring 32 ( 0.1%) Users that have less than 1 test interactions
16856.2s 2167 EvaluatorHoldout: Processed 27063 (100.0%) in 21.59 sec. Users per second: 1254
16856.2s 2168 [I 2025-12-07 01:58:47,098] Trial 88 finished with value: 0.195256986193103 and parameters: {'topK': 80, 'shrink': 51, 'feature_weighting': 'BM25'}. Best is trial 54 with value: 0.21706238132685302.
16856.2s 2169 
16856.2s 2170 [I 2025-12-07 01:58:47,098] Trial 88 finished with value: 0.195256986193103 and parameters: {'topK': 80, 'shrink': 51, 'feature_weighting': 'BM25'}. Best is trial 54 with value: 0.21706238132685302.
16856.3s 2171 [0.19631478864462432, 0.1956081900777031, 0.19400993683661288, 0.19513397370848445, 0.1952180416980902]
16856.7s 2172 Unable to load Cython Compute_Similarity, reverting to Python
16868.3s 2173 Similarity column 6969 (100.0%), 591.05 column/sec. Elapsed time 11.79 sec
16868.5s 2174 EvaluatorHoldout: Ignoring 48 ( 0.2%) Users that have less than 1 test interactions
16889.4s 2175 EvaluatorHoldout: Processed 27047 (100.0%) in 20.95 sec. Users per second: 1291
16889.8s 2176 Unable to load Cython Compute_Similarity, reverting to Python
16900.7s 2177 Similarity column 6969 (100.0%), 631.00 column/sec. Elapsed time 11.04 sec
16900.9s 2178 EvaluatorHoldout: Ignoring 29 ( 0.1%) Users that have less than 1 test interactions
16921.7s 2179 EvaluatorHoldout: Processed 27066 (100.0%) in 20.89 sec. Users per second: 1296
16922.1s 2180 Unable to load Cython Compute_Similarity, reverting to Python
16933.6s 2181 Similarity column 6969 (100.0%), 593.52 column/sec. Elapsed time 11.74 sec
16933.9s 2182 EvaluatorHoldout: Ignoring 42 ( 0.2%) Users that have less than 1 test interactions
16955.0s 2183 EvaluatorHoldout: Processed 27053 (100.0%) in 21.14 sec. Users per second: 1280
16955.4s 2184 Unable to load Cython Compute_Similarity, reverting to Python
16966.7s 2185 Similarity column 6969 (100.0%), 603.73 column/sec. Elapsed time 11.54 sec
16966.9s 2186 EvaluatorHoldout: Ignoring 38 ( 0.1%) Users that have less than 1 test interactions
16988.1s 2187 EvaluatorHoldout: Processed 27057 (100.0%) in 21.26 sec. Users per second: 1273
16988.6s 2188 Unable to load Cython Compute_Similarity, reverting to Python
17000.6s 2189 Similarity column 6969 (100.0%), 569.50 column/sec. Elapsed time 12.24 sec
17000.8s 2190 EvaluatorHoldout: Ignoring 32 ( 0.1%) Users that have less than 1 test interactions
17021.9s 2191 EvaluatorHoldout: Processed 27063 (100.0%) in 21.19 sec. Users per second: 1277
17021.9s 2192 [I 2025-12-07 02:01:32,799] Trial 89 finished with value: 0.2163864498862181 and parameters: {'topK': 50, 'shrink': 448, 'feature_weighting': 'TF-IDF'}. Best is trial 54 with value: 0.21706238132685302.
17021.9s 2193 
17021.9s 2194 [I 2025-12-07 02:01:32,799] Trial 89 finished with value: 0.2163864498862181 and parameters: {'topK': 50, 'shrink': 448, 'feature_weighting': 'TF-IDF'}. Best is trial 54 with value: 0.21706238132685302.
17022.0s 2195 [0.2170414500138142, 0.21639588696200598, 0.21521006819726932, 0.21751396047945146, 0.2157708837785495]
17022.0s 2196 Unable to load Cython Compute_Similarity, reverting to Python
17034.4s 2197 Similarity column 6969 (100.0%), 563.86 column/sec. Elapsed time 12.36 sec
17034.6s 2198 EvaluatorHoldout: Ignoring 48 ( 0.2%) Users that have less than 1 test interactions
17056.8s 2199 EvaluatorHoldout: Processed 27047 (100.0%) in 22.27 sec. Users per second: 1214
17056.9s 2200 Unable to load Cython Compute_Similarity, reverting to Python
17069.9s 2201 Similarity column 6969 (100.0%), 535.14 column/sec. Elapsed time 13.02 sec
17070.1s 2202 EvaluatorHoldout: Ignoring 29 ( 0.1%) Users that have less than 1 test interactions
17092.5s 2203 EvaluatorHoldout: Processed 27066 (100.0%) in 22.48 sec. Users per second: 1204
17092.6s 2204 Unable to load Cython Compute_Similarity, reverting to Python
17104.7s 2205 Similarity column 6969 (100.0%), 573.87 column/sec. Elapsed time 12.14 sec
17104.9s 2206 EvaluatorHoldout: Ignoring 42 ( 0.2%) Users that have less than 1 test interactions
17127.6s 2207 EvaluatorHoldout: Processed 27053 (100.0%) in 22.73 sec. Users per second: 1190
17127.7s 2208 Unable to load Cython Compute_Similarity, reverting to Python
17141.1s 2209 Similarity column 6969 (100.0%), 519.96 column/sec. Elapsed time 13.40 sec
17141.3s 2210 EvaluatorHoldout: Ignoring 38 ( 0.1%) Users that have less than 1 test interactions
17163.6s 2211 EvaluatorHoldout: Processed 27057 (100.0%) in 22.34 sec. Users per second: 1211
17163.7s 2212 Unable to load Cython Compute_Similarity, reverting to Python
17175.3s 2213 Similarity column 6969 (100.0%), 598.67 column/sec. Elapsed time 11.64 sec
17175.5s 2214 EvaluatorHoldout: Ignoring 32 ( 0.1%) Users that have less than 1 test interactions
17197.3s 2215 EvaluatorHoldout: Processed 27063 (100.0%) in 21.81 sec. Users per second: 1241
17197.3s 2216 [I 2025-12-07 02:04:28,116] Trial 90 finished with value: 0.21043395400403214 and parameters: {'topK': 98, 'shrink': 20, 'feature_weighting': 'none'}. Best is trial 54 with value: 0.21706238132685302.
17197.3s 2217 
