21076.6s 3586 [I 2025-12-07 14:45:11,916] Trial 147 finished with value: 0.2028286783114154 and parameters: {'similarity': 'dice', 'topK': 41, 'shrink': 221}. Best is trial 91 with value: 0.24993110179607925.
21076.6s 3587 [0.20229783212052385, 0.20341421603260443, 0.2032192371709109, 0.20220426001075775, 0.20300784622228005]
21076.9s 3588 Unable to load Cython Compute_Similarity, reverting to Python
21085.8s 3589 Similarity column 6969 (100.0%), 769.30 column/sec. Elapsed time 9.06 sec
21086.0s 3590 EvaluatorHoldout: Ignoring 33 ( 0.1%) Users that have less than 1 test interactions
21099.8s 3591 EvaluatorHoldout: Processed 27062 (100.0%) in 14.05 sec. Users per second: 1925
21100.3s 3592 Unable to load Cython Compute_Similarity, reverting to Python
21109.3s 3593 Similarity column 6969 (100.0%), 777.42 column/sec. Elapsed time 8.96 sec
21109.3s 3594 EvaluatorHoldout: Ignoring 28 ( 0.1%) Users that have less than 1 test interactions
21123.0s 3595 EvaluatorHoldout: Processed 27067 (100.0%) in 13.86 sec. Users per second: 1953
21123.5s 3596 Unable to load Cython Compute_Similarity, reverting to Python
21132.6s 3597 Similarity column 6969 (100.0%), 746.58 column/sec. Elapsed time 9.33 sec
21132.8s 3598 EvaluatorHoldout: Ignoring 40 ( 0.1%) Users that have less than 1 test interactions
21146.5s 3599 EvaluatorHoldout: Processed 27055 (100.0%) in 13.65 sec. Users per second: 1982
21146.8s 3600 Unable to load Cython Compute_Similarity, reverting to Python
21155.8s 3601 Similarity column 6969 (100.0%), 754.32 column/sec. Elapsed time 9.24 sec
21156.0s 3602 EvaluatorHoldout: Ignoring 21 ( 0.1%) Users that have less than 1 test interactions
21169.6s 3603 EvaluatorHoldout: Processed 27074 (100.0%) in 13.75 sec. Users per second: 1969
21170.1s 3604 Unable to load Cython Compute_Similarity, reverting to Python
21179.0s 3605 Similarity column 6969 (100.0%), 777.28 column/sec. Elapsed time 8.97 sec
21179.1s 3606 EvaluatorHoldout: Ignoring 29 ( 0.1%) Users that have less than 1 test interactions
21192.6s 3607 EvaluatorHoldout: Processed 27066 (100.0%) in 13.75 sec. Users per second: 1969
21192.7s 3608 [I 2025-12-07 14:47:08,168] Trial 148 finished with value: 0.24853427463363556 and parameters: {'similarity': 'tversky', 'topK': 6, 'shrink': 208, 'tversky_alpha': 0.29167287086228744, 'tversky_beta': 1.4976185702211622}. Best is trial 91 with value: 0.24993110179607925.
21192.7s 3609 
21192.7s 3610 [I 2025-12-07 14:47:08,168] Trial 148 finished with value: 0.24853427463363556 and parameters: {'similarity': 'tversky', 'topK': 6, 'shrink': 208, 'tversky_alpha': 0.29167287086228744, 'tversky_beta': 1.4976185702211622}. Best is trial 91 with value: 0.24993110179607925.
21192.8s 3611 [0.24780475542369942, 0.24910278327524654, 0.24983071526925366, 0.24810439033205525, 0.24782872886792295]
21193.2s 3612 Unable to load Cython Compute_Similarity, reverting to Python
21205.8s 3613 Similarity column 6969 (100.0%), 542.76 column/sec. Elapsed time 12.84 sec
21206.0s 3614 EvaluatorHoldout: Ignoring 33 ( 0.1%) Users that have less than 1 test interactions
21228.7s 3615 EvaluatorHoldout: Processed 27062 (100.0%) in 22.63 sec. Users per second: 1196
21229.0s 3616 Unable to load Cython Compute_Similarity, reverting to Python
21241.4s 3617 Similarity column 6969 (100.0%), 553.78 column/sec. Elapsed time 12.58 sec
21241.6s 3618 EvaluatorHoldout: Ignoring 28 ( 0.1%) Users that have less than 1 test interactions
21264.4s 3619 EvaluatorHoldout: Processed 27067 (100.0%) in 22.72 sec. Users per second: 1191
21264.7s 3620 Unable to load Cython Compute_Similarity, reverting to Python
21277.1s 3621 Similarity column 6969 (100.0%), 553.70 column/sec. Elapsed time 12.59 sec
21277.3s 3622 EvaluatorHoldout: Ignoring 40 ( 0.1%) Users that have less than 1 test interactions
21300.3s 3623 EvaluatorHoldout: Processed 27055 (100.0%) in 22.87 sec. Users per second: 1183
21300.6s 3624 Unable to load Cython Compute_Similarity, reverting to Python
21313.0s 3625 Similarity column 6969 (100.0%), 553.02 column/sec. Elapsed time 12.60 sec
21313.2s 3626 EvaluatorHoldout: Ignoring 21 ( 0.1%) Users that have less than 1 test interactions
21336.2s 3627 EvaluatorHoldout: Processed 27074 (100.0%) in 22.98 sec. Users per second: 1178
21336.6s 3628 Unable to load Cython Compute_Similarity, reverting to Python
21348.9s 3629 Similarity column 6969 (100.0%), 555.50 column/sec. Elapsed time 12.55 sec
21349.1s 3630 EvaluatorHoldout: Ignoring 29 ( 0.1%) Users that have less than 1 test interactions
21372.2s 3631 EvaluatorHoldout: Processed 27066 (100.0%) in 23.03 sec. Users per second: 1175
21372.2s 3632 [I 2025-12-07 14:50:07,555] Trial 149 finished with value: 0.19508288062350393 and parameters: {'similarity': 'jaccard', 'topK': 458, 'shrink': 243}. Best is trial 91 with value: 0.24993110179607925.
21372.2s 3633 
21372.2s 3634 [I 2025-12-07 14:50:07,555] Trial 149 finished with value: 0.19508288062350393 and parameters: {'similarity': 'jaccard', 'topK': 458, 'shrink': 243}. Best is trial 91 with value: 0.24993110179607925.
21372.2s 3635 [0.19413072648842705, 0.19572010954776153, 0.1951520554706859, 0.19469420542735427, 0.19571730618329097]
21372.5s 3636 Unable to load Cython Compute_Similarity, reverting to Python
21381.6s 3637 Similarity column 6969 (100.0%), 753.67 column/sec. Elapsed time 9.25 sec
21381.8s 3638 EvaluatorHoldout: Ignoring 33 ( 0.1%) Users that have less than 1 test interactions
21395.3s 3639 EvaluatorHoldout: Processed 27062 (100.0%) in 13.63 sec. Users per second: 1985
21395.8s 3640 Unable to load Cython Compute_Similarity, reverting to Python
21404.7s 3641 Similarity column 6969 (100.0%), 773.87 column/sec. Elapsed time 9.01 sec
21404.8s 3642 EvaluatorHoldout: Ignoring 28 ( 0.1%) Users that have less than 1 test interactions
21418.3s 3643 EvaluatorHoldout: Processed 27067 (100.0%) in 13.72 sec. Users per second: 1972
21418.8s 3644 Unable to load Cython Compute_Similarity, reverting to Python
21427.8s 3645 Similarity column 6969 (100.0%), 761.38 column/sec. Elapsed time 9.15 sec
21428.0s 3646 EvaluatorHoldout: Ignoring 40 ( 0.1%) Users that have less than 1 test interactions
21441.6s 3647 EvaluatorHoldout: Processed 27055 (100.0%) in 13.64 sec. Users per second: 1984
21441.9s 3648 Unable to load Cython Compute_Similarity, reverting to Python
21450.9s 3649 Similarity column 6969 (100.0%), 761.34 column/sec. Elapsed time 9.15 sec
21451.1s 3650 EvaluatorHoldout: Ignoring 21 ( 0.1%) Users that have less than 1 test interactions
21464.6s 3651 EvaluatorHoldout: Processed 27074 (100.0%) in 13.68 sec. Users per second: 1979
21465.1s 3652 Unable to load Cython Compute_Similarity, reverting to Python
21474.1s 3653 Similarity column 6969 (100.0%), 773.38 column/sec. Elapsed time 9.01 sec
21474.1s 3654 EvaluatorHoldout: Ignoring 29 ( 0.1%) Users that have less than 1 test interactions
21487.6s 3655 EvaluatorHoldout: Processed 27066 (100.0%) in 13.64 sec. Users per second: 1985
21487.6s 3656 [I 2025-12-07 14:52:03,085] Trial 150 finished with value: 0.2466157237328471 and parameters: {'similarity': 'tversky', 'topK': 5, 'shrink': 222, 'tversky_alpha': 0.34852637065811193, 'tversky_beta': 1.4585108066492405}. Best is trial 91 with value: 0.24993110179607925.
21487.6s 3657 
21487.6s 3658 [I 2025-12-07 14:52:03,085] Trial 150 finished with value: 0.2466157237328471 and parameters: {'similarity': 'tversky', 'topK': 5, 'shrink': 222, 'tversky_alpha': 0.34852637065811193, 'tversky_beta': 1.4585108066492405}. Best is trial 91 with value: 0.24993110179607925.
21487.8s 3659 [0.24567516000080702, 0.2472212872392829, 0.2479158444548259, 0.24583762777470006, 0.2464286991946197]
21488.1s 3660 Unable to load Cython Compute_Similarity, reverting to Python
21497.0s 3661 Similarity column 6969 (100.0%), 760.12 column/sec. Elapsed time 9.17 sec
21497.2s 3662 EvaluatorHoldout: Ignoring 33 ( 0.1%) Users that have less than 1 test interactions
21510.8s 3663 EvaluatorHoldout: Processed 27062 (100.0%) in 13.57 sec. Users per second: 1994
21511.2s 3664 Unable to load Cython Compute_Similarity, reverting to Python
21520.0s 3665 Similarity column 6969 (100.0%), 775.58 column/sec. Elapsed time 8.99 sec
21520.2s 3666 EvaluatorHoldout: Ignoring 28 ( 0.1%) Users that have less than 1 test interactions
21533.7s 3667 EvaluatorHoldout: Processed 27067 (100.0%) in 13.73 sec. Users per second: 1971
21534.2s 3668 Unable to load Cython Compute_Similarity, reverting to Python
21543.5s 3669 Similarity column 6969 (100.0%), 749.57 column/sec. Elapsed time 9.30 sec
21543.5s 3670 EvaluatorHoldout: Ignoring 40 ( 0.1%) Users that have less than 1 test interactions
21556.9s 3671 EvaluatorHoldout: Processed 27055 (100.0%) in 13.58 sec. Users per second: 1992
21557.4s 3672 Unable to load Cython Compute_Similarity, reverting to Python
21566.2s 3673 Similarity column 6969 (100.0%), 772.30 column/sec. Elapsed time 9.02 sec
21566.4s 3674 EvaluatorHoldout: Ignoring 21 ( 0.1%) Users that have less than 1 test interactions
21580.0s 3675 EvaluatorHoldout: Processed 27074 (100.0%) in 13.59 sec. Users per second: 1992
21580.4s 3676 Unable to load Cython Compute_Similarity, reverting to Python
21589.1s 3677 Similarity column 6969 (100.0%), 780.76 column/sec. Elapsed time 8.93 sec
21589.3s 3678 EvaluatorHoldout: Ignoring 29 ( 0.1%) Users that have less than 1 test interactions
21602.7s 3679 EvaluatorHoldout: Processed 27066 (100.0%) in 13.64 sec. Users per second: 1984
21602.8s 3680 [I 2025-12-07 14:53:58,272] Trial 151 finished with value: 0.248158076739932 and parameters: {'similarity': 'tversky', 'topK': 5, 'shrink': 212, 'tversky_alpha': 0.2895654487655845, 'tversky_beta': 1.4847038077477297}. Best is trial 91 with value: 0.24993110179607925.
21602.8s 3681 
21602.8s 3682 [I 2025-12-07 14:53:58,272] Trial 151 finished with value: 0.248158076739932 and parameters: {'similarity': 'tversky', 'topK': 5, 'shrink': 212, 'tversky_alpha': 0.2895654487655845, 'tversky_beta': 1.4847038077477297}. Best is trial 91 with value: 0.24993110179607925.
21602.9s 3683 [0.24755833360848395, 0.2488701033107237, 0.2491725335040367, 0.2470344673385428, 0.248154945937873]
21603.3s 3684 Unable to load Cython Compute_Similarity, reverting to Python
21612.3s 3685 Similarity column 6969 (100.0%), 766.66 column/sec. Elapsed time 9.09 sec
21612.4s 3686 EvaluatorHoldout: Ignoring 33 ( 0.1%) Users that have less than 1 test interactions
21625.9s 3687 EvaluatorHoldout: Processed 27062 (100.0%) in 13.71 sec. Users per second: 1974
21626.4s 3688 Unable to load Cython Compute_Similarity, reverting to Python
21635.2s 3689 Similarity column 6969 (100.0%), 775.12 column/sec. Elapsed time 8.99 sec
21635.4s 3690 EvaluatorHoldout: Ignoring 28 ( 0.1%) Users that have less than 1 test interactions
21649.3s 3691 EvaluatorHoldout: Processed 27067 (100.0%) in 13.81 sec. Users per second: 1960
21649.5s 3692 Unable to load Cython Compute_Similarity, reverting to Python
21658.7s 3693 Similarity column 6969 (100.0%), 739.62 column/sec. Elapsed time 9.42 sec
21658.9s 3694 EvaluatorHoldout: Ignoring 40 ( 0.1%) Users that have less than 1 test interactions
21672.5s 3695 EvaluatorHoldout: Processed 27055 (100.0%) in 13.78 sec. Users per second: 1963
21673.0s 3696 Unable to load Cython Compute_Similarity, reverting to Python
21682.1s 3697 Similarity column 6969 (100.0%), 766.40 column/sec. Elapsed time 9.09 sec
21682.1s 3698 EvaluatorHoldout: Ignoring 21 ( 0.1%) Users that have less than 1 test interactions
21695.7s 3699 EvaluatorHoldout: Processed 27074 (100.0%) in 13.72 sec. Users per second: 1973
21696.2s 3700 Unable to load Cython Compute_Similarity, reverting to Python
21704.9s 3701 Similarity column 6969 (100.0%), 780.61 column/sec. Elapsed time 8.93 sec
21705.1s 3702 EvaluatorHoldout: Ignoring 29 ( 0.1%) Users that have less than 1 test interactions
21718.9s 3703 EvaluatorHoldout: Processed 27066 (100.0%) in 13.82 sec. Users per second: 1959
21718.9s 3704 [I 2025-12-07 14:55:54,263] Trial 152 finished with value: 0.24708539976281557 and parameters: {'similarity': 'tversky', 'topK': 7, 'shrink': 215, 'tversky_alpha': 0.32419041844536184, 'tversky_beta': 1.4652150298590665}. Best is trial 91 with value: 0.24993110179607925.
21718.9s 3705 
21718.9s 3706 [I 2025-12-07 14:55:54,263] Trial 152 finished with value: 0.24708539976281557 and parameters: {'similarity': 'tversky', 'topK': 7, 'shrink': 215, 'tversky_alpha': 0.32419041844536184, 'tversky_beta': 1.4652150298590665}. Best is trial 91 with value: 0.24993110179607925.
21718.9s 3707 [0.246123753751434, 0.2481496433518232, 0.24874648452056788, 0.2456193529560541, 0.24678776423419851]
21719.3s 3708 Unable to load Cython Compute_Similarity, reverting to Python
21728.2s 3709 Similarity column 6969 (100.0%), 766.61 column/sec. Elapsed time 9.09 sec
21728.4s 3710 EvaluatorHoldout: Ignoring 33 ( 0.1%) Users that have less than 1 test interactions
21742.1s 3711 EvaluatorHoldout: Processed 27062 (100.0%) in 13.88 sec. Users per second: 1950
21742.6s 3712 Unable to load Cython Compute_Similarity, reverting to Python
21751.6s 3713 Similarity column 6969 (100.0%), 768.08 column/sec. Elapsed time 9.07 sec
21751.6s 3714 EvaluatorHoldout: Ignoring 28 ( 0.1%) Users that have less than 1 test interactions
21765.2s 3715 EvaluatorHoldout: Processed 27067 (100.0%) in 13.79 sec. Users per second: 1963
21765.7s 3716 Unable to load Cython Compute_Similarity, reverting to Python
21774.9s 3717 Similarity column 6969 (100.0%), 746.91 column/sec. Elapsed time 9.33 sec
21775.1s 3718 EvaluatorHoldout: Ignoring 40 ( 0.1%) Users that have less than 1 test interactions
21788.8s 3719 EvaluatorHoldout: Processed 27055 (100.0%) in 13.71 sec. Users per second: 1974
21789.1s 3720 Unable to load Cython Compute_Similarity, reverting to Python
21798.0s 3721 Similarity column 6969 (100.0%), 762.23 column/sec. Elapsed time 9.14 sec
21798.2s 3722 EvaluatorHoldout: Ignoring 21 ( 0.1%) Users that have less than 1 test interactions
21811.9s 3723 EvaluatorHoldout: Processed 27074 (100.0%) in 13.83 sec. Users per second: 1957
21812.4s 3724 Unable to load Cython Compute_Similarity, reverting to Python
21821.2s 3725 Similarity column 6969 (100.0%), 784.38 column/sec. Elapsed time 8.88 sec
21821.3s 3726 EvaluatorHoldout: Ignoring 29 ( 0.1%) Users that have less than 1 test interactions
21834.9s 3727 EvaluatorHoldout: Processed 27066 (100.0%) in 13.81 sec. Users per second: 1960
21834.9s 3728 [I 2025-12-07 14:57:50,425] Trial 153 finished with value: 0.24204620493218046 and parameters: {'similarity': 'tversky', 'topK': 7, 'shrink': 230, 'tversky_alpha': 0.48469089863815423, 'tversky_beta': 1.467452010189078}. Best is trial 91 with value: 0.24993110179607925.
21834.9s 3729 
21834.9s 3730 [I 2025-12-07 14:57:50,425] Trial 153 finished with value: 0.24204620493218046 and parameters: {'similarity': 'tversky', 'topK': 7, 'shrink': 230, 'tversky_alpha': 0.48469089863815423, 'tversky_beta': 1.467452010189078}. Best is trial 91 with value: 0.24993110179607925.
21835.1s 3731 [0.24131456114732053, 0.24271354984627316, 0.24366416408218228, 0.24000282092823047, 0.24253592865689586]
21835.4s 3732 Unable to load Cython Compute_Similarity, reverting to Python
21844.4s 3733 Similarity column 6969 (100.0%), 757.95 column/sec. Elapsed time 9.19 sec
21844.6s 3734 EvaluatorHoldout: Ignoring 33 ( 0.1%) Users that have less than 1 test interactions
21859.4s 3735 EvaluatorHoldout: Processed 27062 (100.0%) in 14.80 sec. Users per second: 1828
21859.7s 3736 Unable to load Cython Compute_Similarity, reverting to Python
21868.8s 3737 Similarity column 6969 (100.0%), 754.70 column/sec. Elapsed time 9.23 sec
21869.0s 3738 EvaluatorHoldout: Ignoring 28 ( 0.1%) Users that have less than 1 test interactions
21883.9s 3739 EvaluatorHoldout: Processed 27067 (100.0%) in 15.04 sec. Users per second: 1799
21884.4s 3740 Unable to load Cython Compute_Similarity, reverting to Python
21893.7s 3741 Similarity column 6969 (100.0%), 746.30 column/sec. Elapsed time 9.34 sec
21893.7s 3742 EvaluatorHoldout: Ignoring 40 ( 0.1%) Users that have less than 1 test interactions
21908.5s 3743 EvaluatorHoldout: Processed 27055 (100.0%) in 15.00 sec. Users per second: 1804
21909.0s 3744 Unable to load Cython Compute_Similarity, reverting to Python
21918.2s 3745 Similarity column 6969 (100.0%), 744.77 column/sec. Elapsed time 9.36 sec
21918.4s 3746 EvaluatorHoldout: Ignoring 21 ( 0.1%) Users that have less than 1 test interactions
21933.3s 3747 EvaluatorHoldout: Processed 27074 (100.0%) in 14.94 sec. Users per second: 1812
21933.7s 3748 Unable to load Cython Compute_Similarity, reverting to Python
21942.7s 3749 Similarity column 6969 (100.0%), 750.96 column/sec. Elapsed time 9.28 sec
21942.9s 3750 EvaluatorHoldout: Ignoring 29 ( 0.1%) Users that have less than 1 test interactions
21957.8s 3751 EvaluatorHoldout: Processed 27066 (100.0%) in 15.03 sec. Users per second: 1801
21957.8s 3752 [I 2025-12-07 14:59:53,315] Trial 154 finished with value: 0.22263364088165488 and parameters: {'similarity': 'tversky', 'topK': 42, 'shrink': 205, 'tversky_alpha': 0.32052683171981117, 'tversky_beta': 1.5232003985093028}. Best is trial 91 with value: 0.24993110179607925.
21957.8s 3753 
21957.8s 3754 [I 2025-12-07 14:59:53,315] Trial 154 finished with value: 0.22263364088165488 and parameters: {'similarity': 'tversky', 'topK': 42, 'shrink': 205, 'tversky_alpha': 0.32052683171981117, 'tversky_beta': 1.5232003985093028}. Best is trial 91 with value: 0.24993110179607925.
21958.0s 3755 [0.22180504706404258, 0.22309064351141805, 0.22319627857604377, 0.22153500645859706, 0.22354122879817306]
21958.3s 3756 Unable to load Cython Compute_Similarity, reverting to Python
21967.4s 3757 Similarity column 6969 (100.0%), 765.50 column/sec. Elapsed time 9.10 sec
21967.4s 3758 EvaluatorHoldout: Ignoring 33 ( 0.1%) Users that have less than 1 test interactions
21980.8s 3759 EvaluatorHoldout: Processed 27062 (100.0%) in 13.54 sec. Users per second: 1998
21981.3s 3760 Unable to load Cython Compute_Similarity, reverting to Python
21990.0s 3761 Similarity column 6969 (100.0%), 780.52 column/sec. Elapsed time 8.93 sec
21990.2s 3762 EvaluatorHoldout: Ignoring 28 ( 0.1%) Users that have less than 1 test interactions
22004.0s 3763 EvaluatorHoldout: Processed 27067 (100.0%) in 13.76 sec. Users per second: 1967
22004.3s 3764 Unable to load Cython Compute_Similarity, reverting to Python
22013.6s 3765 Similarity column 6969 (100.0%), 734.01 column/sec. Elapsed time 9.49 sec
22013.8s 3766 EvaluatorHoldout: Ignoring 40 ( 0.1%) Users that have less than 1 test interactions
22027.6s 3767 EvaluatorHoldout: Processed 27055 (100.0%) in 14.01 sec. Users per second: 1931
22028.1s 3768 Unable to load Cython Compute_Similarity, reverting to Python
22037.4s 3769 Similarity column 6969 (100.0%), 751.78 column/sec. Elapsed time 9.27 sec
22037.4s 3770 EvaluatorHoldout: Ignoring 21 ( 0.1%) Users that have less than 1 test interactions
22051.0s 3771 EvaluatorHoldout: Processed 27074 (100.0%) in 13.75 sec. Users per second: 1970
22051.5s 3772 Unable to load Cython Compute_Similarity, reverting to Python
22060.4s 3773 Similarity column 6969 (100.0%), 762.64 column/sec. Elapsed time 9.14 sec
22060.6s 3774 EvaluatorHoldout: Ignoring 29 ( 0.1%) Users that have less than 1 test interactions
22074.4s 3775 EvaluatorHoldout: Processed 27066 (100.0%) in 13.78 sec. Users per second: 1964
22074.4s 3776 [I 2025-12-07 15:01:49,757] Trial 155 finished with value: 0.2462641084598382 and parameters: {'similarity': 'tversky', 'topK': 5, 'shrink': 162, 'tversky_alpha': 0.41509675513312133, 'tversky_beta': 1.4889890460777013}. Best is trial 91 with value: 0.24993110179607925.
22074.4s 3777 
22074.4s 3778 [I 2025-12-07 15:01:49,757] Trial 155 finished with value: 0.2462641084598382 and parameters: {'similarity': 'tversky', 'topK': 5, 'shrink': 162, 'tversky_alpha': 0.41509675513312133, 'tversky_beta': 1.4889890460777013}. Best is trial 91 with value: 0.24993110179607925.
22074.4s 3779 [0.24528274440000386, 0.24704620827482696, 0.24762046032010304, 0.24536204303411818, 0.24600908627013926]
22074.7s 3780 Unable to load Cython Compute_Similarity, reverting to Python
22084.0s 3781 Similarity column 6969 (100.0%), 735.37 column/sec. Elapsed time 9.48 sec
22084.2s 3782 EvaluatorHoldout: Ignoring 33 ( 0.1%) Users that have less than 1 test interactions
22099.5s 3783 EvaluatorHoldout: Processed 27062 (100.0%) in 15.39 sec. Users per second: 1759
22100.0s 3784 Unable to load Cython Compute_Similarity, reverting to Python
22109.6s 3785 Similarity column 6969 (100.0%), 722.21 column/sec. Elapsed time 9.65 sec
22109.6s 3786 EvaluatorHoldout: Ignoring 28 ( 0.1%) Users that have less than 1 test interactions
22124.9s 3787 EvaluatorHoldout: Processed 27067 (100.0%) in 15.47 sec. Users per second: 1750
22125.4s 3788 Unable to load Cython Compute_Similarity, reverting to Python
22134.6s 3789 Similarity column 6969 (100.0%), 741.33 column/sec. Elapsed time 9.40 sec
22134.8s 3790 EvaluatorHoldout: Ignoring 40 ( 0.1%) Users that have less than 1 test interactions
22150.2s 3791 EvaluatorHoldout: Processed 27055 (100.0%) in 15.33 sec. Users per second: 1765
22150.5s 3792 Unable to load Cython Compute_Similarity, reverting to Python
22160.1s 3793 Similarity column 6969 (100.0%), 710.22 column/sec. Elapsed time 9.81 sec
22160.3s 3794 EvaluatorHoldout: Ignoring 21 ( 0.1%) Users that have less than 1 test interactions
22175.5s 3795 EvaluatorHoldout: Processed 27074 (100.0%) in 15.39 sec. Users per second: 1759
22176.0s 3796 Unable to load Cython Compute_Similarity, reverting to Python
22185.8s 3797 Similarity column 6969 (100.0%), 711.48 column/sec. Elapsed time 9.80 sec
22185.8s 3798 EvaluatorHoldout: Ignoring 29 ( 0.1%) Users that have less than 1 test interactions
22201.0s 3799 EvaluatorHoldout: Processed 27066 (100.0%) in 15.41 sec. Users per second: 1757
