4000.3s 490 [I 2025-12-06 22:24:31,229] Trial 18 finished with value: 0.19628711062051218 and parameters: {'topK': 134, 'shrink': 686, 'feature_weighting': 'BM25'}. Best is trial 10 with value: 0.21699762942341766.
4000.5s 491 [0.1967699923545918, 0.1968761874205947, 0.19538767275925678, 0.19650319260219867, 0.19589850796591898]
4000.5s 492 Unable to load Cython Compute_Similarity, reverting to Python
4015.1s 493 Similarity column 6969 (100.0%), 475.96 column/sec. Elapsed time 14.64 sec
4015.3s 494 EvaluatorHoldout: Ignoring 48 ( 0.2%) Users that have less than 1 test interactions
4049.8s 495 EvaluatorHoldout: Processed 27047 (100.0%) in 34.60 sec. Users per second: 782
4050.0s 496 Unable to load Cython Compute_Similarity, reverting to Python
4064.3s 497 Similarity column 6969 (100.0%), 485.00 column/sec. Elapsed time 14.37 sec
4064.5s 498 EvaluatorHoldout: Ignoring 29 ( 0.1%) Users that have less than 1 test interactions
4099.1s 499 EvaluatorHoldout: Processed 27066 (100.0%) in 34.66 sec. Users per second: 781
4099.3s 500 Unable to load Cython Compute_Similarity, reverting to Python
4113.4s 501 Similarity column 6969 (100.0%), 492.98 column/sec. Elapsed time 14.14 sec
4113.6s 502 EvaluatorHoldout: Ignoring 42 ( 0.2%) Users that have less than 1 test interactions
4147.9s 503 EvaluatorHoldout: Processed 27053 (100.0%) in 34.37 sec. Users per second: 787
4148.1s 504 Unable to load Cython Compute_Similarity, reverting to Python
4162.5s 505 Similarity column 6969 (100.0%), 481.23 column/sec. Elapsed time 14.48 sec
4162.7s 506 EvaluatorHoldout: Ignoring 38 ( 0.1%) Users that have less than 1 test interactions
4196.8s 507 EvaluatorHoldout: Processed 27057 (100.0%) in 34.16 sec. Users per second: 792
4197.0s 508 Unable to load Cython Compute_Similarity, reverting to Python
4211.6s 509 Similarity column 6969 (100.0%), 475.32 column/sec. Elapsed time 14.66 sec
4211.8s 510 EvaluatorHoldout: Ignoring 32 ( 0.1%) Users that have less than 1 test interactions
4246.4s 511 EvaluatorHoldout: Processed 27063 (100.0%) in 34.71 sec. Users per second: 780
4246.4s 512 [I 2025-12-06 22:28:37,371] Trial 19 finished with value: 0.2018752627536527 and parameters: {'topK': 379, 'shrink': 178, 'feature_weighting': 'none'}. Best is trial 10 with value: 0.21699762942341766.
4246.4s 513 
4246.4s 514 [I 2025-12-06 22:28:37,371] Trial 19 finished with value: 0.2018752627536527 and parameters: {'topK': 379, 'shrink': 178, 'feature_weighting': 'none'}. Best is trial 10 with value: 0.21699762942341766.
4246.6s 515 [0.20227729371487282, 0.20141758995933828, 0.20046776097453473, 0.20293870936660874, 0.20227495975290896]
4246.9s 516 Unable to load Cython Compute_Similarity, reverting to Python
4259.4s 517 Similarity column 6969 (100.0%), 548.72 column/sec. Elapsed time 12.70 sec
4259.6s 518 EvaluatorHoldout: Ignoring 48 ( 0.2%) Users that have less than 1 test interactions
4286.7s 519 EvaluatorHoldout: Processed 27047 (100.0%) in 27.20 sec. Users per second: 994
4287.2s 520 Unable to load Cython Compute_Similarity, reverting to Python
4299.4s 521 Similarity column 6969 (100.0%), 561.34 column/sec. Elapsed time 12.41 sec
4299.6s 522 EvaluatorHoldout: Ignoring 29 ( 0.1%) Users that have less than 1 test interactions
4327.0s 523 EvaluatorHoldout: Processed 27066 (100.0%) in 27.43 sec. Users per second: 987
4327.5s 524 Unable to load Cython Compute_Similarity, reverting to Python
4340.2s 525 Similarity column 6969 (100.0%), 538.37 column/sec. Elapsed time 12.94 sec
4340.4s 526 EvaluatorHoldout: Ignoring 42 ( 0.2%) Users that have less than 1 test interactions
4367.7s 527 EvaluatorHoldout: Processed 27053 (100.0%) in 27.37 sec. Users per second: 988
4368.2s 528 Unable to load Cython Compute_Similarity, reverting to Python
4381.3s 529 Similarity column 6969 (100.0%), 524.83 column/sec. Elapsed time 13.28 sec
4381.5s 530 EvaluatorHoldout: Ignoring 38 ( 0.1%) Users that have less than 1 test interactions
4409.2s 531 EvaluatorHoldout: Processed 27057 (100.0%) in 27.82 sec. Users per second: 973
4409.7s 532 Unable to load Cython Compute_Similarity, reverting to Python
4422.2s 533 Similarity column 6969 (100.0%), 550.71 column/sec. Elapsed time 12.65 sec
4422.4s 534 EvaluatorHoldout: Ignoring 32 ( 0.1%) Users that have less than 1 test interactions
4449.5s 535 EvaluatorHoldout: Processed 27063 (100.0%) in 27.24 sec. Users per second: 993
4449.5s 536 [I 2025-12-06 22:32:00,430] Trial 20 finished with value: 0.21484531835515389 and parameters: {'topK': 180, 'shrink': 599, 'feature_weighting': 'TF-IDF'}. Best is trial 10 with value: 0.21699762942341766.
4449.5s 537 
4449.5s 538 [I 2025-12-06 22:32:00,430] Trial 20 finished with value: 0.21484531835515389 and parameters: {'topK': 180, 'shrink': 599, 'feature_weighting': 'TF-IDF'}. Best is trial 10 with value: 0.21699762942341766.
4449.7s 539 [0.21514703210495603, 0.21479460754493857, 0.21399434716782811, 0.2154125123980286, 0.21487809256001794]
4450.0s 540 Unable to load Cython Compute_Similarity, reverting to Python
4461.8s 541 Similarity column 6969 (100.0%), 581.70 column/sec. Elapsed time 11.98 sec
4462.0s 542 EvaluatorHoldout: Ignoring 48 ( 0.2%) Users that have less than 1 test interactions
4483.4s 543 EvaluatorHoldout: Processed 27047 (100.0%) in 21.50 sec. Users per second: 1258
4483.9s 544 Unable to load Cython Compute_Similarity, reverting to Python
4495.5s 545 Similarity column 6969 (100.0%), 587.21 column/sec. Elapsed time 11.87 sec
4495.7s 546 EvaluatorHoldout: Ignoring 29 ( 0.1%) Users that have less than 1 test interactions
4517.3s 547 EvaluatorHoldout: Processed 27066 (100.0%) in 21.68 sec. Users per second: 1248
4517.8s 548 Unable to load Cython Compute_Similarity, reverting to Python
4529.3s 549 Similarity column 6969 (100.0%), 594.34 column/sec. Elapsed time 11.73 sec
4529.5s 550 EvaluatorHoldout: Ignoring 42 ( 0.2%) Users that have less than 1 test interactions
4550.4s 551 EvaluatorHoldout: Processed 27053 (100.0%) in 21.02 sec. Users per second: 1287
4550.9s 552 Unable to load Cython Compute_Similarity, reverting to Python
4561.8s 553 Similarity column 6969 (100.0%), 628.60 column/sec. Elapsed time 11.09 sec
4562.0s 554 EvaluatorHoldout: Ignoring 38 ( 0.1%) Users that have less than 1 test interactions
4583.1s 555 EvaluatorHoldout: Processed 27057 (100.0%) in 21.21 sec. Users per second: 1276
4583.6s 556 Unable to load Cython Compute_Similarity, reverting to Python
4594.3s 557 Similarity column 6969 (100.0%), 641.51 column/sec. Elapsed time 10.86 sec
4594.5s 558 EvaluatorHoldout: Ignoring 32 ( 0.1%) Users that have less than 1 test interactions
4615.3s 559 EvaluatorHoldout: Processed 27063 (100.0%) in 21.00 sec. Users per second: 1289
4615.3s 560 [I 2025-12-06 22:34:46,272] Trial 21 finished with value: 0.2166561325631947 and parameters: {'topK': 78, 'shrink': 96, 'feature_weighting': 'TF-IDF'}. Best is trial 10 with value: 0.21699762942341766.
4615.3s 561 
4615.3s 562 [I 2025-12-06 22:34:46,272] Trial 21 finished with value: 0.2166561325631947 and parameters: {'topK': 78, 'shrink': 96, 'feature_weighting': 'TF-IDF'}. Best is trial 10 with value: 0.21699762942341766.
4615.5s 563 [0.21725422825032073, 0.21611824962194187, 0.21646836803377048, 0.21728693999415752, 0.2161528769157829]
4615.8s 564 Unable to load Cython Compute_Similarity, reverting to Python
4627.2s 565 Similarity column 6969 (100.0%), 602.18 column/sec. Elapsed time 11.57 sec
4627.4s 566 EvaluatorHoldout: Ignoring 48 ( 0.2%) Users that have less than 1 test interactions
4648.9s 567 EvaluatorHoldout: Processed 27047 (100.0%) in 21.64 sec. Users per second: 1250
4649.4s 568 Unable to load Cython Compute_Similarity, reverting to Python
4660.7s 569 Similarity column 6969 (100.0%), 606.31 column/sec. Elapsed time 11.49 sec
4660.9s 570 EvaluatorHoldout: Ignoring 29 ( 0.1%) Users that have less than 1 test interactions
4682.9s 571 EvaluatorHoldout: Processed 27066 (100.0%) in 22.06 sec. Users per second: 1227
4683.4s 572 Unable to load Cython Compute_Similarity, reverting to Python
4694.4s 573 Similarity column 6969 (100.0%), 620.99 column/sec. Elapsed time 11.22 sec
4694.6s 574 EvaluatorHoldout: Ignoring 42 ( 0.2%) Users that have less than 1 test interactions
4716.2s 575 EvaluatorHoldout: Processed 27053 (100.0%) in 21.75 sec. Users per second: 1244
4716.7s 576 Unable to load Cython Compute_Similarity, reverting to Python
4727.6s 577 Similarity column 6969 (100.0%), 629.87 column/sec. Elapsed time 11.06 sec
4727.8s 578 EvaluatorHoldout: Ignoring 38 ( 0.1%) Users that have less than 1 test interactions
4749.5s 579 EvaluatorHoldout: Processed 27057 (100.0%) in 21.86 sec. Users per second: 1238
4750.0s 580 Unable to load Cython Compute_Similarity, reverting to Python
4761.5s 581 Similarity column 6969 (100.0%), 597.30 column/sec. Elapsed time 11.67 sec
4761.7s 582 EvaluatorHoldout: Ignoring 32 ( 0.1%) Users that have less than 1 test interactions
4783.2s 583 EvaluatorHoldout: Processed 27063 (100.0%) in 21.69 sec. Users per second: 1248
4783.2s 584 [I 2025-12-06 22:37:34,184] Trial 22 finished with value: 0.21690477896541255 and parameters: {'topK': 99, 'shrink': 88, 'feature_weighting': 'TF-IDF'}. Best is trial 10 with value: 0.21699762942341766.
4783.2s 585 
4783.2s 586 [I 2025-12-06 22:37:34,184] Trial 22 finished with value: 0.21690477896541255 and parameters: {'topK': 99, 'shrink': 88, 'feature_weighting': 'TF-IDF'}. Best is trial 10 with value: 0.21699762942341766.
4783.4s 587 [0.21736706836650557, 0.21700263923328317, 0.2165978182180032, 0.21763996047056752, 0.21591640853870336]
4783.7s 588 Unable to load Cython Compute_Similarity, reverting to Python
4794.5s 589 Similarity column 6969 (100.0%), 636.43 column/sec. Elapsed time 10.95 sec
4794.7s 590 EvaluatorHoldout: Ignoring 48 ( 0.2%) Users that have less than 1 test interactions
4814.6s 591 EvaluatorHoldout: Processed 27047 (100.0%) in 20.02 sec. Users per second: 1351
4815.1s 592 Unable to load Cython Compute_Similarity, reverting to Python
4826.0s 593 Similarity column 6969 (100.0%), 630.52 column/sec. Elapsed time 11.05 sec
4826.2s 594 EvaluatorHoldout: Ignoring 29 ( 0.1%) Users that have less than 1 test interactions
4846.3s 595 EvaluatorHoldout: Processed 27066 (100.0%) in 20.26 sec. Users per second: 1336
4846.8s 596 Unable to load Cython Compute_Similarity, reverting to Python
4857.5s 597 Similarity column 6969 (100.0%), 638.28 column/sec. Elapsed time 10.92 sec
4857.7s 598 EvaluatorHoldout: Ignoring 42 ( 0.2%) Users that have less than 1 test interactions
4877.7s 599 EvaluatorHoldout: Processed 27053 (100.0%) in 20.11 sec. Users per second: 1345
4878.2s 600 Unable to load Cython Compute_Similarity, reverting to Python
4888.9s 601 Similarity column 6969 (100.0%), 635.91 column/sec. Elapsed time 10.96 sec
4889.1s 602 EvaluatorHoldout: Ignoring 38 ( 0.1%) Users that have less than 1 test interactions
4909.0s 603 EvaluatorHoldout: Processed 27057 (100.0%) in 20.00 sec. Users per second: 1353
4909.5s 604 Unable to load Cython Compute_Similarity, reverting to Python
4920.5s 605 Similarity column 6969 (100.0%), 623.90 column/sec. Elapsed time 11.17 sec
4920.7s 606 EvaluatorHoldout: Ignoring 32 ( 0.1%) Users that have less than 1 test interactions
4940.9s 607 EvaluatorHoldout: Processed 27063 (100.0%) in 20.38 sec. Users per second: 1328
4940.9s 608 [I 2025-12-06 22:40:11,869] Trial 23 finished with value: 0.21678496464541502 and parameters: {'topK': 54, 'shrink': 244, 'feature_weighting': 'TF-IDF'}. Best is trial 10 with value: 0.21699762942341766.
4940.9s 609 
4940.9s 610 [I 2025-12-06 22:40:11,869] Trial 23 finished with value: 0.21678496464541502 and parameters: {'topK': 54, 'shrink': 244, 'feature_weighting': 'TF-IDF'}. Best is trial 10 with value: 0.21699762942341766.
4941.1s 611 [0.2177276272977761, 0.21622723684081602, 0.21612490007036547, 0.21762684886335792, 0.21621821015475967]
4941.4s 612 Unable to load Cython Compute_Similarity, reverting to Python
4953.7s 613 Similarity column 6969 (100.0%), 561.10 column/sec. Elapsed time 12.42 sec
4953.9s 614 EvaluatorHoldout: Ignoring 48 ( 0.2%) Users that have less than 1 test interactions
4978.3s 615 EvaluatorHoldout: Processed 27047 (100.0%) in 24.56 sec. Users per second: 1101
4978.8s 616 Unable to load Cython Compute_Similarity, reverting to Python
4990.9s 617 Similarity column 6969 (100.0%), 568.99 column/sec. Elapsed time 12.25 sec
4991.1s 618 EvaluatorHoldout: Ignoring 29 ( 0.1%) Users that have less than 1 test interactions
5015.8s 619 EvaluatorHoldout: Processed 27066 (100.0%) in 24.82 sec. Users per second: 1091
5016.3s 620 Unable to load Cython Compute_Similarity, reverting to Python
5028.3s 621 Similarity column 6969 (100.0%), 572.80 column/sec. Elapsed time 12.17 sec
5028.5s 622 EvaluatorHoldout: Ignoring 42 ( 0.2%) Users that have less than 1 test interactions
5052.9s 623 EvaluatorHoldout: Processed 27053 (100.0%) in 24.56 sec. Users per second: 1102
5053.4s 624 Unable to load Cython Compute_Similarity, reverting to Python
5065.6s 625 Similarity column 6969 (100.0%), 562.91 column/sec. Elapsed time 12.38 sec
5065.8s 626 EvaluatorHoldout: Ignoring 38 ( 0.1%) Users that have less than 1 test interactions
5089.9s 627 EvaluatorHoldout: Processed 27057 (100.0%) in 24.23 sec. Users per second: 1117
5090.4s 628 Unable to load Cython Compute_Similarity, reverting to Python
5102.5s 629 Similarity column 6969 (100.0%), 566.78 column/sec. Elapsed time 12.30 sec
5102.7s 630 EvaluatorHoldout: Ignoring 32 ( 0.1%) Users that have less than 1 test interactions
5127.9s 631 EvaluatorHoldout: Processed 27063 (100.0%) in 25.31 sec. Users per second: 1069
5127.9s 632 [I 2025-12-06 22:43:18,858] Trial 24 finished with value: 0.21542163166574305 and parameters: {'topK': 183, 'shrink': 58, 'feature_weighting': 'TF-IDF'}. Best is trial 10 with value: 0.21699762942341766.
5127.9s 633 
5127.9s 634 [I 2025-12-06 22:43:18,858] Trial 24 finished with value: 0.21542163166574305 and parameters: {'topK': 183, 'shrink': 58, 'feature_weighting': 'TF-IDF'}. Best is trial 10 with value: 0.21699762942341766.
5128.1s 635 [0.21578131022169508, 0.21537989564900178, 0.21456247202735684, 0.2158492178281836, 0.21553526260247788]
5128.4s 636 Unable to load Cython Compute_Similarity, reverting to Python
5140.1s 637 Similarity column 6969 (100.0%), 589.87 column/sec. Elapsed time 11.81 sec
5140.3s 638 EvaluatorHoldout: Ignoring 48 ( 0.2%) Users that have less than 1 test interactions
5162.4s 639 EvaluatorHoldout: Processed 27047 (100.0%) in 22.25 sec. Users per second: 1216
5162.9s 640 Unable to load Cython Compute_Similarity, reverting to Python
5174.3s 641 Similarity column 6969 (100.0%), 598.60 column/sec. Elapsed time 11.64 sec
5174.5s 642 EvaluatorHoldout: Ignoring 29 ( 0.1%) Users that have less than 1 test interactions
5197.2s 643 EvaluatorHoldout: Processed 27066 (100.0%) in 22.73 sec. Users per second: 1191
5197.7s 644 Unable to load Cython Compute_Similarity, reverting to Python
5209.6s 645 Similarity column 6969 (100.0%), 572.19 column/sec. Elapsed time 12.18 sec
5209.8s 646 EvaluatorHoldout: Ignoring 42 ( 0.2%) Users that have less than 1 test interactions
5233.7s 647 EvaluatorHoldout: Processed 27053 (100.0%) in 23.99 sec. Users per second: 1128
5234.2s 648 Unable to load Cython Compute_Similarity, reverting to Python
5247.3s 649 Similarity column 6969 (100.0%), 524.64 column/sec. Elapsed time 13.28 sec
5247.5s 650 EvaluatorHoldout: Ignoring 38 ( 0.1%) Users that have less than 1 test interactions
5271.2s 651 EvaluatorHoldout: Processed 27057 (100.0%) in 23.80 sec. Users per second: 1137
5271.7s 652 Unable to load Cython Compute_Similarity, reverting to Python
5284.0s 653 Similarity column 6969 (100.0%), 558.05 column/sec. Elapsed time 12.49 sec
5284.2s 654 EvaluatorHoldout: Ignoring 32 ( 0.1%) Users that have less than 1 test interactions
5307.7s 655 EvaluatorHoldout: Processed 27063 (100.0%) in 23.53 sec. Users per second: 1150
5307.7s 656 [I 2025-12-06 22:46:18,583] Trial 25 finished with value: 0.21667540771569618 and parameters: {'topK': 110, 'shrink': 131, 'feature_weighting': 'TF-IDF'}. Best is trial 10 with value: 0.21699762942341766.
5307.7s 657 
5307.7s 658 [I 2025-12-06 22:46:18,583] Trial 25 finished with value: 0.21667540771569618 and parameters: {'topK': 110, 'shrink': 131, 'feature_weighting': 'TF-IDF'}. Best is trial 10 with value: 0.21699762942341766.
5307.8s 659 [0.21685263777901037, 0.21662436059089482, 0.2161233732574752, 0.21755209635765932, 0.2162245705934411]
5308.2s 660 Unable to load Cython Compute_Similarity, reverting to Python
5320.8s 661 Similarity column 6969 (100.0%), 543.71 column/sec. Elapsed time 12.82 sec
5321.0s 662 EvaluatorHoldout: Ignoring 48 ( 0.2%) Users that have less than 1 test interactions
5345.9s 663 EvaluatorHoldout: Processed 27047 (100.0%) in 25.05 sec. Users per second: 1080
5346.4s 664 Unable to load Cython Compute_Similarity, reverting to Python
5360.0s 665 Similarity column 6969 (100.0%), 507.07 column/sec. Elapsed time 13.74 sec
5360.2s 666 EvaluatorHoldout: Ignoring 29 ( 0.1%) Users that have less than 1 test interactions
5385.2s 667 EvaluatorHoldout: Processed 27066 (100.0%) in 25.12 sec. Users per second: 1078
5385.7s 668 Unable to load Cython Compute_Similarity, reverting to Python
5398.1s 669 Similarity column 6969 (100.0%), 552.11 column/sec. Elapsed time 12.62 sec
5398.3s 670 EvaluatorHoldout: Ignoring 42 ( 0.2%) Users that have less than 1 test interactions
5423.0s 671 EvaluatorHoldout: Processed 27053 (100.0%) in 24.79 sec. Users per second: 1091
5423.5s 672 Unable to load Cython Compute_Similarity, reverting to Python
5436.2s 673 Similarity column 6969 (100.0%), 539.30 column/sec. Elapsed time 12.92 sec
5436.4s 674 EvaluatorHoldout: Ignoring 38 ( 0.1%) Users that have less than 1 test interactions
5460.8s 675 EvaluatorHoldout: Processed 27057 (100.0%) in 24.45 sec. Users per second: 1107
5461.3s 676 Unable to load Cython Compute_Similarity, reverting to Python
5474.6s 677 Similarity column 6969 (100.0%), 516.24 column/sec. Elapsed time 13.50 sec
5474.8s 678 EvaluatorHoldout: Ignoring 32 ( 0.1%) Users that have less than 1 test interactions
5499.8s 679 EvaluatorHoldout: Processed 27063 (100.0%) in 25.07 sec. Users per second: 1080
5499.8s 680 [I 2025-12-06 22:49:30,714] Trial 26 finished with value: 0.21544605980792855 and parameters: {'topK': 179, 'shrink': 2, 'feature_weighting': 'TF-IDF'}. Best is trial 10 with value: 0.21699762942341766.
5499.8s 681 
5499.8s 682 [I 2025-12-06 22:49:30,714] Trial 26 finished with value: 0.21544605980792855 and parameters: {'topK': 179, 'shrink': 2, 'feature_weighting': 'TF-IDF'}. Best is trial 10 with value: 0.21699762942341766.
5499.9s 683 [0.21602109791375637, 0.2154504121354969, 0.21460074667864434, 0.21618921591159396, 0.21496882640015127]
5500.3s 684 Unable to load Cython Compute_Similarity, reverting to Python
5512.3s 685 Similarity column 6969 (100.0%), 571.45 column/sec. Elapsed time 12.20 sec
5512.5s 686 EvaluatorHoldout: Ignoring 48 ( 0.2%) Users that have less than 1 test interactions
5535.7s 687 EvaluatorHoldout: Processed 27047 (100.0%) in 23.34 sec. Users per second: 1159
5536.2s 688 Unable to load Cython Compute_Similarity, reverting to Python
5548.0s 689 Similarity column 6969 (100.0%), 582.53 column/sec. Elapsed time 11.96 sec
5548.2s 690 EvaluatorHoldout: Ignoring 29 ( 0.1%) Users that have less than 1 test interactions
5571.7s 691 EvaluatorHoldout: Processed 27066 (100.0%) in 23.64 sec. Users per second: 1145
5572.2s 692 Unable to load Cython Compute_Similarity, reverting to Python
5584.2s 693 Similarity column 6969 (100.0%), 573.62 column/sec. Elapsed time 12.15 sec
5584.4s 694 EvaluatorHoldout: Ignoring 42 ( 0.2%) Users that have less than 1 test interactions
5608.0s 695 EvaluatorHoldout: Processed 27053 (100.0%) in 23.65 sec. Users per second: 1144
5608.4s 696 Unable to load Cython Compute_Similarity, reverting to Python
5620.2s 697 Similarity column 6969 (100.0%), 581.80 column/sec. Elapsed time 11.98 sec
5620.4s 698 EvaluatorHoldout: Ignoring 38 ( 0.1%) Users that have less than 1 test interactions
5644.2s 699 EvaluatorHoldout: Processed 27057 (100.0%) in 23.95 sec. Users per second: 1130
5644.7s 700 Unable to load Cython Compute_Similarity, reverting to Python
5656.8s 701 Similarity column 6969 (100.0%), 567.60 column/sec. Elapsed time 12.28 sec
5657.0s 702 EvaluatorHoldout: Ignoring 32 ( 0.1%) Users that have less than 1 test interactions
5680.3s 703 EvaluatorHoldout: Processed 27063 (100.0%) in 23.36 sec. Users per second: 1158
5680.3s 704 [I 2025-12-06 22:52:31,213] Trial 27 finished with value: 0.21652522562447088 and parameters: {'topK': 109, 'shrink': 246, 'feature_weighting': 'TF-IDF'}. Best is trial 10 with value: 0.21699762942341766.
5680.3s 705 
