18834.8s 2434 [I 2025-12-07 02:31:45,626] Trial 99 finished with value: 0.21686664162593114 and parameters: {'topK': 104, 'shrink': 51, 'feature_weighting': 'TF-IDF'}. Best is trial 54 with value: 0.21706238132685302.
18834.8s 2435 [0.21731924084713294, 0.21698251287756698, 0.2165296486087799, 0.217238809886374, 0.21626299590980194]
18843.5s 2436 Traceback (most recent call last):
18843.5s 2437 File "<string>", line 1, in <module>
18843.5s 2438 File "/usr/local/lib/python3.11/dist-packages/papermill/execute.py", line 131, in execute_notebook
18843.5s 2439 raise_for_execution_errors(nb, output_path)
18843.5s 2440 File "/usr/local/lib/python3.11/dist-packages/papermill/execute.py", line 251, in raise_for_execution_errors
18843.5s 2441 raise error
18843.5s 2442 papermill.exceptions.PapermillExecutionError:
18843.5s 2443 ---------------------------------------------------------------------------
18843.5s 2444 Exception encountered at "In [3]":
18843.5s 2445 ---------------------------------------------------------------------------
18843.5s 2446 AttributeError                            Traceback (most recent call last)
18843.5s 2447 AttributeError: 'MessageFactory' object has no attribute 'GetPrototype'
18843.5s 2448 
18848.2s 2449 /usr/local/lib/python3.11/dist-packages/traitlets/traitlets.py:2915: FutureWarning: --Exporter.preprocessors=["remove_papermill_header.RemovePapermillHeader"] for containers is deprecated in traitlets 5.0. You can pass `--Exporter.preprocessors item` ... multiple times to add items to a list.
18848.2s 2450 warn(
18848.3s 2451 [NbConvertApp] Converting notebook __notebook__.ipynb to notebook
18849.2s 2452 [NbConvertApp] Writing 277330 bytes to __notebook__.ipynb
18852.9s 2453 /usr/local/lib/python3.11/dist-packages/traitlets/traitlets.py:2915: FutureWarning: --Exporter.preprocessors=["nbconvert.preprocessors.ExtractOutputPreprocessor"] for containers is deprecated in traitlets 5.0. You can pass `--Exporter.preprocessors item` ... multiple times to add items to a list.
18852.9s 2454 warn(
18853.0s 2455 [NbConvertApp] Converting notebook __notebook__.ipynb to html
18854.2s 2456 [NbConvertApp] Writing 552102 bytes to __results__.html