7591.8s 1138 [I 2025-12-07 11:00:27,262] Trial 45 finished with value: 0.19894230909350646 and parameters: {'similarity': 'asymmetric', 'topK': 307, 'shrink': 434, 'asymmetric_alpha': 0.20325740926329483}. Best is trial 28 with value: 0.23872565913262506.
7591.9s 1139 [0.19890793473559407, 0.19899032039048642, 0.19916159246167112, 0.19786684077383362, 0.1997848571059472]
7592.2s 1140 Unable to load Cython Compute_Similarity, reverting to Python
7601.0s 1141 Similarity column 6969 (100.0%), 777.69 column/sec. Elapsed time 8.96 sec
7601.2s 1142 EvaluatorHoldout: Ignoring 33 ( 0.1%) Users that have less than 1 test interactions
7618.1s 1143 EvaluatorHoldout: Processed 27062 (100.0%) in 17.04 sec. Users per second: 1588
7618.6s 1144 Unable to load Cython Compute_Similarity, reverting to Python
7627.5s 1145 Similarity column 6969 (100.0%), 769.08 column/sec. Elapsed time 9.06 sec
7627.6s 1146 EvaluatorHoldout: Ignoring 28 ( 0.1%) Users that have less than 1 test interactions
7644.7s 1147 EvaluatorHoldout: Processed 27067 (100.0%) in 17.19 sec. Users per second: 1575
7645.1s 1148 Unable to load Cython Compute_Similarity, reverting to Python
7653.8s 1149 Similarity column 6969 (100.0%), 786.13 column/sec. Elapsed time 8.86 sec
7654.0s 1150 EvaluatorHoldout: Ignoring 40 ( 0.1%) Users that have less than 1 test interactions
7671.2s 1151 EvaluatorHoldout: Processed 27055 (100.0%) in 17.34 sec. Users per second: 1560
7671.7s 1152 Unable to load Cython Compute_Similarity, reverting to Python
7680.5s 1153 Similarity column 6969 (100.0%), 773.37 column/sec. Elapsed time 9.01 sec
7680.7s 1154 EvaluatorHoldout: Ignoring 21 ( 0.1%) Users that have less than 1 test interactions
7697.9s 1155 EvaluatorHoldout: Processed 27074 (100.0%) in 17.39 sec. Users per second: 1557
7698.4s 1156 Unable to load Cython Compute_Similarity, reverting to Python
7707.7s 1157 Similarity column 6969 (100.0%), 739.11 column/sec. Elapsed time 9.43 sec
7707.8s 1158 EvaluatorHoldout: Ignoring 29 ( 0.1%) Users that have less than 1 test interactions
7725.0s 1159 EvaluatorHoldout: Processed 27066 (100.0%) in 17.32 sec. Users per second: 1563
7725.0s 1160 [I 2025-12-07 11:02:40,504] Trial 46 finished with value: 0.19873995477810738 and parameters: {'similarity': 'dice', 'topK': 56, 'shrink': 935}. Best is trial 28 with value: 0.23872565913262506.
7725.0s 1161 
7725.0s 1162 [I 2025-12-07 11:02:40,504] Trial 46 finished with value: 0.19873995477810738 and parameters: {'similarity': 'dice', 'topK': 56, 'shrink': 935}. Best is trial 28 with value: 0.23872565913262506.
7725.2s 1163 [0.1976403147658346, 0.19928984127509924, 0.1992235313539227, 0.19850579952013342, 0.19904028697554696]
7725.5s 1164 Unable to load Cython Compute_Similarity, reverting to Python
7736.0s 1165 Similarity column 6969 (100.0%), 651.87 column/sec. Elapsed time 10.69 sec
7736.2s 1166 EvaluatorHoldout: Ignoring 33 ( 0.1%) Users that have less than 1 test interactions
7756.6s 1167 EvaluatorHoldout: Processed 27062 (100.0%) in 20.49 sec. Users per second: 1321
7757.0s 1168 Unable to load Cython Compute_Similarity, reverting to Python
7767.5s 1169 Similarity column 6969 (100.0%), 651.47 column/sec. Elapsed time 10.70 sec
7767.7s 1170 EvaluatorHoldout: Ignoring 28 ( 0.1%) Users that have less than 1 test interactions
7788.4s 1171 EvaluatorHoldout: Processed 27067 (100.0%) in 20.72 sec. Users per second: 1306
7788.8s 1172 Unable to load Cython Compute_Similarity, reverting to Python
7799.5s 1173 Similarity column 6969 (100.0%), 640.56 column/sec. Elapsed time 10.88 sec
7799.7s 1174 EvaluatorHoldout: Ignoring 40 ( 0.1%) Users that have less than 1 test interactions
7820.1s 1175 EvaluatorHoldout: Processed 27055 (100.0%) in 20.54 sec. Users per second: 1317
7820.6s 1176 Unable to load Cython Compute_Similarity, reverting to Python
7830.9s 1177 Similarity column 6969 (100.0%), 664.65 column/sec. Elapsed time 10.49 sec
7831.1s 1178 EvaluatorHoldout: Ignoring 21 ( 0.1%) Users that have less than 1 test interactions
7851.7s 1179 EvaluatorHoldout: Processed 27074 (100.0%) in 20.72 sec. Users per second: 1307
7852.1s 1180 Unable to load Cython Compute_Similarity, reverting to Python
7862.6s 1181 Similarity column 6969 (100.0%), 651.86 column/sec. Elapsed time 10.69 sec
7862.8s 1182 EvaluatorHoldout: Ignoring 29 ( 0.1%) Users that have less than 1 test interactions
7883.3s 1183 EvaluatorHoldout: Processed 27066 (100.0%) in 20.59 sec. Users per second: 1315
7883.3s 1184 [I 2025-12-07 11:05:18,803] Trial 47 finished with value: 0.1986405218279819 and parameters: {'similarity': 'jaccard', 'topK': 215, 'shrink': 481}. Best is trial 28 with value: 0.23872565913262506.
7883.3s 1185 
7883.3s 1186 [I 2025-12-07 11:05:18,803] Trial 47 finished with value: 0.1986405218279819 and parameters: {'similarity': 'jaccard', 'topK': 215, 'shrink': 481}. Best is trial 28 with value: 0.23872565913262506.
7883.5s 1187 [0.19816925701669127, 0.19947239417926363, 0.19901424553880073, 0.19743113872338353, 0.19911557368177032]
7883.8s 1188 Unable to load Cython Compute_Similarity, reverting to Python
7892.4s 1189 Similarity column 6969 (100.0%), 788.17 column/sec. Elapsed time 8.84 sec
7892.6s 1190 EvaluatorHoldout: Ignoring 33 ( 0.1%) Users that have less than 1 test interactions
7906.5s 1191 EvaluatorHoldout: Processed 27062 (100.0%) in 14.05 sec. Users per second: 1926
7907.0s 1192 Unable to load Cython Compute_Similarity, reverting to Python
7915.6s 1193 Similarity column 6969 (100.0%), 799.78 column/sec. Elapsed time 8.71 sec
7915.7s 1194 EvaluatorHoldout: Ignoring 28 ( 0.1%) Users that have less than 1 test interactions
7929.7s 1195 EvaluatorHoldout: Processed 27067 (100.0%) in 14.17 sec. Users per second: 1911
7930.2s 1196 Unable to load Cython Compute_Similarity, reverting to Python
7938.8s 1197 Similarity column 6969 (100.0%), 795.99 column/sec. Elapsed time 8.76 sec
7939.0s 1198 EvaluatorHoldout: Ignoring 40 ( 0.1%) Users that have less than 1 test interactions
7953.0s 1199 EvaluatorHoldout: Processed 27055 (100.0%) in 14.20 sec. Users per second: 1906
7953.5s 1200 Unable to load Cython Compute_Similarity, reverting to Python
7962.1s 1201 Similarity column 6969 (100.0%), 794.39 column/sec. Elapsed time 8.77 sec
7962.3s 1202 EvaluatorHoldout: Ignoring 21 ( 0.1%) Users that have less than 1 test interactions
7976.3s 1203 EvaluatorHoldout: Processed 27074 (100.0%) in 14.22 sec. Users per second: 1904
7976.8s 1204 Unable to load Cython Compute_Similarity, reverting to Python
7985.4s 1205 Similarity column 6969 (100.0%), 791.85 column/sec. Elapsed time 8.80 sec
7985.6s 1206 EvaluatorHoldout: Ignoring 29 ( 0.1%) Users that have less than 1 test interactions
7999.5s 1207 EvaluatorHoldout: Processed 27066 (100.0%) in 14.13 sec. Users per second: 1916
7999.6s 1208 [I 2025-12-07 11:07:15,071] Trial 48 finished with value: 0.22124800457267013 and parameters: {'similarity': 'asymmetric', 'topK': 7, 'shrink': 559, 'asymmetric_alpha': 0.4641384500439806}. Best is trial 28 with value: 0.23872565913262506.
7999.6s 1209 
7999.6s 1210 [I 2025-12-07 11:07:15,071] Trial 48 finished with value: 0.22124800457267013 and parameters: {'similarity': 'asymmetric', 'topK': 7, 'shrink': 559, 'asymmetric_alpha': 0.4641384500439806}. Best is trial 28 with value: 0.23872565913262506.
7999.7s 1211 [0.22122090945093095, 0.22141340177141652, 0.22242718262914765, 0.2201208080962429, 0.22105772091561265]
8000.0s 1212 Unable to load Cython Compute_Similarity, reverting to Python
8009.3s 1213 Similarity column 6969 (100.0%), 736.66 column/sec. Elapsed time 9.46 sec
8009.5s 1214 EvaluatorHoldout: Ignoring 33 ( 0.1%) Users that have less than 1 test interactions
8033.2s 1215 EvaluatorHoldout: Processed 27062 (100.0%) in 23.78 sec. Users per second: 1138
8033.6s 1216 Unable to load Cython Compute_Similarity, reverting to Python
8042.9s 1217 Similarity column 6969 (100.0%), 733.17 column/sec. Elapsed time 9.51 sec
8043.1s 1218 EvaluatorHoldout: Ignoring 28 ( 0.1%) Users that have less than 1 test interactions
8067.0s 1219 EvaluatorHoldout: Processed 27067 (100.0%) in 23.93 sec. Users per second: 1131
8067.4s 1220 Unable to load Cython Compute_Similarity, reverting to Python
8076.7s 1221 Similarity column 6969 (100.0%), 733.48 column/sec. Elapsed time 9.50 sec
8076.9s 1222 EvaluatorHoldout: Ignoring 40 ( 0.1%) Users that have less than 1 test interactions
8100.5s 1223 EvaluatorHoldout: Processed 27055 (100.0%) in 23.74 sec. Users per second: 1140
8101.0s 1224 Unable to load Cython Compute_Similarity, reverting to Python
8110.2s 1225 Similarity column 6969 (100.0%), 741.32 column/sec. Elapsed time 9.40 sec
8110.4s 1226 EvaluatorHoldout: Ignoring 21 ( 0.1%) Users that have less than 1 test interactions
8134.1s 1227 EvaluatorHoldout: Processed 27074 (100.0%) in 23.82 sec. Users per second: 1137
8134.5s 1228 Unable to load Cython Compute_Similarity, reverting to Python
8144.1s 1229 Similarity column 6969 (100.0%), 715.14 column/sec. Elapsed time 9.74 sec
8144.3s 1230 EvaluatorHoldout: Ignoring 29 ( 0.1%) Users that have less than 1 test interactions
8168.0s 1231 EvaluatorHoldout: Processed 27066 (100.0%) in 23.86 sec. Users per second: 1134
8168.0s 1232 [I 2025-12-07 11:10:03,506] Trial 49 finished with value: 0.03155768398542956 and parameters: {'similarity': 'asymmetric', 'topK': 114, 'shrink': 421, 'asymmetric_alpha': 1.1972106049763769}. Best is trial 28 with value: 0.23872565913262506.
8168.0s 1233 
8168.0s 1234 [I 2025-12-07 11:10:03,506] Trial 49 finished with value: 0.03155768398542956 and parameters: {'similarity': 'asymmetric', 'topK': 114, 'shrink': 421, 'asymmetric_alpha': 1.1972106049763769}. Best is trial 28 with value: 0.23872565913262506.
8168.2s 1235 [0.031627302151325434, 0.03227136600349919, 0.03152547289589997, 0.03129988084544155, 0.031064398030981683]
8168.5s 1236 Unable to load Cython Compute_Similarity, reverting to Python
8183.9s 1237 Similarity column 6969 (100.0%), 447.95 column/sec. Elapsed time 15.56 sec
8184.1s 1238 EvaluatorHoldout: Ignoring 33 ( 0.1%) Users that have less than 1 test interactions
8207.1s 1239 EvaluatorHoldout: Processed 27062 (100.0%) in 23.01 sec. Users per second: 1176
8207.5s 1240 Unable to load Cython Compute_Similarity, reverting to Python
8223.0s 1241 Similarity column 6969 (100.0%), 444.66 column/sec. Elapsed time 15.67 sec
8223.2s 1242 EvaluatorHoldout: Ignoring 28 ( 0.1%) Users that have less than 1 test interactions
8246.6s 1243 EvaluatorHoldout: Processed 27067 (100.0%) in 23.38 sec. Users per second: 1158
8247.1s 1244 Unable to load Cython Compute_Similarity, reverting to Python
8263.1s 1245 Similarity column 6969 (100.0%), 429.96 column/sec. Elapsed time 16.21 sec
8263.3s 1246 EvaluatorHoldout: Ignoring 40 ( 0.1%) Users that have less than 1 test interactions
8286.6s 1247 EvaluatorHoldout: Processed 27055 (100.0%) in 23.25 sec. Users per second: 1164
8287.0s 1248 Unable to load Cython Compute_Similarity, reverting to Python
8302.3s 1249 Similarity column 6969 (100.0%), 450.65 column/sec. Elapsed time 15.46 sec
8302.5s 1250 EvaluatorHoldout: Ignoring 21 ( 0.1%) Users that have less than 1 test interactions
8325.9s 1251 EvaluatorHoldout: Processed 27074 (100.0%) in 23.40 sec. Users per second: 1157
8326.3s 1252 Unable to load Cython Compute_Similarity, reverting to Python
8341.9s 1253 Similarity column 6969 (100.0%), 440.62 column/sec. Elapsed time 15.82 sec
8342.2s 1254 EvaluatorHoldout: Ignoring 29 ( 0.1%) Users that have less than 1 test interactions
8365.4s 1255 EvaluatorHoldout: Processed 27066 (100.0%) in 23.26 sec. Users per second: 1163
8365.4s 1256 [I 2025-12-07 11:13:20,911] Trial 50 finished with value: 0.18225026268280448 and parameters: {'similarity': 'asymmetric', 'topK': 823, 'shrink': 355, 'asymmetric_alpha': 0.17344259526383515}. Best is trial 28 with value: 0.23872565913262506.
8365.4s 1257 
8365.4s 1258 [I 2025-12-07 11:13:20,911] Trial 50 finished with value: 0.18225026268280448 and parameters: {'similarity': 'asymmetric', 'topK': 823, 'shrink': 355, 'asymmetric_alpha': 0.17344259526383515}. Best is trial 28 with value: 0.23872565913262506.
8365.6s 1259 [0.18209334877190342, 0.18229816551112382, 0.1819857288641523, 0.18173385836520292, 0.18314021190163987]
8365.9s 1260 Unable to load Cython Compute_Similarity, reverting to Python
8375.0s 1261 Similarity column 6969 (100.0%), 746.06 column/sec. Elapsed time 9.34 sec
8375.2s 1262 EvaluatorHoldout: Ignoring 33 ( 0.1%) Users that have less than 1 test interactions
8390.2s 1263 EvaluatorHoldout: Processed 27062 (100.0%) in 15.08 sec. Users per second: 1795
8390.6s 1264 Unable to load Cython Compute_Similarity, reverting to Python
8399.9s 1265 Similarity column 6969 (100.0%), 739.80 column/sec. Elapsed time 9.42 sec
8400.1s 1266 EvaluatorHoldout: Ignoring 28 ( 0.1%) Users that have less than 1 test interactions
8415.1s 1267 EvaluatorHoldout: Processed 27067 (100.0%) in 15.16 sec. Users per second: 1785
8415.6s 1268 Unable to load Cython Compute_Similarity, reverting to Python
8424.7s 1269 Similarity column 6969 (100.0%), 747.13 column/sec. Elapsed time 9.33 sec
8424.9s 1270 EvaluatorHoldout: Ignoring 40 ( 0.1%) Users that have less than 1 test interactions
8440.0s 1271 EvaluatorHoldout: Processed 27055 (100.0%) in 15.17 sec. Users per second: 1783
8440.4s 1272 Unable to load Cython Compute_Similarity, reverting to Python
8449.9s 1273 Similarity column 6969 (100.0%), 720.77 column/sec. Elapsed time 9.67 sec
8450.1s 1274 EvaluatorHoldout: Ignoring 21 ( 0.1%) Users that have less than 1 test interactions
8465.0s 1275 EvaluatorHoldout: Processed 27074 (100.0%) in 15.07 sec. Users per second: 1796
8465.5s 1276 Unable to load Cython Compute_Similarity, reverting to Python
8474.6s 1277 Similarity column 6969 (100.0%), 748.68 column/sec. Elapsed time 9.31 sec
8474.8s 1278 EvaluatorHoldout: Ignoring 29 ( 0.1%) Users that have less than 1 test interactions
8490.0s 1279 EvaluatorHoldout: Processed 27066 (100.0%) in 15.35 sec. Users per second: 1764
8490.0s 1280 [I 2025-12-07 11:15:25,484] Trial 51 finished with value: 0.2349886099581429 and parameters: {'similarity': 'asymmetric', 'topK': 90, 'shrink': 461, 'asymmetric_alpha': 0.05858929727947799}. Best is trial 28 with value: 0.23872565913262506.
8490.0s 1281 
8490.0s 1282 [I 2025-12-07 11:15:25,484] Trial 51 finished with value: 0.2349886099581429 and parameters: {'similarity': 'asymmetric', 'topK': 90, 'shrink': 461, 'asymmetric_alpha': 0.05858929727947799}. Best is trial 28 with value: 0.23872565913262506.
8490.2s 1283 [0.23543058617978138, 0.2344923302801078, 0.23519768158529558, 0.23406427395473928, 0.23575817779079053]
8490.5s 1284 Unable to load Cython Compute_Similarity, reverting to Python
8499.6s 1285 Similarity column 6969 (100.0%), 748.25 column/sec. Elapsed time 9.31 sec
8499.8s 1286 EvaluatorHoldout: Ignoring 33 ( 0.1%) Users that have less than 1 test interactions
8514.7s 1287 EvaluatorHoldout: Processed 27062 (100.0%) in 14.99 sec. Users per second: 1805
8515.1s 1288 Unable to load Cython Compute_Similarity, reverting to Python
8524.7s 1289 Similarity column 6969 (100.0%), 710.35 column/sec. Elapsed time 9.81 sec
8524.9s 1290 EvaluatorHoldout: Ignoring 28 ( 0.1%) Users that have less than 1 test interactions
8539.7s 1291 EvaluatorHoldout: Processed 27067 (100.0%) in 14.98 sec. Users per second: 1807
8540.2s 1292 Unable to load Cython Compute_Similarity, reverting to Python
8550.4s 1293 Similarity column 6969 (100.0%), 678.82 column/sec. Elapsed time 10.27 sec
8550.5s 1294 EvaluatorHoldout: Ignoring 40 ( 0.1%) Users that have less than 1 test interactions
8565.4s 1295 EvaluatorHoldout: Processed 27055 (100.0%) in 15.05 sec. Users per second: 1798
8565.9s 1296 Unable to load Cython Compute_Similarity, reverting to Python
8575.9s 1297 Similarity column 6969 (100.0%), 680.51 column/sec. Elapsed time 10.24 sec
8576.1s 1298 EvaluatorHoldout: Ignoring 21 ( 0.1%) Users that have less than 1 test interactions
8591.2s 1299 EvaluatorHoldout: Processed 27074 (100.0%) in 15.13 sec. Users per second: 1789
8591.6s 1300 Unable to load Cython Compute_Similarity, reverting to Python
8601.2s 1301 Similarity column 6969 (100.0%), 708.49 column/sec. Elapsed time 9.84 sec
8601.4s 1302 EvaluatorHoldout: Ignoring 29 ( 0.1%) Users that have less than 1 test interactions
8616.3s 1303 EvaluatorHoldout: Processed 27066 (100.0%) in 15.06 sec. Users per second: 1798
8616.3s 1304 [I 2025-12-07 11:17:31,846] Trial 52 finished with value: 0.23209639642805963 and parameters: {'similarity': 'asymmetric', 'topK': 82, 'shrink': 620, 'asymmetric_alpha': 0.004666413928014531}. Best is trial 28 with value: 0.23872565913262506.
8616.3s 1305 
8616.3s 1306 [I 2025-12-07 11:17:31,846] Trial 52 finished with value: 0.23209639642805963 and parameters: {'similarity': 'asymmetric', 'topK': 82, 'shrink': 620, 'asymmetric_alpha': 0.004666413928014531}. Best is trial 28 with value: 0.23872565913262506.
8616.5s 1307 [0.23233079733284545, 0.23153683046238838, 0.23326123023316958, 0.23078946825187283, 0.23256365586002187]
8616.8s 1308 Unable to load Cython Compute_Similarity, reverting to Python
8626.8s 1309 Similarity column 6969 (100.0%), 690.15 column/sec. Elapsed time 10.10 sec
8626.9s 1310 EvaluatorHoldout: Ignoring 33 ( 0.1%) Users that have less than 1 test interactions
8643.4s 1311 EvaluatorHoldout: Processed 27062 (100.0%) in 16.67 sec. Users per second: 1624
8643.9s 1312 Unable to load Cython Compute_Similarity, reverting to Python
8653.8s 1313 Similarity column 6969 (100.0%), 693.35 column/sec. Elapsed time 10.05 sec
8654.0s 1314 EvaluatorHoldout: Ignoring 28 ( 0.1%) Users that have less than 1 test interactions
8670.7s 1315 EvaluatorHoldout: Processed 27067 (100.0%) in 16.76 sec. Users per second: 1615
8671.1s 1316 Unable to load Cython Compute_Similarity, reverting to Python
8680.8s 1317 Similarity column 6969 (100.0%), 700.15 column/sec. Elapsed time 9.95 sec
8681.0s 1318 EvaluatorHoldout: Ignoring 40 ( 0.1%) Users that have less than 1 test interactions
8697.6s 1319 EvaluatorHoldout: Processed 27055 (100.0%) in 16.72 sec. Users per second: 1618
8698.1s 1320 Unable to load Cython Compute_Similarity, reverting to Python
8708.0s 1321 Similarity column 6969 (100.0%), 692.83 column/sec. Elapsed time 10.06 sec
8708.2s 1322 EvaluatorHoldout: Ignoring 21 ( 0.1%) Users that have less than 1 test interactions
8724.8s 1323 EvaluatorHoldout: Processed 27074 (100.0%) in 16.74 sec. Users per second: 1618
8725.2s 1324 Unable to load Cython Compute_Similarity, reverting to Python
8735.5s 1325 Similarity column 6969 (100.0%), 668.68 column/sec. Elapsed time 10.42 sec
8735.7s 1326 EvaluatorHoldout: Ignoring 29 ( 0.1%) Users that have less than 1 test interactions
8752.3s 1327 EvaluatorHoldout: Processed 27066 (100.0%) in 16.68 sec. Users per second: 1622
8752.3s 1328 [I 2025-12-07 11:19:47,724] Trial 53 finished with value: 0.2173649755309079 and parameters: {'similarity': 'asymmetric', 'topK': 163, 'shrink': 481, 'asymmetric_alpha': 0.15053600419082383}. Best is trial 28 with value: 0.23872565913262506.
8752.3s 1329 
8752.3s 1330 [I 2025-12-07 11:19:47,724] Trial 53 finished with value: 0.2173649755309079 and parameters: {'similarity': 'asymmetric', 'topK': 163, 'shrink': 481, 'asymmetric_alpha': 0.15053600419082383}. Best is trial 28 with value: 0.23872565913262506.
8752.4s 1331 [0.217073195368852, 0.2173724972586538, 0.21742784730588477, 0.21711259599853291, 0.21783874172261602]
8752.7s 1332 Unable to load Cython Compute_Similarity, reverting to Python
8761.9s 1333 Similarity column 6969 (100.0%), 742.79 column/sec. Elapsed time 9.38 sec
8762.1s 1334 EvaluatorHoldout: Ignoring 33 ( 0.1%) Users that have less than 1 test interactions
8776.6s 1335 EvaluatorHoldout: Processed 27062 (100.0%) in 14.70 sec. Users per second: 1841
8777.1s 1336 Unable to load Cython Compute_Similarity, reverting to Python
8786.3s 1337 Similarity column 6969 (100.0%), 751.19 column/sec. Elapsed time 9.28 sec
8786.4s 1338 EvaluatorHoldout: Ignoring 28 ( 0.1%) Users that have less than 1 test interactions
8801.1s 1339 EvaluatorHoldout: Processed 27067 (100.0%) in 14.88 sec. Users per second: 1819
8801.6s 1340 Unable to load Cython Compute_Similarity, reverting to Python
8811.2s 1341 Similarity column 6969 (100.0%), 714.16 column/sec. Elapsed time 9.76 sec
8811.4s 1342 EvaluatorHoldout: Ignoring 40 ( 0.1%) Users that have less than 1 test interactions
8826.0s 1343 EvaluatorHoldout: Processed 27055 (100.0%) in 14.78 sec. Users per second: 1830
8826.5s 1344 Unable to load Cython Compute_Similarity, reverting to Python
8835.7s 1345 Similarity column 6969 (100.0%), 739.04 column/sec. Elapsed time 9.43 sec
8835.9s 1346 EvaluatorHoldout: Ignoring 21 ( 0.1%) Users that have less than 1 test interactions
8850.6s 1347 EvaluatorHoldout: Processed 27074 (100.0%) in 14.91 sec. Users per second: 1816
8851.1s 1348 Unable to load Cython Compute_Similarity, reverting to Python
8860.5s 1349 Similarity column 6969 (100.0%), 730.00 column/sec. Elapsed time 9.55 sec
8860.7s 1350 EvaluatorHoldout: Ignoring 29 ( 0.1%) Users that have less than 1 test interactions
8875.4s 1351 EvaluatorHoldout: Processed 27066 (100.0%) in 14.94 sec. Users per second: 1812
8875.5s 1352 [I 2025-12-07 11:21:50,969] Trial 54 finished with value: 0.23775050868545167 and parameters: {'similarity': 'tversky', 'topK': 28, 'shrink': 550, 'tversky_alpha': 0.03502197943883145, 'tversky_beta': 1.7916616574445885}. Best is trial 28 with value: 0.23872565913262506.
8875.5s 1353 
