10868.0s 1354 [I 2025-12-07 00:18:58,881] Trial 54 finished with value: 0.21706238132685302 and parameters: {'topK': 73, 'shrink': 1, 'feature_weighting': 'TF-IDF'}. Best is trial 54 with value: 0.21706238132685302.
10868.1s 1355 [0.2172821113337456, 0.21667529211284464, 0.2166249567028753, 0.21804643083431244, 0.21668311565048723]
10868.4s 1356 Unable to load Cython Compute_Similarity, reverting to Python
10880.4s 1357 Similarity column 6969 (100.0%), 574.96 column/sec. Elapsed time 12.12 sec
10880.6s 1358 EvaluatorHoldout: Ignoring 48 ( 0.2%) Users that have less than 1 test interactions
10901.1s 1359 EvaluatorHoldout: Processed 27047 (100.0%) in 20.66 sec. Users per second: 1309
10901.6s 1360 Unable to load Cython Compute_Similarity, reverting to Python
10913.7s 1361 Similarity column 6969 (100.0%), 566.99 column/sec. Elapsed time 12.29 sec
10913.9s 1362 EvaluatorHoldout: Ignoring 29 ( 0.1%) Users that have less than 1 test interactions
10934.7s 1363 EvaluatorHoldout: Processed 27066 (100.0%) in 20.82 sec. Users per second: 1300
10935.1s 1364 Unable to load Cython Compute_Similarity, reverting to Python
10946.9s 1365 Similarity column 6969 (100.0%), 582.96 column/sec. Elapsed time 11.95 sec
10947.1s 1366 EvaluatorHoldout: Ignoring 42 ( 0.2%) Users that have less than 1 test interactions
10967.7s 1367 EvaluatorHoldout: Processed 27053 (100.0%) in 20.74 sec. Users per second: 1304
10968.2s 1368 Unable to load Cython Compute_Similarity, reverting to Python
10980.5s 1369 Similarity column 6969 (100.0%), 559.72 column/sec. Elapsed time 12.45 sec
10980.7s 1370 EvaluatorHoldout: Ignoring 38 ( 0.1%) Users that have less than 1 test interactions
11001.8s 1371 EvaluatorHoldout: Processed 27057 (100.0%) in 21.15 sec. Users per second: 1279
11002.2s 1372 Unable to load Cython Compute_Similarity, reverting to Python
11014.5s 1373 Similarity column 6969 (100.0%), 556.61 column/sec. Elapsed time 12.52 sec
11014.7s 1374 EvaluatorHoldout: Ignoring 32 ( 0.1%) Users that have less than 1 test interactions
11035.5s 1375 EvaluatorHoldout: Processed 27063 (100.0%) in 20.82 sec. Users per second: 1300
11035.5s 1376 [I 2025-12-07 00:21:46,358] Trial 55 finished with value: 0.2170391575259638 and parameters: {'topK': 68, 'shrink': 2, 'feature_weighting': 'TF-IDF'}. Best is trial 54 with value: 0.21706238132685302.
11035.5s 1377 
11035.5s 1378 [I 2025-12-07 00:21:46,358] Trial 55 finished with value: 0.2170391575259638 and parameters: {'topK': 68, 'shrink': 2, 'feature_weighting': 'TF-IDF'}. Best is trial 54 with value: 0.21706238132685302.
11035.6s 1379 [0.21730804964059336, 0.21665849809994023, 0.2164055949873389, 0.21802287662230055, 0.216800768279646]
11035.9s 1380 Unable to load Cython Compute_Similarity, reverting to Python
11048.0s 1381 Similarity column 6969 (100.0%), 568.38 column/sec. Elapsed time 12.26 sec
11048.2s 1382 EvaluatorHoldout: Ignoring 48 ( 0.2%) Users that have less than 1 test interactions
11068.8s 1383 EvaluatorHoldout: Processed 27047 (100.0%) in 20.71 sec. Users per second: 1306
11069.3s 1384 Unable to load Cython Compute_Similarity, reverting to Python
11081.3s 1385 Similarity column 6969 (100.0%), 570.65 column/sec. Elapsed time 12.21 sec
11081.5s 1386 EvaluatorHoldout: Ignoring 29 ( 0.1%) Users that have less than 1 test interactions
11102.3s 1387 EvaluatorHoldout: Processed 27066 (100.0%) in 20.86 sec. Users per second: 1298
11102.8s 1388 Unable to load Cython Compute_Similarity, reverting to Python
11114.5s 1389 Similarity column 6969 (100.0%), 581.77 column/sec. Elapsed time 11.98 sec
11114.7s 1390 EvaluatorHoldout: Ignoring 42 ( 0.2%) Users that have less than 1 test interactions
11135.2s 1391 EvaluatorHoldout: Processed 27053 (100.0%) in 20.54 sec. Users per second: 1317
11135.7s 1392 Unable to load Cython Compute_Similarity, reverting to Python
11147.3s 1393 Similarity column 6969 (100.0%), 590.21 column/sec. Elapsed time 11.81 sec
11147.5s 1394 EvaluatorHoldout: Ignoring 38 ( 0.1%) Users that have less than 1 test interactions
11168.2s 1395 EvaluatorHoldout: Processed 27057 (100.0%) in 20.79 sec. Users per second: 1301
11168.7s 1396 Unable to load Cython Compute_Similarity, reverting to Python
11180.6s 1397 Similarity column 6969 (100.0%), 574.15 column/sec. Elapsed time 12.14 sec
11180.8s 1398 EvaluatorHoldout: Ignoring 32 ( 0.1%) Users that have less than 1 test interactions
11201.7s 1399 EvaluatorHoldout: Processed 27063 (100.0%) in 21.00 sec. Users per second: 1289
11201.7s 1400 [I 2025-12-07 00:24:32,608] Trial 56 finished with value: 0.2170011237690173 and parameters: {'topK': 66, 'shrink': 4, 'feature_weighting': 'TF-IDF'}. Best is trial 54 with value: 0.21706238132685302.
11201.7s 1401 
11201.7s 1402 [I 2025-12-07 00:24:32,608] Trial 56 finished with value: 0.2170011237690173 and parameters: {'topK': 66, 'shrink': 4, 'feature_weighting': 'TF-IDF'}. Best is trial 54 with value: 0.21706238132685302.
11201.8s 1403 [0.21787355492724864, 0.21666215502405684, 0.2162722794638748, 0.21753253118859794, 0.21666509824130828]
11202.2s 1404 Unable to load Cython Compute_Similarity, reverting to Python
11213.9s 1405 Similarity column 6969 (100.0%), 581.93 column/sec. Elapsed time 11.98 sec
11214.1s 1406 EvaluatorHoldout: Ignoring 48 ( 0.2%) Users that have less than 1 test interactions
11235.0s 1407 EvaluatorHoldout: Processed 27047 (100.0%) in 20.95 sec. Users per second: 1291
11235.5s 1408 Unable to load Cython Compute_Similarity, reverting to Python
11247.3s 1409 Similarity column 6969 (100.0%), 580.67 column/sec. Elapsed time 12.00 sec
11247.5s 1410 EvaluatorHoldout: Ignoring 29 ( 0.1%) Users that have less than 1 test interactions
11268.5s 1411 EvaluatorHoldout: Processed 27066 (100.0%) in 21.09 sec. Users per second: 1284
11269.0s 1412 Unable to load Cython Compute_Similarity, reverting to Python
11280.9s 1413 Similarity column 6969 (100.0%), 576.15 column/sec. Elapsed time 12.10 sec
11281.1s 1414 EvaluatorHoldout: Ignoring 42 ( 0.2%) Users that have less than 1 test interactions
11302.4s 1415 EvaluatorHoldout: Processed 27053 (100.0%) in 21.38 sec. Users per second: 1265
11302.8s 1416 Unable to load Cython Compute_Similarity, reverting to Python
11314.8s 1417 Similarity column 6969 (100.0%), 570.91 column/sec. Elapsed time 12.21 sec
11315.0s 1418 EvaluatorHoldout: Ignoring 38 ( 0.1%) Users that have less than 1 test interactions
11336.6s 1419 EvaluatorHoldout: Processed 27057 (100.0%) in 21.58 sec. Users per second: 1254
11337.0s 1420 Unable to load Cython Compute_Similarity, reverting to Python
11349.9s 1421 Similarity column 6969 (100.0%), 532.68 column/sec. Elapsed time 13.08 sec
11350.1s 1422 EvaluatorHoldout: Ignoring 32 ( 0.1%) Users that have less than 1 test interactions
11371.7s 1423 EvaluatorHoldout: Processed 27063 (100.0%) in 21.73 sec. Users per second: 1245
11371.7s 1424 [I 2025-12-07 00:27:22,639] Trial 57 finished with value: 0.21694344931815288 and parameters: {'topK': 72, 'shrink': 31, 'feature_weighting': 'TF-IDF'}. Best is trial 54 with value: 0.21706238132685302.
11371.7s 1425 
11371.7s 1426 [I 2025-12-07 00:27:22,639] Trial 57 finished with value: 0.21694344931815288 and parameters: {'topK': 72, 'shrink': 31, 'feature_weighting': 'TF-IDF'}. Best is trial 54 with value: 0.21706238132685302.
11371.9s 1427 [0.21716770445506134, 0.21661232879009973, 0.21640583655092754, 0.21779720902319297, 0.21673416777148277]
11372.2s 1428 Unable to load Cython Compute_Similarity, reverting to Python
11384.9s 1429 Similarity column 6969 (100.0%), 543.71 column/sec. Elapsed time 12.82 sec
11385.1s 1430 EvaluatorHoldout: Ignoring 48 ( 0.2%) Users that have less than 1 test interactions
11408.5s 1431 EvaluatorHoldout: Processed 27047 (100.0%) in 23.52 sec. Users per second: 1150
11409.0s 1432 Unable to load Cython Compute_Similarity, reverting to Python
11421.2s 1433 Similarity column 6969 (100.0%), 561.79 column/sec. Elapsed time 12.41 sec
11421.4s 1434 EvaluatorHoldout: Ignoring 29 ( 0.1%) Users that have less than 1 test interactions
11444.7s 1435 EvaluatorHoldout: Processed 27066 (100.0%) in 23.28 sec. Users per second: 1162
11445.1s 1436 Unable to load Cython Compute_Similarity, reverting to Python
11456.8s 1437 Similarity column 6969 (100.0%), 588.47 column/sec. Elapsed time 11.84 sec
11457.0s 1438 EvaluatorHoldout: Ignoring 42 ( 0.2%) Users that have less than 1 test interactions
11480.2s 1439 EvaluatorHoldout: Processed 27053 (100.0%) in 23.26 sec. Users per second: 1163
11480.7s 1440 Unable to load Cython Compute_Similarity, reverting to Python
11492.6s 1441 Similarity column 6969 (100.0%), 571.63 column/sec. Elapsed time 12.19 sec
11492.8s 1442 EvaluatorHoldout: Ignoring 38 ( 0.1%) Users that have less than 1 test interactions
11516.0s 1443 EvaluatorHoldout: Processed 27057 (100.0%) in 23.18 sec. Users per second: 1167
11516.4s 1444 Unable to load Cython Compute_Similarity, reverting to Python
11528.4s 1445 Similarity column 6969 (100.0%), 571.62 column/sec. Elapsed time 12.19 sec
11528.6s 1446 EvaluatorHoldout: Ignoring 32 ( 0.1%) Users that have less than 1 test interactions
11552.7s 1447 EvaluatorHoldout: Processed 27063 (100.0%) in 24.15 sec. Users per second: 1121
11552.7s 1448 [I 2025-12-07 00:30:23,604] Trial 58 finished with value: 0.20042263348418016 and parameters: {'topK': 128, 'shrink': 137, 'feature_weighting': 'BM25'}. Best is trial 54 with value: 0.21706238132685302.
11552.7s 1449 
11552.7s 1450 [I 2025-12-07 00:30:23,604] Trial 58 finished with value: 0.20042263348418016 and parameters: {'topK': 128, 'shrink': 137, 'feature_weighting': 'BM25'}. Best is trial 54 with value: 0.21706238132685302.
11552.8s 1451 [0.2005287121500608, 0.2015583546141331, 0.19927095427033306, 0.2001065226274101, 0.20064862375896358]
11552.8s 1452 Unable to load Cython Compute_Similarity, reverting to Python
11565.8s 1453 Similarity column 6969 (100.0%), 536.93 column/sec. Elapsed time 12.98 sec
11566.0s 1454 EvaluatorHoldout: Ignoring 48 ( 0.2%) Users that have less than 1 test interactions
11588.1s 1455 EvaluatorHoldout: Processed 27047 (100.0%) in 22.19 sec. Users per second: 1219
11588.2s 1456 Unable to load Cython Compute_Similarity, reverting to Python
11601.1s 1457 Similarity column 6969 (100.0%), 541.79 column/sec. Elapsed time 12.86 sec
11601.3s 1458 EvaluatorHoldout: Ignoring 29 ( 0.1%) Users that have less than 1 test interactions
11623.5s 1459 EvaluatorHoldout: Processed 27066 (100.0%) in 22.29 sec. Users per second: 1214
11623.6s 1460 Unable to load Cython Compute_Similarity, reverting to Python
11636.8s 1461 Similarity column 6969 (100.0%), 527.62 column/sec. Elapsed time 13.21 sec
11637.0s 1462 EvaluatorHoldout: Ignoring 42 ( 0.2%) Users that have less than 1 test interactions
11659.4s 1463 EvaluatorHoldout: Processed 27053 (100.0%) in 22.45 sec. Users per second: 1205
11659.5s 1464 Unable to load Cython Compute_Similarity, reverting to Python
11672.5s 1465 Similarity column 6969 (100.0%), 535.42 column/sec. Elapsed time 13.02 sec
11672.7s 1466 EvaluatorHoldout: Ignoring 38 ( 0.1%) Users that have less than 1 test interactions
11694.6s 1467 EvaluatorHoldout: Processed 27057 (100.0%) in 22.04 sec. Users per second: 1228
11694.8s 1468 Unable to load Cython Compute_Similarity, reverting to Python
11707.3s 1469 Similarity column 6969 (100.0%), 552.37 column/sec. Elapsed time 12.62 sec
11707.5s 1470 EvaluatorHoldout: Ignoring 32 ( 0.1%) Users that have less than 1 test interactions
11729.8s 1471 EvaluatorHoldout: Processed 27063 (100.0%) in 22.33 sec. Users per second: 1212
11729.8s 1472 [I 2025-12-07 00:33:20,709] Trial 59 finished with value: 0.2106446329219512 and parameters: {'topK': 105, 'shrink': 6, 'feature_weighting': 'none'}. Best is trial 54 with value: 0.21706238132685302.
11729.8s 1473 
11729.8s 1474 [I 2025-12-07 00:33:20,709] Trial 59 finished with value: 0.2106446329219512 and parameters: {'topK': 105, 'shrink': 6, 'feature_weighting': 'none'}. Best is trial 54 with value: 0.21706238132685302.
11729.9s 1475 [0.21088689874769256, 0.21107924168291856, 0.21019929682943503, 0.21098848346311638, 0.2100692438865936]
11730.3s 1476 Unable to load Cython Compute_Similarity, reverting to Python
11744.7s 1477 Similarity column 6969 (100.0%), 477.32 column/sec. Elapsed time 14.60 sec
11744.9s 1478 EvaluatorHoldout: Ignoring 48 ( 0.2%) Users that have less than 1 test interactions
11774.1s 1479 EvaluatorHoldout: Processed 27047 (100.0%) in 29.24 sec. Users per second: 925
11774.6s 1480 Unable to load Cython Compute_Similarity, reverting to Python
11788.5s 1481 Similarity column 6969 (100.0%), 494.03 column/sec. Elapsed time 14.11 sec
11788.7s 1482 EvaluatorHoldout: Ignoring 29 ( 0.1%) Users that have less than 1 test interactions
11818.2s 1483 EvaluatorHoldout: Processed 27066 (100.0%) in 29.47 sec. Users per second: 918
11818.6s 1484 Unable to load Cython Compute_Similarity, reverting to Python
11832.2s 1485 Similarity column 6969 (100.0%), 506.37 column/sec. Elapsed time 13.76 sec
11832.4s 1486 EvaluatorHoldout: Ignoring 42 ( 0.2%) Users that have less than 1 test interactions
11861.6s 1487 EvaluatorHoldout: Processed 27053 (100.0%) in 29.25 sec. Users per second: 925
11862.1s 1488 Unable to load Cython Compute_Similarity, reverting to Python
11876.1s 1489 Similarity column 6969 (100.0%), 488.41 column/sec. Elapsed time 14.27 sec
11876.3s 1490 EvaluatorHoldout: Ignoring 38 ( 0.1%) Users that have less than 1 test interactions
11905.6s 1491 EvaluatorHoldout: Processed 27057 (100.0%) in 29.31 sec. Users per second: 923
11906.1s 1492 Unable to load Cython Compute_Similarity, reverting to Python
11920.1s 1493 Similarity column 6969 (100.0%), 491.41 column/sec. Elapsed time 14.18 sec
11920.3s 1494 EvaluatorHoldout: Ignoring 32 ( 0.1%) Users that have less than 1 test interactions
11949.5s 1495 EvaluatorHoldout: Processed 27063 (100.0%) in 29.30 sec. Users per second: 924
11949.5s 1496 [I 2025-12-07 00:37:00,428] Trial 60 finished with value: 0.21208856690257463 and parameters: {'topK': 351, 'shrink': 64, 'feature_weighting': 'TF-IDF'}. Best is trial 54 with value: 0.21706238132685302.
11949.5s 1497 
11949.5s 1498 [I 2025-12-07 00:37:00,428] Trial 60 finished with value: 0.21208856690257463 and parameters: {'topK': 351, 'shrink': 64, 'feature_weighting': 'TF-IDF'}. Best is trial 54 with value: 0.21706238132685302.
11949.7s 1499 [0.21305045056807156, 0.21137837803347134, 0.21088321790687656, 0.21272303976498796, 0.21240774823946576]
11950.0s 1500 Unable to load Cython Compute_Similarity, reverting to Python
11961.4s 1501 Similarity column 6969 (100.0%), 601.58 column/sec. Elapsed time 11.58 sec
11961.6s 1502 EvaluatorHoldout: Ignoring 48 ( 0.2%) Users that have less than 1 test interactions
11981.1s 1503 EvaluatorHoldout: Processed 27047 (100.0%) in 19.60 sec. Users per second: 1380
11981.6s 1504 Unable to load Cython Compute_Similarity, reverting to Python
11993.0s 1505 Similarity column 6969 (100.0%), 601.49 column/sec. Elapsed time 11.59 sec
11993.2s 1506 EvaluatorHoldout: Ignoring 29 ( 0.1%) Users that have less than 1 test interactions
12012.9s 1507 EvaluatorHoldout: Processed 27066 (100.0%) in 19.82 sec. Users per second: 1366
12013.4s 1508 Unable to load Cython Compute_Similarity, reverting to Python
12024.9s 1509 Similarity column 6969 (100.0%), 595.32 column/sec. Elapsed time 11.71 sec
12025.1s 1510 EvaluatorHoldout: Ignoring 42 ( 0.2%) Users that have less than 1 test interactions
12044.8s 1511 EvaluatorHoldout: Processed 27053 (100.0%) in 19.75 sec. Users per second: 1370
12045.2s 1512 Unable to load Cython Compute_Similarity, reverting to Python
12056.4s 1513 Similarity column 6969 (100.0%), 610.54 column/sec. Elapsed time 11.41 sec
12056.6s 1514 EvaluatorHoldout: Ignoring 38 ( 0.1%) Users that have less than 1 test interactions
12076.5s 1515 EvaluatorHoldout: Processed 27057 (100.0%) in 19.91 sec. Users per second: 1359
12076.9s 1516 Unable to load Cython Compute_Similarity, reverting to Python
12089.2s 1517 Similarity column 6969 (100.0%), 557.79 column/sec. Elapsed time 12.49 sec
12089.4s 1518 EvaluatorHoldout: Ignoring 32 ( 0.1%) Users that have less than 1 test interactions
12109.5s 1519 EvaluatorHoldout: Processed 27063 (100.0%) in 20.17 sec. Users per second: 1341
12109.5s 1520 [I 2025-12-07 00:39:40,402] Trial 61 finished with value: 0.21677946878725157 and parameters: {'topK': 52, 'shrink': 0, 'feature_weighting': 'TF-IDF'}. Best is trial 54 with value: 0.21706238132685302.
12109.5s 1521 
12109.5s 1522 [I 2025-12-07 00:39:40,402] Trial 61 finished with value: 0.21677946878725157 and parameters: {'topK': 52, 'shrink': 0, 'feature_weighting': 'TF-IDF'}. Best is trial 54 with value: 0.21706238132685302.
12109.6s 1523 [0.2171582811968992, 0.21668052285280126, 0.21581270938604738, 0.21798601880310614, 0.21625981169740385]
12110.0s 1524 Unable to load Cython Compute_Similarity, reverting to Python
12121.0s 1525 Similarity column 6969 (100.0%), 618.81 column/sec. Elapsed time 11.26 sec
12121.2s 1526 EvaluatorHoldout: Ignoring 48 ( 0.2%) Users that have less than 1 test interactions
12142.0s 1527 EvaluatorHoldout: Processed 27047 (100.0%) in 20.82 sec. Users per second: 1299
12142.4s 1528 Unable to load Cython Compute_Similarity, reverting to Python
12153.6s 1529 Similarity column 6969 (100.0%), 615.69 column/sec. Elapsed time 11.32 sec
12153.8s 1530 EvaluatorHoldout: Ignoring 29 ( 0.1%) Users that have less than 1 test interactions
12174.7s 1531 EvaluatorHoldout: Processed 27066 (100.0%) in 21.03 sec. Users per second: 1287
12175.2s 1532 Unable to load Cython Compute_Similarity, reverting to Python
12186.6s 1533 Similarity column 6969 (100.0%), 599.43 column/sec. Elapsed time 11.63 sec
12186.8s 1534 EvaluatorHoldout: Ignoring 42 ( 0.2%) Users that have less than 1 test interactions
12207.5s 1535 EvaluatorHoldout: Processed 27053 (100.0%) in 20.82 sec. Users per second: 1300
12208.0s 1536 Unable to load Cython Compute_Similarity, reverting to Python
12219.3s 1537 Similarity column 6969 (100.0%), 605.06 column/sec. Elapsed time 11.52 sec
12219.5s 1538 EvaluatorHoldout: Ignoring 38 ( 0.1%) Users that have less than 1 test interactions
12240.2s 1539 EvaluatorHoldout: Processed 27057 (100.0%) in 20.74 sec. Users per second: 1305
12240.6s 1540 Unable to load Cython Compute_Similarity, reverting to Python
12252.1s 1541 Similarity column 6969 (100.0%), 599.78 column/sec. Elapsed time 11.62 sec
12252.3s 1542 EvaluatorHoldout: Ignoring 32 ( 0.1%) Users that have less than 1 test interactions
12273.3s 1543 EvaluatorHoldout: Processed 27063 (100.0%) in 21.08 sec. Users per second: 1284
12273.3s 1544 [I 2025-12-07 00:42:24,146] Trial 62 finished with value: 0.2169483964990823 and parameters: {'topK': 72, 'shrink': 52, 'feature_weighting': 'TF-IDF'}. Best is trial 54 with value: 0.21706238132685302.
12273.3s 1545 
12273.3s 1546 [I 2025-12-07 00:42:24,146] Trial 62 finished with value: 0.2169483964990823 and parameters: {'topK': 72, 'shrink': 52, 'feature_weighting': 'TF-IDF'}. Best is trial 54 with value: 0.21706238132685302.
12273.4s 1547 [0.21715581271036585, 0.21658884154877908, 0.21638958383872625, 0.2177931940359621, 0.2168145503615782]
12273.7s 1548 Unable to load Cython Compute_Similarity, reverting to Python
12285.5s 1549 Similarity column 6969 (100.0%), 580.05 column/sec. Elapsed time 12.01 sec
12285.7s 1550 EvaluatorHoldout: Ignoring 48 ( 0.2%) Users that have less than 1 test interactions
12307.3s 1551 EvaluatorHoldout: Processed 27047 (100.0%) in 21.59 sec. Users per second: 1253
12307.7s 1552 Unable to load Cython Compute_Similarity, reverting to Python
12319.3s 1553 Similarity column 6969 (100.0%), 590.42 column/sec. Elapsed time 11.80 sec
12319.5s 1554 EvaluatorHoldout: Ignoring 29 ( 0.1%) Users that have less than 1 test interactions
12341.6s 1555 EvaluatorHoldout: Processed 27066 (100.0%) in 22.17 sec. Users per second: 1221
12342.1s 1556 Unable to load Cython Compute_Similarity, reverting to Python
12354.0s 1557 Similarity column 6969 (100.0%), 572.38 column/sec. Elapsed time 12.18 sec
12354.2s 1558 EvaluatorHoldout: Ignoring 42 ( 0.2%) Users that have less than 1 test interactions
12376.1s 1559 EvaluatorHoldout: Processed 27053 (100.0%) in 21.88 sec. Users per second: 1237
12376.5s 1560 Unable to load Cython Compute_Similarity, reverting to Python
12388.5s 1561 Similarity column 6969 (100.0%), 574.97 column/sec. Elapsed time 12.12 sec
12388.7s 1562 EvaluatorHoldout: Ignoring 38 ( 0.1%) Users that have less than 1 test interactions
12410.4s 1563 EvaluatorHoldout: Processed 27057 (100.0%) in 21.77 sec. Users per second: 1243
12410.8s 1564 Unable to load Cython Compute_Similarity, reverting to Python
12422.2s 1565 Similarity column 6969 (100.0%), 603.56 column/sec. Elapsed time 11.55 sec
12422.4s 1566 EvaluatorHoldout: Ignoring 32 ( 0.1%) Users that have less than 1 test interactions
12444.7s 1567 EvaluatorHoldout: Processed 27063 (100.0%) in 22.43 sec. Users per second: 1206
12444.7s 1568 [I 2025-12-07 00:45:15,624] Trial 63 finished with value: 0.21699325919421303 and parameters: {'topK': 97, 'shrink': 42, 'feature_weighting': 'TF-IDF'}. Best is trial 54 with value: 0.21706238132685302.
12444.7s 1569 
